"text","handle","category","star_tweet"
"I googled CSD bec of #Elementary and saw this. SO RANDOM! 😃 @HereIsGina as Carmen Sandiego https://t.co/cqqFneXL52 via @variety @JoeOtterson","@lovechicph","cultural-icon",
"See, when I was a young child. I wasn't allowed to watch regular television because I was bad and failing in school. My parents made me watch PBS and I hated it at 1st but eventually my favorite tv shows became #WishBone and Where In The World Is Carmen Sandiego. I learned early.","@DMoNeYGoOnFaCe","cultural-icon",
"AHHHHHHHHHHHHSHDGGEHS CARMEN SANDIEGO WAS MY CHILDHOOD I LOVE GINA I LOVE THIS I FJFJFIJRNR YES https://t.co/9vhkH7yUrN","@likesforkathryn","cultural-icon","x"
"@Gota_de_L1uvia I'm slick Carmen sandiego honestly lol I live in Ga until tomorrow when I drive up north to relocate","@illbelate2that","travel",
"The boys wrap up #WonderCon after finding Carmen San Diego. We'll be back tomorrow with more photos #comics #cosplay https://t.co/01ERThokwd","@GrandMacGuffin","cultural-icon",
"Dafuq Heather cox doin with that Carmen san Diego hat?","@therealjayjones","fashion",
"Where in the world is Carmen Sandiego? All clues lead to Netflix (And Gina Rodriguez.) https://t.co/xHGCTH8Dp0 https://t.co/hFSATf4fWS","@enews","cultural-icon","x"
"Gina Rodriguez will be donning the red fedora and trench coat of Carmen Sandiego for… https://t.co/mN2KdQi3CO","@DHQLounge","cultural-icon",
"@DanielleMcVO Cosplay Carmen San Diego at every airport.","@TheSkittlesPink","travel",
"Where in the world is Carmen San Diego? 🎃 #Halloween https://t.co/k9IWAyACLp","@katika_0","fashion",
"Carmen Sandiego, who stole the Statue of Liberty's torch, slayed in a red fedora, and eluded hundreds of pint-sized gumshoes. https://t.co/C5iTBelJBc","@jaimewoo","fashion","x"
"@MS_LOYAL_ONE travel the world like Carmen Sandiego o yea I'm with it lmfaoooo!!!","@watsfamouswitu","travel",
"Khloe Kardashian is Giving Us Modern Day Carmen SanDiego at LAX @KhloeKardashian #Kardashian http://t.co/kBEWofZyAF #style #fashion","@StyleBySheena","fashion","x"
"Trench coats make me think of Carmen Sandiego lol ❤️🕵🏽‍♀️🌍","@a_karinna09","fashion",
"@Spacekatgal Did you ever play Carmen Sandiego (1996)? super fun and educational! https://t.co/gQlGMMAulH","@movieguyjon","edutainment",
"Really, really, really wanna cosplay Carmen Sandiego. It is my absolute dream! #carmensandiego #cosplay #whereintheworldiscarmensandiego","@JenE_Crock","fashion",
"Mine were Mr. Rogers, Carmen Sandiego, Legends of the Hidden Temple (it was educational, fight me)","@AltDptEducation","edutainment",
"1062770185705345025","my first crush was carmen sandiego, i played the computer game when i was little and i thought she was so beautiful and mysterious","cultural-icon",
"@ExalttheThrone [continued] Her role models include Sailor Moon, Nancy Drew, and Carmen SanDiego. She also adores kpop, especially Bigbang.","@ExalttheThrone","role-model",
"Unless they're very wide-brimmed hats, a la Carmen Sandiego https://t.co/QmMo2MybII","@Sharessan","fashion",
"@RobaatoX It's the sequel to Where in the World is Carmen Sandiego? Mainly cuz the hat.","@BlazeHenry1","fashion",
"TONIGHT'S WHISKEY-FUELED NOSTALGIC FEMINIST THOUGHTS: Carmen Sandiego is a bomb example of a character who is crazy empowered and super feminine without being sexualized/objectified","@down_w_lcc","cultural-icon",
"SO THIS IS HAPPENING AND ALL OF MY DREAMS ARE COMING TRUE. @HereIsGina WILL BE MY CHILDHOOD HERO, CARMEN SANDIEGO. CAPS WERE NEEDED. https://t.co/uiV1wWGdnE","@TorriCWMY","cultural-icon","x"
"@unitionotter I found Carmen Sandiego on my bus today. :P","@MilesTheMeerkat","fashion",
"Look who I found! #cosplay #animeexpo #whereswaldo #carmensandiego #hideandseek http://t.co/69TgAG648O","@coyoteblk","fashion",
"Thank you @splitlipthemag! And I loved playing the computer game version of Where in the World is Carmen Sandiego as a kid. Brings back memories! https://t.co/UDBlFuau9x","@rwillsit","cultural-icon",
"i just bought a ""where in space is carmen sandiego"" choose your own adventure book because, really, what could be more perfect","@auntiepixelante","cultural-icon","x"
". @Burberry, I'm looking into buying a trench coat. But here's the issue: how do I wear one without looking like I'm up to something? #colombo #carmensandiego #matrixmovies #allvampires #RickAstley #castiel @cw_spn (ok w/last one tbh)","@mahjabyn","fashion",
"exploring the Dorsoduro neighborhood in Venice, Carmen Sandiego style👣🇮🇹 #travelgram #eurotripping… https://t.co/oweHg4QRh6","@NYCtoEverywhere","travel","x"
"@TheSubtleDoctor @sniperking323 Carmen Sandiego cartoon taught geography, Bill Nye taught science, Wishbone taught literature,","@joyofthejoui","cultural-icon",
"These guys travel faster than Carmen San Diego and she had a geography game named after her","@haunshall","travel","w"
"I think I wanna be Carmen Sandiego for Halloween this year. Who wants to be Waldo? 🕵🏽","@SassyGemini528","fashion",
"5 airports in less than 24 hours, WOOF. Someone get me a cocktail and a Carmen San Diego outfit. ✈️","@emilystires","fashion","x"
"I used to want to be Carmen SanDiego. She was all over the damn globe","@vanitastrawberi","role-model","x"
"""Is Carmen Sandiego the new feminist hero?"" #xojanepitches","@nealcarter","role-model","w"
"yo if i were a girl i'd be carmen sandiego every damn year for halloween","@tim_fellin","fashion",
"I've been found! Foiled again. Good job, gumshoes! #HappyHalloween #CarmenSandiego http://t.co/aTIZGh9NdB","@DaniaMaduro","fashion",
"@MariaBardoColon quick trip to visit this winter's team...sorry, phone wasn't working!! #carmensandiego http://t.co/Sxq5ruhZc2","@CarolynSwords","travel",
"@lsh_7 Also since you're the real life Carmen Sandiego from all your extensive travels,I thought I'd share this too https://t.co/QJca0SHx11","@OrlandoNunez56","travel","w"
"Our fantastic @SummitArtsNow intern spent time exploring arts & culture in Summit Co. last week. Where should we send MK on her next Summit County Staycation? (She's like our own little Carmen Sandiego!) cc @mkpalazzo @MorganLasher @KatPestian https://t.co/4QeHkr9CJy https://t.co/d8cKSb59Ca","@Nicole_Mullet","travel",
"[INFO]Lady Gaga Swiped Her Hat And Trench From Carmen Sandiego’s Closet https://t.co/IPxN6nO8PP https://t.co/dLrRn86GJ9","@MailRPW","fashion",
"Where in the world is @DorzabY? (PS this is like where in the world is Carmen San Diego but w/o red trench coats)","@prelawswag","fashion",
"Hide as well as Carmen Sandiego with these travel security tips https://t.co/tmKcypyIrD #travelsecurity #cybersecurity https://t.co/eLHZ44qI1J","@rosedefremery","travel",
"""Me: Sha's going to Chicago @michael_filardo : WTF is your mom Carmen San Diego LIKE REALLY"" YES MICHAEL MY MOTHER IS A TRAVELING SPY","@emilyphonehome","cultural-icon",
"Gina Rodriguez will be donning the red fedora and trench coat of Carmen Sandiego for Netflix https://t.co/AJiN0r8vxw","@ANF0S","cultural-icon",
"@EIWBM_Cat Never played. I loaded adventure games into my computer with a cassette tape on my TI-99 4A back in the day. When Carmen Sandiego came out, I was too old for that.","@BadJohnBrown","cultural-icon",
"I was not expecting the Carmen Sandiego theme on my drive home. https://t.co/XjlsEVHt4Y","@itsjohnnydover","cultural-icon",
"@ohsosamm lmao I swear Im not mixxy no more, Im still single & exploring thee world like Carmen San Diego","@CoCoLosoSmooth","travel",
"The First Images of Netflix's Carmen Sandiego Are Here Carmen Sandiego has been found, and she's looking good on Netflix. Gina Rodriguez will make her debut as the new voice of the iconic globe-trotting thief in the new 20-episode... https://t.co/2PU2qfaLrZ","@Reynolds7Rodney","cultural-icon",
"Time to travel around the world this afternoon! All I am missing is Carmen SanDiego and of course Walt...","@tcam83","travel","w"
"Basically the kill screen for Carmen SanDiego. The 7yr old says thank you @textfiles https://t.co/rWgESHSebg","@spacerog","cultural-icon",
"Where at LCDC Have you heard of Carmen San Diego? It’s a game kids play while secretly learning geography. We’... http://t.co/qg6WgNqc0f","@thelivingcoast","edutainment",
"Why does no one talk about Carmen Sandiego as a feminist icon for young girls? She's a bad ass, self-sufficient woman who don't need no man.","@_Michaela","role-model","x"
"is Carmen Sandiego still relevant? because that was my childhood when it came to educational television","@ZyrotheGyro","cultural-icon","x"
"#AgentCarter is like a financially struggling Batman with the style of Carmen Sandiego~@HayleyAtwell is Excellent~@AgentCarterTV is a Hit!","@MiaSweetKisses","fashion",
"@ShannonIsBadAt I was Carmen San Diego for Halloween one year and I’ve never felt cooler. Highly suggest","@CalliFugate","fashion","x"
"The #CarmenSandiego mood continues. Think I'll wear today. https://t.co/z4FGOCqYCh","@LevelDownReview","fashion",
"Celebrated our first year of marriage with a surprise trip to Vegas to see the boys!!!! Parker wins at the husband game.😍👰🏻🤵🏻🥂♥️♣️#VivaLasVegas #wsmfp #CarmenSanDiego #WheresWaldo… https://t.co/NjSLlrv5h9","@nhpennington","travel",
"Where in the World is Carmen San Diego taught me everything I know about World Geography ✈️🚁🚤🚂","@Ms_BrittanyB","edutainment","x"
"@kathyreadsthis More than Carmen SanDiego we need schools to go back to teaching geography.","@CapizziMary","edutainment",
"@samuelnas You were in costume?? I do, however, recognize Carmen San Diego though 🤣","@JustinNBC4","fashion",
"@jmedriver you going to Belize? Maybe you'll find Carmen San Diego lol. Sounds like an interesting trip.","@lvilleshawn","cultural-icon",
"Drake's Dad Does His Best Carmen Sandiego Drake's dad must have a thing for adventure, mystery and inte... https://t.co/q3mzbxYaLE via @TMZ https://t.co/w9ghpZ5uLW","@The_News_DIVA","travel",
"How Carmen Sandiego accidentally became an educational game icon - %https://t.co/WPzYxNDV8C%","@MarioManiac6","edutainment",
"@kchironis 1) YES Purple Moon, preach it from the rooftops & don't forget their site! 2) Support others' suggestions: Clueless, Catz, Zoombinis, WitW is Carmen Sandiego 3) Juliard's Music Adventure 4) Point & click adventures like The Pink Panther Passport to Peril, Monkey Island, Laura Bow","@kimeekat","cultural-icon",
"@auroritas those are Carmen Sandiego hats.","@stoppodcasting","fashion",
"#MyFavoriteThingAboutThe90s So.Many.Things: Disney 1 Saturday morning, TGIF, Carmen Sandiego, Wishbone, delia catalogs, YM, Lifesaver holes, pudding pops, school pizza, & of course, all the music, and the sweet fashion. Also - for me - marching band, DCI, & Centrifuge. #goodtimes","@jennabarnky","cultural-icon",
"2017 Whitney Cosplay Sketch #16: Carmen Sandiego! Like/Retweet to cast your vote for this piece! https://t.co/H6a4vecQt8","@JonPonikvar","fashion",
"@_IcyTea We'll start figuring that out after we learn where in the world is Carmen Sandiego.","@JadeFlames","cultural-icon",
"#EMPIRE COOKIE THREW THAT HAT 👒 ON LIKE CARMEN SANDIEGO http://t.co/5pahhFubK9","@DJLOUDPACKLOS","fashion",
"@kalehummus I don't even know the context, but remind me to tell you my Carmen San Diego Halloween story at some point.","@kaitlen","fashion",
"Things I ponder when I can't sleep....if Waldo and Carmen Sandiego got married, would it be a non stop adventure, or a constant game of peek a boo, with no winner? #SleeplessInCalifornia","@RockinMissMolly","cultural-icon",
"@KaleKatsura Hey, RPGs=story,decisionmaking consequences (FFIV,FFVI)Where in the world is carmen sandiego-who says education can't be fun?","@rkmodena","edutainment",
"@tristawinnie @Leonard_Su k I just have to say that CARMEN SANDIEGO WOULD BE AN AMAZING COSTUME (I may have loved Ms. Sandiego as a kid)","@THEDeeJenks","fashion",
"@CrashGameReview @Kitsuagi I also found a small cache of edutainment games from The Learning Company, including some Carmen Sandiego games.","@DrGameAndSci","edutainment",
"Carmen Sandiego? No. But we both have an affinity for fabulous hats. Thanks @camhats_blake for this… http://t.co/HbJpauVhvy","@MEGaber","fashion",
"Just so you know, if you wear a red wide-brimmed hat in front of me, I can't promise I won't take a sneaky pic of you and send it to my friend with the caption ""hehe found her!"" #CarmenSandiego #90sKidsRemember","@Kay_Mix_127","fashion",
"@RoxyfromGotham Any chance of a Carmen Sandiego cosplay? https://t.co/PmQ5PEpfHC","@JasonRempala","fashion",
"vesperia gave me my murderboy, berseria gave me six lawless heathens, carmen sandiego was my childhood hero, etc etc","@starsinmist","cultural-icon",
"Lady Gaga Swiped Her Hat And Trench From Carmen Sandiego's Closet - https://t.co/3iMQGqptA7 https://t.co/6shjEIc4yi #LittleMonster","@GalaxySkin","fashion",
"@MsLedvinka I learned it from a 90s video game, Where in the Universe is Carmen Sandiego! (I was over 30 when I learned it.)","@mistersato411","edutainment","w"
"where in the world is Carmen Sandiego? halloween 2013 https://t.co/Zpe5mGg6P6","@Aye_Nikk","fashion",
"@GAYBIRDSQUAD @Riveriie Just walk in and say Quasar. Say it invokes a cosmic beauty while staying mysterious and inviting curiosity. Then walk out in the Carmen San Diego costume you either own or most certainly want","@TaquitoBrown","cultural-icon",
"Someone sponsor my travel time in Carmen sandiego","@ShawdieRED","travel",
"#lovely #minimal #learning #kidsshows #pbs #tvshows #smartkids #whereintheworld #teachers #carmensandiego #backintheday","@RebeccaEverlene","edutainment",
"If Soojin visits San Diego what if I blasted Where's Carmen San Diego in the car","@TheGayAgenda69","cultural-icon",
"1072909265868865536","Carmen Sandiego is a one-woman British Museum.","cultural-icon",
"If the Carmen Sandiego Theme Song was Metal…: Never before has geography been so brutal. The post If the Car... https://t.co/AjK4FsI0bp","@samulitmakela","cultural-icon",
"I need to be Carmen sandiego for Halloween. Idc","@BrianniT","fashion",
"#InstaMagAndroid where in the world is Carmen SanDiego lol! #bluesign #worldtravelers #jetsetter… https://t.co/HhduBi8W7i","@maddvocals","travel",
"camila should dress as carmen sandiego for halloween","@lexasmiIa","fashion",
"@KnockOutBreaks A where is Carmen Sandiego hat let's go","@GoldenEyeO07","fashion",
"Everyone has that one adventurous friend. The one that will pick dare in a game of truth or dare. Where is this Carmen San Diego vacationing while you're chillin' in a French cafe? Find out. https://t.co/hlXTvllIYz","@AllianzTravelUS","travel",
"@whittynovels Well.... my first woman crush was fergie and then Carmen Sandiego","@theinfamouswig","cultural-icon",
"The hat of life! Where in the world is Carmen San Diego flow...#whatiworetoday #rockmom #fauxfur… https://t.co/EpGEwXCsOn","@3thechicway","fashion",
"Hey.... I think ""WALDO and ""CARMEN SAN DIEGO"", May be in that Caravan ! Lets send ""DORA THE EXPLORER"" and DIEGO to go check it out !","@lorac328","cultural-icon",
"😱🤩🤓 ‘Carmen Sandiego’ Gets January Premiere Date On Netflix #Go #Celebs #Fashion #Beauty #Entertainment #Music #Film #Tv #Gossip #Celebrities https://t.co/t6gPCY87Rl","@birbaksende","cultural-icon",
"@mikeaustinwest came up and helped us beat Carmen SanDiego while learning more about ancient Egypt!!! #wendellhowlout #kidslovedit https://t.co/niPRmg7hBS","@Msmootoo","edutainment",
"I think Carmen Sandiego dressed up as Waldo might be easier to find than any consistency from the Cubs rotation at the moment. #Cubs #MLB","@jwswim1","cultural-icon",
"@DJSharpeCheddar @KeitaKuhn @OsitaNwanevu Carmen Sandiego doing a new take on the Phantom Thief is not the writers having ""no idea,"" it is the writers doing what basically every writer does. Most of the iconic characters of fiction are based in some way on some preexisting form.","@Jaehaerys48","cultural-icon",
"I can't name a Latino private eye in the last 20 yrs - @thechicoleo Carmen Sandiego - @TyTheRobot #FanBrosShow https://t.co/ILKMieeEuj","@TatianaKing","role-model",
"So...anyone else have a huge crush on Carmen Sandiego, or was that just me? https://t.co/kxngY69igK","@auma582","cultural-icon","x"
"@MajokkoGigi @alkrea @SailorMoonLife lol, I'll dress up all Carmen Sandiego and spy on that poopy ヽ( ･∀･)ﾉ #TotallyIncognito","@ChannelSquare","fashion",
"Now discussing #LHHATL fashion with @thewayoftheid. She seems upset I've cited Carmen Sandiego, Kingpin & Where's Waldo. But...","@Karnythia","fashion",
"Pretty sure I just learned more from watching 30 minutes of Where on Earth is Carmen Sandiego than anything I've read all break....... Ugh.","@hoyaskeetle","edutainment","x"
"This is random, but I really miss Carmen Sandiego. I loved that 80s/90s edutainment stuff.","@collar6","edutainment","x"
"Traveling more than my girl Carmen SanDiego #foreal #jetset #suitelife","@shay_bron","travel",
"So happy people actually knew who I was for #Halloween last night! Where in the world 🌎 is Carmen Sandiego? https://t.co/B1RcBXX8ms","@natalieast","fashion",
"I followed #CarmenSanDiego then @TripStyler. Both are why I ❤️ to #travel http://t.co/QT3tV2coox @expedia","@Magabout","travel","x"
"@claireseldon_ed @amuseED I learnt more about geography playing Carmen Sandiego than I have since!! #aussieED","@robmctaggart","edutainment","w"
"#NotGreatJeopardyCategories Clothing styles for Carmen Sandiego","@saizowleon","fashion","x"
"@CyberShambles @_sarahyo or if you're unaware of ""where in the world is carmen sandiego"".. it's a thing about a well traveled master criminal. ;)","@CyberShambles","travel",
"I was gonna be Carmen SanDiego for Halloween but judging by how this weather has been, that coat will be too hot to wear 😢","@ak1386","fashion",
"It woulda been awesome to see the Carmen Sandiego hat in person tho","@HarlemRican25_8","fashion",
"My mom had the original Carmen SanDiego board game that we would play and I also played the old school computer game version 😭","@chrome_wings","cultural-icon",
"Interesting infographic on gamifying the classroom. Pretty nostalgic! Carmen Sandiego anyone? http://t.co/6SGzTpRpEd #edtech","@TFAEdTech","cultural-icon",
"VIDEO: 10 Reasons Where in the World Is Carmen Sandiego? Was the Best Educational TV Show Ever: The PBS game s... https://t.co/DphDckdiyL","@asb72","edutainment",
"Tonight it's Digitalistic: A Daft Punk Inspired Dance Party 🚀🚀 @SunshineSucks + Phil David play all your fave electronic music tracks from the monumental 00s! Will you wear a Carmen Sandiego coat like they do in this pic? ⚡️guestlist@foxcabaret.com for free cover spots⚡️ https://t.co/Oz75Y34cnX","@FoxCabaret","cultural-icon",
"@Keshj__ Where in Carmen San Diego can I find such beautiful women","@RICHARD2K19","cultural-icon",
"A1: I learned so much about geography from Carmen Sandiego - sounds cheesy but it made me a lifelong learner #edtechchat","@stephenoonoo","edutainment","w"
"Why is ""Agent Carter"" wearing a Carmen San Diego hat?","@JugglerOfGeese","fashion",
"In an uber car in London going to the airport to get to Paris. It's 3am here. #carmensandiego","@jolinda22","travel","w"
"Spending non-beach parts of vacation watching Carmen Sandiego on YouTube. Recommended for amazing pun names of henchmen, if nothing else","@NSHBIZKennedy","travel",
"What in the Carmen Sandiego will I wear for moms weekend tomorrow night?!","@sarrahnae","cultural-icon",
"Sometimes I wonder if Where In The World Is Carmen Sandiego inspired all my travel adventures #solofemaletravel #solotravel #travel","@TheSoloStories","travel","x"
"@TheQuietPsycho Carmen Sandiego would be soooo jealous of that hat.","@rpglvr","fashion",
"On the road all day..looking forward 2 seeing new cities! I'm going 2 make like #CarmenSandiego #roadtrip #Adventure http://t.co/aTaTeaKad5","@NineMusesProd","travel","x"
"@icedus 2. Everyone ages 23 - 32 travels enough to moonlight as Carmen Sandiego","@harrisw","travel","x"
"@Daviziu Carmen Sandiego is an example of how anything can become a huge successful franchise, if you told the people making the 1985 computer game that there would be several follow up games, three television series, and a live-action two-part edutainment planetarium film, they’d laugh","@_AquaBat","edutainment",
"Gina Rodriguez donning red fedora and trench coat of Carmen Sandiego https://t.co/5Z9oxBhIAc #entertainment","@ca_90210","cultural-icon",
"@katiefehlinger @CBS3Mornings Thank you, Katie! I love Carmen Sandiego!","@JanCarabeoCBS3","cultural-icon",
"@MrHailZeon glad you are safe also , this looks totaly fine, im ok with this, just like the reboot of carmen sandiego im willing to give this a shot, at least she-ra has style unlike roar","@SuperFanComShow","cultural-icon",
"@kay_olive yeah for real. i was carmen sandiego once and i still wear the red trench all the time","@icecrmsocialist","fashion",
"i want to be Carmen Sandiego for halloween this year","@bettalicious","fashion","x"
"Agent Carter’s red hat in all these previews is very Carmen Sandiego.","@hvbeg","fashion",
"568633621168455680","Can someone bring back #CarmenSandiego so I can school my kids in random factoid knowledge? #throwbackthursday","cultural-icon","edutainment"
"Ladies, when you wear a bright red coat you improve my day considerably. I enjoy finding Carmen San DIego. I'm like, ""Yeah. Found her.""","@FictiveCameron","fashion",
"@pippinbarr will play it later! i JUST did a carmen sandiego let's play where i riffed on high concepts/feat. airport noise so it resonated","@leighalexander","cultural-icon",
"@pattonoswalt With that red hat, who knew Carmen Sandiego ran Pizza Hut?","@BohemianJenn","fashion",
"Gosh I wish all my old pc games were compatible with my OS.. Test Drive, BYS, ODS games, Carmen San Diego, that weird game on the old Mac...","@hallie_yeah","cultural-icon",
"I was thinking penguin ""@Charlieriley: Looks like Twittererverse has opinions of Erin Andrews outfit. Love the Carmen Sandiego references""","@joeolenick","fashion",
"Where in the world is Carmen Sandiego? Catch me if you can ACME agents, you’ll never find me! 🌎💃🏼 #carmensandiego #Halloween #halloweencostume #whereintheworldiscarmensandiego #90skid… https://t.co/LPVjBMWvYv","@7isagoodnumber","fashion",
"@JeannetteChips @HoarseWisperer It'd be a great learning experience for youth around the world. We could track his gps locations on his crazed tweets while on the lam to teach culture, geography and why civic duties like voting is important. It'd be like where in the world is Carmen San Diego","@LacesOut_Ace","edutainment",
"#celebs Drake's Dad Does His Best Carmen Sandiego - Drake's dad must have a thing for adventure, mystery and in... https://t.co/Sp7bQeCk7o","@shoescopeheels","travel",
"Netflix is betting on ‘90s kids nostalgia for learning with upcoming lineup https://t.co/Svx4JfQdj5 https://t.co/gxwx2HnwuP","@geektitude","cultural-icon",
"#fashion #pfashionstore Lady Gaga Is Really Into Dressing Like Carmen SanDiego Lately https://t.co/P8AhQmdOb8","@pfashionstore","fashion",
"Life goal #64: Dress up like Carmen Sandiego.","@Sphinxoid","fashion","x"
"@eyelish_ she made that happen. She said you were Carmen San Diego if you only had a yellow coat. She wears red.","@jfmonahan","fashion",
"Seeing a lot of ladies being #CarmenSanDiego for Halloween. Was there a memo?","@SaintBrendan","fashion",
"@Errorfied Carmen Sandiego... Just lots of travel and a fabulous trench/fedora combo","@MikesAndRobots","fashion",
"@cbgobeli One time, when I was cosplaying as the Fifth Doctor, a Carmen Sandiego cosplayer came up to me and hugged me and it was the best ever. It was all hats and coats and fanning over each other.","@DoctorOffDuty","fashion",
"@ProjectAria Haha, I used to love playing all those edutainment games like the trails games, carmen sandiego and super solvers","@EriChannelTV","edutainment",
"Where in the world is Carmen Sandiego? One to add to my hat collection. #cappelleriabertacchi… https://t.co/nfKzd3xgYw","@YumiMizuno","fashion",
"Already have my next Halloween costume planned out. Carmen Sandiego. My date&39;ll go as Where&39;s Wally. Always wanted to do that","@adriennebnke","cultural-icon",
"@DeceptionABC lol, watching tonight's ep, I realized something: the Mystery Woman reminds me of Carmen Sandiego xD :) #Deception","@keandric","cultural-icon",
"@TinyTiniTine Lmao 🤣 I did a skit in Spanish class. I was Carmen San Diego!","@Dany_Jonae","cultural-icon",
"We don't know where in the world Carmen #SanDiego is, but we know where YOU should be! #Travel to ""America's Finest City"" and be welcomed #California style by the amazing and hospitable staff of @hotel_republic! #Discover more and book your stay NOW! https://t.co/OivdHvdmHe https://t.co/ukSHebi4la","@GayTravel","travel",
"@warrenksmith @ECDaSilveyra I had to look it up - it was introduced in 1986. I remember playing Memory Castle and Where in the World is Carmen Sandiego? on the IIe's in elementary! Ah, good times.","@RW_Crank","cultural-icon",
"Yo tameka with that Carmen sandiego hat on #AtlantaExes","@jazzi_babi927","fashion",
"What You Learn Hunting Carmen Sandiego Without Google's Help: By Jason Iannone Published: December 05th, ... https://t.co/59p9Rzlp54","@CrackMeNaught","edutainment",
"Have decided SSH and I need to go for Halloween as Waldo and Carmen Sandiego. FIND THEM BOTH TOGETHER!","@justanna","fashion",
"What is this Carmen SanDiego dress/jacket she is wearing?!","@jasmineleann","fashion",
"I wanted to have a metal band, travel the world, get to make video games and play them all the time, and go on these Carmen Sandiego style long voyages. Basically be an international woman of mystery. ...did I make it happen? #TweetYourNonPrincessyLittleGirlDreams","@nyhcmaven84","travel",
"VIDEO: 10 Reasons Where in the World Is Carmen Sandiego? Was the Best Educational TV Show … … https://t.co/xWgoVchPcK","@ritanewman14","edutainment",
