"text","handle","category","star_tweet"
"Heyyyyy! I'm in Luxembourg!!! Feeling like Carmen San Diego in my white hat and wooden jewelry made by… http://t.co/E4Jat8P4XU","@KoyaWebb","travel",
"all i wanna do is play ""Where In Time Is Carmen Sandiego?""","@just_bittenn","cultural-icon","x"
"@tylerc Half of your wish is true. Netflix is doing a new Carmen Sandiego with Gina Rodriguez as Carmen. I haven't heard who will be the Chief.","@crisclc","cultural-icon",
"Netflix to Reboot 'Carmen Sandiego' https://t.co/VkNGxlDfTe https://t.co/qqtAq3Dt34","@dopehorse","cultural-icon",
"Carmen San Diego helped me learn names of exotic lands and outsmarted us young sleuths and the lieutenant","@ruega_por_ella","edutainment",
"My Family Died of Dysentery in the Palm of My Hands—and I Loved Every Minute of It https://t.co/tdJaa11MgI ༄ Before kids hunted for Carmen Sandiego, in a time when computers could barely muster a few on-screen colors, a game called The Oregon Trail taught students about the h… https://t.co/2aFwVBfXe0","@KotakuBot","cultural-icon",
"@DeyBeOnANigga_ i learned more from Carmen San Diego than school at that time lol","@iNLuvWitMaryJ","edutainment",
"@chicazul kinda reminds me of a Carmen Sandiego after a long trip and some booze","@lukec","travel",
"Scandal Season 4 Teaser: Where... Is... Olivia?!?: Sorry, Carmen Sandiego. We don't car... http://t.co/tAHmMjTfEg Press retweet 2share","@Simon55512372","cultural-icon",
"Netflix orders animated Carmen Sandiego series https://t.co/T68t4k5yyE https://t.co/UA9lYmymTg","@freak_ios","cultural-icon",
"Rockapella teaching people about John Cage's 4'33"" is a great example of why Carmen Sandiego is a great show","@WarpWhistles","cultural-icon",
"Kourtney Kardashian Takes Younes Bendjima on a Surprise Birthday Trip Oh, the places they'll go! Kourtney Kardashian channeled her inner Carmen San Diego for Younes Bendjima's birthday--and no, we're not talking about a role-playing fantasy.... https://t.co/P5hiYSiljO","@RayCraig80620","travel",
"It's been like 6 years and I'm still pissed that my cousin had lost my ""Where in the world is Carmen Sandiego?"" game -__-","@daytripper98","cultural-icon",
"Carmen San Diego, I don’t know how you did it...I am one tired traveler","@swest1991","travel","x"
"When people ask who my first queer icon was I always say ""Carmen San Diego.""","@saracentury","inspiration",
"Wait!✋is Netflix seriously making ""where in the world is Carmen Sandiego?"" Into a series???... I think I'm gonna cry","@nanziridawn","cultural-icon","x"
"""@ladyroyalkawaii: @paridisedeliah DO YOU HAVE A PHONE YET WTF HI HELLO"" I'm the modern day Carmen Sandiego","@paridisedeliah","cultural-icon",
"Color of the year inspiration: http://t.co/xuKpPbAvBl Marsala meets Carmen Sandiego, super for fall.","@BumbershootSupp","cultural-icon",
"Got told today that I needed a yellow hat and then I could be Carmen Sandiego. She actually wears a red hat, https://t.co/XG8dFi4Tjp","@Rachel_B_Davis","fashion",
"@levarburton Ask Leo DiCaprio he's got the rights. Honestly reboot the series on Netflix that's your best bet. Look at Magic School bus & Carmen Sandiego","@JDas2k","cultural-icon",
"@ZacharyLevi Sang to the Carmen Sandiego theme... LOL","@NikiNavarro87","cultural-icon",
"@JacobAWohl Maybe you can dress up in your Carmen Sandiego outfit and “investigate”......","@AmadeusHack","fashion",
"WHEN DO I GET JAN IN HER CARMEN SANDIEGO OUTFIT","@hackedmotionart","fashion",
"SnapWidget | Where in the world is Carmen Sandiego? 💃🌎 #xoxo #fashion http://t.co/ElZR5d3Oa4","@JoannyIzadora1","cultural-icon",
"@mikemann02 where in the world is Carmen sandiego? #irrelevant #irrelevancy⬅️#bridgeyearprobs","@BeccaKahn31","cultural-icon",
"Where in TF is Carmen Sandiego","@katieoneillx3","cultural-icon",
"the only game you could play on the one computer in the classroom was Carmen sandiego #growingupkiwi","@courtevans_","cultural-icon",
"@jessibstar Carmen SanDiego helped me pass geography in middle school! I'd watch NOVA and cooking shows like crazy.","@JillEatsFood","edutainment",
"@Johnnys_House yes! I won with this Carmen Sandiego costume at Howl at the Moon Orlando. https://t.co/Cz9XzZgQON","@AlyssaKaye89","fashion",
"I actually knew this because of Where in the Universe is Carmen Sandiego? Who said video games can't be educational? https://t.co/GwmILPxmYG","@mistersato411","edutainment",
"Netflix's 'Carmen Sandiego' debuts on January 19th, 2019 https://t.co/7Pm6mn26PJ ⁦@animag⁩ ⁦@SpiderVerse⁩ ⁦@NetflixFilm⁩ ⁦@netflix⁩","@GirlsOnFilm4","cultural-icon",
"@DrLupo @FortniteGame Where in the world is Benjamin Dr Lupo? (In my best Carmen Sandiego impression)","@figjam300","cultural-icon",
"""You didn't catch me, player."" [Where in the world is Carmen Sandiego?] Carmen Sandiego: Shiroki Cosplay... http://t.co/OgqcvOwx4u","@_Shiroki","fashion",
"Netflix planning live-action Carmen Sandiego movie https://t.co/Nlj7n4ztrU","@larrymlease","cultural-icon",
"I won't lie to you, I don't know much about #Argentina except what I learned from Carmen San Diego and Starship Troopers. #WorldCupFinal","@RossRead","edutainment",
"I LOVE Gina Rodriguez and Carmen Sandiego. Please please PLEASE find a way to introduce a new school Rockapella through this show.","@micQuestion","cultural-icon",
"Congratulations @HereIsGina!! You’ll be an amazing #CarmenSandiego! You’ve got me doing a “Memory Lane Monday”- when I dressed up as Carmen for Halloween! I called myself “Carmen Mandy-ego” ☺️ #Netflix #Latina 👏🏽 https://t.co/lXl1W5Cx9Q","@AmandaSalas","latina",
"I learned the word dossier from playing ""Where in the World is Carmen Sandiego"" on my childhood Mac Classic.","@miriamgottfried","edutainment",
"@Miami_shawtyy girl she's fine AF. I'm just over the Carmen Sandiego hats every episode lol","@AutumntimeFine_","fashion",
"Thinking of traveling in my Carmen Sandiego costume all the time just for kicks. https://t.co/xNCbs6dxHL","@kimikimkim","fashion",
"New: Netflix’s Carmen Sandiego Gets First Image Plus New Cast https://t.co/vINXlbOOXr","@Lila34079795","cultural-icon",
"@WEEI He’s with Carmen San Diego","@taychavy127","cultural-icon",
"Children of the '90s Rejoice, For Carmen Sandiego Is Getting Her Own Animated Netflix Series https://t.co/M84bEARTdG https://t.co/FiPmx5FGZ0","@Instagram_Prom","cultural-icon",
"""Netflix is Bringing Back Carmen Sandiego - With Gina Rodriguez! (Repor"" : https://t.co/VMVH6s7Y6C via @YouTube","@JSM07517820","cultural-icon",
"ah, that's a cool one. i think i'd prefer carmen sandiego generation since i really, really sucked at oregon trail. https://t.co/GvApxMnU6q","@rachelmetz","cultural-icon",
"My Denver women's fashion trend observations My little pony colored hair: vats happening Carmen San Diego hats: ish don't think so #NYFW","@TheRealPeteMcG","fashion",
"Where in the world is Carmen Sandiego...... #travel #wanderlust #world #carmensandiego #where… https://t.co/kMu8JOEBrI","@arlyzmarie","travel",
"@pham1717 one city closer, is he traveling with Carmen Sandiego? Good luck to Neuvirth tonight. Going to need it.","@albinomagnifico","travel",
"Deadpool, Umbridge, and Carmen Sandiego are breaking it down at the Heroes and Villains' Ball! #DragonCon2014","@sharon_therese","cultural-icon",
"Only on Halloween can I watch Spider-Man swingdance with Carmen San Diego. Best time of the year.","@chololoep","fashion","x"
"Carmen Sandiego Returns in a New Educational App https://t.co/OwfcvDHgC0 https://t.co/Cg3foA8obi","@pamelawwinfield","edutainment",
"☎️ me Vinny. on Instagram: “Carmen Sandiego visits the Spring Preserve | Tap photo for outfit... https://t.co/veLS3uCWj8","@BernieDexter","fashion",
"""Gina Rodriguez will voice the woman underneath the hat for 20 episodes (each 22 minutes long), before also starring in a live-action Carmen Sandiego movie for the streaming service."" per @EW. Netflix sure went all in on that one","@GWOtaku","cultural-icon",
"Netflix's CARMEN SANDIEGO Animated Series Gets a Poster, Seven New Images, and a Premiere Date https://t.co/OvFFCgQNTL https://t.co/qXEpDHQ94H","@punga127","cultural-icon",
"I liked Where in the USA and Where in the World! Catching baddies and learning geography was kinda cool! #gamedev #CarmenSandiego #retrogaming https://t.co/mOebd4luvg","@sjfostersound","cultural-icon",
"#HowInTheWorldCan Carmen San Diego ever settle down after a life of world travel and hijinx? https://t.co/10h2rPZXr9","@Rachetgrrl","travel",
"Good piece->Not Your Shero: Carmen Sandiego and the importance of feminism in edutainment https://t.co/tRWV5uurYV","@TonyaWithAPen","edutainment",
"VIDEO: 10 Reasons Where in the World Is Carmen Sandiego? Was the Best Educational TV Show … https://t.co/nTPaU22hje https://t.co/GkQpCULQDY","@justopray","edutainment",
"The Brazilian girl in me is so happy that @HereIsGina will play Carmen Sandiego #carmensandiego #Netflix","@carolmaleixo","latina","w"
"@Troy75801 @SonofLiberty357 He’s dressed up like Carmen San Diego","@B30wu1f2","fashion",
"A dude tried to buy my flannel off my back. He then pointed to a girl who looked like Carmen Sandiego and said ""she needs it to make a hat""","@rissuhhhhhh","fashion",
"Netflix Bringing Back Carmen Sandiego - https://t.co/BSJYbm0HP6 https://t.co/LnHPn4rG29","@GeekNerdery","cultural-icon",
"⚡ Gina Rodriguez is bringing a Carmen Sandiego film to Netflix https://t.co/EeADpZ3wyO","@CoryAustinColl1","cultural-icon",
"Wishbone Activity Zone Mavis Beacon Teaches Typing Rugrats the Movie Activity Challenge Where in the World is Carmen Sandiego? https://t.co/1oQTzehI9p","@jewmanjii","cultural-icon",
"For reasons I can't explain, I REALLY wanna go on a Carmen San Diego spelunking adventure right now. Anybody? https://t.co/KAA5nW3b3S","@turihaim","travel",
"Carmen Sandiego Hits Netflix January 18th... #Animation #CarmenSandiego #GinaRodriguez #Netflix https://t.co/rsvhDS80IE https://t.co/s0uEznbJRU","@IEarths","cultural-icon",
"It's 7 am and I'm flipping out because they're bringing back my childhood on Netflix. Where in the world is Carmen Sandiego ❤❤❤","@Sargam27","cultural-icon",
"We found each other #carmensandiego #whereswaldo #foundlove #love #halloween #loveison @revlon @mrmecc https://t.co/bU3TNH4n3v","@Parnia","cultural-icon",
"Netflix is making a live-action Carmen Sandiego movie. https://t.co/G0uChCD94w https://t.co/TsJ0942BEt","@Kotaku","cultural-icon",
"@JamesKosur I have to admit I was a bit skeptical about Carmen San Diego and Dora the Explorer being listed as character witnesses.","@umussbekidding","cultural-icon",
"@tvoti my world feels strangely complete today age reading a Carmen Sandiego post that wasn't my own. Thank you.","@ElleLewis6","cultural-icon",
"@gersandelf I wanted to be carmen sandiego!","@JamminGames","inspiration",
"Mkay im gonna cosplay as Carmen Sandiego. Who wants to be my Waldo? :3","@MyriamG999","cultural-icon",
"@WiseWyzard @paradoxofedu @Nicole_Cliffe Not until 2019! It'll be on Netflix. https://t.co/NGpL6RwQHS","@amandawtwong","cultural-icon",
"Where in the world is Carmen San Diego? Have you been there? Why not? #Travel #RefinedRelaxation #Vacation #GirlsTrip #GuysTrip #GradTrip","@RefinedNRelaxed","travel",
"90s PC gaming geeks will be delighted by Netflix’s new Carmen Sandiego show https://t.co/vamv7mZbwy OH yeah perhaps best intro song of the 90s","@battleground_k","cultural-icon",
"Carmen Sandiego' Reboot Headed to Netflix - Rolling Stone https://t.co/cwfW6VNu8J","@ap236","cultural-icon",
"I found where in the world Carmen Sandiego is! Takapuna! Auckland! Aotearoa! https://t.co/58DmPJwlzk","@HORansome","cultural-icon",
"""It's like taking airplane bottles into a football game"" ""Or an airplane"" -my family on ""Carmen San Diego Drinking""","@mwalkero","cultural-icon",
"“Where in the universe is Car-men San-di-e-go?” “Carmen Sandiego is on Rigel VII.”","@mattsta","travel",
"One 3rd party character I would have liked to see in the Smash Bros is Carmen Sandiego","@QBynoeOgle","cultural-icon",
"@eastsincerity I LOVE EDUCATIONAL GAMES OKAY dont make me start linking carmen sandiego ones","@FluffSik","edutainment",
"@JustinKutcher Carmen Sandiego? Tell me you the jacket and/or the globe? #90skid","@weaksauceradio","cultural-icon",
"I got 29 out of 35. Which is slightly disappointing - couple stupid mistakes. Let me know how you do!! Geography is awesome. I always wanted to be on ""Where in the World is Carmen Sandiego"" when I was a kid. https://t.co/fmIjaX8vTP","@SmoHawk","cultural-icon",
"Top favorite women: Carmen Sandiego, Olivia Pope, & most importantly, @DanyGarciaCo 🙌 😜 #mysterious #serious and #Focused","@CallMeSwann","feminism",
"@BigBird I'll bet Carmen Sandiego might change the history of @sesamestreet if you & your friends help me. We'll stop her, won't we?","@JeremiahLiles1","cultural-icon",
"@aalastairr I am aware thanks. Think more like Carmen Sandiego hat... https://t.co/3IRMQuMUlw","@flakmagnet","fashion",
"@lamboftrain @K1ngEljay just mentally photoshopped him in Carmen Sandiego's hat. Needed that chuckle.","@AnAmazingFeat","fashion",
"Bedelia going for Carmen SanDiego-chic, there #HannibalPremiere","@StillDefending","fashion",
"Where In The World Is Carmen San Diego???? My Lil' Explorer #AmaniViana #MyBooger #Westminster https://t.co/7s883ibOro","@AGonzalez47","travel",
"@MessyMC U should be called Carmen San Diego or Dora cos u travel that much","@cammy_camilla","travel","w"
"See an exclusive first look at @Netflix's 'Carmen Sandiego' animated series starring @HereIsGina https://t.co/cJcoAoQCqA","@EW","cultural-icon",
"Carmen Sandiego was going around the world stealing and scamming in a fabulous trench coat and a hat. What's not to love? I bet her shoe game was flawless","@VicTORIousGable","inspiration","x"
"‘Carmen Sandiego’ revamp coming to Netflix, Gina Rodriguez to voice https://t.co/dLVgin0oJg","@Legends971","cultural-icon",
"Kate out here looking like Carmen San Diego with that hat on. #WaywardPines #PFWaywardPines","@LookListenPod","fashion",
"@JoannaStern You didn't dress up as Carmen Sandiego... WHY????","@jrsydevyl","fashion",
"“Gina Rodriguez to Star in Netflix’s Live-Action ‘Carmen Sandiego’ Film” by @kmoorejohnson https://t.co/yNTsW6oBbD","@darlennegirard","cultural-icon",
"@JasonKrech ""More Than A Game: What 'Where in the World is Carmen Sandiego?' Taught Us About International Asylum & The Edward Snowden Case""","@ScooterMcGooch","edutainment",
"So like... Where is Carmen San Diego? #Halloween #IPutASpellOnYou2015 #DeadMansToes #90s https://t.co/Kuzp5NNuNd","@ChristinaJOchoa","cultural-icon",
"Boooy having this new number def enhances the cut off game.. I feel like Carmen San Diego biihh","@TheeUCFtailDAWG","cultural-icon",
"My fashion icons are Morticia Addams, Carmen Sandiego, and Lily Collins when she's being extra vampy","@kasey_beth","fashion",
"GINA RODRIGUEZ IS VOICING CARMEN SANDIEGO IN A NETFLIX SERIES IM SO??????","@LansdaleForever","cultural-icon",
"‘Carmen Sandiego’ Toon Series Starring Gina Rodriguez Bound For Netflix https://t.co/QQfvLp1Sgi","@attiliopalmieri","cultural-icon",
"@CapeCodClass I made a rockapella station (the originals: Where in the world is Carmen San Diego?)","@CorpSratHippie","cultural-icon",
"Rasheeda is giving me some ""Carmen Sandiego"" teas with that outfit, and I LOVE IT! #LHHATL","@SimplyPaigeB","fashion","x"
"So I got on this hat like Carmen Sandiego 😩😂😂😂😂😂😂","@_JasLashea","fashion",
"I can't wait when i'm able to travel the world. I'm gonna be like Carmen SanDiego lmao","@_Jazzy26","travel","x"
"Where in the World is ~Carmen San Diego~ Alan García?","@vicosaenz","cultural-icon",
"Lady Gaga Swiped Her Hat And Trench From Carmen Sandiego’s Closet https://t.co/ziXfZf4sG7 https://t.co/QxXtC7Xt6j","@CucusMusic","fashion",
"When I was growing up, there was a popular educational computer game called Carmen Sandiego. Is it still around?","@HRDipendra","edutainment",
"Dammit Ray Lewis with your Carmen Sandiego hats!","@djharveydent","fashion",
"Halloween photo on @Snowden's girlfriend's Instagram. She's Carmen Sandiego, he's Waldo https://t.co/hCc0xqDtFW https://t.co/qxpN8Yn1tK","@fryan","fashion",
"@MrRoughton Kevin, you never cease to amaze! I'm doing World Geography by remixing Carmen San Diego and Pokemon Go. #Craziness LOL","@mrwilliamsworld","cultural-icon",
"@the_simster Every time I see the promo for Agent Carter, that red hat makes me think of Carmen Sandiego. :)","@DoodleBaker","fashion",
"@viiicky_j I say we live the Carmen SanDiego life and just globetrot and steal landmarks to fund further globetrotting","@Drunk_Sup3rman","cultural-icon",
"""Carmen Sandiego? Who's that? What did she teach?"" Obviously not anything to you #beerlinewoes","@debbie25lw","edutainment",
"Gina Rodriguez to Voice Carmen Sandiego in New Netflix Series https://t.co/susKJqpHtp","@jessicagferrer","cultural-icon",
"Maybe I can #FINDJARULE in the same place as Carmen SanDiego.","@mebelexi","cultural-icon",
"#BretsLog Still looking but has anyone found Carmen Sandiego? I want my hat back.","@bretrreimers","cultural-icon",
"Here. Is a thought can we get a #WhereIsMikeAresco poster pic for gameday maybe him dressed up a Waldo or Carmen San Diego maybe a milk carton? 😀 #WhereinTheWorldisMikeAresco #ChargeOn","@UCFKnight_122","cultural-icon",
"#AgentCarter wearing the red hat reminds me of #carmensandiego. http://t.co/JM9F3Pj6TG","@NerdReactor","fashion",
"Gina Rodriquez To Play Carmen Sandiego In Live-Action Netflix Film https://t.co/MPrlEgV7wa https://t.co/SQ3stKjL3l","@2LoveNotH8","cultural-icon",
"@scattermoon *giggle* we tweeted about Carmen Sandiego last night- not knowing your cosplay choice- weird synchronicity ^_^","@Orphemeriel","fashion",
"I was right... but where is my pizza? I don't think anyone knows at this point...I hope Carmen Sandiego and Waldo are enjoying their NY style pizza feast.","@LilMarauder","cultural-icon",
"Gina Rodriguez Voicing Carmen Sandiego in Netflix Show https://t.co/48ryq9LBO6 https://t.co/L5N2JYkZJD","@GaTrailer","cultural-icon",
"@CauseWereGuys real 90s kids remember the original ninja turtles,the first power rangers,Carmen San Diego, Captain Planet,magic school bus","@ThaGez","cultural-icon",
"Do it, Rockapella: Netflix is Making a New ‘Carmen Sandiego' Show https://t.co/FGQBr4KWwf","@RHAF_HQ","cultural-icon",
"Carmen San Diego is getting too old for these weekend adventures. So much fun w/my friends this weekend. Back to reality 👎 #WhereInTheWorld","@npappy2","travel","x"
"Live-action de Carmen Sandiego na Netflix https://t.co/PH6CFMzRjM https://t.co/65KjGnvKOk","@postogeek","cultural-icon",
"The ladies can get away with the future hats because he stole his swag from Carmen San Diego","@Tha_Kota","fashion",
"Netflix orders animated Carmen Sandiego series: Netflix has ordered an animated Carmen Sandiego series, io9… https://t.co/ZzKvVn0GCQ https://t.co/6ExXCprfyJ","@banihafidz34","cultural-icon",
"I might be excited for this, more than is reasonably acceptable. - @netflix orders animated Carmen Sandiego series https://t.co/NXrIWeycbK https://t.co/DpFUFxwjPs","@DeltaSpark","cultural-icon",
"@FxyMxy I miss your face, Rach. Like Where In The World Is Carmen Sandiego, miss.","@MrPart2","cultural-icon",
"I feel like a French Carmen San Diego in this outfit. Still haven't found her yet though. P.S. Mirror elevators FTW. #ootd #whereintheworldiscarmensandiego https://t.co/SbU3BKqsp6 https://t.co/TqmoGpU1qa","@olivialaclaire_","fashion",
"Do you think instead of going to my geography class I could just play Where in the World is Carmen Sandiego?","@jennastinson","edutainment",
"https://t.co/qdNNCzHmuW Gina Rodriguez, ‘Stranger Things’ actor, to lend voice to Netflix’s ‘Carmen Sandiego’: Jane… https://t.co/IfTIcGZNYs https://t.co/lBisFOK5He","@Vipleyo","cultural-icon",
"Gina Rodriguez To Star As Carmen Sandiego In Netflix Live-Action Feature https://t.co/FGSSV5fqhx via @deadline","@thearrendojam","cultural-icon",
"Halloween fun at the office today #CarmenSandiego #WorkFamily @ Rowland Publishing, Inc. https://t.co/94FsfUdrir","@KenzieBurleigh","fashion",
"Shared universe with Dora the Explorer, Go Diego Go, Carmen Sandiego, and Where’s Waldo.","@theotherlaser","cultural-icon",
"@__Misssmarie You travel more than Carmen San Diego","@DontKryWolfHoe","travel",
"Hey guys, I found her. Right here. At the airport. Carmen San Diego! https://t.co/krmy1jEgpX","@LandoKardashian","travel",
"If Erin Andrews wore a red hat, we'd know Carmen Sandiego was in Seattle.","@doozerblake","fashion",
"@AshleyElizabeth please tell me you're Carmen Sandiego? If not, forgive my lack of cosplay characters.","@morgs1223","fashion",
"The boys wrap up #WonderCon after finding Carmen San Diego. We'll be back tomorrow with more photos #comics #cosplay https://t.co/01ERThokwd","@GrandMacGuffin","cultural-icon",
"@agoodstrongwife *shakes fist at the heavens* Carmen San Diego!!!!","@OozyPuddles","cultural-icon",
"VIDEO: 10 Reasons Where in the World Is Carmen Sandiego? Was the Best Educational TV Show Ever https://t.co/pDkPaOXbw7","@AriwaAmi","edutainment",
"One of my closest friends that I had in college is a writer for the CARMEN SANDIEGO Netflix series and I couldn't be more excited to see it !!","@daniel_fidler","cultural-icon",
"Drake's Dad Does His Best Carmen Sandiego https://t.co/PFMsXdmHVF Drake's dad must have a thing for adventure, mystery and international i…","@TanMader","travel",
"@MissterRay @missterray I miss you Carmen Sandiego lol You travel just as much as I do so I don't wanna hear ""Im never in town""","@MissterRay","travel","w"
"Jane the Virgin” star Gina Rodriguez In Netflix Remake Of Where in the World Is Carmen Sandiego https://t.co/GzSzdNPxgU","@Ye_moko","cultural-icon",
"@headdeskben YEEES! I had Math and Word Carmen Sandiego ones too, with like a science base or something that was sinking? OMG I know right every year I go and look to see if anyone has found a way to play them!","@PrinceBubblegum","cultural-icon",
"#CarmenSandiego Reboot Finds New Home With @Netflix! https://t.co/Py08TZUX7c","@AMP1037DFW","cultural-icon",
"Carmen Sandiego's Think Quick Challenge (PC, 1999) The Learning Company http://t.co/MPEuCna6BN http://t.co/qIn2EUXATs","@HotVideoGames2","edutainment",
"Carmen Sandiego is coming to Netflix and the actress voicing her is perfection https://t.co/vEuGutI8UN","@mashable","cultural-icon",
"@EsPyramid Luckily, Carmen Sandiego style heists - where the loot is chosen for cultural/historical significance - fall under the Concert Ticket Problem even in an otherwise post scarcity society","@number_one_twit","cultural-icon",
"@JayBilas traveled the world and found carmen sandiego","@ranchaus18","travel",
"Gina Rodriguez Voicing Carmen Sandiego in Netflix Show https://t.co/RPaDmbSwha https://t.co/GQV7ISPTNG","@CormacGamesNZ","cultural-icon",
"Netflix orders 'Carmen Sandiego' with Gina Rodriguez - https://t.co/K3SgeYAxEU https://t.co/ELdRhx9RWA","@twosheeep1","cultural-icon",
"@netflix Can we get a Where in the World is Carmen Sandiego reboot? Thanks.","@sammytmills","cultural-icon",
"[Photographer]Waldo and Carmen Sandiego This post was automatically fetched from Redditt via /r/co https://t.co/yDXf8Oqgg3 #cosplay #anime","@SuperCosplayBot","fashion",
"Gina Rodriguez to Voice Carmen Sandiego in Netflix Animated Reboot https://t.co/4uJUi7XF5K https://t.co/XU2NFZzEz6","@maruja_sotillo","cultural-icon",
"If I put on a fedora now I’d probably summon a doowop band to sing WHERE IN THE WORLD IS CARMEN SANDIEGO","@mirell","fashion",
"@chelliet22 Just wear a Carmen Sandiego type disguise","@Manetheren_hero","fashion",
"Theress a little girl dressed up as Carmen San Diego &she was holding the hand of (i presume) her little bro who was dressed up as Waldo T^T","@katsnapped","fashion",
"Gina Rodriguez Is Netflix's New 'Carmen Sandiego' https://t.co/WgRxYBqLir","@latinorebels","cultural-icon",
"@AltDptEducation Bill Nye the Science Guy and Where in the World is Carmen Sandiego. PBS all the way.","@mouse_clicker","cultural-icon",
"This Pup Has Traveled The World, And Has Drool-Worthy Pics To Prove It: Move over, Carmen Sandiego, this adven... http://t.co/Xe8b2gXUeD","@carbonmotion","travel",
"👻🎃A Halloween Story 🎃👻 #KellyAnna #CarmenSanDiego #KenMasters #PRChula #Ryu #Halloween #NYC… http://t.co/Ic0zujZktR","@ChrisMCosenza","fashion",
"Everyone’s out here downloading Tinder and I’m here like, “but did you know Carmen Sandiego has an app!” #AgentGumshoe","@FarehBella","cultural-icon",
"They gotta recreate “Where on earth is Carmen Sandiego?” but this time call it “Who on earth is Rita Ora?”","@DGSeason","cultural-icon",
"Now I'm wondering if there's an edutainment erotica series out there. I don't mean Rule 34 on Carmen SanDiego. #Mathfap #PlatonicLovemaking","@Antoneh","edutainment",
"I don't really understand the fashion trend of girls dressing like Carmen Sandiego from, 'Where in the World is Carmen Sandiego'.","@mashburger","fashion",
"Oh snap...I often try to live that Carmen Sandiego travel life https://t.co/OhDzWFeAxe","@Hipployta","travel",
"I'm in Spain. #CarmenSandiego https://t.co/lSa8MVLCBk","@The_Jessicak","travel",
"@CakesDt I am THE Carmen Sandiego","@Feliperesponda","cultural-icon",
"KarloMdz: CBSNews: “Carmen Sandiego” reboot voiced by Gina Rodriguez coming to Netflix https://t.co/KZkB4IS52N … … https://t.co/5YOPUO2QH6","@KarloMdz1","cultural-icon",
"@cjhitchcock -Honorable Mentions- Phantom 2040 Gravity Falls Avengers: Earth's Mightiest Heroes Johnny Bravo Where on Earth is Carmen SanDiego? Aeon Flux","@cjhitchcock","cultural-icon",
"Not sure typical airport employee clothing inspiration seems to be ""Carmen Sandiego.""","@BentonSartore","fashion",
"Netflix is releasing a Carmen Sandiego series next year and I am All About It™️","@OliverMark93","cultural-icon",
