"text","handle","category","star_tweet"
"I've got my whole world in my hands 💃🏽🌍 Happy Halloween, With Love #CarmenSandiego 📍🔍📞🌎 #DIY #MaternityCostume #28w… https://t.co/C3sys00a5f","@misscharmsie","fashion",
"In this reality, Carmen Sandiego and Rum Tum Tugger drive around in a van solving mysteries ...","@Cr0ss0verB0t","travel",
"The cosplay line up for this weekend: Carmen Sandiego and Punk Psylocke (with a whole crew of… https://t.co/Da6x91iiZH","@TheAutumnRogue","fashion",
"Carmen Sandiego had timeless style - wide brim hat and a mean trench coat in the perfect hue of red. She was before her informative children’s television show time... Truly. https://t.co/4D5b2sLpM5","@ShopUnitedFront","fashion","x"
"""Carmen Sandiego"" was one of my nicknames when I was a little girl (I used to always wear red coats + hats)","@Hudikki","fashion","x"
"@andylassner From Dora the Explorer to Carmen San Diego in one trip. Is this her idea of Hispanic outreach?","@Kingwoman","travel",
"@Ager_Bomb I like costumes that kinda sorta work as a normal outfit too for stuff like that (ie: carmen sandiego). but I'm not brave, so.","@merryfaith","fashion",
"I've gotten word Selina intends to dress up as Carmen Sandiego. That'll be a treat.","@Enygmatic_","fashion",
"How Carmen Sandiego accidentally became an educational game icon https://t.co/eQwVkDizOA","@GameArtWales","role-model",
"Rewarding some students with some old, yet fun computer games that will help learning about History, Math and Science more appealing. Where is Carmen Sandiego and JumpStart adventures have a staple of my childhood... https://t.co/Gml52IDBu6","@alextable","edutainment",
"The educational programs growing up were mad dope. Carmen San Diego, Zoobalee Zoo, puzzle place","@BederomO","cultural-icon","w"
"Gina Rodriguez donning red fedora and trench coat of Carmen Sandiego https://t.co/IS1KN02ndF https://t.co/PfSHzVLCVS","@guchiscarllete1","cultural-icon",
"This Pup Has Traveled The World, And Has Drool-Worthy Pics To Prove It: Move over, Carmen Sandiego, this adven... http://t.co/dLHyArrr0i","@Milvec22","travel",
"@Taeler_Hendrix That hat!, maybe a brown trench and you could come in mysteriously like Carmen Sandiego","@kalimytona","fashion",
"Lots of travel in the next few weeks! #SanFrancisco, #Philly, #NYC then #Miami. Just trying to keep up with #CarmenSandiego... #travel","@AlexisAnth","travel","x"
"@young_c5 day by day they are, about to be a busybee traveling my life away starting next month, back to my Carmen SanDiego life....","@PoiZendIynk","travel","w"
"Changed my mind: 2014 I'm tryna be Carmen San Diego chic","@surrealsermons","fashion",
"All I want in life is someone who will couples costume as Waldo and Carmen San Diego with me","@TiatheTiger","cultural-icon","x"
"Carmen San Diego helped me learn names of exotic lands and outsmarted us young sleuths and the lieutenant","@ruega_por_ella","edutainment","w"
"Blake Lively Pulls a Carmen Sandiego in Michael Kors’s Front Row #fashion #mediatrend24 https://t.co/Lvc5bDDsUw","@MEDIAtrend24","fashion","x"
"I've decided that I am going as Carmen Sandiego for halloween!!!!!!!!!!!!!!!!! https://t.co/i2jjXJaA9p","@praizsephone","fashion",
"@lizardbill Carmen San Diego’s got a sweet disguise. Would never have recognized her without the hat","@tvanfosson","fashion",
"@chrisrushing Let us not forget the true pioneers of the red hat like Papa Smurf and Carmen Sandiego","@derekdeal","fashion",
"Poison Ivy was a cartoon villain Harley Quinn Shit, wasn't Carmen Sandiego technically the bad guy? Stylish bitches https://t.co/JrcaPeYoNP","@BabyGrotesque","fashion",
"Where's Waldo? Apparently impersonating LeBron while driving a Kia. Now, back to searching for Carmen San Diego. https://t.co/ZJepVjfJ1j","@mgbode_WFNY","travel",
"Someone give me a tan raincoat and a hat bc we’re finding Carmen San Diego","@MiliKoncelik","fashion","x"
"@LadyOnTheMuna I love takin pics when I'm bored lol & I found my Future/Carmen Sandiego hat, so I just had to 😂💅🏾 https://t.co/bT7mECFWbF","@LadyOnTheMuna","fashion",
"@angelcwrites @Nicole_Cliffe Also I learn to speak like 10 languages while on tour and find/befriend Carmen Sandiego.","@angelcwrites","edutainment",
"Without Carmen Sandiego, I never would have learned what spelunking is.","@alexanderbasek","edutainment","w"
"@Kyotsu_Kurayami N-no more travel. Two cons in 4 months. I'm not Carmen Sandiego ;3;","@ChimpyEvans","travel",
"If I ever do a couple's Halloween costume, I definitely want to go as Carmen Sandiego and Where's Waldo. #relationshipgoals","@moses_says","fashion",
"So much Carmen Sandiego happening right now #shopping #hat #friday #aldo @ Aldo https://t.co/d0RTqUHiZU","@GhiaSaysHi","fashion",
"978706744128946176","can you believe my adulthood queen gina rodriguez is voicing my childhood queen carmen san diego in the new netflix reboot wow maybe god does exist","cultural-icon",
"Ready for #planetcomicon day 3! #pcckc #planetcomicon #day3 #whereswaldo #carmensandiego #cosplay https://t.co/beX9AeRgTm","@AmberCapp","fashion",
"I might make a #CarmenSandiego homage in #Contestant25 after hearing that iconic song by @RockapellaMusic. #JustSaying #writerslife","@PlayerWM86","cultural-icon",
"@MisterCoat Hey, Mr. Coat. Besides Carmen Sandiego, what would you consider the greatest Edutainment series of all time?","@TimothyWhitfie4","edutainment",
"It's cool that Erin Andrews decided to dress up like Carmen Sandiego","@krr5045","fashion",
"Mama Pope lookin like Carmen Sandiego in the red dress all she was missing was the hat #scandal","@ATLREPPA","fashion",
"Bill Nye, Carmen Sandiego, and Magic School Bus were the reasons I was so intelligent as a child","@StevieKnicks21","edutainment",
"I want to see @KeroKeroppi64 stream some old school educational pc games. Time to build up that vocabulary and general world knowledge. I'm thinking some magic school bus games and some Carmen San Diego games","@ThatsADarkHorse","cultural-icon",
"Yall see @khloekardashian in her where in the world is carmen San Diego hat #nbafinals","@thatown2","fashion","x"
"@jumpedforjoi Mimi got a Carmen Sandiego hat on, tryna get the scoop #LHHATL","@jumpedforjoi","fashion",
"I think I just found Carmen Sandiego, what an immaculate outfit. Hot damn.","@DearFreddy","fashion",
"Gina Rodriguez will be donning the red fedora and trench coat of Carmen Sandiego for Netflix https://t.co/8tyuAAhIQ5","@jburnsconsult","cultural-icon",
"😍 The First Images of Netflix's Carmen Sandiego Are Here #Celebs #Celebrity #MakeUp #Today #Fashion #Gossip https://t.co/uNTLdi6WaM","@celebritykimdot","cultural-icon",
"@CjMcWillams It's either that or stealing the entire restaurant, Carmen Sandiego style.","@Sushi575Jones","cultural-icon",
"@aramjabbari My first PC we didn't even have a hard drive. Then we bought Carmen Sandiego and it required a HDD. We had no idea what it was.","@Jeremy_LaMont","cultural-icon",
"Highlight of my day, I found #Waldo and #CarmenSandiego !!!! #IMDb #Halloween https://t.co/luUXEpqG99","@Erika_IMDb","cultural-icon","x"
"I didn't know Carmen Sandiego and Where's Waldo were friends? #whoknew #itsmonday #travel #chatacters http://t.co/9jt6wszcpj","@JessyRenshaw","cultural-icon",
"We love this new chef/mom-designed video game for kids that's like Carmen SanDiego meets Cooking Mama. It's fun -- and it's really educational! https://t.co/EsCYsci2e6","@coolmompicks","edutainment",
"@froppishpet Carmen Sandiego! :D (keeping on the kids shows from the 90's theme, and also b/c I think you'd be amaze in that outfit)","@regonym","fashion",
"Booking my own travel for work is way more fun than booking my boss' travel. 😎 #CarmenSanDiego","@shaybuttuh15","travel","x"
"@ElizabethWatts5 you look like a modern day Carmen San Diego with your outfit tonight!! I'm a fan!!","@jrolgin","fashion",
"Whoever the graphic designer is who got away with this… eye solute you #sweetcreambutter #ValuTime #CarmenSanDiego https://t.co/QxfCxSHZmz","@SEIZMICdesign","fashion",
"CARMEN SANDIEGO'S COAT IS SO CONPLEX https://t.co/l2Gb8QzuI5","@ZyrotheGyro","fashion",
"@kevinrichardson I love that you're wearing the exact outfit as last Monday with the exception of that Carmen San Diego hat lol","@nickytoronto","fashion",
"Where in the World is Carmen Sandiego but every ""Carmen Sandiego"" is replaced with Ray Shero","@nhllauren","cultural-icon",
"""Today's caper is bankrolled by the Corporation for Public Broadcasting and Viewers Like You."" #carmensandiego #80sborn90sraised #PBS #historynerd All I Needed to Know About Life, I Learned From...Carmen Sandiego https://t.co/9oBnzQdG1d via @wordpressdotcom","@RVickieD","edutainment",
"""@waitwait: The game would be a lot easier if it were called, “Where in the World is Carmen? San Diego.”"" wrong, Granada (Spain)","@BrokenSmile_CNJ","cultural-icon",
"Dora the Explorer doesn't have shit on Carmen Sandiego. #realshit #realtalk #truth #mid30sdude","@AaronOfOhio","cultural-icon",
"I'm wearing my big hat with a red coat and a little girl on the train just asked me if I'm Carmen SanDiego. I don't hate it!","@thebostonista","fashion","x"
"Where in the World is Carmen San Diego is a fun and educational game! Brings me back. #eng177","@EmilyThomack","edutainment","w"
"@remove32 @Beanster_97 I mean she probably only learnt about it while watching Carmen Sandiego","@Gordini616","edutainment",
"i mentioned that carmen sandiego was my bi awakening today and subsequently learned all of my coworkers are also bi","@happyurepii","edutainment",
"@ClintSmithIII @lpolgreen @nhannahjones @alexismadrigal I think you should do it with a time travel theme, maybe a bit Carmen Sandiego","@LogicalDash","travel",
"Carmen Sandiego #zakattack #Athens #Greece #family #travel https://t.co/dl1iCR9Wn4","@ArdaZakCP24","travel",
"Suitcase? Check. Sunscreen? Check. Passport? Check. I'm ready! Where will I end up next?! #carmensandiego #travel #vacation","@travelingmad","travel","x"
"@ModLCDAC I was the worst at the time travel ones but I loved them. ""Where in the World is Carmen Sandiego?"" was my obsession for like 2 years","@kylaelena","cultural-icon",
"Carmen Sandiego Is Back Was announced A Animated Series By Netflix , What Will Explore Your Origin https://t.co/t516XR2GXN","@gtrvariedades","cultural-icon",
"If Erin Andrews wore a red hat, we'd know Carmen Sandiego was in Seattle.","@doozerblake","fashion",
"I bought a wide brimmed fedora. I look very ""Carmen San Diego""","@cherology","fashion","x"
"#fashion #style Karlie Kloss Pulls a Carmen Sandiego On Us, and It's Amazing: Where in the wo... http://t.co/hqCk3J6Al3 #glamour #trends","@fradedo88","fashion",
"@amurphy522 I thought Carmen San Diego had a bright red hat‽","@Darnell","fashion",
"In my top 10 fave costumes at #YelpGetsSpooked : Carmen San Diego here with Waldo","@klkunze","fashion",
"today i turn my back on all this craziness for a bit and head off on another adventure! #whereintheworld #carmensandiego","@atthirtyone","travel","x"
"Carmen Sandiego Returns in a New Educational App https://t.co/wFdYC6Bd9M https://t.co/vS0xpLHmPO","@HallowellKim","spam",
"Deciding which nostalgia game to play, Where in the world is Carmen Sandiego or Zoombini's Logical Journey...","@steggy_","cultural-icon",
"Already have my next Halloween costume planned out. Carmen Sandiego. My date&39;ll go as Where&39;s Wally. Always wanted to do that","@butlertrxr","cultural-icon",
"#PersonalPhilosophyoftheday: I'm really surprised so many countries granted Carmen San Diego a travel Visa with her immense criminal history","@MarkRobertMcCue","cultural-icon",
"And now my sis is randomly in Switzerland😒it's like I'm constantly playing a game of Where in the world is Carmen Sandiego with this chic","@mgt92","fashion",
"942242929300594688","they’re making carmen sandiego into a netflix show im shook","cultural-icon",
"#CarmenSandiego has been one of the most overwhelmingly positive, progressive, and diverse edutainment franchises in history, and it almost single-handedly defined what an educational video game should look and feel like. https://t.co/EalPB0chpw","@Syfyfangrrls","edutainment",
"@gumandcoke harry really would make a good carmen san diego like bring back the hat collection this month","@gumandcoke","fashion",
"@ilikeautumn @CarmenSandiejo Legit! Testimonial for the fun of the borrowed Carmen Sandiego costume, though.","@ep_birdsall","fashion",
"@alkatash @BrownieTw Last reports indicate @JuliaMorales vacationing with Carmen Sandiego and/or Waldo. #Astros","@BrandonASmith","cultural-icon",
"@marypcbuk Red Hat Global Services Consultant, you say? #IBM #RedHat #CarmenSandiego https://t.co/q2OMnWbRaC","@shahedC","cultural-icon",
"@nvbinder Carmen San Diego (but without the hat)!","@JForTheMoney","fashion",
"@kimkardashteam Lady Gaga Is Really Into Dressing Like Carmen SanDiego Lately: A *millenial* C... https://t.co/dI0yTPL9Jt #fashion #news","@Touch4Healing","fashion",
"Also, anyone remember Carmen Sandiego? It’s how I learned geography. I met Greg. He was awesome! My dad was a trooper for sanding in line with me for five hours. https://t.co/38kgYapzwu","@adventuresmissa","edutainment","w"
"@darrylayo I have a female friend who owns a red fedora and trenchcoat and wears them both regularly to pretend that she's Carmen Sandiego","@heykidzcomix","fashion",
"Umbrella-less, TTC debacle, zero car2gos, infinite Uber wait times. Still made it to work, albeit looking like soggy Carmen Sandiego. #dlws","@rinabang","cultural-icon",
"@esnjay I feel like Carmen San Diego would be a hell of a Halloween costume for you.","@puckthepilot","fashion",
"We don't know where in the world Carmen #SanDiego is, but we know where YOU should be! #Travel to ""America's Finest City"" and be welcomed #California style by the amazing and hospitable staff of @hotel_republic! #Discover more and book your stay NOW! https://t.co/OivdHvdmHe https://t.co/ukSHebi4la","@GayTravel","fashion",
"time moves so quick one min u see me here next min u link up me there im bout 2 travel more then the carmen sandiego real talk,i keeps movin","@STRATEGIKUNO","travel",
"theres a carmen sandiego outfit for pyro in tf2 now it's pretty cute","@saphirosphere","fashion",
"You know you're working retail on Halloween when you have to ask Where's Waldo and Carmen Sandiego if they need help finding anything.","@poodlestar","fashion",
"@Heather_Poole get a big red hat, you're basically Carmen Sandiego now","@ColHapablap","fashion",
"@Dennydenn They should have called it 'Where in the World is DenDen' not Carmen Sandiego!! :) xo Safe Travels!!","@Cinders_IB","travel","w"
"Debating on trying to convince my boyfriend to go as a couple costume for Halloween. Carmen San Diego and Where's Waldo.","@NowWriteItOut","fashion","x"
"they made a carmen SanDiego one and more my hero academia ones. ugh","@Star__Munch","cultural-icon",
"It was always Carmen Sandiego being a bad ass and seeing all her adventures getting of trouble that I loved the most about the cartoon show.","@CCTakato","role-model",
"@Mario__Bones Carmen San-Diego's costume was red.","@xaaronh","fashion",
"Imma let you finish, but Carmen Sandiego is the greatest female video game character of all time https://t.co/7HWHxQRQrb","@CheatCodesCast","role-model",
"Best airport ride with my A1!!! See you in a couple days mommy😍😍😍 #carmensandiego #wanderlust… https://t.co/E3ttPvmVFV","@hadiatu03","travel",
"@SamTMart2nd1780 @LynetteRoseMrtz @CarmenCruz303 aww well thank you! This Carmen Sandiego chick is just jealous that we look so good!","@andi_b33","cultural-icon",
"Learned so much from this in my childhood #carmensandiego #childhoodmemories #awesome #nostalgia #knowlegdeispower http://t.co/tarl2uwsmW","@DanceMr_K","edutainment","w"
"Since ""Gamification"" of education is making a comeback, why has NO ONE has made a 21st Century version of Carmen Sandiego? #WhereInTheWorld","@kckaye24","edutainment",
"@Timmyham @awcrandall I though it was Carmen San Diego too. I think it's the hat.","@RamonCreates","fashion",
"I'm not planning no more trips after Dubai I must really think I'm Carmen Sandiego or some shit","@DaUglyFriend","travel",
"Everything I know about geography I learned by chasing Carmen Sandiego.","@OMGmyFACE","edutainment","x"
"I was obsessed with Carmen Sandiego as a child growing up in rural Arkansas. Was one of my first examples of an independent woman traveling the world. https://t.co/eXf2hP2UL1","@DriverWrites","travel","x"
"Loved this game so much! When I first started teaching fifth grade, we had the game on our desktops. We kept atlases and almanacs by the computers. It was a blast. #CarmenSanDiego #Funko https://t.co/gKy2381sJR","@jedipadmaster","cultural-icon",
"@LndsPatterson @Q102_Mollie All you need is the right hat and you'll be the perfect Carmen sandiego for Halloween","@twatsmear","fashion",
"@WhtC4nBrwnDo4U @Dom_Book15 Don't accept that bs...bron travels more than carmen sandiego","@_Pierre_Escargo","cultural-icon",
"Use ""Game-if-cation"" i.e. Oregon Trail and Carmen San Diego to teach Americans how to learn and do things correctly. @elonmusk","@AndrewActon","edutainment",
"What a fun a night with some amazing people 🎃 #halloween #wonderwoman #carmensandiego #party https://t.co/Mdu93hZUh7","@syoder_08","fashion",
"CARMEN SAN DIEGO SHOULD DATE THE MAN IN THE YELLOW HAT.","@notworx","cultural-icon",
"@ErinHazelwood U can dress as Carmen Sandiego and I as Waldo...& no one will find us...drinkin all the vodka @ your Halloween party 😃","@althibbie","cultural-icon",
"Saw a wide-brimmed red hat on someone in the train. Thought for moment Carmen Sandiego was on the T...","@GeekStanton","fashion","x"
"Come on, tell me, where in the world is Carmen Sandiego? #cosplaying #cosplay #carmensandiego #PAXEast https://t.co/Bu8mcyC8V4","@thegamermom","fashion",
"I feel like Carmen San Diego with all the traveling I have been doing in the past two weeks.","@BrittnyAlys","travel","x"
"PLANES, TRAINS, AUTOMOBILES, NGO BOATS: > Where's Carmen Sandiego? > Stuck in tourist traps > While @Lauren_Southern is > Hot on the heels of traffickers > Following the money > And the scent of human desperation > They're stormin' the borders > She's restorin' 'em > #BORDERLESS","@sarah_zero","travel",
"Mind blown: I just learned that the reference books included with the Carmen Sandiego games were not only awesome, but also acted as a form of copy protection.","@arbesman","cultural-icon",
"Road Trip!! Where in the world is Carmen Sandiego? http://t.co/TgHmOepeSQ","@eco_emily","travel",
"Dorkly made a tweet about rebooting Carmen Sandiego. The question is: Do we reboot it as the educational series or something else?","@595moore","edutainment",
"""Where in the World is Carmen Sandiego"" needs to make a comeback. That game taught me so much about geography","@marymeth","edutainment","x"
"How Carmen Sandiego accidentally became an educational game icon https://t.co/2OriMk6HuS https://t.co/BLN57cU6Na","@ProgrammingWrld","edutainment",
"The fact that I wanted to be Carmen Sandiego when I grew up probably says a lot about me.","@LetoileSan","role-model","w"
"I had a Carmen Sandiego PC game and I was crushed when I lost it. She was an icon who taught me so much about history.","@dawn_ofanewday","role-model","w"
"The best female villain in video games was the first one for many of us. Carmen Sandiego. Who's with me?","@Robert_Mason_SF","cultural-icon",
"As soon as I get a red hat my life goal of becoming Carmen sandiego will be real","@strawz","fashion","x"
"Save ya money and travel the globe like Carmen Sandiego forget these local females.","@Cbthesoloist","travel",
"Gina Rodriguez Will Voice Globe-Trotting Thief Carmen Sandiego in a Netflix Animated Series - Slate 😳 https://t.co/5ICRIqdNqu","@DavidMerice1","cultural-icon",
"You guys, I found them. #Waldo #CarmenSanDiego #WheresWaldo #WhereInTheWorldIsCarmenSanDiego #Cosplay… https://t.co/gCxUQrYRCR","@hezavalentine","fashion",
"Launched my new travel website! Follow my adventures! https://t.co/RROe0EaDe0 #travel #southamerica #carmensandiego","@whereisasha","travel",
"What You Learn Hunting Carmen Sandiego Without Google's Help https://t.co/tx0FiAKoe1 from cracked","@The1KingDom","edutainment",
"Already have my next Halloween costume planned out. Carmen Sandiego. My date&39;ll go as Where&39;s Wally. Always wanted to do that","@butlertrxr","fashion",
"Carmen sandiego cosplay?","@hecallsmePP","fashion",
"I found Carmen Sandiego's brother on my bus https://t.co/yoBG3vv5CW","@Mattw_dev","cultural-icon",
"I swear to God they just paged Carmen San Diego at the Orlando airport. So there's the answer to the question.","@myshuffledlife","travel",
"@Imperialgrrl as best I can tell @Banzaibabee did a big Carmen Sandiego style heist on the east coast and is moving west to avoid capture.","@malfunct","fashion",
"Thank you, Adam, for wearing ridiculous hats and calling yourself Carmen Sandiego. Thank you for being weird but not serious.","@holarosarita","cultural-icon",
"Dude! Where In the World Is Carmen Sandiego's Car?! #MakeFilmsIntoTVShows #FridayFondue @KaceyecaK @eFoxBand","@JaymeReally","cultural-icon",
"This is literally how I learned Carmen Sandiego was the bad guy. https://t.co/bI8vUt8hdS","@melissa_bee","cultural-icon",
"Ely is dressed up as this girl. Carmen Sandiego https://t.co/Wv6E0QQanv","@JustinElysandra","fashion",
"@julesrivera Carmen Sandiego Green Outfit DLC?","@phyrehawk","fashion",
"Where in the world is Carmen San Diego?? That is, if my external hard drive were named Carmen San Diego....","@cjhinter","cultural-icon",
"Malia Ryanna is LOVING Where on Earth Is Carmen Sandiego? We've been learning more locations on the map and SO... https://t.co/rAEOwmVV0I","@MzOnPointPromo","edutainment",
"What’s your Halloween costume? Carmen San Diego on a floppy disk","@bobbytooyoung","fashion",
"Where in the world is Carmen Sandiego? #happyhalloween http://t.co/DJlYBybCbF","@xjenflood","fashion",
"Larry Fedora sounds like the name of Carmen Sandiego's schlubby husband.","@cicadaqueen","cultural-icon",
"He's wearing a sweater of carmen sandiego he is too precious for this earth ❤️❤️ https://t.co/RSZNrrDapV","@Madi8onLou","fashion",
"Thank you @youknowlimbo for helping me to not only find Waldo hiding within my very own psyche, but for also bringing to light my inner desire to be Carmen Sandiego. My life has been forever changed.","@DiGamommi","role-model",
"Tomb Raider is kind of like the new Where in the World is Carmen Sandiego without actual educational value.","@axl99","edutainment",
"@Lesliiiemarie you out here tryna put Carmen San Diego out of business traveling the world. U don't have time for little people anymore.","@suave_says","travel","w"
"@3liza I love the goth Carmen Sandiego hat.","@jaredchase","fashion",
"703808575358033920","#Netflix I'm begging you - please make a new version of Where in the World is Carmen Sandiego? I'd watch the hell out of that with my kid!","cultural-icon",
"My Carmen sandiego costume is only really great for Halloween because it's just a jacket and scarf. I hope it's not too hot at #baycon","@ezleeamuzed","fashion",
"@LilithAlive We just lived so far out in the middle of nowhere that our only neighbors were my grandfather and farmer watson. And we did have internet but we played computer games instead, at my grandad's house. Carmen Sandiego and Disney edutainment games.","@shinsengaymi","cultural-icon",
"Feel like I'm in a real life version of Where in the World is Carmen Sandiego #roadtrip #sweetride… https://t.co/B24KaNfRHr","@mamajalazo","travel","x"
"Hey @delta, this isn't a solution to a cancelled flight, it's an episode of Carmen Sandiego MSP✈️CIN✈️ORD✈️CWA http://t.co/dpTDMKF0El","@cooper_smith","travel",
"Been around the world like Carmen Sandiego. https://t.co/cKnMB0dKQZ #mbmhmc #carmensandiego #travel https://t.co/olOUng2DI7","@MBMHMC","travel",
"A great female Halloween costume idea: Carmen San Diego","@atownfrombtown","fashion",
"@worm2126 Now he travels more than Carmen Sandiego. “@worm2126: I remember a @MinusThymus that used to give it to me on an occasion or two at PPL.”","@DC3_TWEETS","cultural-icon",
"On Sunday, I met a bunch of Hadley's friends and when we went to go one of them was all ""OMG I love your coat,"" and then her partner said it looked like a Carmen Sandiego coat, and anyway the point is, I need a really big hat.","@Ghetsuhm","fashion","x"
"@KennyCable1000 how can I forget her, I spent hours hunting her and her VILE gang on my computer, Carmen Sandiego taught me my geography","@antholilmonster","edutainment","x"
"The journey continues. Can you find us? Call to vote! #bossierparishlibraries #catchusifyoucan #thedoctor #waldo #carmensandiego #whereintheparish #cantfindus #wheretonext https://t.co/9fHesOLhlX","@bossierlibrary","travel",
"@kchironis I played a lot of education games from the late 90s early 2000s. Carmen San Diego, Reader Rabbit and the like. Pokémon and other Gameboy games were also in my repertoire. Also. Barbie games.","@piebypie","cultural-icon",
"@elevenafter it originally started as a script for a Carmen SanDiego film but wardrobe just couldnt nail a red hat that Tom would wear.","@Latenitedraw","fashion",
"Where in the world is Carmen Sandiego? #ootd #wiw #wruw #fashion #fashionblogger #style #outfitoftheday http://t.co/KhC01tV7fn","@myprojectsoiree","cultural-icon",
"I travel more than Carmen San Diego during the holidays","@Mr_Tanner23","travel","x"
"carmen sandiego was a great role model to grow up with. that red trench coat & fedora combo! pulling off heists throughout time & space!","@astoehr","role-model","x"
"Where in the world is Carmen SanDiego? 🌎💫 #MadysinHatter #wheelsup #travel #adventure #summer… https://t.co/8ZIWImCLrh","@MadysinHatter","travel",
