"text","handle","category","star_tweet"
"Gina Rodriguez Voicing Carmen Sandiego in Netflix Show https://t.co/tvsn14Ksos https://t.co/JNUn9dOGdE","@Multi_News0","cultural-icon",
"Gina Rodriguez Voicing Carmen Sandiego in Netflix Show https://t.co/xt05hYScvQ #gaming #anime","@Apocrifos","cultural-icon",
"@KevinHearne I'm just a hat away from a great Carmen Sandiego...","@andrhia","fashion",
"Carmen Sandiego' Reboot Coming to Netflix https://t.co/WF90TlgVZK via @YouTube","@CofferJonathan","cultural-icon",
"Netflix orders animated Carmen Sandiego series https://t.co/YK3jFtHufr","@LinkwayLive","cultural-icon",
"No lie, I'm really excited for Carmen San Diego and Bill Nye on Netflix 😂","@PageRay","cultural-icon",
"Gina Rodriguez donning red fedora and trench coat of Carmen Sandiego https://t.co/uRYcRzNqGs https://t.co/318AJdIf7L","@VisioDucit","cultural-icon",
"Tonight it's Digitalistic: A Daft Punk Inspired Dance Party 🚀🚀 @SunshineSucks + Phil David play all your fave electronic music tracks from the monumental 00s! Will you wear a Carmen Sandiego coat like they do in this pic? ⚡️guestlist@foxcabaret.com for free cover spots⚡️ https://t.co/Oz75Y34cnX","@FoxCabaret","cultural-icon",
"@Shantilux nope, which is finny considering how fond of carmen sandiego hats he is","@nolechica","cultural-icon",
"@LadyTaliAdina She does in San Diego for half the time. She went as Kiki (Miyazaki's) and Carmen Sandiego last time.","@tsfightingfish","cultural-icon",
"Children of the '90s Rejoice, For Carmen Sandiego Is Getting Her Own Animated Netflix Series - https://t.co/4Wz3fygq63 https://t.co/Ol18Ei1TGq","@SpRnch","cultural-icon",
"Netflix finds 'Carmen Sandiego' for its latest reboot https://t.co/bIJPuzmTtX","@marciojmsilva","cultural-icon",
"@mental_floss Am I the only one who remembers the Carmen Sandiego choose your own adventure books? Also the board game was 👌👌","@snarkanism","cultural-icon",
"Carmen Sandiego is my dream girl!","@Alex_Brennan16","cultural-icon",
"@stuffisthings specifically for the carmen sandiego ""international women of mystery"" types","@thatgirlAFOX","cultural-icon",
"Gina Rodriguez Is Netflix's New 'Carmen Sandiego' - Animation Magazine https://t.co/eEMSsRne3M","@AnimationShare","cultural-icon",
"#Netflix finds '#Carmen Sandiego' for its latest reboot https://t.co/Tr60jk8bFd https://t.co/ShnmRg4sbG","@jpeMEDIA","cultural-icon",
"@Gamer_GFX “@Gamer_GFX: Where in the world is Carmen Sandiego?” Shes in my car man in san diego","@ALIENAIRWRECK","cultural-icon",
"Educational Games of The Past: Carmen Sandiego http://t.co/aAz9npek4P","@MaglomaniacInc","edutainment",
"I have no idea how I remembered Carmen San Diego but I did and I told that Lady her costume is awesome","@amadeustx","cultural-icon",
"In this hat I'm hiding in plain sight.. I feel like #carmensandiego ... Where in the world is… https://t.co/mc87Mij8hK","@samsmith29","fashion",
"Gina Rodriguez to Star in Live-Action 'Carmen Sandiego' Feature for Netflix https://t.co/4FxmYdLOcX via @thr #childhood #love #tv #animated #art #games","@enwellpen","cultural-icon",
"Netflix is making a Carmen Sandiego movie with Gina Rodriguez – CNET https://t.co/nYc03R8Qcd","@barion","cultural-icon",
"Where in the world is Carmen Sandiego?! 🎶🎶🎶🎶","@jasmineosman","cultural-icon",
"@BigBird Carmen Sandiego's fedora hat, trenchcoat & convertible are red, her favorite color.","@JeremiahLiles1","fashion",
"Carmen Sandiego and Doomguy would be my two mains.","@AlineAndOut","cultural-icon",
"Come Get A Map https://t.co/JX7Yoc6NEX #posterPoster #maps #travel #carmensandiego #trackyourtrip https://t.co/n5bNs85d63","@PosterArtHouse","cultural-icon",
"The First Images of Netflix's Carmen Sandiego Are Here #vegas https://t.co/A3xMxLOTRY https://t.co/7Z4HIffLhW","@nightlife_nv","cultural-icon",
"Carmen Sandiego live-action movie in the works for Netflix 2019 release! https://t.co/6DVdUK3XD4 https://t.co/RNn0I5K5Kc","@aolblog","cultural-icon",
"This makes me SO happy 😍😍 Carmen Sandiego and Gina Rodriguez Where the fans at?! https://t.co/4FWJNJvKqx","@MelissaNBC7","cultural-icon",
"Gina Rodriguez to Voice “Carmen Sandiego” In New Netflix Series https://t.co/jpqyHUR5uG #netflix","@takesontech","cultural-icon",
"Our Childhood Dreams Have Come True: Gina Rodriguez Is Playing Carmen Sandiego On Netflix https://t.co/Fq8gtK3GNB","@DeaconTWERK","cultural-icon",
"@geeklil @Ohthatflo actually I was just thinking: ""That hat is Carmen Sandiego-approved."" (A good thing.)","@gizmogladstone","fashion",
"Today I introducedthe Science Guy and Carmen Sandiego to my young Georgian colleagues. https://t.co/yLzF4CmLip https://t.co/tcwq0ZsaFk","@co_lennon","cultural-icon",
"Best reaction to my Carmen Sandiego costume this morning ""CARMEN! I FOUND you! Finally!""","@karlitaliliana","fashion","x"
"Via @HuffPostQueer: Gina Rodriquez To Play Carmen Sandiego In Live-Action Netflix Film https://t.co/DRwagT6Xny https://t.co/5fDfVkPj26","@thejoshuablog","cultural-icon",
"Where in the world is Carmen Sandiego? — I don't use edutainment https://t.co/FCLmZUiI3s","@BriaNamtar","cultural-icon",
"Hey @delta, this isn't a solution to a cancelled flight, it's an episode of Carmen Sandiego MSP✈️CIN✈️ORD✈️CWA http://t.co/dpTDMKF0El","@cooper_smith","travel",
"Netflix orders animated Carmen Sandiego series https://t.co/ovNkRB2eb2 https://t.co/3pKWFCar3c","@superfabis","cultural-icon",
"carmen sandiego's hat #ThingsIFoundOnTheDeepInternet","@thebobkessler","fashion",
"Screen protected ✔ Case w/map of globe so I can find where in the world Carmen San Diego is… http://t.co/Xxm3Nn4X9U","@D___Allen","cultural-icon",
"Where in the world is Carmen SanDiego? Not at Boston's!","@MikeShoes","cultural-icon",
"What if the real Carmen Sandiego is the henchmen we caught along the way?","@ben_r_hoffman","cultural-icon",
"Netflix’s Carmen Sandiego Movie Sets ‘Game Night’ Scribe Mark Perez As Writer https://t.co/8ROGZKMkP2","@Red_Velvet_Seat","cultural-icon",
"Finally found each other! #halloween #carmensandiego #whereswaldo #whereintheworld https://t.co/LraSKN3pCA","@KristinBridges","fashion",
"It's a good day in the library when I get to dress up like Carmen Sandiego for a team building exercise","@jolophon","fashion",
"Netflix brings back Carmen Sandiego https://t.co/Pp7Ew9BYK6 #CarmenSandiego","@NothingsOn123","cultural-icon",
"In the last few days I have been bombarded with online ads for cheese, cheese curds & cheese wedge shaped hats... if this happened on Carmen Sandiego everyone would know she was in Wisconsin.","@JonHuck","cultural-icon",
"Gina Rodriguez Is Going To Be Carmen Sandiego In A Live-Action Film And I'm Breaking Out My Red Fedora To Celebrate https://t.co/cuWDXnLvEh https://t.co/uju37gUpGx","@azemarketing","cultural-icon",
"We Now Know Where In The World Carmen Sandiego Will Be In 2019 #Netflix #CarmenSandiego https://t.co/SNdjC4nib8","@OfficialLRM","cultural-icon",
"Netflix orders animated Carmen Sandiego series https://t.co/25tYUsfxIK https://t.co/WuiQFK7GxX","@Hwinvox","cultural-icon",
"Where In The World Is Carmen San Diego: Harry Styles Edition 2014","@swiftiehazza","cultural-icon",
"My friends are like the mf wolfpack, Dora the explorer, blues clues, Carmen San Diego, all that no secrets kept no rock unturned🔍👣👀 tryMe","@stalkmythoughts","travel",
"@ty_hotcommodity You gon be like Carmen San Diego","@SoulfulBrotha","cultural-icon",
"Netflix Plans Live-Action ""Carmen Sandiego"" Film https://t.co/FpkzZ4ylvy https://t.co/8iuqltQDvt","@darkhorizons","cultural-icon",
"Yay! The kids on my team recognized my Carmen San Diego costume! I almost won the costume contest too but my team said I already won 2 raffles last week. Seeing my team's faces light up is enough for me.","@CarmenSD11235","fashion",
"I found Carmen Sandiego. She's a Delta flight attendant. http://t.co/qmrnewrTxc","@Shermanther","travel",
"Real life Carmen San Diego. lol. Dead. https://t.co/Rrr9x8XqK8","@flycarla","cultural-icon",
"Jane the Virgin's Gina Rodriguez May Voice Carmen Sandiego on Animated Netflix Series https://t.co/i61RjCy4Ll https://t.co/eLHPzv2UF2","@MoviesWrld","cultural-icon",
"@LaconicLelex @c_gonzalez Telling list. But yes, I did love Col. Santiago as a kid, and Carmen Sandiego remains a secret role model. ;)","@Quinnae_Moon","inspiration","w"
"@Technophobia @pikestaff okay but think about it Carmen Sandiego/Dack Fayden buddy cartoon with similar music inspiration","@Rilgon","cultural-icon",
"spacetwinks: carmen sandiego was a brilliant woman and master thief who told both the entire world and the... http://t.co/ZEAzeAfd1G","@ellemcintosh","feminism",
"#Netflix greenlit a #CarmenSandiego series https://t.co/c5zUylOAMS","@ilovesportsyes","cultural-icon",
"Chuck Norris is the reason Waldo is hiding, and why Carmen San Diego can't be found.","@LegendaryNorris","cultural-icon",
"Connie dressed up like Carmen Sandiego and Steven dressed up like Luigi. #StevenUniverse #BlogAllTheTime","@yahoo201027","fashion",
"Olivia Pope is the real life Carmen Sandiego #Scandal","@flyyerthanyou","cultural-icon",
"@nuffsaidNY ri have a red coat...that's my go-to costume...I can be Carmen Sandiego or a sexy vampire. LOL my red coat is magic.","@femalemsktr","fashion",
"New Carmen Sandiego animated Netflix series!!!!!","@ZayIntheLife","cultural-icon",
"""Netflix plans live-action 'Carmen Sandiego' film with Gina Rodriguez"" https://t.co/l556giSk7A","@nbuoy5","cultural-icon",
"@espn_macmahon As he rocks a hoodie and a Carmen Sandiego hat","@samtheaustinP1","fashion",
"@gerardway Are you going to show us a selfie in the new Carmen Sandiego yellow coat?","@Nightingveil","fashion",
"@jsethriley well then get your trench coat & fedora ready to go (Carmen Sandiego style!)","@1GoldenLamb","fashion",
".@TherealTaraji That ""Where in the World Is Carmen San Diego"" Hat tho!!! #FIYAH #Empire #FoxEmpire","@Call_Me_VRT","fashion",
"Chuck Norris always knows the EXACT location of Carmen SanDiego.","@Robin41099363","cultural-icon",
"Remember when I used to pretend I'm Carmen Sandiego and how much you hated it when I called you Waldo? I miss.","@Her_Randomness","cultural-icon",
"@midwesttraveler screw Carmen San Diego. Its more like ""where in the world is @jondavidson ""","@bad_belvin","travel",
"Who remembers that TV show "" Where In The World Is Carmen Sandiego?""","@RN_Miyagi","cultural-icon",
"You had to see Kelly Rowland with her Carmen Sandiego hat...","@callmedollar","fashion",
"Netflix's 'Carmen Sandiego' debuts on January 19th, 2019 https://t.co/QfeAKuj4qm","@engadget","cultural-icon",
"Bruh...Where in the world is Carmen Sandiego is by far one of the most educational cartoons #handsdown","@JazziMayonnaise","edutainment","x"
"People Are Loving The Carmen Sandiego Comeback Starring Gina Rodriguez https://t.co/msMSW7XMru","@Vix_Social","cultural-icon",
"Me: “See, and there’s the yellow shirt she’s wearing underneath! I KNOW MY CARMEN SANDIEGO.” @holodeck_four: “Weird flex, but ok.”","@marjberockin","fashion",
"Why @DonaldGlover is the best rapper: he references Carmen sandiego. #childishgambino #camp","@Dfraeds","cultural-icon",
"@bravescarmen @aubietiger1928 couple choices, Car-Car, Carmen San Diego, Sherri, Carl, Carpet or just Car.","@BrandonBravos","cultural-icon",
"happy halloween y'all's! #whereintheworld? #Halloween #CarmenSanDiego #Waldo @ Hyatt Regency Waikiki… https://t.co/KeYnMJQoO9","@mistakayk","cultural-icon",
"Good luck finding me in my Magic Eye Carmen Sandiego disguised as Waldo costume. #Halloween","@RhythmOrangutan","fashion",
"http://t.co/gm3HEy5RkU Where In The USA IS Carmen Sandiego? Mystery Geography Board Game Sealed #games #toys #Dvds #Holidayshopping","@10dollr","cultural-icon",
"There's gonna be a new Carmen Sandiego series on Netflix? #Netflix #CarmenSandiego #TVShows #filmmakers #filmmaking","@sjfostersound","cultural-icon",
"PBS had that 🔥🔥 too. Wishbone. The magic school bus. Carmen San Diego","@lilmiss_jordan","cultural-icon",
"Sounds Like #Netflix Is Bringing Back 'Where In The World Is Carmen Sandiego?' https://t.co/IumnuABtpN","@NotifyrInc","cultural-icon",
"Where in the World Is Carmen Sandiego? Becoming a Secret Travel Agent https://t.co/lVVphBKIEz","@HNComments","travel",
"@hollybrocks PLEASE say it was an awesome Carmen Sandiego cosplay","@jrothwell","fashion",
"im gonnnaaaaa watch the carmen sandiego cartoon in german to try and help me not forget everything i learned over the summer","@katethulu","edutainment",
"Walked in on my 8 yr old playing Where in the World is Carmen Sandiego on the retro gaming system I set up. The boy has great taste in classic games! https://t.co/GeUQH7QCX6","@SkepticalMJ","cultural-icon",
"@ChrisBarrett I remember Picadilly and Paws Teaches Typing on Apple IIe/IIc. I grew up at home with Carmen Sandiego and Chessmaster 3000!","@cfarivar","cultural-icon",
"Carmen Sandiego was an amazing woman. She taught me about different countries and cultures. I got to travel without leaving the comfort of my own home! https://t.co/L6YFKnZMrH","@JediMassaYoda","travel","x"
"@ERBofHistory Dipper and Mabel Pines vs Rick & Morty Sanchez Prince vs Bowie (Singers) Naruto vs Aang Steve Irwin vs Jeff Corwin King George 3rd vs Henry The 8th Galileo vs The Pope Rosa Parks vs Ms.Frizzle Bart Simpson vs Dennis The Menace Amelia Earhart vs Carmen Sandiego","@davcharley5001","cultural-icon",
"@Mario__Bones Carmen San-Diego's costume was red.","@xaaronh","fashion",
"Lady Gaga Swiped Her Hat And Trench From Carmen Sandiego’s Closet https://t.co/iy2fhlejvG https://t.co/X8bTXOOAXz","@Theshowbizbabe","fashion",
"Idea: make a new Carmen Sandiego game that helps students, and adults, learn how to search better and tell fake vs real news.","@donovanscience","cultural-icon",
"been flying around the globe trying to catch up to @bizbaby ...She's real Carmen Sandiego wit it. Trying to convert these Anti-Grams 1 by 1.","@FrancGrams","travel",
"I've changed my mind like 1000 times, but I think I'm going to be Carmen Sandiego for Halloween. G is gonna be Waldo 😂❤️","@HisWinoWifey","cultural-icon",
"My aliases: 1. Your local Tupperware lid thief 2. That chained up guy shredding the guitar in Mad Max: Fury Road 3. The Punk of Daft Punk 4. Carmen SanDiego's travel agent 5. Banksy","@theDRaGnrebOrN","cultural-icon",
"@LaurenAtLast My geography knowledge is around the Carmen Sandiego level. So... I may be of use?","@antijenic","cultural-icon",
"Did anyone ever actually figure out where in the world Carmen Sandiego was?","@Cream_of_DKropp","cultural-icon",
"My Carmen Sandiego is back with the most beautiful voice .... Can not wait to accompany, so proud of you Gina @HereIsGina https://t.co/d0tHLBZVov","@samia_candido","cultural-icon",
"“Carmen Sandiego” is going to become an animated series for Netflix https://t.co/FmTwfAExCU https://t.co/DVH550U1vq","@Weegee","cultural-icon",
"Where in the world is Carmen San Diego? Deeming them ""Carmen"" hats and they are trending right now!… http://t.co/6NjbwLNcGw","@ShopGotham","fashion",
"Everyone is looking for me but I’m just trying to find myself 🤓🎃 — #happyhalloween #happyhalloween🎃 #halloweencostume #halloweenmakeup #halloween🎃 #halloween2018 #govgeek #wednesdaywisdom #waldo #whereswaldo #carmensandiego #cosplay @TheChicGovGeek @TheGovGeeks https://t.co/E7YaxcBtxD","@JavierLopezMSA","fashion",
"Found this: Sounds Like Netflix Is Bringing Back 'Where In The World Is Carmen Sandiego?' https://t.co/C3OdUqKBOO","@TopParent","cultural-icon",
"Where ... Carmen San Diego #1 from '96. Credited to SM Taggart but looks like Pete Bagge. Any guesses? @ben_towle ? http://t.co/0q5kET2R1e","@adamccasey","cultural-icon",
"✨Am I the only person who can’t wear a trench coat without singing the Carmen Sandiego theme song? ✨ #whereintheworld @ Chinatown https://t.co/9SFxJod1xV","@Jetsetterjrnl","fashion",
"@korybing There is genuinely a solid collection of 80s/90s edutainment you could throw together into a sweet compilation. Obviously Oregon Trail and Carmen Sandiego topsthe list, but I'd point and click the hell outta Cosmic Osmo again.","@TheOnlyTrout","edutainment",
"Netflix orders animated Carmen Sandiego series https://t.co/fcOFIUJ9hl","@davi4antonio","cultural-icon",
"@WhatsSleepTho I know your bed feels nice after all those Carmen Sandiego adventures you take. Lol. I'm chilling. Relaxing after a LONG workweek","@TristanAMEllis","travel",
"@RunKeeper now that sounds like an adventure! #carmensandiego Can't wait to record the #Camino trip, 115 kilometres across northern Spain!","@mariaheffernan","latina",
"@cwoodsart First of all, you doing this is the absolute coolest thing Christina! You’re art is so fantastic it’s a fabulous incentive for people to vote! Second, could I get my fave gentlewoman thief Carmen Sandiego wearing an “I Voted” sticker? https://t.co/7neOuklKhR","@JeffP888","cultural-icon",
"@reillycosgrove Carmen Sandiego who! You did that! 👏👏👏","@emmasoawkward","cultural-icon",
"Where in the World Is Carmen Sandiego? has been completed!","@LegendaryRPGQue","cultural-icon",
"The World is a big place get out & see it 🌎 #CarmenSanDiego #postivity #Freedom #wanderlust… https://t.co/hlL3P4cvZE","@misscarter","travel",
"I've given Netflix a lot of shit, and I'll give it quite a bit more, I'm sure, but they're reviving Carmen Sandiego with Gina Rodriguez, and that's great.","@flyasscaracal","cultural-icon",
"@JarlisHL If I had to guess, I was either playing mavis beacon teaches typing or the where in the world is carmen san diego game.","@ohheyhihello","edutainment",
"Carmen Sandiego is coming to Netflix","@geniusane","cultural-icon",
"Forget Carmen Sandiego, #USCAP2017 has Dr. R. Cooke who sleuths the globe for pathology specimens from WWI.","@auburnstrat","cultural-icon",
"@JustinnLamar thank you! Wish you were here but hope you're having fun Carmen Sandiego","@WhitneyiAM","cultural-icon",
"Gina Rodriguez Will Star In Netflix's Live-Action 'Carmen Sandiego' Movie - UPROXX https://t.co/pNUfCFMHjL","@exrentals","cultural-icon",
"Carmen Sandiego Able to Steal the Netflix Highlight in January https://t.co/cY7ME3LPT0 https://t.co/Bx74bItBAj","@punga127","cultural-icon",
"""Gobi brave in Inner Mongolia"" -The Chief, Where In The World is Carmen San Diego","@Danielleri","cultural-icon",
"@barstoolsports All this without even mentioning Round House and Where In The World Is Carmen San Diego","@eyyyhowudoin","cultural-icon",
"I do wish this #CarmenSandiego show was going to be live action. Though I'm happy to have the animated show, as well. #netflix","@Siobhan_Chase","cultural-icon",
"Carmen Sandiego is returning as an animated children’s show on Netflix https://t.co/gmgPYXpwSx","@MoviesWorldNewz","cultural-icon",
"In honor of the #Netflix series underway, 'Where in the World is Carmen Sandiego' (1991 FULL VERSION) https://t.co/ohFKni4AH3 via @YouTube","@ProudJersey","cultural-icon",
"That one time when you're really feeling fancy in your Carmen San Diego hat #summernights… https://t.co/ZR3seplAj5","@SShannanigan","fashion",
"‘Carmen Sandiego’ Animated Series Greenlit at Netflix, Gina Rodriguez to Star https://t.co/vM3xmc6Q7d #TDoug https://t.co/bjUGQiTyXV","@TDougNews","cultural-icon",
"Life goals: Achieve the same balance of ambition and fashion sense as Carmen Sandiego. http://t.co/wqOBe6LqWT","@kevinpokeeffe","fashion","x"
"Carmen Sandiego Is Officially Happening With Gina Rodriguez at Netflix https://t.co/wDPygCOdHD","@areyouforeal_SA","cultural-icon",
"Is it just me or does Agent Carter's hat look like Carmen Sandiego's? #agentcarter #carmensandiego","@ki4rex","fashion",
"@WorldlySeb I see ur finally embracing who you really are with that hat, Carmen Sandiego","@ProllyJohnny","fashion",
"Just reminded of best couple costume I saw on Halloween: Carmen Sandiego and Wally.","@jaqx0r","cultural-icon",
"NETFLIX Developing Live-Action 'CARMEN SANDIEGO' Movie Starring GINA RODRIGUEZ https://t.co/CbrHJctwhC https://t.co/pvnccLGHmN","@ComicBookNOW","cultural-icon",
"I guess we found out Where in the World #CarmenSandiego was! @netflix https://t.co/PUni9s8sCQ","@Infinite_Pods","cultural-icon",
"Rockapella-Where In The World Is Carmen Sandiego https://t.co/T1cFxNa14I This song will always get me smiling. Great geo-learning show","@preezerk","cultural-icon",
"It is a true gift to travel the world with someone you love. I hope Carmen Sandiego feels the same way about me. I would ask her but I don’t know where in the world she is right now.","@bobsaget","travel",
"@homefreeguys should sing the carmen sandiego theme song #thesingoff","@banANNAboat77","cultural-icon",
"Gina Rodriguez donning red fedora and trench coat of Carmen Sandiego https://t.co/DkKtDWaw3z https://t.co/iia5000XLf","@mya_fl","cultural-icon",
"Netflix is banking on a certain audience for some of its new shows. https://t.co/zpKry9LxI3","@Polygon","cultural-icon",
"Reading Rainbow is coming back. The Magic School Bus and Carmen Sandiego should come back too.","@nkennedy","cultural-icon",
"I still have my 90s Where in the World is Carmen San Diego board game and the geography questions are still too hard WTF this was way too much for a kid's game and I live and breathe History and the world.","@HexingLow","cultural-icon",
"Wait wait wait lmao who went to the station? What that man do? WHERE IN TF IS CARMEN SANDIEGO? Answers","@TroubleSan","cultural-icon",
"Yuri is giving me Carmen Sandiego vibes and that is how she wins airport fashion medal today","@lilchampagnecat","travel",
"Did they screen these kids for any geography knowledge at all beforehand? #CarmenSandiego","@Barwickipedia","cultural-icon",
"Saturday Night Social: Gina Rodriguez Will Voice Carmen Sandiego in Netflix’s Upcoming Animated Series https://t.co/zTl6kCo7V0","@Ryanl_linda","cultural-icon",
"Research skills, collaboration, and technical literacy are in play during our Carmen Sandiego VR activity! #edchat #edtech #sschat #geography #VR #VirtualReality #google https://t.co/E77YLqTbFN","@saintfester","edutainment",
"@_ayoCHELZ smh, you traveling the world like Carmen Sandiego and can't give a decent tip 🙄","@KallMeTank","travel",
"Netflix finds 'Carmen Sandiego' for its latest reboot https://t.co/clIW3e8qKj","@gadgetmanjay","cultural-icon",
"@sini_o Speaking of that, did you know they're making a Carmen Sandiego series for Netflix?","@dojikkomeido","cultural-icon",
"I want new Carmen Sandiego to beat me up actually I'm cool with any iteration doing it","@waitworry","cultural-icon",
"Jane the Virgin's Gina Rodriguez May Voice Carmen Sandiego on Animated Netflix Series https://t.co/r3e5FKH9r1","@IPOmaven","cultural-icon",
"Netflix is Bringing Back Carmen Sandiego - With Gina Rodriguez! (Report) https://t.co/NbHNF55WJq https://t.co/9wd7B1BUjE","@news_24_365","cultural-icon",
"I learned how to disappear from Waldo and Carmen SanDiego","@MrElicit","cultural-icon",
"every time i see a woman in a red coat i think maybe...just maybe...it's carmen sandiego.","@davelucci","fashion","x"
"@whelaro @ohhoe @julielerman My kids 10, 7, and five play Carmen San Diego all the time on https://t.co/fu4ygtIPWO I have to leave browsers open for days. (https://t.co/F58pcjmHd6)","@jgmac1106","cultural-icon",
"Trying to find out what country Raquel is currently stranded in is like my own personal game of ""Where in the World is Carmen Sandiego?""","@DearJamieMR","cultural-icon",
"@mcmansionhell I believe it is ""carmen san diego"" style...","@LynnApgar","fashion",
"@LORDHEFNER Was Carmen SanDiego Afro Latina? Because that’d be my vote","@Pyrowoods","latina",
"Gina Rodriguez donning red fedora and trench coat of Carmen Sandiego https://t.co/dqrjl0gPre","@EvaLori5","cultural-icon",
"childhood heroes: - catwoman - sailor mars - carmen san diego this says so much","@aprikii","cultural-icon","x"
"@HereIsGina say, are there any publicity photos for Carmen Sandiego yet? Just had a Halloween costume idea. 🎃👻🎃👽🎃💀🎃","@ElsiethePM","fashion",
"Went old school today with a little Carmen Sandiego youtube/@EDpuzzle mashup. Solving crimes and learning about the world. @FatherHenriVS https://t.co/ZMV5JfFnSR","@fhvgrade3","cultural-icon",
"Gina Rodriguez Will Play The Iconic Carmen Sandiego In An Upcoming Netflix Live-Action Film https://t.co/iu5qT1E5iu https://t.co/UZjlde3ETc","@BuzzFeedEnt","cultural-icon",
"Edward Snowden isn’t the 1st person to flee to Russia. Carmen Sandiego fled to Moscow after revealing classified edutainment trivia","@Sophia_D75","edutainment",
"#GinaRodriguez @HereIsGina to Voice #CarmenSandiego in #Netflix Animated Reboot via @EW https://t.co/uya0ZsEf1h https://t.co/T45x0u26E3","@WednesdayComix","cultural-icon",
"@JLJMcCarron @NBCTimeless @abigailspencer @lucianamangas @TheTimelessRoom My sons’ #geography grades improved big time! Then #history when #CarmenSandiego went from World through Time! She and The Chief (the late #LynneThigpen ) were our favourite characters. Hasn’t been an educational program since that family wants to watch, until #Timeless SLR🍀🐰","@leprchaunrabbit","cultural-icon",
"@netflix making 'Carmen Sandiego' ? OMG!","@shanytc","cultural-icon",
"Rasheeda got her Carmen Sandiego hat on. #LAHHATL","@gabbynutter","fashion",
"Gina Rodriguez Will Voice Globe-Trotting Thief Carmen Sandiego in a Netflix Animated Series https://t.co/lyH8iZTPpt","@WomeninComicsNY","travel",
"#AgentCarter is going to have to get a lot more iconic before people stop calling me #CarmenSandiego every time I wear my red Stetson!","@mareasie","fashion",
"Carmen Sandiego Returns in a New Educational App https://t.co/IupqMdSOts https://t.co/g8rBETshjv","@DorisdbryantD","edutainment",
"#Netflix finds '#Carmen Sandiego' for its latest reboot #internationalspy #GinaRodriguez https://t.co/zTD0wdwWrN","@Gamolizer","cultural-icon",
