"text","handle","category","star_tweet"
"Hey Gumshoes, it’s happening! Netflix's is having a live-action Carmen Sandiego! https://t.co/s2HcbG76s6","@helloiamGio","cultural-icon",
"ok dinner where r u? are you hiding with Carmen Sandiego?! 😭","@ryanoginger","cultural-icon",
"@ATLREPPA “@ATLREPPA: Mama Pope lookin like Carmen Sandiego in the red dress all she was missing was the hat #scandal”|!!!!!","@KeithJonesJr","fashion",
"#IfSiriAndAlexaMet Dora The Explorer, They’d figure out where in the world is Carmen Sandiego. https://t.co/Mtf65Rst4x","@JustMyTweet","cultural-icon",
"Top story: Netflix's 'Carmen Sandiego' debuts on January 19th, 2019 https://t.co/bZgeo9aGBf, see more https://t.co/TSvbTiWCvf","@grjenkin","cultural-icon",
"How Carmen Sandiego accidentally became an educational game icon https://t.co/UzgdXIqqf1","@GamesPlace4u","inspiration",
"Jane the Virgin” star Gina Rodriguez In Netflix Remake Of Where in the World Is Carmen Sandiego - https://t.co/edhiA5Zwqu","@Youngdynastymag","cultural-icon",
"Netflix is rebooting Carmen Sandiego as an animated kids’ series https://t.co/GtQX8UZzg0","@VictorRVillar","cultural-icon",
"Gina Rodriguez To Star As Carmen Sandiego In Netflix Live-Action Feature | @deadline https://t.co/TZ9a8TTFLu","@PublishersWkly","cultural-icon",
"@theRaychul oh Carmen San Diego. And educational show that was fun to watch.","@INKREDIBLEKEV","edutainment",
"how did it literally never occur to me that Carmen Sandiego was latina","@FykesMeister","latina",
"""An animated Carmen Sandiego series is coming to Netflix!"" ""...in 2019."" https://t.co/b8EbjloLyg","@scully1888","cultural-icon",
"@Mike_Matei Math/Reading Blaster, Carmen Sandiego, any Jumpstart game, Barnyard Rhythm&Moos. I played these educational PC games back then!","@hankforeman91","edutainment",
"Gina Rodriguez to Voice Carmen Sandiego in Netflix Animated Reboot https://t.co/sPlw8qw74k https://t.co/9W32AMhGR3","@la_patillaUs","cultural-icon",
"bought wifi to do work on an airplane feeling like such a clickety clack clack carmen san diego bitch","@rivianna","travel",
"Carmen Sandiego and Waldo would be easy but lowkey wanna dress up as Bulma and Vegeta.","@STROBELIGHTS","cultural-icon",
"Netflix is bringing back ‘Carmen Sandiego’ with ‘Jane the Virgin’ star Gina Rodriguez as the title character: https://t.co/pkBQ3Uy9xj https://t.co/uR4zO1TzKE","@screencrushnews","cultural-icon",
"Netflix to Reboot 'Carmen Sandiego' https://t.co/jcwZRMcWFa #MyMusicGrind https://t.co/Jlha6rAyQd","@ky_darius","cultural-icon",
"@Braves_Paul I've never played Oregon trail. Not sure why. Carmen San Diego and so you want to be a hero. Brothers influence.","@99braves834","inspiration",
"Carmen Sandiego: Gina Rodriguez to Voice the Role for Netflix https://t.co/pGnRzJ6nCQ via @po_st","@helmi_deris","cultural-icon",
"As we speak a room full of highly educated adults cannot remember what state Pittsburgh is in. Carmen San Diego failed us.","@Get_Hoodzpah","edutainment",
"Awesome!!! @HereIsGina to voice Carmen Sandiego in Netflix animated series: https://t.co/95YAz2RKzG via @BrowBeat","@carolinefan","cultural-icon",
"The hero we need: Carmen Sandiego https://t.co/F1snsFktab","@dav_mcg","inspiration","x"
"I just LOVE Halloween here at my two costumes this year #CarmenSandiego #SrirachaMuchacha https://t.co/O7Pa4UZK61","@PalomaStarr","fashion",
"Look women in trench coats to me = Carmen Sandiego. LOL!","@NeekGoBacon","fashion",
"So ummmmm, Where in the world is Carmen SanDiego!?","@ONLY1WIZER","cultural-icon",
"#TheStoryOfTheMissing Carmen Sandiego. Where in the world is Carmen Sandiego?","@DanielAshley13","cultural-icon",
"I'd use my World Almanac of the USA, Fodor's USA travel guide & Where in the USA is Carmen Sandiego clue book together for a State-A-Base.","@JeremiahLiles1","travel",
"VIDEO: 10 Reasons Where in the World Is Carmen Sandiego? Was the Best Educational TV Show … https://t.co/FkFUCwITFT https://t.co/pBfQ0JCzmt","@swimmerboy2379","edutainment",
"flights booked, like Carmen San Diego.","@jazzyrae","travel",
"Lebron travel more than Carmen San Diego","@OG__Mars","travel",
"@jsnell I didn’t do the survey, but when I heard the hats question, Carmen Sandiego was my actual first guess and I was so happy to hear it at the end.","@MatthewDoel32","cultural-icon",
"@SHlMADAHANZO She looked like Carmen Sandiego I AM SALTY ABOUT THIS WHY ANOTHER JAINA CLONE","@thegatethekey","cultural-icon",
"@amandawtwong FIRST IMAGES AVAILABLE!!!!!!! https://t.co/whDemFHWDR","@amandawtwong","cultural-icon",
"@smashified Where on the Battlefield is Carmen Sandiego?","@NintendoForce","cultural-icon",
"#Halloween costumes at work include: Hipster Carmen Sandiego, Sharknado and ""A Basic""...@MPRM is killin' it at this costume thing.","@nicoleduong","fashion",
"@Christophicles Million dollar idea: Cast Pitbull as a male Carmen San Diego in an educational geography game/app called ""Widely Watching Mr. Worldwide""","@Christophicles","edutainment","x"
"As she got older and the gray fog of dementia crept into her mind, Carmen SanDiego wouldn’t know where in the world she was.","@AAxline","cultural-icon",
"Trending Worldwide Netflix discovers Gina Rodriguez for a new Carmen Sandiego animated series https://t.co/ky7u1XoPQD","@flashnewsportal","cultural-icon",
"@SesameWorkshop I guess you'd know how much I wish more kids expanded their education skills with Carmen Sandiego games, wouldn't you?","@JeremiahLiles1","edutainment",
"@livelovelawWSHS where in the world is sydneydelarosa? (and I would've won that trip to space camp if I was casted, #carmensandiego)","@livelovelawWSHS","travel",
"#halloween2016 Vs. #halloween2017 Carmen San Diego Vs. Lara Croft. I definitely needed last years costume this year bc it was cold af. 😂 https://t.co/FOyB7cOGxf","@MsAuviErlene","fashion",
"Uhhh they're trying to protect their fam. Lizzie's going to play Carmen SanDiego so I guess she hates Cakeden. #GH https://t.co/c3jkbZvpno","@GHRealDeal","fashion",
"Where in the world is Carmen San Diego....well this guy....✈️✈️✈️🚢🚢🚢 #travel #vacations #family https://t.co/4rwJ2mA8Rr","@grumpyvic","travel",
"@AndreaBils @BW I don't hate it, but that 'hut' icon made me think of Carmen Sandiego's hat! http://t.co/gbEx5AMOJt","@Sweet_Madness","fashion",
"Is that a Carmen San Diego hat?!? @katieslatteryyy for the win! #football #fsu #gatech","@jackiefell","fashion",
"VIDEO: 10 Reasons Where in the World Is Carmen Sandiego? Was the Best Educational TV Show Ever https://t.co/73wIOE1o3S","@CelebritySights","edutainment",
"#WhyInTheWorld doesn't Carmen Sandiego and Waldo travel together? It would be much more fun and cheaper.","@Jason_Bergeron","travel",
"Where in the World Is Carmen Sandiego? Becoming a Secret Travel Agent [video] https://t.co/IXB78ZS9CF","@betterhn100","travel",
"And we out! Waldo & Carmen Sandiego is on the move again ✈️ — traveling to Cabo San Lucas - Mexico from Newark... https://t.co/JwQE5PGf7K","@Mslovelace","cultural-icon",
"Netflix finds 'Carmen Sandiego' for its latest reboot https://t.co/duha3rtiwU","@marciojmsilva","cultural-icon",
"Who wore it better: Red Hat or Carmen Sandiego? 😏 #NCEdLab18 https://t.co/ekDNEdjkbF","@dc_price","fashion",
"Strongly considering buying a red coat and hat and being Carmen Sandiego for Halloween","@faeriefountain","fashion",
"Finally found a Carmen San Diego hat! http://t.co/11s5EiZmuQ","@FRESHHtoDeff","fashion",
"Found an old hard drive. Now we are playing Carmen Sandiego.","@jeremygroverboy","cultural-icon",
"EW has the exclusive first look the #CarmenSantiago animated series on #Netflix. The lead character will be voiced by Gina Rodriguez. https://t.co/dzT9Ko0yQw","@reddotdiva","cultural-icon",
"@laynadelbooboo omg Carmen SanDiego, best thing in the world. 👯","@Anna_letsche","cultural-icon",
"Great idea @TeamCairney EdTech TakeOut podcast. Carmen Sandiego for a green screen lesson https://t.co/isF5qHX4ag https://t.co/OfJBRUUcCi","@creativeedtech","cultural-icon",
"He got the Carmen San Diego hat on https://t.co/dQNuNcix5x","@Lamar_NoOdom","fashion",
"@VincentValenLoL *starts humming Carmen Sandiego theme song*","@RyryJones","cultural-icon",
"New Carmen SanDiego coming to Netflix!!!","@Ochsman91","cultural-icon",
"@amurphy522 I thought Carmen San Diego had a bright red hat‽","@Darnell","fashion",
"Netflix is bringing back ""Where in the World is Carmen Sandiego?"" Which is lame, because we already know the answer: Deported.","@rfvestal","cultural-icon",
"Where in the world is #CarmenSanDiego? At San Diego Comic-Con's @blacklightning #Ballroom20 panel of course! #wbsdcc #cosplay https://t.co/7MtEUapQMm","@DanrebV","fashion",
"Where in the world is Carmen Sandiego?","@DJHillyC","cultural-icon",
"Cosplay as Carmen Sandiego at work today? Yes, I think I shall.","@RawkinRobinGoes","fashion",
"[!!!!!!] Gina Rodriguez to voice Carmen Sandiego in Netflix animated series: https://t.co/kM7HtUC3zQ via @BrowBeat","@wraparoundcurl","cultural-icon",
"Netflix's Carmen Sandiego Animated Series Gets January Premiere Date - https://t.co/xR1IhiJEom #TVNews https://t.co/yqvc5GZuzT","@GrangeHotel","cultural-icon",
"VIDEO: 10 Reasons Where in the World Is Carmen Sandiego? Was the Best Educational TV Show Ever https://t.co/hewbTDqwK6","@JeannaTukerno","edutainment",
"@lizzie_b Striped top = jailed. All black = bank robber. Red jacket + hat = Carmen San Diego. Blue hoodie + glasses = Damien from Mean Girls.","@rachelczech","fashion",
"Loved Carmen Sandiego, a favorite of my kids. https://t.co/FIw28Rh16V","@KathyatChrysler","cultural-icon",
"the more notes my gaga video gets the more the thumbnail starts to look like carmen sandiego in a witch hat","@tjbhm","fashion",
"@netflix Any chance you guys could add ""Where on Earth is Carmen Sandiego?"" to your catalogy someday? Thanks! :)","@liagalanodel","cultural-icon",
"⚡️ “Netflix greenlights a Carmen Sandiego series” https://t.co/zKpIToQxlp","@SanyaSafi","cultural-icon",
"Rockapella - Where in the World Is Carmen Sandiego? http://t.co/VexE7oyoly","@benjamminmusic","cultural-icon",
"It's Official: Carmen Sandiego Is Getting Her Own Animated Netflix Series https://t.co/QRcjH0Rcev","@RCRreview","cultural-icon",
"Where's my Carmen Sandiego movie? I mean, come on film industry, if you're making a Cars 3, you're clearly out of ideas.","@MikaylaRae_USA","cultural-icon",
"Check out ""Not Your She-Ro: @carmensandiego and the Importance of Feminism in Entertainment"" @syfy! We're so excited to be working on a TV show AND book series that promotes a strong, complicated female character (and stars @HereIsGina!) https://t.co/JndRo3e9O9 https://t.co/LQYedLNu6E","@HMHKids","feminism",
"Coolest hat? #CarmenSandiego #Undertaker #MaryPoppins #DarkwingDuck #Kuzco or #ScroogeMcDuck? #Funko https://t.co/LkO7y6I7LM","@FearlessRiOT","fashion",
"Terrible game idea: location aware smartphone port of Where in the World is Carmen Sandiego, where you have to physically travel the world to play.","@crazyunlikeafox","travel",
"Netflix is Making a Live-Action Carmen Sandiego Movie https://t.co/ozdrSxEov6 https://t.co/YwOYRINs5K","@cine_monde","cultural-icon",
"my kids are playing BoulderDash on the #C64 and Where in the World is Carmen Sandiego","@BloodyCactus","cultural-icon",
"My dream Halloween costume is The Other Mother and Carmen San Diego. And Sam from Trick R Treat.","@bebravelive","fashion",
"after years of adventure carmen sandiego settles down, builds a magic school bus with stolen magical artifacts and changes her name","@DrPalutena","cultural-icon",
"this years halloween fit: Carmen Sandiego 💃🏽","@_vichoria","fashion",
"Gina Rodriguez donning red fedora and trench coat of Carmen Sandiego https://t.co/XniWOI3Rdj https://t.co/6Xte8nyq9D","@jlwoods0241","cultural-icon",
"Gina Rodriguez donning red fedora and trench coat of Carmen Sandiego https://t.co/rLoT7kyVwy https://t.co/8ARtPcHbvU","@DenkyuuMedia","cultural-icon",
"Gina Rodriguez Is Netflix's New 'Carmen Sandiego' - Animation Magazine https://t.co/2WTJIiffQp","@Animationtweet","cultural-icon",
"Gina Rodriguez donning red fedora and trench coat of Carmen Sandiego https://t.co/wzo53nRTfR @mashable https://t.co/DwoyZ5uMMG","@alvinlindsay21","cultural-icon",
"@H2ODelirious you're that mystery smell that no one can find #CarmensanDiego #metoo","@DirtySa73757735","cultural-icon",
"Jane The Virgin star Gina Rodriguez to play Carmen Sandiego in Netflix’s live-action movie https://t.co/TN3MC1NWpg","@ReleaseSoon","cultural-icon",
"Highlight of my day, I found #Waldo and #CarmenSandiego !!!! #IMDb #Halloween https://t.co/luUXEpqG99","@Erika_IMDb","cultural-icon","x"
"In honor of #InternationalWomensDay I'm dressing like Carmen San Diego.","@JanCaruana","feminism",
"@HereIsGina will star as #CarmenSandiego in a @netflix live action feature film and animated series! She will also produce the movie through her I Can and I Will Productions! Congrats, #GinaRodriguez 👏🙌 https://t.co/Yc4n8P23ub","@TheMujerista","cultural-icon",
"Netflix orders animated Carmen Sandiego series https://t.co/NgxN4Kb8wA #EdTech","@nick_chater","cultural-icon",
"Thank you, qubo, for re-running Where in the World is Carmen San Diego? #stillrelevant","@ShansMasala","cultural-icon",
"Wow...great geography skills @sardeen_! #CarmenSandiego #alltforsverige","@JohnOlsonOnline","cultural-icon",
"@pmmillerr I’m not sure if you dress up for Halloween you’d make for a great Carmen Sandiego","@MTrujillo_music","fashion",
"Everything I know about geography I learned by chasing Carmen Sandiego.","@OMGmyFACE","edutainment","x"
"Already have my next Halloween costume planned out. Carmen Sandiego. My date&39;ll go as Where&39;s Wally. Always wanted to do that","@maybelleqqo","fashion",
"Carmen Sandiego May Be Coming to Netflix Soon via Chip Chick - I'm pretty sure it'd be easier to ... https://t.co/Jiz6km2DkW","@KellyLaBrecque","cultural-icon",
"Reading up on Carmen Sandiego's Latina origins and the impact she had on Latin American girls. http://t.co/rQyowslgtK http://t.co/4FpH3XHE0R","@oswaldjleon","latina","w"
"@JamieErdahl like that Carmen SanDiego red hat and coat from a while back?","@JhazonOnline","fashion",
"E!: Carmen Sandiego Is Officially Happening With Gina Rodriguez at Netflix: Get excited… https://t.co/KkIEiJ2kgb","@arcagility","cultural-icon",
"He traveled further than Carmen Sandiego https://t.co/tso3P7XBhr","@MrAllenAlmachar","travel",
"@AgentCarterTV @HayleyAtwell Love the hat, very Carmen Sandiego :) Can't wait for this, Peggy was such an awesome character in the Cap film!","@jd2319","fashion",
"Gina Rodriguez will be donning the red fedora and trench coat of Carmen Sandiego for Netflix https://t.co/sC4vAzIccD","@OpalJuanda","cultural-icon",
"@LegsInTheCoupe hair flying in the wing you swore you was Carmen San Diego 😭😭😭","@inRondaEyes","travel",
"Gina Rodriguez Voicing #CarmenSandiego in Netflix Animated Series https://t.co/NAdhmSn5EO https://t.co/Q4vjVQbOd0","@FreddieMKR","cultural-icon",
"Carmen Sandiego, the world's most iconic Latina super villain, is back: https://t.co/GbqQaltcOS https://t.co/Eaiy9L8Ulz","@CharlesPulliam","inspiration",
"@Hermann22 That's pretty high praise. Maybe I'll give it a shot. Her look in that hat reminds me of Carmen Sandiego anyway.","@AdamDavis83","fashion",
"Gina Rodriguez Will Reportedly Voice Carmen Sandiego in Netflix Series https://t.co/j5u5XuGf5L via @JustJaredJr","@priscilatosate","cultural-icon",
"Happy #InternationalWomensDay to the most international woman who ever was: Carmen Sandiego. https://t.co/fn4Omwov53","@evan7257","feminism","w"
"Carmen Sandiego is returning as an animated children’s show on Netflix - Polygon https://t.co/WRo5mWPcFM","@FelDaCougar","cultural-icon",
"Finally I can make my direct flights to Reykjavik and find Carmen Sandiego. https://t.co/0v9lsCuMVf","@HeadlessDildo","cultural-icon",
"I wonder was I the only one to notice the lady walking near Kensington dressed up like Carmen Sandiego","@AntawnSchefter","fashion",
"it has never been a better time to have a pet named carmen sandiego","@dumpstercryptid","cultural-icon",
"Netflix Is Reportedly Reviving Carmen Sandiego With Gina Rodriguez... https://t.co/U65auT6sZ1","@Amandalyekie","cultural-icon",
"Netflix is betting on ‘90s kids nostalgia for learning with upcoming lineup https://t.co/MY0YSDtSWH https://t.co/czvKmQjH2X","@zombie_inc","cultural-icon",
"You know what I miss? Where In The World Is Carmen Sandiego. (Even though my sense of geography and history are still rather appalling lmao)","@maiji","cultural-icon",
"Netflix orders animated Carmen Sandiego series (#wnn2) Netflix has ordered an animated Carmen Sandiego series, io9 reports. The 22-episode…","@WNN_Dash2","cultural-icon",
"@soldwindle now you are full nomad I expect the 'where on earth is Carmen Sandiego' game to become a regular fixture! #whereskarl","@JonoPatterson","travel",
"On the real, Waldo and Carmen Sandiego are more easily found than @SkyyhookRadio when she travels.","@ReignOfApril","cultural-icon",
"@Breyalynn1 I just hope you find Carmen Sandiego","@Mr_J_treats","cultural-icon",
"@SeeMomClick A6 my kids love skylanders and carmen Sandiego #FiOSPhilly","@gizmordj","cultural-icon",
"I feel like Carmen Sandiego. Lol","@viamermaid_","cultural-icon",
"Carmen San Diego is back! Thanks @netflix https://t.co/WdIFpmbYrL","@geekerycomics","cultural-icon",
"@nickcarter What are you, @Lauren_Kitt and Odin dressing up as for Halloween?! I’m going to be Carmen Sandiego!","@oceanserenity","fashion",
"Where in the World is Ginger Zee? 🌎 She's got that Carmen Sandiego hat. No shade, just a cultural reference. @ABCWorldNews","@KFisCapK","fashion","x"
"Where Carmen Sandiego at she owe me!!! https://t.co/dHXMib12Xu","@DrumtasticEllis","cultural-icon",
"@bigredcobcast @GrantWistrom Is there any truth to the rumor that Mr Wistrom also knows where Carmen San Diego is?","@therealinformer","cultural-icon",
"road trip by nsp is a modern day where in the world is carmen sandiego","@IizzieoIsen","cultural-icon",
"‘Carmen Sandiego’ Coming to Netflix as an Animated Series Starring Gina Rodriguez https://t.co/dkgfbYVbWN https://t.co/KPnuMxXlsI","@Ice_N_berg","cultural-icon",
"I triggered some serious childhood nostalgia in people tonight with my costume. Never would have thought I’d have a dozen strangers giving me length speeches about their feelings on Carmen Sandiego in a bar 😂 https://t.co/gzgnqDQi6F","@halesjade","inspiration","x"
"Where in the World is Carmen Sandiego? And Eric Lindros? #NYR #NHL #concussed","@theT5E","cultural-icon",
"@GMShivers ""The Incredible Machine"" and ""Where in the World is Carmen Sandiego?"" were both big part of my childhood. Both educational games.","@ezacariasv","edutainment",
"@aliciakeys Dope look, it's like a hip-hop mix of Carmen Sandiego and Raiden. I dig it.","@HarveyLinton","cultural-icon",
"@DEKA_bot The adventures of tin tin. Captain Planet Where in the world is Carmen Sandiego Pro stars","@BassAnonymous","cultural-icon",
"Is it about him travelling through time to find Carmen Sandiego and is it called ""Fedora the Explora""? @Todd_Spence","@IPetFudge","cultural-icon",
"@DugoutDiva You need a Carmen Sandiego hat with a Curly W on it","@jonfeng1","fashion",
"Carmen Sandiego May Be Coming to Netflix Soon https://t.co/wY7rjRCmPc https://t.co/J8cvlJdiaB","@Chip_Chick","cultural-icon",
"Theme song to ""Where in the World is Carmen SanDiego"". #StuckInMyHead","@AmarenaMarie","cultural-icon",
"@my2k we were deprived of a carmen sandiego goddess honestly im mad","@tanatot","cultural-icon",
"Jane the Virgin's Gina Rodriguez May Voice Carmen Sandiego on Animated Netflix Series https://t.co/4CpWP4PgVH","@karlosbas","cultural-icon",
"Why did I spend so much time and energy learning state capitols as a child? Were the grooming us for Carmen Sandiego auditions?","@ETCinSTL","edutainment","x"
"@babytwigxxx Rockos Modern Life Duck Tales Goof Troop Ren and Stimpy CatDog Two Angry Beavers Doug Carmen San Diego Inspector Gadget Arthur Magic School Bus Need I go on...?","@DevDidThat","cultural-icon",
"I feel like Carmen San Diego the way I move around 🤷🏾‍♂️ https://t.co/g7mlczxGg8","@OGMaco","travel",
"I can't wait to watch Carmen Sandiego in Netflix. Tbh I don't know why.","@IDKMateyy","cultural-icon",
"Netflix's 'Carmen Sandiego' debuts on January 19th, 2019 https://t.co/EK6m3GfCWK https://t.co/EzOe9oZTSf","@marciojmsilva","cultural-icon",
"https://t.co/pfOHEirbju; Telling the untold - ""New on Netflix in January: 'Incredibles 2,' 'Carmen Sandiego' and more Marvel"" @ https://t.co/L0KtWKTXn8 #news","@_oftoday_","cultural-icon",
"Where in the World is Carmen Sandiego! No other game taught young me how little I knew about my world, in such a fun way. #ThinksyNostalgia","@maybe_warren","travel","x"
"Next time I'm in a relationship on Halloween, I'll be Carmen San Diego, he'll be Waldo. What are the chances they're found TOGETHER. 😄","@_katedougherty","fashion",
"Gina Rodriguez is going to be live action and animated voice for Netflix's Carmen San Diego! Congrats to her, haven't seen her work but by her interviews I can say she's fitted for this role!","@JadoreLainie","cultural-icon",
"Carmen Sandiego Is Officially Happening With Gina Rodriguez at Netflix https://t.co/gFM01Dm2YV https://t.co/qITkXTt1qg","@maruja_sotillo","cultural-icon",
"How fitting that they found each other! #WheresWaldo #CarmenSanDiego #Cosplay #PAXSouth http://t.co/f597ymgQY5","@PractitioNERD","fashion","x"
"Last week: we enjoyed the utopia of the One World Order in Carmen Sandiego. Next week: we explore adjective placement in Breath of Fire 2.","@OneMoreTurnPod","cultural-icon",
"Did they ever find #CarmenSandiego? Maybe she would have been more noticeable with our OOH-RAH color on to match that red coat. #impromptu https://t.co/9FncSxFZm4","@impromptu_life_","fashion",
"Netflix is learning how in the world to play the franchise game with Carmen Sandiego https://t.co/HXYtH4UeyR Nostalgic millennials, get ready for a Carmen Sandiego live-action movie and cartoon TV series. https://t.co/RzuQrzun8h","@anycurrencynews","cultural-icon",
"Gina Rodriguez to Voice “Carmen Sandiego” for Netflix as Two Movie Studios Battle for Her Next Slot (Exclusive) https://t.co/d8bn7HOrzY","@Childmediafound","cultural-icon",
"#BobCostas doesn't have the Carmen Sandiego hat tonight, but he is in Matrix black... looking very covert @NBCSports","@ChooseFreeWill","fashion",
"A little sad I am still in need of my winter coat this week. Where are you San Diegooooo. #cali #dreams #carmensandiego","@amandadonohue","cultural-icon",
"@MikeBeas Can they just make a real life Carmen Sandiego show or something.","@ZacCoffman","cultural-icon",
"Where in the world is Carmen Sandiego?!","@bourgeois94","cultural-icon",
"📷 ginarodriguez-news: Netflix Reboots ‘Carmen Sandiego’ With Gina Rodriguez Where in the world is... https://t.co/02tIxGR6Np","@kanakaschicklet","cultural-icon",
"GUYS⚡️ “Netflix greenlights a Carmen Sandiego series” https://t.co/IJcwPWThED","@FANGIRLOVERLOAD","cultural-icon",
"Do it, Rockapella: Netflix is Making a New 'Carmen Sandiego' Show: https://t.co/aGnKCbzzTr https://t.co/oAtEvVaYtH","@geekdotcom","cultural-icon",
"Happy Halloween!! I'll be dressed as Carmen Sandiego at the party tonight! Try to find me. 😜 #LetsGoRacingInstead","@Just_AP","fashion",
"Is someone in the audience wearing Carmen Sandiego drag? 😃 #DragRace","@WootiniGG","fashion",
"Where in the world is Carmen San Diego?","@Hromowyk","cultural-icon",
"Where in the world is Carmen Sandiego","@BILLbestwick","cultural-icon",
"Had to recycle Carmen San Diego this year due to last minute issues, but #HappyHalloween Tweeties!! 🎃🌍 https://t.co/aEzUpYt3Tq","@ThaPlatinumOne","fashion",
"Netflix Is Reportedly Reviving Carmen Sandiego With Gina Rodriguez https://t.co/Cq5P6rSQnm https://t.co/hng3Q371sU","@CraigSmithWMTW","cultural-icon",
"@Rebs1001 please tell me you can photoshop a hat on him like the one that Carmen Sandiego has? :D","@Cellie_23","fashion",
"My German lessons taught me ""we have him!"" &""they see us!"" so I'm pretty sure they were written by the people who trained Carmen Sandiego.","@trishaleighKC","edutainment",
"#AlternativeFutures After Boots the monkey is murdered, Dora the explorer partners up with Swiper and one day becomes Carmen Sandiego.","@driftwoodbern","cultural-icon",
"@F_for_Frostie FrostFire loved watching Carmen Sandiego when she was young which could account for her world traveler explorer status. :>","@F_for_Frostie","travel","x"
"Netflix is making a Carmen Sandiego movie with Gina Rodriguez - CNET https://t.co/OSLSv81lbY","@divimixmax","cultural-icon",
"Netflix is bringing back ‘Carmen Sandiego,’ and it’s going to star Gina Rodriguez https://t.co/QWpzLbXQUa https://t.co/T8P77yidte","@Ep4Records","cultural-icon",
"Life goal✔️ 7 days, 7 completely random places. Where will I end up? Stay tuned to see. ✈️🚂🚎#CarmenSanDiego #adventuretime #travelgram https://t.co/oXYJ1grZBw","@coopscadoop","travel","x"
"@beardyderp I have a hat that makes me look a bit like Carmen Sandiego. I smell a Halloween couple's outfit. https://t.co/Y0RqLIyPqj","@jmonkey808","fashion",
"I am really hoping for greatness here!!! I loved this show!!!! Side Note: I have many friends that could be Carmen Sandiego based on their travel frequency!! I wonder where in the world they are now . . . https://t.co/jFifv8KKfu","@FunwithZs","travel",
"@ascottkeys86 We should get you a big red hat to be Carmen San Diego https://t.co/D6hlhsKBdN","@valderie","fashion",
"Whenever I wear black and red, I feel like Carmen Sandiego. #90sKid","@Annajyo","fashion",
"@Tails_High_ @SwychBun Not really I mean I still headcanon that Carmen Sandiego stole things *by* shrinking them. Where's the Eiffel tower? Under her hat.","@LayneTweets","cultural-icon",
