"text","handle","category","star_tweet"
"@emilypractice I'm sorry Emily Cami Patoon Carmen San_Diego Jessica Lange Ms. New Spoopy Drouillard","@funkychunks4","cultural-icon",
"Sounds like Netflix is bringing back ""Where in the World is Carmen Sandiego?"" https://t.co/zC3W6QoPyZ via @HuffPostEnt","@MomOfCrabbyKids","cultural-icon",
"Gina Rodriguez Voicing Carmen Sandiego in Netflix Show https://t.co/9TdDo7BMux https://t.co/6mYzJICM7I","@sarcastard1","cultural-icon",
"@HereIsGina say, are there any publicity photos for Carmen Sandiego yet? Just had a Halloween costume idea. 🎃👻🎃👽🎃💀🎃","@ElsiethePM","fashion",
"DO IT ROCKAPELLA MT @margarita: It's international women's day so enjoy the Carmen Sandiego theme song: http://t.co/SLIwipxdw2","@dvanduzer","cultural-icon",
"@scottEweinberg I learned what spelunking was from Carmen Sandiego. My mom and I played the first handful of games together on Saturday nights in the 80s.","@Supavixen","cultural-icon",
"The decepticon formerly known as Carmen San Diego just whispered in my ear. I'm tempted to follow suit and disappear until the new year.","@Serentis","cultural-icon",
"@dabynsky Carmen Sandiego and the Dr. Brain games were my faves back then. I think I'm the only person who remembers Dr. Brain though.","@feichfem","cultural-icon","x"
"Where in the world *is* Carmen Sandiego? @UPROXX makes great use of @Wochit's on screen text tool to track her down in this new report on @netflix's upcoming Carmen Sandiego movie. https://t.co/MJc3NCezwF","@Wochit","cultural-icon",
"Photo: tanitauncut: Yo, I found Carmen Sandiego, she’s a small Irish woman in Montgomery, AL. I command so... http://t.co/bVJhVd3onO","@youlookthesame","fashion",
"Netflix finds 'Carmen Sandiego' for its latest reboot In a bid to answer one of, if not the biggest unsolved... https://t.co/Sx1zaQdbFo","@samymohab","cultural-icon",
"Jane the Virgin's Gina Rodriguez May Voice Carmen Sandiego on Animated Netflix Series https://t.co/WAGjqBXyKo https://t.co/g4ePpHvD7X","@MoviesWorldNewz","cultural-icon",
"Check out pics from the upcoming #CarmenSandiego series! https://t.co/csRLj1QK4V","@justjaredjr","cultural-icon",
"Should I be Dorothy or Carmen San Diego for Halloween","@__jazzPersona","fashion",
"Oomf is the black Carmen Sandiego bc she traveling errrrwhere","@Fools_R_US","travel",
"@pronounced_ing My first car, a little red Kia was Carmen, like Carmen Sandiego. My current car is Athena","@katedoucette15","cultural-icon",
"@CauseWereGuys real 90s kids remember the original ninja turtles,the first power rangers,Carmen San Diego, Captain Planet,magic school bus","@ThaGez","cultural-icon",
"lrt I FORGOT ABT THE CARMEN SANDIEGO SHOW MAYBE I WILL BE SAVED","@sugarsculls","cultural-icon",
"@JennJukebox ooh! Good joke! My Son is kinda old, they didn't make all this stuff yet lol! The baby has it but she's Carmen San Diego lol🎤✈️","@nikkicarrtqs","cultural-icon",
"Netflix finds 'Carmen Sandiego' for its latest reboot https://t.co/3JrchvPYHc","@blkberrycastle","cultural-icon",
"Film: Carmen Sandiego Is Heading To Netflix As An Animation - https://t.co/l155fIMMsZ https://t.co/M95djjN9lc","@G33kHQ","cultural-icon",
"Carmen Sandiego for Smash","@RandyRileyyy","cultural-icon",
"VIDEO: 10 Reasons Where in the World Is Carmen Sandiego? Was the Best Educational TV Show … … https://t.co/665IJc3AYL","@dolores_sch","edutainment",
"We found Carmen Sandiego! She’s going to be on @Netflix with @HereIsGina n both a live-action film and an animated series. https://t.co/I8x7cYMwFd","@TheCredits","cultural-icon",
"@JacobAWohl I'm willing to bet you never found either Waldo or Carmen Sandiego.","@Bill_Stancill","cultural-icon",
"Lady Gaga Swiped Her Hat And Trench From Carmen Sandiego’s Closet https://t.co/UaM5bbaYIc https://t.co/U1uKV77Ga8","@DAFIT_Fanbase","fashion",
"@gamespite @netflix Referring to #CarmenSandiego as a globetrotter and not a notorious crime boss and renowned thief seems like a mischaracterization.","@MustyHobbit","cultural-icon",
"That moment when you mention Where In the World is Carmen Sandiego and all your Malaysian friends have no idea what the hell that is","@tmakalpha","cultural-icon",
"My nanny... As I drive her home from the airport today... Modern day Carmen Sandiego... 85 years… http://t.co/snTuPfrVDd","@PatHemsworth","cultural-icon",
"Reminiscing about elementary school. #OregonTrail and #CarmenSandiego came up. #oklaed","@tschneiderOK","cultural-icon",
"Already have my next Halloween costume planned out. Carmen Sandiego. My date&39;ll go as Where&39;s Wally. Always wanted to do that","@tabithay1119","fashion",
"How I used to travel the world https://t.co/vJu0i0RHMg","@ilovekida","travel",
"What are you up to during the next 1500 years?! :D It's adventure time with Carmen Sandiego: http://t.co/C3WyNnFllh http://t.co/NMmO2M2I3a","@emuparadise","cultural-icon",
"#JaneTheVirgin star @HereIsGina is doubling down on '90s icon #CarmenSandiego by playing her in a live-action film for Netflix, as well as voicing her in an animated series https://t.co/dp652w66Ru https://t.co/RITK9nBvDw","@MyTrackingBoard","cultural-icon",
"@huffiepuffie — Carmen Sandiego (Where on Earth is Carmen Sandiego?) https://t.co/kiynIEe8FB","@huffiepuffie","cultural-icon",
"#kaabil #Adhm #Shivaay Saturday Night Social: Gina Rodriguez Will Voice Carmen Sandiego in Netflix’s Upcoming Anim… https://t.co/fy5N7UyZzY https://t.co/X2WwheUDmX","@LaneJarry","cultural-icon",
"subway car costume tally: one witch, one carmen sandiego, and 40ish people who either forgot to dress up or my god, carmen has done it again","@robdubbin","fashion",
"Gina Rodriguez To Star As Carmen Sandiego In Netflix Live-Action Feature https://t.co/g2mPv3vdLF #gossip #news #breaking #entertainment #hollywood #celebs #tmz #glamour #sandiego #gina #rodriguez https://t.co/Cmv6eZc3vo","@headl1nes_ent","cultural-icon",
"VIDEO: 10 Reasons Where in the World Is Carmen Sandiego? Was the Best Educational TV Show Ever https://t.co/8QP4iVA8st","@SrtaPearson","edutainment",
"@TheDweck He dresses like Carmen Sandiego had a stroke","@carsonraft","cultural-icon",
"‘Carmen Sandiego’ Animated Series Is Coming — With Gina Rodriguez! https://t.co/znZWBEuZd7","@Rincon_Fashion","cultural-icon",
"Lemme get my Carmen Sandiego costume popping for work. I was third place last year.","@MzCrystalBella","fashion",
"Gina Rodriguez to Play Carmen Sandiego in Live-Action Netflix Feature: https://t.co/3wymA0BULV https://t.co/a1jwkvCks0","@NerdMusicRadio","cultural-icon",
"Honestly, I thought the Larry Fedora all over my TL today had to be a villain in a Carmen San Diego episode. #cartoony","@LKNWoman","fashion",
"I want to wear my Carmen Sandiego coat tomorrow but I'll be driving all day.","@urfavfemme","fashion",
"@theWXwoman @USPS oh noooooo! I was so excited to see it. New Colorado stylin: Orange puffy coat, Carmen Sandiego hat, skinny jeans, boots","@missb62","fashion",
"@AlexaAimes Are you traveling with Carmen Sandiego? Lol","@groundedgeek2","travel",
"Her clothes give off a Carmen Sandiego vibe tbh I love it","@wintersbwidow","cultural-icon",
"I’m still thinking about the woman who walked into the store yesterday in a denim overcoat and bright red purse and Carmen Sandiego hat. Teach me your ways queen cause girl was serving LOOKS","@davidmarzano","fashion",
"Inktober 2017 Day 28 Homestar Runner (as The Greatest American Hero) & Strong Bad (as Carmen Sandiego) #inktober #inktober2017 https://t.co/A06Jw2t1gQ","@robinandcat","cultural-icon",
"Netflix orders animated Carmen Sandiego series https://t.co/ovNkRB2eb2 https://t.co/3pKWFCar3c","@superfabis","cultural-icon",
"Honestly the reactions to this news is hilarious. Carmen Sandiego's an ex-agent turned artifact thief, crime lord, style icon, and jetsetter. Even so, still #TeamCarmen. Plus her theme song is BAWSE. Before the Bellas, there's Where in the World is Carmen Sandiego. https://t.co/7z66ucjgUH","@DJMK4Life","cultural-icon",
"Netflix finds 'Carmen Sandiego' for its latest reboot https://t.co/S8cBQjmtkS via #indilens","@jibonsingh12343","cultural-icon",
"Carmen Sandiego would be a fun gal to date","@aisforalex04","cultural-icon",
"Yes!!! Gina Rodriguez to Voice Carmen Sandiego in Netflix Series https://t.co/hgwj2uqwPS via @vulture","@sdiaz101","cultural-icon",
"@timpastoor ¯\_(ツ)_/¯ no idea? I was born in 'muricastan. If it weren't for Where in the World is Carmen San Diego my geography knowledge would be worse","@rhymebyter","cultural-icon",
"Netflix is rebooting Carmen Sandiego as an animated kids’ series https://t.co/VVUhoV3fGz #music","@allisondejollie","cultural-icon",
"Netflix' New Version of Carmen Sandiego Premieree January 18 https://t.co/1AqgH0mvae","@PublishersLunch","cultural-icon",
"Where in the world is Carmen Sandiego. I'll go look in 2019. No, for real. I was just asked where I wanted to go. Let's bust out the globe!","@BonceDeLeon01","travel",
"I have the Where in the world is Carmen Sandiego theme song on my iPod #confessiontime","@ChampionCheza","cultural-icon","x"
"Where in the World Is Carmen Sandiego? Becoming a Secret Travel Agent https://t.co/FUmaLyWb8T https://t.co/LS1a9dhrdS","@jackstarr1999","travel",
"Where on Earth is Carmen Sandiego? #CarmenSanDiego #Cartoon #Cartoons #EduTainment #FoxKids https://t.co/ceV7j32SDI","@whydoisay","edutainment",
"everybody crying to dress for fall only to pull out over the knee boots and Carmen Sandiego trench coats.","@channypannies","fashion",
"@StephenCapps My date dressed up as Carmen Sandiego","@StephenCapps","fashion",
"Gina Rodriguez to bring Carmen Sandiego to life. https://t.co/SF8ETgvFz4 @HereIsGina @netflix #CarmenSandiego","@NerdNewsFactory","cultural-icon",
"@somnuszzz @harrismint Could also attempt Carmen Sandiego if we wanted an geographically educational hunt: https://t.co/PwBe21H7uX","@TuskCulture","edutainment",
"#flashback #2012 #carmensandiego one of my #favorite #Halloween #costume #mystery #spy #worldtraveler… https://t.co/QrBG9s3Lj7","@AnnysaLaMantia","cultural-icon",
"Poison Ivy was a cartoon villain Harley Quinn Shit, wasn't Carmen Sandiego technically the bad guy? Stylish bitches https://t.co/JrcaPeYoNP","@BabyGrotesque","fashion",
"Netflix Is Reportedly Reviving Carmen Sandiego With Gina Rodriguez https://t.co/FjTDRU686w","@GadgetStash","cultural-icon",
"Rumor: Gina Rodriguez in talks for 'Where in the World is Carmen Sandiego?' reboot on Netflix https://t.co/chLWqgKx2P","@deafgeoff","cultural-icon",
"Gina Rodriguez (Jane in Jane the Virgin) being the VA of Carmen Sandiego 4 Netflix show is a weird but awesome piece of news u need 2 know.","@thejoewah","cultural-icon",
"Netflix's 'Carmen Sandiego' debuts on January 19th, 2019 https://t.co/QfeAKuj4qm","@engadget","cultural-icon",
"@MikahWyman Wear in the World is Carmen Sandiego","@carsonraft","cultural-icon",
"""What do you make of all this stuff with the president, '90s Man?"" ""They never re-ran the first season of 'Where in The World is Carmen Sandiego?' because the Soviet Union collapsed and changed all the geography.""","@HoneyIShrunkJG2","cultural-icon",
"Someone on my bus is dressed as Carmen SanDiego... Halloween is in 3 wks, so I can't help but speculate as to whether that was her intention","@monogato","fashion",
">Carmen Sandiego time-travels to steal Ben Franklin's Key, stopping his electricity research. Wouldn't that cause a massive freaking time paradox?","@MagicaRanger","cultural-icon",
"At last! #CarmenSandiego is coming as a live-action feature #Netflix https://t.co/pVumFUF6fO","@Crwrealife","cultural-icon",
"When @themudcrusher goes on her OCR travels, it reminds me of Where in the World is Carmen Sandiego ? 💪😎 https://t.co/uH1jTOypSE","@roy_roydweaver","travel",
"I've always wondered where Carmen San Diego went on vacation","@JosephCrabb","cultural-icon",
"@lindseymgardner I'm enjoying your Where in the World is Carmen Sandiego adventures.","@AdamsWorldBlog","travel",
"‘Carmen Sandiego’ Coming to Netflix as an Animated Series Starring Gina Rodriguez!!!… https://t.co/K5zuF9dBcI https://t.co/xbnbOUZ9yC","@movizark","cultural-icon",
"So glad to see Gina getting these roles! If you haven't seen her on Jane the Virgin, check it out. She's incredible in it! https://t.co/NcqEB4bMtr https://t.co/NcqEB4bMtr","@joe_juhase","cultural-icon",
"Black Twitter grew up watching Where In The World Is Carmen San Diego?. I shouldn't be shocked by the sleuthing skills but I am every time.","@Quemini","cultural-icon",
"Feeling very Carmen Sandiego in this photo. Just need my hat. 💋 #latergram #redlips #palegirls https://t.co/Kj8NvTZmOZ","@BreGraing","fashion",
"Seriously, world, that's the best we can do? A ROM of Carmen Sandiego on a slightly dodgy site? Why can I get this on iPad for my kids? #lrt","@bjkraal","cultural-icon","x"
"And there is a whole section of praise given, without reservation or qualification, of Carmen Sandiego as a role model for young Latinas.","@saraheverywhere","role-model","x"
"@Ginger_Zee first thing I thought with your hat was ""where in the world is carmen San Diego!","@jeffreytwatkins","fashion",
"@renatasnacks I really want the purple Carmen Sandiego hat but I can't afford it :( #hollywoodproblems","@renatasnacks","fashion",
"@KelseyChapstick Whoa, so THAT'S where in the world Carmen Sandiego is!","@stormbeard","cultural-icon",
"⚡️ “Netflix greenlights a Carmen Sandiego series” https://t.co/EheaXpPrVE","@setrocs929","cultural-icon",
"Netflix's Carmen Sandiego Reboot Has a New Premiere Date and Some Mysterious Teaser Images https://t.co/48KmFeSIg7","@davea71","cultural-icon",
"one day ill have a guy who i can be carmen sandiego and he can be waldo for halloween #goals","@jilldiegsxo","fashion",
"@iSmashFizzle I was Carmen Sandiego for Halloween when I was 11 or so, which means I had mentally put her alongside Zorro and Tuxedo Mask.","@berhuq","fashion",
"hey, remember that time @dessadarling was Carmen Sandiego for Halloween? ahahaha https://t.co/fuOV1mJQOt","@DOOMTREE","fashion",
"My kids are never gonna die on the Oregon Trail. Or look for Waldo, and Carmen San Diego. Or have Mavis teach them typing. Sigh.","@ShamekaErby","cultural-icon",
"Sad Facts about growing up: so it turns out Carmen Sandiego is a lot easier when you know about geography.","@AnnieNybo","cultural-icon",
"I told my friends I wanna be Carmen sandiego for Halloween, but they don't even know who that is. I clearly was born in the wrong year","@Mel_Osorio","fashion",
"Carmen Sandiego was stealing all types of shit with the baddest red coat.","@CarmillaLusta","fashion",
"What if Carmen SanDiego and Waldo with the striped hat and sweater are somewhere with all my pens and sunglasses?","@RoxieBrookshire","cultural-icon",
"Guys remember that time I went to #Ukraine spontaneously? ✈️🌅 #vscocam #tbt #carmensandiego @… http://t.co/tBL8oEPgns","@Max_Not_Mark","travel",
"What's new on Netflix in January 2019 https://t.co/mMArJrIihH","@geniuscloudapps","cultural-icon",
"Our Childhood Dreams Have Come True: Gina Rodriguez Is Playing Carmen Sandiego On Netflix https://t.co/HZJp7ZqQZl","@Sergioman","cultural-icon",
"Gina Rodriguez to Star in Live-Action 'Carmen Sandiego' Feature for Netflix https://t.co/GPDWUXU7E9","@ravensley14","cultural-icon",
"If you find yourself needing an encyclopedia set, may I suggest being a contestant on Where In the World is Carmen Sandiego? #gumshoe","@NitWok","cultural-icon",
"Where In The World Is Carmen Sandiego? Who remembers this, Ioved it as a kid. Great show http://t.co/S3LRyd5hgz","@natrepair","cultural-icon",
"New post: Netflix plans live-action ‘Carmen Sandiego’ film with Gina Rodriguez https://t.co/1AHIRWIe7h","@MobileStarts","cultural-icon",
"Bold move for Netflix to introduce their live action Carmen Sandiego within an episode of Homes Under The Hammer https://t.co/HDQhSniLEu","@AndrewDEvans","cultural-icon",
"@whittynovels honestly if carmen sandiego wasn't your first woman crush then get out of my face","@whittynovels","cultural-icon",
"Karlie Redd borrowed one of Rasheeda's Carmen SanDiego hats from last season for his meeting with Joseline...#LHHATL","@libra10584","fashion",
"""Okay, so where in Carmen Sandiego do I need to go?""","@tallshotofpain","cultural-icon",
"https://t.co/hDoYNVZsuk Carmen Sandiego May Be Fictional, but Her Style Is Hugely Influential  https://t.co/ns5RfCLKk4 https://t.co/P1dk2DwXbO","@rent_the_look","fashion",
"Yo, @netflix's new take on Carmen Sandiego actually looks kinda great. I like the new art style, I just hope it looks as good in motion as it does as stills. https://t.co/Vr6HXTBKAb","@Ekana_Stone","cultural-icon",
"OMG..Carmen Sandiego?!? M SO IN!!!!! Netflix Adds Stranger Things Star To Carmen Sandiego Reboot Cast https://t.co/PeLA45KgTu via @ComicBook","@om2kool","cultural-icon",
"@HereIsGina @netflix wait...there is gonna be a Carmen sandiego on netfiex?","@PhoenixCoreDHE","cultural-icon",
"#PersonalPhilosophyoftheday: I'm really surprised so many countries granted Carmen San Diego a travel Visa with her immense criminal history","@MarkRobertMcCue","cultural-icon",
"He said,""you travel like you on tour"" #carmensandiego #waldo #where #travelteam","@The_Prize","travel","w"
"What is with the Carmen SanDiego hat on #LHHATL this season?!?!","@KaramelBelle","fashion",
"Carmen Sandiego is my role model. That bitch can steal what she wants, when she wants and she can totally pull off red.","@Huy_Will_Nguyen","role-model","w"
"#CarmenSandiego inspo #outfit of today. #red #coat #boots http://t.co/zoTQBswv0C via Facebook http://t.co/w2134qOYv6 http://t.co/2TpBKNpmJj","@becandbaxt","fashion",
"@ErinAndrews looks like 'where in world is Carmen Sandiego' with that hat #NFL #GBvsSEA","@1jrojas1","fashion",
"Yall see @khloekardashian in her where in the world is carmen San Diego hat #nbafinals","@thatown2","fashion","x"
"@AdrienSpecter I know... I know... Let's pray... If not I will find Carmen SanDiego and hide there","@Eddie_Vega1","cultural-icon",
"🙌🏻Thank you lovebug.As the #CarmenSanDiego of #Periscope✈️,I'm making my rounds this holiday season! 😉#LoveBugNation https://t.co/0MtwAVBOXq","@xoxoLizza","cultural-icon",
"Netflix Adds Stranger Things Star To Carmen Sandiego Reboot Cast #TV #movies #Comics https://t.co/npmJFDN3Ld","@pure_enter","cultural-icon",
"Carmen SanDiego last night at the 006.9 spy-themed show at ROCKS 😎✈️🌎🌍🌏 #carmensandiego… http://t.co/I9zS0dFqYl","@ThePacificaRim","cultural-icon",
"@connor_hatzi Nope. Will is know as Carmen Sandiego in Sweden.","@RbkEst","cultural-icon",
"@RichXKU @6abc Carmen Sandiego must have been on vacation or something. :D","@NevynPA","travel",
"Netflix is betting on ‘90s kids nostalgia for learning with upcoming lineup: Carmen Sandiego, Magic School Bus https://t.co/3CoOrTb4Mq","@Rxbun","cultural-icon",
"New post from Engadget RSS Feed: ""Netflix's 'Carmen Sandiego' debuts on January 19th, 2019"" https://t.co/G0IXZICL0i","@drunktechguy","cultural-icon",
"@HereIsGina something to cheer you up: this is what I look like tonight. #Halloween #CarmenSandiego https://t.co/IOkkU7NDVd","@ElsiethePM","fashion",
"Why did Heather Cox wear a ""Where in the World is Carmen Sandiego?"" hat tonight on air?","@PaulMBanks","fashion",
"Ever died of dysentery or chased Carmen Sandiego? https://t.co/pFBpwzDgqm https://t.co/dAGAxjTAKo #education #kids https://t.co/dgo3IKNZSf","@amatradio","cultural-icon",
"It's like 20+ degrees already so I need to go out in my sun hat. Looking a bit like Carmen Sandiego tbh http://t.co/3nYImIQsro","@japanese_gum","fashion",
"#CarmenSandiego Getting Her Own Animated #Netflix Series https://t.co/hIi8EKcw1o? utm_medium=sharefromsite&utm_source=io9_twitter via @io9","@TheBAM27","cultural-icon",
"""The Rari got a red coat like Carmen San Diego""- Jeffrey 🔥🔥🔥","@CizzlePower","fashion",
"So for Halloween I was Carmen San Diego. Gotta find costumes where I… https://t.co/YumXqGB0qk","@Operababyd","fashion",
"It's Official: Carmen Sandiego Is Getting Her Own Animated Netflix Series https://t.co/vQqSLYJW1Z","@WomeninComicsNY","cultural-icon",
"@imisspoundsigns So, he overpaid for track pants and Carmen Sandiego's trench coat. Got it.","@GCraftyCouture","fashion",
"@FiletMunyon come pick me up and we will have a Carmen San Diego adventure! With booze, of course!","@ar_martin09","travel",
"carmen san diego is like how i put tinder boiz in my phone. dustin sacramento, jason anaheim, jordan winter park... none of them have a cool red hat though 😔","@caseyandthebear","cultural-icon",
"everybody crying to dress for fall oy to pull out over the knee boots and Carmen Sandiego trench coats.","@channypannies","fashion",
"Stolen zebras? Even Carmen San Diego wouldn't stoop so low. #Elementary","@hoosierjedi","edutainment",
"Lady Gaga Swiped Her Hat And Trench From Carmen Sandiego’s Closet https://t.co/ZFNWCYMIT3","@MoviesGuru","fashion",
"Is @ErinAndrews trying out her Carmen Sandiego outfit today?","@bagel202002","fashion",
"This outfit reminds me of that where in the world is Carmen Sandiego thing https://t.co/l64mkkYCfK","@nuniobseo","fashion",
"this is how I learned about world geography way back https://t.co/6vel9N1s3a","@Franzu09","cultural-icon","w"
"Carmen Sandiego said she was gon fly me across the world today...but she stood me up at the airport. Ebony and Ivory got my back though.","@ParabellumRaps","travel",
"The hat is back. Tune in tonight. #carmensandiego 🕵❄️🔦📺 https://t.co/AygiP3KXFG https://t.co/6xPNifgKsW","@theWXwoman","fashion",
"#CarmenSandiego Reboot Finds New Home With @Netflix! https://t.co/Py08TZUX7c","@AMP1037DFW","cultural-icon",
"No Life Goals. This is a lifestyle. Carmen Sandiego 🌎 On Go ✈️ https://t.co/FaIBs3OLBW","@p0is0n0uz","travel",
"Netflix’s ‘Carmen Sandiego’ to begin streaming in January https://t.co/dkW47enc9s","@jdesignz","cultural-icon",
"VIDEO: 10 Reasons Where in the World Is Carmen Sandiego? Was the Best Educational TV Show Ever https://t.co/ZMljmyAKld via @People","@SFBEX","edutainment",
"Sincere look like Carmen SanDiego in this hat 😂","@HollywoodJustin","fashion",
"Netflix Could Be Bringing Carmen Sandiego Back https://t.co/Yn5yVCkd5q [via io9]","@darylelockhart","cultural-icon",
"I ❤ed Carmen Sandiego as a kid. This would be so fun in the classroom https://t.co/09lDZFhTuG","@wileyteaching","cultural-icon",
"Netflix Could Be Bringing Carmen Sandiego Back https://t.co/bq50I1Udz2","@MissChisolm","cultural-icon",
"Umm...What in the what now?!? No. Nooooo! 40something me refuses to accept this. Carmen Sandiego was a mysterious badass traveling the world getting acapella songs written about her. She was #lifegoals. https://t.co/oeJDEhzzUX","@virgogirlgm","role-model",
"@JoeBudden You won Halloween with the red hat. No one could have pulled off Carmen San Diego, Hamburglar and Mr. Incredible at the same damn time.","@thefakejayowens","fashion",
"New hat for fall also doubles as a #carmensandiego costume. #whereintheworld #canadaeh https://t.co/maoP5OKNYZ","@LindsayH902","fashion",
"When an invite says ""explorer gear,"" more Carmen San Diego than Dora?! @ExplorersClub #TravelTuesday https://t.co/xqXsWF278Q","@koimtv","travel",
"▶@DigitalTrends: Gina Rodriguez, ‘Stranger Things’ actor, to lend voice to Netflix’s ‘Carmen Sandiego’ https://t.co/Q2N1uTtqA1","@Reach1SocMedia","cultural-icon",
"Like where in the world is carmen san diego does anyone remember that show","@timbitstyles","cultural-icon",
"https://t.co/RBdwMsfuzd VIDEO: 10 Reasons Where in the World Is Carmen Sandiego? Was the Best Educational TV Show … https://t.co/2EL0qB9Ikd","@MicheleGerren","edutainment",
"(SQUEEES like a schoolgirl going to a K-Pop concert.) Oh my god, Netflix is bringing back Carmen Sandiego for a new animated series 😍 Unfortunately it’s not out till next year but they’re banking on 22 episodes.","@latexbadger","cultural-icon",
"Gillian Anderson's best outfit in HANNIBAL? Carmen Sandiego's Luigi. https://t.co/vCKyiw40wl","@gregbrown","fashion",
"spatscolombo: So I accidentally learned today about this thing where lots of people ship Carmen Sandiego... https://t.co/NMEsHNZa3r","@DanicaHere","cultural-icon",
"⚡ Netflix greenlights a Carmen Sandiego series https://t.co/CgkplApV3b","@Calvero","cultural-icon",
"A5 well I am in the process of building a Where in the a World in Carmen SanDiego style game based on content using sites #edtechafterdark","@btcostello05","cultural-icon",
"@iSmashFizzle Listen... in my mind she was just a woman who traveled with a trench coat, and she will continue to be that for me. I see no wrong with Carmen San Diego.","@JensShoeDiaries","travel",
"My dream came true. I dressed up as Carmen Sandiego for a Halloween party. I can now die happy","@miss_stmarie","cultural-icon","x"
"⚡️ “Netflix greenlights a Carmen Sandiego series” https://t.co/zKpIToQxlp","@SanyaSafi","cultural-icon",
"Netflix making live-action Carmen Sandiego movie https://t.co/rR4pkkjhkG https://t.co/5IhleKi4e2","@AllGamesDelta","cultural-icon",
"@nfidel_ In 1994, we used the Carmen San Diego video game in our after-school program with 7 to 11 year-olds, to develop world geography knowledge. In order to proceed through the game, children needed to use almanacs and other ref. works. This was before Google was so widely available.","@RGracielaMontes","cultural-icon",
"Where in the world is Carmen Sandiego? 💃🌎 #xoxo #fashion http://t.co/mIR8HeJ9sL via @snapwidget","@JoannyIzadora1","fashion",
"Debating on trying to convince my boyfriend to go as a couple costume for Halloween. Carmen San Diego and Where's Waldo.","@NowWriteItOut","cultural-icon","x"
"Yaaaas, baby!!! #CarmenSandiego","@Abimelec_MR","cultural-icon",
"Netflix finds 'Carmen Sandiego' for its latest reboot - https://t.co/m6fuLlNHoB #News https://t.co/il25dl7qtJ","@aivanet","cultural-icon",
