"text","handle","category","star_tweet"
"Yay! Also I miss the TV game show ⚡️ “Netflix greenlights a Carmen Sandiego series” https://t.co/35TMWoV3N7","@cwalkker","cultural-icon",
"Big fan of STEM education for kids, but there are now 9,582 ""learn to code"" toys, no innovation in geography ed. since Carmen San Diego.","@josephflaherty","edutainment",
"On that note, I think I'll be Carmen Sandiego for Halloween.","@Han","fashion",
"What do you get when you have The Doctor, Waldo, and Carmen Sandiego in one location? An epic adventure! Follow our journey and see if you can figure out where we’re stopping, you might… https://t.co/JXIKGmIbo1","@bossierlibrary","cultural-icon",
"Better 90s-themed costume: Daria or Carmen Sandiego? Can't decide which I'd rather invest money for.","@piggywillow1","fashion",
"Khloe Kardashian now dresses as Carmen Sandiego every day. I mean im not hating on it. Carmen was so boss","@megansarahj","fashion","x"
"carmen sandiego is a bisexual icon change my mind","@NikosRaves","role-model",
"15 Classic PC Games That Deserve The Netflix Treatment: With Netflix announcing a new Carmen Sandiego animated... https://t.co/IAisEit0yq","@TheVintageComic","cultural-icon",
"They should put Carmen San Diego on @netflix","@WINTism","cultural-icon",
"Rockapella-Where In The World Is Carmen Sandiego https://t.co/T1cFxNa14I This song will always get me smiling. Great geo-learning show","@preezerk","edutainment",
"I have not found Carmen San Diego on my trip, but I did find the early 90s! http://t.co/nMOabaVeaq","@maybeimamazed","travel",
"#CarmenSandiego was a huge part of my childhood and it was awesome to ""find"" her at #Comikaze! Cosplay… http://t.co/0bfhuz0MYy","@thatemilykelley","cultural-icon",
"Sounds like Netflix is bringing back ""Where in the World is Carmen Sandiego?"" https://t.co/2bas96LelA https://t.co/pNYwTNfifI","@FOXCinemas","cultural-icon",
"🌎@Netflix is bringing back Carmen Sandiego! https://t.co/od7RKEwdBb https://t.co/WMNqp422kX","@REMEZCLA","cultural-icon",
"I feel like Carmen SanDiego finding all these obscure map points!","@DrAngelaSutton","cultural-icon","x"
"@captainduckIing @sethycohens geography the world carmen sandiego","@captainduckIing","cultural-icon",
"@forgottentowel that’s what Carmen Sandiego said! And while I still haven’t found her, I do have this fedora and a Capella group…","@aboynamedboom","fashion",
"@angwilliams @HiAndrewJenkins Halloween lifesaver! I have Carmen San Diego waiting to be revived if need be but thank you!","@lifewithlauren1","fashion",
"Gina Rodriguez Will Voice Every ’90s Kid’s Favorite Globe-Trotting Thief, in a Netflix Animated Series. https://t.co/w9fcgnUgeK","@deenay1o","travel",
"I'd give my left arm to still have my ""Where in the World is Carmen SanDiego?"" CD-ROM. You can run, but you can't hide bishhhh!","@hannahfofanna47","cultural-icon",
"Erin Andrews found Carmen SanDiego and stole her clothes #whereintheworld #canyoubuythatoutfit","@thirdsacharm09","fashion",
"@melissafumero While she's not a Marvel hero, I'd LOVE to see you as Carmen Sandiego https://t.co/lOQ2nF4sOs","@SimonJadis","cultural-icon",
"InStyle: .HereIsGina is set to take on Carmen Sandiego's voice in Netflix revival: https://t.co/6he5jLYujj All #InStyle","@SwatEGogia","cultural-icon",
"#NEWS Gina Rodriguez donning red fedora and trench coat of Carmen Sandiego https://t.co/iGl4tQ1uIU https://t.co/xlY8E4wuUo","@nikhilhmakwana","cultural-icon",
"Where in the world.... #hats #santamonica #la #Latina #carmensandiego #lifeincolor #fullfigured… https://t.co/05fIt1aufo","@MassielNH","fashion",
"but are the Clippers exploring a trade for cap space? the Cavs can be carmen san diego all they want, nobodies knows where she went tho.","@ChuckShots","travel",
"1. Gina Rodriguez is awesome 2. I absolutely loved Carmen Sandiego as a kid 3. There may or may not be video footage of me singing the theme song wearing a hat and a sweet pair of sunglasses and using a marker as a microphone when I was 5 or so https://t.co/HXHT7UnXXR","@dbrobst92","cultural-icon","x"
"I look up to Carmen Sandiego. She was intelligent, cunning, ambitious daring and #snatched. Still looking for that bad red trench coat.","@LoyalToddler","fashion","x"
"Stranger Things Star Joins Netflix's New Carmen Sandiego Animated Series #stranger #things #joins #netflix #carmen… https://t.co/Tzc25tHP6I https://t.co/UpuURRiDdi","@mezomefans","cultural-icon",
"The First Images of Netflix's Carmen Sandiego Are Here Carmen Sandiego has been found, and she's looking good on Netflix. Gina Rodriguez will make her debut as the new voice of the iconic globe-trotting thief in the new 20-episode... https://t.co/gg9QJGNvxg","@BarrWarren","cultural-icon",
"Carmen Sandiego makes her way to Netflix in 22-episode series - Inside the Magic https://t.co/aA1mdksGm6","@TreadwayInd","cultural-icon",
"@VixenRogue Geography was my wheelhouse back in the day lol. When I was a kid, I so desperately wanted to be on Carmen Sandiego haha","@ep504","cultural-icon",
"VIDEO: 10 Reasons Where in the World Is Carmen Sandiego? Was the Best Educational Show Ever https://t.co/7wzGzMFwuG via @People","@justmerebear","edutainment",
"I JUST REALIZED THAT CARMEN SANDIEGO IS IN THE BACKGROUND OF THE ALOLAN DUGTRIO COSPLAY???????","@silencedrowns","fashion",
"@Emperordaein Thankfully, Ducktales looks like it'll be good and I'm interested in the Carmen Sandiego Netflix Original.","@PikaHikariKT","cultural-icon",
"NEW CARMEN SANDIEGO SERIES ON NETFLIX I WANT IT NOW https://t.co/eYiJW9e4Ol","@JAClark_13","cultural-icon",
"Who's my #hero? Carmen Sandiego https://t.co/C2cYhcgUQz","@TheAlebrije","role-model","x"
"@MatPatGT @CordyPatrick @jj_parks @chriswidin Game requests for #GTLive: The Oregon Trail, Carmen Sandiego, Museum Madness - I thought it'd be fun to relive those 90s games you could find on any elementary school computer. 😂 Def would like to see more childhood nostalgia games.","@erinlani","cultural-icon",
"So @HereIsGina is live-actioning my girl Carmen Sandiego. I’m on the fence cuz I haven’t seen Gina in a villainess role. I expect a Spy Kid/Catch That Kid kind of feature but hoping more for a Ocean/Gone in 60 Seconds heist. Never say never, Player! See you next crime https://t.co/mAgt4TMIZX","@Mojavi_8","cultural-icon",
"Okay. I still have NO ideas for a Mardi Gras costume. I was thinking Carmen Sandiego, but idk that people will get it.","@PasDeOops","fashion",
"@ROEnetwork Still holding out for Carmen Sandiego style Ada. Hope that coat is red.","@LeonKiske","fashion",
"Where in the world is Carmen Sandiego? All clues lead to Netflix (And Gina Rodriguez.) https://t.co/AHpjuzuSxN by #enews via @c0nvey https://t.co/F7fn0Fuixb","@PinkliaOficial","cultural-icon",
"Congrats to @HereIsGina on landing the starring role in Carmen Sandiego on Netflix! Good luck and have fun! https://t.co/7sTobWl4rR","@boliver36","cultural-icon",
"Netflix Reboots 'Carmen Sandiego' With Gina Rodriguez https://t.co/cyODpb8Cm7 https://t.co/T0A5NznmOp","@morganakather","cultural-icon",
"[Variety] ⒸⒸ↪ ‘Carmen Sandiego’ Animated Series Greenlit at Netflix, Gina Rodriguez to Star https://t.co/JVCGI2nUfA ↩ @clubcritica","@clubcritica","cultural-icon",
"@sistersingeek @donttrythis @Comic_Con The costume he will spend most of the con hiding in. Like a geeky where's Waldo/Carmen Sandiego","@LokiDragon","cultural-icon",
"Netflix's CARMEN SANDIEGO Animated Series Gets a Poster, Seven New Images, and a Premiere Date https://t.co/2wEnxjprY0","@mattseay_91","cultural-icon",
"there is only one person allowed to wear a fedora and that person is Carmen Sandiego","@hexeaktivitat","fashion",
"Just saw a woman wearing a trench coat and fedora at the corner of Windsor and Beverly, in case anyone's still looking for Carmen Sandiego.","@EvanJKessler","fashion",
"Imma let you finish, but Carmen Sandiego is the greatest female video game character of all time https://t.co/8qj5WgGgE7 https://t.co/j64P1hhlgc","@Every_Game_News","role-model",
"Forget QAnon. Here's the REAL conspiracy! Time travel is real, and Carmen Sandiego's creator tried to warn us!","@FiefdomOfSpeech","cultural-icon",
"@somnuszzz @harrismint Could also attempt Carmen Sandiego if we wanted an geographically educational hunt: https://t.co/PwBe21H7uX","@TuskCulture","edutainment",
"Lowkey moves with my uncle #airport 👀👀👀 #carmensandiego http://t.co/DZOWmyw6zP","@fashionfirstpls","travel",
"New ‘Carmen Sandiego’ Coming to Netflix in 2019 https://t.co/JHy5PVTirs https://t.co/7CfkZ50Hbr","@comicvault","cultural-icon",
"The Where in the World is Carmen Sandiego Bowl. #RejectedBowlGames","@SqueeksMcGee33","cultural-icon",
"Today I think I saw Carmen SanDiego boarding a bus in northern Virginia. She works in finance, y'all","@thecountesscoco","travel",
"Sounds Like Netflix Is Bringing Back 'Where In The World Is Carmen Sandiego?'... https://t.co/xggWDrPLwq","@CPA_King","cultural-icon",
"In addition to providing her animated voice, Gina Rodriguez will play Carmen Sandiego in a new movie: https://t.co/VQ69vr3JtL https://t.co/3MIkTxxdH4","@empiremagazine","cultural-icon",
"@RIDE0RDIETY wow I come home and you go on another trip? You really Carmen Sandiego now I see🤔","@OctobersOwn","travel",
"YAY!! Sounds like Netflix is bringing back ""Where in the World is Carmen Sandiego?"" https://t.co/1R8RCuHk6w via @HuffPostEnt","@bethanylynn29","cultural-icon",
"[CHIKA MINUTE] 'Jane the Virgin' star to voice Carmen Sandiego in new Netflix series https://t.co/CHieUTbx2M | via GMA News","@PHShowbizNow","cultural-icon",
"Netflix's 'Carmen Sandiego' debuts on January 19th, 2019 - Engadget https://t.co/0gNwS5mqZb via @GoogleNews","@willishl","cultural-icon",
"@RawStory I swear she’s Carmen Sandiego. Always traveling but nobody knows where to and for what purpose. https://t.co/No5NtwvUWw","@Napsterrific","travel",
"Carmen Sandiego is coming to Netflix and the actress voicing her is perfection https://t.co/3Gxupo43yt","@jinanasmawati","cultural-icon",
"Halloween photo on @Snowden's girlfriend's Instagram. She's Carmen Sandiego, he's Waldo https://t.co/hCc0xqDtFW https://t.co/qxpN8Yn1tK","@fryan","fashion",
"Got my carmen sandiego coat, little bit small but it will do","@Redback","fashion",
"@webcomicchat Q5: @ArchieComics, @Garfield and Peanuts @Snoopy comics have always been a big influence for me. Another non-comic influence for me is ""Where in the World is Carmen Sandiego?"", as my comics are about traveling to different countries of the world. (#90skid lol) #webcomicchat 🍭","@Lollipop_Comics","travel",
"@yev_volgin hello CArmen Sandiego can you please tell ANDREW to look at his iMessages thank you","@Fitz814","cultural-icon",
"OH MY GOSH I JUST FIGURED IT OUT Carmen Sandiego is a red teamer to train everyone else!","@websterleone","cultural-icon",
"Dear Programmers: Please make modern(er) versions (android apps ideal) of Wishbone and Carmen Sandiego games. I have a kid now. Thank you.","@mactavish","cultural-icon",
"I feel very Carmen Sandiego today. I just need a really big hat. 👒","@kerryhishon","fashion",
"So far on the train: Jack & Sally, solid snake, Carmen San diego, and Scooby-Doo (plus our costumes)","@Ritz_Tweeting","fashion",
"For how much I enjoyed watching Where In The World is Carmen Sandiego as a child you would think I’d be better at geography.","@aaronnelsen","cultural-icon",
"@kevinolearytv helped to kill the companies that made #CarmenSandiego #OregonTrail and #StorybookWeaver He hates children.","@ajnevin","fashion",
"In the promo for #AgentCarter last night, I thought that in that red hat she looked like Carmen Sandiego - as in Where in the world is....","@The1Russter","fashion",
"Last night I dreamed that I was wandering Florence in Bedelia's blue Carmen Sandiego outfit. Can I go back to Italy now, please?","@Kbethery","fashion",
"Lady Gaga Swiped Her Hat And Trench From Carmen Sandiego’s Closet https://t.co/ZFNWCYMIT3","@MoviesGuru","fashion",
"Gina Rodriguez to Reportedly Play Carmen Sandiego in Brand New Netflix Animated Series https://t.co/KlFMRvsk23 via @TheMarySue here for this","@ReelTalker","cultural-icon",
"Karlie Kloss Pulls a Carmen Sandiego On Us, and It's Amazing http://t.co/L8mS1IP1HD #fashion","@Fashion__Agent","fashion",
"Unpopular opinion(?): Where in the USA is Carmen Sandiego is the superior PC game. Also. Netflix is said to revive it. Hells yeah.","@Gateskp","cultural-icon",
"#WhatIThoughtWhenIWas18 Thank you youtube for bringing Where in the World is Carmen Sandiego back in my life","@theRealiHeart","cultural-icon",
"No one made any Carmen SanDiego comments about my photos today in a trenchcoat, tbh a little surprised.","@_lizharvey","fashion",
"Children of the ’90s Rejoice, For Carmen Sandiego Is Getting Her Own Animated Netflix Series #robots https://t.co/axb7zC0k1C https://t.co/ZJYRMGRKWu","@_SleauxMeaux","cultural-icon",
"Found an old hard drive. Now we are playing Carmen Sandiego.","@jeremygroverboy","cultural-icon",
"Favourite children's program of the 80s and 90s? Mr. Dressup? Carmen Sandiego? Reading Rainbow? #ThrowbackThursday","@michaelkwan","cultural-icon",
"Carmen Sandiego, unexpected feminist? Check out how this villainous pop culture icon was so formative and important for millennials. #CarmenSandiego #FemaleCharacters #WomenInHollywood https://t.co/9sowTMGSzL","@BrainMagicMedia","role-model",
"VIDEO: 10 Reasons Where in the World Is Carmen Sandiego? Was the Best Educational TV Show … https://t.co/xXbkFIbYv6 https://t.co/UXQFgdDjLV","@simonrob78","edutainment",
"Netflix is making a Carmen Sandiego movie with Gina Rodriguez - CNET https://t.co/nyshyxFbF5","@Trending_Global","cultural-icon",
"First half analysis: Erin Andrews is wearing a Carmen Sandiego costume. Terry Bradshaw ate a bunch of red pistachios before halftime.","@TGJamison","fashion",
"engadget: Netflix finds 'Carmen Sandiego' for its latest reboot https://t.co/gSmsTMmyfW https://t.co/QigMoVEccp","@Point_tecno","cultural-icon",
"Um, yes. I pretend I'm Carmen Sandiego every time I wear mine. Doesn't everybody? https://t.co/SJR0Q3TEu1","@pipifelix","fashion",
"@YohanesSulaiman just found out who Carmen Sandiego is. So she's actually Waldo, right?","@YOlivia28","cultural-icon",
"@swooper_d @Maxou_AbwFr @davenolan17 @GtoTheNextLevel @16bitnostalgia @ColonelFalcon @CardiacDrop @BloggosPow @Lt_Ironfox @Kuniotchi @SNUKgaming Here's a game I just got. Carmen Sandiego! https://t.co/jpX7UdMrp9","@CdMega","cultural-icon",
"Remember how we had those Cluefinders, Reader Rabbit and Carmen Sandiego games to learn things while growing up? Where are those games now?","@LeClairJoshua","edutainment",
"A dude tried to buy my flannel off my back. He then pointed to a girl who looked like Carmen Sandiego and said ""she needs it to make a hat""","@rissuhhhhhh","fashion",
"Been around the world like Carmen Sandiego. https://t.co/cKnMB0dKQZ #mbmhmc #carmensandiego #travel https://t.co/olOUng2DI7","@MBMHMC","travel",
"@ukelyon Carmen San Diego taught me how to pronounce Riyadh.","@DustinLClark","edutainment",
"Gina Rodriguez Will Play Carmen Sandiego In Netflix Live Action Film https://t.co/cIPPruq7wU https://t.co/8mmgfJdwSP","@anthonysavvy","cultural-icon",
"@hobbyheroescast @Geekway awesome! I like that you guys did two unrelated charecters. all though Carmen San Diego & Charlie are both well travels so I guess they could bump into each other. 👍👍","@ministomp","travel",
"#etalk Kate Middleton Channels Carmen Sandiego for Commonwealth Day at Westminster Abbey: ... https://t.co/o9cD4k8we5 #Fashion #Celebrity","@Dubintertainer","fashion",
"Yes @HereIsGina Latina in a live action film👏🏽 so excited 🤗 #CarmenSandiego https://t.co/cVMYoFGpUt","@vbarr111","role-model",
"@reillycosgrove Carmen Sandiego who! You did that! 👏👏👏","@emmasoawkward","cultural-icon",
"red herring for Halloween. or Carmen SanDiego. whatever. https://t.co/l3zh8ylawc","@tabjuh","fashion",
"Okay what the hell? THIS IS A THING? Carmen Sandiego on Netflix? https://t.co/bg16y8a1y1","@akeyboardcat","cultural-icon",
"Daily Podcast: Captain Marvel, Stranger Things 3, Solo, Star Wars, Carmen Sandiego, Netflix, and Pacific Rim Uprising – /Film https://t.co/iRJuIoAvhv","@mparel","cultural-icon",
"Netflix's Carmen Sandiego Reboot Has a New Premiere Date and Some Mysterious Teaser Images https://t.co/LYsCuwQUbE","@Stitched","cultural-icon",
"@jtemplon 9/18...and in true Carmen San Diego fashion...done in by the African continent.","@daniel_platt","fashion",
"Where in the World Is Carmen Sandiego? Becoming a Secret Travel Agent https://t.co/E6ByFlavSO https://t.co/VrLU2peBRr","@DobieCrypt","travel",
"Little does she know, back in elementary I ALWAYS found Waldo and Carmen San Diego 😏👌🏼","@InSight_Music","cultural-icon",
"@nicksays_summer Omg. Totally read that in ""Where in the World is Carmen Sandiego"" tune LMAO","@bcase82","cultural-icon",
"Netflix Could Be Bringing Carmen Sandiego Back https://t.co/myEZtb31G0","@EdGamer","cultural-icon",
"Gina Rodriguez to star in live-action ‘Carmen Sandiego’ Netflix film https://t.co/Joqx0nZTLr","@go4viral","cultural-icon",
"Where in the World Is Carmen Sandiego was a trip. The format was genius. It was like a game show, but Greg Lee and The Chief had these...","@JoeyWinterDay","cultural-icon",
"Next year I want to be Carmen San Diego for Halloween","@saramski","fashion",
"Erin Andrews looking like Carmen Sandiego in that hat. #GBvsSEA","@heyitsmarklind","fashion",
"Netflix finds 'Carmen Sandiego' for its latest reboot https://t.co/gFG6kjrJgx #engadget #tomgadget","@tom_taylor","cultural-icon",
"@4mxnute I wanted a big hat, cause her whole shtick reminded me of carmen sandiego","@MagiKoopa24","fashion",
"#CarmenSanDiego movie being developed by @Netflix with @HereIsGina #geekasm https://t.co/g8ttj990Vl","@tecknotot","cultural-icon",
"i hope they re-release old educational games like Carmen Sandiego and The Cluefinders, even though im old now i still wanna go and play them","@istoplukelisten","edutainment",
"In addition to voicing #CarmenSandiego in a Netflix animated series, @HereIsGina will play the criminal mastermind in a live-action film for the streaming giant https://t.co/dp652w66Ru https://t.co/GoFdJXfrTc","@MyTrackingBoard","cultural-icon",
"Check out ""Not Your She-Ro: @carmensandiego and the Importance of Feminism in Entertainment"" @syfy! We're so excited to be working on a TV show AND book series that promotes a strong, complicated female character (and stars @HereIsGina!) https://t.co/JndRo3e9O9 https://t.co/Advp1Y5piX","@HMHKids","role-model",
"This is a warning to all women wearing wide brim hats: I know that you are Carmen Sandiego or at the very least in cahoots with her.","@Blarebare","fashion",
"Ru is really serving some Carmen Sandiego realness in that hat. Work.","@softershade","fashion","x"
"MY UNCLE AND HIS FIANCÉ WERE WALDO AND CARMEN SANDIEGO FOR HALLOWEEN KILL ME","@tiatheditz","fashion",
"@bravescarmen @aubietiger1928 couple choices, Car-Car, Carmen San Diego, Sherri, Carl, Carpet or just Car.","@BrandonBravos","cultural-icon",
"Carmen Sandiego' Reboot Headed to Netflix: Netflix ordered an animated reboot of the Eighties computer game franchise Carmen Sandiego,… https://t.co/30E14Y1rWW","@CecilIsabel2","cultural-icon",
"*adds a giant Carmen San Diego hat to my Amazon wish list""","@CamCron","fashion","x"
"Netflix is betting on ‘90s kids nostalgia for learning with upcoming lineup https://t.co/kdHeX7bgYm","@Legendarygs","edutainment",
"@LadyHawkins But you won't like... TAKE it, right? It'll still be there when you leave? Or do you plan to Carmen SanDiego style steal it?","@MrsLauraRoslin","cultural-icon",
"Found them again #whereswaldo #carmensandiego #halloweencostume https://t.co/unoGWNVxRI","@RTGr8","cultural-icon",
"@RyanRoach5 @space_sloth26 It's like Where in the World is Carmen Sandiego? for idiots. Complete idiots.","@raaadaniel","cultural-icon",
".@Netflix has released the first teaser art from their Carmen Sandiego animated series! Unfortunately this series won't be out till 2019. https://t.co/yOLM1qRNkn","@GeekOfOz","cultural-icon",
"What Netflix’s New Carmen Sandiego Show Will Actually Be About https://t.co/xutYGh7fnf https://t.co/rEyQnhbLCl","@ScriptFeed","cultural-icon",
"Kourtney Kardashian Takes Younes Bendjima on a Surprise Birthday Trip Oh, the places they'll go! Kourtney Kardashian channeled her inner Carmen San Diego for Younes Bendjima's birthday--and no, we're not talking about a role-playing fantasy.... https://t.co/0sBS9hWR4s","@Reynolds7Rodney","travel",
"literally sent myself an email to be sent to me october 1, 2017 to be carmen sandiego for halloween","@loafie19","fashion",
"I was real good at making paper planes in 4th grade & sold them for 50 cents to classmates, used profits to buy my bff a Carmen Sandiego hat","@too_lewd","fashion",
"#LittleMonsters, we think @ladygaga was def. channeling Carmen Sandiego. Who wore it better? http://t.co/xPOGkGRv2W http://t.co/HPUxF9qSE8","@PopCrush","fashion",
"Netflix Developing Live-Action Carmen Sandiego Movie https://t.co/d9QhFbcVzY","@artistinfrance","cultural-icon",
"Lady Gaga Is Really Into Dressing Like Carmen SanDiego Lately: A *millenial* Carmen SanDiego. https://t.co/6x8qHuSGQs #Fashion https://t.co/g1CZjENpWc","@amandasome","fashion",
"I wanna be Carmen San Diego for Halloween","@CocoCherryMango","fashion",
"At any given time I’m thinking about one thing: Kerry Washington in full Carmen San Diego cosplay","@BradClayton11","fashion",
"@expectproblems Where in the World is Carmen Sandiego's Hat? is a slightly less motivating title.","@hailtonothing","cultural-icon",
"@HereIsGina carmen sandiego annihilation someone great i love one netflix owner","@heresginas","cultural-icon",
"Netflix’s ‘Carmen Sandiego’ debuts on January 19th, 2019 https://t.co/GAG1iOtK69 https://t.co/N8qnHHiles","@viajandoperdido","cultural-icon",
"What You Learn Hunting Carmen Sandiego Without Google's Help https://t.co/oOUklGKJlc","@YMD_nigga","edutainment",
"Gina Rodriguez donning red fedora and trench coat of Carmen Sandiego https://t.co/acYjUiEGeY","@zatheteacher","cultural-icon",
"I reject this. Carmen Sandiego is a woman who leads a global network of associates, and we don’t know what she does with her acquired goods. She could secretly be a Robin Hood in a killer red trench coat. https://t.co/XCAFQAt922","@ModernMage","fashion",
"Happy Halloween 2014 everyone! Carmen Sandiego just stole Sherlock Holmes's heart...& wallet!… http://t.co/87GSDj8Axk","@C_Rodriguez76","fashion",
"‘Carmen Sandiego’ Animated Series Greenlit at Netflix, Gina Rodriguez to Star https://t.co/GUkiRp0V7Y https://t.co/5BMD3a9Lvs","@MoviesWrld","cultural-icon",
"Netflix plans live-action 'Carmen Sandiego' film with Gina Rodriguez '90s kids have even more to get excited about as Carmen Sandiego comes to Netflix as a feature film. Jane the... https://t.co/btpJ2NTIPu","@samymohab","cultural-icon",
"Already have my next Halloween costume planned out. Carmen Sandiego. My date&39;ll go as Where&39;s Wally. Always wanted to do that","@salvatorefo1228","fashion",
"Where in the world is #GinaRodriguez? The #JaneTheVirgin star is officially bringing #CarmenSandiego to life in a live-action feature about the thieving villain from the 1990s educational children’s series! // #HollywoodFirstLookFeatures https://t.co/9Key6GLpmZ","@HollywoodFLF","cultural-icon",
"Agent Carters hat reminds me of Carmen Sandiego. As long as Peggy stays out of Budapest we should be fine","@GeekGirlAgentM","fashion",
"""Welcome to Costume World. How can I help you?"" ""Can't decide between Carmen San Diego, Waldo, Santa Claus, or LL Cool J in I'm Bad video."" https://t.co/yX2YMR23Ak","@chachoficial","cultural-icon",
"Lady Gaga Swiped Her Hat And Trench From Carmen Sandiego’s Closet https://t.co/xSILqChY3Q","@wavesharing","fashion",
"Cause of the #CarmenSandiego discussion, I'm really feeling my childhood heroes today. The stories that make you love stories are the best. https://t.co/pkM1y4KFcK","@BayAlden","cultural-icon",
"Netflix Is Reportedly Reviving Carmen Sandiego With Gina Rodriguez https://t.co/BE8nFkcr7w https://t.co/k8muB3dZjb","@WMTWTV","cultural-icon",
"@ColleenDoran Tale of Genji by Murasaki Shkibu (thank you Carmen Sandiego). And a woman created science fiction","@DanielKalban","edutainment",
"Attending a party as Carmen Sandiego #Halloween https://t.co/jAWGGEHqSY","@ashleyinNL","fashion",
"Like Carmen Sandiego: where will I end up next? 😎 👠 All I’m missing is a red trench coat! See you 4pm-6pm at the Monroe County Clerk’s Office #ROC #NewsLife https://t.co/mJ73fOvEqP","@jeanniemcbride_","fashion",
"These graphics tho!!! #carmensandiego awww man im estatic right now #smallthingsmakemehappy http://t.co/B5PIhmqOzU","@OnSumBoogShiT","cultural-icon",
"Gina Rodriquez is becoming Carmen Sandiego in a Netflix show & im so happy!! 🤗🤗","@_aysiaboo","cultural-icon",
"@composerose that's right, trilby. I cannot let the fashion choice of my personal hero Carmen San Diego be besmirched. :p","@EmpressSudol","fashion",
"Star>TV News:Netflix's Carmen Sandiego Animated Series Gets >> https://t.co/ImxHEOh2n3 #celebrities https://t.co/QeTBbzJJhy","@StarsTVMag","cultural-icon",
"Just booked a flight to NYC for the weekend before I head to Tel Aviv this summer! Move over Carmen Sandiego! #havepassportwilltravel","@txkelli","travel",
"@Rarely_Ordinary I texted you early today. I figured you were doing your carmen Sandiego traveling the world lol","@Malachi_Garcia","travel",
"@annaVthorn @ChicagoNemesis My Carmen San Diego hat","@Skyinflatballaz","fashion",
"Gina Rodriguez will produce and star in a new live-action Carmen Sandiego film for @netflix. https://t.co/HtMvUm06yK","@MomentsAU","cultural-icon",
