"text","handle","category","star_tweet"
"Last-Minute Halloween Costumes Waldo and Carmen San Diego - Waldo's the easiest costume ever and people will... http://t.co/sicZjCxd63","@CompassOKC","fashion",
"Every time I hear a #Penatonix song, all I hear in my head is “where in he world is Carmen Sandiego”. @RockapellaMusic","@uganole","cultural-icon","x"
"Where in the world is Carmen Sandiego? She's at FrightWorks in Knoxville. #happyhalloween http://t.co/E0yqbpMqoE","@nomadbykate","fashion",
"@RockapellaMusic Your Carmen Sandiego theme went metal. Thank you for the memories. https://t.co/3rAM6LZ3iB","@markedman247","cultural-icon",
"@SandraMuiMui @DaddyDaddymac Sandra I just have to say, everytime you tweet and your picture comes up, with that hat slightly pulled down, I immediately think of ""Where in the World is Carmen Sandiego"". I don't know why, just had to let you know that.","@JoeMamaQA17","fashion",
"What was the most memorable educational game? #Oregontrail #CarmenSandiego #ReaderRabbit","@CONtvChannel","edutainment",
"#WayBackInThe80s Everything I learned about geography, I learned chasing Carmen Sandiego across the United States, and then across the world.","@FebWriter","cultural-icon","x"
"@Company971 @CommonManRadio Tell Lori Schmidt that Carmen San Diego wants her hat back.","@MEATBAT24","fashion",
"In the airport. Is Carmen Sandiego?""","@1yvadaka","travel",
"Erin Andrews and her Carmen San Diego hat can suck it!","@amandajulson","fashion",
"@iglvzx carmen sandiego is a lesbian icon but she's also a cop who steals from indigenous cultures purely bc she's bored","@MarkLoafers","role-model",
"Inspired by my longtime 💖 of #CarmenSanDiego, I've created @YouTube playlist #game called, 'Find Amara' ~ where you watch other creators videos & try to spot me... take that Waldo: https://t.co/jI7S1rJDlG 🔍🤔🎬 Best Adventures, @AmaraInSeattle & #AmaraNotInSeattle 😉 https://t.co/4C2E9ahXYl","@AmaraInSeattle","cultural-icon",
"Peggy's hat is giving me Carmen Sandiego feels.","@Calila1988","fashion",
"Where in the world is Carmen San Diego... #halloween #carmensandiego #iheardshesinhouston #catchherifyoucan ... 😏 https://t.co/9ilSq3r78N","@ladiiA_X0X0","fashion",
"Sign up for the Everyday Explorer newsletter: https://t.co/HcTlHIbBt7 Lot's of Carmen Sandiego gifs and mentions await.","@theLeighWright","travel",
"#bea16 ! Find me in the Carmen Sandiego hat and get a bookmark! #whereintheworld @ McCormick Place https://t.co/JrIhecf0Ra","@zlikeinzorro","fashion",
"@Rockets2Writing Nice! I did Inspector Gadget last year and Carmen Sandiego the year before that. Decided NO MORE TRENCH COATS. Too hot!","@wendyqualls","fashion",
"I need some boots for my carmen sandiego costume, but I'm far too uncertain of my size to order online.","@Redback","fashion",
"Where in the World Is Carmen Sandiego? Becoming a Secret Travel Agent https://t.co/ivL0Oln2d3 (cmts https://t.co/f0R89vr4Tf)","@newsycbot","travel",
"Carmen San Diego's name has got to be based on Camino de Santiago, right? I just learned about the latter (via the Wikipedia of an Emilio Estevez film, of course) and my mind is BLOWN with the potential.","@MarkCVolain","cultural-icon",
"Seriously, Carmen Sandiego is a really good villainess.","@idamork","role-model",
"Where is world is Carmen San Diego? Where's Waldo? #cosplay… https://t.co/F7F0XjxJfX","@ninjaman1994","cultural-icon",
"VIDEO: 10 Reasons Where in the World Is Carmen Sandiego? Was the Best Educational TV Show Ever https://t.co/t4gL4WNbx3","@PoukuladisKaris","edutainment",
"VIDEO: 10 Reasons Where in the World Is Carmen Sandiego? Was the Best Educational TV Show … https://t.co/V66UZ0yWm8 https://t.co/YroTCxTHMC","@mrrobertbrunell","edutainment",
"#WhenWeRunOutOfHashtags We will have found Waldo, Carmen SanDiego, who let the dogs out, where the car is, the killer of Inigo Montoya's dad","@RandilynIsIn","cultural-icon",
"@JesonthePage I have some super nice faux leather ones I got off ebay years ago for my Carmen Sandiego cosplay and they are FULLY phone interactive.","@cakeandmadness","fashion",
"@shelbyholliday Next yr for Halloween please be Carmen San Diego.","@CJ_Powell","fashion",
"When others were 1st playing Sonic & Mario, I was playing Where in World is Carmen San Diego, Oregon Train & Kid Pix, & learning Basic","@KnownGoodGeek","cultural-icon",
"Taking the Carmen San Diego hat out for a spin #whereintheworld","@christineshead","fashion","x"
"Carmen Sandiego is still bae","@MoSallah7","cultural-icon","x"
"Feeling very Where on Earth Is Carmen Sandiego? #summerhat #hats #strawhat #hatsofinstagram https://t.co/x82RZSyCP0","@susankalexander","fashion",
"Hmmmmm. So it’s b/c you’ve been makin Carmen San Diego for Africa you want to come and challenge me and my travels . Lol na wa for dis new Tayo wey dey stunt like dizzzzz","@ImRealSassy","travel",
"Just thinking about how I dressed up as Carmen Sandiego for Halloween last year and nobody knew who that was. http://t.co/dNCWGpDMGr","@OliviaHelen27","fashion",
"Where in the world is #carmensandiego? Try Looking at #GothamCity jail. #dallasfandays #dallasfanexo #cosplay fanexpodallas #fanexpodallas #fanexpo Carmen is @tranimation and GCPD is… https://t.co/tzLDoK6KlA","@misspmjcosplay","fashion",
"Lady Gaga Is Really Into Dressing Like Carmen SanDiego Lately: A *millenial* Carmen SanDiego. https://t.co/6x8qHuSGQs #Fashion https://t.co/g1CZjENpWc","@amandasome","fashion",
"@SpanglyAgent Wow, I like it Mrs. Rogers, the hat and the dark reminds me of Carmen SanDiego...though, she might be a bit new to yourself.","@ZenginXcelladon","fashion",
"@lausyllama Hahahahaha nuuu you can be Carmen Sandiego the anti-hero in 'Where in Time is Carmen Sandiego'","@ijechinn","cultural-icon",
"@AshsStash Or Carmen Sandiego! Do you have a large red hat to go with it?","@cabe_bedlam","fashion",
"@KrystalShelbs traveling the world like Carmen Sandiego! https://t.co/b06g02amWE","@aimee_costa","travel",
"@MsLSpatz @heathermgirls @KatBarrell I remember watching Where in The World is Carmen Sandiego on TV! Gaah!! 😂😂😂😂 Halloween costume idea!!","@buttercup363","cultural-icon","x"
"Carmen San Diego lost her hat... #whereintheworld #NJPATH #NYCmetroart #girlabouttown #seeninpassing http://t.co/HspBPj29TT","@simonemarteen","fashion",
"@Chrisrubery I hope it's International Woman of Mystery, Carmen Sandiego (as performed by Katya Virshilas in a large hat).","@marksiddall84","role-model",
"https://t.co/qE0437xWol What makes you #travel? For me, it's to learn. via @HuffingtonPost #worldcitizen #CarmenSanDiego #ineedavacation","@allezelizabeth","travel",
"Someone on my bus is dressed as Carmen SanDiego... Halloween is in 3 wks, so I can't help but speculate as to whether that was her intention","@monogato","fashion",
"I'm at this show ... AKA captain hat low looking like Carmen Sandiego.","@DidIASQ","fashion",
"Carmen Sandiego is a mirror of Selena Kyle sans costume. If you love Catwoman as an amoral thief, there's no reason not to love Carmen for the exact same reason. She doesn't need to be a ""hero.""","@jskylerinc","role-model",
"Apparently I'm Carmen Sandiego. I already have the heels and the need to travel, just need the boss red trench coat and hat. https://t.co/efhS6vr6aU","@lilbitnc","fashion","x"
"Riddle me this....Where in the world is Carmen Sandiego? #happyhalloween #carmensandiego… https://t.co/TUWgJ4EfTF","@axtell_k","fashion",
"Imma start wearing those Carmen Sandiego hats like Future","@LosoRuiz","fashion",
"#TBT to Janese Swanson, inventor & founder of Girl Tech + co-developer of the first Carmen Sandiego educational games. #womenintech https://t.co/0GSwx78YHd","@girldevelopit","cultural-icon",
"@spectacles_ak I am waiting for some picture of Rarity with the same dress and hat as Carmen Sandiego.","@Gworkag","fashion",
"After so many ""Carmen Sandiego"" hat jokes, I decided to role with it for #Halloween. https://t.co/SzAcBq5BiQ","@MaOnTheAir","fashion",
"VIDEO: 10 Reasons Where in the World Is Carmen Sandiego? Was the Best Educational TV Show Ever via PEOPLE.c… https://t.co/tDgFHJNWOm","@GrasslandDesign","edutainment",
"1070827218912378880","Chuck Norris always knows the EXACT location of Carmen SanDiego.","cultural-icon",
"Day seven as Carmen Sandiego. Try to catch me, detectives. #Halloween #challenge http://t.co/idbXuTX3oO","@jpuffbsb23","fashion",
"This elusive criminal mastermind decked out in red is here to teach a thing or two, as I take a look back at Where on Earth is Carmen Sandiego. This article covers the #cartoon and a little about the character that has stuck with me through the years. https://t.co/fiypruqCOC","@StephenWilds","edutainment","x"
"DIY #Halloween: Carmen San Diego. Because everyone loves a woman with a good sense of direction. https://t.co/wOF0uDUlZO","@gslovesme","fashion",
"@Bizapalooza A2: Mine was this computer game called ""Where in the World is Carmen Sandiego?"" I learned a lot about different countries and their culture!! #BizapaloozaChat","@BossMovesMovmnt","edutainment","w"
"The real life version of Where in the World Is Carmen Sandiego is trying to keep up with @vanessadaves travels. http://t.co/XVBiUcij4R","@jonpoarch","travel","w"
"Did anyone actually ever find Carmen Sandiego or is she still on the run? #EdTech #90sEdTech https://t.co/uKfhWimxtS https://t.co/wUyIym4CdJ","@banqer_app","cultural-icon",
"@Ninja_Chris_ she reminded me of Carmen Sandiego, with her whole outfit, I may check it out then it looks good","@antholilmonster","fashion",
"@Cantplaypiano lol thank you sir. I'm endlessly hoping for a serious and badass Carmen Sandiego film. Let's cheer for the ""villain"".","@hopeduckie","cultural-icon",
"@evankirstel @BoingBoing I grew up on games + Cross Country USA, Oregon Trail, Chivalry, Carmen Sandiego.. they were educational tools","@mbreingold","edutainment",
"@LaurenGoode @CaseyNewton Mark Zuckerberg and Sheryl Sandberg should be Where’s Waldo and Carmen San Diego for Halloween.","@LessThanLiz","fashion",
"That one time I fought the Evil Dead with Carmen Sandiego. #tbt #Halloween http://t.co/rpyQkfYyq8","@rockhollywood8","fashion",
"@Netflix_CA is bringing back #CarmenSandiego! 4/5 #travel agents agree, #passion for #adventure started here | https://t.co/nhw3SdZ9mW https://t.co/eVVrWqJPIr","@FCRoncesvalles","travel",
"I’m picturing CCH Pounder as boss / remote contact, because in my brain she connects to traveling spy (Carmen SanDiego??)","@OfeliaPnj","travel",
"@TeamZarbi @MainEventTV_AKA @Coolmanx5 @ashelia doesnt stop fun edutainment like Math Blaster, math circus, carmen San Diego, zoombinis, etc","@sie_kensou77","edutainment",
"Where in the world is Carmen San Diego kinda night. 😏🌎🌙|| #smize #beard #hats #smirk #trou… http://t.co/DToyRz0U42 http://t.co/LYVuJyrpkc","@andrewcurryla","fashion",
"Carmen Sandiego is my style icon. https://t.co/YQl0QvxjKA","@ailbhetross","fashion",
"No way phenomenon means exploring a cave @KenTremendous didn't you learn anything about spelunking from playing Carmen Sandiego?","@alexanderbasek","edutainment","x"
"@EarlNoahBernsby 1. I wish. Carmen SanDiego wears a red trench coat & Sandra Bullock is Carmen San Diego 2. Google http://t.co/fLdyyszhJd","@SeannSara","fashion",
"BEYONCE FELL DOWN A FLIGHT OF STAIRS IN A RED CARMEN SAN DIEGO COAT. WE DON'T CARE ABOUT WHAT SHE ALMOST DID.","@applebumebonita","fashion",
"I learned where a lot of places are from Where in the world is Carmen sandiego","@Caesar__Cam","edutainment","w"
"I just learned that Mavis Beacon was not a real person...now I’m questioning my entire childhood. 🧐 What’s next, gonna try to tell me Carmen Sandiego was a fraud too?!? https://t.co/dVoy2mFNXi","@fretcrazy","cultural-icon",
"There's no doubt that #CarmenSandiego was great way to keep young gamers educated while having fun playing #Gaming http://t.co/CHv9cjBvDY","@Scootablu","edutainment","w"
"If you have an Alucard cosplay, then you also have a Carmen Sandiego cosplay.","@ChristophPrime","fashion",
"556927619271507968","@brokeymcpoverty I played Where in Time is Carmen Sandiego with my kid the other day. It was the best.","cultural-icon",
"@jasonbenetti @BatsRadio I thought you were a globe-trotting criminal mastermind in a big hat and trench coat #CarmenSandiego","@ryanmitchell75","fashion",
"@Daisydukeeeees see, that was easy. I'm tryna get you this travel business Carmen sandiego 😂😂😂","@Gib215","travel",
"I'm happy the Carmen San Diego hat is finally an accepted fashion accessory for women. #aheadofhertime","@usernamedchris","fashion","x"
"I want a Carmen Sandiego game where she travels the world taking fedoras back from MRAs.","@StabbinsMcGee","fashion",
"Carmen Sandiego is a millennial role model.","@WiseWyzard","role-model","x"
"Relationship goals! I dress up as Carmen Sandiego. Partner in crime goes as Waldo. Bonus points: gender bender. Hells. Yes.","@Violinagin","fashion",
"Who In The World Is Carmen Sandiego? CEO, Intellectual, & America’s Most Positive Latina Role Model http://t.co/SliBvUcIPe via @TheMarySue","@Sally26622460","role-model",
"Where in the World in Carmen Sandiego? #CarmenSandiego #gamer #gamedev #PC #education","@sjfostersound","cultural-icon",
"@sethasfishman @DjangoWexler If you aren't dressed in a Waldo or a Carmen Sandiego costume, you're missing a perfect opportunity.","@bryancamp","fashion",
"I want to disappear for a full week. Carmen sandiego style.","@QueenBriana23","cultural-icon",
"Odd question: is Carmen Sandiego the highest-profile Hispanic villainess?","@chadbonin","role-model","X"
"Watch out for @GlennThrush he's obviously the best investigative journo. He found Carmen Sandiego and wears her hat as a trophy(Just a joke)","@JoPhSa","fashion",
"I'm thoroughly convinced that Chuck Norris, Carmen Sandiego, Waldo, and ninjas are like in the biggest game of hide and seek ever. XD #MLIA","@thatonemusickid","cultural-icon","x"
"@hunicke straight up like Carmen San Diego but hunting a more dangerous Omega Carmen San Diego with fabulous world travel skills","@MaxGeiger","travel",
"For Halloween, I would like to do a couple costume of Where's Waldo/Carmen San Diego, but where we just don't show up to any parties.","@wyllinois","cultural-icon",
"@colorsoloud Is it part of a Carmen Sandiego costume?","@clawphd","fashion",
"Sick so no Halloween. 😕 Was going to go as Carmen SanDiego. Still works because now friends can wonder where in the world I am. #Halloween","@FeralCherylZ","fashion",
"I'm just a red coat away from stealing national treasures and running around the world to escape. #CarmenSanDiego #90skid #90sNostalgia https://t.co/1feq3GjoSr","@springinsnow","fashion",
"Signs you're old: When a co-worker only knows of the character Carmen Sandiego as ""that woman in the red hat & jacket.""","@HartKnight","fashion",
"Safe Travels Carmen Sandiego💋@a_SKY_walker: Early morning flights are disrespectful…..”","@CocoTheCure","travel",
"WITW/WIT is Carmen Sandiego pitch: Carmen's time travel let her see 2017 coming; everything she stole was to create a survivor colony","@AdamShaftoe","cultural-icon",
"@AlexisDelCid Is that hat from the Carmen Sandiego line?","@michaelburgett","fashion",
"Where in the world is Carmen Sandiego? Why hangin with Axel Rose of course🌎 #happyhalloween @… https://t.co/WzBJI6Xq48","@PrettyConnected","fashion",
"GINA RODRIGUEZ IS GOING TO BE MY CHILDHOOD HERO, CARMEN SANDIEGO https://t.co/Xn8j0J111n","@ktammm","role-model","x"
"@midnight Where in the WWW is Carmen SanDiego? (On Safari looking for a Firefox, with her Chrome Explorer) #TechTVShows","@JohnCDupre","cultural-icon",
"This year is all about trying to be Carmen Sandiego #CatchMeIfYouCan ✈️🚢","@samari_says","travel","x"
"our stylist chuy has been calling me carmen sandiego all day mebe ill go 100 on Halloween","@mayalynne","fashion",
"We never found Carmen Sandiego because she dressed up as Where's Waldo and slipped away forever.","@Cecconi140","cultural-icon",
"Looked up from my phone to see a woman in a giant fedora and a long red coat. I FOUND CARMEN SANDIEGO!","@chicazul","fashion",
"If I had a kids cartoon I’d take inspiration from Carmen Sandiego and call it “Where in the World is My Lighter?”","@ondireplay","cultural-icon",
"I’ve been at #GenCon four minutes and I’ve seen not one, but, TWO Carmen Sandiego costumes.","@chris_corwin","fashion","x"
"@AvaWBAL @wbaltv11 That is the perfect outfit for today! Awesome creativity. #CarmenSanDiego","@kimbearlyw8","fashion",
"Costume idea for Comic-Con: you and your significant other dress as Carmen Sandiego and Waldo, and walk around the place all day, telling people how happy you've been since you found each other.","@Wh0v1an_4_L1fe","cultural-icon","x"
"Gina Rodriguez donning red fedora and trench coat of Carmen Sandiego https://t.co/t6BC69rzhJ","@ALErtMarketer","cultural-icon",
"The third image from my colab with @garypeppergirl with an illustrated hat by me. A little Carmen Sandiego for... http://t.co/NhCsbG3AwV","@kellythompson1","fashion",
"Do you think Harry ever played where in the world is Carmen sandiego bc he seems to have similar patterns of traveling","@mgargoonsquad","travel","w"
"@andy_nortcliffe “@andy_nortcliffe: @PhillGray it's like where in the world is carmen san diego. http://t.co/GPr3YHbayL” I need a red coat and hat","@PhillGray","fashion",
"I just wanted to be Carmen Sandiego for Halloween but I can't find any quality red trench coats that won't cost me $100 & my life is over.","@marissaRmilano","fashion",
"VIDEO: 10 Reasons Where in the World Is Carmen Sandiego? Was the Best Educational TV Show … https://t.co/F9PnzeXpEj https://t.co/RvXAMdVn0o","@JetaimCentral","edutainment",
"So excited that @HereIsGina is going to be Carmen Sandiego! I dressed up as her for Halloween as a kid! https://t.co/CMXX9VzPKy","@SabreBeauty","fashion","x"
"Netflix is betting on ‘90s kids nostalgia for learning with upcoming lineup https://t.co/0EwY3VqFEr via @Polygon","@korvin_7","cultural-icon",
"@cavykatie @cypheroftyr Creatures! with the little Norns and Grendels I still have the package and CD around. I cannot pick a favorite, but admit that was definitely a highlight. Especially trying to teach them words. Also: Monkey Island, MYST & Carmen Sandiego I had fond times playing.","@StormyGriffin","edutainment",
"Best cosplay ever? @bigkingbadger but where on earth is Carmen Sandiego? http://t.co/FL7scs76xc","@pigeonbaguette","fashion",
"My Favorite Girl carmen_sandiego_ Who Travels The World 🌎 Reppin My Skitdadle Shirt Out #Thailand… http://t.co/n3gdMn59Hd","@PeanutLive215","travel",
"This new app is part Carmen Sandiego, traveling the world to collect ingredients, and part Cooking Mama, measuring and mixing to make the dish correctly, both of which make it super fun. https://t.co/6nhKQC8DAg","@coolmompicks","cultural-icon",
"In my haste to get all the things to be able to leave, left the gloves and hat. So, I don’t look like Carmen Sandiego tonight. Oh well.","@TheScruffyDruid","fashion",
"@dancingofpens I was waiting for someone to make a Carmen Sandiego joke thank you Camryn A++ as always. *high five*","@Caitlin_Renata","cultural-icon",
"Sudden desire to dress up as Carmen San Diego for this flight","@aphyr","fashion",
"@superbunnyhop On a trip to find Carmen Sandiego?","@Alchanii","travel",
"And seek out my own adventures. Carmen Sandiego was my hero and inspired me to live an adventurous life #imaginationeducation #ashleythearchaeologist #girlpower https://t.co/1i6bMA3IAP","@imaginationeduc","role-model","w"
"Where in the world is... Carmen Sandiego! #cosplay #videogame… https://t.co/BwYiNgurOL","@DJRanmaS","fashion",
"Where in the world is Carmen Sandiego aka @embassthon? Actually, can we get Rockapella to serenade her on her journey?","@AlicesAstroInfo","cultural-icon",
"@st0rmhusky Im not sure whether me or @Dashtiger84 is the Carmen Sandiego. We keep chasing each other across the globe.","@Mangusu","travel",
"This Halloween... If I come across a girl that can pull off a solid Carmen Sandiego costume... I will wife her up...","@LegitTonyTone","fashion","x"
"This is perhaps my best costume in years. Sorry, past Bre who dressed as Wednesday Addams, Poison Ivy and Carmen Sandiego.","@bschossow","fashion",
"@sesamestreet you know, the Carmen Sandiego games can help teach kids about different cultures too.","@JeremiahLiles1","edutainment","w"
"Nikhil Makwana: #NEWS Gina Rodriguez donning red fedora and trench coat of Carmen Sandiego https://t.co/HfuKotuP3y … #Money …","@Tocacyy","cultural-icon",
"I legit learned more geography and history from Carmen Sandiego than school tbh. https://t.co/L8f1qhaJ9M","@calvinstowell","edutainment","w"
"Gina Rodriguez will be donning the red fedora and trench coat of Carmen Sandiego for Netflix - https://t.co/MERqyABALk via @UnitedStatesTD https://t.co/aYi1wSrW7c","@UnitedStatesTD","fashion",
"It's time for another round of #WheresTheresa Can you spot our PM in this line-up? She's like Carmen Sandiego sans the big hat. https://t.co/BcrF4rxe3r","@TWWhittaker","fashion",
"From the prepping, pinning and cutting of my Carmen Sandiego coat... #craftastrophe #bookofgonzo https://t.co/Zgqsojpm69","@thegamermom","fashion",
"My flight path to SXSW feels like an episode of Carmen Sandiego.","@MichaelSDawson","travel",
"Carmen Sandiego and her boyfriend Capwolf enjoying Halloween at @AvengersAcademy 😍 #Steggy #PeggyCarter #SteveRogers https://t.co/Vcok9sqIPj","@AniWolfsBane","fashion",
"@iSmashFizzle Carmen Sandiego was how I learned about geography and moral complexity","@OceanOperative","edutainment","w"
"@ChuggleDBugl @AntonyCannon Can we make that a tjing? Put @AntonyCannon 's oc in an Carmen Sandiego outfit?","@Fim_Keychi","fashion",
"Carmen San Diego teaching about the Patriots running game","@BkKilam","cultural-icon",
"@FNC_Ladies_Rule lol Erin Andrews hat reminds me of Carmen Sandiego","@MichelleFields","fashion",
"@c_sirrah and that red coat bruh. Legit call her Carmen San Diego","@FrannyDiva","fashion",
"#HowInTheWorldCan Carmen Sandiego hide? Everyone must know that red trenchcoat and extravagant hat by now!","@DoubleHAndI","fashion",
"No matter how far I have to go, my summer travel plans are to find where in the world Carmen Sandiego really is! #FreakerAlamo","@punkrocky","travel",
"@glsignal salt used to be worth it's weight in gold (things I learnt playing Carmen Sandiego)!","@akampjes","edutainment","x"
"The women playing Young Doris look like Carmen Sandiego when they're dressed at jetsetting Doris.","@HerSoulWrites","travel",
"So...I basically did #InternationalWomensDay & #WaybackWednesday in one closet cosplay Does anybody else remember #CarmenSandiego No?🤔 Kay😅💚 https://t.co/fAaG6TSbfk","@NoelWillett","role-model",
"This Halloween I've dressed up as Carmen San Diego. Which means you're all in for an obnoxious… https://t.co/yKjfCvtxjk","@DangerLass","fashion",
"This Pup Has Traveled The World, And Has Drool-Worthy Pics To Prove It: Move over, Carmen Sandiego, this adven... http://t.co/FTTOmWyaz0","@DontMindLife","travel",
"@coffee4danz This is like ""Where in the World is Carmen Sandiego."" What adventure are you embarking upon now?!?","@JulieBrethauer","travel",
"@DaemZero @TheOnlyMephisto @Samuel_IGN @pettycommajared @ErrorJustin Carmen Sandiego does where a hat!!! Never overlook a Daemon half-answer","@TheWillis33","fashion",
"Who's finding who tonight? #whereswaldo #carmensandiego #halloween @ Vanderbilt University https://t.co/aeBIHchCuT","@AnnieGreaney","fashion",
"Where in the World is Carmen Sandiego. shouts to some notables like Adventures of Pete & Pete and Arthur","@_DannyWill","travel",
"Netflix is betting on ‘90s kids nostalgia for learning with upcoming lineup https://t.co/VOJCQtIPsS https://t.co/2FYeTK0zps","@TheOneDonJoe","edutainment",
"Keeping it #Latina for Halloween this year. #CarmenSanDiego https://t.co/rDqlqJ8cBp","@JournalistFritz","fashion",
"This is how I learned my geography #carmensandiego #videogames #retro https://t.co/sryeuKwExa","@RillaMulwane","edutainment","w"
"Where on earth is Carmen Sandiego? #layover #travel #nintendo #nintendoswitch #gamer #pokemongo #photography #photographerslife @ Amsterdam Airport Schiphol https://t.co/CaVWlbjrvs","@shootingnathan","travel",
"On this #InternationalWomensDay, I think it's important for us all to take a moment to reflect on the accomplishments of Carmen Sandiego.","@rhanser","role-model","x"
"Life goals: Achieve the same balance of ambition and fashion sense as Carmen Sandiego. http://t.co/wqOBe6LqWT","@kevinpokeeffe","fashion","x"
"I desperately want to read a #novel whose protagonist is Carmen Sandiego. Dark and gritty, please and thank you. #Publishing #Author #Crime","@KathrynLAmonett","cultural-icon",
"@HMHCo Do you guys still own Zoombinis & Carmen Sandiego? You should totally port them to consoles; they're the best educational games ever!","@djchallis","edutainment",
"Where in the World Is Carmen Sandiego? Becoming a Secret Travel Agent https://t.co/E6ByFlavSO https://t.co/VrLU2peBRr","@DobieCrypt","travel",
"This outfit reminds me of that where in the world is Carmen Sandiego thing https://t.co/l64mkkYCfK","@nuniobseo","fashion",
"@rustyjacko @JRRivett @sdoc23 @cjpelican I learnt so much from Carmen Sandiego. Not serving technique though http://t.co/uF9IxasDJx","@Supermercado99","edutainment",
"@scottsROW @CXHairs Like Carmen Sandiego, look for the enormous hat.","@SC_Cycling","fashion",
"way #nba been trading #ridnour combine #CarmenSandiego #Waldo #OrphanBlack all together really like he been getting free air travels on it?","@KLAC_GS_ERA","travel",
"Ever played any of the Carmen Sandiego games? #gamedev #education #retrogaming https://t.co/4GwkvutAhC","@sjfostersound","cultural-icon",
"@JonathanRKnight I love your adventures lately. I feel like I'm playing Where in the World is Carmen Sandiego!","@Nerak2780","travel","w"
