"text","handle","category","star_tweet"
"my childhood girl power icons: shania twain the cheetah girls my mom elle woods the dixie chicks the girl from motocrossed carmen sandiego","@emlytptn","role-model","x"
"Just hanging out in my living room jamming to ""Where in the World is Carmen Sandiego?"" #NBD http://t.co/9IMjy6tMEe","@SocialstGumshoe","cultural-icon",
"We Now Know Where In The World Carmen Sandiego Will Be In 2019 #Netflix #CarmenSandiego https://t.co/n4Zbn4NKQF","@LRM_Exclusive","cultural-icon",
"Rodriquez is already set to voice Carmen in the Netflix reboot of the popular animated series, due in 2019 along with a line of books from the owner of the property, educational... https://t.co/PbMIfqDGCg","@jasoncaston","cultural-icon",
"For Edutainment month, I did a video on Where In Time is Carmen Sandiego from 1989! https://t.co/Y8a2MZbMSG","@PushinUpRoses","edutainment",
"Trying very hard not to get into a fight with every person who thinks Gina is wrong for Carmen Sandiego https://t.co/H8MRDrHpSa","@OliviaHungers","cultural-icon",
"Netflix orders animated Carmen Sandiego series https://t.co/rl2H27IMy9","@fastnewstech","cultural-icon",
"Why this look like Carmen Sandiego without the hat https://t.co/qbvlqJiS1t","@BryleighTate","fashion",
"Side note Netflix is making a new Carmen Sandiego","@Nervatel","cultural-icon",
"Celebrity Fashion Buzz: Rihanna Gives Patent Leather Carmen Sandiego Vibes at the Grammys https://t.co/j3feJkUt9V #GlamCoalition","@GlamCoalition1","fashion","x"
"My nanny... As I drive her home from the airport today... Modern day Carmen Sandiego... 85 years… http://t.co/snTuPfrVDd","@PatHemsworth","cultural-icon",
"@annsabheinn @silverkranch @DNguyenY @PrisonPlanet Lol! I haven't had waffles since I was a child! You go Carmen Sandiego, you are a world traveling genius (sarcasm)","@RitchieJodi","travel",
"Remember how we had those Cluefinders, Reader Rabbit and Carmen Sandiego games to learn things while growing up? Where are those games for my age group now?","@LeClairJoshua","cultural-icon",
"My Halloween costume was pretty damn cool!! #carmensandiego #OldSchool https://t.co/KR39glKxyJ","@dazzlinggem76","cultural-icon",
"Gina Rodriguez Is Netflix's New 'Carmen Sandiego' https://t.co/AfWonHBwdp","@AnimationUpdate","cultural-icon",
"@evilgaywitch ""So who would you say has had the biggest influence in your life? *tips her hat with her gloved hand* Carmen. Carmen Sandiego","@evilgaywitch","fashion",
"Gina Rodriguez Dishes On Netflix’s Reboot Of ‘Carmen Sandiego’, Playing The Virgin Mary | Peo.. https://t.co/aN7FVGHnxQ","@InTheFame","cultural-icon",
"Netflix Reboots 'Carmen Sandiego' With Gina Rodriguez - https://t.co/2lCi4K9j3B https://t.co/LGVDVVnsF2... https://t.co/XnzGkX4dLz","@behnam39999","cultural-icon",
"OMG #Jem is on Netflix!! Next up #max #tintin #carmensandiego and #xmen #thistweettogodsears !","@justRJLewis","cultural-icon",
"TUAW : Netflix plans live-action 'Carmen Sandiego' film with Gina Rodriguez - https://t.co/8EatfomSFJ","@appleactual","cultural-icon",
"Netflix making live-action Carmen Sandiego movie - Polygon https://t.co/zNmsdFKH2C","@Movietweet365","cultural-icon",
"Josh Rusk is harder to get ahold of than Carmen Sandiego.","@iJallen","cultural-icon",
"Netflix Reboots 'Carmen Sandiego' With Gina Rodriguez https://t.co/XxLKKB5QY6","@DILandsman","cultural-icon",
"Consider - a cartoon where you have Ms Frizzle teaching a classroom attended by a young Carmen Sandiego.","@EnochBranard","cultural-icon",
"just learned there's a carmen sandiego villain named Barb Dwyer and i want that to be someone's roller derby name","@Dorianize","cultural-icon",
"Also Bedelia's blue Carmen Sandiego outfit. Give it to me.","@Scarimonious","fashion",
"@GMShivers ""The Incredible Machine"" and ""Where in the World is Carmen Sandiego?"" were both big part of my childhood. Both educational games.","@ezacariasv","cultural-icon",
"""Where in the World is Carmen Sandiego’s Luggage [...]was used as part of a classroom-based customer service training course at Scandinavian Airways Systems (SAS)"".""","@LucasHayas","cultural-icon",
"Seth and I got invited to a costume party this year so we actually have to put in the effort to do a couples costume and I’m both excited but also not looking forward to going to the trouble lol (we decided on Waldo and Carmen Sandiego)","@ohdarlingmartha","fashion",
"Jane The Virgin's Gina Rodriguez To Star In New Netflix Series Carmen Sandiego https://t.co/PnuUUPNcjm","@DjChigga","cultural-icon",
"Gina Rodriguez To Voice ‘Carmen Sandiego’ Netflix Revival https://t.co/7gNHEtA0ZL https://t.co/gJOcf8Ab8e","@Killinent","cultural-icon",
"Carmen Sandiego Is Officially Happening With Gina Rodriguez at Netflix https://t.co/ebqFcOYlk9","@starsjournal","cultural-icon",
"Do it, Rockapella: Netflix is Making a New ‘Carmen Sandiego’ Show - https://t.co/fACXYud3S9 https://t.co/f7BD0attS3","@droidrss","cultural-icon",
"What’s your Halloween costume? Carmen San Diego on a floppy disk","@bobbytooyoung","fashion",
"Just saw a random picture of people on a boat and thought it looked like Cabo and it turned out to be so. I feel like Carmen San Diego","@KariukiMachine","cultural-icon",
"@SheKnowsSports_ Or it could be Carmen Sandiego. We don't know where in the world she is... https://t.co/eLkYSmixZy","@SeasonsOfSasha","cultural-icon",
"Hey, nice hat, Carmen Sandiego.","@oprahspinfrey","cultural-icon",
"I think I found Carmen San Diego 💃✈️ http://t.co/63sgW9ETNC","@STARRSET","travel",
"@MzS0Fi_V @_jackelineee You the real life carmen sandiego you should be a pro by now","@Benevolent_Man","cultural-icon",
"I’m going on vacation to San Francisco, Michigan, and Hawaii over the next three weeks. Is this what it feels like to be Carmen Sandiego?","@derekjlawrence","travel","x"
"Netflix has found Carmen Sandiego and its Gina Rodriguez. https://t.co/VMggpfhXXO","@GeekPopPodcast","cultural-icon",
"@fnnwlfhvrd @FinnSkata @HereIsGina @netflix I want to see Carmen Sandiego and It chapter two right now @FinnSkata","@lamamadeeddie","cultural-icon",
"Where in the world is #CarmenSanDiego?? I need her to help navigate these crazy roads! #Belgium https://t.co/vOWZHJqU2T","@jrowehawk","cultural-icon",
"And the chicest Carmen Sandiego impression goes to ... Doutzen Kroes https://t.co/rRWsgY8vY8 https://t.co/ol4TZ5I3Lj","@TheCut","fashion",
"Costume Guide to Carmen Sandiego's Criminal Style https://t.co/TBxac5a7Wt","@thecostumet","fashion",
"Netflix plans live-action 'Carmen Sandiego' film with Gina Rodriguez - https://t.co/YLfk8ClM8z","@TheNewsGlobe","cultural-icon",
"Carmen Sandiego is returning as an animated children’s show on Netflix https://t.co/fV5vBZYKpz","@GaminG4Respect","cultural-icon",
"how did it literally never occur to me that Carmen Sandiego was latina","@FykesMeister","role-model",
"i got a carmen sandiego coat for $15 so that's pretty cool","@friendofrocks","fashion",
"Thinking of traveling in my Carmen Sandiego costume all the time just for kicks. https://t.co/xNCbs6dxHL","@kimikimkim","fashion",
"So I realized that every time it's Halloween I'm constantly Carmen Sandiego, but I think this year I'm going to be the crazy Druid chick from Troll 2","@TianaCamachoVO","fashion",
"She likes travelling the world, living the high life, and she has red hair. Is it possible Alison Redford is actually Carmen Sandiego? #wrp","@wmcbeath","cultural-icon",
"#Allcon was a success & I can't wait for #DCC #DallasComicCon! #Cosplaying #HarleyQuinn (duh) and maybe #CarmenSandiego for a 1st? #cosplay","@MissFrostage","fashion",
"Netflix plans live-action 'Carmen Sandiego' film with Gina Rodriguez https://t.co/CnfBb7pA2f","@nfdeklerk","cultural-icon",
"@ErinAndrews looks like Carmen Sandiego or Mary Poppins with that ridiculous fedora. Goes with her awful skills on sideline.","@radum27","fashion",
"Who wore it better: Red Hat or Carmen Sandiego? 😏 #NCEdLab18 https://t.co/ekDNEdjkbF","@dc_price","fashion",
"Not Your Shero: Carmen Sandiego and the importance of feminism in edutainment https://t.co/LSgwfKjkS1 #carmensandiego","@TVHistoryFest","edutainment",
"Netflix plans live-action 'Carmen Sandiego' film with Gina Rodriguez https://t.co/PCF99DTmZ7","@MuseumToday","cultural-icon",
"What happened to where in the world is Carmen Sandiego? That game was the bomb in elementary school","@haleyizawesome","cultural-icon",
"Gina Rodriguez to Voice Carmen Sandiego in Netflix Animated Reboot https://t.co/LblirNdvgU https://t.co/sAIq8qBWoI","@MoviesWorldNewz","cultural-icon",
"@WWEUniverse @TheDeanAmbrose With as much as they travel, probably a good idea to have a globe with you...or Carmen Sandiego or Waldo.","@ranrtt","cultural-icon",
"Erin Andrews rockin some Carmen Sandiego fashion #SeahawksvsPackers","@emilypaup","fashion",
"Watching ""Where in the World in Carmen Sandiego?"" and still sucking at it. These kids make me feel dumb.","@KyleBurbank","cultural-icon",
"Gina Rodriguez (@HereIsGina) will play ‘90s super-thief, Carmen Sandiego, in the live-action Netflix film. https://t.co/2z48SrWw57 https://t.co/ONo47n3jBN","@okayplayer","cultural-icon",
"@Strangeland_Elf I've gotten ""Peggy Carter"", ""Carmen Sandiego"", ""flight attendant"", ""vintage"", ""European"", ""classy"", ""hobbit-ish"", + others I can't think of…","@Strangeland_Elf","cultural-icon",
".@HereIsGina to voice “Carmen Sandiego” in @netflix‘s upcoming animated series: https://t.co/XfDEP7hIx1 https://t.co/r4Uo5BZ2Ms","@WomenaHollywood","cultural-icon",
"Netflix is betting on ‘90s kids nostalgia for learning with upcoming lineup https://t.co/IkLox6sQBJ https://t.co/ObBq6iNhqG","@FM_Framed","cultural-icon",
"Carmen SanDiego was my younger siblings and my children's generation. I used to see it on the TV in passing. Like how I saw this one in passing. LOL. Had to… https://t.co/CdfonFUtEy","@DeRoxs206","cultural-icon",
"Carmen Sandiego' Reboot Headed to Netflix https://t.co/XmwX5Lubya https://t.co/i1fwmp2MV0","@VergaraTefy","cultural-icon",
"I am about to LITERALLY be the ONLY passenger on my flight. Literally. Oh. Me and my cat, Carmen San Diego. #twilightzone","@BobbyNotBarbie","travel",
"@SamHeughan such adventures it's kinda like watching the old show where in the world is Carmen San Diego when I see your tweets. What next?","@RegaladoKat","travel","x"
"one day i'm going to dress up as Carmen Sandiego and run around Epcot April 03, 2015 at 11:39PM","@LiveinADHD","fashion",
"@ehmehlee I really like the idea of Carmen Sandiego, but I'd essentially have to buy a whole outfit, lol. Arthur is cheap, ahaha.","@theheartistcin","fashion",
"Where in the world is Carmen SanDiego #youngatheart #games #Elementary","@kimbobabii","cultural-icon",
"Carmen sandiego used to be my girlfriend 😂😂😂😂😂😂😂😂","@Ushudchaseme","cultural-icon",
"@jonathansfrakes Are we playing where in the world is Carmen Sandiego game, but Jonathan Franks style? Or is where's Waldo? lol","@Enivek","cultural-icon",
"@Apexlucifer16 @InspirinEmerald Where in the world is Carmen Sandiego","@cinog4rd","cultural-icon",
"@hurgling Oh! Thank you <3 And yes, Carmen Sandiego is a big inspiration for me. I want to cosplay her someday","@NullBlanc","fashion",
"Track down famed thief Carmen Sandiego around the globe -- http://t.co/R5p4A35O6T education","@virtualapple","edutainment",
"Erin Andrews fashion inspiration for the day is Carmen Sandiego","@mpbirchtree","cultural-icon",
"VIDEO: 10 Reasons Where in the World Is Carmen Sandiego? Was the Best Educational TV Show Ever https://t.co/TKh4OBuhbL #celebrity #gossip","@celebnews1456","edutainment",
"Where in the?!?! Off to a gig. #dragqueen #CarmenSanDiego #Halloween #gay #costume #gayboy #red #robbieturner http://t.co/o5XQTddFHw","@TheRobbieTurner","fashion",
"😱🤩🤓 ‘Carmen Sandiego’ Gets January Premiere Date On Netflix #Go #Celebs #Fashion #Beauty #Entertainment #Music #Film #Tv #Gossip #Celebrities https://t.co/67j3kGb0j6","@celebritykimdot","cultural-icon",
"@Leezachka The future hats? Like where u going carmen San Diego","@slicklikeagato","cultural-icon",
"VIDEO: 10 Reasons Where in the World Is Carmen Sandiego? Was the Best Educational TV Show … https://t.co/ExiwTgDZF2 https://t.co/mXoILvYY6c","@doogjohn","edutainment",
"In 4th grade, I would show up an hour before school started so I could play Carmen Sandiego on the classroom PC https://t.co/O0EEoOCjNl","@andyjayhawk","edutainment",
"I nearly bought a Carmen San Diego hat, today... And then I had a wasabi martini which was possibly… http://t.co/jYhdqNkOJe","@SiobhanHoffmann","fashion",
"Netflix is betting on ‘90s kids nostalgia for learning with upcoming lineup https://t.co/Y6MtIbJF3n #Games #Features #Reviews #news #cultu… https://t.co/73ARgrzP7x","@Iconjurer","edutainment",
"Learn about other cultures through edutainment, from Carmen Sandiego to Culturegrams. Learn more @fayobserver: https://t.co/qgyzijrWQg","@ccpublibrary","edutainment",
"Already have my next Halloween costume planned out. Carmen Sandiego. My date&39;ll go as Where&39;s Wally. Always wanted to do that","@angelatktd","fashion",
"@AshsStash I would say more modern day Carmen Sandiego. Just need the hat.","@khenpoe","fashion",
"#CarmenSandiego is the woman who inspired me to go travelling. CAN'T WAIT.","@LibraryTasha","travel",
"#FlashbackFriday Where in the World is Carmen SanDiego? taught me everything I know today about geography. This dude was my fave bad guy https://t.co/myJBxwZ8U1","@MikMaqRacer83","cultural-icon",
"Found a Carmen Sandiego hat at Goodwill :) https://t.co/QmzAgsJkpo","@mishtheuniverse","fashion",
"Gina Rodriguez to star in live-action Carmen Sandiego film for Netflix - Consequence of… https://t.co/eneZ2ZXYVj","@NewGamesPlay","cultural-icon",
"@leastihavemy___ Where in the World is Carmen San Diego's Hat?","@JuliusIrvington","fashion",
"@MrBeauCarter Where in the world is Carmen San Diego 🌍🌎🌏","@KWonder1","cultural-icon",
"Hey Folks! Please Like, Share and Comment on this Post:Netflix is bringing back ‘Carmen Sandiego,’ and it’s going … https://t.co/uDBAXpi9Cz","@how_people_do","cultural-icon",
"I want to cosplay as the ACME Employee Travel Agent in Where in the World is Carmen Sandiego Deluxe Edition. https://t.co/ncbcqI5nni","@sadakos_daisy","fashion",
"⚡️ “Gina Rodriguez is bringing a Carmen Sandiego film to Netflix” https://t.co/Nyq2CENtq2","@john_siracusa","cultural-icon",
"Where is Carmen Sandiego? @netflix 2019. https://t.co/YTlKn2DhvV","@SavasaurusRexx","cultural-icon",
"Where in the world is Carmen SanDiego?","@nancygirl92","cultural-icon",
"Carmen Sandiego is coming to Netflix and the actress voicing her is perfection https://t.co/QNXuxZ4L3D","@jelitanitami","cultural-icon",
"@SteveMartinToGo Are you Waldo or Carmen Sandiego this Halloween?","@BernhardtM","cultural-icon",
"@AndyBVB You had better cartoon music in the 90s. Though we had Where in the World is Carmen Sandiego? http://t.co/HvtJeGrNjJ","@NKookz","cultural-icon",
"can she wear this in red and be the modern day carmen sandiego pls https://t.co/qwD3Pa2TcD","@nvwju","fashion","x"
"Y'all. Netflix is making a Carmen Sandiego movie. This is terribly exciting. Anyone know if Rockapella is still a thing? https://t.co/1cZL67l7WX","@rightwave","cultural-icon",
"Carmen Sandiego was a fashion icon and no one can convince me otherwise. #WhereintheWorldisCarmenSandiego #trenchcoats https://t.co/Mi1Ao01pm1","@kcam91","fashion",
"this carmen sandiego hat is so fucking bae","@SoAlmondie","fashion",
"Did Anna (with that hat and trench) remind anyone else of Carmen Sandiego on today's episode? #GH","@jtrutherford","fashion",
"Personally, I was all about Carmen Sandiego. And oddly enough, I wasn’t big on Oregon Trail but I put a fair bit of time into Yukon Trail. Yet my geography and history knowledge is still garbage. 😆","@hupfen","cultural-icon",
"EVERYTIME she wears that hat she looks like Carmen Sandiego.","@abrwnigrl","fashion",
"@jameystegmaier Two IP’s: The Sword of Truth- amazing high fantasy IP where the world is based on balance, which is a nice intrinsic quality. 2nd would be Carmen Sandiego. Mix escape room style puzzles with world travel, could even go Legacy 😎","@MikeWoWUfc","fashion",
"Thank the goddess for self control I almost purchased a boat load of pageboy caps and a Carmen San Diego rabbit fur hat.","@sbstnjck","fashion",
"@erin_ville ditto for you and geography. Play a lot of Carmen Sandiego back in the day?","@hurrrdurrr","cultural-icon",
"Carmen Sandiego' Series Hits Netflix, With Gina Rodriguez https://t.co/mFVyMNeSmj","@cinemosity","cultural-icon",
"Also, anyone remember Carmen Sandiego? It’s how I learned geography. I met Greg. He was awesome! My dad was a trooper for sanding in line with me for five hours. https://t.co/38kgYapzwu","@adventuresmissa","edutainment",
"Wait!✋is Netflix seriously making ""where in the world is Carmen Sandiego?"" Into a series???... I think I'm gonna cry","@nanziridawn","cultural-icon","x"
"Netflix finds 'Carmen Sandiego' for its latest reboot https://t.co/duha3rtiwU","@marciojmsilva","cultural-icon",
"Mark and Estel Fashion Stylist Crystal just styled me out in these sunnies!!!! Hot Carmen San Diego stylesssss!... https://t.co/Sen5VxQJW2","@markandestel","fashion",
"@touchablyalive Thanks Mom ❤️ haha. Tell her that she'll look fabulous in a Carmen Sandiego hat","@wonderburrito","fashion",
"@mjstone @s81p @nasboatOG have you considered going as carmen sandiego for halloween?","@StatsBoyAndi","fashion",
"Carmen Sandiego Is Officially Happening With Gina Rodriguez at Netflix https://t.co/LcOaKIRJWF","@GadgetStash","cultural-icon",
"First released image of Netflix's upcoming Carmen Sandiego series, featuring Gina Rodriguez (Jane The Virgin) as... https://t.co/UefEZIZlu3","@MrSeanDisney","cultural-icon",
"@FxyMxy I miss your face, Rach. Like Where In The World Is Carmen Sandiego, miss.","@MrPart2","cultural-icon",
"@Adam_Jacobi I think we finally know where Carmen Sandiego is","@LeighSpeaks","cultural-icon",
"https://t.co/Q9RmigV11R #Netflix plans #liveaction 'Carmen Sandiego' film with Gina Rodriguez: '90s kids have even more to get excited about as Carmen Sandiego comes to #Netflix as a feature film. Jane the Virgin and Annihilation star Gina Rodriguez will… https://t.co/fh3b5olFQh https://t.co/JBpv9A4dWZ","@ManuelKalinski","cultural-icon",
"Where in the world is Carmen Sandiego? #halloween #carmensandiego #nevertooldtoplaydressup #lifeasadietitian... https://t.co/atLe1lhmBU","@WhittyNutrition","fashion",
"I remember a guessing game for you to match art with a blurb about it I think. Between this and Carmen San Diego, my computer games educated the hell out of me. I still remember Shakespeare quotes and I can't stand reading Shakespeare.","@BoboNoire","edutainment",
"@RevenantFox proves my point. The Carmen Sandiego series were excellent graphic adventures for their time, and are still pretty good now.","@tudsworthington","cultural-icon",
"Whenever I wear black and red, I feel like Carmen Sandiego. #90sKid","@Annajyo","fashion",
"Kiss the dead and still make them cry ! Lol #happyhalloween #carmensandiego #beautiful… https://t.co/iBj7hY2WI1","@Iamziina","fashion",
"Happy Halloween from the original #MissTravel! Looking for the perfect travel themed #Halloween #costume?? #CarmenSandiego #WheresWaldo https://t.co/fLChnRiTuW","@DateMissTravel","travel",
"I hope everyone is ready for me to conduct the Carmen Sandiego hype train.","@rollinrabbits","cultural-icon",
"@janeglorianas Girl it’s called Carmen Sandiego the Netflix animated series, Carmen San Diego the Netflix live action film and Someone Great the Netflix rom com. All that’s left is Netflix changing their name to Ginaflix","@iwishyouwoulds","cultural-icon",
"@LauraBabcock @MooreintheAM @NEWSTALK1010 More like Carmen Sandiego. You're just missing the hat","@thekantastic","fashion",
"My parents let my car battery die!!!!! I have clearly left Carmen San Diego in bad hands....","@SosoSel","cultural-icon",
"@iSmashFizzle Carmen Sandiego was how I learned about geography and moral complexity","@OceanOperative","edutainment",
"Where in the World Is Carmen Sandiego? [insecurity in the air travel booking system] | Chaos Computer Club https://t.co/PH8poap0Db","@DataG","travel",
"Gina Rodriguez of ""Jane the Virgin"" Might Be The New Voice of Carmen Sandiego in Netflix Animated Series #latism https://t.co/TwNYmlDcqE","@kunmuth","role-model",
"Netflix plans live-action 'Carmen Sandiego' film with Gina Rodriguez - Engadget https://t.co/IWTjomnHID #Film #Movies","@FilmNewser","cultural-icon",
"Hey Harrison, your magic and comedy span the globe. Say hello to Carmen San Diego... :)","@ProAudioLabs","travel",
"Fanny and her Carmen Sandiego hat.....","@_PettyCrocker","fashion",
"@AynRandPaulRyan @cjillian0709 The rest was spent on finding the perfect Carmen Sandiego outfit","@rkeyjr019","fashion",
"Already have my next Halloween costume planned out. Carmen Sandiego. My date&39;ll go as Where&39;s Wally. Always wanted to do that","@fletcherfm1359","cultural-icon",
"When it’s #Halloween and you can’t choose if you want to be #CarmenSandiego or #WonderWoman so you decide to be both! Carmen/Diana ran into The Purge’s Uncle… https://t.co/rVY6lWb2lG","@EricaKlafehn","fashion",
"@deadmau5 I am Canadian. That makes being Canadian THAT MUCH cooler. #themostinterestingmanintheworld #CarmenSandiego #MissUniverse ✈️✈️🌻👩💋💋","@Kithanae","cultural-icon",
"@bretlowery .@bretlowery item 5, last known whereabouts of #CarmenSanDiego & suspected travel plans","@NFSSmith","cultural-icon",
"One of my role models growing up was Carmen Sandiego","@kar_lo","role-model","x"
"@redheadedgirl THANK YOU! I've had an obnoxious song stuck in my head all day, and now Carmen Sandiego's dislodged it and things are better.","@AmeliaRoseWrite","cultural-icon",
"Speaking of cosplay, i need to find something to compliment my Carmen Sandiego cosplay. Some sort of artifact..","@LilithFlorian","fashion",
"Carmen Sandiego Returns in a New Educational App https://t.co/74MmkGUWyS https://t.co/imW47gokIs","@RobbiedsimsD","edutainment",
"Gina Rodriguez donning red fedora and trench coat of Carmen Sandiego https://t.co/K5gxmuQqmC","@SocialKickme","cultural-icon",
"I'm disappointed that Netflix is doing an animated #CarmenSandiego TV show, only because I think it could be a great live-action series.","@johnkubicek","cultural-icon",
"A1: I need Star Wars figures for space exploration, Carmen Sandiego for expository genre study(reports) & Wonder Woman being assertive #tlap","@StefaniePitzer","cultural-icon",
"REWIND: Gina Rodriguez To Star As #CarmenSandiego In Live-Action Netflix Movie https://t.co/6ASGtFizYd","@4_Y_E","cultural-icon",
"#afternoon #stroll on the #pontevecchio 💃🏻 #carmensandiego 😉🇮🇹 #italy #travelgram #travel… https://t.co/Tvs1Zif1dN","@AnnysaLaMantia","travel",
"‘Carmen Sandiego’ Toon Series Starring Gina Rodriguez Bound For Netflix https://t.co/ubZla9ckGj https://t.co/OkwJ3gEuff","@MoviesWorldNewz","cultural-icon",
"Good news Gumshoes! #Netflix is bringing back #CarmenSandiego #oldschool #ChildhoodMemories https://t.co/Of4knLGll7 via @dailydot","@kt_bates","cultural-icon",
"It's Official: Carmen Sandiego Is Getting Her Own Animated Netflix Series https://t.co/lIrDXmW9AH","@WesWalcott","cultural-icon",
"@hurdy_burdy I love Island of Dr. Quandary but I voted for Carmen Sandiego because it came with an almanac that had a bunch of color pictures of flags","@Hieropants","cultural-icon",
"@lauraewaddell You just need the hat and then you've got your Carmen Sandiego cosplay sorted!","@RobGilroy","fashion",
"Where in Upstream is @eschoenTHD ?!? Sounds a little like Carmen Sandiego 🤔🤣 ✈️ #Alwaysonthemove #TeamSchoen #MissedHimAgain https://t.co/Afev5XCp2J","@HRMThomasTHD","cultural-icon",
"@DrLupo @FortniteGame Where in the world is Benjamin Dr Lupo? (In my best Carmen Sandiego impression)","@figjam300","cultural-icon",
"@carrieunderwood in a red trenchcoat and all I could think of was ""Where in the world is Carmen Sandiego?""","@LadyZubat","fashion",
"Apparently Erin Andrews knew where Carmen Sandiego was, killed her and stole her outfit. #GBvsSEA #erinandrews","@TrevorGebhardt","fashion",
"Where in the world is Carmen Sandiego?","@FrankieNicole_","cultural-icon",
"Seriously though, where in the world *is* Carmen Sandiego?? 🤔","@JasonicProtosh","cultural-icon",
"Gina Rodriguez Dishes On Netflix's Reboot Of 'Carmen Sandiego', Playing ... https://t.co/Kd8id8l0cZ","@sarah052794","cultural-icon",
"@TheOnion It’d be pretty much him doing all Carmen Sandiego cosplay.","@madmantx","fashion",
"Bout to get back on my Carmen Sandiego ✈️","@_kyndallelise","travel",
"Carmen Sandiego' Animated Series Is Coming to Netflix - Us Weekly https://t.co/PTWghaaZJp https://t.co/JvtVU6RkS9","@MoviesWorldNewz","cultural-icon",
"Ok, I'm done fixing racism for tonight. Can we discuss the greatness of the #Empire hashflag some more? A cookie in a Carmen Sandiego hat!","@ItsTheBrandi","fashion",
"@loveyoursG_ this reminded me of you, because of that one halloween you were carmen sandiego! https://t.co/vzlYQEaN8p","@Chulaaa_vaaal","fashion",
"Already have my next Halloween costume planned out. Carmen Sandiego. My date&39;ll go as Where&39;s Wally. Always wanted to do that","@vikkiafuxs","fashion",
"things i learned from carmen sandiego: puns have been important all throughout history","@lahirisms","edutainment",
"I feel like Carmen San Diego. No one has any idea where in the world I am.","@RealFruitSnacks","travel",
"#FollowFriday #FF @RealityGlitch because he found Carmen Sandiego but then they just traded hats? I dunno it was kinda weird.","@Nintendo_Legend","cultural-icon",
"in like '93 i was carmen sandiego for halloween and no one knew who i was and i'm still mad bitter","@girl_and_cat","fashion",
