"text","handle","category","star_tweet"
"And, above all: who's Georgij's mystery girl and where the heck is he now? *muffled carmen sandiego's theme playing in the distance* https://t.co/EkaegnSYWQ","@raxilia_r","cultural-icon",
"@Gota_de_L1uvia I'm slick Carmen sandiego honestly lol I live in Ga until tomorrow when I drive up north to relocate","@illbelate2that","travel",
"My favourite solo traveller (sorry @AlyssaRamos 🙊) is coming to Netflix! https://t.co/owhYQz96o8 #solotravel #travel #CarmenSandiego https://t.co/c1TKYuGzYM","@brandon_sousa","travel","x"
"Tell me, Where in the World is #CarmenSandiego? This Carmen is currently in #YorkPA. #WhereInTheWorldIsCarmenSandiego #Halloween 🕵🏻‍♀️🗺 https://t.co/10rDpFu6MZ","@PhotogChris","fashion",
"Netflix's Carmen Sandiego Series Gets a Release Date https://t.co/Vgk19QvaF7 https://t.co/jteLFenxWc","@CBR","cultural-icon",
"Netflix finds 'Carmen Sandiego' for its latest reboot: https://t.co/uPk3YUGW0D","@fusioneletronix","cultural-icon",
"Just realized the best cosplay photo would be Waldo and Carmen Sandiego together.","@j_hat","cultural-icon",
"To whoever gave Erin Andrews the go-ahead to dress up like Carmen SanDiego today, thank you... thank you very much. http://t.co/Oci7RgVOTw","@RyanPappolla","cultural-icon",
"@EIWBM_Cat Never played. I loaded adventure games into my computer with a cassette tape on my TI-99 4A back in the day. When Carmen Sandiego came out, I was too old for that.","@BadJohnBrown","cultural-icon",
"New post (Where's Waldo and Carmen Sandiego...) has been published on 2017 Halloween - https://t.co/jrIUGM9VOy https://t.co/Q8L7a0vvaz","@Halloween_2k17","cultural-icon",
"I want a trench coat but I don't want to look like Carmen SanDiego","@briellesimonell","fashion",
"@ElSandifer The adventures of young Carmen Sandiego? Sounds better than part four of the Rise of the Tomb Raider trilogy","@BeardedJarl","cultural-icon",
"Lady Gaga Swiped Her Hat And Trench From Carmen Sandiego’s Closet https://t.co/ziXfZf4sG7 https://t.co/QxXtC7Xt6j","@CucusMusic","fashion",
"Just said that Carmen San Diego was Dora the Explorer's enemy in kid's trivia on @971AMPRadio... I got it wrong, but that really should be the case. Somebody make it happen https://t.co/fjduXWA2ca","@MootePoints","cultural-icon",
"Carmen Sandiego' Animated Series Is Coming to Netflix — With Gina Rodriguez Voicing the Lead Role! https://t.co/GWfNStom6i https://t.co/eNI3S44TeC","@sarcastard1","cultural-icon",
".@netflix’s #CarmenSandiego movie sets ‘Game Night’ scribe Mark Perez as writer https://t.co/4PRpUmfUM0","@DEADLINE","cultural-icon",
"❤️Where In The World Is Carmen Sandiego!❤️ #Myart #art #Isabela #paint #woodwork #love #carmen #carmensandiego #geography #80s #90s #televisionshows #books #games #bam #ladyinred #red #ginarodriguez #ritamoreno #oldschool #thursday #throwbackthursday #tbt #badgirl https://t.co/ptu5UWc9KY","@AnnJenfer","cultural-icon",
"So many excellent guesses so far: Rome, New York, St Petersburg, Moscow, Helsinki, Vienna... but where in the world will Sophie and Lil be? *cue Carmen Sandiego music* 🌍 #TaylorAndRose @EgmontUK","@followtheyellow","travel",
"🤷🏻‍♂️Where will the ✈️ drop me on Day 4? #CarmenSanDiego https://t.co/7sKpO7zPIu","@coopscadoop","cultural-icon",
"@Arena_Rome It is a combination of ""Where's Waldo?"" and ""Where In The World Is Carmen San Diego?"" Guess he's learning from the best...","@_MadameV","cultural-icon",
"Forget Carmen Sandiego, where in the world is the YAG bus? https://t.co/glDrFq3Ush","@weakestlink99","cultural-icon",
"The #StarTrek V 1989 PC game looks way more fun than the actual movie, Carmen SanDiego style! http://t.co/kAFurDA7h6 http://t.co/2kRAYIH1z0","@Nick_Acosta","fashion",
"""Chuck Norris is the reason Waldo is hiding, and why Carmen San Diego can't be found.""","@cchucknorrris","cultural-icon",
"Netflix orders animated Carmen Sandiego series https://t.co/eyVHvgFOUa https://t.co/EdSE3L0nVr","@jjcrysiscodes","cultural-icon",
"Stranger Things Star Joins Netflix's Carmen Sandiego Series https://t.co/jSIGsdfzQY via @ToysAndGamesCo https://t.co/Ix1JL5EblX","@ToysAndGamesCo","cultural-icon",
"What's new on Netflix in January 2019 https://t.co/VbSjvnCNzG","@outworldapps","cultural-icon",
"@Coolguyreiner though I'm already in love with her Carmen Sandiego hat","@Coolguyreiner","fashion",
"Netflix planning live-action Carmen Sandiego movie https://t.co/Nlj7n4ztrU","@larrymlease","cultural-icon",
"Carmen Sandiego's trench-coat https://t.co/6KnmbBPsEx","@hernameisadam","fashion",
"What's new on Netflix in January 2019 https://t.co/yl2Qq9l1Ri","@TechRiverPros","cultural-icon",
"@HillyHindi “@HillyHindi: Where in the world is Carmen Sandiego? 💃🌎 #xoxo #fashion http://t.co/YZn1jZozZZ” @SeasonedHipster remember ""Carmen Sandiego?""","@miatillery12495","cultural-icon",
"Just texted my sister and asked if our mother was still alive. Carmen San Diego could learn a few tricks from her.","@katiewhiskey_","edutainment",
"Jan 17 American Crime Story: The Assassination of Gianni Versace Jan. 18 Carmen Sandiego (Netflix Original)","@GaboTorres72","cultural-icon",
"Getting my passport. I wonder if they would still let me get one if my name was Carmen Sandiego.","@space_not_war","cultural-icon","x"
"@JLo Ms. Lopez? Is it true that you're going to be Carmen Sandiego? http://t.co/bXW9D8kUqF","@Don_P_Andrews","cultural-icon",
"Terrible game idea: location aware smartphone port of Where in the World is Carmen Sandiego, where you have to physically travel the world to play.","@crazyunlikeafox","travel",
"“Carmen Sandiego,” New Animated Series, Coming to Netflix in 2019 https://t.co/tP9HbzHofG https://t.co/LRIKIiTm2z","@TheCCommentary","cultural-icon",
"@BigBird I'm still on Carmen Sandiego's trail. So far I caught Hal E. Luya & Hugo Yurway in Georgia.","@JeremiahLiles1","cultural-icon",
"Sorry @HiAndrewJenkins my costume came. I don't need Carmen San Diego though if you want to be that?","@lifewithlauren1","fashion",
"New hat...I refer to it as my ""Carmen Sandiego"" hat. 🌎 https://t.co/zTj3T4UST2","@Sportzgurl52","fashion",
"Someone give me a tan raincoat and a hat bc we’re finding Carmen San Diego","@MiliKoncelik","fashion","x"
"I named my car after Carmen San Diego as they both share the trait of unreliability. #whereintheworlddidmybrakesgo","@CharleeAnn","cultural-icon",
"https://t.co/mqujiXqw8C New Carmen Sandiego animated series coming to Netflix in 2019 https://t.co/ezEzh8oaK5 (via Flixist) https://t.co/MF0","@Games2Gold","cultural-icon",
"@CarmenOrChante That's whatsup you aint playing you bout to be on your Carmen San Diego traveling for real and Home 2 work cant beat it!","@swzhaobudaozion","travel",
"Couples costume goals. I’ll dress up as Where’s Waldo or John Cena,she dresses as Carmen Sandiego","@TKN951","fashion",
"How in the world could Carmen San Diego afford to have travelled so much? Frequent flyer miles? We'll never know..","@BRoddy12","travel",
"I first learned about feminism and geography in the same place: Where in the World is Carmen Sandiego?","@juliarebeccaj","edutainment","x"
"@AllAboutSylvie ty it's my Carmen Sandiego hat :), Shawn will be where's waldo...lol 😂","@RayMarkAble1","fashion",
"Carmen Sandiego. Where I learned the word ""spelunking"" #BestPartOfThe90sWas https://t.co/TC2O3w3ADu","@Puritan2000","edutainment",
"I gotta tell my best friend about the latest adventures of Carmen San Diego","@iamNiish","travel",
"Day 137: Where in the World is Carmen San Diego? Carmen San Diego is a character from a series of computer, board games and even a kids gameshow that tried and teach the youth of the early… https://t.co/FGVX1OMOMj","@JulianFGaitan82","edutainment",
"@thaumatropia That is very cool and Carmen Sandiego. I need a snappy red coat.","@FightDynamite","fashion",
"I swear I know a real Life Carmen sandiego. U never know where eb is","@SICKemAJ","travel",
"Before I die, I want to Cosplay Death, Carmen Sandiego, and Rose from street fighter.","@Sp00kySpice","fashion",
"@TheFalcoholic I believe he could catch Carmen sandiego","@Bolden7","cultural-icon",
"@netflix WHAT?! YAS #CarmenSandiego","@klynnped","cultural-icon",
"Netflix is betting on ‘90s kids nostalgia for learning with upcoming lineup https://t.co/JW1utw1G1x https://t.co/QbQxACk35I","@XboxOneNews","edutainment",
"Hot take: Carmen Sandiego was one of our early feminist icons next to Ramona Quimby and April O'Neil https://t.co/4wzy1DcDkD","@megansarahj","role-model","x"
"#growingupwithmyname ""have you heard of carmen san diego?"" No wow educate me on the game character who shares the same name as me thanks","@agrandestyles","cultural-icon",
"Gina Rodriguez to Voice Carmen Sandiego in #Netflix Animated Reboot https://t.co/AFeG2zaK8O #tv #ginarodriguez #news","@Sekinatlawal081","cultural-icon",
"First person adventure with the globe trotting fun of ""Where in the World is Carmen Sandiego"".... heh.","@IQ_Adventures","travel",
"Carmen Sandiego and Happt Meal were kewl costumes","@RokTheSpot","fashion",
"Do it, Rockapella: Netflix is Making a New 'Carmen Sandiego' Show - Geek https://t.co/CRN0WSr5oG","@NewGamesPlay","cultural-icon",
"Netflix to reboot 'Carmen Sandiego' animated series (starring Gina Rodriguez) https://t.co/xEqZu2hzEe https://t.co/tG3yVLJv5D","@NeoGAFOT2","cultural-icon",
"@MidnightRem 4) I played the hell out of the ""Carmen Sandiego"" games, trivia games, building games... Everything that would be called ""edutainment"" now.","@MidnightRem","edutainment",
"@DAbruzzoTweets I researched my favorite game show Carmen Sandiego & learned it used to be taped next to Sesame Street.","@JeremiahLiles1","cultural-icon",
"personal style: goth Carmen Sandiego","@staygoldrebecca","fashion",
"@missleylaha Now the Carmen San Diego theme song will be in my head all day","@SLAVES_BC","cultural-icon",
"@Dismalify @itzzzCrayon @TBEFaker Guys, we have to figure this out. Hopefully @notpeej can give us the clue we need so we can Carmen Sandiego this","@NGE_League","cultural-icon",
"Gina Rodriguez Voicing Carmen Sandiego in Netflix Show https://t.co/Cm6b0mXdlY #indie #letsplay https://t.co/V0BZBR9B0Q","@indiegames1","cultural-icon",
"[Self] We were a big hit at our Halloween party! Despite everyone thinking I was Carmen Sandiego #cosplay https://t.co/N90ndYA1AM","@cosplaysnugglz","fashion",
"Netflix is Bringing Back 'Carmen Sandiego' with Gina Rodriguez Playing the Lead https://t.co/DXg3dAtEky #leonardsimpsonTV #fashion","@LEONARDSIMPSON","cultural-icon",
"Where in the world is #carmensandiego ? The clue is in her hat. 🐭 #sketch_dailies @Sketch_Dailies #mickeyears http://t.co/5vHdljyeqX","@HaileyJensenArt","fashion",
"Awesome to see a Latina voicing Carmen Sandiego. Bigger question: Will @RockapellaMusic be involved? https://t.co/6Qyf9pTpkn","@AlexPalombo","cultural-icon",
"Nikhil Makwana: #NEWS Gina Rodriguez donning red fedora and trench coat of Carmen Sandiego https://t.co/HfuKotuP3y … #Money …","@Tocacyy","cultural-icon",
"@garyvee If you wanted to beat Carmen Sandiego’s travel legacy, doing a good job.","@TheAllCreative","travel",
"Carmen Sandiego was the entry level drug to Travel shows. #throwback https://t.co/eEK45y3ii2","@astr0mnaut","travel",
"#CarmenSandiego is back in an all-new animated series coming from #Netflix!","@haveyourview","cultural-icon",
"Gina Rodriguez to voice heist queen Carmen Sandiego for https://t.co/9ZxcaGxLVO via @W3LiveNews #Netflix #GinaRodriguez #CarmenSandiego","@W3LiveNews","cultural-icon",
"Hee hee! Driving Thing 2 kooky 'cause I can't stop singing ""Where in the World is Carmen Sandiego?"" @PBS #WhereInTheWorldIsPeadysWaterBottle","@Peady","cultural-icon",
"Netflix is betting on ‘90s kids nostalgia for learning with upcoming lineup https://t.co/8lBQjqTN4V https://t.co/rblgxPFg7W","@Radalei","cultural-icon",
"Idk but where in the world is Carmen SanDiego?","@royboy244","cultural-icon",
"Gina Rodriguez to Star as Carmen Sandiego in Live-Action Netflix Film https://t.co/GlSMvhT53K","@tigg3001","cultural-icon",
"Chuck Norris knows where Carmen Sandiego is.","@DrLouFran","cultural-icon",
"From @TVGuide: #entertainmentnews Jane the Virgin's Gina Rodriguez May Voice Carmen Sandiego on Animated Netfli... https://t.co/E3i4gXmTta","@mentalformovies","cultural-icon",
"I know it's not going to happen, but I'm still going to be sad when Carmen Sandiego premieres and the first line isn't ""SING IT, ROCKAPELLA!""","@Themiscyra","cultural-icon",
"where in the world is carmen sandiego; harry styles special edition http://t.co/MphVVvzBEb","@IAMEBORGHlNl","cultural-icon",
"@WCReaf Can't wait for this!! #CarmenSandiego","@ASliceofComics","cultural-icon",
"@VincentValenLoL *starts humming Carmen Sandiego theme song*","@RyryJones","cultural-icon",
"If you don't want me to scream ""I found her! I found her! I found Carmen SanDiego!!!"" don't wear a red trench coat","@EricJJohnson79","fashion",
"A new Carmen Sandiego could be coming to Netflix https://t.co/VcTOnMqHhC https://t.co/Rm49PXOKwg","@superfabis","cultural-icon",
"Lived this with my Carmen Sandiego Halloween costume https://t.co/X2wJ3dWyYe","@h0tmessjess","fashion",
"@braincluttered @Song2Sing55 @SylvanEsso (BTW, I loved ""Where in the World is Carmen Sandiego?"" A fond childhood memory. Thank you for being a part of it.)","@braincluttered","cultural-icon",
"Gina Rodriguez Voicing Carmen Sandiego in Netflix Animated Series - Screen Rant https://t.co/OZvEJjkDpP","@Q_Sizzle","cultural-icon",
"@RadioAmy @merib yeah yeah yeah!!! 🎉🎉🎉 (but where is the Carmen Sandiego hat?!)","@mikesaenzsays","fashion",
"@FITWR The 90'a property that needs a big screen reboot is Where In The World Is Carmen San Diego? as a Hard R, John Wick globe hopper.","@thenickisaac","travel",
"Who remembers the game where in the world is Carmen Sandiego?💕✈️🌎 • That's me 🙌🏻💕 • Adventure. Explorer. Learner. My mom is behind the 📸 h…","@fitlifecreation","travel",
"Netflix Developing Live-Action Carmen Sandiego Movie - https://t.co/uzeETNppaz","@Cyber_Saber","cultural-icon",
"Netflix is making a live-action Carmen Sandiego movie. #carmensandiego #netflix #movies… https://t.co/grZ02pvR5o","@nerdinformants","cultural-icon",
"The great machinery never stops! @Netflix developing new #CarmenSandiego animated series with @HereIsGina | #TV #cartoon #animation #art https://t.co/bHeruWfgj4","@alejomalia","cultural-icon",
"hey, remember that time @dessadarling was Carmen Sandiego for Halloween? ahahaha https://t.co/fuOV1mJQOt","@DOOMTREE","fashion",
"Where in the world is she? #carmensandiego #hat #red #stylish #detective #illustration #dailysketch… http://t.co/qTnEw4iGdM","@aaron_millard","fashion",
"Imma let you finish, but Carmen Sandiego is the greatest female video game character of all time https://t.co/AtkhX4tTnc https://t.co/I1cCnQaR0F","@WWW_Spaceships","role-model",
"BEDELIA'S CARMEN SANDIEGO OUTFIT. FLAWLESS. #Hannibal #HannibalPremiere","@pocketrex","fashion","x"
"Bruh traveling like Carmen Sandiego","@MIGUELGUAPISIMO","travel",
"#Throwback #Thursday - #where #in #the #world #is #carmen #sandiego? #edtech #education #computers http://t.co/fAvwSxKV9P","@TheAlinaGroup","cultural-icon",
"@Variety @HereIsGina @netflix #CarmenSandiego is flying to @netflix https://t.co/kIYIw3Zg7f","@Miyuko_junsei","cultural-icon",
"Where in the world is Carmen Sandiego? All clues lead to Netflix (and Gina Rodriguez). https://t.co/SieU1gyScv https://t.co/ZBlno2SXlh","@FOXCinemas","cultural-icon",
"I can't get over Murasame's carmen sandiego cosplay","@fanboymaster","fashion",
"Where in the world is Carmen Sandiego? #betyoujustsangthat #happyreformationday #happyWednesday #humoday #happyhalloween https://t.co/v6g3cSu60Q","@321bheisler","fashion",
"Not sure if I'm channeling Gatsby or Carmen Sandiego… 💋 #selfie #me #fashion #dinner #waiting @… http://t.co/WzS6KGmuj8","@MaryWojcicki","fashion",
"The first image from Netflix’s new Carmen Sandiego is here, and we’re only buying red from now on https://t.co/yaloyrEzbO","@MoviesWrld","cultural-icon",
"I want the game show back as well! #CarmenSandiego #Netflix https://t.co/tr74Yokpq9","@DarnelleRadford","cultural-icon",
"@LoriSchmidt I specifically said Fedora...name one other lady with a trademark Fedora (besides Carmen SanDiego) and I'll take it back.","@charleboy1020","fashion",
"AaaaaAaa carmen sandiego e netflix ainda n to crendo","@thedoorrs","cultural-icon",
"Gina Rodriguez donning red fedora and trench coat of Carmen Sandiego https://t.co/o5tqjfz7BL","@TeamYunnoh","cultural-icon",
"My mom is actually Carmen San Diego. I asked my Dad when she was coming home and he said ""I don't know, maybe Wednesday?"" #GlobeTrotter","@brianhasfun","travel",
"Someone told me I look like Carmen Sandiego when I put my red hat on.","@juramhawk","fashion",
"Carmen Sandiego is the first strong female icon I remember. An independent woman always on the move. And let’s be real, she gay. https://t.co/tT8bBGBsTv","@axse0","role-model",
"theofficialcarmensandiego is coming to @netflix this January. #january19 #carmensandiego #whereintheworldiscarmensandiego https://t.co/aeKb4c4cxO","@SheFightsToo","cultural-icon",
"New post (Where's Waldo and Carmen Sandiego...) has been published on 2017 Halloween - https://t.co/jrIUGM9VOy https://t.co/Q8L7a0vvaz","@Halloween_2k17","fashion",
"I learned how to disappear from Waldo and Carmen SanDiego","@MrElicit","cultural-icon",
"How fitting that they found each other! #WheresWaldo #CarmenSanDiego #Cosplay #PAXSouth http://t.co/f597ymgQY5","@PractitioNERD","cultural-icon","x"
"@LuuucyImHome Hi Lucy, my little brother's a fan of LACMA snapchat 😁 We had a good time working through today's posts Carmen Sandiego style!","@hueiyuanpan","cultural-icon",
"Our McDuece wasn’t dirty it was filthy. 25 reps of push-ups, squats and crunches followed by a 125 yard bear crawl. Repeat 4 times. Hat tip to Silicon, Carmen San Diego and Mookie for rising to the challenge.","@PlanoF3","cultural-icon",
"InStyle : Netflix's Live-Action Carmen Sandiego Will Star Gina Rodriguez #myfirstTweet #TheBest #GoodDay https://t.co/Sabrjh5a4d","@WWE_Wrestling0","cultural-icon",
"How can I expect to live out my lifelong dream of dressing like Carmen Sandiego if red trench coats insist on being so expensive?","@savageglitter","cultural-icon","x"
"A4- There are so many great game websites out there. I have used the old Carmen San Diego to help with gathering clues and problem solving. I use a lot to review and reinforce different concepts. Kids love it and they do not realize they are learning!! #122edchat","@RealMrsBentley","edutainment",
"Carmen Sandiego is returning as an animated children’s show on Netflix https://t.co/gmgPYXpwSx","@MoviesWorldNewz","cultural-icon",
"@VanityLaviie thank you Carmen Sandiego","@_Beezo__","cultural-icon",
"[Mashable] Gina Rodriguez donning red fedora and trench coat of Carmen Sandiego https://t.co/9ITEjr3aI7","@netzlesen","cultural-icon",
"@Steelersdepot That play is called Carmen San Diego.","@DarrellNeloms","cultural-icon",
"Halloween partay!!! #SelinaKyle #scarecrow #jubilee #rickandmorty #carmensandiego https://t.co/1dzxJebD8L","@RagebowBrite","fashion",
"Where am I???? #vacation #CarmenSanDiego #Falsesky https://t.co/xz7cTeAAJr","@cassiusmedauar","travel",
"here you go, kids! You learn Geography the way I had to, By chasing this dodgy lady around the damn globe! #CarmenSandiego #netflix https://t.co/DeCuN0X5yv","@upearlychannel","travel",
"@MatthewACherry @netflix You guys missed Carmen Sandiego in that list... another epic show","@Wes_Johnson0507","cultural-icon",
"Yeah the whole ""I found Wally/Carmen Sandiego"" cosplay pic thing is getting kinda old now.","@Ognawk","fashion",
"Report: Gina Rodriguez (@HereisGina) cast as Carmen Sandiego in new @netflix... https://t.co/jSsmZhk20D by #HereIsGina via @c0nvey https://t.co/LOU8PzMJ8S","@insanejvega","cultural-icon",
"A lady just ran up to me and said ""I found Carmen Sandiego"" ~because of my hat #whereintheworldiscarmensandiego http://t.co/M63FtgZmx3","@Sara_Zuccari","fashion",
"@jiveammunition Carmen Sandiego Ashe looked great!","@Arioch6","cultural-icon",
"Gina Rodriguez To Star As Carmen Sandiego In Netflix Live-Action Feature https://t.co/bBa8IFqRSu #Entertainment","@BlakeShelnot","cultural-icon",
"(Mashable) #Gina #Rodriguez will play Carmen Sandiego in the live-action movie : Netflix.. https://t.co/nAPaLUQcug https://t.co/dhwGxO1plR","@storiesflowcom","cultural-icon",
"Carmen Sandiego is back to her old tricks on iOS: Well she sneaks around the world, from your iPhone to your iPad... The geography-ob...","@erin_mcneal","cultural-icon",
"Where in the world is Carmen Sandiego? Found her. Apparently she's been in Forever21 this Whole time... http://t.co/ufTN53OGDt","@kelseyogajo","cultural-icon",
"Netflix finds 'Carmen Sandiego' for its latest reboot https://t.co/lNggFOiqGo","@nswint","cultural-icon",
"way too excited about the carmen sandiego netflix series. carmen was probably one of the top 10 best things to happen to my childhood tbh https://t.co/JANpMuqSxd","@katiechironis","cultural-icon","x"
"Ask your parents if they remember this : Netflix's Carmen Sandiego Reboot Has a New Premiere Date and Some Mysterious Teaser Images https://t.co/gKwqrqHyhu via @io9","@LibraryatWMS","cultural-icon",
"@Independent @Netflix Scooby-Doo, Dune Buggy, Johnny Quest, Carmen Sandiego, Where's Waldo.","@BBCUSA173","cultural-icon",
"How Carmen Sandiego accidentally became an educational game icon https://t.co/UzgdXIqqf1","@GamesPlace4u","role-model",
"WTF where in the world is carmen sandiego game show. If I wanted to watch old people talk about geography I'd check out Rick Steves.","@carolynmain","cultural-icon",
"Hey @netflix what's going on with Carmen San Diego ???!","@Spadekqj10","cultural-icon",
"@ericalindbeck @stephaniesheh @BrinaPalencia You know, with an actual fedora you could probably cosplay as Carmen Sandiego.","@adam_kun","fashion",
"Mimi know she needed to quit with that Carmen San Diego outfit she had on!","@Mickens__","fashion",
"@HereIsGina If you're voicing Carmen Sandiego in a new Netflix Animated Series, I cannot wait!!! I loved the PC game as a kid. #NowImOld 😄😂","@CaseyBMusic","cultural-icon",
"İyi haber. Sounds Like Netflix Is Bringing Back 'Where In The World Is Carmen Sandiego?' - The Huffington Post https://t.co/SeI15x6p7s","@gkchz","cultural-icon",
"#CarmenSandiego is returning as an #animated #children #show on #Netflix https://t.co/rPP7y6xhj7 via @Polygon","@clone9design","cultural-icon",
"@TimFederle Best Halloween working at the bookstore: asking Where's Waldo and Carmen Sandiego if they needed help finding anything.","@poodlestar","cultural-icon",
"@LuckyMe59 Lol! I pulled a Carmen Sandiego with this trip.","@TheMoFactor9","travel","x"
"Netflix plans live-action 'Carmen Sandiego' film with Gina Rodriguez https://t.co/VRVLoaTBqw #socialmedia","@RyMonahan","cultural-icon",
"@SankofaNYC I feel like watching Where in the World Is Carmen Sandiego? Made me enjoy travel, and is why i am good at geography","@SankofaNYC","travel","x"
"Where in the world is Carmen Sandiego? #Halloween #Halloween2018 #Halloween18 #HappyHalloween2018 https://t.co/jCG2I6d1Aw","@wanderingfete","fashion",
"Netflix is making a Carmen Sandiego movie with Gina Rodriguez https://t.co/qgvF5imrHq #Followback #news https://t.co/BC1wc7rod5","@loopnewsinfo","cultural-icon",
"Idk much about Carmen Sandiego but the show looks pretty","@Inkvenger","cultural-icon",
"@EA please for the love of god remake where in time is carmen sandiego on PS4 VR.","@getlemonhead","cultural-icon",
"@FireJB_ I always considered Carmen San Diego very stylish.","@Christophicles","fashion",
"Some times I get nostalgic for the old school computer games you'd play on the old Macintosh computers at school like OregonTrail, that nursery rhyme game where you had to put all the characters back in their stories, & Carmen Sandiego... 😭 i just want to play CarmenSandiego","@CmndrLex","edutainment",
"Netflix is betting on ‘90s kids nostalgia for learning with upcoming lineup https://t.co/MgzCGNK332 https://t.co/yGg3YZXAzs","@betium","cultural-icon",
"Remember how we had those Cluefinders, Reader Rabbit and Carmen Sandiego games to learn things while growing up? Where are those games now?","@LeClairJoshua","cultural-icon",
"@netflix you guys really making a Carmen Sandiego reboot? 👍🏿","@dmichel42","cultural-icon",
"If that hat was red, Erin Andrew would be Carmen Sandiego","@ted_lilly9","fashion",
"First look at #CarmenSandiego from @EW. The artwork is gorgeous, and she looks badass. Gina Rodriguez is doing the voice for 20 episodes, then following it up with a live-action movie for Netflix. https://t.co/m4Cz4a7ZLk https://t.co/m8HtCsjuhu","@LAdynerdsMeetup","cultural-icon",
"@CandiceAmanda Where's Waldo and Carmen Sandiego are my top two choices this year. I need the hats for both, though.","@EveyJacob","cultural-icon",
"Netflix Reboots ‘Carmen Sandiego’ With Gina Rodriguez https://t.co/xgIe65Fmpg https://t.co/lxMm6kssJe","@F4GSocial","cultural-icon",
"What does Oregon Trail have in common with Tomb Raider? Assassin's Creed with Carmen Sandiego? Learn more about video game world-building in this @barretthonors talk Thursday https://t.co/4hSKG7tztG 🎮 https://t.co/DzFYzhUH7u","@ASU","cultural-icon",
"Radical! Netflix Could Be Bringing Carmen Sandiego Back https://t.co/SGeedtVo5k","@eternaljanuary","cultural-icon",
"@PBS .@PBS Reading Rainbow, Shining Time Station, Lamb Chop's Play-Along, Carmen Sandiego, Mr. Rogers, and uh... pledge drive. #ILovePBS","@cellytron","cultural-icon",
"Gina Rodriguez to portray 'Carmen Sandiego' in live-action Netflix movie #GinaRodriguez #JanetheVirgin https://t.co/Umi33E7LE1","@realitytvworld","cultural-icon",
