"text","handle","category","star_tweet"
"If I get another cat I'm gonna name it Carmen San Diego. So whenever I'm looking for her I can sing, where in the world is Carmem San Diego?","@Miss_Jasine","cultural-icon","x"
"@adamlambert THAT'S who you look like in your tan sports jacket and hat! Not police detective as I 1st thought - but Carmen Sandiego! 😊","@ConcordiaGirl03","fashion",
"I learned the colors of flags from many countries thanks to 'Where in the World is Carmen Sandiego?' #CEP813 #MAET","@codymaet","edutainment","w"
"Dora's last name was San Diego, because she travelled with her mom Carmen. #Doratheexplorer #Carmensandiego #everythingmakessensenow.","@PainbhindmyIs81","cultural-icon",
"Sometimes I have to google the places @jonk is traveling to. He is the modern day Carmen Sandiego...","@PatMikeL","travel",
"I just noticed the hands are missing on the Car of History clock in Statuary Hall...and my first thought was where in the world is Carmen Sandiego?","@bretthhorton","cultural-icon",
"Lady dressed like Carmen Sandiego just took several minutes to put her bags in the overhead bin. So much for an experienced world traveler","@RossMulk","travel",
"I talked to my dad about the Carmen Sandiego show and he was like ""yeah that's the only way we could trick you into learning anything""","@carriewood34","edutainment","x"
"I just drove myself crazy trying to figure out where in the world Carmen Sandiego is... I still don't know #epicfail","@Coco_bean15","cultural-icon","w"
"@michaelk42 @3liza Well, everyone knows Carmen Sandiego was Chaotic Neutral, not evil. What this outfit presupposes is... maybe she wasn't ?","@original_sgnp","fashion",
"Another great post from the vault: Educational Games of The Past: Carmen Sandiego http://t.co/nSobkyt8Ru http://t.co/aSqGGeiRtx","@MaglomaniacInc","edutainment",
"@sawngbyrd28 Is that a Carmen San Diego hat? ""@sawngbyrd28: But while I'm on here judging North's parents... http://t.co/ZumfIKZmsZ""","@Still_sOUnerfan","fashion",
"How in the world could Carmen San Diego afford to have travelled so much? Frequent flyer miles? We'll never know..","@BRoddy12","travel",
"Today I dressed up as Carmen Sandiego, and completely independently of that, my classmate was Waldo. Beautiful unexpected things do happen.","@PetrichorInF","fashion","x"
"What You Learn Hunting Carmen Sandiego Without Google's Help: So I decided that I needed to get away from Wiki... https://t.co/5JwZg0ZjxA","@LixenTk","edutainment",
"Walking to work today I learned a) I still know all the words to the “Where in the World is Carmen Sandiego” theme song and b) I’ve been to like half of the places named and I think maybe this is just a bucket list thing now :D","@matrioshkadog","cultural-icon",
"guys, if we get a rebooted bill nye & magic school bus & carmen sandiego WHEN ARE WE GETTING WISHBONE","@emilysteers","cultural-icon",
"@howled okay so first of all carmen sandiego is a WOMAN and was a huge role model when I was little that wasn't barbie or a disney princess","@sadiebyrrd","role-model","x"
"Harley Quinn, or Carmen Sandiego...decisions, decisions. #cosplay #Halloween","@JillRobiFangirl","fashion",
"#carmensandiego #wip now that's a big hat https://t.co/K7GxYYyb4H","@drew_moss","fashion",
"I make a great 3rd wheel, lol! I'm like Carmen San Diego w/out the hat. Team Valor even back then.😂 #onthisday #oneyearago #radiatorsprings https://t.co/Xaa1T3nqJy","@mellokittv","cultural-icon",
"New trending story from People : VIDEO: 10 Reasons Where in the World Is Carmen Sandiego? Was the Best Educational TV Show Ever","@tyovaatteita","edutainment",
"Where's Waldo and Carmen San Diego would make great Halloween outfits. Cause any time someone lost you they could yell out the titles.","@Kitsykitkat","fashion",
"Some of Yall be cute as shit in ya lil Carmen Sandiego hat","@FallofTres","fashion",
"I HAVE WANTED TO BE CARMEN SANDIEGO for halloween for YEARS, but couldn't find the right hat. But now a company somewhere will make it!! https://t.co/RE8qiSxwOF","@the_huntswoman","fashion","x"
"SnapWidget | Where in the world is Carmen Sandiego? 💃🌎 #xoxo #fashion http://t.co/ElZR5d3Oa4","@JoannyIzadora1","cultural-icon",
"@BillyBiggle I first saw Mount Rushmore in the America's Heroes video, then I saw it in Carmen Sandiego & My First Amazing World Exolorer.","@JeremiahLiles1","edutainment",
"Gina Rodriguez will be donning the red fedora and trench coat of Carmen Sandiego for Netflix https://t.co/8vLJYiVpUT","@SiennaSigil","cultural-icon",
"@PGATOURSMartin @RyanLavnerGC I have to thank Where In The World Is Carmen Sandiego for teaching me the definition of 'spelunking.'","@PGATOURSMartin","edutainment",
"Did Carmen Sandiego ever time travel or am I misremembering things?","@CBazenas","cultural-icon",
"""How Carmen Sandiego accidentally became an educational game icon"" by via Gamasutra News https://t.co/T5frbDnRHf","@IGDALA","edutainment",
"@MiklCraw4d ""Larry Fedora"" sounds like a ""Where in the World is Carmen San Diego"" character","@wc_thats_me","fashion",
"@DeyBeOnANigga_ i learned more from Carmen San Diego than school at that time lol","@iNLuvWitMaryJ","edutainment",
"Happy Halloween from Robin, Carmen San Diego and Batgirl!🎃🍬👻 #happyhalloween #superheronight… https://t.co/d8IBc6581Q","@kristyhart24","fashion",
"@DizzyHellfire The Carmen SanDiego hat?","@razerhawk2000","fashion",
"Great Fun with Where in the World is Carmen Sandiego? today... looking forward to Senior Halloween tomorrow https://t.co/HU255TKhSo","@CSHIREPURAVIDA","fashion",
"Why is there no gritty reboot of Where in the world is Carmen Sandiego? I'd even take a funny TBS style buddy show.","@jgrenn","cultural-icon",
"What do you get when you have The Doctor, Waldo, and Carmen Sandiego in one location? An epic adventure! Follow our journey and see if you can figure out where we’re stopping, you might… https://t.co/JXIKGmIbo1","@bossierlibrary","travel",
"#WhereOnEarthIsCarmenSandiego : a master class in crime https://t.co/Y2lsIgFxc0 #cartoons #edutainment #CarmenSandiego #FoxKids #nostalgia https://t.co/24XNsCewr8","@GamingRebellion","cultural-icon",
"Incognito Khloe Kardashian Channels Carmen Sandiego With Her Trench And Fedora: Where in the world is Khloe… http://t.co/nnchCwfbIL","@music8maker","fashion",
"😭😭😭😭 at Mia saying Rasheeda got the Carmen SanDiego outfit. She swear she you @rt_Tee","@TerrellChuggs","fashion",
"VIDEO: 10 Reasons Where in the World Is Carmen Sandiego? Was the Best Educational TV Show … https://t.co/8sdRZK9yF1 https://t.co/akUijHCYbx","@tedcatalyst","edutainment",
"Love @i_am_mays's Carmen San Diego style #googletourbuilder lesson. Nice work, gumshoe! #neotech2017 https://t.co/X4IAMRUKSA","@JakeMillerTech","fashion",
"@BSO Carmen San Diego is needed when growing up, lesson learned","@platiado8","edutainment",
"Wanted: For fashion fierceness. #WITWIAL? #AdamLambert #CarmenSandiego http://t.co/J07rG103Bn","@Mountainflowr","fashion",
"@jennifersterger So you BUSTing out the #CarmenSanDiego outfit for Halloween again this year? #SeeWhatIDidThere #BestCostumeEver","@wraithblade","fashion",
"@Georganne400h what airport you in, where you going to now? you been around the world more then Carmen Sandiego ever been past few weeks lol","@_M_23__","travel","w"
"Strong urge to play Where in the World is Carmen Sandiego. ✈️🚢🚣 #travelbug #explorer","@liannevalle","cultural-icon","x"
"Already have my next Halloween costume planned out. Carmen Sandiego. My date&39;ll go as Where&39;s Wally. Always wanted to do that","@jenkinsjw164","cultural-icon",
"She found me!!! #CarmenSandiego #photobomb #HappyHalloween #OctoberZone #troubleseason pixz4fun http://t.co/CEs3jSZPr1","@KillaKarla928","cultural-icon",
"Wondering what happened to the edutainment game software of your youth, like Reader Rabbit and Oregon Trail? This article covers the corporate shenanigans that led to their downfall. https://t.co/kzXJi25XN0","@ArcadeSpiritsVN","edutainment",
"The news you find out through your company's daily enewsletter... I will watch this. I don't care how old I am. Carmen San Diego was AWESOME... along with The Magic School Bus... https://t.co/J5sLDZtfOB","@jagged_sapphire","cultural-icon",
"A lot of the games I played put dreams of travel in me: Carmen Sandiego, Leisure Suit Larry 5, Indiana Jones and the Fate Of Atlantis (what should’ve been the 4th Indy movie but we got Crystal Skull instead.) They used real locations which just made it more palpable.","@nyhcmaven84","cultural-icon","x"
"Apparently PK Subban found Carmen Sandiego and stole her hat. https://t.co/jYni1ZqWCt","@NickMacK9","cultural-icon",
"Lady Gaga Is Really Into Dressing Like Carmen SanDiego Lately https://t.co/auLmSScIqM #elle #fashion","@Qk_Jewelry","fashion",
"Playing ""Where In the World is Carmen Sandiego?: the Board Game"" and we just learned that there's a ham museum in Dubuque, Iowa. https://t.co/nRUXcraCe8","@VeryDragons","edutainment",
"Carmen SanDiego was a great show because it taught an entire generation geography, history, and that beautiful women wil","@masaihori","role-model",
"Why Vonte Stole Carmen Sandiego Hat..? https://t.co/qi8SIhXxLJ","@LCTheLegend","fashion",
"Facebook Hides Your Exes, Carmen Sandiego Returns on Mobile… [Digest] https://t.co/hM0VjZATQP #Science #MakeUseOf","@PakCStuff","cultural-icon",
"Dyn Swiped Her Hat And Trench From Carmen Sandiego's Closet #fakeheadlinebot #learntocode #makeatwitterbot #javascript","@javascriptisez","fashion",
"@theAPEXassoc Make a 'follow @joepleader' Carmen San Diego style map--with hints--see who guesses where he'll be each week! Bon Voyage! ;)","@designerjet","fashion",
"Ok, I'm done fixing racism for tonight. Can we discuss the greatness of the #Empire hashflag some more? A cookie in a Carmen Sandiego hat!","@ItsTheBrandi","fashion",
"@runwithskizzers ARE YOU EVER NOT TRAVELLING, CARMEN SANDIEGO?","@DaveCarr","travel","w"
"I found them both here, together @wizardworld Des Moines! #cosplay #comiccon #carmensandiego #waldo https://t.co/okfSkKIbKl","@mattpeppler","fashion",
"Facts! I still see Carmen San Diego as a female icon!!!! Do you know how many male thief we praise in these streets? https://t.co/Jh1Q3EFGc3","@twerkforcondoms","role-model","x"
"I remember learning about Mansa Musa from my Carmen Sandiego computer game #nerdmoment https://t.co/tDQgi1Ran8","@Jess_Nelson","edutainment",
"@EW plot twist Carmen Sandiego steals the Magic School Bus!","@stanford88_07","cultural-icon",
"Where in the world is Carmen Sandiego? 💃🌎 #xoxo #fashion http://t.co/4FlRAXxfsE","@HillyHindi","fashion",
"Do it, Rockapella! The hunt for the the red fedora wearing super thief begins once more https://t.co/83puVJktfk","@TheGeekFinity","cultural-icon",
"@soonaorlater @chuchugoogoo Carmen sandiego style","@zachtratar","fashion",
"VIDEO: 10 Reasons Where in the World Is Carmen Sandiego? Was the Best Educational TV Show Ever https://t.co/73wIOE1o3S","@CelebritySights","edutainment",
"Apparently, @Soembie is the latina version of Carmen San Diego, ""Carmen Santiago"". 😂😂 @overwatchleague https://t.co/OQf8kkE9pC https://t.co/vEdnS3uFhW","@Puban_Games","cultural-icon",
"I don't ever want to not be cosplaying Carmen Sandiego; makes me feel like I have legs for days! #shortpersonhack #cosplay","@ClaireGorges","fashion",
"VIDEO: 10 Reasons Where in the World Is Carmen Sandiego? Was the Best Educational TV Show … https://t.co/hFdOf6MjM4 https://t.co/mITinwiMEg","@SierraZingaro","edutainment",
"In which I attend a costume convention, find Carmen Sandiego and see a Ned Stark who is warden of a wig stand: https://t.co/etWEMmKgCo","@NSavidge","cultural-icon",
"I've had a beer in Dominican Republic and Puerto Rico today. If I have one tonight I'll be like the Carmen Sandiego of drinking.","@MikeCastiner","cultural-icon",
"I love when people travel the world 🌎✈..i just hate when yall come back and act like no one else did it before 🙄🙄 relax carmen sandiego..most of us been there already 😒","@keeonB_thatbeme","travel",
"Bestie is going as Carmen Sandiego for Halloween, I'm going as a nurse with fake blood all over my scrubs. I'm so excited","@toteshigh","fashion",
"This elusive criminal mastermind decked out in red is here to teach a thing or two, as I take a look back at Where on Earth is Carmen Sandiego. This article covers the #cartoon and a little about the character that has stuck with me through the years. https://t.co/fiypruqCOC","@StephenWilds","edutainment","x"
"Umm...What in the what now?!? No. Nooooo! 40something me refuses to accept this. Carmen Sandiego was a mysterious badass traveling the world getting acapella songs written about her. She was #lifegoals. https://t.co/oeJDEhzzUX","@virgogirlgm","role-model",
"I was reading this article about The Learning Company and its history, and this sentence brought a smile to my face. It's things like it that make me feel like part of something bigger than myself. https://t.co/cLaDUmoDsh https://t.co/lYGR7vREvS","@MrEightThreeOne","edutainment",
"Channeling Carmen Sandiego on set today 😍🎬💄💁🏽 Also wearing two jackets because winter will never… https://t.co/JSd7L0gLuM","@NatalieTheGeek","fashion",
"Watch @marcysutton's talk for the Carmen Sandiego references, stay to learn a lot about tricky #a11y challenges. 😎 https://t.co/RoB37Ehiwk","@kimberlymunoz","edutainment",
"@chemAKal WHERE IN THE WORLD IS CARMEN SANDIEGO! Now I want a big red hat... #MuSci","@magyarflutist","cultural-icon",
"@vvarh0l im looking for my where in the usa carmen sandiego game to continue the learning fun","@samrelated","edutainment",
"2015: Took on the look of my favorite career criminal, Carmen Sandiego, in one of my favorite costumes least favorite photos of my life. What even is my face? Why am I mean mugging a look that deserves a cocky grin? We may never know. https://t.co/5I3dBqqLnk","@JeffP888","fashion",
"@BellaSassin Getting Carmen Sandiego vibes from you in that hat. Makes sense since you stole Theresa May's very expensive towel.","@dinoconservativ","fashion",
"Already have my next Halloween costume planned out. Carmen Sandiego. My date&39;ll go as Where&39;s Wally. Always wanted to do that","@lesterjoqmv","cultural-icon",
"One of the Delta flight attendants is wearing a straight up Carmen San Diego outfit.","@AndrewJLicari","fashion",
"Gina Rodriguez is Carmen San Diego? WOW. I like it. Carmen San Diego is one of my favorite female charaters/role model as a kid.","@BangtanLena","role-model","x"
"I was trying to sleep but the theme song to Where in Time is Carmen Sandiego? popped into my head, so to hell with that idea, I guess.","@DannyShanahan","cultural-icon","x"
"VIDEO: 10 Reasons Where in the World Is Carmen Sandiego? Was the Best Educational TV Show … https://t.co/3GVnrjbc0C https://t.co/3PdbDdOi81","@GenXstyle","edutainment",
"Carmen Sandiego lost her hat... https://t.co/5GEpX2HBdq","@expectproblems","fashion",
"626555692380336129","My kids love where is Carmen San Diego just as much as I did! 😎 they are so cool!","cultural-icon",
"Miguel's latest reaches into the history of educational games, and explores how one in particular wanted to teach us to teach ourselves. Opened World: Finding Her - Miguel Penabella travels the world with Carmen Sandiego. https://t.co/CeoBhzChJC https://t.co/CqsmaRMX78","@haywiremag","edutainment",
"I learned a lot about world geography form Carmen Sandiego. That was my show","@Tabasco08","edutainment","x"
"Carmen Sandiego cause it's about to travel more than it could ever imagine https://t.co/hWCxyNxAev","@Bdurbs","travel",
"totally being Carmen San Diego for Halloween and if you don't know who that is, I feel sorry for your childhood","@jennatort","cultural-icon",
"It has been decided that my hat is a cross between Carmen sandiego and Dorothy Parker. I like that combo! #bringbackhats","@beth_parker","fashion",
"When #AgentCarter wears her dresses with big hats, I think of Carmen San Diego.","@HiltonCollins","fashion",
"@Holtarna @Phukfaic @chxmicalwarfare @Overmayor This sounds like an actualized version of the time travel Carmen Sandiego game from the 90s that I remember playing and ragequitting because it was too frivolous.","@PunkerTY","cultural-icon",
"""To travel is to live.."" | So grateful to share this experience with carmen_sandiego_! We've prayed,… http://t.co/7PXxlMqqT5","@JasmineAlston","travel",
"I FOUND THEM BOTH!! #whereswaldo #carmensandiego #cosplay #nycc #comiccon #costume #fun… https://t.co/eeAGKVkTY8","@crazyalcayne","fashion",
"@sarah_connors everyone who travels regularly should be required by law to wear a Carmen Sandiego outfit","@ari_raid","fashion","w"
"I'm not sure where this bus is going, but I'm sitting between Waldo and Carmen San Diego.","@scrotificient","travel",
"@SarahBarthel That hat is very Carmen Sandiego. #whereintheworldissarahbarthel","@joeyishellagood","fashion",
"#HowOldAreYou playing Carmen Sandiego and The oregon trail on floppy disk in ""computer science"" #Lmao","@marlaa","edutainment",
"Why Where in the World Is Carmen Sandiego? Was the Best Educational Show Ever : https://t.co/7iUw7URYAm https://t.co/kW0vgSIn9T","@mdtoorder","edutainment",
"@NCFox1 @LisaHarveyNC @JackieHarling1 @AncientGreekk @ruckin_ Carmen San Diego, The Magic School Bus, Square One, Ghost Writer and many more classics back in the day","@KrisMayhue","cultural-icon",
"Who asks this???? Who? They obviously didn't play ""Where in the USA is Carmen Sandiego"" during elementary school. https://t.co/ZAoZrP6sHO","@tehloserprince","edutainment",
"I wanted to literally BE Carmen Sandiego growing up as a young Latina girl. She was brilliant, sly, and funny. And her fucking sense of style was epic. This is such perfect casting and I’m dying over this. https://t.co/dR7xqiTZoV","@NefariousSiren","fashion","X"
"there is no edutainment character cooler than carmen sandiego","@carnikiss","edutainment","w"
"VIDEO: 10 Reasons Where in the World Is Carmen Sandiego? Was the Best Educational TV Show … … https://t.co/8aiwRjn1Mo","@brenda_tyler2","edutainment",
"Carmen Sandiego Returns in a New Educational App https://t.co/DXQdIhFLeu https://t.co/KbwQ9tfL6f","@LerchIrma","spam",
"Permanently inspired by Carmen Sandiego. 💄#always #mylook #hat #lipstick #brunette #blackandwhite… https://t.co/9EgGlrQz5f","@sampulon","fashion","x"
"If tease image is indicative of overall style I am freaking IN. The world could always use more Latina anti-heroes! https://t.co/vVW4WjXDxF","@SuedeBlade","fashion","w"
"First half analysis: Erin Andrews is wearing a Carmen Sandiego costume. Terry Bradshaw ate a bunch of red pistachios before halftime.","@TGJamison","fashion",
"#HappyBDay to Puerto Rican- American Rita Moreno! 'Anita' in ""West Side story""; Carmen, ""Where on Earth is Carmen Sandiego?"" animated series","@l_valles_c","role-model",
"Time to get my Carmen San Diego and start planning this trip abroad.","@Eddie_Kearney","travel","x"
"been booking flights like carmen san diego recently","@KevaKevs","travel","x"
"there's been TWO Carmen Sandiego references on YouTube this week and I'm super happy ab it. thank you @Jenna_Marbles and also @GameGrumps 💖","@awgkarth","cultural-icon",
"Where in the world is Carmen Sandiego? On a bus in Seattle. https://t.co/rv5v5HEXX2 https://t.co/ICvXh7gfXm","@PhotonFluxCA","travel",
"😳her and that red coat lolRT @PreachMAC: Anybody remember Carmen San Diego?? Lol #random","@DaniellARanaE","fashion",
"Wearing my mom's vintage coat from the 70s. Always makes me feel a bit like Carmen Sandiego http://t.co/y4WADY62qc","@tagsalegirl","fashion",
"Just referenced Carmen Sandiego and now I feel old.","@teejsartor","cultural-icon","w"
"Whenever you’re feeling down about your bad decisions, remember that a winner on Where in the World is Carmen Sandiego once chose Idaho as her prize vacation. So cheer up emo kid.","@tinyelvisbkwd","travel",
"Where in the world is Carmen Sandiego? #Winter #travel #WhereInTheWorld http://t.co/JTa5nTKjYW","@kimray02","travel",
"@HoneyBxo_ lookin like. Cute ass Carmen sandiego with that hat on","@StevieDaGod","fashion",
"The rise and fall of the company behind millennials' favorite educational games https://t.co/julG9pbyLr via @outline","@staceyrdecker","edutainment",
".@Snowden & girlfriend win best #Halloween costumes. #CarmenSandiego #Waldo https://t.co/fEusuqn8vx","@ActOutonOccupy","fashion",
"@ginamarie72310 If you had a red trench coat, I would think you were Carmen Sandiego","@skykestrel","fashion",
"@megturney @TheMilesLuna @BGibbles you're one giant floppy hat away from a gold Carmen San Diego cosplay","@broseidon1992","fashion",
"How Carmen Sandiego accidentally became an educational game icon https://t.co/7x6kVWnHVB","@platonictornado","role-model",
"@ittoujuu @TheOtakusphere But Where In Time Is Carmen Sandiego taught me that ancient Rome had running water and sewage pipes!","@irothtin","edutainment","x"
"@SageRosenfels18 Carmen San Diego also wears that coat well.","@garlan010","fashion",
"Sometimes I get a strong urge to play ""Where in the world is Carmen San Diego"" circa 1995. I miss the travel agent the most. #90sareallthat","@ealexhancock","cultural-icon","x"
"VIDEO: 10 Reasons Where in the World Is Carmen Sandiego? Was the Best Educational TV Show … https://t.co/vLq0i0p0bO https://t.co/QO6heFaXX9","@lunabonifacio25","edutainment",
"@LaceyEvansWWE @WWENXT And a Carmen Sandiego hat.","@confusedraptor","fashion",
"VIDEO: 10 Reasons Where in the World Is Carmen Sandiego? Was the Best Educational TV Show Ever https://t.co/APAO5UUisL","@ElouiseDeceile","edutainment",
"Keeba: Where did you learn geography? Me: Where in the world is Carmen Sandiego?","@zmr94","edutainment","w"
"This is how I learned my geography #carmensandiego #videogames #retro https://t.co/sryeuKwExa","@RillaMulwane","cultural-icon","w"
"Gina Rodriguez Will Play The Iconic Carmen Sandiego In An Upcoming Netflix Live-Action Film https://t.co/8yrAnvw3vc via @MeAliVelez","@JessHSun","cultural-icon",
"#technos Gina Rodriguez donning red fedora and trench coat of Carmen Sandiego https://t.co/Iaf60umvEy","@akemoi","cultural-icon",
"If someone made Acme gumshoe jackets as worn on Where in the World is Carmen Sandiego, I would buy one & wear it until the sleeves fell off.","@LucyNaturae","fashion","x"
"literally me. I can so far speak french fluently but conversational farsi, Spanish, Korean and Amharic (Ethiopian)\. Anyone willing to teach me more conversational languages are more than welcome but I need to be #CarmenSanDiego therefore I learn what I can https://t.co/zFhcOxi1f4","@Diamond_ChaseMi","edutainment",
"2015 here I come! Can't wait to explore the world - where will I end up? #CarmenSandiego http://t.co/iSQKQYRivJ","@KerryFaye74","travel","x"
"436906897158197249","I feel like Carmen sandiego considering I've been all over this world.","cultural-icon","travel"
"Who remembers ""Where In the World is Carmen Sandiego?"" That's one of my female hero's. I'd put her up there with Rosa Parks lol.","@SportsGrind_Don","role-model","x"
"Booked a few flights today. I'm never going on holidays, just searching for Carmen Sandiego.","@john_geoffrey","travel",
"@_pronto_ Red hat == Carmen sandiego?","@cheeseanddope","fashion",
"Where in the World Is Carmen Sandiego? Becoming a Secret Travel Agent https://t.co/JyTyWqDlXw","@hackernewsrobot","travel",
"It's 2:30 AM sure but I just learned that the Where in the World is Carmen Sandiego theme song was only CO-written by Sean Altman and that his writing partner was his HIGH SCHOOL FRIEND DAVID FUCKING YAZBEK so NO I can't sleep and WHO COULD BLAME ME","@atarnow","cultural-icon",
"I swear I learned this playing Where In Time Is Carmen Sandiego (1997, PC)","@SamwellGnarly_","edutainment","w"
"To clarify, both female characters become Carmen Sandiego at the end? (I'm asking based on their hats) #TrueDetective #TrueDetectiveFinale","@sliss630","fashion",
"Where in the world is Carmen Sandiego aka @embassthon? Actually, can we get Rockapella to serenade her on her journey?","@AlicesAstroInfo","travel",
"@ErinAndrews I love that you were rocking the #CarmenSanDiego outfit at the #NFCChampionship today","@wmckeveny","fashion",
"I really do need a costume tho. Last time I dressed up, I was Carmen San Diego and that was 2 years ago.","@__Miri__","fashion",
"Am I Carmen Sandiego now? Because I'm fine with that. I want to travel. And learn how to hack.","@dancingofpens","travel","x"
"@HerInteractive @ZerinaGrace Love the time travel idea! Maybe her and Carmen Sandiego can team up lol #nancydrewrocks","@AyEll922","cultural-icon",
"Where in the world is Carmen San Diego? Is time to plan this years get always ... 🌎🌍🌏🌪🌪 #life #travel #goodmorning … https://t.co/mg1V033bRP","@PeepholeWorld","travel",
"932824202767343617","@TonyAlbrecht @laurclinn I’ll put in a second vote for Carmen Sandiego - cemented my love of geography & International relations that would stay with me for a lifetime.","cultural-icon","edutainment"
"The ""I found a mirror"" version of Carmen Sandiego #Halloween #Airport https://t.co/Xue25mqa6p","@pleia2","fashion",
"Super stoked to learn abou the history of educational games tonight! Who loved Math Blaster, Oregon Trail, or Carmen San Diego? What was your favorite ""educational"" game?","@LoadingLaw","edutainment",
"@pc_gamer_squid 1. Do educational PC games count? If so, Where in the World Is Carmen Sandiego.","@pc_gamer_squid","cultural-icon",
"@brogepi You really really really do. Carmen Sandiego-style bureaucracy at its finest.","@discordfairy","cultural-icon",
"Kourtney Kardashian Takes Younes Bendjima on a Surprise Birthday Trip Oh, the places they'll go! Kourtney Kardashian channeled her inner Carmen San Diego for Younes Bendjima's birthday--and no, we're not talking about a role-playing fantasy....","@_teen_problem","travel",
