"text","handle","category","star_tweet"
"usatodaylife: People on Twitter are comparing the style choice to looks worn by pop icon Michael Jackson and fictional characters Carmen Sandiego and Indiana Jones: https://t.co/ScI6s6ZDs5","@channel1et","fashion",
"I think Marc Jacobs inspiration was Carmen San Diego 😂 #NYFW https://t.co/jw5aDzIxnu","@rayeesuh","fashion",
"@CarmenSandiejo what if we were both carmen sandiego wearing waldo outfits under our carmen sandiecoats","@ryfkah","fashion",
"@nicolelynnhoefs yes! Carmen Sandiego is so awesome and it's not complicated cosplay.","@booksandwine","fashion",
"Sounds like Netflix is bringing back ""Where in the World is Carmen Sandiego?"" https://t.co/IgoMVkaJUw vía @HuffPostEnt","@AnaVM","cultural-icon",
"#TheVerge Netflix orders animated Carmen Sandiego series https://t.co/P8E3gVBiX4 https://t.co/p46nMetWPj","@TechieTurf","cultural-icon",
"On a brighter note, I dressed up as Carmen Sandiego for Halloween. https://t.co/CYAIJWMl9b","@thatpeterfox","fashion",
"@AnnTran_ is a real life Carmen Sandiego! https://t.co/wW01M4tg1N","@JasonWRocco","cultural-icon",
"Netflix Is Reportedly Reviving Carmen Sandiego With Gina Rodriguez #Celebrities https://t.co/0daVHJ68nh","@CelebritiesNwsl","cultural-icon",
"Jane The Virgin’s Gina Rodriguez To Star In New Netflix Series Carmen Sandiego https://t.co/LNg8uSNeU6 https://t.co/7KgcSrsuAm","@Nobsdaslushhkid","cultural-icon",
"Netflix Developing Live-Action Carmen Sandiego Movie https://t.co/Nr8034sm9z https://t.co/lnGNYrIWGQ","@syndrome208","cultural-icon",
"Gisele Bundchen skipped the #MetGala to cosplay Carmen Sandiego at #ChanelCruiseCuba https://t.co/XRcrhgNsTc https://t.co/7Hu6WecV4X","@Racked","fashion","x"
"Found Carmen Sandiego. She's in Montreal if anyones still looking for her. http://t.co/x10FhK6Li8","@foff_d","fashion",
"Where On Earth Is Carmen Sandiego is an old favorite of mine from childhood. I was raised by examples of powerful Women... Not Feminists. https://t.co/zjddX9JH20","@SaitoNetwork","feminism",
"📷 cowscratch: ginarodriguez-news: Netflix Reboots ‘Carmen Sandiego’ With Gina Rodriguez Where in the... https://t.co/LME4B3kRxq","@VioletVioIence","cultural-icon",
"Maybe I should be Carmen Sandiego for Halloween.","@CarmenSandiegOh","fashion",
"@neontrotsky I will never forget that I learned the word spelunking from the Carmen Sandiego computer game","@neontrotsky","edutainment",
"That where in the world is Carmen Sandiego hat... Girl bye... Have several 💺💺💺","@afi_sexiblack","fashion",
"@Meems852 @irvspanish Something using primary sources, google earth, and green screen video? Think Where in the World is Carmen San Diego but for people not geography?","@mrterborg","cultural-icon",
"Wait Carmen San Diego is coming to Netflix? WHERE IN THE WORLD was I when this was announced.","@Trasufoma","cultural-icon",
"VIDEO: 10 Reasons Where in the World Is Carmen Sandiego? Was the Best Educational TV Show … https://t.co/ExiwTgDZF2 https://t.co/Q0DOeg2If9","@doogjohn","edutainment",
"My beloved Crash Bandicoot has been successfully stolen at work and put with @zecmo's Spider-Man & @laurenelliott's Carmen San Diego hat. Take a good care of the office while I'm away, Crash. https://t.co/8ZVetQV4nG","@bmmashat","cultural-icon",
"Someone please tell me not to bring my complete Carmen Sandiego cosplay with me to Vegas. I DON'T HAVE ROOM IN MY LUGGAGE. OR THE TIME TO DEDICATE TO A PHOTO SHOOT.","@CarmenSandiejo","fashion",
"Erin Andrews channeling her inner Carmen Sandiego in that coat & hat. #GBvsSEA #NFCChampionship","@shellbelle0123","fashion",
"TV News Roundup: Netflix’s Carmen Sandiego Series With Gina Rodriguez Sets Premiere Date https://t.co/HiYvU4nSLU https://t.co/bKUAfQGibV","@Variety_TV","cultural-icon",
"10 reasons Where in the World Is Carmen Sandiego? was the best educational TV show ever https://t.co/TKH5eBFkbP https://t.co/66R0JdyOms","@news8magazine","edutainment",
"Life goal✔️ 7 days, 7 completely random places. Where will I end up? Stay tuned to see. ✈️🚂🚎#CarmenSanDiego #adventuretime #travelgram https://t.co/oXYJ1grZBw","@coopscadoop","travel","x"
"Why do I remember Carmen Sandiego with dark hair? If she’s a red head how have I not been her for Halloween yet? https://t.co/RgDM1o2sVG","@katieferg","cultural-icon",
"tired of my black trench coat but every time I try on a khaki one I feel like Carmen Sandiego or Inspector Gadget.","@bunnyinthecity9","fashion",
"@gtijerina well come visit anytime with your clan. You guys hope all over the globe like Carmen San Diego.","@PatrickGorman3","travel",
"Where In the World is Carmen Sandiego? Apparently my apartment, have a convention... #happyhalloween… http://t.co/kaN5p6toHK","@ceciliayudin","fashion",
"(Netflix’s ‘Carmen Sandiego’ Film Gets ‘Game Night’ Writer) Read the article here - https://t.co/MSD1n3i6Gx https://t.co/hjdkc1Zjnp","@SBOCMEDIA","cultural-icon",
"Easy to make Carmen Sandiego & Inspector Gadget costumes. http://t.co/VC7m9AHGfs","@urbanthriftyyc","fashion",
"Where in the world is Carmen San Diego? #AdventureGirls #MissingMyAce #ItsAllGood #Travel #Focus… https://t.co/ZdZj4UOI8M","@LIVEinTheBOOthe","travel",
"So admittedly, I learned geography from playing ""Where in the World is Carmen Sandiego"" on my computer. You know I'm cool. #gaymer","@DrYoshi2","edutainment","x"
"@HerryNelson34 I found a KFC toy of Carmen Sandiego's car on Amazon! She must be in it!","@JeremiahLiles1","cultural-icon",
"@skepchicks where in the world is Carmen SanDiego?! You're a tough chick thank you and although I was a few years back from you, it's still","@LittleMeilee","cultural-icon",
"Chuck Norris always knows the EXACT location of Carmen SanDiego.","@chucknorriskik","cultural-icon",
"""Carmen Sandiego? Who's that? What did she teach?"" Obviously not anything to you #beerlinewoes","@debbie25lw","edutainment",
"Where in the world is Carmen Sandiego? Its not rocket science. #Pakistan #Zawahiri https://t.co/On8VFsgB88","@PiratesMutiny","cultural-icon",
"@kenjisalk @iSmashFizzle THIS is what I got from Carmen Sandiego. Because of this...I WANTED to BE her!","@Mojavi_8","inspiration",
"[Photographer]Waldo and Carmen Sandiego via /r/cosplay https://t.co/7P8CfpN5zn #cosplay https://t.co/JlpImTmMpN","@CosplayLove2","cultural-icon",
"I dreamt I cosplayed/crossdressed (Cross-Played?) as Carmen Sandiego for a Con, and I woke up just as I saw myself in the mirror and realized I was wearing the Hat wrong. Thinking back at it, I think I can pull it off with the right kind of Training...","@CJHuaman94","fashion",
"Where in the world is Carmen SanDiego? 🌎💫 #MadysinHatter #wheelsup #travel #adventure #summer… https://t.co/8ZIWImCLrh","@MadysinHatter","travel",
"SNL tries some edutainment with Where In The World Is Kellyanne Conway? https://t.co/ENqJol4z1u","@digg","cultural-icon",
"Raise your hand if the only time you've ever heard about Interpol was from playing Carmen Sandiego","@JYuter","cultural-icon",
"How Carmen Sandiego accidentally became an educational game icon https://t.co/PbCeuV5KT5","@luizftom","edutainment",
"Y’all....... so many people thought I was Carmen Sandiego today...........","@heathernharmony","fashion",
"tell me, where in the world is Carmen San Diego?","@erynmcc","cultural-icon",
"Gina Rodriguez Is Carmen Sandiego In Netflix’s New Live-Action Film @okayplayer https://t.co/CWWPcJ6Y6b","@TheLueCrew","cultural-icon",
"#Where on the #planet Is #Carmen #Sandiego? (On #Netflix, and She s #Being #Played by Gina Rodriguez): Image: Getty In 2017, #Netflix revealed that Gina Rodriguez would be voicing the daring woman in red, #Carmen #Sandiego, for an animated series. Now,… https://t.co/Hq9pJNwGQu https://t.co/m6AaV7JXQx","@hetflixdotcom","cultural-icon",
"Gina Rodriguez to Voice Carmen Sandiego in New Animated Netflix Series Carmen Sandiego is coming to Netflix! https://t.co/so5ZiIBOkr","@kristoferkawas","cultural-icon",
"@SuperCaballeroJ Imagine it, Carmen Sandiego as a legacy name given to all these smart women of color from all around the world!","@SuperCaballeroJ","feminism","x"
"Gina Rodriguez To Star As Carmen Sandiego In Netflix Live-Action Feature https://t.co/YnnOjEbLos #Movies #TV","@watchtvcentral","cultural-icon",
"@BigBird Carmen Sandiego's fedora hat, trenchcoat & convertible are red, her favorite color.","@JeremiahLiles1","fashion",
"@buckleit Tells it like it was. Tough to live through the transition from CDRom to Internet to Mobile. Long live #broderbundsoftware #edutainment #cdrom #educationalsoftware #learninggames #thelearningcompany @buckleit . https://t.co/ItvfOlCrTU","@nancymacintyre","cultural-icon",
"Seriously tho. @ladygaga is the real life Carmen Sandiego lol https://t.co/W14GEB636f","@karinacasaS","cultural-icon",
"@revealingmia didn't know you were still traveling, carmen sandiego! have fun 😄","@kidlightyear","travel",
"Do it, Rockapella: Netflix is Making a New 'Carmen Sandiego' Show - Geek https://t.co/ThMwGsmcLb","@NewGamesPlay","cultural-icon",
"#FlashbackFriday Where in the World is Carmen SanDiego? taught me everything I know today about geography. This dude was my fave bad guy https://t.co/myJBxwZ8U1","@MikMaqRacer83","cultural-icon",
"@SixFootGelfling I would! I remember waaaay back in the day of Carmen Sandiego having to research stuff for it. Learning is fun!","@panzerdaves","edutainment",
"Shared universe with Dora the Explorer, Go Diego Go, Carmen Sandiego, and Where’s Waldo.","@theotherlaser","cultural-icon",
"Bethenny walked into lunch with Carole wearing the latest in ""Where in the World is Carmen San Diego?"" fashion. #RHONY","@TheHopeSpears","fashion",
"Gina Rodriguez Voicing Carmen Sandiego in Netflix Show https://t.co/wlPtujV4IZ https://t.co/my9wvtHJkJ","@chrisdor2","cultural-icon",
"Gina Rodriguez Voicing Carmen Sandiego in Netflix Show - Where in the world is Carmen Sandiego? Apparently, the... https://t.co/QXQrT8CbJB","@SuperCon2K","cultural-icon",
"Can't wait to tell my kids what Arthur and Carmen Sandiego were like as we choke on coal fumes https://t.co/61CqpqEpj9","@CHIEFSAMBO","cultural-icon",
"@aliissocute @PsychicTerrain Get back to me when Mario can wear Pauline's dress. ...and her fabulous Carmen Sandiego hat!","@Stryc9Fuego","fashion",
"In an uber car in London going to the airport to get to Paris. It's 3am here. #carmensandiego","@jolinda22","travel","w"
"#Netflix officially announces their #CarmenSandiego animated series. https://t.co/cHfHyLnr0Q https://t.co/X6U9q4zPXQ","@RealmBeyondS","cultural-icon",
"If I'm ever in a relationship during Halloween I want to do a couples costume of Carmen Sandiego and Waldo.","@Haroldd_C","fashion",
"I know jack about Carmen Sandiego but that new Netflix series looks pretty danged cool","@chrisairbud","cultural-icon",
"Lets play “where in the world is Nick?” #travels #memories #carmensandiego https://t.co/9JUwArnhWM","@nickyahogan","travel",
"Carmen Sandiego' Netflix Animated Series Starring Gina Rodriguez Approved https://t.co/dI1tk6j0mE — Newsmax (newsmax) April 18, 2017","@Roses_4_Thorns","cultural-icon",
"This Popular 1980s Cartoon Is Getting the Netflix Treatment https://t.co/3Yrvm9gwAe https://t.co/EQ7JMyYTNb","@Erendero","cultural-icon",
"@almielag spelunking will always be my favorite word (which I learned as a youngin from the Where In the World Is Carmen San Diego? game)","@neontrotsky","edutainment",
"TheVerge: Netflix orders animated Carmen Sandiego series https://t.co/JH6MAKktsN","@boreronews","cultural-icon",
"He's Mark Cuban, not Carmen San Diego or Dora the Explorer https://t.co/4R8ZrsYSdQ","@azsportsguy","cultural-icon",
"Iconic! Netflix Is Bringing Back OG Scammer Carmen Sandiego & Everyone Is GEEKED https://t.co/XXjUlMeoNc #Bossip #SuCity #Music https://t.co/WIgdUwo4XV","@SuCityRecords","cultural-icon",
"Feeling nostalgic #eci834? Give @TheCrashCourse educational games a watch! #carmensandiego was my favourite! #edtech https://t.co/atpRutZatL","@AndrewForeman21","cultural-icon",
"@friedmanjon New headcanon: Waldo and Carmen Sandiego become travel buddies and go on adventures together.","@Batshua","travel",
"@sassy_skater she's time traveling like Carmen Sandiego","@barbiebackstage","cultural-icon",
"Gina Rodriguez to star as Carmen Sandiego in Netflix live-action feature https://t.co/14qH5su1vb","@Phil_Lewis_","cultural-icon",
"Carmen Sandiego Is Officially Happening With Gina Rodriguez at Netflix https://t.co/OqHso3KsAa https://t.co/zSBuRV0Gr9","@Arka_kharismaaa","cultural-icon",
"Chuck Norris knows where Carmen Sandiego is #chucknorrisfacts","@Talktodjrp","cultural-icon",
"For how much I enjoyed watching Where In The World is Carmen Sandiego as a child you would think I’d be better at geography.","@aaronnelsen","cultural-icon",
"@PeterBurnsESPN A real life Carmen SanDiego","@dhamner1906","cultural-icon",
"Chuck Norris knows where Carmen Sandiego is.","@December21st201","cultural-icon",
"Besides Walter White, I don't think there's a villain more beloved than Carmen Sandiego.","@DGLee_","cultural-icon",
"@AudreyMcClellan I learned how to find where Carmen Sandiego was! #SchoolHappens","@McK3lly","cultural-icon",
"Gina Rodriguez, ‘Stranger Things’ actor, to lend voice to Netflix’s ‘Carmen Sandiego’ https://t.co/KNfZpHMPc3 #gaming","@gamerkiddieYT","cultural-icon",
"VIDEO: 10 Reasons Where in the World Is Carmen Sandiego? Was the Best Educational TV Show Ever https://t.co/ftUvspgSc4 via @People","@Jill_Chodak","edutainment",
"@CocoTRobot Nice hat, carmen sandiego","@fritolaysia","fashion",
"Um... SUPER EXCITED #carmensandiego is making a comeback on @netflix! She inspired my favorite Halloween costume. #whereintheworldiscarmensandiego 🌍 🧳 🚔 ✈️ 🗺 🚊 https://t.co/jqfzcPykQe","@MeloDtime","inspiration","x"
"I've always liked the red mage outfit in the FF saga. It's like a mix of Carmen Sandiego, a fencer, and a mage","@Lexisizestuff","fashion",
"Netflix is betting on ‘90s kids nostalgia for learning with upcoming lineup https://t.co/veEiQH3Tz5 via @Polygon","@sacrament_ent","edutainment",
"Gina Rodriguez To Star As Carmen Sandiego In Netflix Live-Action Feature https://t.co/TN3KpvxRXq via @deadline","@blugirl718","cultural-icon",
"@natalieweber8 she's like the real life Carmen San Diego","@linds_free","travel",
"I read an article recently about an ""Ultimate D&D Party"" who were laid out as Fighter: Conan Rogue: Gray Mauser Healer: Aragorn Wizard: Elminister While this is good, here's mine. I want to hear yours. Fighter: She-Ra Rogue: Carmen Sandiego Healer: Yuna (FFX) Wizard: Aang","@TBPNemo","cultural-icon",
"Already have my next Halloween costume planned out. Carmen Sandiego. My date&39;ll go as Where&39;s Wally. Always wanted to do that","@keshaparromero","cultural-icon",
"Where in the world is Carmen San Diego? #travel #beauty #fun #walk #view #dream #happiness https://t.co/4CDUbkE6h2","@LindsayScherr","cultural-icon",
"""Netflix plans live-action 'Carmen Sandiego' film with Gina Rodriguez"" https://t.co/9GXEdO1aCU","@guzmanadrian","cultural-icon",
"@SurenaXMarie As they just announced ""Carmen Sandiego"" on @netflix, I think you'd be rocking the bad-ass ""gentleman thief"" look... Hardest part of the outfit would be the hat I reckon... #CarmenSandiego #LookingGood 😎🤠","@BoardJg","fashion",
"Gina Rodriguez donning red fedora and trench coat of Carmen Sandiego https://t.co/U2F3TZWPMG","@ForTechSake","cultural-icon",
"Carmen Sandiego Is Officially Happening With Gina Rodriguez at Netflix Get excited, gumshoes! Just days after it was reported that Netflix …","@_teen_problem","cultural-icon",
"""Where In The World Is Rob Ford"" I smell a sequel to the popular educational game ""Where In The World Is Carmen Sandiego?"" #pnpcbc","@TrevorsIdeas","edutainment",
"Newswire: Netflix has finally found Carmen Sandiego https://t.co/iSpauwhY4N https://t.co/uYqGemfwci","@MoviesWrld","cultural-icon",
"@MollyJongFast Where in the world is Carmen SanDiego and can she post my bail?","@BrandonHasWords","cultural-icon",
"Netflix’s Carmen Sandiego Live-Action Movie Just Found Its Carmen https://t.co/MXOSpYJf5S","@LuxuryFashionIt","cultural-icon",
"@ganbariley God, that throws me back all the way to 2004 when they aired Carmen Sandiego on french tv and seeing this gives me hype af","@BetamaxLoss","cultural-icon",
"@toddysire_ More like Carmen Sandiego coming to steal valuable monuments in 2018, where trenchcoats are so cliché. https://t.co/LrxDtmQgki","@WynneRichport","cultural-icon",
"Carmen Sandiego is getting a Netflix series","@Dshwnrd","cultural-icon",
"Gina Rodriguez To Voice Carmen Sandiego For Netflix https://t.co/F23U4FVBeC #breakingnews","@BreakingNewss3","cultural-icon",
"Chuck Norris always knows the EXACT location of Carmen SanDiego.","@andrewtathampi","cultural-icon",
"New post up...and I'm kind of doing a Carmen Sandiego thing with this hat 😂 #liketkit… http://t.co/ZYfJ0xtdG6","@JustAddGlam","fashion",
"@heartoutirwin this is only slightly funny if you know ""where in the world is carmen sandiego"" and even then it's not super funny","@heartoutirwin","cultural-icon",
"@PaganChild Oh lol. I live in Charlotte. That was a play on Carmen San Diego bc I travel so much 😂","@BlkCarmenSDiego","travel",
"We Found Carmen Sandiego On Netflix In January https://t.co/58m3MuwO79","@Vix_Social","cultural-icon",
"What is this Carmen SanDiego dress/jacket she is wearing?!","@jasmineleann","fashion",
"Netflix's 'Carmen Sandiego' debuts on January 19th, 2019 https://t.co/8EiU5IqHsG https://t.co/u0FWQEEvNC","@Illinois_HR","cultural-icon",
"Netflix’s Carmen Sandiego Movie To Be Written By Mark Perez ('Game Night') https://t.co/2kvFy19Ijd","@HotStumbles","cultural-icon",
"Carmen Sandiego May Be Fictional, but Her Style Is Hugely Influential - Racked #sandiego https://t.co/6ToqxCTfzh","@ladygagaa__fans","fashion",
"@TheJoshAVinson I'm trying to make something shake next month , pop up for a weekend or something is you gonna be out there or somewhere else Carmen San Diego","@doobzzNJordan6z","cultural-icon",
"@GreenThe_Tinsle her name is carmen sandiego but she's deaf so it doesn't really matter to her lol","@dumpstercryptid","cultural-icon",
"@kaseylanewrites and here I am getting my Carmen Sandiego costume. Your devil puts me to shame.","@nikimcluff","fashion",
"traveling the country like Carmen San Diego, for the culture. https://t.co/YTG6NRYSbG","@jazzyrae","travel",
"Jane The Virgin’s Gina Rodriguez To Star In New Netflix Series Carmen Sandiego https://t.co/wGlddbyN7q","@nigerianews360","cultural-icon",
"@nickjfrost I think you need a hat to carry it off, then again that could end up a bit 'Carmen Sandiego.'","@TheJPBradley","fashion",
"“Carmen Sandiego” reboot voiced by Gina Rodriguez coming to Netflix https://t.co/cGyPeJXfkZ","@swengenusa","cultural-icon",
"Throwing my hat in the ring for FBI director based on an extremely successful record of consistently finding Carmen Sandiego.","@BenFinfer","cultural-icon",
"@Lauzin My favorite costumes I saw were 11, Hunter S. Thompson & Carmen San Diego because god bless someone who watched PBS in the early to mid 90s","@Lauzin","fashion",
"(Sung to the Carmen Sandiego theme) ♬ Where in the world is / My kidnapped fiancé? ♬","@JTrainNeil","cultural-icon",
"@kellyrpope I shared it with my faculty colleagues and suggested it to the campus library for purchase. You do such a good job of explaining the heist and exposing the crook (w/apologies to Carmen Sandiego). It was fantastic - makes me wish you’d explain the Panama Papers, too. Thank you!","@kwittman","cultural-icon",
"@Drea_PY traveler. It's become like a live version of ""Where is the World is Carmen Sandiego"" with the eldest. It would be good to see him in person.","@Drea_PY","travel",
"@NewYorkPBS @ThirteenWNET Public schools educated me- and public television was great for me. From Sesame Street, Mr. Rogers’ Neighborhood, Reading Rainbow, Ghostwriter, Where in the World is Carmen Sandiego, and countless other shows, I appreciate what public TV has done. https://t.co/Df2CrqL5PG","@jamaaltbailey","cultural-icon",
"I've traveled to the East Coast under the guise of ""Christmas,"" but I'm actually here to capture Carmen Sandiego. Don't tell the internet.","@MichaelVarrati","cultural-icon",
"Hb and this “where is Carmen San Diego” profile pic","@_JXRGE_","cultural-icon",
"📷 Happy #Halloween everyone from #CarmenSandiego #costume (at City In The Park) https://t.co/kLoJeGBEzu","@Aviewfromabroad","fashion",
"Had so much fun playing the Where in the World is Carmen Sandiego game with my girl (she found it less fun than I did, but she’ll learn). You sort through clues about locations, stolen objects and criminals until you know what Carmen took and where she i… https://t.co/suT2SzoKUZ https://t.co/26Cm3NyH0e","@ourdailycraft","edutainment",
"Carmen Sandiego costume: One (1) little black dress One (1) long red coat One (1) big red hat Many (lots) of stolen accessories","@techn0madic","fashion",
"@DrewsClues Netflix is doing a live action version with Gina Rodriguez as Carmen San Diego.","@elmer_e_ortiz","cultural-icon",
"VOTE: @ladygaga or Carmen Sandiego - who wore it better? http://t.co/xPOGkGRv2W http://t.co/qnAdHABiHC","@PopCrush","fashion",
"""Netflix orders animated Carmen Sandiego series"" https://t.co/Rou9WZitFH","@superdficial","cultural-icon",
"One 3rd party character I would have liked to see in the Smash Bros is Carmen Sandiego","@QBynoeOgle","cultural-icon",
"""Carmen San Diego’s signature smirk gives it away: travelers are having questionably legal amounts of fun."" http://t.co/PrPIrUkRdz","@TUStudyAbroad","travel",
"Carmen Sandiego Returns in a New Educational App https://t.co/WR0NLrDO9G https://t.co/2wnoktU1uY","@mariajjohnson_j","edutainment",
"The Carmen Sandiego Movie Sets Its Sights on Netflix https://t.co/0TsqCu1rhW https://t.co/cmQX531OEV","@Twinfinite","cultural-icon",
"If the Wide-Brim Hat Fits! Gina Rodriguez Will Play Carmen Sandiego in Live-Action Movie https://t.co/cql3ZwkfGK https://t.co/Ij7raTiRO3","@St4rNewz","fashion",
"Gina Rodriguez To Star As Carmen Sandiego In Netflix Live-Action Feature https://t.co/vRqVQint2n via @YahooEnt","@142Countries","cultural-icon",
"@DanRubenstein @cjane87 I was Carmen Sandiego for halloween a few years back :)","@NicoleAuerbach","fashion",
"Little known fact that you can use this game to teach rich historical facts to your kids. Practically this generations ""Carmen Sandiego"" https://t.co/z8GunOFrvh","@crchriselam","edutainment",
"Since I wanted to be Carmen Sandiego this year I will be spending these next couple of seasons saving up all over again lol","@TEEwonders","cultural-icon",
"Lady Gaga Swiped Her Hat And Trench From Carmen Sandiego’s Closet https://t.co/N647G9YHQ4 https://t.co/9TVowzyWwr","@mariadelmexico","fashion",
"Because #life demands at least one great #hat 😘 Also, I kinda' feel like #CarmenSandiego haha 😄 http://t.co/oobNVtKbln","@LesterSiobhan","fashion","x"
"VIDEO: 10 Reasons Where in the World Is Carmen Sandiego? Was the Best Educational TV Show … https://t.co/Di5YVboYMa https://t.co/Ptqtlqy2lp","@premedicvlogs","edutainment",
"Seth and I got invited to a costume party this year so we actually have to put in the effort to do a couples costume and I’m both excited but also not looking forward to going to the trouble lol (we decided on Waldo and Carmen Sandiego)","@ohdarlingmartha","cultural-icon",
"@ProfessorBLove @BlackCosplayers I can't wait to cosplay Carmen Sandiego and Batgirl at this year's NYC Comic Con!","@asiaelle","fashion",
"@janeviIlanueva You do I get so excited when a. New project is announced like carmen sandiego and she's like YES IM SO EZCITED and she goes thank you mama","@janeviIlanueva","cultural-icon",
"@LanaWWE @RusevBUL I'm always a big fan of Where's Waldo and Carmen Sandiego as a couple costume!","@malecki_jason","cultural-icon",
"I grew up playing ""Where in the World is Carmen Sandiego?"", which fueled my love for geography, history, and games! Carmen also might have been my first love. #FirstDigitalLearningCrush #GameOnCFB @CFBDLS https://t.co/6CT82Oew8D","@CoachFB","cultural-icon",
"""You didn't catch me, player."" [Where in the world is Carmen Sandiego?] Carmen Sandiego: Shiroki Cosplay... http://t.co/OgqcvOwx4u","@_Shiroki","fashion",
"Gina Rodriguez to Voice “Carmen Sandiego” for Netflix as Two Movie Studios Battle for Her Next Slot (Exclusive) https://t.co/ilX63EpjAF","@NerdocratLife","cultural-icon",
"""I learnt about Brazil's extradition laws from Carmen Sandiego!"" #rtpt","@keith_ng","latina",
"@realscavenger18 @TwoJerseyKids Oregon trail, Where in the world is Carmen Sandiego...a long time ago, but digital games in learning are poised to make a comeback.","@WiseDad_Games","edutainment",
"carmen sandiego is my ideal halloween costume: it combines my love of the colour red with my love of rarely being seen in public.","@cashaleer","fashion","x"
"#CarmenSandiego - #JaneTheVirgin's Gina Rodriguez to Voice Lead in #Netflix Animated Series https://t.co/dSWpxbBlvY https://t.co/utzgOlOjZc","@SpoilerTV","cultural-icon",
"The 10 Best Video Games That Tricked You Into Learning: Carmen Sandiego was our first crush. http://t.co/bHdV0QTFBh","@blendedevents","edutainment",
"In Brazil, we don't say Carmen Sandiego. We say Eike Batista and I think that's beautiful. https://t.co/Nm37g3y5KP","@caesarologia","cultural-icon",
"@LeahLikesDogs I haven’t, I don’t play too many games at all, but I’m a sucker for throwbacks like Carmen Sandiego, or bitmap based train simulators","@marctomik","cultural-icon",
"Georges Niang travels more than Carmen Sandiego","@Cerner4Royals","travel",
"Nevermind that Mama Pope is running around in her Carmen San Diego trench coat... Oh. #Scandal","@Juana4ev","fashion",
