"text","handle","category","star_tweet"
"Netflix is making a Carmen Sandiego movie with Gina Rodriguez - CNET https://t.co/T27n0ulcpt https://t.co/N7Il9VuGvF","@shopsalenation","cultural-icon",
"Geography round! Good thing my alter ego is Carmen SanDiego... #quiznight @winstonheights","@daniellekuz","cultural-icon",
"Get in the car loser we’re going to the airport 🌎 #carmensandiego https://t.co/tGZRuX4Auk","@Carlitttoooooos","travel",
"Already have my next Halloween costume planned out. Carmen Sandiego. My date&39;ll go as Where&39;s Wally. Always wanted to do that","@larrytrujill","fashion",
"@Iesha87Official @HereIsGina Yessss and thanks for the info ...... and yes world this adult male Latino oilfield worker loves carmen San Diego","@arnold_beltran","latina",
"#BretsLog Still looking but has anyone found Carmen Sandiego? I want my hat back.","@bretrreimers","fashion",
"Where in the World is Carmen San Diego?! Does she have my car keys too??! #ElderlyVideoGames @midnight","@mrjwn","cultural-icon",
"Gina Rodriguez Is Netflix’s New ‘Carmen Sandiego’ https://t.co/fZ9Q9LoVpe https://t.co/FS49pVINAc","@magelicasvoyage","cultural-icon",
"@eiritana @to3st where in the world is Carmen Sandiego","@ShamVoid","cultural-icon",
"With all the 90s shows being rebooted these days, who else thinks that @GeographyNow should host a “Where in the World is Carmen Sandiego” reboot? That show is legit how I got interested in geography as a kid!","@dtcscout","cultural-icon",
"I think I want to be Carmen Sandiego for Halloween... thoughts??","@AbbyIund","fashion",
"@WeeabooNinja @Jyosua Living in the country learning a language is like playing Carmen Sandiego. You enjoyed never realizing it's an educational game","@WeeabooNinja","edutainment",
"Ok my fav cosplay couple so far - Carmen Sandiego and Waldo. #genius","@chilisizzle","fashion",
"#Gina_Rodriguez to Star in ‘#Carmen_Sandiego’ Movie for #Netflix https://t.co/3bVT9rbUMk https://t.co/UXyZF1IV3U","@SellersTed","cultural-icon",
"Imma need a red trench coat. https://t.co/iqPqrIDTdL","@MiekeEoyang","fashion",
"@gooeyblob Carmen Sandiego is in town?","@Sporkicide","cultural-icon",
"Sounds Like Netflix Is Bringing Back 'Where In The World Is Carmen Sandiego?' https://t.co/gW5eXDd4bx","@WChasterson","cultural-icon",
"Paul Alter Gina Rodriguez to voice Carmen Sandiego for Netflix https://t.co/1xYGJRuqkt https://t.co/9CjNYSHujN","@paulaltertv","cultural-icon",
"Gina Rodriguez, ‘Stranger Things’ actor, to lend voice to netflix’s ‘Carmen Sandiego’ https://t.co/l1JDlZR7DC  https://t.co/ds3sbk2LRl","@juaniraola","cultural-icon",
"Carmen San Diego - ready for the costume party! http://t.co/xLfbdPSLi6","@chattyabbey","fashion",
"Sounds like Netflix is bringing back ""Where in the World is Carmen Sandiego?"" https://t.co/dTde2avx84 via @HuffPostEnt","@RebeccaEverlene","cultural-icon",
"""Think Carmen Sandiego for wildlife adventures!"" @juniorexplorers teaches children to protect the environment! #alleylove #NatEdWeek","@AlleyNYC","cultural-icon",
"It's Official: Carmen Sandiego Is Getting Her Own Animated Netflix Series https://t.co/vZ5XT0hJ3i | io9","@future_db","cultural-icon",
"♫ Tell me where in the world is Carmen Sandiego? ♫ Oh wait, we meant where in the world are United Methodists? :) How much do you know? Have a little fun on this #TravelTuesday and test your knowledge: https://t.co/qbxDjKBL5B #UMC https://t.co/3sGk88PmmG","@UMChurch","travel",
"⚡️ “Netflix greenlights a Carmen Sandiego series” https://t.co/hTLMxCFghz","@BhagwaSalaam","cultural-icon",
"Netflix Reboots 'Carmen Sandiego' With Gina Rodriguez https://t.co/OPUCOmcxlp","@breanna_monique","cultural-icon",
"Carmen Sandiego and Yeezy taught me","@PageRay","edutainment",
"Where In The USA is CARMEN SANDIEGO ? Mystery Geography Board Game https://t.co/oKRatk90PA https://t.co/KcXYjegTsp","@DealGorgeous","cultural-icon",
"24 years ago since the feminist icon Carmen San Diego graced the small screen. Because completely nonsensical, fancy women can be notorious jewel thiefs. https://t.co/4clHQfpGpe","@orourke28","feminism",
"#Netflix is Bringing Back Carmen Sandiego - With Gina Rodriguez! (Report) https://t.co/5XqEhm4jYs","@Promoted_News","cultural-icon",
"@I_Dont_Know_Her LMAO and also for jacking Carmen San Diego's style?! #WhereIntheWorldisCarmenSanDiegovibes #youindangergirl #dragandgagher","@VetDepot","fashion",
"I'm not mad at @alexabahou for wearing the Carmen San Diego jacket on TV. She needs the hat to complete the look.","@T1theinfamous","fashion",
"I'm starting on my east to west coast road trip today. Consider this a version of Where In The World Is Carmen Sandiego but better. Well not @netflix reboot with @HereIsGina better but like a notch underneath that. #travelnurselife https://t.co/576ncSR4Q6","@peoplearewild","travel","x"
"Carmen Sandiego May Be Coming to Netflix Soon via Chip Chick - I'm pretty sure it'd be easier to ... https://t.co/4evqj46GY8","@billdubie","cultural-icon",
"@Oasis3457 if u didn't travel like Carmen Sandiego I would say it's never too late","@MzAlanRyan","travel",
"@SwordsToPlow I don't remember Carmen Sandiego being so well armed. Nice hat.","@Max_Fan","cultural-icon",
"#YoMemo is so transparent it makes Where’s Waldo look like cryptography. YoMemo is so childish it makes Dora the Explorer look like Jacques Cousteau. YoMemo could not find the truth if it was tattooed on Carmen San Diego’s forehead. #YoMemoJokes","@HybridBeats","cultural-icon",
"Cookie wearing that hat looking like Where in the world is Carmen sandiego. #Empire","@suthrngurl","fashion",
"@sue012 “@sue012: That guy in tht trench coat last night👌😂” 😂 Carmen San Diego 😂","@peepee_head","fashion",
"The moment @carlagugino was looking like a designer Carmen San Diego in that elevator I knew shit was going down #WaywardPines","@Micheal_Drew","fashion","x"
"Gina Rodriguez to star in live-action Carmen Sandiego film for Netflix https://t.co/PoYf9hONXz","@mrrichardmarin","cultural-icon",
"😀🙉🤗 #Magazine #Vulture : Get Gina Rodriguez a Giant Coat, Shes Doing a Live-Action Carmen Sandiego Movie | Vulture, please click here for details. #Magazine #Celeb #News #Today #Maga https://t.co/Qk36huGLCG","@magazinbirbak","cultural-icon",
"@ericalindbeck @stephaniesheh @BrinaPalencia You know, with an actual fedora you could probably cosplay as Carmen Sandiego.","@adam_kun","fashion",
"@Loudwindow @emzzong Someone said her old concept design looked like cowgirl carmen sandiego, and now I want that https://t.co/nSJgv9hx7o","@Paolabear96","cultural-icon",
"Modern version of ""Where in the World is Carmen Sandiego?"" https://t.co/MMuHak40HI A fun way to learn the world. #travel @ThePortlandBlog","@improvor","edutainment",
"Netflix, I'm available for the Carmen Sandiego film. Just saying.","@AM_Antolin","cultural-icon",
"@DisturbedCorpse Look, I’m Carmen San Diego RN! 🗺","@Arena_Rome","cultural-icon",
"I used to want to be Carmen SanDiego. She was all over the damn globe","@vanitastrawberi","travel","x"
"I bet I could find this plane. I was the Carmen San Diego champion in elementary school.","@ChefBROardee","edutainment",
"@HaveADayKid7 lmao. And don't forget the critical thinking skills Carmen Sandiego taught you","@MrJakeFreeman","edutainment",
"Gina Rodriguez to Star in Live-Action 'Carmen Sandiego' Feature for Netflix https://t.co/HNlVFKBmfW","@LaFemme_Negrita","cultural-icon",
"This dude traveled more than Carmen Sandiego… https://t.co/lbRzFQ0uEA","@HumanSpiderACNJ","travel",
"@ArtistSeanSeal @RetroFeeder That's too bad. Somewhere I still have the B: drive disk for the Carmen San Diego game I beat back in 8th grade. I think that was the first game I ever beat.","@LudonarrianGame","cultural-icon",
"@OpTicMiDNiTE never watched Bob Ross that much. Magic School Bus, Mr Rogers and Where in the World is Carmen Sandiego were my PBS Go-Tos.","@_chrismaldonado","cultural-icon",
"@TheBloggess Did you learn about spelunking on Where in the World is Carmen Sandiego? I did and just heard it's coming back - yay for geography education","@cawainil","edutainment",
"""Where in the World is Carmen San Diego?"" is the theme song for a show about geography written by someone with little knowledge of geography","@MyDickerson","cultural-icon",
"doing my internet research for halloween and there's a lot of weird shit going on between carmen sandiego and where's waldo #uncomfortable","@DanaCass","fashion",
"Childhood dream complete !!!! I've been to every place mentioned in the opening song for Where in the World is Carmen Sandiego !!! Almost all through show business bookings. #carmensandiego #whereintheworldisMatthewDiSero #dreams #magician #comedian #traveller","@MattDisero","travel","x"
"On an adventure with the kiddos every Summer. Where in the world is Carmen San Diego with her kids??? 😂😂 https://t.co/pcQ7s5meKI","@Bossy_Lady","travel",
"In which I attend a costume convention, find Carmen Sandiego and see a Ned Stark who is warden of a wig stand: https://t.co/etWEMmKgCo","@NSavidge","fashion",
"I’ve decided I wanna do a series of playing old learning games I played growing up (treasure mountain, Carmen San Diego, Oregon trail) on Twitch & YOU CAN’T STOP ME","@AlexanderEmpyre","edutainment",
"@aboutamom @kilmorna65 My mom always called her car Carmen Sandiego when we were kids. #1stImpressionsCount","@BookAddict86","travel",
"@remove32 @Beanster_97 I mean she probably only learnt about it while watching Carmen Sandiego","@Gordini616","edutainment",
"VIDEO: 10 Reasons Where in the World Is Carmen Sandiego? Was the Best Educational TV Show … … https://t.co/H15O9YS1Mm","@kaylarr5","edutainment",
"Gina Rodriguez Voicing Carmen Sandiego in Netflix Show https://t.co/BqvzTszUG1 #IGN","@VideoGameNews","cultural-icon",
"Carmen Sandiego and Waldo Costume for Couples | https://t.co/ZmP47e6wQj #CarmenSandigo&WaldoCostume","@snehapawar7261","cultural-icon",
"@LindseyStirling @HP Nice Carmen Sandiego hat! Rather fitting! 😂","@TribalSam","fashion",
"Out of all the things he could have worn, he chose Rule 63 Carmen Sandiego https://t.co/u6CtsmbF99","@DasHekatombe","fashion",
"@adolfminic Chuck Norris always knows the EXACT location of Carmen SanDiego.","@VxPr02","cultural-icon",
"Educational or Exploratory? Find out in this great article about one of the most successful learning games. #gbl #edtech The Making Of Carmen Sandiego https://t.co/jmK8aQNYDq via @kotaku","@athomas_tr","edutainment",
"I’m going on vacation to San Francisco, Michigan, and Hawaii over the next three weeks. Is this what it feels like to be Carmen Sandiego?","@derekjlawrence","travel","x"
"Carmen Sandiego Is Officially Happening With Gina Rodriguez at Netflix #Celebrities https://t.co/NgAIl41fBS","@CelebritiesNwsl","cultural-icon",
"Gina Rodriguez Is Carmen Sandiego in Live-Action Netflix Movie https://t.co/FvDqS9K2Zg https://t.co/jba8kLXksg","@affiani1","cultural-icon",
"I just learned where Minnesota is. If this were Where in the World is Carmen Sandiego, I would have tried to put it in Kentucky.","@Jenifesto","edutainment",
"if i dont get to start traveling soon idk what imma doooo i wanna be carmen sandiego","@mynameischapman","inspiration","w"
"Gina Rodriguez will be donning the red fedora and trench coat of Carmen Sandiego for Netflix - ... among the othe... https://t.co/ovJfctQldJ","@FinanceRadr","cultural-icon",
"Just found out I could potentially play Carmen Sandiego on our desktop computer. This is a big deal. #WhereInTimeIsCarmenSandiego","@Marlee_n_Me","cultural-icon",
"Do you think Carmen San Diego has different codenames in different countries like is she Carmen Marseille or Carmen Fukuoka in France and Japan.","@raikamudapon","cultural-icon",
"@goomvi @pissGoblin Ravi can you just steal these landmarks Carmen Sandiego style","@ActionAlan","fashion",
"#UnexplainedPantryItems Waldo and Carmen SanDiego. I sent Dora the Explorer in to find them.","@benjan29","cultural-icon",
"Aiden was just watching a Halloween episode of, ""Where in the World is Carmen San Diego,"" and it got me excited... http://t.co/Sr2ZwlUPN5","@beckympeter","cultural-icon",
"The Netflix gods are smiling upon us all today https://t.co/daLNnS3ZEd","@marissaapena","cultural-icon",
"The Opening Ceremony is like a giant reminder of how much you would have sucked at Carmen Sandiego. #Olympics2014","@Cosmopolitan","cultural-icon","x"
"@AandGShow Carmen Sandiego is more appropriate, being that you were in the airport.","@NieceePiecee","travel",
"@BonnieMcKee i'd disappear somewhere in the world Carmen Sandiego style.","@konnichiwalski","travel",
"@MustacheBabs Thank you all for following along my freak out over Carmen Sandiego. https://t.co/S5jPON7Y8n","@MustacheBabs","cultural-icon",
"My ideal woman: Carmen Sandiego.","@SirWillALot","cultural-icon",
"Where in the World is Carmen San Diego actually taught me world geography","@Kontravercy","edutainment","x"
"#Netflix plans live-action 'Carmen Sandiego' film with Gina Rodriguez - https://t.co/Lv2uL3daGI #News https://t.co/zVpRsbFu3a","@aivanet","cultural-icon",
"Gina Rodriguez will be donning the red fedora and trench coat of Carmen Sandiego for Netflix https://t.co/Qpoy46LQLZ","@ChrisAdamTweets","fashion",
"There's an urban legend that, if you beat the 'Where In The World Is Carmen SanDiego?' game in less than an hour with no wrong choices, you'll unlock the uncatchable thief character Scott Free.","@ThePhonyPCB","cultural-icon",
"Carmen Sandiego at Graydons Crossing . #graydonscrossing #salmon #experiencegr @ Graydon's Crossing https://t.co/5XDB0niBQD","@EatGR1","cultural-icon",
"#carmensandiego #pokemongo + #purge ...it must be Halloween!… https://t.co/xevKMAlKRw","@itsbabyt","fashion",
"Gina Rodriguez to Star in Live-Action 'Carmen Sandiego' Feature for Netflix https://t.co/B3djIsFvtq via @thr","@MickeyPerez_1","cultural-icon",
"Carmen Sandiego Is Officially Happening With Gina Rodriguez at Netflix https://t.co/aWhgxvh1ee https://t.co/nWdXSn5Kcm","@NedFlandStark","cultural-icon",
"(#DiiME) Netflix is Bringing Back Carmen Sandiego - With Gina Rodriguez! (Report) https://t.co/R20le8uhjP (#GORDiiTOO)","@YO_SOY_DR","cultural-icon",
">Netflix's ""Carmen Sandiego"" movie is beign written by the same guy who did Game Night well now i'm interested","@LanoomAES","cultural-icon",
"@haasjosh I am! I have a Carmen SanDiego hat and an Inspector Gadget jacket!","@Jackie_Schafer","fashion",
"Good morning friends! Our very own April Flagg is Aroostook's ""Carmen San Diego"" Where in The County will she be? Stay tuned...","@AAIGauvinFund","cultural-icon",
"@MaryBethMacleo1 Give her a hat and she could be Carmen Sandiego! 😁💜","@katamarikitty","fashion",
"@angelcwrites @Nicole_Cliffe Also I learn to speak like 10 languages while on tour and find/befriend Carmen Sandiego.","@angelcwrites","edutainment",
"Where in the world is Carmen Sandiego and what in the world is wrong with Shia Labeouf","@alyssapanda","cultural-icon",
"Old News But Still Worth It – Carmen Sandiego Cartoon Series Coming to Netflix https://t.co/rEK7nUTQnG https://t.co/XSDyltkTvp","@gaycomicgeek","cultural-icon",
".@HereIsGina will produce and star in a Carmen Sandiego film for @netflix https://t.co/c5hnlGVKEF https://t.co/GRFH0mRel4","@ETCanada","cultural-icon",
"Finn Wolfhard has joined ""Carmen Sandiego,"" Netflix's new animated series that's arriving in 2019 voice starring... https://t.co/XKeNaJ84gk","@RamasScreen","cultural-icon",
"@LoriSchmidt Did you dress as Carmen Sandiego for Halloween? 😉","@cbusbj99","fashion",
"@antoinetriplett wow carmen sandiego and mario in the same car.","@antoinetriplett","cultural-icon",
"I feel like Carmen San Diego ... Everyone wondering why I haven't posted on snapchat. Cmon. Silence like lasagna","@IamMinaLo","cultural-icon",
"Where in the world is Carmen Sandiego?","@dargaman","cultural-icon",
"I need two people to dress up as Waldo and Carmen Sandiego for a shoot Idea I have.","@josephclark","cultural-icon",
"They mention Belize in the ""Where In The World is Carmen Sandiego"" theme song.","@78Grams","cultural-icon",
"So ... @TheDailyShow ... can we get a Carmen San Diego style report on the #cohensituation? The loot ... the warrant ... https://t.co/5kU8PdjkP7","@TheRealTRigler","cultural-icon",
"Peggy must have stolen her hat from that other hard to track lady, Carmen Sandiego. #AgentCarter #GaygentCarter","@anh62950","fashion",
"You could find me on Instagram with pictures of the adventures and home improvements but I would end up like a living game of where in the world is Carmen sandiego.","@skylerzane","travel",
"Netflix finds 'Carmen Sandiego' for its latest reboot https://t.co/JjBbBevLck via #indilens","@SuhanaParbin","cultural-icon",
"Netflix’s Carmen Sandiego Gets First Image Plus New Cast https://t.co/VQItKTRiny https://t.co/MbIq9iAI7U","@JeremyDollens","cultural-icon",
"""How Carmen Sandiego accidentally became an educational game icon"" https://t.co/WHVGeqglft","@ralphusion","edutainment",
"New look up on Northwest Blonde where I feel like #CarmenSanDiego https://t.co/DXLJ6aboMU #ootd #outfit #hats https://t.co/8oYg7yFKV8","@aluiza__","fashion",
"Jayden K. Smith will lead the Cyber Security Task Force while Carmen Sandiego will be in charge of monitoring International travel.","@SpencerGraves","travel",
"Our Childhood Dreams Have Come True: Gina Rodriguez Is Playing Carmen Sandiego On Netflix! https://t.co/ZpVcdhFqUr https://t.co/S8NxSRxLKW","@iamthatgirl","cultural-icon",
"@Ethanhamm I would smoke those other kids in geography on Carmen Sandiego. used to facepalm when they didn't know states IN the US","@SowaTheArrogant","cultural-icon",
"Netflix finds 'Carmen Sandiego' for its latest reboot https://t.co/aMnLCevUiK https://t.co/rvPxZtfhrK","@24megabytes","cultural-icon",
"I loved both the cheesy kids quiz show and the animated series so I'd be 100% here for Carmen Sandiego no matter how it looked. The fact that the art style looks legit awesome is just incredible icing on top. https://t.co/SbXJ4cZbgd","@jobias","cultural-icon","x"
"Who wants to go get me a Carmen San Diego hat from the Netflix? DreamWorks? whatever booth, I will be your best friend","@vqnerdballs","fashion",
"@amandawtwong because you liked my tweet, I now know there will be a new Carmen Sandiego next year. thank you ;-;","@dasiavou","cultural-icon",
"Got Carmen Sandiego working on my Apple IIe! Just needed to give the drive interface card a shake. https://t.co/y3ndW3c3R8","@Sierra_OffLine","cultural-icon",
"Raising a 90's kid. She's legit addicted to Roundhouse, Where in the World is Carmen Sandiego? , Animaniacs, and The Adventures of Pete & Pete. Kids at school like https://t.co/H1lEDhw0Vr","@ShitcoinSherpa","cultural-icon",
"#inspiration alert: We're loving @ritaora in this coat. So that's where Carmen Sandiego went... http://t.co/7A1LIxihJj #nny #noelnewyork","@noelnewyork","fashion",
"DEADLINE: Gina Rodriguez To Star As Carmen Sandiego In Netflix Live-Action Feature https://t.co/3nIGZIA7QJ https://t.co/px7J2RMJ2h","@ERNESTONODAL","cultural-icon",
"Netflix’s Carmen Sandiego Movie Sets ‘Game Night’ Scribe Mark Perez As Writer https://t.co/ilnHHOSo4F https://t.co/pGPAB1u0dp","@entertainm2018","cultural-icon",
"@MaraWilson Imagine if there’d been a Silk Road game on the Apple II, etc. So many U.S. folks would have an actual understanding of Central Asian geography. But at least we had Carmen Sandiego.","@griner","cultural-icon",
"Where in the World Is Carmen Sandiego? How travel booking systems lack good #cybersecurity Via @cyberdefensemag https://t.co/UrmstR54AH https://t.co/c4eJfEo9bR","@Speakster","travel",
"Gina Rodriguez To Star As Carmen Sandiego In Netflix Live-Action Feature https://t.co/DtP83VRnsE","@foxrak","cultural-icon",
"I know where in the world Carmen San Diego is...she was headed west from 27th and Park in full costume about an hour ago","@AshleyRNoble","fashion",
"Netflix is Bringing Back 'Carmen Sandiego' with Gina Rodriguez Playing the Lead 90s educuational... https://t.co/TXqvHC6VF7 via @GlamourMag https://t.co/d0Fr8Dbso8","@The_News_DIVA","cultural-icon",
"This is great and everything but what I really want is the Where in the World is Carmen Sandiego Quiz Show redone! https://t.co/VRdeMzPwe2","@NerdFamily","cultural-icon",
"@Lerandcuy84 @tinyelfbigheals @Amarathyst_WoW @AllarinDawnglow @Ammathrel @AdellwynMisha @FrostytheElf @BinniWoW @Rakastra @ssbjezi @Evas_WoW @thegoldqueen @Halolux_ @NamuratheLock @Imperious0212 @Kaldorei_Life @LysSunbreeze @RumTheElf @PoisonFox @ShadowDenaise @SanlaynZari You managed to find Carmen Sandiego but she gave you the slip! ((And thank you!)) https://t.co/aRla5egujj","@KuroDakari","cultural-icon",
"@courteeyy you're like Carmen sandiego. You travel more than me lol. I need to renew my passport so I can leave lol","@kingOMI","travel","w"
"@FeministaJones “Where In the World Is Carmen Sandiego”. Best hosts, best game, best theme song.","@raisedbymoogles","cultural-icon",
"Netflix finds 'Carmen Sandiego' for its latest reboot https://t.co/BAL0fEaxnu via #indilens","@mintude2","cultural-icon",
"Everybody dresses as Waldo for Halloween but nobody has the gall to pull off Carmen Sandiego","@xMOONS","fashion",
"@janelleNOmonae lmao, I need a future hat. Feeling like Indiana Jones meets Carmen SanDiego","@thatnoxiousCALI","fashion",
"Ann Sheridan is all ""Where In The World Is Carmen San Diego?"" in that hat. #TheyDriveByNight #TCMParty https://t.co/yOfcfJht8D","@shortyblueyes5","fashion",
"Chuck Norris always knows the EXACT location of Carmen SanDiego.","@YDouib","cultural-icon",
"@critiques4geeks Were in the world is @critiques4geeks @smcnyc sung to the tune of Carmen sandiego","@BethGrangerSays","cultural-icon",
"Be still my beating heart ⚡️ “Netflix greenlights a Carmen Sandiego series” https://t.co/wLVjIjdcwr","@DrTGIF","cultural-icon",
"@Todd_Spence Where on Earth is Carmen San Diego?","@troydomd","cultural-icon",
"That's why kids these days aren't graduating. We had dope shows that taught us shit. Ghost Writer, Carmen Sandiego, Wishbone","@flippedhatnupe","edutainment",
"i'm so mad, i left my pirate coat AND my carmen sandiego hat upstate :(","@KittyCatalyst","fashion",
"I wonder if anyone ever found Carmen San Diego or if she's still just wandering the globe.","@Mandama004","cultural-icon",
"Now I feel like Carmen Sandiego https://t.co/tcx8tlI0aO","@CatSwetel","cultural-icon",
"I found Carmen Sandiego in an airport in Dallas. She's gone blonde and prefers sitting on the floor. Strange cat. https://t.co/43CxYw71uv","@EricHolljes","cultural-icon",
"No way phenomenon means exploring a cave @KenTremendous didn't you learn anything about spelunking from playing Carmen Sandiego?","@alexanderbasek","edutainment","x"
"Netflix to find #CarmenSandiego in January https://t.co/9G6klLcA2J https://t.co/D8jSjeqo7H","@kidscreen","cultural-icon",
"Netflix plans live-action 'Carmen Sandiego' film with Gina Rodriguez https://t.co/xFWPWIOozM","@10021tech","cultural-icon",
"Netflix is making a Carmen Sandiego movie with Gina Rodriguez - CNET https://t.co/086f5THZ9R","@eqlia_nozomu","cultural-icon",
"@iSmashFizzle I think I realized it in 1998 when I was watching a re-run of Where In Time is Carmen Sandiego? The lyrics are “stop her crime and solve this mystery” and I was like ohhhhh no bueno","@lalalalaurs","cultural-icon",
"What's new on Netflix in January 2019 https://t.co/5WQXI8wHzN","@iApplenotice","cultural-icon",
"The 10 Best Video Games That Tricked You Into Learning: Carmen Sandiego was our first crush. http://t.co/bHdV0QTFBh","@blendedevents","edutainment",
"""Netflix orders animated Carmen Sandiego series"" https://t.co/37AWAxdPLQ","@nbuoy5","cultural-icon",
"Sounds Like Netflix Is Bringing Back 'Carmen Sandiego' https://t.co/jm273CQiaB","@LunaLuvgood2017","cultural-icon",
"@UppperEchelon_ you the real life Carmen Sandiego. “Where in the world is Chrisette Spence?” https://t.co/97Z3SAita6","@AmooreLove","cultural-icon",
"Netflix is betting on ‘90s kids nostalgia for learning with upcoming lineup https://t.co/Y56FnhVCO0","@DTAMedia","cultural-icon",
"Carmen sandiego was my first crush and also my rolemodel for what a successful lesbian looks like","@novelasha","inspiration","w"
"Did some shopping for Halloween stuff after work & I am pretty damn excited. I got some good stuff. Newest costume idea: Carmen Sandiego.","@smackalalala","fashion",
"Gina Rodriguez Will Play The Iconic Carmen Sandiego In An Upcoming Netflix Live-Action Film https://t.co/8yrAnvw3vc via @MeAliVelez","@JessHSun","cultural-icon",
"More Halloween at DCL! Carmen Sandiego has made an appearance at the North Carolina Collection... https://t.co/e1WSMKO1qN","@DurhamCountyLib","fashion",
"@RossTuckerNFL please make fun of carmen sandiego outfit erin andrews wore,its comedy gold","@CHEFofJOKES","fashion",
"I think ‘Where in the World is Carmen Sandiego’ sparked my wanderlust soul at a young age. 🌎 #wanderlust #travel","@KatilynnWyatt","travel","x"
"Netflix's Carmen Sandiego Reboot Has a New Premiere Date and Some Mysterious Teaser Images https://t.co/ylh6OD18JE #carmensandiego #netflix #ginarodriguez https://t.co/eLXhniHTH8","@igor_os777","cultural-icon",
"So excited for this!!! #carmensandiego #liveaction #movie #netflix #animation #series @HereIsGina @netflix https://t.co/F2wTpggVor","@retropopgaming","cultural-icon",
"Celebrity Fashion Buzz: Rihanna Gives Patent Leather Carmen Sandiego Vibes at the Grammys https://t.co/j3feJkUt9V #GlamCoalition","@GlamCoalition1","fashion","x"
"Went as Agent Peggy Carter for Halloween. I'll have to be Carmen Sandiego next year for optimal hat… https://t.co/AaZOOjxPLp","@lcaitday","fashion",
"Get a first look at Netflix’s Carmen Sandiego animated series https://t.co/9jK7PIxr2p https://t.co/Z4NlijrYkM","@SusanGentileus","cultural-icon",
