"text","handle","category","star_tweet"
"@loljocks_grimey @edsbs still helping search for Carmen Sandiego","@jose_jose","cultural-icon",
"Erin Andrews could use some work on her Carmen Sandiego cosplay. Colors are all wrong, as is the hair.","@DanJGlickman","fashion",
"Cosplay as Carmen Sandiego at work today? Yes, I think I shall.","@RawkinRobinGoes","fashion",
"Whenever I wear a hat I feel like Carmen Sandiego, but with a worse travel agent cuz where in the world am I? Goddamn Queens. That's where.","@lizfuh","travel",
"TV News Roundup: Netflix Sets Premiere Date for Carmen Sandiego Series - Variety https://t.co/NdxBVSrxz7","@AnimeWorld31","cultural-icon",
"@MissMollie_x the one in the top right, is that Carmen Sandiego's hat?","@Joshique_Noir","fashion",
"Where the heck is Carmen San Diego?! @Dr3d859","@OneWonWon","cultural-icon",
"Anyone remember ""where in the world is Carmen SanDiego?"" Ha.","@cooperallyn","cultural-icon",
"If @Nintendo wants to have more villainous characters in #SuperSmashBrosUltimate, they should add Carmen Sandiego. She is technically a video game character first.","@Undying_Reverie","cultural-icon",
"Fan Expo 2015: Carmen Sandiego & Waldo FINALLY found… Together?: Do you have any fun cosplay images to share f... http://t.co/XjzYHLA9JQ","@VillainCostumes","cultural-icon",
"Where in the World Is Carmen Sandiego? #Travel booking #secuity systems talk with Karsten Nohl https://t.co/1jcyHswKFU","@developer_ca","travel",
"@MonsterTigerbot clearly your mom didn't make you statue of liberty, mary poppins, carmen sandiego, raggedy ann, etc costumes then haha","@merryfaith","fashion",
"@HereIsGina Is #Netflix’s New #CarmenSandiego #Latina #actress #talent https://t.co/HbuRLb8J1c","@DaisyCabreraPR","role-model",
"Carmen Sandiego Is Officially Happening With Gina Rodriguez at Netflix #tvnews https://t.co/X3ACzUQkXR","@us_beautyNature","cultural-icon",
"Manny Machado rocking a Carmen Sandiego hat https://t.co/utoo3h62UN","@iamjoonlee","fashion",
"@PBS .@PBS Reading Rainbow, Shining Time Station, Lamb Chop's Play-Along, Carmen Sandiego, Mr. Rogers, and uh... pledge drive. #ILovePBS","@cellytron","cultural-icon",
"#WhatIThoughtWhenIWas18 I’d travel the world by the time I’m elderly at age 40. Thanks to Where in the World is Carmen Sandiego! I’ve accomplished my goals! Love that game 😉","@DrJeanGreySmith","travel","x"
"Thought I'd throw in my favorite #CarmenSandiego #hat since she's being revived by #Netflix with the fantastic @HereIsGina! It's all about the #hat! :) https://t.co/PvftHMcakz","@TasiaValenza","fashion",
"The more I travel, the more I feel strange being in this country I call home. I do not fit in at ALL!!! 😥 Becoming #carmensandiego 🌎🌍🌏","@TihdaVongkoth","travel",
"Netflix is making a Carmen Sandiego movie with Gina Rodriguez - CNET https://t.co/mX1hofFIE1","@GamerGeekNews","cultural-icon",
"Also Carmen Sandiego speaks in spanish sometimes and if you think she sounds good in english","@MitsukiZi","cultural-icon",
".@Snowden and his gf win all Halloweens for these epic costumes. #WheresWaldo #CarmenSandiego https://t.co/iCAmbvpBxL","@o_ema","cultural-icon","x"
"Listen up, gumshoes! Where in the World is Carmen Sandiego? began 25 years ago today on PBS w/ that iconic theme. https://t.co/ClxFSrUVtS","@thearcadeshow","cultural-icon",
"@Shiroiko That red hat REALLY makes her look like Carmen Sandiego. Which is also awesome. :D","@sierralad","fashion",
"@spx7200 6th & 7th grader first played a live action role play version of Carmen Sandiego before playing the e-version on their iPads today. Proof that learning and practicing Geography facts can be fun. #LearningIsFun #Engagement #STEM #OldSchoolLearning https://t.co/Jj3B6mXvlQ","@MrsOBrien_SPX","edutainment",
"@DisneylandToday At the Halloween party this year - Mickey told me he found Carmen Sandiego! (Only b/c I don’t have a pic fom when I was 4.) https://t.co/W9ytASJm31","@TalithaRabboni","cultural-icon",
"@MizzCreme It all depends where these battles are at since Smack traveling like Carmen Sandiego","@Mottoofficial","travel",
"Photoset: ofgeography: dementedsiren: jedavu: Paintings by Emerico Imre Toth Carmen Sandiego? found her. http://t.co/r85lZhLeQI","@DarlingSchwert","cultural-icon",
"@Mrsam_LMP The greatest #cosplay ever was when this one couple was #Waldo and #CarmenSandiego 😂😂😂","@MissMiniver","cultural-icon",
"#CarmenSanDiego with blonde hair, Nine West hats & red Peoni crossbody bags, #ootd http://t.co/PokxzNw0Jn","@duffydossier","fashion",
"Random thought of the day: Was Carmen Sandiego a villain or just a misunderstood chick with a bad case of #wanderlust?","@LizSoolkin","travel",
"NEWS: WHEN in the world is Carmen Sandiego coming to Netflix? January! #NetflixNewsWeek Netflix has announced that the new animated series ""Carmen Sandiego"" will debut globally on January 18th, 2019. The series... Read more: https://t.co/l0XyLjLGHG https://t.co/LHUQJzj4fH","@NewOnNetflixUSA","cultural-icon",
"...my brain just did like a five-step process that led me to what might be a pretty safe Halloween costume. What if I went as Carmen Sandiego.","@GemCityGem","fashion",
"Netflix orders animated Carmen Sandiego series https://t.co/z4dHsDs1a5 https://t.co/d6dQsbIhdL","@BlackBerry_Push","cultural-icon",
"#JaneTheVirgin star Gina Rodriguez will play #CarmenSandiego in Netflix's reboot - https://t.co/tTfhU8JsBx https://t.co/Dw9KkgVt5G","@wgtc_site","cultural-icon",
"#CarmenSandiego - Netflix Reboot Release Date Announced https://t.co/2ngj5ue3S1 https://t.co/7QuIgpWQW6","@TVReboots","cultural-icon",
"Carmen SanDiego was a great show because it taught an entire generation geography, history, and that beautiful women will always be elusive.","@NathanBgood","role-model","x"
"Strongly considering buying a red coat and hat and being Carmen Sandiego for Halloween","@faeriefountain","fashion",
"First Bill Nye...now Carmen Sandiego?! Netflix has came a longggg way dude. They're the 🐐 now","@GhostwritaMusic","cultural-icon",
"I'm wearing my big hat with a red coat and a little girl on the train just asked me if I'm Carmen SanDiego. I don't hate it!","@thebostonista","fashion","x"
"Where in the world is Carmen Sandiego? @ Los Angeles International Airport (LAX) https://t.co/7lGbcES8AI","@MikeJarzabek","travel",
"@haasjosh I am! I have a Carmen SanDiego hat and an Inspector Gadget jacket!","@Jackie_Schafer","fashion",
"Group costume idea: st Anthony, Carmen San Diego, and Waldo.","@PDHeuer","fashion",
"@amandawtwong Having just spent hours this past weekend watching old school Carmen Sandiego episodes....I AM SO EXCITED ABOUT THIS. #CarmenSandiego #ShesTotallyMyJam","@MaybeMander","cultural-icon","x"
"VIDEO: 10 Reasons Where in the World Is Carmen Sandiego? Was the Best Educational TV Show … https://t.co/uJQtw798uk https://t.co/nBe4OgYlSb","@Brwnigrl0904","edutainment",
"Netflix is betting on ‘90s kids nostalgia for learning with upcoming lineup https://t.co/VgdHdmizn5 https://t.co/C4NJpozrhO","@LetsBlankToday","cultural-icon",
"@sofiaflevin The proper form of that question is “Where on earth can I get a Carmen Sandiego type hat quickly”","@philletourneau","fashion",
"@Doctor_Hugs WHERE in SPACE deluxe is Carmen Sandiego","@InfinitNutshell","cultural-icon",
"*jumps in backseat of car wearing a bloody shirt* ""Can you take me somewhere nobody will find me?"" *Carmen Sandiego turns around & winks*","@_NinJar","cultural-icon",
"VIDEO: 10 Reasons Where in the World Is Carmen Sandiego? Was the Best Educational TV Show Ever via PEOPLE.c… https://t.co/7kXI72mc23","@WhoFeedsYou","edutainment",
"@aarondelp I was wondering where in the world is Carmen sandiego?","@ITVirtuality","cultural-icon",
"Does anyone have a big hat to make this outfit complete?!?! #whereintheworldis #carmensandiego… https://t.co/fg4sJk7lFV","@TheDaftknees","fashion",
"VIDEO: 10 Reasons Where in the World Is Carmen Sandiego? Was the Best Educational TV Show Ever: The PBS game show went off the air 20...","@ELIZABETHBYRN17","edutainment",
"Gina Rodriguez has been cast in a live-action 'CARMEN SANDIEGO' film for Netflix. (Source: @DEADLINE) https://t.co/6F4zt3bAKo","@DiscussingFilm","cultural-icon",
"#News #iPhone Hands On: Carmen Sandiego Returns 1.0 (iOS): If you grew up in the '80s and '90s, you're probabl... https://t.co/m7FxDzVGB1","@IphoneNews17","cultural-icon",
"Finding my phone is harder than trying to find Carmen San Diego","@AlwaysBeenAGee","cultural-icon",
"@iSmashFizzle She's a sticky-fingered filcher but she's such a cool, smart and charismatic thief that we all root for her anyway. Nobody ever made a song about the people pursuing Carmen Sandiego.","@Brocartoon","cultural-icon",
"@garyvee gets around more than Carmen Sandiego ✈️🚕🚁","@chrisjohnston","travel",
"Where is the world is Carmen San Diego? I mean....cute dresses.","@misschristiegee","cultural-icon",
"is Carmen Sandiego still relevant? because that was my childhood when it came to educational television","@ZyrotheGyro","cultural-icon","x"
"#AgentCarter is going to have to get a lot more iconic before people stop calling me #CarmenSandiego every time I wear my red Stetson!","@mareasie","cultural-icon",
"Netflix Is Reportedly Reviving Carmen Sandiego With Gina Rodriguez https://t.co/BE8nFkcr7w https://t.co/k8muB3dZjb","@WMTWTV","cultural-icon",
"Fire up your old PC and get ready for some grade A edutainment, because new 'Carmen Sandiego' is coming to Netflix: https://t.co/dnPdKyALOn https://t.co/z6cERcVEk3","@pedestriandaily","edutainment",
"A1. Most memorable image of a person from pop culture is Carmen Sandiego. She made real all the places I travelled in my head. #woctt","@LittleFootLady","travel","x"
".@Netflix's #CarmenSandiego Reboot Gets January Premiere Date — First Look https://t.co/vVMKyEwsYL https://t.co/Yr7DnFQpVm","@TVLine","cultural-icon",
"Netflix making live-action Carmen Sandiego movie https://t.co/Cvpwc9MOLu #polygon #games #reviews","@CrespoherreraA","cultural-icon",
"Any other kids have a crush on Carmen San Diego? She was a cultured, strong, ambitious, mysterious woman who ran her own international criminal organization, spoke multiple languages, skilled in hand-to-hand combat and technically proficient with firearms. Yes please! #goals 😍","@TheRealBenAukes","role-model","x"
"Auburn has about as much chance as the poor kid on the Africa map at the end of Carmen Sandiego.","@NoNotJeffAllen","cultural-icon",
"I kind of want to buy this dress and be Carmen Sandiego next Halloween. https://t.co/PJWrOYjMjm","@MarthaMihalick","fashion",
"Huh. I only just saw that there's going to be a new Carmen Sandiego cartoon on Netflix. I used to really like the old show :)","@mattdoylemedia","cultural-icon",
"""'Magic School Bus' 'Where in the World is Carmen Sandiego?' and 'Bill Nye the Science Guy' on PBS lineup"" old","@KaiserUppercut","cultural-icon",
"J. Lo set to produce Where in the World is Carmen Sandiego movie | Carmen Sandiego http://t.co/96k3IGNrRC","@latinachicana19","cultural-icon",
"#security Where in the World Is Carmen Sandiego? Becoming a secret travel agent https://t.co/VsV69T5trW","@TianchenW","travel",
"Where in the world is Carmen Sandiego Building - game to teach kids about Architecture #eqxdhack16 https://t.co/3FN07NF2RD","@EquityxDesign","edutainment",
"[Photographer]Waldo and Carmen Sandiego #cosplay https://t.co/rrDur5t0tN","@cosplaysnugglz","cultural-icon",
"Gina Rodriguez to star in live-action Carmen Sandiego film for Netflix https://t.co/EdBqqZyOIa","@CranberryFiend","cultural-icon",
"I need to measure my fat head so I can order my Carmen Sandiego hat","@lauralyexoo","fashion",
"Dust Bunny, Ghostbuster, Red Riding Hood, Zombie Scooby Doo, Carmen Sandiego rock Halloween! @WorkingatDuke http://t.co/jnPvh4wOTT","@DukeUCAE","fashion",
"Gina Rodriguez, ‘Stranger Things’ actor, to lend voice to Netflix’s ‘Carmen Sandiego’ (Christine Persaud/Digital… https://t.co/DsE29PCaaG","@TechInvestNews","cultural-icon",
"@RealLordDalek If you know geography, you could actually do Carmen Sandiego map. There's no way to study/prepare for the temple beforehand.","@rwmead","cultural-icon",
"Netflix Casts Gina Rodriguez as Carmen Sandiego in Live-Action Movie AND Animated https://t.co/7ydaxtObhS #90s #CarmenSandiego #Cartoons","@vizecraft_me","cultural-icon",
"@jessibstar Carmen SanDiego helped me pass geography in middle school! I'd watch NOVA and cooking shows like crazy.","@JillEatsFood","edutainment",
"@MatthewACherry @netflix I have three daughters. I wish there were more engaging shows like Where in the World is Carmen SanDiego for them rather than @YouTube","@R_Nevy","cultural-icon",
"Geography and a capella fans have something to celebrate today: Where in the World is Carmen Sandiego premiered on PBS 25 years ago today. https://t.co/w8l3BknGIU","@rejectnation","cultural-icon",
"I may be carmen san diego this halloween 🤔","@Jedii_Mcfly","fashion",
"Still salty that Netflix doesn't have Where In the World is Carmen Sandiego.","@onetakedizzle","cultural-icon",
"[cue scary music] 🎃 ...anyone know what classic Hallowe'en movie poster this looks like? #nofilter #fog #rhymejaws #trickortreat #homemadecostume #carmensandiego https://t.co/x2q7D9zfsd","@RhymeJaws","cultural-icon",
"Dust off that magnifying glass! Carmen Sandiego is getting a Netflix movie https://t.co/ZPe8Src5JM https://t.co/PAJ7aPhiX8","@webandgraphix","cultural-icon",
"Nice Carmen Sandiego cosplay there, PK Subban. https://t.co/aSftAy1kBp","@strawbecky_81","fashion",
"Gina Rodriguez donning red fedora and trench coat of Carmen Sandiego https://t.co/VF728CQt4w https://t.co/YOzSStt1y5","@TrueTechLover","cultural-icon",
"why Joe got on the carmen san diego hat on though 😂😂😂","@DJHonestAve","fashion",
"Gina Rodriguez Lands Carmen Sandiego Role In New Netflix Film https://t.co/hIyNQLMwUF #referencias #ifttt #feedly","@caparica1975","cultural-icon",
"Carmen Sandiego su Netflix? Forse serie in arrivo | SmartWorld https://t.co/7QLEeIbss6 via @smartworld_it","@TomDellyPV","cultural-icon",
"@iSmashFizzle I queue up that dank a capella Carmen San Diego song all the time still.","@Frakbox","cultural-icon",
"@OilSlickShiner @caulkthewagon @PartyOfANewType @GerardDiTrolio I gain my extensive knowledge of geography from the game carmen sandiego tha","@badsushichef","cultural-icon",
"@bfod Do you think a Carmen Sandiego game could be made now? Thinking about what it'd be/how it'd work has been an occasional idle exercise, but it's hard to picture it both being a genuinely useful teaching tool, and working reliably, when the Internet exists.","@ja2ke","edutainment",
"Where's Waldo with Carmen Sandiego. Drunk Dora the Explorer who fell down in the street. Halloween in DC. https://t.co/ADqbviyHin","@DCDiva28","cultural-icon",
"Carmen San Diego not wearing her signature red. https://t.co/J0XqAOeYju","@plangeypants","fashion",
"@StacyKeibler Where in the world is Carmen Sandiego? Whoops I meant Stacy .","@SirNighthawk007","cultural-icon",
"Gina Rodriguez is Carmen San Diego? WOW. I like it. Carmen San Diego is one of my favorite female charaters/role model as a kid.","@BangtanLena","role-model","x"
"@andylassner From Dora the Explorer to Carmen San Diego in one trip. Is this her idea of Hispanic outreach?","@Kingwoman","travel",
"Clearly @unclebutchh is the real Carmen SanDiego..cause I cannot find this biiiish.","@Sam_Carter94","cultural-icon",
"@NintendoAmerica #SmashBros maybe Little Mac, Geno, Waluigi, Daisy, Captain N, King K Rool, Impa and maybe Carmen Sandiego for 3rd party?","@QBynoeOgle","cultural-icon",
"https://t.co/8dKdksz8YX The Making Of Carmen Sandiego: Making Educational Games Fun #gamedev","@RedditGameDev","edutainment",
"The skids need constant reminding. The only red fedora is on one Miss Carmen Sandiego, TYVM 😉 https://t.co/WOs1oOLN23","@da5ch0","fashion",
"Where is Carmen SAN Diego.... #hats #japan #funky https://t.co/pBnhDgANQ6","@thunderrosa22","fashion","x"
"Carmen Sandiego' Coming to Netflix, Voiced By 'Jane the Virgin' Star https://t.co/AoM4Pa5qvG","@K1017fm","cultural-icon",
"Gina Rodriguez to Voice Carmen Sandiego in Netflix Series https://t.co/3r5LXJkZn0 via @vulture :D","@LeNoirAuteur","cultural-icon",
"#Breaking @netflix is developing a live-action film based on the classic edutainment video game series #CarmenSandiego https://t.co/C14UGhp5UT @BlastingNews #IARTG #PJNET #tcot https://t.co/yf8S2XX5Tz","@larrymlease","cultural-icon",
"@livebeef if you look at it like that way then yes you are right, he has become the real life Carmen Sandiego,was refering to his professional career.","@TheWolfenbach","cultural-icon",
"@MediaObsessed I freaking WISH! Can't fit that hat over the fro tho ""@MediaObsessed: @arisacox International Woman of Mystery, are you Carmen Sandiego?!?!""","@arisacox","fashion",
"@netflix sooo... How about that Carmen Sandiego??","@gracequaintance","cultural-icon",
"Netflix orders 'Carmen Sandiego' with Gina Rodriguez https://t.co/ATIL9DGuZJ","@UPIshowbiz","cultural-icon",
"My Squad!!! #CarmenSandiego #NavySeal #hippies #FidelCastro #Soldier #Pinky #Foxy #HappyHalloween… http://t.co/75hEJrRcxW","@KillaKarla928","fashion",
"@erinscafe I'm being Carmen Sandiego for Halloween!","@GeeLyn","fashion",
"Carmen San Diego! Inspiration for my car https://t.co/rkaHx4o5bd","@ryanjmac_","cultural-icon",
"How Carmen Sandiego accidentally became an educational game icon https://t.co/q9uorMKp1K","@F4GSocial","edutainment",
"One Halloween my sister and I went as Carmen Sandiego and Babs Bunny. Decent female kid-culture icons, imo. What are the equivalents today?","@jocelyngiannini","fashion",
"I think Carmen Sandiego dressed up as Waldo might be easier to find than any consistency from the Cubs rotation at the moment. #Cubs #MLB","@jwswim1","cultural-icon",
"@SNCmusic is there a video anywhere of you guys doing the Carmen Sandiego song? It would make my childhood happy.","@tessamalk","cultural-icon",
"#throwbackthursday to this game I used to play in elementary school. :-) #carmensandiego http://t.co/QhLxgLR51I","@AdrianaMunoz09","edutainment",
"http://t.co/jpfMqJrTsw Less than a week now until I don the Carmen Sandiego hat and dash all about London to stand outside state's embassies","@scattermoon","fashion",
"Where in the World is Carmen Sandiego?? https://t.co/lsJ1mkuQWt #carmensanediego #cosplay #costumes #hats","@withoutastitch","fashion",
"Hot: VIDEO: 10 Reasons Where in the World Is Carmen Sandiego? Was the Best Educational TV … https://t.co/oI8OplUTY3 https://t.co/rhMvjoIKbe","@SevenDaysLive","edutainment",
"#growingupwithmyname ""have you heard of carmen san diego?"" No wow educate me on the game character who shares the same name as me thanks","@agrandestyles","cultural-icon",
"Theyre making a Carmen Sandiego show on Netflix @DadassPaladin","@keereeyou","cultural-icon",
"Where in the USA is Carmen Sandiego Geography Board Game 1993 https://t.co/p4jHNAJuiF https://t.co/V0RsHW3bCc","@UltraPlushest","cultural-icon",
".@HereIsGina as carmen sandiego, animated AND live action!!! between this and @OneDayAtATime coming back, this has been a beautiful 10 minutes for latinx people https://t.co/ago7xizalx","@meanchelled","role-model","x"
"“Carmen Sandiego” reboot voiced by Gina Rodriguez coming to Netflix https://t.co/yD6yOfgSHj https://t.co/H9C05eXzxG","@MechanicalBaba","cultural-icon",
"Gina Rodriguez donning red fedora and trench coat of Carmen Sandiego https://t.co/e5r0SQs2pW","@ReadyForTheWeb","cultural-icon",
"Gina Rodriguez Voicing Carmen Sandiego in Netflix Show https://t.co/gHlw9PKaoB https://t.co/KnPTXTGC5U","@Gaming_NN","cultural-icon",
"@bowmanspartan @NCAgames Think of it this way- the last successful educational game was Where in the World is Carmen Sandiego (I also had some success with the incredible machine.) People focus too much on the *message* and less on the *game*. Good game will always instill a good message (or memorable)","@TycunaTV","edutainment",
"Hipster Sighting: 20 something ginger, wearing child's ""Where in the world is Carmen Sandiego"" backpack and Non-GMO free range shoes","@Vintage_Carrot","cultural-icon",
"Shady + red trench coat + red hat = Carmen San Diego for Halloween Do you all h... https://t.co/Re2rEjiEJA","@crashpalace","fashion",
"@helloicedcoffee New game where Carmen Sandiego travels the world trying to find herself","@jaybarnes","cultural-icon",
"Gina Rodriguez to Star as Carmen Sandiego in Live-Action Movie for Netflix! https://t.co/qx7oh6JAN1 via @justjared https://t.co/3DodwSo7Pv","@The_News_DIVA","cultural-icon",
"Having taught history & now teaching technology, I've got a kinda unique perspective. I like to think about games like Oregon Trail & Carmen Sandiego and consider why I enjoyed them so much. For me it comes down to that they were games first, learning second.","@KnightofCali","edutainment",
"Carmen Sandiego is the second oldest edutainment series in the history of video games. #ThinkSerious :^) https://t.co/2tg3G5Uqmm","@Azu_Rayn","edutainment",
"Gina Rodriguez, ‘Stranger Things’ actor, to lend voice to Netflix’s ‘Carmen Sandiego’ https://t.co/dYHBdBqqyu #Digital #Trends #News","@MobileAATrends","cultural-icon",
"Who In The World Is Carmen Sandiego? CEO, Intellectual, & America’s Most Positive Latina Role Model http://t.co/OOhQJJlqiq","@Kekeh77","role-model",
"Today, my friend had on a big red hat & I told her she looked like #CarmenSandiego. Her 13 y/o brother had no idea who that was. #IFeelOld","@NoahTheGolden","fashion",
"Netflix finds 'Carmen Sandiego' for its latest reboot: https://t.co/3olw99VaIi","@pops131","cultural-icon",
"Our Childhood Dreams Have Come True: Gina Rodriguez Is Playing Carmen Sandiego On Netflix https://t.co/EyI3e01DYa #ilovespinradio","@ILoveSpinRadio","cultural-icon",
"@alerivera35 this tweet represents my struggle of wanting to be Carmen San Diego for Halloween, but not doing it cause no one will get it","@Titoro_","fashion",
"Someone please dress up as Waldo and I'll dress up as Carmen Sandiego and together we will win Halloween.","@rachaelandrew4","cultural-icon",
"I want to know some of your favorite educational games growing up. Ya know besides Oregon Trail and Carmen Sandiego: http://t.co/8fE0FdXaIa","@skie","edutainment",
"#inktober2017 15th Mysterious #ink #traditional #womam #carmensandiego #trenchcoat https://t.co/kv8cFutjdM","@DABurgosART","fashion",
". @netflix has reportedly ordered 20 episodes of a ""Where in The World Is Carmen Sandiego"" reboot: https://t.co/6qArM1n1WQ https://t.co/O3FWb1EUAf","@FM100Memphis","cultural-icon",
"Netflix's 'Carmen Sandiego' debuts on January 19th, 2019 https://t.co/vxl7Bslt9z #tech","@m_adduci","cultural-icon",
"Flashback Friday to matty_harris44 and I's costumes last year. Carmen San Diego and Agent Lee Jordan.… http://t.co/72Y51qXECj","@RachoUNO","fashion",
"@SamanthaWeiner1 Carmen Sandiego was many things, but a jerk was not one of them. Ahead of her time as fictional female villain. Rock it.","@andreas_marcos","role-model",
"@MingNa Your hat makes me think of Carmen San Diego, if she, you know, kicked butt!","@OppThumbs","fashion",
"""Gobi brave in Inner Mongolia"" -The Chief, Where In The World is Carmen San Diego","@Danielleri","cultural-icon",
"Ball With Me by Carmen Sandiego use to jam!","@_paypay","cultural-icon",
"@DeMarko Javiera dresses up as Carmen Sandiego, April O’Neil and Lara Croft in the video","@DeMarko","fashion",
"From Carmen Sandiego to Freddi Fish, here are some of the more noteworthy female heroines and influencers from one of the greatest eras for kids' software ever. https://t.co/28sH3C2znM","@Syfyfangrrls","role-model",
"Help me out guys! Waldo and Carmen Sandiego. The Dream Team! Which background do you guys think works the best? http://t.co/YCPdKvDrkz","@IzzyKSter","cultural-icon",
"Gina Rodriguez Is Netflix's New 'Carmen Sandiego' - Animation Magazine https://t.co/XlrLaLjHUI","@Animationtweet","cultural-icon",
"all i wanna do is play ""Where In Time Is Carmen Sandiego?""","@just_bittenn","cultural-icon","x"
"""world traveler costume"" it's a knock off carmen sandiego","@thelittlepakeha","fashion",
"@ami_angelwings I'm traveling with Carmen Sandiego","@maxx_chaos","travel",
"@mmitchelldaviss what are your thoughts on Carmen Sandiego on Netflix?","@AnnaMetra","cultural-icon",
"Netflix greenlights a Carmen Sandiego series 😎 https://t.co/W0lfwNQma4","@Dante_Geek","cultural-icon",
"Seriously, has anyone found Carmen Sandiego yet? She has to be tired of traveling all over the world. My guess is she retired to Florida.","@NYeoman","cultural-icon",
"Last Night with carmen_sandiego_ and the homie Marc Berman #YoungWithOptions http://t.co/BARpLsOMDg","@Pooda_Dappa","cultural-icon",
"@tipsy_writer #tipsychat Also, back in my day, the best computer games were all educational. Who remembers Clue Finders, Math/Reading Blaster and Carmen Sandiego?","@MsOcampoWrites","edutainment",
"Gina Rodriguez Set to Steal Our Hearts as Carmen Sandiego in Netflix Live-Action Movie https://t.co/LupT7Afe4y #movies","@jim_napier","cultural-icon",
"Netflix picks up a second Carmen Sandiego project, with Gina Rodriguez to star: https://t.co/26wHu8HLL8","@DenofGeekUS","cultural-icon",
"Gina Rodriguez to Voice “Carmen Sandiego” for Netflix as Two Movie Studios Battle for Her Next Slot (Exclusive) https://t.co/sHvnwo7hke","@childmediaconf","cultural-icon",
"@HerSoulWrites A1 (contd): I also sang to my dolls and then wrote about my adventures. I was Carmen Sandiego. #NostalgiaChat","@HerSoulWrites","cultural-icon",
"Channelling #carmensandiego for our #drcarlenlive adventure tonight 💋 See you at 8PM… https://t.co/pGVvHN23PI","@drcarlen","travel",
"This Stranger Things Star Will Be In Netflix's Carmen Sandiego Reboot https://t.co/7ibhcOVABB #beauty https://t.co/mROhdq0865","@BrendaLambertWr","cultural-icon",
