"text","handle","category","star_tweet"
"@LizzAndrews I suddenly have an image of you dressed as Carmen San Diego in a trench coat.","@Majk04","fashion",
"Double Yeah!!! Gina Rodriguez To Star As Carmen Sandiego In Netflix Live-Action Feature https://t.co/IgCWqJbZyE via @deadline","@LainnieFelan","cultural-icon",
"Saturday Night Social: Gina Rodriguez Will Voice Carmen Sandiego in Netflix’s Upcoming Animated Series https://t.co/xu6V1ZCDlD https://t.co/J8AHm1TypW","@marin_lane","cultural-icon",
"But @DRUNKBOYGEO and I found Carmen Sandiego and the white power ranger on the FDR drive tonight. #sucess","@ashleyyy_lol_","cultural-icon",
"First look image from Netflix’s Carmen Sandiego, Finn Wolfhard joins cast https://t.co/qK9Fe3c1nk","@terencekoger","cultural-icon",
"Idea for a video game. In the style of #AssasinsCreed but you play as #CarmenSanDiego traveling the world, avoiding spies that are tracking you down while you clear your name and collect clues from all over. #idea #gameidea #videogames #thoughts","@CandleCTM","travel",
"Netflix making live-action Carmen Sandiego movie https://t.co/fhULvukOsA via Michael McWhertor https://t.co/I6lgfmTnU4","@techviagoogle","cultural-icon",
"@maspoxacorno @vivi_scans Darkwin Duck, Carmen Sandiego, Snorks","@danielquinello","cultural-icon",
"So clearly we all need this Carmen San Diego bananarama ass coat in our lives #HowToGetAwayWithMurder https://t.co/MH2k2SfMp7","@BlackGirlLostX","fashion",
"Iconic! Netflix Is Bringing Back OG Scammer Carmen Sandiego & Everyone Is GEEKED https://t.co/Dk0GNBpKUb https://t.co/ACkyIEhoPe","@freakyradioshow","cultural-icon",
"I made a Where In The World Is Carmen Sandiego reference and no one caught on, y'all suck.","@kittinnho","cultural-icon",
"I can't wear a hat and sunglasses together and look cute. I look incognito. I look like Carmen Sandiego.","@abrianamcar","fashion",
"Netflix Casts Gina Rodriguez as Carmen Sandiego in Live-Action Movie AND Animated Series https://t.co/iHk5Z96hV3","@teresacornwell3","cultural-icon",
".@HereIsGina Set to Play #CarmenSandiego in @netflix Live-Action Film and All My Dreams Have Come True https://t.co/IYgCaqUSg1 #gaming #womeninfilm #Latinx #latina https://t.co/YY7RNlkkpn","@TheMarySue","cultural-icon",
"@eegabeeva88 Your hat and traveling imply that you are looking for Carmen San Diego","@ViaBlazer","cultural-icon",
"Uh, I don't have professional wear, so is it cool if I just go to the Geography Career Fair as Carmen Sandiego?","@GreenMEGs_n_Ham","edutainment",
"@ThatBarb My guess is he's on a trip with Carmen Sandiego","@WPJ4","travel",
"In today's edition of ""World Traveler Costumes,"" we present: Where in the World is Carmen Sandiego? #costumeideas... https://t.co/UjaoNXuUSF","@ISAHighSchool","fashion",
"But Carmen Sandiego would be an awesome Overwatch hero","@RynnyRyn","cultural-icon",
"Another '90s Favorite Is Being Rebooted at Netflix—And Gina Rodriguez Is Playing the Lead https://t.co/9b3dgt270Q via @glamourmag","@80sMusicGirl","cultural-icon",
"@iSmashFizzle This is my most fave tweet as an unenlightened white kid in the 90s I didn’t even realize how Carmen Sandiego was “revolutionary” for POC I just thought the song was cool 😂","@AmelieSaysHola","cultural-icon",
"FIRST LOOK: Netflix Sets ‘Carmen Sandiego’ Reboot for January 18 https://t.co/P9ScLHs0Mf https://t.co/PL4pANC2vu","@JJKnightart","cultural-icon",
"Gina Rodriguez donning red fedora and trench coat of Carmen Sandiego: https://t.co/KC2c2SkzPS","@brianrobplus","cultural-icon",
"Netflix's #CarmenSandiego adaptation nabs itself a release date. https://t.co/Yj9DCKpvNb","@DenofGeekUS","cultural-icon",
"@HayleyAtwell With the promo shot of that red hat, I totally think you should be cast as live-action Carmen Sandiego.","@stahscream","fashion",
"#SocialMedia #SMM Gina Rodriguez donning red fedora and trench coat of Carmen Sandiego https://t.co/KTZu3jEhkr https://t.co/kCbGoFDaMW https://t.co/ldfSH15C85","@asif5i","cultural-icon",
"Today is International Women's Day, the day we celebrate the greatest thief in the world Carmen Sandiego. I have been informed that is not what today is for.","@401authrequired","feminism",
"So way back in my Carmen Sandiego article I mentioned that in that game you could travel to the ""future of 2014 AD"" http://t.co/CbD4N9K6sT","@caspiancomic","travel",
"Gina Rodrigruez Reportedly to Star in New ""Carmen Sandiego"" series on Netflix https://t.co/Eac5B9f43Y","@GeeksOfColor","cultural-icon",
"@simplex_reverie Fictional - Carmen San Diego. That chick knows her way around the globe! Real life - My best travel friend. Some of the best memories of my life have been when I have been on trips with her.","@xfbard","travel",
"@jelly - time to be Carmen Sandiego for #halloween - where's the best red trench though? #askjelly","@caseylorens","fashion",
"@SharonHayes @TalkNerdyToMe72 I actually dressed as Carmen Sandiego one Halloween and ran into a Waldo 😂","@syd_viciously","cultural-icon",
"Use ""Game-if-cation"" i.e. Oregon Trail and Carmen San Diego to teach Americans how to learn and do things correctly. @elonmusk","@AndrewActon","edutainment",
"Netflix Is Reportedly Reviving Carmen Sandiego With Gina Rodriguez https://t.co/dsKSIwWyru https://t.co/VRp1diYpGu","@WTAE","cultural-icon",
"""Gina Rodriguez Voicing Carmen Sandiego in Netflix Show"" https://t.co/ubJ2UxDBJk","@TweeBrittanyLee","cultural-icon",
"@Dr3Ducati “@Dr3Ducati: I'm Where's Carmen San Diego old.” Then you def gotta be Bill Ny the Science Guy old!","@AUDIOFEEN617","edutainment",
"Playing Where in the World is Carmen Sandiego and I found a raging clue... https://t.co/MvddBfI1Fk","@theadamdiaz","cultural-icon",
"@KennyCable1000 how can I forget her, I spent hours hunting her and her VILE gang on my computer, Carmen Sandiego taught me my geography","@antholilmonster","cultural-icon","x"
"Her name is Carmen Sandiego and she taught me about art, history, geography, and nature so she's already better thank you very much. https://t.co/3eqjVygVA8","@fakejokename","edutainment",
"Ya'll think the big, black Carmen Sandiego hat is actually sold or just passed around from #KPOP Idol to Idol? #MAMA2014 #2014MAMA","@RCreacts","fashion",
"@CHamsClassroom @KatieF On another note, Carmen Sandiego is my Halloween costume :-). Pics will be posted!","@Ms_A_Yeh","fashion",
"Carmen San Diego think she slick https://t.co/HmwXibkuge","@LBRWNJMS","cultural-icon",
"Where in the World Is Carmen Sandiego? Becoming a Secret Travel Agent https://t.co/4xtcFewhMp (cmts https://t.co/uk1CK0BVWo)","@FrontPageHN","travel",
"Gina Rodriguez to play Carmen Sandiego in Netflix film - https://t.co/VgNnptJtBA","@TheReal_KDubb","cultural-icon",
"Who remembers this? There was also a TV show too which @netflix is bringing back #carmensandiego #90s https://t.co/k8Y4y2f4ZL","@poly_zero","cultural-icon",
"LeBron out here lookin like Carmen San Diego with all that travel. #NBAFinals","@e4o8j","travel",
"#CarmenSanDiego will make #Netflix her new home! Expect to see the animated series in 2019. https://t.co/7VSKQvaEKP https://t.co/KW61G9QvXe","@HollywoodRedux","cultural-icon",
"If the Wide-Brimmed Hat Fits! Gina Rodriguez Will Play Carmen Sandiego in Live-Action Movie https://t.co/j4iyzxTyd8 via @POPSUGARLatina https://t.co/U7KL8uiSIp","@The_News_DIVA","cultural-icon",
"You could find me on Instagram with pictures of the adventures and home improvements but I would end up like a living game of where in the world is Carmen sandiego.","@skylerzane","travel",
"@IsraelButson exactly. A game can be educational while being a great game. I didn't play Carmen Sandiego to learn geography, and yet I did","@kindofstrange","edutainment","x"
"To dudes who couldn't take it, might I say 'hasta luego' / Cause I'm takin all your city like I'm Carmen San Diego","@BenLeiker","cultural-icon",
"Where in the world is Carmen San Diego? @ Hilton Head Plantation http://t.co/xhhiG8ilWq","@cranfordhollow","cultural-icon",
"But seriously. I'm 22 and just found Carmen Sandiego. Both elementary school me and adult me are hyped as fuhhhh","@ASzotko","cultural-icon",
"Netflix is bringing back ‘Carmen Sandiego,’ and it’s going to star Gina Rodriguez https://t.co/VkRHbqJM9P https://t.co/8Xi9VGyUcf","@MastaCriminal","cultural-icon",
"@TheMadSmith Dude, did you ever play the Carmen Sandiego lost in time PC game? That was amazing.","@MissFushiGaming","cultural-icon",
"I just walked into the kitchen and calmly stole an entire plate of cookies I feel like Carmen Sandiego","@saracentury","cultural-icon",
"I'm excited for the #CarmenSandiego @netflix reboot. Only platform to have a decent record of not butchering my childhood nostalgia 🙌🏼","@tisstassnyc","cultural-icon",
"It's not a comic con until you find Waldo and Carmen Sandiego. #sdcc2016 #comiccon #cosplay https://t.co/2jjjNMPf92","@BookBlerd","cultural-icon",
"marina!!!!!!!!!!!!!!!! marina you're looking like carmen san diego in that hat and coat!!!!!!!! hello again!!!!!! #thelword","@mackdougs","fashion",
"Where In Time Is Carmen Sandiego definitely has a powerful look. very eccleston dr. who, early digital effects and CG sets. and such beautiful purple ❤️❤️❤️ (the then-color of cyberspace in a lot of stuff), very deep space inspired color palette https://t.co/a4ZcXzSBsU","@MaxKriegerVG","cultural-icon",
"My mother at Dottie's red hat, ""I thought that was Carmen Sandiego."" *dies laughing* #AgentCarter","@silverwolfstar7","fashion",
"Lady in floor-length fur and Carmen Sandiego hat arriving one minute before the Acela departs: I have no words.","@sarrible","fashion",
"Why hasn't there been a Borne style or Bond style, Where In The World Is Carmen Sandiego movie?!","@jedihelpdesk","cultural-icon",
"@goldengateblond we finally know where in the world Carmen Sandiego lost her hat","@SevaUT","fashion",
"@RyanRoach5 @space_sloth26 It's like Where in the World is Carmen Sandiego? for idiots. Complete idiots.","@raaadaniel","cultural-icon",
"What in the world is Gina Rodriguez doing next? Playing #CarmenSandiego! https://t.co/C9lLZnZkc5 @HereIsGina https://t.co/YoSZeVuITl","@Variety","cultural-icon",
"@thehitch_md it really is. Assuming she’s also got major issues with these kids driving their Geo Prisms, & looking for Carmen San Diego.","@jfarm07","cultural-icon",
"Is Carmen Sandiego a gay icon yet?","@CyberMormon","inspiration",
"I found Carmen Sandiego! She changed her coat color. #STLvsSEA #GoHawks","@kate_m22","cultural-icon",
"No One In the World Actually Ever Found Carmen Sandiego...Until Now! https://t.co/5mK8ZEvqtl #edchat #edtech","@MsMensing","cultural-icon",
"Whewwww that red carmen sandiego hat she wearing 👏","@Kimberlychanel_","fashion",
"@beezwitit im starting to think you may be the real life carmen san diego 🤔","@91ultra_","cultural-icon",
"Gina Rodriguez donning red fedora and trench coat of Carmen Sandiego #ChainFeedsDotCom https://t.co/lFWAe9wMPm","@Camertw33t","cultural-icon",
"@solusandra definitely, especially if I can't get @zyx77 to dress up as Where's Waldo so I can go as Carmen San Diego.","@AlwaysBeezy","fashion",
"I learned how to disappear from Waldo and Carmen SanDiego","@MrElicit","cultural-icon",
"#Randomthought : did geography knowledge in the US decrease after the cancelation of ""Where in the World is Carmen San Diego?""","@NRRatcliffe","cultural-icon",
"Stranger Things Star Joins Netflix's Carmen Sandiego Series https://t.co/HVzSaVSg3g https://t.co/tArfBgbBMa","@RelentLife","cultural-icon",
"Where's Waldo? Apparently impersonating LeBron while driving a Kia. Now, back to searching for Carmen San Diego. https://t.co/ZJepVjfJ1j","@mgbode_WFNY","cultural-icon",
"Anna looks gorg in her Carmen Sandiego outfit. #GH","@thetomorrowroom","fashion",
"I found Carmen Sandiego's cousin. She wears a black hat and coat though.","@_sassycat","fashion",
"Netflix finds 'Carmen Sandiego' for its latest reboot https://t.co/gUiCt2CX8j via #indilens","@rumide123","cultural-icon",
"@xxxescortamber Given your extensive travel diary you could be a sexy Carmen Sandiego this year https://t.co/ZNdDLHgbLD","@BigDK00","travel",
"As far as I can tell, there has never been an official Carmen Sandiego action figure, figurine, statuette, or doll. With a new TV series and feature film from Netflix this year, 2018 has the opportunity to finally correct a travesty that has continued for 25 years","@WINGSPANTT","cultural-icon",
"I know I’m not the only one who remembers Carmen Sandiego?","@adriennespaige","cultural-icon",
"@TH3R3VLCLXVDS no cable? boy get that carmen sandiego out of here i hated not having cable them cartoons was wack once we got cable shit was lit 😂😂","@avatareric","cultural-icon",
"RNN: Gina Rodriguez To Star As Carmen Sandiego In Live-Action Netflix Film https://t.co/zXt06eHJA0","@reviewngnetwork","cultural-icon",
"Wore a trench coat to work today and was repeatedly asked where Carmen Sandiego was.","@AussiePrice","fashion",
"Gina Rodriguez to Play Carmen Sandiego in Live-Action Netflix Feature https://t.co/z1ppjMB7bx","@dot_film","cultural-icon",
"Carmen SanDiego was a great show because it taught an entire generation geography, history, and that beautiful women wil","@Nab__y4viz72s7f","edutainment",
"Idk if ive mentioned this on my twitter b4 but i am SO HYPED FOR THE CARMEN SANDIEGO REBOOT WITH GINA AND FINN NONE OF Y'ALL UNDERSTAND https://t.co/SZQ5OJNhZ2","@nymphonies","cultural-icon",
"Spencer becomes Schrödinger's cat. Noel becomes a 3rd-wave feminist. Jason becomes a chair. Melissa becomes Carmen Sandiego. #PLL #PLLTheory","@lastweekonPLL","cultural-icon",
"Carmen Sandiego is a role model. https://t.co/76a8BVIvvh","@fromira","inspiration",
"Check out this article I wrote yesterday! Carmen Sandiego is coming to Netflix! https://t.co/eIKYo28v3D","@jonjnorth","cultural-icon",
"‘Carmen Sandiego’ is officially in works with Gina Rodriguez https://t.co/WBMdiVirhP LOS  ANGELES, Apr 19:  Netflix has formally announce…","@nasirmobeen2","cultural-icon",
"Idk about y’all but one of the most elusive women in my life was Carmen Sandiego. She really might have been the originator of the fly out. This chick was all over the globe!! Shoutout the geography lessons tho","@The_Dubberman","edutainment",
"#QueenSugar Where in the world on NICKI MINAJS ALBUM.... (In the style of Carmen San Diego)","@Imwithtash","cultural-icon",
"@mclars @realytcracker @pwrcycle @derose But what if Carmen Sandiego was wearing an MCLars shirt?","@marshalljansen","cultural-icon",
"@RedBeanz87 @hawkwrrdly did he get pk the carmen sandiego hat?","@audrey1nd","fashion",
"#CarmenSandiego is officially sneaking onto #Netflix! Get the first teaser image and all the details: https://t.co/Qe8iz6e905 https://t.co/jzr8HceXuN","@ComicBookNOW","cultural-icon",
"WHAT!!? YES!! 🤠😍 ⚡ Netflix greenlights a Carmen Sandiego series! https://t.co/vbJ2SCjZGH","@lobovalenzuela","cultural-icon",
"@MarkAgee @RedDirtSport CAM: No, gimme Carmen Sandiego finds the Sorting Hat.","@markaduck","cultural-icon",
"Carmen Sandiego's Think Quick Challenge (PC, 1999) The Learning Company http://t.co/MPEuCna6BN http://t.co/qIn2EUXATs","@HotVideoGames2","edutainment",
"It's Official: Carmen Sandiego Is Getting Her Own Animated Netflix Series https://t.co/EYiaesoXSf via @io9","@ironcoder88","cultural-icon",
"@deadmau5 I am Canadian. That makes being Canadian THAT MUCH cooler. #themostinterestingmanintheworld #CarmenSandiego #MissUniverse ✈️✈️🌻👩💋💋","@Kithanae","cultural-icon",
"My life has become a nonsensical geography game and I am Carmen San Diego. I need an appropriate hat.","@mariancall","cultural-icon",
"""How Carmen Sandiego accidentally became an educational game icon"" https://t.co/WHVGeqglft","@ralphusion","edutainment",
"@ahencyclopedia I remember learning from a Carmen Sandiego point-and-click about Lief Eriksson, Vinland, and how the days are name after the gods of Valhalla.","@RoscoeTheHorse","edutainment","x"
"Netflix Casts Gina Rodriguez as Carmen Sandiego in Live-Action Movie AND Animated Series https://t.co/2vWrnMw8eg","@srepenascor1988","cultural-icon",
"Sounds like Netflix is bringing back ""Where in the World is Carmen Sandiego?"" https://t.co/6qBPC2A21s by... https://t.co/jUwchPjwGS","@JaNursing","cultural-icon",
"#Hollywood #MAGAMarch Saturday Night Social: Gina Rodriguez Will Voice Carmen Sandiego in Netflix’s Upcoming Anima… https://t.co/MT6O1HWRsz","@ollielogan20","cultural-icon",
".@netflix She puts the Miss in misdemeanor when she stole the beans from Lima. Tell me. Where. In. The. World. Is: Me: Carmen San Diego https://t.co/ATbNni4wkS","@MatthewACherry","cultural-icon",
"Gina Rodriguez Will Star in Animated ‘Carmen Sandiego’ Netflix Series https://t.co/R4iusofuHG https://t.co/M7Jpbz2ZkJ","@biggeststories","cultural-icon",
"Netflix orders animated Carmen Sandiego series https://t.co/nW8oigSch0","@1bestHappy","cultural-icon",
"@eerupps @PBS what other program can you name that made #history AND #geography fun? bring back #CarmenSandiego","@leprchaunrabbit","cultural-icon",
"Where in the world is @ashtonraze? (puts on Carmen Sandiego outfit) Wait...I think I got that backwards.","@kelseyr713","cultural-icon",
"@mmitchelldaviss what are your thoughts on Carmen Sandiego on Netflix?","@AnnaMetra","cultural-icon",
"@Wray62 @shalinel I've started puttering around in a yellow trench coat and trilby hat. I look like the lovechild of Carmen Sandiego and-","@CarnaganWolfe","fashion",
"Seriously, world, that's the best we can do? A ROM of Carmen Sandiego on a slightly dodgy site? Why can I get this on iPad for my kids? #lrt","@bjkraal","cultural-icon","x"
"Netflix Developing Live-Action 'Carmen Sandiego' Movie Starring Gina Rodriguez https://t.co/qM7Iijbt62","@DcCosmos","cultural-icon",
"The Magic School Bus is coming back. Now, all I need is for @netflix to revive Carmen Sandiego too, and I'll be set! @CarmenSandiego #please","@Terab0414","cultural-icon",
"A Carmen Sandiego animated series is in the works at Netflix with Jane The Virgin’s Gina Rodriguez attached to... https://t.co/LSQNobmK7n","@papibarbers1","cultural-icon",
"Gina Rodriguez To Play Carmen Sandiego In Live-Action Netflix Film https://t.co/I5zv7x3gtU","@summedupusa","cultural-icon",
"This defense is Carmen San Diego levels of missing","@geauxcrimson","cultural-icon",
"can't wait to watch the new animated series of Carmen Sandiego what great memories I had as a kid #Netflix https://t.co/EK9jhyFwHK","@BARON_1987","cultural-icon",
"Already have my next Halloween costume planned out. Carmen Sandiego. My date&39;ll go as Where&39;s Wally. Always wanted to do that","@daughertyaj332","cultural-icon",
"@ddale8 So he wasn’t a fan of Dora The Explorer or Where in The World is Carmen San Diego? How about one of those floor size world map puzzles?","@BldheartLib","cultural-icon",
"ME: Carmen Sandiego is a queer icon MANDY [without hesitation]: Oh my god, yes, of COURSE she is. - typical conversation with my alpha friend https://t.co/Mcp4FLLHQQ","@JennyChalikian","inspiration",
"@SpawnWaveMedia Some of the classic educational games like Oregon trail, Carmen San Diego, Gizmo and gagets","@avikingchef","edutainment",
"Where in the world is... she be coming to Netflix 2019!! Animated origin story. Super pumped! #CarmenSandiego #netflix https://t.co/6uZdSCQgwz","@cueplotdevice","cultural-icon",
"I was real good at making paper planes in 4th grade & sold them for 50 cents to classmates, used profits to buy my bff a Carmen Sandiego hat","@too_lewd","cultural-icon",
"Where in the world is Carmen San Diego? #TuesdayThoughts https://t.co/OIpxhhvgjn","@missMAM","cultural-icon",
"@elonjames Just white dudes. They don't have the power to ruin Carmen Sandiego's fashion statement for anyone else.","@EmpressSudol","fashion",
"Already have my next Halloween costume planned out. Carmen Sandiego. My date&39;ll go as Where&39;s Wally. Always wanted to do that","@carolynnrfdtc","cultural-icon",
"Awesome to see a Latina voicing Carmen Sandiego. Bigger question: Will @RockapellaMusic be involved? https://t.co/6Qyf9pTpkn","@AlexPalombo","cultural-icon",
"LOL YES ALSO I FEEL LIKE CARMEN SANDIEGO WHEN YA TRY TO FIGURE OUT WHAT TOWN IN BERGEN COUNTY I LIVE IN😂😂😂","@twolegit_ebooks","cultural-icon",
"When I opened my eyes, I had no idea where in the world I was. Only a vague memory of my name - Carmen SanDiego. #amwriting #writerslife #amnesia #globetrotter #geography #hats @OfficeTeam https://t.co/nIaqKwyNyU","@AutumnFaraday","cultural-icon",
"@SilvaniArt Where in the World is Carmen Sandiego Ducktales Original Teenage Mutant Ninja Turtles Mighty Orbots Adventures of the Galaxy Rangers","@ImNotAHRHitter","cultural-icon",
"That time I found both of them. #waldo and #carmensandiego #cosplay from #NYCC 2014 https://t.co/pKUlkQUgre","@evildirtydave","cultural-icon",
"OMG! Holy Crimefighting Gumshoes! Carmen Sandiago is getting a new Animated series on Netflix!!! https://t.co/KcP0stLjPH","@WarnarI","cultural-icon",
"@nathanadney I posted a pic on halloween. I was Carmen Sandiego","@enviroartiste","fashion",
"“Carmen Sandiego” reboot voiced by Gina Rodriguez coming to Netflix https://t.co/lHvWLjeu6Q https://t.co/BHA0V5IvNC","@livechannelfeed","cultural-icon",
"Gina Rodriguez will be donning the red fedora and trench coat of Carmen Sandiego for Netflix https://t.co/r3ZIrIwITA Hidden among the ot…","@berge31","cultural-icon",
"I legit learned more geography and history from Carmen Sandiego than school tbh. https://t.co/L8f1qhaJ9M","@calvinstowell","edutainment",
"This Pup Has Traveled The World, And Has Drool-Worthy Pics To Prove It: Move over, Carmen Sandiego, this adven... http://t.co/FTTOmWyaz0","@DontMindLife","travel",
"Don't remember any mention of #CarmenSandiego using a motorcycle for time travel. Found at the #PlasticArmory booth at @aVideoGameCon #avgc #hititrockapella #retrogaming https://t.co/YMNVpoPdhm","@evaction","cultural-icon",
"Carmen Sandiego is coming to Netflix.......... #CarmenSandiego https://t.co/j63bvdxMy3","@quietbooklion","cultural-icon",
"The ladies love my style // The guys like my flow // My swag is timeless // Carmen Sandiego","@Deejaralamo","cultural-icon",
"On my ""Carmen San Diego"" vibe, again....................... #hat #accessory #artist #IamOther… https://t.co/IVTNgLYFg3","@Ruthy_Valdez","fashion",
"@Christophicles Million dollar idea: Cast Pitbull as a male Carmen San Diego in an educational geography game/app called ""Widely Watching Mr. Worldwide""","@Christophicles","edutainment","x"
"Whenever I travel, I feel like I'm chasing Carmen Sandiego. Searching high & low, always one step behind, never able to find my quarry. Except my Carmen Sandiego is 2-ply toilet paper.","@Marty_Quinn","travel",
"I need a girlfriend only so she can be Carmen Sandiego while I'm where's Waldo for Halloween.","@EricAldstadt","cultural-icon",
"Gina Rodriguez To Star As Carmen Sandiego In Netflix Live-Action Feature – Deadline https://t.co/BVHUAxEMxH","@LilXenoVert","cultural-icon",
"Carmen Sandiego games on the PC 😂😂 yea I’m old","@FreeMyDreams_","cultural-icon",
"(All beautiful women in red fedoras are Carmen Sandiego, right? That's how it works?)","@nerdsoup","fashion",
"@AshleyEsqueda nobody should judge anybody for wanting Carmen Sandiego on any platform. It’s a good educational title, there are so few.","@waynedixon","edutainment",
"Agreed! I have trail blazed for SDPBC since the ‘80’s....saved receipts to get Macs & Carmen San Diego discs, laser discs, and more... short lived moments of tech enhanced learning.... this time, I truly believe this path we trailblaze will be followed by many others! https://t.co/u2yj6XRhjM","@MichelleReadWPB","edutainment",
"Growing up I had educational TV. Reading rainbow, Bill Nye the science guy, magic school bus, Carmen San Diego. Children's TV now is 🚮","@JENNY4RMTHEBLOC","travel",
"@CakesDt I am THE Carmen Sandiego","@Feliperesponda","cultural-icon",
"Stranger Things Star Joins Netflix's Carmen Sandiego Series https://t.co/WK5y6PnUBf https://t.co/n19CgsB7du","@TheNewNerdnTown","cultural-icon",
"I almost forgot about the time we went as Waldo and Carmen San Diego! #Halloween http://t.co/lMHvFWkqAa","@WintersNight","fashion",
"@mrmatera A2 - I've never tried it myself, but I can think of Mario is Missing or Where is Carmen Sandiego as examples of this kind of game mechanics. They could support travel and history research very well. #xplap","@pandacucho","cultural-icon",
"Netflix is rebooting Carmen Sandiego as an animated kids’ series https://t.co/SAesvCXaXG","@soundslide","cultural-icon",
"@heysawbones The main character, Carmen San Diego, goes on globetrotting adventures.","@Robot_on_coffee","travel",
"My impulsivity sometimes scares me. But not this time... ONE WEEK!!!! Where is Carmen SanDiego off to now? 😏🇺🇸✈️🌉🚂🇪🇸🇬🇧","@jennyymarie","travel",
"RollingStone: A 'Carmen Sandiego' reboot is headed to Netflix, featuring Gina Rodriguez and Finn Wolfhard … https://t.co/v4ceMrp3Xs","@milehighcompany","cultural-icon",
"#WhereOnEarthIsCarmenSandiego : a master class in crime https://t.co/PoH6qXmA9v #cartoons #edutainment #CarmenSandiego #FoxKids #nostalgia https://t.co/K3Jt9tyPtm","@GamingRebellion","edutainment",
"Where in the world is Carmen Sandiego? #happyhalloween #letthefunbegin http://t.co/ez50hd6MMG","@ChelseaLHolland","fashion",
"Grace!! Please discuss Netflix's Carmen Sandiego revival and Syfy's Krypton Teaser that dropped today!! @GraceRandolph","@FJResto","cultural-icon",
"Digimon Adventure 02: Episode Twenty-whatever: Ken wakes to find Carmen Sandiego is mad at him for losing his sunglasses","@Panwaffle36","cultural-icon",
"Yes yes but HOW in the World is Carmen San Diego?","@realchrisjett","cultural-icon",
