"text","handle","category","star_tweet"
"@TheSubtleDoctor @sniperking323 Carmen Sandiego cartoon taught geography, Bill Nye taught science, Wishbone taught literature,","@joyofthejoui","edutainment",
"me: idk ive never really seen carmen sandiego i don't rlly care? netflix: we got gina rodriguez me: carmen sandiego is my favorite franchise","@possumqveen","cultural-icon","x"
"Kourtney Kardashian Takes Younes Bendjima on a Surprise Birthday Trip Oh, the places they'll go! Kourtney Kardashian channeled her inner Carmen San Diego for Younes Bendjima's birthday--and no, we're not talking about a role-playing fantasy.... https://t.co/0sBS9hWR4s","@Reynolds7Rodney","travel",
"#WhatIThoughtWhenIWas18 I’d travel the world by the time I’m elderly at age 40. Thanks to Where in the World is Carmen Sandiego! I’ve accomplished my goals! Love that game 😉","@DrJeanGreySmith","travel","x"
"Photo: on my Carmen Sandiego today (at Hartsfield - Jackson Atlanta International Airport, Concourse F) http://t.co/t6T7j2xeOB","@kristensmith","travel",
"@llamaemilia Why is costume #1 sexy Carmen Sandiego?","@Comfy_Couchman","fashion",
"I want a girlfriend to go as Carmen Sandiego and for me to go as Waldo for Halloween. Then we go and watch Netflix and no one ever finds us.","@Chuckles152","fashion",
"Red fedora acquired. Operation find Wally and kiss and stab him shall commence soon. #cosplay #carmen #sandiego","@BeaIank","fashion",
"I miss how @tarah and @deviantollam are just so easy to talk to. (I still remember my first impression of @tarah at the Shoot: ""Smart and stylish, like Carmen Sandiego, but..real and nice."")","@Vintage_Sister","fashion",
"Having just learned that @andrhia was cruelly deprived of Carmen Sandiego VILE agent name puns, let's all bask. https://t.co/S0nbvnYoTB","@mjandersen","cultural-icon",
"Any kid who could complete the Africa map on Where in the World is Carmen Sandiego was instantly my hero. #90s #wannabegumshoe","@notaleaf","edutainment",
"The family had moved roughly 40 times. The mother was a former actress. We traded plant cuttings and I tried on her old costumes—all the red made me look like Carmen Sandiego. One son was gay and we were fast friends; the other was rakish and flirtatious.","@ancienttexting","cultural-icon",
"@Barkeromo Similar style as a proper fedora. I have a coat to match for the full Carmen San Diego look.","@harleyquinnical","fashion",
"Also, I think I just found Carmen San Diego on the M60 bus to LaGuardia.","@capetownbrown","cultural-icon",
"Sometimes I wake up in the morning & wonder where in the world I am that day & feel like Carmen Sandiego. I should buy a hat.","@nickikb","fashion",
"Where in the world is #CARMENSANDIEGO? I aspire to be her. Travel. Not steal things. #sketch_dailies @sketch_dailies http://t.co/BedMDqlai0","@jaymetwins","travel","x"
"937719291507384320","Yes! Carmen San Diego was a smart and slightly mischevious globetrotter. She was a real badass and I am a bit too excited about this revival. https://t.co/puNesaKTQK","cultural-icon","feminism "
"Where are....? #CarmenSandiego #Waldo #Halloween #Halloween2018 #CouplesCostume https://t.co/7a7IalBB0Q","@littlesassilie","cultural-icon",
"On the lowest of keys, PBS had the most fire children's programming in the 90s. Arthur, Magic School Bus, Bill Nye The Science Guy, Kratt's Creatures, Where In The World Is Carmen San Diego.","@thatkneegro","cultural-icon",
"If that hat was red, Erin Andrew would be Carmen Sandiego","@ted_lilly9","fashion",
"Any other kids have a crush on Carmen San Diego? She was a cultured, strong, ambitious, mysterious woman who ran her own international criminal organization, spoke multiple languages, skilled in hand-to-hand combat and technically proficient with firearms. Yes please! #goals 😍","@TheRealBenAukes","role-model","x"
"I wanna be Carmen San Diego for Halloween but my hair is blonde now :/","@elenastoner","fashion",
"Where in the world is Carmen SanDiego? She's actually right in front of me at the airport. Mystery solved.","@angela_bode","travel",
"@BigBird when I chase Carmen Sandiego & her crooks, I use my clue books, World Almanacs, an atlas of Europe & a Fodor's travel guide.","@JeremiahLiles1","travel",
"#entertainment news Incognito Khloe Kardashian Channels Carmen Sandiego With Her Trench And Fedora: Where in the… http://t.co/yoefR5zGPQ","@JeniseEmbleton","fashion",
"@faeriefountain If you want to be Carmen Sandiego buy a red hat and coat and never leave the house. Maximum effort!","@Yamazuya","fashion",
"@cakeandmadness Please for the love of all things holy cosplay Carmen Sandiego","@theresaninkspot","fashion",
"Just found out my Puerto Rican queen @HereIsGina is playing the badass of my childhood, Carmen Sandiego?!?","@lolhiimtiff","cultural-icon","x"
"I found Carmen Sandiego's cousin. She wears a black hat and coat though.","@_sassycat","fashion",
"i wanna be one of those celebs that just has one outfit like waldo or carmen san diego......wait...maybe i just want to be hard to find","@yeahsometimes","fashion",
"How Carmen Sandiego accidentally became an educational game icon: ""We didn't want to call… https://t.co/kr9ov7mVum","@AllGameThings","edutainment",
"@annfosterwriter @DEADLINE I was already planning on re-purposing my Agent Carter hat for a Carmen Sandiego Halloween costume and now it turns out I'm not just nostalgic, I'm on trend","@vikkivansickle","cultural-icon","x"
"@tiffannyvarga Add red hat for the Carmen Sandiego look http://t.co/TVyDDe0h3e","@JCampana","fashion","x"
"Where in the World is Carmen San Diego? #roadtrip #nextdestination #dontmindmytravelsweatshirt… https://t.co/yXbEZvnQem","@tiaalexander007","travel",
"Balloon Globes in Social Studies 🗺🌏 #CarmenSanDiego -who remembers that tv show? 😎📺 #CCPSSUCCESS @VOEPanthers https://t.co/cYSwVmfrPy","@Immokalee_Flats","cultural-icon",
"Gina Rodriguez Prepares Her Fedora For Netflix’s ‘Where In The World Is Carmen Sandiego’ Reboot https://t.co/95nsgNiW8C via Shayla D","@All_Trends_IT","cultural-icon",
"Daily #zentangle with my Carmen Sandiego hat. #zentangleinspiredart #zendoodle #doodle… https://t.co/NGoM9JNLne","@thedreadpiratej","fashion",
"@BigBird Carmen Sandiego likes dietetic food too, no wonder she's slender. Her car radio is always set to a classical music station.","@JeremiahLiles1","cultural-icon",
"I learned the word dossier from playing ""Where in the World is Carmen Sandiego"" on my childhood Mac Classic.","@miriamgottfried","cultural-icon","w"
"VIDEO: 10 Reasons Where in the World Is Carmen Sandiego? Was the Best Educational TV Show Ever https://t.co/ftUvspgSc4 via @People","@Jill_Chodak","edutainment",
"Carmen San Diego was a role model of mine... @ Kingsborough Community College https://t.co/EAa8ZBxuJh","@HilaryCorna","role-model","w"
"#IStillHavent found Carmen Sandiego. My travel budget is woefully limited. http://t.co/dVl0kthIwe","@OrderRodentia","cultural-icon",
"I wake some days and be seriously thinking my life is a ""Choose Your Own Adventure"" book....Trying to get to the final page of victory, No...turn to page 33...45...4..😱 *imma just be Carmen Sandiego 😒","@PhoenixReignsRM","travel",
"FLL > MSY > FLL > PBG feeling like #CarmenSanDiego minus the snazzy red trench coat","@LauWeins","travel",
"@RELEVANTpodcast I'm pumped for the Magic School Bus reboot. Let's bring back all '90s PBS. Carmen Sandiego with theme song by @PTXofficial?","@CindyAgoncillo","cultural-icon",
"@GailSimone You've never encountered Carmen Sandiego? The educational video games, the animated series, the quiz show? Wow. We must fix this","@shurato2099","cultural-icon",
"@idontlikemunday I clearly need to read ""We Can Fix It."" (And also I can't believe I didn't think of Carmen Sandiego as a time-traveller!).","@cynaragee","cultural-icon",
".@HereIsGina as carmen sandiego, animated AND live action!!! between this and @OneDayAtATime coming back, this has been a beautiful 10 minutes for latinx people https://t.co/ago7xizalx","@meanchelled","role-model","x"
"@katlauver where did u travel to now Carmen San Diego","@PhilsHouse","travel","w"
"@CRB_Sunshine @tonyrey @WildStar Looks more like Carmen San Diego. Maybe it's the hat.","@CptF4ncyP4nts","fashion",
"Happy #WomensDay! Inspiring women in my life? 1) My lovely Mother. 2) My lovely sister. 3) #LisaSimpson. 4) @FloandJoan 5) #CarmenSandiego","@TotallyHadley","role-model",
"You know who needs to make a comeback? Carmen Sandiego. And no not in an Edutainment kinda way. I’m talking Kingsman or James Bond style movie with Carmen being a total badass the entire film. LOOK AT HOW COOL SHE IS! She’s a master thief worthy of a big budget action film! https://t.co/QJw3NRWNjA","@KdinJenzen","cultural-icon",
"@BaileeMadison @satishere @RhysMatthewBond @hallmarkchannel That's back when you were wearing your Carmen Sandiego outfit. :)","@canadajoe1","fashion",
"@msalylloyd @GreyDeLisle You found Carmen Sandiego! Minus the hat.","@EpicVoiceGuy","fashion",
"October 27th: it’s not a Queer Lady Halloween Party until there’s at least one Carmen San Diego, one Dana Scully, and one Francine Frensky 😉 #inktober https://t.co/6VpIQFA42h","@ghostbatcomix","cultural-icon",
"I have no idea where Azerbaijan would be on a map. Why didn't Carmen Sandiego teach me this country","@ryanrhoton","edutainment",
"@_KayStaxxx girl you must think you're Carmen SanDiego.. Where do you travel in a week 😂","@PrettyEscape08","travel","w"
"Do they still make awesome educational videogames? #CarmenSandiego #MariosTimeMachine","@BDubzSurfacing","edutainment",
"Already have my next Halloween costume planned out. Carmen Sandiego. My date&39;ll go as Where&39;s Wally. Always wanted to do that","@brucerf1332","fashion",
"This is the Halloween prize for the Carmen Sandiego facebook contest! Happy Halloween!","@prizmdesign","fashion",
"Last night I was looking on eBay for Carmen Sandiego costume parts until I got distracted by Sporcle/Jetpunk world geography quizzes. Yup.","@scattermoon","fashion",
"Brian and I wanna be Where's Waldo and Carmen Sandiego for Halloween","@stunneyr0bins","cultural-icon",
"Yes, I have a hat that looks like #CarmenSanDiego https://t.co/XJJXtmz8Zt","@ohmisshollie","fashion",
"@TartiiCat They deserve shows like The Pirates of Dark Water, Where On Earth Is Carmen Sandiego, The Real Ghostbusters, Swat Kats, Batman The Animated Series, Gargoyles, etc. To me, these are a step up from shows line Teen Titans GO. Okay, not even close. Maybe a flight of steps.","@Xanaecor","cultural-icon",
"Huh. Interesting side effect of wearing red sunglasses. Everyone looks like a redhead. (also, Carmen Sandiego cosplayers are unrecognizable)","@cronodeus","fashion",
"@Rarely_Ordinary I texted you early today. I figured you were doing your carmen Sandiego traveling the world lol","@Malachi_Garcia","travel",
"If I ever come into a large sum of money, I will waste it on going on a trip to every place mentioned in the ""Carmen Sandiego"" theme song","@Dantvman","cultural-icon","x"
"She needs a Carmen Sandiego hat https://t.co/42NpbAYL0W","@CourJenna","fashion",
"@benjedwards Man I just saw the card game at Target today! Didn't know there is a digital game sku too! Brings me back to elementary school memories. When getting your classwork done early meant you could PC game haha. That and Carmen Sandiego!","@remiscs","cultural-icon",
"A1: I need Star Wars figures for space exploration, Carmen Sandiego for expository genre study(reports) & Wonder Woman being assertive #tlap","@StefaniePitzer","cultural-icon",
"@umcornell @Leendorp Nice Carmen Sandiego cosplay","@Jonalope9889","fashion",
"Where in the World is Carmen SanDiego, a show that taught us geography and that acapella sucked #PBS","@Tom_Menzini","edutainment",
"Wearing a fedora in your LinkedIn picture makes me think I found Carmen Sandiego, not the right candidate #justsaying","@KatrinaKibben","cultural-icon",
"VIDEO: 10 Reasons Where in the World Is Carmen Sandiego? Was the Best Educational TV Show Ever https://t.co/1trFZ1pCXt","@kimzae5","edutainment",
"Hey, Erin Andrews, Carmen Sandiego wants her outfit back...#GBvsSEA","@kneejo15","fashion",
"""And she's wearing this trench coat lookin' like Carmen SanDiego.""","@KodaFett","fashion",
"""Where in North Dakota Is Carmen Sandiego? is a 1989 edutainment video game""","@LucasHayas","edutainment",
"Somehow, Carla Cugino had enough time to change into a Carmen Sandiego outfit. #WaywardPines","@pocketrex","fashion",
"#pt it was show where kids learned about the world by chasing an international thief called Carmen Sandiego http://t.co/qkg7Zrs3PZ","@AnonymousZiZ","edutainment",
"@aalastairr I am aware thanks. Think more like Carmen Sandiego hat... https://t.co/3IRMQuMUlw","@flakmagnet","fashion",
"had a photoshoot with my Carmen Sandiego hat 😂 http://t.co/qrWxG2UQzv","@Tashapinkk","fashion",
"I dressed up as Carmen Sandiego for our company's annual CNY dinner, and only a select few expats understood. This is great news!! https://t.co/yPgq9FRIen @HereIsGina","@blersing","fashion",
"Former Mexican President Vicente Fox, seen here on the set of Where in the World is Carmen San Diego... https://t.co/XXpZmrSG8x","@NMercad","cultural-icon",
"Gina Rodriguez donning red fedora and trench coat of Carmen Sandiego https://t.co/Puil48Gcx5","@manishr0ckz","cultural-icon",
"Gina Rodriguez donning red fedora and trench coat of Carmen Sandiego https://t.co/hNN79Lz116 mashable https://t.co/bdGfka02W9","@jdt55","cultural-icon",
"Good afternoon Paris! 🇫🇷 #travel #tourist #adventure #carmensandiego #mytravelgram ----- Don't just live, live crea… http://t.co/eesF6EqVvz","@SelfieRobot","travel",
"@Lucaskavner Mine is Jonathan Stone and yes I will definitely be indicted in a Carmen San Diego hat.","@BusinessTimeWeb","fashion",
"You're welcome BTW I want to watch the old Carmen San Diego cartoon. Its educational and fun. http://t.co/tKQZOQ1hPM","@Patfactorx","edutainment","w"
"@whatiwore We’d love to use your Carmen Sandiego costume for a @RealSimple slideshow. For more info: samantha.zabell@realsimple.com!","@samzabell","fashion",
"Was listening to the Carmen Sandiego theme song, and I can't help but wonder why she was such a cool character. Other than her hella fashion","@BlackCatula","fashion",
"@cwoodsart First of all, you doing this is the absolute coolest thing Christina! You’re art is so fantastic it’s a fabulous incentive for people to vote! Second, could I get my fave gentlewoman thief Carmen Sandiego wearing an “I Voted” sticker? https://t.co/7neOuklKhR","@JeffP888","cultural-icon",
"@FrankIndD hope you're having fun traveling the world you're like the modern day Carmen San Diego 😝😂","@veemarie121","travel","w"
"A stylish Carmen Sandiego cartoon? This is the biggest improvement from a 90s show since TMNT 2K3","@GWOtaku","cultural-icon",
"Netflix is betting on ‘90s kids nostalgia for learning with upcoming lineup https://t.co/SJgHs9MzHa https://t.co/mn5BvhIoCv","@RSHD_Gaming","edutainment",
"@nicolelynnhoefs yes! Carmen Sandiego is so awesome and it's not complicated cosplay.","@booksandwine","fashion",
"Where in the World is Carmen San Diego? 👒 💄Another from our shoot in #Brazil luizlimaphotog… https://t.co/zTNUW0la1Q","@ValeskaJean","cultural-icon",
"VIDEO: 10 Reasons Where in the World Is Carmen Sandiego? Was the Best Educational TV Show Ever https://t.co/sB1uyCX3Wz","@RichanKloe","edutainment",
"@ladyluvstech We had a desktop when I was 5, lots of learning games. Math puzzles + Carmen San Diego were my early childhood #ladylovescode","@whatthefoz","cultural-icon",
"things i learned from carmen sandiego: puns have been important all throughout history","@lahirisms","edutainment",
"Carmen Sandiego style😏👒 https://t.co/4i6rZht8cs","@Cla_TeamHaught","fashion",
"#FlashbackFriday Where in the World is Carmen SanDiego? taught me everything I know today about geography. This dude was my fave bad guy https://t.co/myJBxwZ8U1","@MikMaqRacer83","cultural-icon","w"
"@BBolander @alisontheperson His TAL narrations scream for various inversions, however. Last pledge drive time we pretended he was Carmen Sandiego.","@BBolander","cultural-icon",
"@howled okay so first of all carmen sandiego is a WOMAN and was a huge role model when I was little that wasn't barbie or a disney princess","@sadiebyrrd","role-model","x"
"I found Carmen Sandiego. She was hiding as a coat rack https://t.co/UTH4XLjrnW","@ScienceJesus","fashion",
"I was trying to think how I can put my newly-improved global geography knowledge to use, and then it struck me: Carmen Sandiego cosplay!","@scattermoon","fashion",
"I can imagine Taylor Swift in a Carmen Sandiego outfit in the dark awaiting to seek revenge with her new single. 😈","@Zaren89","fashion",
"Carmen San Diego is a Latinx icon","@pigeonspiel","role-model","x"
"We found each other!!!!!! #carmensandiego #waldo #AmazingLasVegasComicCon #cosplay #comiccon #ALVCC #bffs http://t.co/ATBKs0oX3K","@abbybrechner","cultural-icon",
"carmen sandiego is a queer icon surely? disrupting the american dream, disappearing into hard to reach spaces, neither here nor there yet everywhere, followed by a grade-a diva cat, that coat, that hair, those boots.","@vidyarrrr","cultural-icon","w"
"Muahaha. I have a rather epic Carmen Sandiego costume that I put together for Halloween last year. https://t.co/ml1Pv4cgHz","@BookWithoutPics","fashion","x"
"Also, the only reason my profile pic is what it is is because that jacket and hat make me look like Carmen San Diego. Man I loved that game.","@katiapsyche92","fashion",
"Chasing #CarmenSandiego around the #world as a child made me want to #travel the world as I grew older. #explore #cultures","@kampind","travel","x"
"Gonna do ya a favor Your PC edutainment childhood was Jump Start, Clue Finders, Humongous Entertainment, Super Solvers, and Carmen Sandiego","@Aerobian_Angel","cultural-icon",
"How Carmen Sandiego accidentally became an educational game icon https://t.co/aRPBrHtMnI https://t.co/NBjR1S5Xqs","@AllGameThings","edutainment",
"Past Dream Girl's of course include Anna Kendrick, Allison Williams, Elliot from Scrubs, Ashley Tisdale, Carmen Sandiego and April O' Neil.","@CoreyAldritt","cultural-icon",
"@JennaOfAvalon How do you even plan these things?! I feel like you need a red fedora ala Carmen Sandiego! ;)","@kayler","fashion",
"Part of me secretly hopes #PeggyCarter got her hat from #CarmenSanDiego #AgentCarter","@ShadupJoe","fashion",
"So this new character #FANG in @CapcomFighters #SFV kinda feels like Grim Fandango meets Carmen Sandiego in Crane Style?","@GamesNetworking","fashion",
"#HowInTheWorldCan Carmen San Diego ever settle down after a life of world travel and hijinx? https://t.co/10h2rPZXr9","@Rachetgrrl","travel",
"@Allisomething @affectionidea @HollabackHRM THAT'S IT. No one gets to wear fedoras any more, except Carmen Sandiego.","@RebelBeckerton","cultural-icon",
"Today's work off-site is a murder mystery with a 1920s theme. So, of course, I broke out the hat and waistcoat combo! #1920s #1920sfashion #redvelvet #ladydetective #carmensandiego… https://t.co/z7kDkqB8FT","@oliviadgrace","fashion",
"We need to make a new game - ""Where in the World is @JohnVignocchi ?"". He travels so much it makes Carmen SanDiego look like a shut in.","@jason_moffitt","travel","x"
"javiera mena cosplays as carmen sandiego, laura croft, other amazing outfits. where in the world is she? https://t.co/owwidhKu9v","@samcmac","cultural-icon",
"Carmen Sandiego doesn't need a man she travels the world alone","@Sir_Rosebullet","role-model","x"
"@Glee_Astrology **signs as glee cast halloween costumes** GEMINI || Naya Rivera || Carmen Sandiego https://t.co/CAS3FyRB8H","@Glee_Astrology","fashion",
"Lady just sashayed across the elementary school parking lot in a bright red Carmen Sandiego trench coat. OKAY, MA'AM. #wheretheysellthose?","@HolleyTrent","fashion",
"@jaiannegilkey that feel when you walk into Mr. Norton’s classroom and saw that the lights were off and the screen was pulled down you knew you were either playing carmen sandiego or watching liberty’s kids that day and either way it was going to be lit af","@aly_nort","cultural-icon",
"I learned so much about history and geography from playing Where in The World is Carmen Sandiego? It would be awesome to have this games and others that engage and help students learn in a fun and interactive way! #NTsschat","@jjacksongr8","edutainment","x"
"How Carmen Sandiego accidentally became an educational game icon https://t.co/BdPCQlI4BN","@gamasessential","edutainment",
"@tomblappy Mrs. Biggerstaff & my 2nd grade teacher Ms. Bjork had Where in the World is Carmen Sandiego board games in their classrooms.","@JeremiahLiles1","cultural-icon",
"Gina Rodriguez donning red fedora and trench coat of Carmen Sandiego https://t.co/M7GPjN00St #Tech #Innovation https://t.co/ZmoczpPPyk","@smart_home_news","cultural-icon",
"Soccer obviously isn't for everyone, but as a 90s kid who had Carmen Sandiego on every weekday afternoon, I do think there are fun aspects of the tournament unrelated to the games. It's an opportunity to learn about different countries and, jokes aside, about the host country.","@doctorofdunk","edutainment",
"How Carmen Sandiego accidentally became an educational game icon - %https://t.co/WPzYxNDV8C%","@MarioManiac6","role-model",
"Am I Carmen Sandiego now? Because I'm fine with that. I want to travel. And learn how to hack.","@dancingofpens","travel","x"
"VIDEO: 10 Reasons Where in the World Is Carmen Sandiego? Was the Best Educational TV Show Ever https://t.co/hewbTDqwK6","@JeannaTukerno","edutainment",
"@JussieSmollett helping my friend push his car out the road. The gains the gains. Where ru going Carmen Sandiego :)","@followtheleo","travel",
"Look, most of Leviticus is fun, flexible stealth with delightful heist panache and Carmen Sandiego's hat.","@sushi_cronut","fashion",
"@johnqgoh love that game! I learned so much from playing those Carmen Sandiego games","@MissCaseyCes","edutainment","w"
"Dust Bunny, Ghostbuster, Red Riding Hood, Zombie Scooby Doo, Carmen Sandiego rock Halloween! @WorkingatDuke http://t.co/jnPvh4wOTT","@DukeUCAE","fashion",
"Happy Halloween! 🎃 Was definitely channeling Inspector Gadget and Carmen Sandiego vibes as I strolled the streets of Brugge in this outfit recently. 🌎 It’s the closest I’ll get to a… https://t.co/gaX0AfWUWf","@ElleLaMarca","fashion",
"Iconic! Netflix Is Bringing Back OG Scammer Carmen Sandiego & Everyone Is GEEKED https://t.co/7NpXnKNubM","@kaceytwerk","cultural-icon",
"New Carmen Sandiego and The Magic Schoolbus?! It's like @netflix looked into my brain & said, ""Why yes, you can relive your childhood."" 😍😍😍","@wingedreviews","cultural-icon","x"
"[Heavy Breathing Intensifies] I *LIVE* for these costumes: #Steampunk #Waldo and #CarmenSandiego #cosplay*faints* http://t.co/gHKa0hWOcC","@ShatteredStitch","cultural-icon","x"
"@RiotRogers I just realized, with the hat (and a little color change) you’re like modern day Carmen Sandiego…..","@JasonMB","fashion","x"
"#latergram Waldo and Carmen Sandiego later created Pharell. Happy birthday jshrimp3! #halloween https://t.co/58uyQhxRIN","@bakerhi","cultural-icon",
"@GWeberGale You're like Carmen Sandiego on this trip - ""Where in the world is GWG?""","@entropygoddess","travel",
"Where in the world is Carmen Sandiego? 💃🌎 #xoxo #fashion http://t.co/mIR8HeJ9sL via @snapwidget","@JoannyIzadora1","cultural-icon",
"Carmen Sandiego caught at last: Carmen Sandiego's globe-trotting crime spree has finally com... https://t.co/HgVrZIZUvc Via: Destructoid","@GaboArellano4","cultural-icon",
"So far the sexy Carmen San Diego outfit has been my fave #VSFashionShow","@SamiMelaragno","fashion",
"#CarmenSanDiego would never b able to #escape u by #airplane #NowADays. She wouldn't make it through #TSA b4 u #caught her. #TrueStory","@Gregster357","travel",
"I love that #AgentCarter's final costume is like Carmen Sandiego! Cute! #AvengersAcademy https://t.co/ZBdTnJk78M","@ThatArchivist","fashion",
"Thinking about hitting up a couple of Goodwill's for Carmen Sandiego cosplay pieces.","@NCogsmith","fashion",
"Carmen San Diego trench coat? Yes!! #VSFashionShow","@suderjh","fashion","x"
"@BryanInSpace where are you?! Your pictures make you look like you travel like Carmen San Diego","@taraperry","travel","x"
"It’s called Doc ??! After study of everything necessary to make magically I learned on my own to create visually j love you Jessica Chun Li !!! I now know where Carmen San Diego is !!! Hey I’m in the red corner... https://t.co/2u4ETFvuVI","@DJ_Influence1","cultural-icon",
"@MKtheWorst I hope you twirled your Carmen Sandiego hat as a reciprocating gesture","@bcbwilla","fashion",
"If I put on a fedora now I’d probably summon a doowop band to sing WHERE IN THE WORLD IS CARMEN SANDIEGO","@mirell","fashion",
"Iconic! Netflix Is Bringing Back OG Scammer Carmen Sandiego & Everyone... https://t.co/VhOmkxuIOd","@hypeunderground","cultural-icon",
"In elementary school, I was more of a Kid Pix over everything kind of child. BECAUSE I'M CREATIVE & HATE GUESSING WHERE CARMEN SANDIEGO IS.","@meganphosho","edutainment",
"Gina Rodriguez Is Going To Be Carmen Sandiego In A Live-Action Film And I;m Breaking Out My Red Fedora To Celebrate https://t.co/E5IZWYZhre https://t.co/3BHH5DZKGF","@StrongMamaSleep","cultural-icon",
"@emilycarmichael Aaah, Paper Boy, Number Munchers, Carmen Sandiego, Oregon Trail...Brings back memories of skipping PE in elementary school.","@likalaruku","cultural-icon",
"Netflix is betting on ‘90s kids nostalgia for learning with upcoming lineup https://t.co/UcDsTRSqZP https://t.co/0nOYsk3D9N","@gucci_dolphin1","edutainment",
"Carmen Sandiego doesn't always wear red 🌹 #brixton https://t.co/V20hsUhbV1","@HannahGottesman","fashion",
