"text","handle","category","star_tweet"
"Fav cosplay couple: Waldo and Carmen Sandiego. #SDCC2017 #SDCC #WheresWaldo #WhereintheworldisCarmenSandiego","@elenalovesgames","cultural-icon",
"@astepanovich He actually picked up the entire Utah Data Center and ran away with it Carmen Sandiego style","@JakeLaperruque","cultural-icon",
"I just loved this show #CarmenSandiego #Cosplay https://t.co/QcEqrI78YP","@panchtatvam","fashion",
"Carmen Sandiego Series in the Works at Netflix https://t.co/WKwjtgYpbI #Gaming #News #pgnhq","@PGNewsHQ","cultural-icon",
"Carmen Sandiego Live-Action Netflix Movie Nabs Game Night Writer https://t.co/JHpcIxQSPn https://t.co/ws8Cx7FeXE","@togeekornot","cultural-icon",
"@noxmoony @Sketch_Dailies hehe, thanks a bunch! And I hope most people noticed the hidden 'Carmen Sandiego's hat' there. ;)","@wizmaya","fashion",
"I'm Carmen Sandiego... Where in the world am I ?✈️✈️✈️","@shelbymcourtney","travel",
"Spent lunch hour playing ""Where in the World is Carmen Sandiego"" with my sleuthful coworkers on #InternationalWomensDay","@richardsonstep","cultural-icon",
"Hustle like Charlie from Vallejo my partners from the Bay know might see me anywhere like Carmen SanDiego","@ihaterooster","cultural-icon",
"Netflix finds 'Carmen Sandiego' for its latest reboot https://t.co/xdekAzzRwC #Tech #Technology https://t.co/kWJlHTFEmF","@CEOatdesibazar","cultural-icon",
"***New Trend Alert*** 1. CSUN 2. #heat 3. carmen sandiego 4. Russell Wilson 5. Maria Butina 6. Harold Baines 7. Sonic 8. Chris Brown 9. Planned Parenthood 10. Amari Cooper 11. Brexit 12. Godzilla 13. Rams 14. #GaviMTR 15. #MyMentalStateIn5Words","@TrendWikiUSA","cultural-icon",
"Gina Rodriguez donning red fedora and trench coat of Carmen Sandiego https://t.co/VG4MjRcmyN","@krunox123","cultural-icon",
"Where (in the world) is Carmen Sandiego?","@abbyhaines54","cultural-icon",
"After many years of searching, I’m happy to report that I found Carmen Sandiego at the airport. #Empower18 https://t.co/ZsNsldytB6","@sjunkins","cultural-icon",
"I Still don't trust ladies in red Fedoras and trench coats thanx #Carmen #Sandiego","@gogorichie","fashion",
"cows went missing and everyone is up to arms at the indians, smh. #ByeFelicia #carmenSandiego #thatprairielyfe TAB","@PerHansa3","cultural-icon",
"if i dont get to start traveling soon idk what imma doooo i wanna be carmen sandiego","@mynameischapman","travel","w"
"Loved game as a kid & I will play again. #CarmenSandiego is Up To Her Old V.I.L.E. Tricks https://t.co/BIAeZ1v0Ue https://t.co/nGfStRGH5D","@watcher_969","cultural-icon",
"Netflix’s Carmen Sandiego https://t.co/b3EtLq4Ihv","@KeithDusheke","cultural-icon",
"@missbrianna24 Or you want to cosplay n be carmen sandiego bri hun lmaol 😉😁","@myterrybear","fashion",
"Carmen Sandiego is the OG badgirl. #cosplay #cosplayergirl #cosplayphoto #patreonmodel https://t.co/oKX4hIjRbU","@InsidiousSin","fashion",
"Netflix's 'Carmen Sandiego' debuts on January 19th, 2019 https://t.co/3uz4xX1YC2","@AdiccionMM","cultural-icon",
"Per @laureningram's instructions: Happy Birthday @derridalicious! (As I tweeted this, I just noticed that you look like Carmen Sandiego (if she was wearing glasses) in your current profile picture.)","@Gavin_J_Porter","fashion",
"@_JFURY @KRaeLittle Hmmm.... it seemed to fit...? I suppose dateline was ""Where in the world is CARMEN SANDIEGO?!"" #NailOnTheHead","@IronCamTheMan","cultural-icon",
"@pvponline Actually, Carmen Sandiego's all the rage these days. Geography is the new Black.","@thesporq","cultural-icon",
"Perfect couple's Halloween costumes-Waldo and Carmen sandiego","@gottacatjamaal","fashion","x"
"@goonerkate actually I guess it would be okay if it were a ""global adventure"" in the sense that Spider-Man is chasing Mysterio around the world like he's Carmen Sandiego","@braak","travel",
"well look who's gonna voiced carmen sandiego on a netflix series https://t.co/Sn2D61c7Xz","@OsvaldoVelazque","cultural-icon",
"Lady Gaga Swiped Her Hat And Trench From Carmen Sandiego's Closet - https://t.co/IEeDx8dr6O https://t.co/PJXsssNNJQ #LadyGaga","@LadyGagaPict","fashion",
"@revolttv Shoutout to Joe for rocking the Carmen Sandiego hat 😂 https://t.co/VYONTubSGI","@mighttalksports","fashion",
"@MissFushiGaming So that's where Carmen Sandiego is.","@TheMadSmith","cultural-icon",
"Netflix could be bringing Carmen Sandiego back https://t.co/8DuUhTXM89 https://t.co/hlbUAZ1Gw0","@KarthiSRV","cultural-icon",
"Think Ima wear my Carmen San Diego hat today :)","@MsKim614","fashion",
"Netflix is bringing back Where in the World is Carmen Sandiego? I'm stoked.","@Shane184","cultural-icon",
"Trying to be Carmen San Diego for Halloween so when I disappear after three shots my friends will thinks it's part of the plan.","@LaurenLeckliter","fashion",
"""excuse me Carmen Sandiego"" LOL #OrangeIsTheNewBlack #Netflix #addicted","@m3_creative","cultural-icon",
"I do like this girls Carmen Sandiego outfit tho. #TheNotebook","@That1Polly","fashion",
"@kchironis carmen sandiego! my hero to this day and a very early gender rolemodel for me, as well as an enormous formative influence in general.","@SophieAyase","role-model","w"
"Why do I remember Carmen Sandiego with dark hair? If she’s a red head how have I not been her for Halloween yet? https://t.co/RgDM1o2sVG","@katieferg","cultural-icon",
"Thirtieth anniversary of Carmen Sandiego marked with new iOS app: Global learning company Houghton Mifflin Har... https://t.co/tK1bCBolbD","@Iaheadlines","cultural-icon",
"My Kentucky Derby/Carmen Sandiego hat has arrived. https://t.co/pyF7UxyJLU","@Fibby1123","fashion",
"Where in the world is Carmen San Diego....well this guy....✈️✈️✈️🚢🚢🚢 #travel #vacations #family https://t.co/4rwJ2mA8Rr","@grumpyvic","travel",
"Trying to be a hat person, but I think you have to be Carmen Sandiego or… https://t.co/iM4qBLHmJH","@eyeheartit","fashion",
"Netflix Developing Live-Action 'Carmen Sandiego' Movie Starring Gina Rodriguez : https://t.co/CY6GY2nPnr | #JhootayViewsWithMalick #AskChNisar","@hassaiothmane","cultural-icon",
"Okay so @SariCarpenter posted a picture of Carmen San Diego and @peytonpclark posted a picture of Where's Waldo.....Halloween costumes????","@leifer_lizzie","cultural-icon",
"Already have my next Halloween costume planned out. Carmen Sandiego. My date&39;ll go as Where&39;s Wally. Always wanted to do that","@82wvryandavid","fashion",
"The #Olympics have made me realize I need to relearn World Geography. Is #CarmenSandiego still around to teach me?","@irishfreckles17","edutainment","x"
"carmen sandiego is such a style icon","@cyborgkirstie","fashion",
"Why they got Liv dressed up like Carmen San Diego? #Scandal","@TypicalAssGucci","fashion",
"@MollyJongFast Where in the world is Carmen SanDiego and can she post my bail?","@BrandonHasWords","cultural-icon",
"VIDEO: 10 Reasons Where in the World Is Carmen Sandiego? Was the Best Educational TV Show Ever https://t.co/g37uG8gJ5B","@FujikageYori","edutainment",
"FBI AGENT: A known rogue actor, Carmen Sandiego, has reportedly smuggled enough uranium out of Tehran to develop a suitcase nuke. ACME AGENCY CHIEF: Holy mushroom cloud! I'll assemble my team of geography-loving teenage gumshoes at once! FBI AGENT: (sigh) I thought you might.","@matttomic","cultural-icon",
"I currently feel like Carmen Sandiego. Where am I? Think little sausages.","@YourUncleEddy","cultural-icon",
"Gina Rodriguez Is Going To Be Carmen Sandiego In A Live-Action Film And I'm Breaking Out My Red Fedora To Celebrate https://t.co/alaZRBFbxt https://t.co/WtYcgDlaXY","@amandasome","cultural-icon",
"A4 Integrated with Where in the World is Carmen San Diego where we had to connect with someone from the country we travelled in #aussieED","@reditech","travel",
"Get my education back — watching Where in the World Is Carmen Sandiego? (game show)","@homie_big","edutainment",
"@shadesfox I actually went as Carmen Sandiego a few years ago since I have the red coat. I turned a $3 red witch hat into a red fedora!","@Sererena","fashion",
"Carmen Sandiego, Star Wars, Batman, Shakespeare, King Arthur, Edgar Allan Poe, Science, Physics, Math, Pop Culture, History...etc #Nerdcore","@DevDowns","cultural-icon",
"I'm like Carmen San Diego.... But blonde. #Whereswaldo #jetsetter #weekendgetaway with the babe… https://t.co/yXSvruF2Bp","@TaraLeeEddings","travel",
"@MS_LOYAL_ONE travel the world like Carmen Sandiego o yea I'm with it lmfaoooo!!!","@watsfamouswitu","travel",
"Not Your Shero: Carmen Sandiego and the importance of feminism in edutainment #shero #mediastudies https://t.co/cCvD32VKqY","@PaulDarvasi","role-model",
"Netflix is bringing back ""Where in the World is Carmen Sandiego"", with ""Jane the Virgin"" star GINA RODRIGUEZ https://t.co/8GgRJqYnUy","@sky1065","cultural-icon",
"@JPdaGawdIz @Predator82_ This is what happens when you’re globe trotting Carmen San Diego. But yes we’re engaged! 💍Video coming soon!!","@avail4greatness","travel",
"Netflix is Bringing Back Carmen Sandiego - With Gina Rodriguez! (Report) https://t.co/QQ6kJIhZPW","@MaurizioGlovia","cultural-icon",
"How Carmen Sandiego accidentally became an educational game icon https://t.co/dvYdcrzZBz https://t.co/bHV92ys6dq","@jackmonkeygames","edutainment",
"Here’s to new adventures #SanFrancisco #BigMove #Arrival #Love #Conquer #CarmenSanDiego #CityLights #LetsExplore #AdventureTime #Beats #Shades #Fashion #Fresh #Mens #Style #Beards… https://t.co/KifGK2QOn0","@HoundstoothJavi","fashion",
"When your best friend talks you into wearing a ""Carmen San Diego"" hat and you have to take an awkward… https://t.co/NkYIE1gxOc","@justafitchick","fashion",
"~ Where in the world is... Carmen Sandiego? ~","@TheManaManiac","cultural-icon",
"Look who's back! 💃🏻🌎 #CarmenSandiego watch full series on #cEyes_platform #cEyesweekend #series #Animation #Adventure #StonedComicBooks https://t.co/D4hXU3KwyJ","@ceyesplatform","cultural-icon",
"@0x3w1ng Look, Carmen Sandiego, you do insist on wearing the hat all the time","@Talen_Lee","fashion",
"#GrowingUpIWanted to be a stylish as Carmen Sandiego https://t.co/CQQdOCvhNN","@mina_masters","fashion","x"
"Where in the world is Carmen Sandiego? Apparently she's at the Latchstring. #DialBackThePerfumeCarmen http://t.co/3ffUKdKS3D","@JenniferPurdue","cultural-icon",
"VIDEO: 10 Reasons Where in the World Is Carmen Sandiego? Was the Best Educational Show Ever https://t.co/rhFwthKvyh https://t.co/ZZjd7F4pW6","@stylishgirls7","edutainment",
"""this ain't it, chief"" -carmen sandiego","@wackhumanbeing","cultural-icon",
"You guys, I found them. #Waldo #CarmenSanDiego #WheresWaldo #WhereInTheWorldIsCarmenSanDiego #Cosplay… https://t.co/gCxUQrYRCR","@hezavalentine","fashion",
"YES⚡️ “Netflix greenlights a Carmen Sandiego series” https://t.co/RhXjRqT879","@21haleymiller","cultural-icon",
"@danawhite @JonnyBones @AlexTheMauler legit ONLY going to #ufc232 to see champ @criscyborg vs @Amanda_Leoa however since its my bday party im def not mad about seeing @JonnyBones vs @AlexTheMauler also & @CatZingano vs carmen san diego aka waldo anderson 🎉🎉🎉lets go #ufc232 best bday party ever!!! #CyborgNation","@kdmercy1","cultural-icon",
"Gina Rodriguez Voicing Carmen Sandiego in Netflix Show https://t.co/bN5D2E2FuR https://t.co/myneG6aZt7","@eStream_Studios","cultural-icon",
"A unique crossover costume idea for couples: dress up as Carmen San Diego & Waldo! Full guides here: http://t.co/NAWZs3uyAe","@costumeplaybook","cultural-icon",
"Gina Rodriguez to star as Carmen Sandiego in Netflix’s live-action feature film https://t.co/os7MXRttEA","@NewJacksnyc","cultural-icon",
"Had a dream that @cinephileo had concocted an elaborate scavenger hunt involving Carmen Sandiego-esque world traveling. At least I think it was a dream.","@Cobes","travel",
"Omfg guys Netflix is remaking Carmen Sandiego","@Dannnniiixx","cultural-icon",
"Already have my next Halloween costume planned out. Carmen Sandiego. My date&39;ll go as Where&39;s Wally. Always wanted to do that","@josephfnhensley","fashion",
"Carmen Sandiego stole the TARDIS! #CVG2017 #cosplay https://t.co/fTt6pcgtUl","@DopeQueensBH","fashion",
"People on Twitter are comparing the style choice to looks worn by pop icon Michael Jackson and fictional characters Carmen Sandiego and Indiana Jones: https://t.co/38hkDXxgBP","@usatodaylife","cultural-icon",
"In the promo for #AgentCarter last night, I thought that in that red hat she looked like Carmen Sandiego - as in Where in the world is....","@The1Russter","fashion",
"I have been listening to the theme song from ""where in the world is Carmen San diego"" on repeat in my car for days now","@JohntheMiller","cultural-icon","w"
"@tomblappy after the Magic School Bus episode came an Up Next: Bill Nye, a Carmen Sandiego promo & part of the opening of Kidsongs Season 2.","@JeremiahLiles1","cultural-icon",
"Flashback Friday to matty_harris44 and I's costumes last year. Carmen San Diego and Agent Lee Jordan.… http://t.co/72Y51qXECj","@RachoUNO","cultural-icon",
"@animejunki71 @olga_breido Carmen Sandiego! : D Can't wait. Thank you, my lovely.","@LiesbethLap","cultural-icon",
"Where on earth is Carmen SanDiego?","@AndreJacobie_","cultural-icon",
"The airport loudspeaker just paged for a person named Carmen Sandiego. I dunno how to break it to you; you're not gonna find her.","@UnseenMessiah","cultural-icon","w"
"WOOT!! // It's Official: Carmen Sandiego Is Getting Her Own Animated Netflix Series https://t.co/XdgcsVbJYd via @io9","@sadbhyl","cultural-icon",
"Ready for a Where in the World is Carmen Sandiego Mini Series if I’m being completely honest to be quite honest honestly if I’m being honest @TheCW @netflix","@marymurphay","cultural-icon",
"OMG...It's Official: #CarmenSandiego Is Getting Her Own Animated Netflix Series. Yassssss https://t.co/HWaZ5Aj8vY #ttot https://t.co/EYGZeEg8wY","@TravelLushes","cultural-icon",
"@MorellaAddams Where on Earth Is Carmen Sandiego?!?","@Pete_Correia","cultural-icon",
"Netflix Is Making A Carmen Sandiego Movie https://t.co/rj82FZGeJi","@XSpBlog","cultural-icon",
"Where In the World Is Carmen Sandiego? On A Netflix Animated Series, Voiced By Jane The Virgin Star Gina Rodriguez https://t.co/klU57K1rZo https://t.co/3VScW8jED0","@cartooning_rr","cultural-icon",
"Air Force has a reconnaissance drone that can maintain flight for TWO DAYS, but we still can't find where in the world is Carmen SanDiego.","@the_bear0274","cultural-icon",
"Where in the world is Carmen Sandiego? With the Wolf of Wall Street, of course! 😉😊❤️ #halloween http://t.co/vNTs1Y7IVG","@_MelissaMeyer","fashion",
"2000+ miles away from each other: Carmen San Diego and Where's Waldo. Trying to find each other on Halloween.","@ConsentHousecat","fashion",
"It's Official: Carmen Sandiego Is Getting Her Own Animated Netflix Series https://t.co/EYiaesoXSf via @io9","@ironcoder88","cultural-icon",
"Netflix’s Carmen Sandiego Movie Sets ‘Game Night’ Scribe Mark Perez As Writer https://t.co/lRNbmGoOqF","@_hollywoodpoint","cultural-icon",
"""@ladyroyalkawaii: @paridisedeliah DO YOU HAVE A PHONE YET WTF HI HELLO"" I'm the modern day Carmen Sandiego","@paridisedeliah","cultural-icon",
"Carmen Sandiego Revival Headed to Netflix - CBR https://t.co/KAq4AUBJfm","@dino_man","cultural-icon",
"I think I just spotted the greatest couples costume in history at Tomorrowland. One person was Waldo and the other was Carmen Sandiego. That is incredible and more people should do it.","@michaeljande19","cultural-icon","x"
"Not Your Shero: Carmen Sandiego and the importance of feminism in edutainment https://t.co/LSgwfKjkS1 #carmensandiego","@TVHistoryFest","edutainment",
"Gina Rodriguez to voice Carmen Sandiego in Netflix animated series: https://t.co/U3xMzE06Oj https://t.co/jJYRcewzIn","@Slate","cultural-icon",
"@Valerie_Perez @netflix Carmen San Diego! And you nailed it!!!","@RAlester76","cultural-icon",
"Netflix, TE AMO https://t.co/Ohsz9rglli","@Roberto_Pastor","cultural-icon",
"carmen sandiego is my ideal halloween costume: it combines my love of the colour red with my love of rarely being seen in public.","@cashaleer","fashion","x"
"Rasheeda done wore this Carmen San Diego hat EVERY episode this season! #LHHATL","@Sir_Deveraux","fashion",
"If I got this coat in red, I'd be cosplaying Carmen San Diego.","@IOV4E","fashion",
"@nomadj1s Best Halloween costume my husband and I ever did was Carmen Sandiego & Where’s Waldo. UNTRACEABLE.","@hannahkardon","cultural-icon",
"@LaurMoor you look like carmen sandiego except if she wore a white hat","@darklink97","fashion",
"@elizaskinner If you’re working on a Carmen Sandiego costume then yeah, hella.","@LeilLikeNeil","fashion",
". @netflix has reportedly ordered 20 episodes of a ""Where in The World Is Carmen Sandiego"" reboot: https://t.co/dimfn2OwpK https://t.co/oWhowHeKaY","@997ThePoint","cultural-icon",
"There's some good stuff left to explore with Carmen Sandiego in terms of the mythology...like; who IS she? One of the compelling things about the character is that she's a mystery...a cat burglar who steals historical and cultural monuments. What motivates someone like that?","@DTHalliday","cultural-icon",
"A4. I don't know about you all, but Carmen Sandiego was my role model growing up! #WeGoSolo","@GoGirlGuides","role-model","x"
"Sometimes I moonlight as Carmen Sandiego... You can find me in Philly today #Philadelphia #globetrotter http://t.co/ECw0sdAMSg","@LtLinscott","travel",
"Carmen Sandiego, guacamole, and car door selfies. First three that came to mind https://t.co/p2G2U5lIlX","@AmyTheFrone","travel",
"@Fletcher_Powell It's cool, but it would be like finding out Carmen Sandiego was not an actual globe-trotting criminal mastermind and instead the creation of a Southern CA game designer who REALLY liked (national treasure) Eric Carmen. That would absolutely end me.","@SatanHangTen","fashion",
"Carmen Sandiego' Animated Series Is Coming to Netflix — With Gina Rodriguez Voicing the… https://t.co/JPQG3gfC5I https://t.co/R8OEMSUhQ0","@sarah23re","cultural-icon",
"Netflix could be bringing Carmen Sandiego back https://t.co/Nz4MxhQqak https://t.co/gzbq6eQX4w","@scitecho","cultural-icon",
"Does anyone else think Gina Torres looks a little like Carmen Sandiego in that hat? Could she play @HereIsGina's mom in the reboot? #RoyalWedding","@soimwatching","fashion",
"*Prince bursts in wearing Carmen San Diego gear ""It's hard to solve a case without...Finger Prince"" ""Do you mean finger prints?"" ""No""","@BobbyBowlinsock","fashion",
"Good morning sunshine! Netflix has TWO Carmen Sandiego projects on the way and What is Kingdom Con? https://t.co/HOA9tNGIIP","@HambySanDiego","cultural-icon",
"Daily Podcast: Captain Marvel, Stranger Things 3, Solo, Star Wars, Carmen Sandiego, Netflix, and Pacific Rim Uprising https://t.co/DHgMidp4UV https://t.co/AYRMW3OO65","@Filmedia","cultural-icon",
"#WhenWeRunOutOfHashtags We will have found Waldo, Carmen SanDiego, who let the dogs out, where the car is, the killer of Inigo Montoya's dad","@RandilynIsIn","cultural-icon",
"Good luck finding us. #BigRedBoos #halloween #carmensandiego #waldo https://t.co/pd0cpaZv1k","@Jennmag07","fashion",
"I love it when ya'll call me Carmen SanDiego. ✈️🚂🚢🚇🚈🚘🚖🚍","@justshekinah","travel","x"
"I found them both here, together @wizardworld Des Moines! #cosplay #comiccon #carmensandiego #waldo https://t.co/okfSkKIbKl","@mattpeppler","fashion",
"I would love being a kid and coming home to Gumball at 3 and Adventure Time at 4. It's no Power Rangers and Carmen Sandiego, but its nice.","@EminemAndMnMs","cultural-icon","x"
"This Popular 1980s Cartoon Is Getting the Netflix Treatment https://t.co/pVDrYBFBMc","@uohanalilly","cultural-icon",
"@ColliderVideo Which Of This 90's Cartoons Would You Greenlight For Live-Action First ??? Where Is Carmen Sandiego ? Gargoyles Swat Kats Captain Planet Street Sharks #ColliderMovieTalk","@MarioPR05","cultural-icon",
"Gina Rodriguez donning red fedora and trench coat of Carmen Sandiego https://t.co/OvgvTWOgFy #Tech #Technology https://t.co/PTiPZWfvrc","@CEOatMobiVerse","cultural-icon",
"Carmen Sandiego was the originator of Future hats & brunch boots","@Scott_CEOofSUH","fashion","x"
"everyone always asks ""where in the world is carmen san diego?"", not ""how in the world does carmen san diego afford to travel so frequently on her three minimum wage jobs while she rents a studio in the bay""","@stewartmatzek","travel",
"@johnqgoh love that game! I learned so much from playing those Carmen Sandiego games","@MissCaseyCes","edutainment","w"
"@bbusterbuster Daran Norris as Mr. Turner in the live action Fairly OddParents movies. Will Arnett as Batman (with a Legofied batsymbol) at the 2015 Oscars. Also, Gina Rodriguez will be playing Carmen Sandiego in a movie and voicing her in an animated series. Both will be released on Netflix https://t.co/RjhBaACpg1","@DigiRanger1994","cultural-icon",
"@MYHira @CarisaMarie11 I thought she was headed east? She travels more than Carmen San Diego.","@Clay_57","travel","w"
"Film>Movies> Attention ‘90s Kids: Netflix Is Bringing Back CARMEN >> https://t.co/BWya7Z0scf #movie https://t.co/CPG1rECcdA","@MoviesMovieMag","cultural-icon",
"Netflix's Carmen Sandiego Reboot Has a New Premiere Date and Some Mysterious Teaser Images https://t.co/tV37x1dWad","@GizmodoUK","cultural-icon",
"Where in the World Is Carmen Sandiego? Becoming a secret travel agent, by Karsten Nohl, Nemanja Nikodijevic #33c3 https://t.co/wzIVopsZse","@ivc","travel",
"Netflix's 'Carmen Sandiego' debuts on January 19th, 2019 https://t.co/MxXAaKmJhY","@Cyberfrancisnet","cultural-icon",
"I hope kids today still get to play Carmen Sandiego's Great Chase Through Time, where I learned everything I've ever needed to know about the world.","@_SurajUttam","edutainment","x"
"So like... Where is Carmen San Diego? #Halloween #IPutASpellOnYou2015 #DeadMansToes #90s https://t.co/Kuzp5NNuNd","@ChristinaJOchoa","cultural-icon",
"First poster and images for Netflix’s Carmen Sandiego https://t.co/AxR4RYLvsX","@terencekoger","cultural-icon",
"@AlexisDelCid Is that hat from the Carmen Sandiego line?","@michaelburgett","fashion",
"@CJPatruno Sharing an airb&b with Waldo and Carmen Sandiego.","@FriedMarian","cultural-icon",
"Why has there not yet been a Fast N Furious-style reboot of Carmen Sandiego?","@ca_london","cultural-icon",
"I feel like carmen sandiego's career was made easier by the fact that the only people who ever went up against her were ten years old and she was an international artifact thief","@spookperson","cultural-icon",
"CARMEN SANDIEGO STA PER TORNARE GRAZIE A NETFLIX https://t.co/zyEsrGbQsi","@Sothe_Mizuno","cultural-icon",
"Sounds Like Netflix Is Bringing Back 'Carmen Sandiego'. Call me a nerd, by I'm like REALLY excited🙌🏾 https://t.co/GrwdKsYsFO","@drsarahspeaks","cultural-icon",
"Netflix's 'Carmen Sandiego' to begin streaming in January https://t.co/kKVcu4zZ2K https://t.co/JzFq9goRgK","@MobileSyrup","cultural-icon",
"@PetrosAndMoney evil 4 letter 2. Found it, Carmen San Diego style","@7BuFFaLo6","fashion",
"In my haste to get all the things to be able to leave, left the gloves and hat. So, I don’t look like Carmen Sandiego tonight. Oh well.","@TheScruffyDruid","fashion",
"#AgentCarter stole Carmen San Diego's hat. Now that is badass. #AgentsofSHIELD","@hoosierjedi","fashion",
"For #CIBsunday I happily present all 4 Carmen Sandiego games for Commodore 64. These boxes are heavy, since the games game big alamanac-style books. #RetroGaming #Commodore64 #carmensandiego https://t.co/2zHAq4zXXz","@zoggins","cultural-icon",
"@Gota_de_L1uvia I'm slick Carmen sandiego honestly lol I live in Ga until tomorrow when I drive up north to relocate","@illbelate2that","travel",
"@bridgetpatricia Only acceptable answers: dream doll designer or where in the world is carmen San Diego","@bridgetpatricia","cultural-icon",
"@HayleyAtwell @paddingtonbear no but you kind of look like Carmen San Diego w your red hat & blue coat","@JasonEBurack","fashion",
"Carmen Sandiego taught yal all the tricks ..","@TheGreatBailey","cultural-icon",
"Obama almost started singing the theme to Where in the World is Carmen Sandiego there.","@EmGusk","cultural-icon",
"(BTw the image I chose is from the new Carmen Sandiego animated remake being made by netflix )","@Viridian_tsw","cultural-icon",
"With @gerkonanaken. Talking about our icons growing up. Mine were Skeletor, Carmen Sandiego and Cyril Sneer. 💁💁💁","@robagain","role-model","x"
"Getting my Carmen San Diego on in Spain. #traveldreams #passportlife #dowhatyoulove #harlemgirloutintheworld https://t.co/J0Z5jizjin","@MsMiddleton818","travel",
"In other news of #Netflix world dominance ‘#CarmenSandiego’ Toon Series Starring Gina Rodriguez Bound the service https://t.co/IdhqKiwWFb","@NotherBrother","cultural-icon",
"they're making a carmen sandiego netflix series and im 👀👀👀💖💖💖","@chiffonades","cultural-icon",
"Where in the world is Carmen San Diego aka @KendallBrooke23","@nmorse23","travel",
"Next Up.... How do I make a decent Carmen Sandiego cosplay because I really feel she's my patron saint for 2017.","@LianaBrooks","fashion",
"@BeachyTwy I know it's 2 early 4 this since it's mid December Twylla but @HereIsGina NEW @netflix show Carmen Sandiego comes out on 1.18.19!","@deano10593","cultural-icon",
"How Carmen Sandiego accidentally became an educational game icon https://t.co/F6ev0EDjjq","@KaseyGamez","role-model",
"New Carmen Sandiego Animated Series Coming to Netflix in 2019! #StreamTeam https://t.co/bBtTHpJN6M via @LongWait4Bella","@valmg","cultural-icon",
"HERE'S THE ""WHERE IN THE WORLD IS CARMEN SANDIEGO"" THEME! IT'S HOW I LEARNED GEOGRAPHY CUZ WE DIDN'T HAVE TEXTBOOKS https://t.co/F4lVyKbhRM","@xGramps701x","edutainment",
