"text","handle","category","star_tweet"
"My humor seems to be falling on deaf ears. The lady in that article has a floppy hat and she's a criminal. She's Carmen San Diego.","@dave_mayhem","fashion",
"Gina Rodriguez to Play Carmen Sandiego in Live-Action Netflix Feature https://t.co/z1ppjMB7bx","@dot_film","cultural-icon",
"@chelsaat legit though i played SO MANY carmen sandiego games as a kid i honestly attribute that to my love of travel and of hijinks.","@chelsaat","travel","x"
"Fun fact about me: for years as a child I wanted a trench coat so that I could be like my hero, Carmen Sandiego.","@jai_dit","role-model","x"
"Netflix's 'Carmen Sandiego' debuts on January 19th, 2019 https://t.co/tNkVtQBVBq","@JustAnimalCare","cultural-icon",
"Why does the new character from @PlayOverwatch Ashe remind me of Carmen San Diego??? 🤷‍♀️ either way, I can't wait to play her😍","@ashelsOU","cultural-icon",
"Live action Carmen Sandiego series via @netflix... AWESOME!!! Now please give me a live action Oregon Trail series where the main chracter dies from stubbing his toe!","@JustADad_3","cultural-icon",
"@CeeNoelle Trench coat and a Fedora Hat like Carmen Sandiego","@JoeArmstrong718","fashion",
"What You Learn Hunting Carmen Sandiego Without Google's Help https://t.co/1YDPqzFJLE | https://t.co/a9BfmuOjfu https://t.co/z8izqadzUv","@IsweatGlitter1","edutainment",
"@vesselskirt CALL BRØDERBUND, TELL EM TO UPDATE MY CARMEN SANDIEGO AND MAVIS BEACON SAVES, ALSO TELL EM THANKS FOR THE STRONG FEMALE ROLE MODELS","@vesselskirt","role-model",
"Trish is looking like Carmen San Diego in that red coat. #LethalWeapon","@cbarajas82","fashion",
"#InstaMagAndroid where in the world is Carmen SanDiego lol! #bluesign #worldtravelers #jetsetter… https://t.co/HhduBi8W7i","@maddvocals","travel",
"@iheartheels Slouchy sweater and big hat - Carmen Sandiego-style! RT@iheartheels How do you like to wear your black maxi skirt? #stylechat","@Imaggle","fashion",
"@_LeMoog_ It's Official: Carmen Sandiego Is Getting Her Own Animated Netflix Series | Kotaku Australia (via @KotakuAU) https://t.co/tGM4duQ4dZ","@_LeMoog_","cultural-icon",
"Where in the World Is Carmen Sandiego? Becoming a Secret Travel Agent [video] https://t.co/frqPYTSqU5","@ryf_feed","travel",
"Ooh @HereIsGina is going to be the voice of Carmen Sandiego on the new @netflix version. This matters. 😻","@longhair3x","cultural-icon",
"Netflix is betting on ‘90s kids nostalgia for learning with upcoming lineup https://t.co/rmC0jLMQbb https://t.co/vrEraS6duW","@MoneyMatchGame","cultural-icon",
"♪Where in the World Is Carmen Sandiego〜","@kaikoga","cultural-icon",
"@amae: Whenever I'm wearing a hat and use my passport as I.D., allasudden it's a lot of Carmen Sandiego comments up in here.","@amae","fashion",
"The First Images of Netflix's Carmen Sandiego Are Here Carmen Sandiego has been found, and she's looking good on Netflix. Gina Rodriguez will make her debut as the new voice of the iconic globe-trotting thief in the new 20-episode... https://t.co/RuJl9gOnJh","@RyanMedina462","cultural-icon",
"Netflix may have found their 'Carmen Sandiego' and she comes with Golden Globe credentials https://t.co/kQMfvurCaB via @UPROXX","@bdouglas14","cultural-icon",
"Carmen Sandiego Is Officially Happening With Gina Rodriguez at Netflix https://t.co/e6v3MAyOe9","@AMNAYzh","cultural-icon",
"Carmen Sandiego? Oh false alarm she is not wearing a red outfit https://t.co/x0VEP7aTqW","@josefcd904","fashion",
"Where In The World Is Carmen San Diego? #JohnOliver #LWT #Geography http://t.co/EFeUWfvHOk","@quewp1","cultural-icon",
"me when i'd get a new carmen sandiego game from that little flimsy paper magazine at the book fair delivered to my classroom 4 weeks later https://t.co/QCxxJ3mskC","@_Brodes","cultural-icon",
"Netflix orders animated Carmen Sandiego series https://t.co/fcOFIUJ9hl","@davi4antonio","cultural-icon",
"My two favorite Halloween costumes from last year....Carmen Sandiego and Cruella DeVille 🙌🙌🙌 http://t.co/YUsP2cjnNh","@_Uwyy","fashion",
"we take Halloween at WC very seriously. #carmensandiego #whereintheworldiscarmensandiego #prince… https://t.co/BS9UYWmDEx","@musicboxsong","fashion",
"We can't WAIT to see @HereIsGina as #CarmenSandiego in @netflix's live-action adaptation! https://t.co/dloyjW0Jl3","@TooFab","cultural-icon",
"I remember this game was the shit in elementary school!! #CarmenSandiego where in the world is Carmen Sandiego lol #1999games #oldschool https://t.co/bsmqEz68TZ","@RemZisWorld","cultural-icon",
"@Keshj__ Where in Carmen San Diego can I find such beautiful women","@RICHARD2K19","cultural-icon",
"It's back! Where in the world is Carmen Sandiego? Netflix. https://t.co/udfh6kRksx https://t.co/i79YYEPUjf","@TweetsByVivek","cultural-icon",
"I'm watching 2x13 again because I feel like it and I still think Nyssa looks like Carmen Sandiego at the beginning with the hat #Arrow","@RachelEiley","fashion",
"How carmen sandiego accidentally became an educational game icon https://t.co/WNdV2CAFfx","@DegammageUK","edutainment",
"As soon as I get a red hat my life goal of becoming Carmen sandiego will be real","@strawz","fashion","x"
"Watched Carmen Sandiego turn not Latina at all over time. #EurocentricCallOuts https://t.co/33WMgH4hiH","@phoneticletter","role-model",
"Found Carmen Sandiego. She's in Montreal if anyones still looking for her. http://t.co/x10FhK6Li8","@foff_d","fashion",
"I kinda want Hope to go dressed as Carmen Sandiego for Halloween now... #Days","@semigemi","fashion",
"Gina Rodriguez To Voice ‘Carmen Sandiego’ Netflix Revival - Where in the World is Carmen Sandiego? Netflix, app... https://t.co/cxm8hbTrdw","@CONSCIOUSBEATS7","cultural-icon",
"@ClarkServiceGrp Is that Carmen Sandiego? Great costumes!👍","@Fresh_Creative","fashion",
"I can confirm that @jawjagrrl is all over the map. She covers more of the globe than Carmen Sandiego. https://t.co/jxYuL0V4IO","@ISmokeEmWet","travel",
"Where in the world is Carmen Sandiego?","@ReginaVolk","cultural-icon",
"If You Know Where Gina Rodriguez Is, Then You Know Where in the World Carmen Sandiego Is https://t.co/9QwbwBTI4n https://t.co/euH9D16maO","@News_Cult","cultural-icon",
"‘Carmen Sandiego’ Animated Series Greenlit at #Netflix, Gina Rodriguez to Star https://t.co/ZUHR0KWPfq","@NotifyrInc","cultural-icon",
"@theluciebee I was really hoping this pic would be a Carmen Sandiego cosplay","@timbyrnes89","fashion",
"It's a Wicked, Maleficent & Carmen San Diego kinda #Halloween. #teambeautiful #thebeautifuls… http://t.co/zoYJqnGOR3","@RhapsoDani","fashion",
"@MadamSecretary ok Bebe Neuwirth looked like Carmen San Diego in that trench coat and hat get up. Geez","@VHelmintoller","fashion",
"I guess a new animated Carmen Sandiego series is OK, but what Netflix really needs to bring back is the game show: https://t.co/2tPTVi1fWj https://t.co/M0pRKhGWqo","@dhmontgomery","cultural-icon",
"I ❤ed Carmen Sandiego as a kid. This would be so fun in the classroom https://t.co/09lDZFhTuG","@wileyteaching","cultural-icon",
"#JaneTheVirgin star @HereIsGina Rodriguez to voice Carmen Sandiego in new animated series for Netflix (Exclusive) https://t.co/GVoWTQFNkq https://t.co/CoB87nNjBl","@MyTrackingBoard","cultural-icon",
"Next game is Where in the World is Carmen Sandiego? By the Software company Broderbund. Which use to be huge my I think is out of business","@LegendaryRPGQue","cultural-icon",
"@Logantj @KFloyd34 @BryanDaines @important_pod Same here. My childhood was a steady diet of Oregon Trail II, Yukon Trail, Jumpstart 3rd Grade, Hardball 5, Carmen Sandiego, and Jazz Jackrabbit, with some Magic School Bus and NFL Math thrown in.","@JN_Floyd","cultural-icon",
"Does anyone have Carmen Sandiego's address? So far nobody in the world knows where she is. I wanted to send her a Christmas Card!","@BocaScottVip","cultural-icon",
"@Bullet_Wave @draxterx7 Sunset Shimmer's outfit makes me think of Carmen Sandiego for some reason","@MLP_Joey_","fashion",
"VIDEO: 10 Reasons Where in the World Is Carmen Sandiego? Was the Best Educational TV Show … https://t.co/HDJuPByshF https://t.co/T0yWSmfBS6","@Vishal_Sah7","edutainment",
"New on NETFLIX! 'Jane the Virgin' star Gina Rodriguez salsas into 'Carmen Sandiego' https://t.co/M11PtgOgcg via @WildBillWGNO","@ami_tvdfan","cultural-icon",
"What is the minimum number of countries you visit chasing Carmen Sandiego across the globe? https://t.co/iUuUnSRGcr https://t.co/eLPlx5y4Va","@RewardStock","travel",
"@PBS The Magic School Bus for sure with Arthur, Bill Nye, and Carmen Sandiego as close runner ups #ILovePBS","@ChewyFishy","cultural-icon",
"@EvilyPurple12 If your Carmen San Diego where's your hat & monkey? She does have a monkey right?","@kelliburris7","fashion",
"@GabeNiles I’m about to find you like Carmen San Diego! What part of the map are you.....✈️🛩","@FLYBOYBEEZY","cultural-icon",
"#JaneTheVirgin star @HereIsGina is doubling down on '90s icon #CarmenSandiego by playing her in a live-action film for Netflix, as well as voicing her in an animated series https://t.co/dp652w66Ru https://t.co/RITK9nBvDw","@MyTrackingBoard","cultural-icon",
"Where in the World Is Carmen Sandiego? Becoming a Secret Travel Agent [video] https://t.co/eqU0wxechw Article URL: https://t.co/Ba6mJsrrAO","@M157q_News_RSS","travel",
"@fafafanelll are you still traveling the United States like a middle class Carmen San Diego or have you returned to the normal boring lifestyle of work and home?! Lol","@AntonFanelli","travel",
"Gina Rodriguez donning red fedora and trench coat of Carmen Sandiego https://t.co/1kGTLwCQK7 https://t.co/zQaOj1MwQA","@0_kelvin","fashion",
"SNL' Tries Some Edutainment With 'Where In The World Is Kellyanne Conway?' https://t.co/ByRdfCQJ2M","@DiggVideo","cultural-icon",
"I told my friends I wanna be Carmen sandiego for Halloween, but they don't even know who that is. I clearly was born in the wrong year","@Mel_Osorio","fashion",
"What's new on Netflix in January 2019 https://t.co/WTC4Q2jvo0 @slideme https://t.co/nQC6Vqwur0","@slideme","cultural-icon",
"I feel a little like Carmen SanDiego when I travel in this hat. #travel #whereintheworld http://t.co/iafSWqON5n","@suitcaseofbooks","travel",
"@trimmau same.... same. i played So many edutainment games with my sister when i was little they were my lifeblood. miss carmen sandiego is the perfect embodiment of ""be gay and do crimes"" and even from that alone i love her games, but they really just were That Fun too","@voltorbflip","edutainment",
"Netflix to Reboot 'Carmen Sandiego' #digitalmarketing #news #today https://t.co/zZfvpK3Zmc via @Easy_Branches https://t.co/ymiN8NZDya","@EasyWorldNews","cultural-icon",
"I’ve always wanted to be Carmen San Diego. Maybe I’ll finally work on doing that for next year. I guess I should start planning now. Lol","@Mhaysee","role-model",
"@iSmashFizzle I remain firm in my belief that Carmen Sandiego was trying to bring down the patriarchy by stealing art.","@rachem","cultural-icon",
"Carmen Sandiego DIC original production animation cel n Background 1994-1999 https://t.co/695aQbtt7j","@CharlesSGallery","cultural-icon",
"I just learned that Carmen Sandiego has a cat named Carmine. I never noticed this.","@PushinUpRoses","cultural-icon",
"I love when the casting for something is just so perfect you have to watch. Gina Rodriguez as Carmen Sandiego 🙌 https://t.co/nQEmeIi1SA","@BurtCarolyn","cultural-icon","x"
"New post (Where in the World is Carmen SanDiego #1 Geography Software Explore the World) has been published on News Bits - https://t.co/YZbDiFPk4v https://t.co/YqUA2J8gkd","@newsbits173","cultural-icon",
"Taking on your city like I'm Carmen San Diego","@carmenthecandid","cultural-icon",
"Wait, is the hat because Bradley Whitford is rebooting Carmen Sandiego?! Do it, Rockapella! #Emmys2015","@leffjakin","cultural-icon","x"
"@MissJenniferEss “@MissJenniferEss: @KJSmith567 OMG where are u?!” I'm in LA. Where are u my Carmen San Diego, traveling the world and whatnot?!??","@KJSmith567","travel","w"
"Hey @netflix , skip the animated series and give @HereIsGina a live action #CarmenSandiego series. https://t.co/5UhzBJVuHs","@Batmancanseeyou","cultural-icon",
"Erin Andrews looks like Carmen SanDiego with that Hat/Coat Combo. #GBvsSEA @nfl @nflnetwork","@LiamTweetsHard","fashion",
"Aztecs might be from Carmen San Diego with all this traveling. #kubball","@FakeKUCJay","travel","w"
"@Goodtweet_man Learned this from playing ""Where in Time is Carmen San Diego"" around age 8.","@BamaExpat","edutainment",
"@ahencyclopedia I remember learning from a Carmen Sandiego point-and-click about Lief Eriksson, Vinland, and how the days are name after the gods of Valhalla.","@RoscoeTheHorse","cultural-icon","x"
"@HeatherAntos An epic Carmen Sandiego style heist!","@mattleong13","cultural-icon",
"Where in the World Is Carmen Sandiego? Becoming a Secret Travel Agent https://t.co/jmUT8Voo8k (https://t.co/c99gJE8faN)","@newsyc50","travel",
"@PushinUpRoses I will fight anyone who tries to tell me Carmen Sandiego was not top tier edutainment. Those games were my life. https://t.co/9ULaStw18d","@DMThisIsPam","edutainment",
"@Vic_Turban @cacowgirl8 @CherryLimeade_3 @fakelindz I usually see Waldo on Halloween.Do you know- where in the world is Carmen Sandiego?","@Betty_Begen","fashion",
"Just have one question: where in the world is Carmen Sandiego? #QuestionOfTheDay","@CARLEARA","cultural-icon",
"*sliding into my Carmen Sandiego-esque hat and coat* https://t.co/xlOFw1tnmg","@Kerr_Frost","fashion",
"@SMmakesitLive 1. Play “WHERE IN THE WORLD IS CARMEN SANDIEGO?” bonus round. Would love to see NCT’s knowledge in world geography since they’re about the take over the world! 2. Dance “Boss” switched position version (by lucky draw)","@zeus_mood","cultural-icon",
"@DannaHentze Hi Danna, wherever you are! You're Twitter location says everywhere. Are you with Carmen SanDiego? #geography #marketing","@lutzmbryan","cultural-icon",
"this is the last thing you see before an angel, arthur, and carmen sandiego sacrifice you","@pinnateleif","cultural-icon",
"I've traveled around this country more then Carmen Sandiego raw meat throwin to loins under the Kings table","@AnthonyBarraco","travel",
"#entertainment Carmen Sandiego Is Officially Happening With Gina Rodriguez at Netflix: Get excited, gumshoes! Just… https://t.co/IbrFVsHCve","@GeorgianneStoll","cultural-icon",
"@AllAboutSylvie ty it's my Carmen Sandiego hat :), Shawn will be where's waldo...lol 😂","@RayMarkAble1","fashion",
"@ForbesTech Video games do teach. Learned computers and typing on Oregan Trail. World geography and culture searching for Carmen San Diego","@JLSmith02","edutainment",
"@0x3w1ng Look, Carmen Sandiego, you do insist on wearing the hat all the time","@Talen_Lee","fashion",
"@noxmoony @Sketch_Dailies hehe, thanks a bunch! And I hope most people noticed the hidden 'Carmen Sandiego's hat' there. ;)","@wizmaya","fashion",
"You didn't learn shit about anything unless Carmen Sandiego stole it.","@KojiKatsuya","edutainment","x"
"Netflix is betting on ‘90s kids nostalgia for learning with upcoming lineup https://t.co/tZYcqlbpJf https://t.co/Dk8YiOZFFo","@GamingTday","edutainment",
"Netflix Is Making A Carmen Sandiego Movie https://t.co/OGHuFCPw7U","@BillyFlynn","cultural-icon",
"Gina Rodriguez Voicing Carmen Sandiego in Netflix Show https://t.co/grLpaXNJsA https://t.co/jL5nt23d4n","@B_o_B_Gaming","cultural-icon",
"Why does @RanveerOfficial look like he stole his hat from #CarmenSandiego #umang2015","@chunkypots","fashion",
"“If Agent Carter & Carmen Sandiego ever met up, they could compare notes on their coats. Coat notes!” #QOTD #NoContextForYou","@bibliobutch","fashion",
"@drquuxum .@drquuxum Halloween costume: Carmen Sandiego palette swap","@nex3","fashion",
"Gina Rodriguez to portray 'Carmen Sandiego' in live-action Netflix film https://t.co/w8hclIygaz","@real_reality","cultural-icon",
"Gina Rodriguez will be donning the red fedora and trench coat of Carmen Sandiego for Netflix https://t.co/tteHPgKvMC","@TheMediaDrs","cultural-icon",
"My dream women would be that of an Amelia Earhart- Carmen San Diego mix 🤔🙏🏻","@ljblair12","cultural-icon",
"Netflix's Carmen Sandiego Reboot Gets January Premiere Date — First Look https://t.co/8Y86rgDvtT","@american_mikey","cultural-icon",
"....In my Carmen SanDiego voice: Where in the world, is Russian born Felix Saaaaaaaattter!? https://t.co/TDRejhzlkJ","@iDULezGO","cultural-icon",
"i wish carmen sandiego would visit again. I forgot what the Awesome Coat does","@FangzV","fashion",
"This SNL skit really catches the great quirky memories and style of ""Carmen San Diego"" (big fans at our house): https://t.co/aXuV5TNc82","@gsircus","cultural-icon",
"A red fedora and... Bam!!! I already found Carmen Sandiego... https://t.co/5vsvnaTNdi","@CallofVenom2011","cultural-icon",
"Netflix orders animated Carmen Sandiego series https://t.co/fNOFBZ8zwV https://t.co/1ptpHTYQWK","@carlosgarijo","cultural-icon",
"Omg Hope is dressed like Carmen Sandiego. Give her the hat. Please! https://t.co/qVzPW7dxqB","@trendingtara","fashion",
"@MsUndersin U remember or nah? :'D ""@MsUndersin: Go to sleep Miyagi “@RN_Miyagi: Who remembers that TV show "" Where In The World Is Carmen Sandiego?""”""","@RN_Miyagi","cultural-icon",
"Netflix Reboots 'Carmen Sandiego' With Gina Rodriguez https://t.co/VcYFfSSrUE","@jppaiva","cultural-icon",
"❤️Where in the world❤️ Heading to @armageddonexponz for day twooooo! #carmensandiego #whereintheworldiscarmensandiego #cosplay https://t.co/H5hUX4wuR0 https://t.co/2JOFoX6o8I","@ashlynne_dae","fashion",
"Where in the world is #CarmenSandiego because people are in dire need of learning geography.","@gabbyfer","edutainment",
"@AwestruckVox my fiancé and I are dressing up as Carmen sandiego and Waldo for Halloween","@spygirl297","fashion",
"IGN: #CarmenSandiego is back in an all-new animated series coming from #Netflix! https://t.co/TNWdcBov9d https://t.co/Jq0DG7T6Em","@Jihedovsky","cultural-icon",
"Mistigram: @Dubaiwalla is kind of like Carmen Sandiego in that you never know where in the world he'll be turning up next.  This architectural photograph of his is of the ceiling in an atrium in The Netherlands' foreign ministry, and was included in this… https://t.co/XiZIlmIel5 https://t.co/tQNb8dLKHx","@mistfunk","travel",
"@ehmehlee I really like the idea of Carmen Sandiego, but I'd essentially have to buy a whole outfit, lol. Arthur is cheap, ahaha.","@theheartistcin","fashion",
"#JanetheVirgin's @HereIsGina to Voice Netflix's #CarmenSandiego https://t.co/hPWn0qv1sb via @TVLine https://t.co/8M2tR1aHYz","@MichaelAusiello","cultural-icon",
"Gina Rodriguez Voicing Carmen Sandiego in Netflix Show https://t.co/iejPB09oVs https://t.co/o3p99Mu7nT","@gamznewz","cultural-icon",
"I love living in a world where Kate McKinnon is Miss Frizzle's sister and Gina Rodrgieuz is Carmen Sandiego","@Eva_Friedman","cultural-icon",
"I need a boyfriend solely to be Waldo for halloween next to my Carmen San Diego","@juliabethj","cultural-icon",
"Netflix orders animated Carmen Sandiego series https://t.co/MfQTWA0LPm","@gadgetmanjay","cultural-icon",
"Costume 2 of 3: Carmen San Diego for work lol... this was actually a recycle from a few years ago... I’ve been teaching a poetry workshop on Wednesdays and didn’t wanna do anything super… https://t.co/Hunsn62994","@steph_love500","fashion",
"Bookmarked: Where in the World Is Carmen Sandiego? Becoming a secret travel agent [33c3] - YouTube: https://t.co/xa2v2g2VEl #in","@avzfoughts","travel",
"Can't wait for #Netflix #CarmenSandiego #GinaRodriguez @HereIsGina. So many childhood memories. https://t.co/4Dim2sk7ew","@Xsal94","cultural-icon",
"Scam and travel worldwide like Carmen Sandiego https://t.co/Qy9T7hdUur","@reinabeefola","travel",
"@ErinAndrews looks like 'where in world is Carmen Sandiego' with that hat #NFL #GBvsSEA","@1jrojas1","fashion",
"Carmen Sandiego gets a reboot with Netflix https://t.co/o2J7KoRBaN","@RanLearns","cultural-icon",
"Yes, I will watch the shit out of Gina Rodriguez as Carmen Sandiego, but can we ALSO bring back the game show??? Rockapella is still alive!","@electricjb","cultural-icon",
"⚡ Netflix greenlights a Carmen Sandiego series https://t.co/Zu1bpCQzLV","@gem_drill","cultural-icon",
"@AnnieOa70013462 @MichaelAvenatti @EdKrassen @RudyGiuliani He was humiliated and shamed by Michael Avenatti on live TV. Following this, he purchased a Waldo outfit, called up Carmen Sandiego, and has been on the run somewhere in the US ever since.","@ResistMonsters","cultural-icon",
"I hope it's just her in therapy and trying to connect with friends she made in her travels but had to abandon due to her secretive lifestyle and then they title it ""*How* in the world is Carmen Sandiego?""","@Mike_Laidlaw","fashion",
"carmen sandiego was a great role model to grow up with. that red trench coat & fedora combo! pulling off heists throughout time & space!","@astoehr","role-model","x"
"On the bright side, I am now the proud owner of a Carmen Sandiego trenchcoat and I know exactly what I am going to do for Halloween now","@magalisays","fashion","x"
"Did anyone else have a raging queer-girl crush on Carmen Sandiego growing up? Because: https://t.co/Nroh6DZzjL","@nadya","cultural-icon",
"If the Wide-Brimmed Hat Fits! Gina Rodriguez Will Play Carmen Sandiego in Live-Action Movie https://t.co/wTE03aRw0y https://t.co/dYB9OXTPUd","@HealthBeauty747","cultural-icon",
"Who travels more, Iguodola or Carmen San Diego?","@solesavage","travel",
"@GoGirlGuides didn't see too many women travelers growing up but Carmen Sandiego was inspiring...so was my dad who traveled the globe","@ChocoChipRaisin","travel","x"
"Netflix is now making a Carmen Sandiego live-action movie starring Jane the Virgin's Gina Rodriguez https://t.co/xvSyMkeHFg","@digitalspybrk","cultural-icon",
"@greekemmy @LAMcL7 When it's criminal to tell the truth you get to be a cool anti-hero like Robin Hood or Carmen Sandiego. hehehe.","@ChateauRuby","role-model",
"Netflix finds 'Carmen Sandiego' for its latest reboot https://t.co/rp0yLY19ci https://t.co/y7V5xzdsXD","@applestreem","cultural-icon",
"I feel like Carmen San Diego. I'm at Commonwealth Parliament Assn. #cdnpoli #yyj http://t.co/0quoMB3inR","@janniaragon","cultural-icon",
"I'm flying on Halloween. Which means the obvious choice in costume: ""Carmen Sandiego.""","@KSkinnerTweet","fashion",
"Where in the world is hero of the revolution Carmen Sandiego?","@somesillywowzer","role-model",
"A New Carmen Sandiego Series Is Coming... #CarmenSandiego #GinaRodriguez #Interpol #JaneTheVirgin #Netflix https://t.co/eYHw4RKaJS https://t.co/j4wRTZ5yp7","@IEarths","cultural-icon",
"@JamieErdahl like that Carmen SanDiego red hat and coat from a while back?","@JhazonOnline","fashion",
"wouldn't it be weird to record a Lo-Fi Let's Play of Carmen Sandiego in an airport while everyone stares at me","@leighalexander","travel",
"Where in the World is Carmen Sandiego?—Tyrannosaurus Wrecked: http://t.co/gfL2k0VQZj via @youtube","@AshleyShyMiller","cultural-icon",
"Netflix Plans Live-Action ""Carmen Sandiego"" Film has been published on Movietoday - https://t.co/0j6lmT1tbY https://t.co/SKXGUXFNx0","@NMoviez","cultural-icon",
"The show will also feature the voice of Stranger Things’ Finn Wolfhard #CarmenSandiego #Netflix #GinaRodriguez #animatedseries #TVShows #TVSeries #streaming https://t.co/FUiWSBzkDy via @geekspinco","@tvscoopsdaily","cultural-icon",
"You know you're working retail on Halloween when you have to ask Where's Waldo and Carmen Sandiego if they need help finding anything.","@poodlestar","cultural-icon",
"Just recalled that last Halloween husb and I dressed as Waldo and Carmen Sandiego and found out afterward so did Edward Snowden and his g.f.","@Stefaniya","cultural-icon",
"My direction to the designer: ""Pretend that you are submitting this map design to Carmen SanDiego"" #maphead #marketingmanagerproblems","@googleismybf","cultural-icon",
"where in the world is carmen sandiego","@JohnCrowell","cultural-icon",
"@Mebesse15 @samdavisboyhero the wide brimmed hat from Carmen Sandiego?","@CapnTopDeck","fashion",
"Celebrated our first year of marriage with a surprise trip to Vegas to see the boys!!!! Parker wins at the husband game.😍👰🏻🤵🏻🥂♥️♣️#VivaLasVegas #wsmfp #CarmenSanDiego #WheresWaldo… https://t.co/NjSLlrv5h9","@nhpennington","cultural-icon",
"""10 reasons Where in the World Is Carmen Sandiego? was the best educational TV show ever https://t.co/MqGkYjwOI6 https://t.co/e5T8cLflY4""","@PetrinaRigby","edutainment",
"I feel like Carmen San Diego. I just need a lightweight summer trench coat, California is hot AF. #floppyhat https://t.co/sZYSu6fdvE","@ElleMcPoopson","fashion",
"Some1 call Carmen San Diego, get these morons some geography lessons https://t.co/SGvJ7NBThl","@CaleenJ","cultural-icon",
"Thought of Paraguay's capital and am currently running through South American capitals in my head. Thank you, Carmen Sandiego and Aunt Gini.","@HalliePV","edutainment","x"
"@TheRealSourD @ColinDonkowski @NiltChamberlain RIGHT?!? He's like the Portuguese male version of Carmen Sandiego #whereintheworldisNilt??","@Chrisbroferr","travel",
"Netflix is making a Carmen Sandiego movie with Gina Rodriguez - CNET https://t.co/Ro0RxRKoif https://t.co/FltWaGFDad","@AnthonyVenutolo","cultural-icon",
"YES I 💖 GAGA's RECENT TRENCH COAT STYLES VERY WHERE IN THE WORLD IS CARMEN SAN DIEGO 🌏","@_ALBERTV","fashion","x"
"It doesn't really fit, but I just want to wear that big Carmen Sandiego hat","@CelticChick5513","fashion",
"Gina Rodriguez will be the voice of 'Carmen Sandiego' in Netflix series https://t.co/NCdvnGzqVh via @ffsportstalk","@sarahstweets85","cultural-icon",
