"text","handle","category","star_tweet"
"Gina Rodriguez will be donning the red fedora and trench coat of Carmen Sandiego for Netflix - ... among the othe... https://t.co/ovJfctQldJ","@FinanceRadr","cultural-icon",
"Davidson has been called for traveling more than Carmen SanDiego. #watchus #ShowMyAgeTweet","@jimhughelliott","travel",
"‘Carmen Sandiego’ Animated Series Greenlit at Netflix, Gina Rodriguez to Star | https://t.co/2520WQk6ck (reddit)","@KouchPotatoIN","cultural-icon",
"Ruby just came up with her first fan theory. Re: Carmen San Diego... ""Wait, is her daughter Dora the Explorer??""","@shutterMuggz","cultural-icon",
"Saturday Night Social: Gina Rodriguez Will Voice Carmen Sandiego in Netflix’s Upcoming Ani... https://t.co/BjChaaO5lH https://t.co/3VpwARY8s2","@boxofficecollec","cultural-icon",
"Me: Netflix is making carmen Sandiego! Elli: & magic schoolbus Me: I don't care about that Elli: I ship carmen & miss frizzle Me: oh! Yes...","@s_incerely","cultural-icon",
"Curse my not having Netflix, cause I'd totally watch this! https://t.co/ZBBQIZlJCe","@PikaHikariKT","cultural-icon",
"Where in the world is Carmen San Diego? Remember that game?","@summer81","cultural-icon",
"Sad Facts about growing up: so it turns out Carmen Sandiego is a lot easier when you know about geography.","@AnnieNybo","cultural-icon",
"Gina Rodriguez to Voice Carmen Sandiego for Netflix https://t.co/hYo7BTxuYo","@unimediapr","cultural-icon",
"#WhereOnEarthIsOliviaPope? I don't know, but is she gonna get a red fedora now, a la Carmen Sandiego? #Scandal http://t.co/Kw9jq8XYrk","@Twirl4meK","cultural-icon",
"A match made in heaven. #halloween #whereswaldo #carmensandiego #waldo #halloween2016 https://t.co/LcPGhwImwq","@Timfluffybeard","cultural-icon",
"#Netflix green lights Carmen Sandiego - Jane The Virgin's Gina Rodriguez voices thief. Joined by Finn Wolfhard (Mike/Stranger Things) https://t.co/c5kDbTUwdz","@JoAnne_Rowney","cultural-icon",
"Gina Rodriguez Is Going To Be Carmen Sandiego In A Live-Action Film And I'm Breaking Out My Red Fedora To Celebrate https://t.co/alaZRBFbxt https://t.co/WtYcgDlaXY","@amandasome","cultural-icon",
"Do it, Rockapella: Netflix is Making a New 'Carmen Sandiego' Show: https://t.co/aGnKCbzzTr https://t.co/oAtEvVaYtH","@geekdotcom","cultural-icon",
"#GinaRodriguez will be playing #CarmenSanDiego in 2019 #Netflix #braces #dentistry #odontologia #odontología #colour #color #cor #cores https://t.co/hp9GKdoXWn","@BraceMateApp","cultural-icon",
"carmen san diego is like how i put tinder boiz in my phone. dustin sacramento, jason anaheim, jordan winter park... none of them have a cool red hat though 😔","@caseyandthebear","cultural-icon",
"WHERE IN THE WORLD IS HARRY EDWARD STYLES?! (Sung in the tune of Carmen Sandiego.)","@ambreezz","fashion",
"Saw a tweet mention Where in the World is Carmen Sandiego? I miss that show.","@cdulaney85","cultural-icon",
"This video and the tv show 'Where In the World is Carmen Sandiego' is how I learned my geography. https://t.co/kbhYeJlESQ Enjoy","@CM_Abides","edutainment",
"Why would y'all photoshop Jeffery Atkins with Carmen Sandiego? http://t.co/1bRxO2QuwT","@CG4","cultural-icon",
"Netflix finds 'Carmen Sandiego' for its latest reboot https://t.co/qDgkGIGXEu via #enews24ghanta","@MegahDe","cultural-icon",
"⭐️ #News • Gina Rodriguez to Voice Carmen Sandiego in Netflix Animated Reboot: Netflix has scheduled Carmen… https://t.co/jbTXKcWD70 https://t.co/y47GC3n7cA","@Kazi_Celebrity","cultural-icon",
"My take on the bad-ass female traveler and villain: Carmen Sandiego http://t.co/HArNgknxHG","@paranormal__us","travel",
"Sounds Like Netflix Is Bringing Back 'Carmen Sandiego' https://t.co/jm273CQiaB","@LunaLuvgood2017","cultural-icon",
"@chelsaya you're one gigantic hat away from being Carmen Sandiego","@ForTheLark","fashion",
"throwbacks from my past travels until I'm on my Carmen SanDiego again ☕️✈️ #bluebottle #abeereatsinla… https://t.co/HVqr6Ul7kI","@TheAbeerNajjar","travel",
"@cvxfreak I hope by the end of this trip you've caught Carmen Sandiego.","@JoshuaJSlone","travel",
"VIDEO: 10 Reasons Where in the World Is Carmen Sandiego? Was the Best Educational TV Show Ever https://t.co/tV1xbGrWeU @Peoplemag","@StevoCandelaria","edutainment",
"Here is to a successful heist. #Cosplay #CarmenSandiego https://t.co/Az3SIwxcRH","@BeaIank","fashion",
"Where in the world is Carmen Sandiego? — DO IT ROCKAPELLA!!!!! Carmen Sandiego is in our hearts. Geography bless... http://t.co/3uyvwNxWnI","@GeekRemixALot","cultural-icon",
"@eehouls really hoped it would be her traveling the globe searching for Shelly Miscavage. Carmen San Diego style.","@belleisleasylum","fashion",
"#GinaRodriguez to star in Netflix’s #CarmenSandiego movie https://t.co/A6ZcCIP2Cr","@US48PM","cultural-icon",
"Good luck finding us. #BigRedBoos #halloween #carmensandiego #waldo https://t.co/pd0cpaZv1k","@Jennmag07","cultural-icon",
"@JennaOfAvalon How do you even plan these things?! I feel like you need a red fedora ala Carmen Sandiego! ;)","@kayler","fashion",
"@AmperoDJ You don't know how much I wanted to be Carmen SanDiego!! But yeah even though I try to cover it, it's a very nasal sound. 🤦🏾‍♀️","@HellOverYonder","cultural-icon",
"@badmovesDC You might also like seeing us dressed up as Carmen Sandiego and Where's Waldo: https://t.co/PhWxpzbeGD https://t.co/OJuWuJVY17","@badmovesDC","cultural-icon",
"Where in the world is Carmen Sandiego? @Netflix: https://t.co/NamP0tNLBn https://t.co/8Tu4gCecs1","@Local12","cultural-icon",
"Gina Rodriguez to star in Netflix reboot of Carmen Sandiego https://t.co/FELcu6OgVy","@rusty_offishall","cultural-icon",
"where in the world is harry styles??? a spinoff of where in the world is carmen sandiego","@fvckharoldd","cultural-icon",
"Inktober 2017 Day 28 Homestar Runner (as The Greatest American Hero) & Strong Bad (as Carmen Sandiego) #inktober #inktober2017 https://t.co/A06Jw2t1gQ","@robinandcat","cultural-icon",
"Travel glow. 😉 #Vacation #CarmenSandiego #WheresJess #Again? #😂 #HappyPlace #HardlyHome… https://t.co/U7cntkUsvr","@berryflavord","travel",
"Where in the World Will Gina Rodriguez Be When She Voices Netflix’s New Carmen Sandiego Series? https://t.co/rBq5v8vRNf https://t.co/3jNfaLRJiJ","@MoviesWrld","cultural-icon",
"Netflix Is Developing an Animated Carmen Sandiego Series Starring Gina Rodriguez https://t.co/mxmLSdqBR7","@NYILFF","cultural-icon",
"My sister is the real life Carmen Sandiego! By the end of 2016, she will have seen all 7 continents. She's not... https://t.co/txkqnuOvC3","@AntoineEdmonson","travel","x"
"Gina Rodriguez to Star as Carmen Sandiego in Live-Action Netflix Film https://t.co/Lkbc68292q","@Komishi","cultural-icon",
"Ru is really serving some Carmen Sandiego realness in that hat. Work.","@softershade","fashion","x"
"Quotes frm the BFF-""being your friend is like playing Where in the World is Carmen SanDiego, except the clues are harder & you travel more""","@denanicole","travel","w"
"Gina Rodriguez will play ""Carmen Sandiego"" in a live-action feature for Netflix https://t.co/aoNxMLw6My","@LosAngelesCP","cultural-icon",
"@RockapellaMusic @HereIsGina @CarmenSandiego @netflix It’s not Carmen San Diego without Rockapella. @netflix you better lock Rockapella up for the show too!","@Undertrader","cultural-icon",
"@Meems852 @irvspanish Something using primary sources, google earth, and green screen video? Think Where in the World is Carmen San Diego but for people not geography?","@mrterborg","cultural-icon",
"Retweeted Deadline Hollywood (@DEADLINE): Gina Rodriguez To Star As Carmen Sandiego In Netflix Live-Action Feature https://t.co/tfaV4uyrWS https://t.co/T8Q9LJlyFI https://t.co/YfWDGQsEj7","@Taidon","cultural-icon",
"Netflix Is Reportedly Reviving Carmen Sandiego With Gina Rodriguez #tvnews https://t.co/avmBTnTbVl","@us_beautyNature","cultural-icon",
"Gina Rodriguez May Voice Carmen Sandiego on Netflix's New Animated Series The streaming giant is... https://t.co/AlH2ZXfi8L via @AceShowbiz https://t.co/qX51X1B4gM","@The_News_DIVA","cultural-icon",
"Watching ""Where in the World in Carmen Sandiego?"" and still sucking at it. These kids make me feel dumb.","@KyleBurbank","cultural-icon",
"🙌🏻Thank you lovebug.As the #CarmenSanDiego of #Periscope✈️,I'm making my rounds this holiday season! 😉#LoveBugNation https://t.co/0MtwAVBOXq","@xoxoLizza","cultural-icon",
"Netflix plans live-action 'Carmen Sandiego' film with Gina Rodriguez https://t.co/utlAfyGmlP https://t.co/VM5dA4HLP2","@cjland","cultural-icon",
"@UniWhiteWolf Why is Carmen Sandiego wearing a blue suit?","@Neo_Gambit","fashion",
"@GlobalBrunch Read this quickly as Carmen Sandiego... the ultimate world traveler! @GlobalBrunch #expediachat http://t.co/s339i6tzgJ","@BeccaBandit","travel",
"Need the hat, then my Carmen Sandiego cosplay is ready to go https://t.co/3B7r1MlY0H","@Tobliz","fashion",
"Someone just asked where in the world I am right now and now I feel like Carmen San Diego.","@persimmonsorbet","travel",
"film rouge dresses like shes from a film noir, city slicker dresses as detectives and some carmen sandiego shit idk. umbra wears thrift stor","@eyegauze","fashion",
"Netflix finds 'Carmen Sandiego' for its latest reboot https://t.co/yQFm7IzgFc https://t.co/Pz0xx2K2Zl","@TRAJKOVICNEWS","cultural-icon",
"just downloaded carmen sandiego on my ipad so see you guys in a few days","@darrenjenna","cultural-icon","x"
"Lo-Fi Let's Play does Carmen Sandiego in a Helsinki airport, musing on the nature of traveling & being hunted https://t.co/F2Y717Ba0M","@leighalexander","travel",
"Gina Rodriguez Voicing #CarmenSandiego in Netflix Animated Series https://t.co/NAdhmSn5EO https://t.co/Q4vjVQbOd0","@FreddieMKR","cultural-icon",
"Netflix Developing Live-Action Carmen Sandiego Movie...","@PewPewPewMalta","cultural-icon",
"See an exclusive first look at Netflix's 'Carmen Sandiego' animated series https://t.co/jXrjNLwlh1","@NaylaKodiak","cultural-icon",
"I wanted to be Carmen Sandiego growing up.....","@NiverasWings","role-model",
"Where in the world is Carmen Sandiego?","@rcotton2","cultural-icon",
"Why is @ErinAndrews wearing a Carmen Sandiego costume on the sidelines?","@Tyemazing123","fashion",
"@jason_fox haha Carmen Sandiego was AWESOME!!! I think I learned to type by just using IRC & IM a lot","@TheDanLevy","edutainment",
"Wearing my mom's vintage coat from the 70s. Always makes me feel a bit like Carmen Sandiego http://t.co/y4WADY62qc","@tagsalegirl","fashion",
"Now discussing #LHHATL fashion with @thewayoftheid. She seems upset I've cited Carmen Sandiego, Kingpin & Where's Waldo. But...","@Karnythia","cultural-icon",
"Gina Rodriguez To Star As Carmen Sandiego In @netflix Live-Action Feature https://t.co/a2Z3jjPWbs","@chacal_lachaise","cultural-icon",
"Jane the Virgin' star to voice Carmen Sandiego in new Netflix series https://t.co/80RX19L1lD https://t.co/ggjBIceztX","@gmanewsonline","cultural-icon",
"Gina Rodriguez Voicing Carmen Sandiego in Netflix Animated Series - https://t.co/jQdJgvcdnx https://t.co/UtLmpoW0hZ","@FOXCinemas","cultural-icon",
"@JacobLRosen CANT WAIT TO PLAY WHERE IN THE WORLD IS JACOB ROSEN! (NEED TO PHOTOSHOP YOU IN A CARMEN SANDIEGO HAT ASAP)","@sportsyelling","travel",
"Where in the Universe is Carmen Sandiego, in which thieves steal scientific concepts and kids answer science trivia.","@gemini6ice","edutainment",
"YES! @HereIsGina to voice Carmen Sandiego in @netflix animated series: https://t.co/rPNANLwy3E via @BrowBeat","@rosaliechan17","cultural-icon",
"@BigDragonien Well what the hell else would I have been? I guess a Where in the World is Carmen Sandiego edutainment show about history","@spirit_cimmaron","edutainment",
"@TruUKFan @bradtaschuk @ricketyoldshack I wanted to be on Carmen San Diego when I was a kid. I killed Geography Bee. Was 2nd in school twice","@JayPrimetown","cultural-icon",
"InStyle : Netflix's Live-Action Carmen Sandiego Will Star Gina Rodriguez #myfirstTweet #TheBest #GoodDay https://t.co/Sabrjh5a4d","@WWE_Wrestling0","cultural-icon",
"What if the real Carmen Sandiego is the henchmen we caught along the way?","@ben_r_hoffman","cultural-icon",
"No one wants to say it so I will: looks like the work of Carmen Sandiego.","@jacaissie","cultural-icon",
"Where in the world is Carmen Sandiego #flightattendant http://t.co/MKIuHTUIyA","@Naturallycurlfu","cultural-icon",
"Happy birthday to the one and only @J_McNeil94 your love for our fraternity and our Brothers is unparalleled #KickstartMyHeart #CarmenSandiego https://t.co/CbVo8Bopo1","@AkronPhiDelt","cultural-icon",
"Netflix orders animated Carmen Sandiego series https://t.co/yI6hOuCpWk https://t.co/RB91FjWchh","@yogendrachavda","cultural-icon",
"This hat! Carmen San Diego want it back. Lol","@iam_Acapricorn","fashion",
"""Where in the World is Carmen San Diego?"" is the theme song for a show about geography written by someone with little knowledge of geography","@MyDickerson","cultural-icon",
"Okay so @SariCarpenter posted a picture of Carmen San Diego and @peytonpclark posted a picture of Where's Waldo.....Halloween costumes????","@leifer_lizzie","cultural-icon",
"@GreeGreeHoist no. I stole it from Where on Earth is Carmen Sandiego. the cartoon series.","@AndrewJPlant","cultural-icon",
"@sistersingeek @donttrythis @Comic_Con The costume he will spend most of the con hiding in. Like a geeky where's Waldo/Carmen Sandiego","@LokiDragon","cultural-icon",
"I wonder is Carmen San Diego is completely lost by now or just waiting for Dora the Explorer to find her.","@Kamenzie","cultural-icon",
"Where in the World is Carmen San Diego? 👒 💄Another from our shoot in #Brazil luizlimaphotog… https://t.co/zTNUW0la1Q","@ValeskaJean","cultural-icon",
"Dear Carmen Sandiego, please tell me your secrets. All this travel is exhausting. #naptime #worklife #adultingishard","@midwestStein","travel","x"
"İyi haber. Sounds Like Netflix Is Bringing Back 'Where In The World Is Carmen Sandiego?' - The Huffington Post https://t.co/SeI15x6p7s","@gkchz","cultural-icon",
"ok but she gets points for her carmen sandiego costume","@PhiShort195","fashion",
"Jessica is turning into a modern day Carmen Sandiego with all of these MF trips she's taking 🙄🙄","@samcarvajal_","travel",
"So @nicdasilva as WonderWoman would be awesome... but Nic as CARMEN SANDIEGO = EVEN MORE AWESOME! 🙌🙌 🎶Where in the world is Nic Da Silva?🎶 https://t.co/kyJpmsiQHH","@JoanTheProfound","cultural-icon",
"Being misogynist while wearing a Carmen Sandiego coat...ok buddy.","@IntergalacticQ","fashion",
"Bout to get back on my Carmen Sandiego ✈️","@_kyndallelise","travel",
"@Miss_Magitek *headscratch* nope not seeing the carmen san diego. I mean if you were wearing a red hat and trenchcoat and black pants and boots I'd buy that one but...nah. tour guide for an everglades air boat tour? :P","@Cotyleus","fashion",
"Gina Rodriguez will play Carmen Sandiego in the live-action movie Netflix has found a star for its upcoming Carmen Sandiego movie: Gina Rodriguez. Rodriguez will be starring as Carmen Sandiego in the upcoming live-action movie, The Hollywood Reporter … https://t.co/aBJ4Rqziqg","@Millthorn","cultural-icon",
"Thank you, brain, for remembering and singing every word to ""Where in the world is Carmen Sandiego?"" But not... https://t.co/zwH7BtAFa9","@Brooke_Alyson","cultural-icon",
"Omg i shouldve gotten a carmen sandiego costume","@___idi","fashion",
"Did a count today- 28 countries, 57 cities in the last 6 months. When I was little I wanted to be Carmen Sandiego and I got my wish.#pmjtour","@crisgattina","travel","x"
"🔥🙌🏾. Gina Rodrigruez Reportedly to Star in New ""Carmen Sandiego"" series on Netflix https://t.co/Eac5B9f43Y","@GeeksOfColor","cultural-icon",
"Jane The Virgin’s Gina Rodriguez To Star In New Netflix Series Carmen Sandiego https://t.co/6LpEOIKPxI","@Officialcayana","cultural-icon",
"Carmen Sandiego': Netflix Announces Premiere of Gina Rodriguez-Starring Series (PHOTO) https://t.co/EGkY2M8r0x https://t.co/0dQyrz3y68","@BetaSeries_News","cultural-icon",
"Where can I get a Carmen Sandiego type hat quickly?","@sofiaflevin","fashion",
"@MichaelVarrati I will never complain about more Carmen Sandiego in my life. Thank you!","@RVAgeek","cultural-icon",
"#MyLifeWouldBeComplete if I could find Waldo, Carmen Sandiego, the One Armed Man, and my car @InfernoHashtags @HashtagRoundup","@randilynisin","cultural-icon",
"I feel like Carmen San Diego with all the traveling I have been doing in the past two weeks.","@BrittnyAlys","travel","x"
"I JUST FOUND OUT WHERE ON EARTH IS CARMEN SANDIEGO IS GETTING A RE RUN ON NETFLIX WITH FREAKING GINA RODRIGUEZ THE QUEEN AS CARMEN WHY IS NO ONE TALKING ABOUT THIS","@thisisnotbellag","cultural-icon",
"OMG! 😱😱❤❤ Carmen San Diego! Netflix is betting on ‘90s kids nostalgia for learning with upcoming lineup https://t.co/eGOEqp15Je https://t.co/kICQ1eu3km","@snooogansomega","edutainment",
"Where in the world is Carmen Sandiego? Where's Waldo? Why they're spending Halloween together of course! https://t.co/9lHHeaBSkA","@kwsipio","fashion",
"Your Geography Bee Champion Cade and the runner Josh. Congrats boys! #carmensandiego https://t.co/iQ6mn6Xo8w","@LibertyMSEagles","cultural-icon",
"Lady Gaga Swiped Her Hat And Trench From Carmen Sandiego's Closet - https://t.co/PDWvtV0VA9 https://t.co/eoVaAZRf0u","@LadyGaGaWatch1","fashion",
"""Gina Rodriguez To Voice ‘Carmen Sandiego’ Netflix Revival"" #mustread #feedly https://t.co/besx4ayBCS","@GiaPeppers","cultural-icon",
"Kimmy Schmidt's Final Season, Carmen Sandiego and More Coming To Netflix In January https://t.co/PqWUfxyPA3","@tonikyalo","cultural-icon",
"I'm wearing my Carmen Sandiego coat today look out world","@marycat45","fashion",
"New ‘Carmen Sandiego’ Images Tease the Animated Netflix Series’ Arrival in 2019 https://t.co/nA4Wi9L5Rd via @collider","@matt_stott_72","cultural-icon",
"Halloween options: Lorde Hermione Carmen Sandiego Sexy Spectre at the feast","@HRHCarson","fashion",
"🌍🌎🌏 where in the world is Carmen sandiego was the game that really and truly started my computer addiction","@Comatose__33","cultural-icon",
"Where in the World Is Carmen Sandiego? Becoming a Secret Travel Agent https://t.co/zXnbMj1Ne1","@neuropuff","travel",
"My bad it’s “Where in America’s Past is Carmen Sandiego” :S still…time travel right?","@Chronoslinger","cultural-icon",
"Netflix orders animated Carmen Sandiego series https://t.co/r8JGTZR5vJ","@Tomles","cultural-icon",
"I think Dora the explorer is the only human being alive who knows where Carmen San Diego is","@brie_nini","cultural-icon",
"@TVGMLogan @DaysofourLives @billymflynn @camilabanus @MarciMiller @nbcdays when Abby wears the floppy all I can think of Carmen Sandiego.","@jwall09","fashion",
"SNL' Tries Some Edutainment With 'Where In The World Is Kellyanne Conway?' https://t.co/zhYtHsLU7Y","@newsweek88","cultural-icon",
"@_AshaAce “@_AshaAce: Let's see what this airport is looking like ....”CARMEN SANDIEGO","@EFFIN_JERK","travel",
"Gina Rodriguez To Star As Carmen Sandiego In Netflix Live-Action Feature via /r/movies https://t.co/520yphJBaK https://t.co/U4ny9bFGGf","@anarchistnuts","cultural-icon",
"1. What you wear is part of how you communicate. Fashion is often more powerful than words. 2. Then don’t travel the world dressed like Carmen Sandiego.","@SabrinaMaddeaux","fashion",
"I hope Edward Snowden and Lindsay Mills go as Where's Waldo and Carmen Sandiego for Halloween. That would be epic.","@abditum","fashion",
"Congrats to my girl @HereIsGina for landing the lead role in the live action movie of Carmen Sandiego on @netflix. It has been so fun cheering you on over the years. This news made me so happy. Xoxo #werk #getitgirl","@kesthemess","cultural-icon",
"Netflix plans live-action 'Carmen Sandiego' film with Gina Rodriguez https://t.co/q1jTkDtp4j #socialmedia https://t.co/q1jTkDtp4j","@smsharks","cultural-icon",
"My Carmen Sandiego meets India Arie travel look 🔎📸 . . . . #wcw #love #livefree #fashion #model #pose #amsterdam #throwback #netherlands #naturalhair #travel #btm #coach #rayban #trenchcoat #mua #ootd #smile #serenity #ariesseason #aries #aprilbaby #lamode #instagoodMy Carme… https://t.co/FZhcvj8mZ2","@mjoi1584","cultural-icon",
"Only Chuck Norris knows where Carmen San Diego is","@Howie024","cultural-icon",
"it took me over two decades of my life to figure out the pizza hut logo was actually a rooftop and not carmen sandiego's hat","@toilethospital","fashion",
"Netflix is Bringing Back 'Carmen Sandiego'—with Gina Rodriguez Playing the Lead https://t.co/pEdxKHYfsm https://t.co/xivlb6wSGB","@MoviesWorldNewz","cultural-icon",
"I just posted ""Where's Waldo? And where the hell is Carmen Sandiego?"" on Reddit https://t.co/Bv1eBDWeVZ","@mintyisland","cultural-icon",
"Carmen Sandiego games on the PC 😂😂 yea I’m old","@FreeMyDreams_","cultural-icon",
"Popular 80s and 90s educational video game hit & kids' game show #CarmenSandiego will make its live-action debut starring @HereIsGina on @netflix https://t.co/TqFR9PgtPY","@geekradioshow","cultural-icon",
"This makes me feel like Carmen Sandiego https://t.co/CqnjT6IkGi","@ChateauErin","cultural-icon",
"Carmen San Diego's car has the license plate ""Carmen"". She's blase about it being towed by a helicopter...so she watches a movie.","@derekthebard","cultural-icon",
"@SarahSecord You could so cosplay as Carmen Sandiego.","@SolusLupus","fashion",
"Dara's baiting me to join her Carmen San Diego adventures in #3Dprinting My inner monopoly man likes the idea http://t.co/K5pw61lT0D","@Jammer_Volts","travel",
"Where in the world is Carmen Sandiego? 💃🌎 #xoxo #fashion http://t.co/mIR8HeJ9sL via @snapwidget","@JoannyIzadora1","fashion",
"So cosplay stats. Most photographed: Kaylee's Pink Dress. Most Recognized: Carmen San Diego BUT Pyro got the most SELFIES so woo","@caeboa","fashion",
"Still pissed about Carmen Sandiego being replaced by Zoom in 1996.","@chasetastic","cultural-icon",
"Where in the World Is Carmen Sandiego? At the Paris Haute Couture Shows https://t.co/bbgmSqkgOn #fashion #fashion… https://t.co/IbMIR9W6Gz","@joefrancis","fashion","x"
"And, above all: who's Georgij's mystery girl and where the heck is he now? *muffled carmen sandiego's theme playing in the distance* https://t.co/EkaegnSYWQ","@raxilia_r","cultural-icon",
"Where in the world is Carmen Sandiego? Google might know: PlaNet is a deep-learning machi... https://t.co/m2F8a3A7OX #ML #machinelearning","@SJFinne71","cultural-icon",
"@MrTylerCrook I was going to reply with a Carmen Sandiego gif but immediately hated the ""criminal"" allusion.","@TangoCharlie","fashion",
"Can't wait for my game to download....got Where in the World is Carmen Sandiego. Haven't played that in forever!!","@brsoto92","cultural-icon",
"@spencerspellman YES “@spencerspellman: Love this by @tripstyler (with a sweet giveaway!): How Carmen Sandiego fuelled her wanderlust http://t.co/jlUvo0rf7C”","@kattancock","travel",
"I truly need a second job for all the traveling I'm tryna do next year. Carmen San Diego headass.","@soulfauxreal","travel",
"Netflix finds 'Carmen Sandiego' for its latest reboot https://t.co/GfjxAtXuxt https://t.co/53wdkhaGGw","@AdventurousTech","cultural-icon",
"@gildedspine omg they're doing a Carmen San Diego movie. CSD helped me learn geography back when everyone used mcintosh computers in the library :D","@s_raughley","cultural-icon",
"Sounds Like Netflix Is Bringing Back 'Where In The World Is Carmen Sandiego?' https://t.co/N7POXMXEeK https://t.co/q4Hhg1fcIc","@shelbylaneMD","cultural-icon",
"Just reminded of best couple costume I saw on Halloween: Carmen Sandiego and Wally.","@jaqx0r","fashion",
"Taking a multi-destination trip definitely makes me feel like Carmen Sandiego","@lheinzen2","travel",
"@kanyewest Carmen Sandiego the globe*","@Jayybans","travel",
"I'm gonna start my own PI agency. And call it Where in the World is Carmen San Diego.","@justine_marie","cultural-icon",
"Netflix orders animated Carmen Sandiego series https://t.co/LLwWdT4x55 https://t.co/aqiUHge106","@sonuise","cultural-icon",
"Uh, I don't have professional wear, so is it cool if I just go to the Geography Career Fair as Carmen Sandiego?","@GreenMEGs_n_Ham","edutainment",
"Where in the world is Carmen Sandiego? In case you’re wondering, it seems she’s taken off with some of our Erstwilder Halloween treats! 🎃🖤 Jess @cakeandmadness looked fab in her classic costume at our event last Saturday 😍❤️ https://t.co/SaF0eOoqx5","@Erstwilder_","fashion",
"@Sheena__K ""Ok so you taught me batman and I played a lot but you were more of a Carmen San Diego fan""","@MHarwoodJr","cultural-icon",
"Get a first look at Netflix's ""Carmen Sandiego"" animated series https://t.co/1nor8bAWMr","@BruGomez_7","cultural-icon",
"mashable : Carmen Sandiego is coming to Netflix and the actress voicing her is perfection https://t.co/sSxNf4MRo8… https://t.co/tA2V7LCuYa) https://t.co/qpIh5RaBNs","@alphi_creative","cultural-icon",
"Netflix plans live-action 'Carmen Sandiego' film with Gina Rodriguez https://t.co/IBWl0FyAcf","@OnlyVegetables","cultural-icon",
"#Repost @its_poppin with repostapp. ・・・ #carmensandiego #beige #trenchcoat Size 6-8 $30 shipped… https://t.co/xl8GGnoOLn","@Its_Poppin","fashion",
"> “I feel like Carmen Sandiego, they’ll never know it’s Junkrat""","@UltimaSomnia","cultural-icon",
"#BillOReillysNextGig Joining Richard Simmons, Waldo and Carmen Sandiego as adventure hunters","@DcStarlord","travel",
"#GamerGate Nov 1985 #retrogaming ad memories - Where in the World is Carmen Sandiego? Educational games level up! http://t.co/fyrH8Erdrz","@VGBounceHouse","edutainment",
"Gina Rodriguez to star in live-action Carmen Sandiego film for Netflix https://t.co/i9OAH4sqpl","@misformusicnews","cultural-icon",
