"text","handle","category","star_tweet"
"#DidYouKnow that the Carmen Sandiego edutainment franchise, which began with video games World (1985) and U.S.A. (… https://t.co/uL7nMsRkbL","@DidYouKnowWP","cultural-icon",
"Retweeted MV (@mirand4v): Getting ready for @Comic_Con 💥Excited to see all the cool costumes + interactive booths! ⚡️ #ComicCon #SanDiego #CarmenSanDiego #SDCC #SDCC2018 https://t.co/gue9KTMC0x","@SkylineITS","fashion",
"Why do I always do this? #snapchat #Halloween edition. #carmensandiego #costume #wink #basic #bw… https://t.co/mpdiPmfq1i","@cassie_sokol","fashion",
"#BREAKING #news: Introducing our Travel Series. It's the fun of #Travel & the #nostalgia of #Carmen Sandiego. (link below): https://t.co/oP7kObLLbh #IAmACreator #travelblogger #Blog #vlog #BestFanArmy #Twitter #games #world #trip #weekend #fun #latelate #Motivation #inspiration","@VerdictSquadNow","travel",
"Do it, Rockapella: #Netflix is Making a New ‘Carmen Sandiego’ Show https://t.co/oYz7tlyuis https://t.co/MCNSHUVlFP","@marsmellowspop","cultural-icon",
"Netflix's Carmen Sandiego Reboot Has a New Premiere Date and Some Mysterious Teaser Images https://t.co/ylh6OD18JE #carmensandiego #netflix #ginarodriguez https://t.co/eLXhniHTH8","@igor_os777","cultural-icon",
"Already have my next Halloween costume planned out. Carmen Sandiego. My date&39;ll go as Where&39;s Wally. Always wanted to do that","@madgepadillavcz","cultural-icon",
"me: idk ive never really seen carmen sandiego i don't rlly care? netflix: we got gina rodriguez me: carmen sandiego is my favorite franchise","@possumqveen","cultural-icon","x"
"oh boy any y'all member where on earth is Carmen SanDiego always knew answers to soon n my kid hated to watch with me same w/ crime shows https://t.co/F8gKog40k5","@lildanie24","edutainment",
"Imma let you finish, but Carmen Sandiego is the greatest female video game character of all time https://t.co/dDt7JnwMbe https://t.co/IvcQ3sBcWE","@bestgaming2015","role-model",
"@GMaclagan Maybe @Marlins_Man is looking for his Carmen Sandiego which is why he roams park to park?","@kirksorensen28","travel",
"Another MS Dos'ing around installment, around educational game 'Where In The World Is Carmen San Diego' #carmensandiego #dos #dosbox #pc #90s #retrogaming https://t.co/jicTSW07gB https://t.co/FXr3KF33ma","@KiotaGaming","edutainment",
"https://t.co/U0pNCd2exR #unsigned #talent #forum The return of Carmen Sandiego and Miss Frizzle on Netflix is so… https://t.co/nNlsx3koCw","@goldenbeatz11","cultural-icon",
"Netflix finds 'Carmen Sandiego' for its latest reboot https://t.co/521TnVlSvt https://t.co/7avjeMb5hQ","@juancaroga","cultural-icon",
"@catehstn WEALTHY international mystery woman, or criminal? OR BOTH? Are you secretly Carmen Sandiego?","@kwugirl","cultural-icon",
"A Carmen Sandiego animated series is in the works at Netflix with Jane The Virgin's Gina Rodriguez attached to... https://t.co/otKQvKmHj6","@datboyjerry","cultural-icon",
"Carmen forgot her hat. #whereintheworld #carmensandiego https://t.co/AXuvc7q5ai","@AnjGardner","fashion",
"Carmen Sandiego, the world’s most iconic Latina super villain, is back https://t.co/z5sVE52gpn https://t.co/pmOO0IOh7C","@Dav3403","role-model",
"@TLHyatt Is that anything like Where in the World is Carmen San Diego? ...probably don't even know what that is. Lol","@N8JustSayin","cultural-icon",
"@AllysonBird @dianawillsie all I see is a cookie wearing a hat like the one from Where In The World Is Carmen San Diego....","@allie_hendricks","fashion",
"New ‘Carmen Sandiego’ Images Tease the Animated Netflix Series’ Arrival in 2019 https://t.co/QBLHC8KkiR via @collider","@Adam_Luff","cultural-icon",
"@Guinz It was like Where In The World Is Carmen Sandiego, except nobody was willing to learn about ancient Greece to find out.","@StPeterGateKeep","edutainment",
"Netflix is banking on a certain audience for some of its new shows. https://t.co/zpKry9LxI3","@Polygon","cultural-icon",
"Just sang New York, New York in a bar in Fort Worth and I'm from Leonard. The latter is the best city, and I feel like Carmen Sandiego.","@Leonardite","travel",
"Get a first look at Netflix’s Carmen Sandiego animated series https://t.co/UhvJBGyBqB","@lindsaywalms","cultural-icon",
"Remember how we had those Cluefinders, Reader Rabbit and Carmen Sandiego games to learn things while growing up? Where are those games for today's age group?","@LeClairJoshua","cultural-icon",
"Netflix plans live-action 'Carmen Sandiego' film with Gina Rodriguez https://t.co/gSlrLRfKiG","@ItalianFoodNow","cultural-icon",
"Did anyone else ever notice that Ralphie's family was standing next to Carmen Sandiego during the parade? #AChristmasStory","@regularguy5mb","cultural-icon",
"@jimmystagger ""Where in the world is Carmen Sandiego?""","@GracefulWings","cultural-icon",
"Went old school today with a little Carmen Sandiego youtube/@EDpuzzle mashup. Solving crimes and learning about the world. @FatherHenriVS https://t.co/ZMV5JfFnSR","@fhvgrade3","edutainment",
"Photoset: ickaimp: 10 Costumes and Moments that made me giggle at Katsucon. Carmen SanDiego and Waldo are... http://t.co/zzAUc0lE2x","@LinuxScouser","cultural-icon",
"Gina Rodriguez Is Carmen Sandiego in Live-Action Netflix Movie https://t.co/5bYTV4VMBJ https://t.co/coTQzI1gCP","@movieweb","cultural-icon",
"Cookie looking like Where in the World is Carmen San Diego w/ that hat! #EmpireFOX","@kpetty86","fashion",
"I'm wearing my big hat with a red coat and a little girl on the train just asked me if I'm Carmen SanDiego. I don't hate it!","@thebostonista","fashion","x"
"I like learning while I work. Which is why I've been watching Carmen Sandiego. #freelancelife #carmensandiego","@breakfast_jones","edutainment",
"Me: Guess who I'm going to be for Halloween now! *Puts on red fedora* Mom: Carmen Sandiego! Dad: Jimmy Fallon! Well, one of them's right.","@DaniaMaduro","fashion",
"literally sent myself an email to be sent to me october 1, 2017 to be carmen sandiego for halloween","@loafie19","fashion",
"#LeonardSimpsonTV Netflix cannot stop producing nostalgia at a fever clip. The streaming service is slowly but su… https://t.co/HmpUUHPILt https://t.co/aRdatWDT3T","@LEONARDSIMPSON","cultural-icon",
"learning so much about history & badass bitchery from Carmen Sandiego rn","@DinoSpots","edutainment","x"
"A @NatGeo survey showing lack of geography knowledge in USA inspired #CarmenSandiego! ""Best Game Shows of the '90s"" https://t.co/rfkN8Rwx6a https://t.co/6LLhp0dTs8","@LanaGay","cultural-icon",
"1. Form-fitting long button coat, either red or blue 2. Janelle Monáe’s 2018 VF Oscar Party dress 3. Carmen Sandiego’s entire outfit ...I have a type https://t.co/TWgdBXoWj8","@DrownARiver","fashion",
"Gina Rodriguez, ‘Stranger Things’ actor, to lend voice to Netflix’s ‘Carmen Sandiego’ https://t.co/PRCJ3ae97W https://t.co/LWlKm3tOsN","@grejeentrends","cultural-icon",
"BEYONCE FELL DOWN A FLIGHT OF STAIRS IN A RED CARMEN SAN DIEGO COAT. WE DON'T CARE ABOUT WHAT SHE ALMOST DID.","@applebumebonita","fashion",
"@johnqgoh love that game! I learned so much from playing those Carmen Sandiego games","@MissCaseyCes","edutainment",
"Netflix is Developing a New CARMEN SANDIEGO Animated Series! https://t.co/E4EiNG60ts https://t.co/T5j96jPLO1","@GeekTyrant","cultural-icon",
"My bf Is stressed out bc we have a flight in a few hours and all I’m doing is packing really slowly while singing Melissa Etheridge/ the Carmen Sandiego theme song at the top of my lungs. #stressingoutadam","@brynwoz","travel",
"I read that the car that the ACME RV in Where in the USA is Carmen Sandiego turns into is a dragster.","@JeremiahLiles1","cultural-icon",
"@SonicSentry @netflix @HereIsGina A live action Carmen San Diego would be a-mazing","@MovieguysCraig","cultural-icon",
"Gina Rodriguez to star as Carmen Sandiego in Netflix’s live-action feature film https://t.co/os7MXRttEA","@NewJacksnyc","cultural-icon",
"@matrioshkadog I previously declared Carmen Sandiego to be a coyote which may imply things about my view on 90s cartoons edutainment role models >.>","@matrioshkadog","role-model",
"indieGames: Carmen Sandiego is returning as an animated children’s show on Netflix https://t.co/AipcYSaCe4 #letsplay #indie https://t.co/vn14sJof0X","@indiegames1","cultural-icon",
"Hee! @ladytian & I just saw the best couples cosplay. Waldo & Carmen SanDiego. Sadly, we were on the escalator, so we have no proof that we found them. #WonderCon","@ralkana47","cultural-icon",
"Can we get an investigation of Carmen Sandiego next? RT@voxdotcom: 9 myths you learned from playing Oregon Trail http://t.co/JQtdtbjoVx","@thathuynh","edutainment",
"Sounds like Netflix is bringing back ""Where in the World is Carmen Sandiego?"" https://t.co/hSwAacppY5 via @HuffPostEnt","@fabfrenchie","cultural-icon",
"Where in the USA is Carmen Sandiego?!?!? http://t.co/0JjxE7NQWv","@RyGuy176","cultural-icon",
"I went out for Halloween as nothing and ended as Carmen Sandiego with a holographic Pokémon card doing a death drop on the subway. 🎃👻 https://t.co/cqYifPWLA2","@tstrader4","fashion",
"Sounds Like Netflix Is Bringing Back 'Carmen Sandiego' https://t.co/hd0KoRFhZd","@yehitsroger","cultural-icon",
"Dust off that magnifying glass! Carmen Sandiego is getting a Netflix movie - Digital Trends https://t.co/n2be2NDaGw","@NewGamesPlay","cultural-icon",
"Netflix Reboots 'Carmen Sandiego' as Animated Series With Gina Rodriguez https://t.co/hGNqnWSRwU https://t.co/z0r5c0xiDn","@MoviesWrld","cultural-icon",
"WHERE IN THE USA IS CARMEN SANDIEGO MYSTERY GEOGRAPHY GAME 1993 https://t.co/PjRAVRJxno https://t.co/HMjh4D2aba","@DealGorgeous","cultural-icon",
"Throwback! Do you remember ""Where in the World is Carmen Sandiego"" which taught geography and reference skills?... http://t.co/k5ZJKBSnmh","@All4OneTutoring","edutainment",
"@oneilllo Louise O'Neill - international woman of mystery. Need to get you a Carmen Sandiego hat.","@d_ruddenwrites","fashion",
"It seems like everything I loved as a kid has returned in some form. Saw a Carmen Sandiego card game at Target. Bought an OG style My Little Pony pj set. I have to ask though... Where are the pogs?","@KateMB","cultural-icon",
"Where in the world is Gina Rodriguez? It's official gumshoes: Jane the Virgin is bringing Carmen Sandiego to life in a live-action film! https://t.co/hNhMTp4xBc","@enews","cultural-icon",
"My wishlist for nostalgia-baiting Netflix revivals: 1. Kids Incorporated 2. Roswell 3. Carmen Sandiego 4. The Nanny 5. Strangers w/ Candy","@timmymetzner","cultural-icon",
"RE: LRT I ""forget"" that Carmen Sandiego was supposed to be a bad guy thief because she's badass af and has great fashion sense.","@technotoastx","role-model",
"Gina Rodriguez to star in Netflix's Carmen Sandiego movie.. https://t.co/Xu95yFaavF","@NewsBossIndia","cultural-icon",
"Carmen Sandiego Ready to Steal the Netflix Spotlight in January https://t.co/pYnDMz34WY","@BBCWPress","cultural-icon",
"Fun day out at #caufieldcup with @nextofficial_au 💖 What do we think of my outfit? Obviously I was heavily influenced by Carmen Sandiego! 💁🏼‍♀️🙌🏼 #nextau #sharewithnext #nextofficialau @ The Olsen","@JessRaeKing","fashion",
"I found #carmensandiego ! #whereintheworldiscarmensandiego #whereonearthiscarmensandiego #netflix #sandiego https://t.co/UucilDJSjE","@aicarsilog","cultural-icon",
"NETFLIX Reveals 'CARMEN SANDIEGO' Poster and First Look https://t.co/1RutpyLEhq https://t.co/KkSKKATr0x","@ComicBookNOW","cultural-icon",
"So I got on this hat like Carmen Sandiego 😩😂😂😂😂😂😂","@_JasLashea","fashion",
"Sounds Like Netflix Is Bringing Back 'Where In The World Is Carmen Sandiego?' - The Huffington Post https://t.co/WC2eMoesp7","@ErikaAbrahamss2","cultural-icon",
"“@netflix has tapped @gamenightmovie screenwriter @MarkPerez80 to pen its #CarmenSanDiego feature film that has set @CWJaneTheVirgin star @HereIsGina to topline. No director is attached yet.”","@NHMC","cultural-icon",
"Gina Rodriguez Voicing Carmen Sandiego in Netflix Show https://t.co/Iwtmt4fQ9n https://t.co/Q34SPvdOzl","@GamesInfinityof","cultural-icon",
"Happy Halloween from Carmen San Diego and a wounded Scottish warrior http://t.co/IxNbknScLX","@MichaelRoos","fashion",
"#ginarodriguez as #carmensandiego coming to #netflix https://t.co/NOmG7r6x8K","@andresflava","cultural-icon",
"Gina Rodriguez to Star as Carmen Sandiego in Live-Action Movie for Netflix! https://t.co/doETSlSkEI","@dumonttelev","cultural-icon",
"Tips for hiding dark circles under your eyes: • Concealer • Stand in the shadows • Wear large hats • Buy a red trench coat • Never stay in one place long enough for anyone to see them • Become Carmen Sandiego","@deapoirierbooks","cultural-icon","x"
"Gina Rodriguez, ‘Stranger Things’ actor, to lend voice to Netflix’s ‘Carmen Sandiego’ https://t.co/paOESrFcbG #Te… https://t.co/4KuFLAYmzh","@FrostbiteTrends","cultural-icon",
"@AmoebaSisters @iamscicomm I recently played Magic School bus and it was really good, also tried Oregon Trail And Where in Time is Carmen Sandiego -both so hard!","@GeneticCuckoo","cultural-icon",
"@manilaluzon @teammagph This ""Carmen Sandiego But Fashion"" look is 😙👌","@kitchenwitchin","fashion",
"@Snarkyname @Gray_DM @LeeMinSaya @ChipBrent @Tatted_Dread_ I just took it as him being appalled by how gay Carmen Sandiego's hat is on dude.","@Rasputin_RGLM","fashion",
"LADIES imagine this, It’s 15 years from now. You’re travelling all across the globe. You have a large collection of priceless artifacts. You wear a giant red hat and trench coat all the time. You’re international criminal Carmen Sandiego.","@KevinWPriolo","fashion","x"
"A Carmen Sandiego Reboot and it actually looks decent!? Well I can't wait to see how this goes! ^-^","@Renaki05","cultural-icon",
"VIDEO: 10 Reasons Where in the World Is Carmen Sandiego? Was the Best Educational TV Show … https://t.co/UKZX7PSp6c https://t.co/HEc1gkdsz2","@chardmedia43","edutainment",
"Where in the world is Carmen Sandiego? #halloween https://t.co/N6bMSN0gTz","@MissElizaProps","fashion",
"Gina Rodriguez Will Reportedly Voice Carmen Sandiego in Netflix Series https://t.co/j5u5XuGf5L via @JustJaredJr","@priscilatosate","cultural-icon",
"@huffiepuffie — Carmen Sandiego (Where on Earth is Carmen Sandiego?) https://t.co/kiynIEe8FB","@huffiepuffie","cultural-icon",
"Netflix's 'Carmen Sandiego' debuts on January 19th, 2019 https://t.co/IOrNkAGai1 https://t.co/vHC5WnNfrQ","@CATechCouncil","cultural-icon",
"Looking for Carmen Sandiego (@ Newark Liberty International Airport (EWR) w/ 62 others) http://t.co/YfNRmORdzE","@NickFoden","travel","w"
"Harden stay traveling more than Carmen Sandiego","@Trifecca","travel",
"When you find that one friend who says "" I learned that historical fact from the Carmen Sandiego game too!"" #whataday #booyah #classic","@BeccaE23","edutainment","x"
"Gina Rodriguez Will Play Carmen Sandiego In New Netflix Reboot https://t.co/ReasLrtRYN","@1045thecat","cultural-icon",
"A4) I create creative lessons that turn my classroom into an FBI office to find Carmen Sandiego or a Bakery. I love having my students unsure of what might happen next and excited to come to class. #KidsDeserveIt","@teaching_power","edutainment",
"Last night I dreamed that I was wandering Florence in Bedelia's blue Carmen Sandiego outfit. Can I go back to Italy now, please?","@Kbethery","cultural-icon",
"Who is the best Halloween couple costume, Carmen Sandiego and Where's Waldo or The Tapatio Man and Cholula Girl?","@westsidecomedy","cultural-icon",
"Always asking WHERE in the world is Carmen Sandiego but never HOW in the world is Carmen Sandiego","@JamesZintel","cultural-icon","x"
"Random but -- OMG I'm about to be Carmen San Diego for Halloween","@BeckuhBeck","fashion",
"Carmen Sandiego Series in the Works at Netflix https://t.co/cvukC1Bwde https://t.co/4rvQuudl8y","@Every_Game_News","cultural-icon",
"@sgrstk Carmen SanDiego was the original manic pixie dream girl. Shows up, takes something important, disappears, and claims they're both better off","@UpThePieFights","cultural-icon",
"@FBE Suggestions for reactions and LPs: React - The Bill (UK TV show 1984-2010), NCT (K-Pop), Michael Rosen (UK poet and meme), Knightmare (UK TV show 1987-1994) LPs - Myst, Edutainment games (Oregon Trail, Carmen Sandiego, Dorling Kindersley)","@EastXWestMusic","edutainment",
"netflix is doing...carmen...sandiego??","@karykeion","cultural-icon",
"Thank you @javier_san Hopefully this would help your search with Carmen San Diego. Captain America… http://t.co/7X5dNGAo6d","@According2Frank","cultural-icon",
"Sounds like Netflix is bringing back ""Where in the World is Carmen Sandiego?"" https://t.co/FlA9z36FGS by #HuffingtonPost via @c0nvey https://t.co/S609aeBFXE","@thefixitagent","cultural-icon",
"Our Childhood Dreams Have Come True: Gina Rodriguez Is Playing Carmen Sandiego On Netflix – we are mitú https://t.co/XqyEYUZC2w https://t.co/6zCcNyZnpe","@EllevateNtwk","cultural-icon",
"Where in the World Is Carmen Sandiego? Becoming a Secret Travel Agent https://t.co/JyTyWqDlXw","@hackernewsrobot","travel",
"I feel like Carmen Sandiego at work today","@ClayBeez","cultural-icon",
"#WhereintheworldisCarmenSandiego so need to bring this show back! #geography #Carmensandiego… https://t.co/1mLQjgpFqG","@TheMonaShai","cultural-icon",
"One of Sombra's legendary skins should be a Carmen San Diego outfit.","@kyriscrass","fashion",
"Gina Rodriguez Voicing Carmen Sandiego in Netflix Show https://t.co/nzXtCj6VRU https://t.co/LhdZu0J7iw https://t.co/5xrSM9PF7a","@ninjion_feed","cultural-icon",
"@ChrisFaber39 I’d rather have a spin-off of “where in the world is Carmen SanDiego”","@Jacksonfromcoq","cultural-icon",
"Home 3 days ago, Miami in 2. Call me Carmen Sandiego","@jackielopezxo","travel",
"Carmen Sandiego Is Getting Her Own Animated Netflix Series https://t.co/ga56sK9Jj3","@jasonwhit","cultural-icon",
"Would you rather travel the world with: - Dora The Explorer and Diego OR -Carmen Sandiego and Waldo #commentbelow!!! 🌎🌍󾀹","@nicholasfactor","cultural-icon",
"Chuck Norris always knows the EXACT location of Carmen SanDiego.","@i_can_code","cultural-icon",
"@lukezim Sir, if this is meant to be a dig at Ms. Carmen Sandiego, I’ll kindly ask you not to compare a legendary geography thief eluding Interpol to a First Lady eluding home life. Pay some respect. But, long story short, from your photo it would appear that Carmen Sandiego is in Egypt.","@Jeff_Dub","cultural-icon",
"someone's got to be able to help Carmen Sandiego keep her phone charged and the geography geeking coming","@ksej","cultural-icon",
"My kids may never know how great this is. Mostly because we don’t have a cassette tape player. #Whereintheworld #carmensandiego @PBS @RockapellaMusic #parenting https://t.co/jvkJQPzUiG","@ginnytjones","cultural-icon",
"The Where in the World is Carmen Sandiego Bowl. #RejectedBowlGames","@SqueeksMcGee33","cultural-icon",
"Netflix Casts Gina Rodriguez as Carmen Sandiego in Live-Action Movie AND Animated Series https://t.co/PYRR421gbu #dating #free #4flirt https://t.co/AFnW1P0PkK","@www_4flirt_org","cultural-icon",
"@DaleVsTheWorld traveling the world with Carmen SanDiego.","@_shanakin","travel",
"Carmen Sandiego' Reboot Headed to Netflix https://t.co/NrmwLLohQG https://t.co/0zBKQBG45a","@NoticiasEnglish","cultural-icon",
"is it too late for blurry halloween selfies??? ...Too bad #mylove #catwoman #carmensANDIEGO #funknight… http://t.co/BoUzpmdFCf","@dionyeezus","fashion",
"With the mention of ""road trip"" from a Bieber the whole fan base is bringing back their where in the world is Carmen SanDiego skills","@MissManD143","cultural-icon",
"Feeling like Carmen Sandiego! Where in the world could I be today? 🌎 @southwestair #travel… https://t.co/E2EhDAKQDX","@MrsBazis","travel",
"@KaiserNeko That or Trunks playing something about time travel. Maybe Carmen Sandiego?","@TValiar","travel",
"Wait!✋is Netflix seriously making ""where in the world is Carmen Sandiego?"" Into a series???... I think I'm gonna cry","@nanziridawn","cultural-icon","x"
"Daily Podcast: Captain Marvel, Stranger Things 3, Solo, Star Wars, Carmen Sandiego, Netflix, and Pacific Rim Uprising - https://t.co/vb77SGzDUE (via @SlashFilm)","@TheStarWarsBlog","cultural-icon",
"DEADLINE: ‘Carmen Sandiego’ Toon Series Starring Gina Rodriguez Bound For Netflix https://t.co/3XOa5MENgS https://t.co/8iZ4ZcXecJ","@ERNESTONODAL","cultural-icon",
"Where is Carmen San Diego ?? Where is @damienaguirre ????","@tinaaleeroy","cultural-icon",
"@confettipocket For a Halloween that I was in LA for and @joematoske in NYC, we dressed as Carmen San Diego and Waldo.","@vanholdthephone","fashion",
"@TheScruffyDruid Oh noooo You could be ""where in the world is Carmen Sandiego's hat?""","@stephnoob","fashion",
"Even Adults Are Pumped About Netflix's Carmen Sandiego Reboot https://t.co/xz1W2yW4nP","@MoviesWorldNewz","cultural-icon",
"HOW DID I MISS THAT CARMEN SANDIEGO WAS COMING BACK INTO MY LIFE!!!! @netflix https://t.co/JylK6Zv329","@poormanstinafey","cultural-icon",
"Oh look: @Netflix @NetflixUK did a clever thing...AGAIN!!!! And so the video-game adaptation renaissance begins. #carmensandiego :~D","@moviemaster1993","cultural-icon",
"@CrazyJuan77 @dreyer_smit I used to play the Where on Earth is Carmen Sandiego adventure game & Oregon Trail on my Compaq Presario! Those were the days!","@Willsncz","cultural-icon",
"Netflix greenlights 'Carmen Sandiego' animated reboot - TechSpot https://t.co/68MULm8Ez6","@dung_h2","cultural-icon",
"Everything I know about the Declaration of Independence, I learned from 'Where On Earth is Carmen Sandiego?'","@teganleeoneill","edutainment","x"
"[TOP TOPICS] Sounds Like Netflix Is Bringing Back 'Where In The World Is Carmen Sandiego?' https://t.co/EJUYV2U9Pw","@LoveMYIKA","cultural-icon",
"Netflix Could Be Bringing Carmen Sandiego Back https://t.co/bq50I1Udz2","@MissChisolm","cultural-icon",
"Netflix Could Be Bringing Carmen Sandiego Back https://t.co/AJqruwt4oy https://t.co/8qjppJT7wY","@Technolizer","cultural-icon",
"#FunkoPhotoADay December 5: Something Red. Where is she now? #CarmenSandiego #Funko https://t.co/NH40QNkKhC","@FearlessRiOT","cultural-icon",
"@jhaletweets is the new voice actor for @PlayOverwatch.With such an impressive resume of games under her belt, Ashe reminds me of Carmen San Diego, a character that Jennifer hale voiced. Here is a side by side comparison! https://t.co/TZPsd7AwaA","@KAT25585970","cultural-icon",
"@KateTheHuntress I was freaking that someone else knew about it! I saw a couple girls dressed up like Carmen San Diego for Halloween.","@TenaciousGlamor","fashion",
"Trending Worldwide ‘Carmen Sandiego’ Coming to Netflix as an Animated Series Starring Gina Rodriguez https://t.co/dUZpOHKXpO","@flashnewsportal","cultural-icon",
"Tonight #CarmenSanDiego is lost in the burbs of Philly #HappyHalloween. I've got candy for the… https://t.co/4xVa4LJ4jv","@PaperFlowerWedd","fashion",
".@jefflac: ""xbox - turn off. turn OFF. TURN. OFF."" me: /sings carmen sandiego theme J: ""LENA - MUTE. Xbox - turn off.... Thank you.""","@lena_moss","cultural-icon",
"VIDEO: 10 Reasons Where in the World Is Carmen Sandiego? Was the Best Educational TV Show Ever https://t.co/1trFZ1pCXt","@kimzae5","edutainment",
"YES I loved Carmen Sandiego as a kid and gina is so so so so perfect omg 😭 https://t.co/4Zzkl25o62","@jazminsays","cultural-icon",
"Does Carmen Sandiego wear the necklace with the launch codes? #IBM #AppleIIE #WhereInTheWorld https://t.co/yfckGQ4u4t","@MattyKern","cultural-icon",
"@KimFreakinB today was very Carmen Sandiego of you. Did you wear a red cape today?","@Genx13","fashion",
"OMG!! She is coming back!! And animated to boot!! Cannot wait for 2019!!! #CarmenSandiego #Netflix https://t.co/qzibOsdYpo","@Der_Holland","cultural-icon",
"See what had happened was: ATLANTA. #whereswaldo #vacation #carmensandiego #shawty #actorslife… https://t.co/D0oFaPNYpy","@CarlKennedyShow","cultural-icon",
"Happy Halloween from the original #MissTravel! Looking for the perfect travel themed #Halloween #costume?? #CarmenSandiego #WheresWaldo https://t.co/fLChnRiTuW","@DateMissTravel","travel",
"I bet Carmen San Diego is hiding under Pharrell's hat.","@DCYanda20","cultural-icon",
"Sounds Like Netflix Is Bringing Back 'Where In The World Is Carmen Sandiego?' | The Huffington Post - I... https://t.co/VrutEkEHiP","@HtownShan","cultural-icon",
"Greenlit: Gina Rodriguez Will Explore the World as Live-Action ‘Carmen Sandiego’ + More https://t.co/uNHmhdndVj https://t.co/mgxtN0UHda","@MoviesWrld","travel",
"Theory: Carmen Sandiego is part of The Hand. #IronFist #ironfistnetflix","@TristinHuntamer","cultural-icon",
"Its a trip how it was easier to find nemo than it is to find waldo or carmen san diego #FindingNemo","@Verse1one","cultural-icon",
"Netflix finds ""Carmen Sandiego"" for its latest reboot https://t.co/HbhdCTOmKS #carmen #carmensandiego #culture #internet https://t.co/UX7wYXYgV1","@doulCiOffical","cultural-icon",
"Feelin' very Carmen Sandiego in this getup. I do hope you know who I'm referring to...😜(Also, thank you @equalupri… https://t.co/7mdqmeyGd8 https://t.co/IgkJtBDhmx","@hullosam","fashion",
"Bout to go as Carmen Sandiego for Halloween this year","@MartiniZealot","fashion",
"VIDEO: 10 Reasons Where in the World Is Carmen Sandiego? Was the Best Educational TV Show Ever … https://t.co/ICj09uXThC","@gossip_24_365","edutainment",
"Probably one of the most anticipated gifts. ""Where in the world is Carmen San Diego!"" http://t.co/OnsI3Av3sy","@Pocahontits","cultural-icon",
"You could find me on Instagram with pictures of the adventures and home improvements but I would end up like a living game of where in the world is Carmen sandiego.","@skylerzane","travel",
