"text","handle","category","star_tweet"
"Netflix is betting on ‘90s kids nostalgia for learning with upcoming lineup https://t.co/ULmrUTXdiU","@talkdaybright","cultural-icon",
"‘Carmen Sandiego’ gets January 18 premiere date on Netflix https://t.co/dEkRAgnXoU","@AmandaW29474500","cultural-icon",
"First time wearing a proper hat today (am I a hat person?) and had to remind myself: ""Put down the trench. You are not Carmen Sandiego""","@hollystair","fashion",
"⚡ Netflix greenlights a Carmen Sandiego series https://t.co/Zu1bpCQzLV","@gem_drill","cultural-icon",
"For many fortunate children of the ‘80s and ‘90s, Carmen Sandiego was their first encounter with a globe-trotting","@FeleciaMaciver","travel",
"@APEDAWG5 Carmen Sandiego’ Toon Series Starring Gina Rodriguez Bound For Netflix synchronicity😀 https://t.co/AhdFA5jMW9","@LanceHirdler13","cultural-icon",
"Was looking up Carmen Sandiego on Wikipedia to make sure I spelled it right, and discovered Netflix is supposedly making an animated show for 2019. Ahhh!!!!! Oh god, can it be 2019 now? I want to seeeee it! #Nerd","@darlingroland","cultural-icon",
"#Movie_News Netflix’s Carmen Sandiego Gets First Image Plus New Cast https://t.co/AxYMsy9O42 https://t.co/cqufnBQA5A","@EveryMovieR","cultural-icon",
"@LawyerRogelio Get her a big hat and she could easily be Carmen Sandiego.","@johnwluke","fashion",
"So excited that they still play Carmen Sandiego episodes on @qubo! Loved this show as a kid!","@kdzirkle","cultural-icon",
"Just got a sudden urge to play Where In The World Is Carmen Sandiego?","@MacDaddyNilssen","cultural-icon",
"Chuck Norris always knows the EXACT location of Carmen SanDiego.","@SarahJo25314309","cultural-icon",
"Netflix finds 'Carmen Sandiego' for its latest reboot https://t.co/AMgdXxlyve https://t.co/yHWTQUcqwq","@Siddharthjrs","cultural-icon",
"Booked my flight for Tokyo. Starting to think I might be Carmen San Diego...","@kelkesh","travel",
"Yas my role model @HereIsGina slayin' on @TheEllenShow today! 💃🏾#CarmenSandiego #JaneTheVirgin https://t.co/fzdOqDdeJS","@lreyna_17","role-model",
"⚡️ “Netflix greenlights a Carmen Sandiego series” #CarmenSandiego #Netflix #Excited https://t.co/facgkvvKsb","@KiyotsukO","cultural-icon",
"@iSmashFizzle Carmen SanDiego was a thief but she was brilliant, stylish and had the great Lynn Thigpen (RIP) as The Chief. ""She sneaks around the world from Kiev to Carolina/She's a sticky fingered filcher from Berlin down to Belize/She'll take you on a ride on the slow boat to China...""","@FountainPenDiva","role-model","x"
"@ChuckWendig Carmen Sandiego was an early fueler of my love of stylish villains.","@DoctorOffDuty","fashion","x"
"@GeorgeLA96 it’s better than that. He’s traveling the country in pursuit of the mysterious Carmen Sandiego","@the16thdoc","travel",
"I love they got an authentic Carmen Sandiego set and costumes for a 2 minute sketch.","@ziggafoss","fashion",
"I've been reminiscing about Carmen Sandiego a lot lately because I learned the word ""dossier"" from Where in the World is Carmen Sandiego.","@guydpete","cultural-icon","x"
"A little Halloween fun. 💄🎃 #carmensandiego #halloween http://t.co/UC55GCrRpu","@queenofspades14","fashion",
"You'd think a woman in a red coat and hat would be easier to find. But Carmen Sandiego is still as elusive as ever!!! >:C","@Poisonedcandie","fashion",
"Where my tweeps at? Where my car keys? Where eagles dare? Where in the world is Carmen SanDiego? https://t.co/hS8X0eVFLE","@subjacktive","cultural-icon",
"@normsantoro @JeepersMedia he and Waldo and Carmen Sandiego ran off on a chuffing jolly good adventure :)","@AEAquariums","cultural-icon",
"Gina Rodriguez To Star As Carmen Sandiego In Netflix Live-Action Feature https://t.co/8a5sd3ESPE Shared from my Google feed","@shadowboxerinc","cultural-icon",
"The rise and fall of the company behind ‘Reader Rabbit’ and all your favorite educational games https://t.co/sm1jIczX7W via @outline","@CSandusky_TCC","edutainment",
"Don't know whether to be psyched or afraid of netflix bringing back Carmen Sandiego - it has to have Rockapella.","@segsig","cultural-icon",
"@deputydipshitt I love this beautiful woman.@KatBarrell AKA Carmen San Diego. 😁🤗","@Maribel2009","cultural-icon",
"More Celebrity Gossip on https://t.co/SKz9mb7mRM - Netflix Is Reportedly Reviving Carmen Sandiego With Gina... https://t.co/hyh3QV8xvc","@FChoiceDating","cultural-icon",
"Gina Rodriguez Voicing Carmen Sandiego in Netflix Show https://t.co/XQJDPzFPhE Source: IGN","@AnubisGaming109","cultural-icon",
"@eastsincerity I LOVE EDUCATIONAL GAMES OKAY dont make me start linking carmen sandiego ones","@FluffSik","edutainment",
"@HereIsGina in a live action reboot as Carmen Sandiego why yes please add her voice to a new animated series as well.. Why @netflix you have made it possible to introduce this character to my kids so bravo!","@MasterDeighle","cultural-icon","x"
"@laevantine @TheQuinnspiracy Since it has long been my goal to be Carmen Sandiego, I have a hat available... ^_^","@StarKat99","fashion",
"Instead of Jem, they should do a Where in the World is Carmen Sandiego movie. Heists, stylized world, smart female antagonist. Writes itself","@darling_sammy","role-model",
"Netflix is making a Carmen Sandiego movie with Gina Rodriguez - CNET","@Rockykaie","cultural-icon",
"Netflix Cast's Its Live-Action Carmen Sandiego https://t.co/dOMm470ZJp","@salute_mag","cultural-icon",
"I haven't shared any new music in a while because my most recent contracts don't allow it. So here's the Gregorian Chant version of Carmen Sandiego I made for Frog Fraction 2; maybe the dumbest thing I've ever done? https://t.co/8tX3GgZa95","@RyanIkeComposer","cultural-icon",
"Netflix's 'Carmen Sandiego' debuts on January 19th, 2019 https://t.co/BNpldH385V","@MacGenio","cultural-icon",
"Ahhh this was my show as a kid 😍😍😍 I'm excited ! “Netflix greenlights a Carmen Sandiego series” https://t.co/qcPF621qcp","@fervent_ash","cultural-icon",
"Saturday Night Social: Gina Rodriguez Will Voice Carmen Sandiego in Netflix's Upcoming Animated Series https://t.co/1QqipyfIYl","@gaw_test","cultural-icon",
"#Throwback #Thursday - #where #in #the #world #is #carmen #sandiego? #edtech #education #computers http://t.co/fAvwSxKV9P","@TheAlinaGroup","cultural-icon",
"Now how does this tie into the blue Carmen Sandiego outfit? #Hannibal #MadsAndHugh","@terra_tenshi","fashion",
"Also? Emma Stone was one fedora away from auditioning for Carmen Sandiego, no? #Oscars #oscars90","@TheFirstEcho","cultural-icon",
"I feel like Carmen Sandiego, but i only know half of where the hell im going. #dissertationresearch #gradschool https://t.co/5ZYaeH4UyO","@bendenton13","cultural-icon",
"@ira @SailorScooby Offended that you would suggest that Carmen Sandiego was not already fashion.","@notabeanie","fashion",
"Jane The Virgin’s Gina Rodriguez To Star In New Netflix Series Carmen Sandiego https://t.co/ysn68f2p91","@jimivaey","cultural-icon",
"My hat swallows people. Ahhh hahahaha #CarmenSandiego'd #MyLoves https://t.co/LAcLm7p9fB","@Breanifornicate","fashion",
"@kyanmiddap @Punters @LukeBevoNQMan @J_Walter23 @armodan @Puddrix @MugPuntz1 @bennydj16 Dropping Carmen Sandiego references but forgot to mention ghost bread as his favourite punting snack FFS","@PuntingEngineer","cultural-icon",
"RollingStone: A 'Carmen Sandiego' reboot is headed to Netflix, featuring Gina Rodriguez and Finn Wolfhard … https://t.co/v4ceMrp3Xs","@milehighcompany","cultural-icon",
"Do it, Rockapella: Netflix is Making a New 'Carmen Sandiego' Show - Geek https://t.co/6gHceljp1M","@NewGamesPlay","cultural-icon",
"The new Carmen Sandiego will be________! #CarmenSandiego #Netflix #shows #filmmakers #animation","@sjfostersound","cultural-icon",
"I wanted to go on Carmen Sandiego just to meet the chief. Then marry her.","@IHatebd","cultural-icon",
"Safe travels to my best friend, Carmen Sandiego, I mean @anisiatierney","@VanessaZanghi","travel",
"Red ""Carmen San Diego"" hat. #whereintheworldiscarmensandiego #hats #vintage #muse @ Muse… https://t.co/m0QFZgtbWH","@MichiganFlyGirl","fashion",
"@greg_doucette O.T. for the win. (I will also accept Carmen SanDiego.)","@jen_cam","cultural-icon",
"Netflix orders animated Carmen Sandiego series https://t.co/i9u6Keblg1 https://t.co/HKkGeWmG39","@jealvarez","cultural-icon",
"DogFood Load On First Leg towards Home. TurkeyDay here I Come!!!! #BatOutOfHell #CarmenSanDiego 🚛🔜🗺🖍📍Minnesota (@ Smuckers in Topeka, KS) https://t.co/UVz1NzgYcK","@Pulpmind","cultural-icon",
"We found details on Netflix's Carmen Sandiego series. https://t.co/sd2gju1Q9B","@GeekCavePodcast","cultural-icon",
"Gina Rodriguez will star in and produce a live-action Carmen Sandiego movie for Netflix!!! She also voices the iconic character in an upcoming animated series https://t.co/WO75fuL0Ue","@JarettSays","cultural-icon",
"@schweinsty I loved Carmen Sandiego. *-* It was more educational than Where's Waldo. (You learned geography.) Mostly a video game and TV game show, but I think a cartoon, too.","@McNultyAmy","cultural-icon",
"just realized how unintentionally hilarious i've been in choosing to wear a carmen sandiego shirt for the ladies' free skate","@Dorianize","fashion",
"This chick @passport_cutty is a modern day Carmen San Diego... Imma buy her a trench coat","@CupCake_Capo","fashion",
"@chrislowrance The idea of a red leather Carmen Sandiego coat makes me very happy. So many hours on the Apple IIe playing that game...","@msnaughty","fashion",
"Where In The World Is Carmen Sandiego? but it’s Why In The World Am I?","@JDSaladJar","cultural-icon",
"Im tryna book studio time but @ChrisDHouse actin all Carmen San Diego🌐","@NewEraOnit","cultural-icon",
"Netflix orders animated Carmen Sandiego series https://t.co/oeIeldmyjt https://t.co/CT30f26ZBu","@eBasiony","cultural-icon",
"@RossTuckerNFL please make fun of carmen sandiego outfit erin andrews wore,its comedy gold","@CHEFofJOKES","fashion",
"#SteveHarvey looks like sexy #carmensandiego AND/OR like he borrowed #MeghanMarkle ‘s coat #nycnewyearseve2018","@babar_22","fashion",
"Netflix’s Carmen Sandiego gets a first image and Stranger Things’ Finn Wolfhard has joined the cast #carmensandiego https://t.co/YCXcivcmri","@comingsoonnet","cultural-icon",
"Carmen Sandiego is returning as an animated children’s show on Netflix https://t.co/QPsqVpUqI0 https://t.co/JMuRkdPVYU","@Gaming_NN","cultural-icon",
"Gina Rodriguez Set to Steal Our Hearts as Carmen Sandiego in Netflix Live-Action Movie https://t.co/msxBeDDdhd","@zbudgetdirector","cultural-icon",
"@anne_theriault you've got an amazing Carmen Sandiego vibe happening here. Love that coat!","@tmuchano","fashion",
"#halloween Gina Rodriguez to Voice Carmen Sandiego in Netflix Animated Reboot https://t.co/sX7WSkhMrP #socialdome https://t.co/PR6GgiIN8L","@Halloweenpirate","cultural-icon",
"Gina Rodriguez Dishes On Netflix’s Reboot Of ‘Carmen Sandiego’, Playing The Virgin Mary | Peo.. https://t.co/aN7FVGHnxQ","@InTheFame","cultural-icon",
"she is doing some of the greatest Carmen sandiego cosplay i have ever seen https://t.co/AYf61YRybN","@solomonmissouri","fashion",
"Where on the world r u Carmen San Diego @DefNotFloyd","@saboRaSinaLoa","cultural-icon",
"Halloween party here we come! #CarmenSanDiego #WheresWaldo #WeCute http://t.co/KZAnYoUw06","@CatAliceSimpson","fashion",
"les comparto VIDEO: 10 Reasons Where in the World Is Carmen Sandiego? Was the Best Educational TV Show Ever https://t.co/qf8EwxczfW","@adrianaamanuel","edutainment",
"@datingdecisions World Almanac & Book of Facts is how I would catch Carmen San Diego and her Vile Henchmen.","@holemanm","cultural-icon",
"@jaivergent and he beat up a Carmen Sandiego cosplayer and stole the coat.","@lbjb247","fashion",
"2019 ES EL AÑO DEL FANDOM noah: -abe -waiting for anya sadie: -eli finn: -carmen sandiego -the goldfinch -the turning -it 2 millie: -godzilla king of the monsters caleb: -high flying bird y stranger things 3 y la foto de los seis chicos juntos (ojalá que si)","@milliebsflower","cultural-icon",
"Netflix is Bringing Back 'Carmen Sandiego' with Gina Rodriguez Playing the Lead https://t.co/wPmGiuca4C #Fashion #Beauty","@bolddress","cultural-icon",
"New post (Where's Waldo and Carmen Sandiego...) has been published on 2017 Halloween - https://t.co/jrIUGM9VOy https://t.co/Q8L7a0vvaz","@Halloween_2k17","cultural-icon",
"Netflix orders animated Carmen Sandiego series https://t.co/RbL2KdBfoH https://t.co/W8rUFOkJjd","@nikhilhmakwana","cultural-icon",
"“Where in the World Is Carmen Sandiego"" is a 1985 #educational game I played in high school on @Apple II PC's. The player takes the role of a rookie in a detective Agency tasked to track down crooks from an organisation that have stolen famous works. #throwbackthrusday https://t.co/azKqlim4dc","@mattlovesradio","edutainment",
"Where in the World Is Carmen Sandiego? Becoming a Secret Travel Agent : https://t.co/4gSdFLuIF4 Comments: https://t.co/OYkr5IIOty","@hacker_news_hir","travel",
"Gina Rodriguez has been cast as Carmen Sandiego in a live-action Netflix show! Read all about… https://t.co/3z0fWShSPW","@SelectStartPres","cultural-icon",
"Chuck Norris always knows the EXACT location of Carmen SanDiego.","@MiaBlac72130663","cultural-icon",
"Captain Marvel, Stranger Things 3, Solo, Star Wars, Carmen Sandiego, Netflix, and Pacific Rim Uprising – /Film https://t.co/WDmhSy9Pll","@jeepeg","cultural-icon",
"Just saw Waldo leave the bar with Carmen Sandiego.... I fricking love #Halloween","@Vonwhistler","cultural-icon",
"JANUARY 18!! JANUARY 18!!! WATCH CARMEN SANDIEGO ON NETFLIX ON JANUARY 18!! WE ALL WORKED VERY HARD ON IT!!","@amandawtwong","cultural-icon",
"So Netflix is creating a show based on Carmen Sandiego starring Gina Rodriguez as her? Interesting...","@BKFinest92","cultural-icon",
"Who wore it better?? #erinandrews #carmensandiego http://t.co/UcjJrsBSKa","@APedlar86","fashion",
".@io9: Netflix's CARMEN SANDIEGO Reboot Has a New Premiere Date and Some Mysterious Teaser Images https://t.co/pLakVCEtcS","@FanbaseWeekly","cultural-icon",
"All I could dream about it tracking down Carmen Sandiego.. @Gregersss @NicoleTrain","@JLKane02","cultural-icon",
"#RenewAgentCarter because we still haven't heard the bit where Peggy gives her hat to Carmen Sandiego during her supervillain origin story","@DubiousCA","fashion",
"@White4630 @rebeccaburcher Isn't it Carmen* SanDiego?","@Big_Dave52","cultural-icon",
"News: Sounds Like Netflix Is Bringing Back 'Where In The World Is Carmen Sandiego?' https://t.co/MST2ujjssU","@bbltweet","cultural-icon",
"Cookie looks like Carmen Sandiego in that outfit. I like.","@trice10552","fashion",
"#ParentPickedLiked Sounds Like Netflix Is Bringing Back 'Where In The World Is Carmen Sandiego?' https://t.co/52pk6aZRrf","@ParentPicked","cultural-icon",
"My ideal woman: Carmen Sandiego.","@SirWillALot","cultural-icon",
"When is Netflix gonna add Carmen Sandiego? ヾ(･д･ヾ)","@teapearls","cultural-icon",
"@trimmau same.... same. i played So many edutainment games with my sister when i was little they were my lifeblood. miss carmen sandiego is the perfect embodiment of ""be gay and do crimes"" and even from that alone i love her games, but they really just were That Fun too","@voltorbflip","cultural-icon",
"I'm always looking for the flappy hat. I'll find Carmen San Diego 3x before I find you at Goodyear Ballpark https://t.co/1IMFC2lpN7","@byJeffRich","fashion",
"@AgentKuo 13 dead end drive, where in the world is carmen san diego, clue, settlers of catan, deutschlandreise, battleship, boss monster","@beverlymantle","cultural-icon",
"Using her trench coat and hat as a wind suit/parachute, she has to hide out in cities across the globe where not as many people have heard of her so she can stay incognito. #CarmenSanDiego #videogameidea https://t.co/SWcqOqVRpR","@CandleCTM","travel",
"Gina Rodriguez will play Carmen Sandiego in the live-action movie: #Netflix has found… https://t.co/fbNu6JdDjj #tech","@Trending_Global","cultural-icon",
"@OsitaNwanevu This description makes it immediately the 2nd best version of Carmen Sandiego, right behind the 1991 PBS game show, which is amazing.","@GameShowGarbage","cultural-icon",
"@JoshuaJMills @mdriddlen it’s like where in the world is Carmen Sandiego except the prize is a bland game designer who I don’t like.","@JASlingerland","cultural-icon",
"@dianasaladpot Ya boy probably thinks Carmen Sandiego is some designer he's never heard of.","@katt_j83","fashion",
"Things I ponder when I can't sleep....if Waldo and Carmen Sandiego got married, would it be a non stop adventure, or a constant game of peek a boo, with no winner? #SleeplessInCalifornia","@RockinMissMolly","cultural-icon",
"Give kathern mcfee a red hat. We finally found Carmen Sandiego !!! #superbowlcommercials","@H3rlth","fashion",
"Get a first look at Netflixs Carmen Sandiego animated series https://t.co/gtTtyyvK9n https://t.co/NJ2rrBmoar","@viralcrusher","cultural-icon",
"If she can't tell you about Ghost Writer, Carmen San Diego, Bill Bye The Science Guy or The Magic School Bus. She too young for you.","@Kobe_Luck","cultural-icon",
"Already have my next Halloween costume planned out. Carmen Sandiego. My date&39;ll go as Where&39;s Wally. Always wanted to do that","@nealpx898","cultural-icon",
"Gina Rodriguez to Star as Carmen Sandiego in Live-Action Netflix Film https://t.co/jclgauINmB","@MidChildPress","cultural-icon",
"@iwata77 I wish I wore a fedora and a beige trench coat so this would make sense! 😂😂 #carmensandiego","@jvhtu99","fashion",
"Gina Rodriguez, ‘Stranger Things’ actor, to lend voice to Netflix’s ‘Carmen Sandiego’ https://t.co/F15yNjregx https://t.co/MRQICVPgjB","@sonuise","cultural-icon",
"@katdvs We were poor. I got to play Oregon Trail & Carmen Sandiego in elem. In jr high learned Printshop...and that's about all my training.","@Samantha12Jane","edutainment",
"Just realized the best cosplay photo would be Waldo and Carmen Sandiego together.","@j_hat","cultural-icon",
"Carmen Sandiego has to be in crippling debt. Those trips aren't cheap and she can't make any money with what she steals. You can't pay rent with The Gargoyles from Notre Dame Cathedral.","@iam_owens","travel",
"Netflix orders 'Carmen Sandiego' with Gina Rodriguez: https://t.co/HU7dCNCNhd - Latest News - https://t.co/J61HAQSQiB #Latest","@breakingnews_no","cultural-icon",
"Gina Rodriguez donning red fedora and trench coat of Carmen Sandiego https://t.co/V9d2Xuihsr https://t.co/TFSE4zJKOF","@alenoir","cultural-icon",
"Geek Girl Mistress Zelda's wonderful Carmen Sandiego cosplay: https://t.co/xkXZFgTnPt","@geekxgirls","fashion",
"We found her! Now #ThatsWAYSanDiego! Apparently Carmen San Diego is in New Durham. Great costume @SabSpellman https://t.co/FuOpiwo804","@WaySanDiego","fashion",
"Have to be up early tomorrow to catch a train but I'm up trying to download Where in the USA Is Carmen Sandiego because I go hard the paint.","@BrandonS002","cultural-icon",
"@THR @davidagreg @HereIsGina @netflix Where in the world 🌍 is... Carmen Sandiego? 👏🏽","@TKagee","cultural-icon",
"Carmen Sandiego Is Officially Happening With Gina Rodriguez at Netflix https://t.co/e6v3MAyOe9","@AMNAYzh","cultural-icon",
"@megkmag this look has been called courderoy carmen sandiego, or, one might say......Courderoy Diego","@megkmag","cultural-icon",
"We went to Pokemania in the Mall there and bought a Korean Boy and had him in our trunk throughout the trip. The KPop star was a gift for @TheNerdChef little sister. Also Carmen Sandiego and Waldo Found Together, https://t.co/jFVdsMzUjO","@LadyFoxHeart","cultural-icon",
"#nowplaying Where In the World Is Carmen Sandiego? by Rockapella http://t.co/TftkkEtY5E","@atyamasu_bot","cultural-icon",
"I'm downloading ""where in time is Carmen sandiego"" to my laptop and I have to wait like 8 hours and I'm not sure if it'll even work 😐","@myaaadams_","cultural-icon",
"On today's edition of ""Costumes for the World Traveler"": Where in the world is #carmensandiego ?… https://t.co/NQXrNlylgo","@ISAHighSchool","fashion",
"@IndieGames_Muso @emilybuckshot Can you get reputable versions of the Carmen Sandiego games? I already loved geography/international studies before I played those but they definitely had a huge influence on me.","@ms45","cultural-icon",
"I delivered all the fruit and Christmas cheer. Now where in Carmen San Diego am I?","@BiZonkerz","cultural-icon",
"@KateTheHuntress I was freaking that someone else knew about it! I saw a couple girls dressed up like Carmen San Diego for Halloween.","@TenaciousGlamor","fashion",
"#fashion #beauty #trends Rihanna Gives Patent Leather Carmen Sandiego Vibes at the Grammys https://t.co/pHq83W4661","@TheB4DASSGirl","fashion",
"I missed ""Wear Red"" & ""Crazy Hat Day"" for @redribbonweek so I combined them today & everyone asked if I was Carmen Sandiego!😂 #ThingsKidsSay https://t.co/TgF2AqDcam","@MrsCollins1787","fashion",
"@CatMcDonnell7 haha it's much appreciated. Rio for you? Or the bay, or Chicago, or NYC? Real life Carmen Sandiego","@ChrisMWebb","travel",
"#CarmenSandiego #fanx16 #saltlakecomiccon #cosplay @ Salt Lake Comic Con https://t.co/lyGf8dxWS2","@ashleecouture","fashion",
"@Jadelle1 Looks like people were telling him that his hat looks like the hat of Carmen Sandiego http://t.co/3BUcqETAte","@Grrrr_girl","fashion",
"I finally found Carmen San Diego","@MrShots1","cultural-icon",
"To the tune of Carmen Sandiego: Where in the World is Carmin on Vacation? @AngryGalvin @MrMikeCalta","@Ryan_Redbeard","travel",
"Carmen Sandiego is returning as an animated children’s show on Netflix https://t.co/wz8Fo3UR3F https://t.co/srVQwul6tB","@GamingTday","cultural-icon",
"Netflix's 'Carmen Sandiego' debuts on January 19th, 2019: Since Netflix first announced its animated Carmen Sandiego reboot, news about the upcoming series has been, well, hard to find. Now, the studio has dropped some intriguing images from the series… https://t.co/GJ4ZDL7Ynx https://t.co/16p22eq4Nk","@bdnews24","cultural-icon",
"Gina Rodriguez to voice Carmen Sandiego in Netflix animated series: https://t.co/Oq0e0apfV2 via @BrowBeat","@miss_runiverse","cultural-icon",
"Where in the world is Carmen Sandiego? #travel #River #bridge #roadtrip http://t.co/vN4X6HJIzs","@KortnyePR","travel",
"Gina Rodriguez will be donning the red fedora and trench coat of Carmen Sandiego for Netflix https://t.co/tteHPgKvMC","@TheMediaDrs","cultural-icon",
"@DragonOrca @SilverYote Don't forget The Magic School Bus and Where in the World is Carmen Sandiego?","@skynero19","cultural-icon",
"@Sererena you know, if that hat were red you would make a killer Carmen sandiego","@shadesfox","fashion",
"Already have my next Halloween costume planned out. Carmen Sandiego. My date&39;ll go as Where&39;s Wally. Always wanted to do that","@atkinsonupwy","fashion",
"@_h3nn3ssyD ""Where in the World is Carmen Sandiego"" always traveling http://t.co/kvZSCvTVOH","@video_kid","travel",
"@ep_birdsall @Extinction65mya @CarmenSandiejo i have a costume but if i try to swing dance in the carmen sandiego coat i will probably die of overheating","@ryfkah","fashion",
"where can i buy a carmen sandiego hat and trench coat asking for myself","@abnoormality","fashion",
"I think I just found my new Halloween costume muse 😭 link the styles sis. I was about to go as Carmen SanDiego, but this is that life.","@DjSpaSy","fashion",
"Netflix’s Carmen Sandiego Movie Sets ‘Game Night’ Scribe Mark Perez As Writer EXCLUSIVE: Netflix has tapped Game Night screenwriter Mark Perez to pen its Carmen Sandiego feature film that has set Jane the Virgin star Gina Rodriguez to topline. No direct… https://t.co/fSrxA3QuIw https://t.co/ASwWxSuBBF","@popcultrbrain","cultural-icon",
"EXCELLENT! ⚡️ “#netflix greenlights a Carmen Sandiego series” https://t.co/YN7ec6hRwD","@RobertoRiyadh","cultural-icon",
"Netflix Takes Aim At Hollywood With Gina Rodriguez's 'Carmen Sandiego' https://t.co/P2d5IdOC9G https://t.co/EoxGZxwSD3","@marcolopezjr","cultural-icon",
"Erin Andrews fashion inspiration for the day is Carmen Sandiego","@mpbirchtree","cultural-icon",
"Netflix is making a Carmen Sandiego movie with Gina Rodriguez - CNET https://t.co/086f5THZ9R","@eqlia_nozomu","cultural-icon",
"The whole gang👻 #halloween #jigsaw #dayofthedead #skeleton #carmensandiego #zombie by jillybee24 http://t.co/THvhNvm0aM","@ZombieTacTeam","fashion",
"Sooo who tryna find me an old school Carmen San Diego game for my computer?...","@diannadenise","cultural-icon",
"@GeekGirlWren What a gem of a genre! I had a copy of Carmen Sandiego from a General Mills box, and it is STILL one of my favorite edutainment games to this DAY!","@Frankly_Emily","edutainment",
"Wait, wait, HERE is the original theme for Carmen Sandiego care of @nickyonge. With original memory-tingling footage: http://t.co/jBRurmLStM","@glassbottommeg","cultural-icon",
"""Its like where in the world is carmen san diego, only jesus style"" #Girls #GirlsNight","@Niamh_Gutierrez","cultural-icon",
"@Lord_Arse A Windows 95 Mini. Games include -Magic School Bus Human Body, Solar System, Ocean. Mario’s Game Gallery -Mario Teaches Typing -Every Super Solvers game -Mario is Missing -Oregon Trail -Battle Chess -Day of the Tentacle -Sam & Max -Star Wars X Wing -Carmen Sandiego -Math Blaster","@JeffMan1490","cultural-icon",
"Netflix’s #CarmenSandiego Animated Series Adds Stranger Things Star https://t.co/jGAjhhpEgs https://t.co/YlGdLJfRYY","@FreddieMKR","cultural-icon",
"Nostalgia Trip: Where In The World Is Carmen Sandiego? https://t.co/YVQANLTHz5 https://t.co/rhbNFjY0oM","@FredCasden","cultural-icon",
"Here for this! Gina Rodriguez (@HereIsGina) will play ‘90s super-thief, Carmen Sandiego, in the live-action Netflix film. https://t.co/2z48SrWw57 https://t.co/brj06sdvxc","@okayplayer","cultural-icon",
