"contents","author","category","star_tweet"
"If I get this, I bet I could find a matching coat... #carmensandiego #whereintheworld https://t.co/OYxAZ23fZO","@rebeccajensen","style",
"Thank you, brain, for remembering and singing every word to ""Where in the world is Carmen Sandiego?"" But not... https://t.co/zwH7BtAFa9","@Brooke_Alyson","pop culture",
"Did they ever find #CarmenSandiego? Maybe she would have been more noticeable with our OOH-RAH color on to match that red coat. #impromptu https://t.co/9FncSxFZm4","@impromptu_life_","style",
"VIDEO: 10 Reasons Where in the World Is Carmen Sandiego? Was the Best Educational TV Show … https://t.co/sYmkTh0tlt https://t.co/zkfReaQgrV","@Henry_Stradford","edutainment",
"@lazygamereviews Those were my edutainment days so all I know are like Howie Bears Great Math/Word adventures featuring Howie Mandel and the Where In Time is Carmen Sandiego remake","@PockySlice","edutainment",
"Carmen SanDiego was a great show because it taught an entire generation geography, history, and that beautiful women wil","@eulkuxenu","feminism",
"Saw Netflix is doing a #CarmenSandiego reboot!! Then I went down a rabbit hole & learned that people ship CS with Waldo of Where's Waldo.","@knsalustro","waldo",
"@dylanohernandez Damn. And I was just about to conduct a ""Where In the World Is Carmen Sandiego"" style search for Kenley.","@ucladodgerdog","style",
"Everything I know about San Marino, I learned from Carmen Sandiego. #SBSEurovision","@Scarimonious","edutainment","x"
"Another great post from the vault: Educational Games of The Past: Carmen Sandiego http://t.co/nSobkyt8Ru http://t.co/VkrPPygKsC","@MaglomaniacInc","edutainment",
"I remember always wanting to be on that #CarmenSandiego game show when I was a kid. Kids were winning trips to all of these dope places on that show.","@_3mmanuel_","travel",
"A brave super sleuth managed to track down Carmen Sandiego: https://t.co/OqRwL5M9uF https://t.co/0MlJysylqK","@coslive","pop culture",
"@Books_Pieces @London_Geekfest Yay! I'm thinking about doing Carmen Sandiego for one of the days as a fairly low key costume.","@ClaireRousseau","style",
"give her the hat and boom. Carmen San Diego lmao https://t.co/lKdXBxwH3D","@mxsteele__","style",
"So my aesthetic is Carmen Sandiego cosplay","@NellVoid","style",
"@Gamer_GFX “@Gamer_GFX: Where in the world is Carmen Sandiego?” Shes in my car man in san diego","@ALIENAIRWRECK","pop culture",
"Mind blown: I just learned that the reference books included with the Carmen Sandiego games were not only awesome, but also acted as a form of copy protection.","@arbesman","pop culture",
"Well. Video rig needs a new liquid cooling system. Not great news, but better than the motherboard, graphics card or any of the drives. That, plus maybe no more Paul Ryan and Gina Rodriguez as CARMEN SANDIEGO is news to finally fall asleep to.","@the_moviebob","pop culture",
"VIDEO: 10 Reasons Where in the World Is Carmen Sandiego? Was the Best Educational TV Show … https://t.co/F9PnzeXpEj https://t.co/RvXAMdVn0o","@JetaimCentral","edutainment",
"Lebron travel more than Carmen San Diego","@kenanbell","travel",
"A game with the gameplay of Where in the World is Carmen Sandiego?, but which looks like Half Life 2 that teaches math.","@EduGameIdea","edutainment",
"@ColorNat carmen san diego has a red coat tho... i mean 😑","@lvsre","style",
"When your halloween costume is rad as hell #carmensandiego https://t.co/PJm5ft6fmN","@SpookyEco","style",
"I owe my entire IT career to the librarian who taught me to start ""Where in the World Is Carmen San Diego?"" on the library's Apple IIe on my own, and my parents buying us a Commodore 64 with BASIC.","@zoestweets4real","nostalgia",
"Carmen Sandiego stole our drums, our time, but not our hearts. Here is the not quite educational content you crave https://t.co/cxz6kp8fno","@overplayedpod","edutainment",
"Knowing I can ignore that voice has lead me to take up a new hobby, I'm learning to play the violin, something I've wanted to do since I heard ""The Violin"" by Eileen Ivers and Brian Dewan on the Where in the World is Carmen Sandiego? soundtrack, but never thought I'd be able to. https://t.co/ogbDZcdndD","@DrFunkin","rockapella",
"Why this look like Carmen Sandiego without the hat https://t.co/qbvlqJiS1t","@BryleighTate","style",
"@cashmereblvd @FarahPink *throws on Carmen sandiego costume* found it 😩","@cashmereblvd","style",
"Carmen Sandiego is peak edutainment according to STS 351: Understanding Video Games. Where in Time is Carmen Sandiego and T.H.I.N.K Quick challenge were my jam. Still are I guess since I got the former to run on Windows 10. #CarmenSandiego #WhereOnEarthCanSheBe","@LMNaick","nostalgia",
"Lamb chop, reading rainbow, between the lions, magic school bus, Carmen sandiego, mr. Rogers man damn I'm old","@NeighborhoodRoe","pop culture",
"VIDEO: 10 Reasons Where in the World Is Carmen Sandiego? Was the Best Educational TV Show … https://t.co/nAbd7RHw71 https://t.co/xtD3P3EjJT","@Noc_Renditions","edutainment",
"Netflix is betting on ‘90s kids nostalgia for learning with upcoming lineup https://t.co/By4XGp1F8j https://t.co/SbtAPgBSUX","@AngelFofficial1","edutainment",
"@Heather_Poole get a big red hat, you're basically Carmen Sandiego now","@ColHapablap","style",
"@_leeNomein I literally had friends over to physically play Carmen Sandiego lol haha! Gettin in a parked car, driving no where. Just for imagination 😂","@_leeNomein","pop culture",
"I LOL when I heard ""She's Carmen Sandiego, she travels around the world."" They respond with ""I do too, I'm going to Puerto Rico next month.""","@laxrafs","travel",
"Hi #VisibleWomen! I’m a background artist currently working on the new Carmen Sandiego! I’ve also worked on My Little Pony: The Movie and DC Super Hero Girls. Website: https://t.co/ZMvmhS0BOi Tumblr: https://t.co/vFiz54pgx4 Instagram: https://t.co/Ig1Pxn5zs7 https://t.co/yFwack2nk1","@amandawtwong","pop culture",
"VIDEO: 10 Reasons Where in the World Is Carmen Sandiego? Was the Best Educational TV Show … https://t.co/vLq0i0p0bO https://t.co/QO6heFaXX9","@lunabonifacio25","edutainment",
"Justus hiding Waldo and Carmen Sandiego under his hat 😭😭😭😭😭","@VinceStaplers","pop culture",
"@jowrotethis Thanks! Haven't seen her in anything; should fix that. Damn, she is voicing Carmen Sandiego in a new Netflix series. How do you imagine a Kate Bishop movie? Like a Hawkeye-Hawkeye Matt Fraction-style duo or a solo thing? Either way, I'm game!","@LukaNieto","pop culture",
"@CrashGameReview @Kitsuagi I also found a small cache of edutainment games from The Learning Company, including some Carmen Sandiego games.","@DrGameAndSci","edutainment",
"I was real good at making paper planes in 4th grade & sold them for 50 cents to classmates, used profits to buy my bff a Carmen Sandiego hat","@too_lewd","style",
"Where in the World Is Carmen Sandiego? Becoming a Secret Travel Agent L: https://t.co/mCAyVj9r53 C: https://t.co/2Bp1dFk7zv","@hn_frontpage","travel",
"@JacobQKnight I love how the main characters are basically Han Solo and Carmen Sandiego. Even though it cribs from dozens of other movies (The Thing, Die Hard, The Poseidon Adventure), it still feels fresh. Resident Evil 4 even stole the finale! https://t.co/2DmKItCT7b","@SteveHughNelson","pop culture",
"@BigBird in Where in the USA is Carmen Sandiego, I use CrimeNet Travel to travel across the US.","@JeremiahLiles1","pop culture",
"@Kaylersx I found a dress that may work--it looks like what Carmen Sandiego would wear to Broadway. @GreatCometBway @joshgroban","@nurseregank","style",
"Gina Rodriguez donning red fedora and trench coat of Carmen Sandiego https://t.co/cWCsLnVxRg https://t.co/UqX1M3oK6t","@MalcomKyleSaint","pop culture",
"hi happy thursday i'm wearing a jacket that makes me look like the love child of Hagrid and Carmen San Diego","@iMakeShoes","style",
"@_AlexLawrence It would be FANTASTIC to have a ""where in the world is Carmen SanDiego"" type Go app that teaches kids about locations, etc.","@drgurner","edutainment",
"@SammNeiland @Shadolith OK so did you ever play the old Carmen Sandiego games? I want to do something similar where you're a globe-trotting>","@Proprietous","travel",
"@blairwilliamsxx Carmen Sandy Eggo? Because Carmen Sandiego has a hat like that, only red...","@protagnostic","style",
"I triggered some serious childhood nostalgia in people tonight with my costume. Never would have thought I’d have a dozen strangers giving me length speeches about their feelings on Carmen Sandiego in a bar 😂 https://t.co/gzgnqDQi6F","@halesjade","inspiration","x"
"@MollyQerim lookin fab w/your Carmen San Diego outfit 💋👀👠 @FirstTake #fabmysteriouslady","@cancerforyou","style",
"@Redray18 Lol shut ur hating Carmen sandiego ass up","@BonnieGodiva","style",
"Does Carmen Sandiego wear the necklace with the launch codes? #IBM #AppleIIE #WhereInTheWorld https://t.co/yfckGQ4u4t","@MattyKern","pop culture",
"Probably should invest in a REAL suitcase if I'm playing Carmen San Diego","@fuckroaches666","travel",
"@eehouls really hoped it would be her traveling the globe searching for Shelly Miscavage. Carmen San Diego style.","@belleisleasylum","travel",
"@Moviepoll2018 Animated (no part. order) Teenage Mutant Ninja Turtles (80s) Magic School Bus Challenge of the Super Friends Chip N Dale Rescue Rangers Real Ghostbusters Wacky Races Spectacular Spider-Man Scooby-Doo! Where Are You? The Adventures of Tintin Where On Earth Is Carmen Sandiego?","@TheMovieMan17","pop culture",
"I miss the days when my biggest concern was learning where in the world was Carmen Sandiego. https://t.co/8d5UrpUAY0","@DwayneDavidPaul","nostalgia",
"the #CarmenSandiego educational games were a sensation ever since their debut on #PC games #RetroGaming http://t.co/tBYT3GJkxS","@Scootablu","edutainment",
"@MissyXMartinez You should dress up as Carmen San Diego.","@XxkoolloserxX","style",
"If the Wide-Brimmed Hat Fits! Gina Rodriguez Will Play Carmen Sandiego in Live-Action Movie https://t.co/j4iyzxTyd8 via @POPSUGARLatina https://t.co/U7KL8uiSIp","@The_News_DIVA","pop culture",
"learning about mummification in art history and I already know it all from Where in the World is Carmen Sandiego","@capecodkyrakyra","edutainment","x"
"An Agent, a random Ski Bum, The Gentleman Ghost, and Carmen Sandiego... One rainy, chilly Halloween… https://t.co/zx1OLwWj6a","@Kusalaknits","style",
"Had so much fun playing the Where in the World is Carmen Sandiego game with my girl (she found it less fun than I did, but she’ll learn). You sort through clues about locations, stolen objects and criminals until you know what Carmen took and where she i… https://t.co/suT2SzoKUZ https://t.co/26Cm3NyH0e","@ourdailycraft","edutainment",
"Where in the world is #CarmenSandiego? #MendixWorld. And you can be, too. Just click to enter contest for free trip https://t.co/0TwFRGw6k6","@Mendix","travel",
"@PatrickZircher Civ II was the first big PC game that I really got into* *That wasn't educational. I LOVED Carmen Sandiego games","@DanielKalban","edutainment",
"Summary of upcoming #travel: I've got 2 @EatwellFarm boxes left this round & I get them 6/10 & 7/8. #EatLocalWhenYouAreLocal #CarmenSandiego","@MeghanCArnold","travel",
"@janinecompoop It’s been a long while! we should catch up. you can tell me your adventures as Carmen Sandiego lol","@Intricate93","travel",
"@gravescolleen @atkauffman @robert_kalman @bloxelsbuilder @greenway_ashley @ElisaBostwick @LFlemingEDU @travislape @theipodteacher @WickedDecent Ok, jumping in way later...so I did do Carmen San Diego, Links Golf, Ask Freud...our first CPU had a 40 mb hard drive.","@pburgstem","pop culture",
"#ThursdayThoughts Each time I wear my trench coat I expect for my bf to continually ask me where in the world is your hat Carmen Sandiego.","@JJandS","style",
"Alright I really need to start working on my Halloween costumes this year. I think for work I’m gonna do Carmen San Diego, but what for my not-work costume? I live in NE now, so I can not wear pants otherwise I’ll freeze","@gotohela","style",
"Joe- ""Do I look like a gay Carmen San Diego?"" Me - ""no, youre a gay dude & mexican, you're Carlos San Diego.""","@RADPITT_","pop culture",
"Harden stay traveling more than Carmen Sandiego","@Trifecca","travel",
"Why does @RanveerOfficial look like he stole his hat from #CarmenSandiego #umang2015","@chunkypots","style",
"1. BO knew he had to sit between them to keep MO off of worldstar 2. Why does she always have on a trench coat like she's Carmen Sandiego?","@igotlenses","style",
"@garkuo @TrumplerVision This is so much fun!!! Reminds me of playing WITWI Carmen San Diego on our classroom computer in elementary school ☺️","@emmy600","nostalgia",
"#ILovePBS I once named all the southern Spanish countries on a map thanks to the game show version of where in the world is Carmen San Diego","@WendyOKoopaZNTF","edutainment","x"
"@msneil2009 Oh my gosh, Carmen Sandiego. Taught me so much about looking for the DETAILS.","@_joshuagarrett","edutainment",
"Played Carmen Sandiego all night, such a nostalgia trip.","@markzoomy","pop culture",
"a lot of what I have learned in life came from either Carmen Sandiego or Wishbone","@belladogz","edutainment",
"#TheRewindFiles author @clairewillett 's favorite female time traveler countdown: #7 Carmen Sandiego http://t.co/g7eLJ4XED9","@retrofitpub","pop culture",
"#HowInTheWorldCan Carmen Sandiego travel so fast with TSA delays?","@Kiera_is_Kie","travel",
"is the pizza hut logo supposed to -be- something other than the roof of a pizza hut, cuz every time i look at one i just see carmen sandiego's hat","@FleetingMadness","style",
"#VOICE LIKE #MZ CARMEN SANDIEGO #AKA #CARMEN JONES#NO SACKCLOTHE#LIVE TRAVEL ECPLORE #SAFELY#IMAGINATION IS 🔑🔐🚪💰💸💵","@STAYBIG3","travel",
"@DAbruzzoTweets I researched my favorite game show Carmen Sandiego & learned it used to be taped next to Sesame Street.","@JeremiahLiles1","nostalgia",
"I used to want to be Carmen SanDiego. She was all over the damn globe","@vanitastrawberi","inspiration","x"
"@BigBird Carmen Sandiego likes dietetic food too, no wonder she's slender. Her car radio is always set to a classical music station.","@JeremiahLiles1","pop culture",
"I only used Apple computers in elementary school: Carmen San Diego, Math Blaster, Oregon Trail, etc...","@EAR_JORDAN","edutainment",
"Save ya money and travel the globe like Carmen Sandiego forget these local females.","@Cbthesoloist","travel",
"Netflix is betting on ‘90s kids nostalgia for learning with upcoming lineup https://t.co/MgzCGNK332 https://t.co/yGg3YZXAzs","@betium","edutainment",
"The day I quite literally fell into the Irish Sea and drove 100 on the wrong side of the road. I’m 👌#nofilter #CarmenSanDiego @ Northern Ireland https://t.co/l4PflyS67H","@coopscadoop","travel",
"It smashed my iPhone battery, but BBC’s AR Civilisation app is outstanding. Explore artefacts from civilisations gone by, listen to facts and investigate using a special torch. Perfect for the Indiana Jones or Carmen Sandiego in all of us. https://t.co/Vu28jlt1jv","@teachnlearnMB","pop culture",
"The '90s are back and tonight @SoniaIsabelleTV explores the TV trend with #HollywoodDarlings, #CarmenSandiego, #BritneySpears & more https://t.co/WJxn5ysIe9","@CelebrityPageTV","pop culture",
"@chrisbentzel: *sigh* I'm going to have the ""Where in the World is Carmen Sandiego?"" theme song in my head the whole flight back. @__apf__","@mikewest","travel",
"#UnexplainedPantryItems Waldo and Carmen SanDiego. I sent Dora the Explorer in to find them. More: https://t.co/ZNjb7VcD5A","@bolly_dansis","pop culture",
"@joshuagates @Discovery Why isn’t there an Expedition Unknown video game?? It could be a Tomb Raider/ Indiana Jones/ Carmen SanDiego style. Instead of fighting, make the players solve puzzles and riddles. Ancient maps to decode, and traps to avoid.. must have diving.","@WillieEaderBush","pop culture",
"Johnny took inspiration from his childhood hero Carmen Sandiego this week","@suhsquatch","inspiration",
"Carmen Sandiego for halloween i think but i'll have to find a neat red trenchcoat.","@formetopoupon","style",
"#metvwonderwoman. Ooh, Diana’s rocking her Carmen Sandiego hat!","@Nelson63L","style",
"@aliciadear @thebestjasmine i also think you would look great in carmen sandiego's outfit","@aliciadear","style",
"No joke, there is someone dressed like Carmen Sandiego on my flight. She has a huge red floppy hat and red dress. Why? What is your life?","@ElizabethCalos","travel",
"Raising a 90's kid. She's legit addicted to Roundhouse, Where in the World is Carmen Sandiego? , Animaniacs, and The Adventures of Pete & Pete. Kids at school like https://t.co/H1lEDhw0Vr","@ShitcoinSherpa","pop culture",
"@adambellow rocking his opening with a trip down memory lane! #oregontrail #carmensandiego #FETC #TechShare","@jenhencken","pop culture",
"Where on earth is Carmen Sandiego? Sitting next to me on the bus, and she has her eyebrow pierced now.","@SophieElisabeth","fashion",
"@Ginger_Zee loving the look! Very ""Where in the World is Carmen San Diego""-chic. #GMA #fashionista #iheartginger. https://t.co/uMLEqVh4ox","@MTimHossain","style",
"#MyGamingStart was probably Farmer Jane's Ponds on the Apple][ in our classroom, in 1990. Then Carmen Sandiego the year after. I got a Sega Master System II in maybe '93-94, so Alex Kidd","@phluid61","nostalgia",
"VIDEO: 10 Reasons Where in the World Is Carmen Sandiego? Was the Best Educational TV Show … https://t.co/YUvAVAopz3 https://t.co/36RirwrXDF","@masecdante","edutainment",
"@artsyomni If she maintains the pantsuit and Carmen Sandiego fedora, I'm down with it.","@StephenJPlant","style",
"In 4th grade, I would show up an hour before school started so I could play Carmen Sandiego on the classroom PC https://t.co/O0EEoOCjNl","@andyjayhawk","edutainment",
"Thought for Halloween NEXT year: Elroy Jetson Carmen SanDiego Pop Art Patrick Bateman!","@ArmandoGJR","style",
"I’m still geeked over the fact I saw someone in a Carmen Sandiego Halloween costume Saturday night. I absolutely LOVE Carmen Sandiego! Watched the show and played the computer game religiously!","@TRTGFC","style","x"
"channeling my inner carmen sandiegio 🕵🏻‍♀️😉 :::: have to admit i had no idea who carmen sandiego was until david told me my outfit looked like her 🙈 as a kid i was so loyal @disney if they… https://t.co/YBAL0Uzt6L","@JazzyElias","style",
"I have a long red coat at home so now I can dress up as carmen sandiego any time I want #kubecon @RedHat https://t.co/VvZQBKtApU","@charwarz","style",
"@DesertBus thank you for singing the Carmen Sandiego theme song. All the nostalgia!","@ktbates22","pop culture",
"@chillibeanboy @MatthewWolfff Well she glides around the globe and she'll flimflam every nationShe's a double-dealing diva with a taste for thieveryHer itinerary's loaded up with moving violationsTell me where in the world is Carmen Sandiego? the song is now stuck in my head","@Jacala63","pop culture",
"#MeetTheHoosiers Jr. Close D Matt ""Frat"" Roberts. Fun Fact: Is on a quest to find Carmen Sandiego in Seville, Spain. https://t.co/tMDiGjLm62","@IULacrosse","travel",
"https://t.co/1VF5tG1OXT Gina Rodriguez to Voice Carmen Sandiego in New Animated N... https://t.co/ngGLXbFXZA #hollywood #celebrity #fashion https://t.co/8ASfpneTMs","@CelebStarzNews","pop culture",
"Also, anyone remember Carmen Sandiego? It’s how I learned geography. I met Greg. He was awesome! My dad was a trooper for sanding in line with me for five hours. https://t.co/38kgYapzwu","@adventuresmissa","edutainment",
"1. What you wear is part of how you communicate. Fashion is often more powerful than words. 2. Then don’t travel the world dressed like Carmen Sandiego.","@SabrinaMaddeaux","travel",
"Issa got on a Carmen San Diego coat she gon pass out #InsecureHBO","@CerromeRussell","style",
"hnnnngggggggg carmen sandiego was my actual childhood hero who made me gay","@starsinmist","lgbt",
"At work. Silly. #Halloween #carmensandiego #dressup #costume https://t.co/igOPNnRiCl","@the_popester","style",
"Everyone is looking for me but I’m just trying to find myself 🤓🎃 — #happyhalloween #happyhalloween🎃 #halloweencostume #halloweenmakeup #halloween🎃 #halloween2018 #govgeek #wednesdaywisdom #waldo #whereswaldo #carmensandiego #cosplay @TheChicGovGeek @TheGovGeeks https://t.co/E7YaxcBtxD","@JavierLopezMSA","style",
"VIDEO: 10 Reasons Where in the World Is Carmen Sandiego? Was the Best Educational TV Show … https://t.co/y4C56xCfjX https://t.co/tk8ouFNoKO","@Charlesc85","edutainment",
"I think I should be Carmen Sandiego for Halloween.","@NCogsmith","style",
"@kchironis I was homeschooled for several years, so edutainment was my bread and butter from age 11-13. Carmen Sandiego, Castle Explorer, the Way Things Work, Oregon and Yukon Trail, Magic Schoolbus, Journey of the Zoombinis. When I was a bit older, I played Escape Velocity for HOURS.","@ButWhatIfNeige","nostalgia",
"spatscolombo: So I accidentally learned today about this thing where lots of people ship Carmen Sandiego... https://t.co/UvKuNzgepC","@Rhube","waldo",
"where in the world is Carmen Sandiego? halloween 2013 https://t.co/Zpe5mGg6P6","@Aye_Nikk","style",
"Gina Torres looks like a drop dead gorgeous Carmen Sandiego in that hat and I’m there for it","@mrsngng","style",
"@jemelehill Stephen...never...ever...being able to find Carmen San Diego would drive anyone insane... https://t.co/HB0mGJYjuV","@90305_","travel",
"SNL tries some edutainment with Where In The World Is Kellyanne Conway? https://t.co/ENqJol4z1u","@digg","pop culture",
"@annfosterwriter @DEADLINE I was already planning on re-purposing my Agent Carter hat for a Carmen Sandiego Halloween costume and now it turns out I'm not just nostalgic, I'm on trend","@vikkivansickle","nostaligia","x"
"Where In the World Is Carmen Sandiego? Why, she's in each of our hearts each time we learn and then immediately forget geographic trivia.","@DKinMN","edutainment",
"#30DayGamingChallenge TUE: Holy villainous team-up! #Hazama, #DrEggman, #ShangTung, #Bowser & #CarmenSandiego form my villain team! https://t.co/5w3KwzihkI WED: Heroes unite! #Cortana, #Tails, #JohnnyCage, #Sakura & #Yuffie assemble to battle them! https://t.co/WcvDCxQQmE","@mattdoylemedia","pop culture",
"Cant be Carmen Sandiego without my hat. Where in the world did I put it? #Halloween","@Aviewfromabroad","style",
"JoJo is pretty OK because the muscle dudes learn magic from Carmen Sandiego","@dualhammers","pop culture",
"Every day is International Women's Day when you're Carmen Sandiego","@allie_kolb","feminism",
"Law goes on a different adventure every day. Like Carmen Sandiego or sum shit.","@YBG_JBo","travel",
"I dreamt I cosplayed/crossdressed (Cross-Played?) as Carmen Sandiego for a Con, and I woke up just as I saw myself in the mirror and realized I was wearing the Hat wrong. Thinking back at it, I think I can pull it off with the right kind of Training...","@CJHuaman94","style",
"@krystlecruz safe travels ... Where are you off to now ... you're coming like Carmen San Diego #whereintheworldiskcruz #krystlecruises #kcru","@Mad_H_A_T_T_E_R","travel",
"@c_sirrah and that red coat bruh. Legit call her Carmen San Diego","@FrannyDiva","style",
"@jhaletweets Love some Carmen Sandiego. She is the Learning Thief.","@Jeice_Burter","edutainment",
"VIDEO: 10 Reasons Where in the World Is Carmen Sandiego? Was the Best Educational TV Show … https://t.co/yCGel6oZYZ https://t.co/MNA6gTaH6v","@lelyons3","edutainment",
"Carmen Sandiego was the baddest Spanish bitch on the block","@VulkanKrusader","latina",
"Gina Rodriguez donning red fedora and trench coat of Carmen Sandiego https://t.co/a47PMfRY4J","@DavidPapp","pop culture",
"@chelsaya you're one gigantic hat away from being Carmen Sandiego","@ForTheLark","style",
"I was glad many people recognized my Agent Carter cosplay yesterday! I only got a handful of ""...Carmen Sandiego?"" Which, fair. #LCTC2015","@EscoDingo","style",
"The comunista almost through me for a loop. 1985, Mari. 1985. Next stop, Moscu. #Case4 #Spanish #CarmenSandiego http://t.co/3Njh7OcxMy","@GoldStarMarimo","pop culture - game",
"#tbt to the time I was trying to be like #CarmenSanDiego on our family vacation in #Islamorada a… https://t.co/Y4L3SrJs8h","@LorenMcCollom","travel",
"#TBT to Janese Swanson, inventor & founder of Girl Tech + co-developer of the first Carmen Sandiego educational games. #womenintech https://t.co/0GSwx78YHd","@girldevelopit","pop culture",
"@Baldini1 @juliephayer I found it, shoutout to Carmen San Diego for teaching me excellent hunting and research skills: http://t.co/MAGwadiSns","@Baldini1","edutainment",
"This Pup Has Traveled The World, And Has Drool-Worthy Pics To Prove It Move over, Carmen Sandiego, this adventuro http://t.co/m36gKv5eRp","@JustDan_please","travel",
"@RedheadBabyMama I love Carmen SanDiego! Enjoy your adventures!","@Janelle3480","travel",
"Where in the world would you go this #TravelTuesday? Our US Copywriter is missing the red rocks of Western Colorado. #carmensandiego https://t.co/lT0vCqSm3Q","@Travall_CA","travel",
"Airport security just told me I look like Carmen San Diego. My regular outfits look like costumes.… http://t.co/PssmgfpoMk","@AniZargar","travel",
"@AshleyEsqueda nobody should judge anybody for wanting Carmen Sandiego on any platform. It’s a good educational title, there are so few.","@waynedixon","edutainment",
"""Carmen Sandiego is an American media franchise of educational computer games and other media featuring a thieving villain of the same name""","@grodaeu","pop culture",
"one day i'm going to dress up as Carmen Sandiego and run around Epcot April 03, 2015 at 11:39PM","@LiveinADHD","style",
