"text","handle","category","star_tweet"
"Everyone is graduating but do they really know where in the world Carmen Sandiego is? College doesn't even teach the important things.","@NicCageBlows","edutainment",
".@Netflix ordered 20 episodes of #CarmenSandiego reboot—set to premiere in 2019 w/... https://t.co/B8ovCONZ4H by #THR via @c0nvey","@obe_olusegun","cultural-icon",
"Netflix is betting on ‘90s kids nostalgia for learning with upcoming lineup https://t.co/OBB0TAm99P #Polygon","@VideoGameNwsBot","cultural-icon",
"@ViolenceJones i can only speculate why this song was on the carmen sandiego soundtrack of all things. thank you rockapella","@ViolenceJones","cultural-icon",
"On the lowest of keys, PBS had the most fire children's programming in the 90s. Arthur, Magic School Bus, Bill Nye The Science Guy, Kratt's Creatures, Where In The World Is Carmen San Diego.","@thatkneegro","cultural-icon",
"Netflix is betting on ‘90s kids nostalgia for learning with upcoming lineup https://t.co/QKCa6GI7E8 https://t.co/aNpFMFC1SA","@HACKhalo2","cultural-icon",
"Gina Rodriguez to play master thief Carmen Sandiego in new series. debuting in 2019 on #Netflix https://t.co/cduxRCfUsN","@DamianEudy","cultural-icon",
"Bedelia looks like she's wearing the blue version of Carmen San Diego's outfit. #Hannibal #HannibalPremiere","@kt_pumpkinhead","fashion",
"lmfao i was looking through the CDs in my car and i have a carmen sandiego cd in the passenger side map pocket","@falldamaged","cultural-icon",
"I learned about Interpol thanks to Carmen Sandiego. And I learned the importance of camouflage thanks to Waldo.","@introvertedwife","cultural-icon","x"
"@HabItHerWay I like how it's called the ""Women's World Traveler"" and not the ""Carmen Sandiego""","@SpikeC20","cultural-icon",
"""New plan for Halloween: you dress as Waldo, I’ll dress as Carmen San Diego. We can just hide in a..."" http://t.co/0fezLiPLks","@EpicBert","cultural-icon",
"The fierce Gina Rodriguez will star as Carmen Sandiego in the upcoming Netflix film. @REMEZCLA","@alpfa","cultural-icon",
"Photoset: ickaimp: 10 Costumes and Moments that made me giggle at Katsucon. Carmen SanDiego and Waldo are... http://t.co/zzAUc0lE2x","@LinuxScouser","fashion",
"WHAAAAAT?!?!?!!? ~It's Official: #CarmenSandiego Is Getting Her Own Animated #Netflix #Series~ https://t.co/Zroby7SBXy via @io9","@K41N_of_2358","cultural-icon",
"Nostalgic I miss Mario Teaches Typing, Oregon trail, Math Munchers, Kid Pix & Where in the World is Carmen San Diego. All gaming on a Mac!","@KnownGoodGeek","cultural-icon",
"Working on my Halloween costume & watching the live gameshow of Where in the World is Carmen Sandiego?...they break the 4th wall a lot!","@bookluvr8705","fashion",
"Netflix is developing a live-action Carmen Sandiego movie: Netflix is developing a live-action film based on the classic edutainment video game series Carmen Sandiego, according to entertainment industry website Deadline. The series - which begin in 1985… https://t.co/5caBClUgv9 https://t.co/yBBMoX0O1G","@zimisss","cultural-icon",
"@JiaSpice somewhere with carmen sandiego","@AV_225","cultural-icon",
"Netflix plans live-action 'Carmen Sandiego' film with Gina Rodriguez https://t.co/AwxPxyG0J8 https://t.co/LdTLz78EQ8","@vvvncs","cultural-icon",
"So stoked #carmensandiego is making a come back with the new app. Now I have a whole 6 red head Halloween costume options! #redhead","@mullis_sarah","fashion",
"Sorry if this is not feminist enough for u guys but imho Carmen Sandiego WANTED to be found","@lynnbixenspan","role-model",
"@widowmercy Very nice, reminds me a bit of Carmen Sandiego lul","@Megaalberto96","cultural-icon",
"Move over, Carmen Sandiego. Hit the road, Oregon Trail. Kids should be learning to mine and (by btc_rofl) [internal] http://t.co/4W0girOQwF","@r_Buttcoin","edutainment",
"Netflix orders animated Carmen Sandiego series #robots https://t.co/axb7zC0k1C https://t.co/Hq9wzzZlKy","@_SleauxMeaux","cultural-icon",
"Netflix Is Reportedly Reviving Carmen Sandiego With Gina Rodriguez https://t.co/sVlJ3cSo9X","@HispanicNews","cultural-icon",
"@darciebean I'm with u on this....... Get ur hat and coat Carmen San Diego..... We're gonna fish 🙅😂😂","@kutu_michael","fashion",
"@cakemittens i really saw carmen sandiego and thought “wow there’s a show about car men in san diego”","@MeepisMurder","cultural-icon",
"I'm on a flight to Tokyo any KidSuper kids out there?? I need a guide lol #carmensandiego","@KidSuper","travel",
"@TheONLYValMac On a beach, feet up, with Carmen San Diego....Throwback “@TheONLYValMac: @JayREllis now where are you? :)”","@JayREllis","travel",
"Where's Carmen San Diego? Put yo number in my phone","@Nico_Yeah_Bitch","cultural-icon",
"What Netflix’s New Carmen Sandiego Show Will Actually Be About https://t.co/QXvhxBrmtw https://t.co/8iFnTSRKWL","@Arka_kharismaaa","cultural-icon",
"@BitterSonicsFan I saw that I was like Carmen Sandiego is a fashion icon. How dare you?!","@upthetwerx","fashion",
"VIDEO: 10 Reasons Where in the World Is Carmen Sandiego? Was the Best Educational TV Show … https://t.co/lzqOnf1ZMV https://t.co/EiwO5WcA0H","@norfaiz","edutainment",
"@mogwai_poet finally getting around to FF2. Thank you for realizing my childhood dream of ""Where in the Hell Is Carmen Sandiego"".","@luvcraft","cultural-icon",
"Carmen San Diego and I at the 90s themed halloween party... A lot of great costumes there...… https://t.co/kjWWJohI2B","@KDuds8","fashion",
"Kourtney Kardashian Takes Younes Bendjima on a Surprise Birthday Trip Oh, the places they'll go! Kourtney Kardashian channeled her inner Carmen San Diego for Younes Bendjima's birthday--and no, we're not talking about a role-playing fantasy.... https://t.co/Bw8KaYfSuJ","@davenorton84171","travel",
"That moment when you aren't wearing your glasses & you think you see Carmen San Diego riding a unicycle down the sidewalk #sadbuttrue #blind","@Alana_Wa","fashion",
"Carmen Sandiego also committed multiple murders, but Broderbund thought knowing that might distract you from geography facts.","@ShadowTodd","cultural-icon",
"@VillasSnake you should invest in a trench coat and hat a la Carmen Sandiego. #HitItRockapella","@DailyDisasterYo","cultural-icon",
"okay i give up this cutlery show does not exist but i have onw remembered how bad iw anted to bang carmen sandiego as a child","@harpymonet","cultural-icon",
"El Chapo is your Real Life Carmen San Diego","@Only_Tony_","cultural-icon",
"Lindsay Lohan Dresses Up as Carmen Sandiego http://t.co/NUBna0cd14 - The Blemish","@HollywoodHoneys","fashion",
"You know that old kids show ""Where in the world is Carmen Sandiego?"" What we need: ""Where in the world is Harry Styles?""","@hailthedimples","cultural-icon",
"@jlkurtz Has there even been a @KSTATEADGT sighting aside from NY?? I feel like it’s my kids tv show, but instead of “Where in the world is Carmen Sandiego”, it’s “where in the world is @KSTATEADGT”. Anyone got a tail #? Sighting? Anything??? Dude disappeared like a ninja on prom night","@lunchbox_77","cultural-icon",
"is carmen sandiego gonna be in the new smash bros","@schreck_c","cultural-icon",
"Where in the World is Gina Rodriguez? https://t.co/4oKM2yollD","@GamesOnFilmPod","cultural-icon",
"@mdawg957 oh yeah, it's been cooking. Some of this Netflix stuff gets announced quite far in advance, like Carmen Sandiego (2019!)","@GWOtaku","cultural-icon",
"@k8bushofficial You lost me at “fedora”, but regained me forever with “Carmen San Diego”","@TheGayChingy","cultural-icon",
"theres a carmen sandiego outfit for pyro in tf2 now it's pretty cute","@saphirosphere","fashion",
"Angelina Jolie finishes every interview by winking, tossing on a red fedora, and fleeing as the interviewer realizes she is Carmen Sandiego.","@louisvirtel","cultural-icon",
"⚡️ “Netflix greenlights a Carmen Sandiego series” https://t.co/xGrmy169J1","@MStarzky","cultural-icon",
"Rockapella-Where In The World Is Carmen Sandiego: http://t.co/AOVU10oOqV why am i listening to this song","@fran77771","cultural-icon",
"the @pizzahut #pizza icon looks like you’re about to embark on a secret spy mission with #carmensandiego https://t.co/k4XaMPxdIO","@Dolberdi","cultural-icon",
"#Gina #Rodriguez to #Star in Netflix'#S #Carmen ... - ##Netflix #GinaRodriguezToStarInNetflix'sCarmenSandiego - https://t.co/KidgjFGO8F https://t.co/UelWtKQa6R","@WomanSTale","cultural-icon",
"@KrystalShelbs traveling the world like Carmen Sandiego! https://t.co/b06g02amWE","@aimee_costa","travel",
"@lenubienne @Glamorfonic werk. I always call @whitberries Carmen Sandiego too cause I never know where the hell she is 🌍✈️","@huny","travel",
"@No2MarmadukeFan There was a Carmen Sandiego cartoon in the 90's that looks leagues better than this.","@elizibar","cultural-icon",
"OH. MY GOSH. NO. EFFING WAY! #Netflix #90sKid #CarmenSanDiego https://t.co/NDgYwWE957","@itzmoe","cultural-icon",
"15 Reasons Why The World is So Ready For a Carmen Sandiego Reboot - atomictiki: I’m glad geography was... https://t.co/2qf1MGSjki","@cartoon_fan","cultural-icon",
"happy #InternationalWomensDay and especially thanks to carmen sandiego, the most international woman there is","@whalleyrulz","role-model","w"
"@FoxCT @AngelicaSpanos does some Carmen Sandiego cosplay live on air this morning. http://t.co/0Mm8LPC1FQ http://t.co/ybrL7luq6Y","@One_Fractal","fashion",
"Already have my next Halloween costume planned out. Carmen Sandiego. My date&39;ll go as Where&39;s Wally. Always wanted to do that","@samellabfg","cultural-icon",
"Using the style of Carmen Sandiego to teach kids about the oceans. http://t.co/VABVgEIw9Y","@jason_wilson","fashion",
"@Axxman300 oh I seriously thought it was A mysterious woman that kind of resembles Carmen Sandiego! :/","@TwizMandy","cultural-icon",
"tbh I'm amazed there hasn't been a live action Carmen Sandiego or Penelope Pitstop movie yet. Magic School Bus not so much.","@tommgran","cultural-icon",
"I remember learning the word 'dossier' from playing Where in the World is Carmen Sandiego?","@alex_block","cultural-icon","w"
"@CLGervais_lcv @BRIANVELI_ @100sFakeSupreme chuck norris is the reason Waldo's hiding and you can't find Carmen San Diego","@destroy3R","cultural-icon",
"Remember Carmen Sandiego? Netflix Is Rebooting the Childhood Classic - The Cheat Sheet https://t.co/0zW6PTz0VO","@exrentals","cultural-icon",
"@danharmon points for obscurity @danharmon:Where in the World is Carmen Sandiego,I'll Let YouDrugMeForTheAnswer,Oh Christ I'm Buried Alive #SadTVShows""","@Bristy","cultural-icon",
"I learned about Interpol thanks to Carmen Sandiego. And I learned the importance of camouflage thanks to Waldo.","@introvertedwife","edutainment","x"
"10 reasons Where in the World Is Carmen Sandiego? was the best educational TV show ever https://t.co/3tl7TKaGPt https://t.co/Jkj3nq14Pt","@people","edutainment",
"@TheWeirdTeacher Michelle, HS Science love ""Where in the world is Carmen Sandiego?"" #WeirdEd","@AwesomeScience","edutainment",
"Netflix found Carmen Sandiego! 💃 https://t.co/X0BSql8E40","@CNET","cultural-icon",
"Gina Rodriguez Is Going To Be Carmen Sandiego In A Live-Action Film And I'm Breaking Out My Red Fedora To CelebrateHot Trending Buzz news https://t.co/xmMlWgxGhk","@amberperly","cultural-icon",
"@Mike_Matei Math/Reading Blaster, Carmen Sandiego, any Jumpstart game, Barnyard Rhythm&Moos. I played these educational PC games back then!","@hankforeman91","edutainment",
"Gina Rodriguez To Star As Carmen Sandiego In Netflix Live-Action Feature (https://t.co/UZqdPxOaUO)","@juliajdpr","cultural-icon",
"Adam Lambert Serves Carmen Sandiego En Bleu Realness: Who in the world is Adam Lambert's new style icon? Ummm,... http://t.co/0ps1VDt5t0","@SummerTees","fashion",
"Where in the world is Carmen Sandiego?","@hill026","cultural-icon",
"Tech: Gina Rodriguez, ‘Stranger Things’ actor, to lend voice to Netflix’s ‘Carmen Sandiego’ https://t.co/XbSGFAwDzs","@MarkBeacham","cultural-icon",
"Carmen Sandiego Hits Netflix January 18th... #Animation #CarmenSandiego #GinaRodriguez #Netflix https://t.co/rsvhDSpBAc https://t.co/ltbGpqmwOs","@IEarths","cultural-icon",
"@keshhh Go head! Ms Carmen Sandiego!!! That sounds like a pretty coo trip! I ain’t mad at it. Heyyy lol What’d you shoot?","@purdyplustaxx","travel",
"The Purge, Carmen Sandiego, and Boxer Princess, lolz!! 💋😈👻👿☣🕸 #treehouse #patiobar #halloween… https://t.co/BMk4EV6g7y","@cmpromoprincess","fashion",
"@TokyoCourtesan @AvaZaneXO Thank you!!! 😍😍😍 Carmen San Diego was my cartoon crush when I was a kid 🌏🌎🌍","@MeetJosieQu","cultural-icon",
"I want a outfit like Carmen Sandiego","@DeyBeOnANigga_","fashion",
"@andylassner From Dora the Explorer to Carmen San Diego in one trip. Is this her idea of Hispanic outreach?","@Kingwoman","role-model",
"Lrt I had the honours on working on this show! I did the poses and expressions in some of the episodes, and it was HELLA fun to work with (when Animate CC didn't crash on you that is HEH), so I hope you guys enjoy Carmen Sandiego when she comes out this January 18, 2019! :D","@BlueUmbriel","cultural-icon",
"Thats what i get for loving an explorer. A Carmen sandiego.","@JasiriSimba","travel",
"The @Rodebjer Sergeant Coat is Carmen Sandiego’s dream. And therefore ours. http://t.co/v7MvpJkEUt #whereintheworld #fashion #style #coat","@garmentory","fashion","x"
"@Aye_Naki where do you suggest i go then mz World Traveler carmen san diego","@ben_wellick_V","travel",
"Netflix's 'Carmen Sandiego' debuts on January 19th, 2019: Since Netflix first announced its… https://t.co/ZIDnrHgNYT","@Feedjunkie","cultural-icon",
"Gina Rodriguez donning red fedora and trench coat of Carmen Sandiego https://t.co/cAdRZxJgqg","@gahlautdhruv","cultural-icon",
"#JaneTheVirgin star HereIsGina reported to voice lead character in Netflix_CA's rumoured #CarmenSandiego reboot… https://t.co/e28yOiei6D","@Julia_Abdulla","cultural-icon",
"A game like Where in the World is Carmen Sandiego? mixed with Metal Slug, but more casual that teaches Greek mythology.","@EduGameIdea","edutainment",
"Netflix is Bringing Back Carmen Sandiego - With Gina Rodriguez! (Report) #Celebrity https://t.co/y2CYhv5bGM https://t.co/Nb90M43ZKS","@blogparser","cultural-icon",
"At shutocon with my offspring - she says: hmm I don’t know if that is Carmen Sandiego or a lady that happens to have redhair wearing a trench coat.","@Renegade0x6","fashion",
"Okay so @SariCarpenter posted a picture of Carmen San Diego and @peytonpclark posted a picture of Where's Waldo.....Halloween costumes????","@leifer_lizzie","fashion",
"Gina Rodriguez will be donning the red fedora and trench coat of Carmen Sandiego for Netflix https://t.co/P5aAOgYEvQ","@TechmarketNG","cultural-icon",
"@magencubed 2. CARMEN SAN DIEGO, BECAUSE I WANT THAT HAT","@magencubed","fashion",
"I've got a yellow scarf and now a red trench coat, which makes me that much closer to living my dream of dressing as Carmen Sandiego as I sneak around the world, from Kiev to Carolina...","@nolaladyuk","fashion","x"
"@comewhenicall @HentaiKyoko I feel like she needs a red hat and bam new age Where in the World is Carmen Sandiego","@Babetronically","fashion",
"Psa: Carmen Sandiego is coming to Netflix next month","@MaeFli","cultural-icon","x"
"This new @netflix show looks so good! https://t.co/LSUzaNYq6r","@mix969","cultural-icon",
"Gina Rodriguez Voicing Carmen Sandiego in Netflix Show https://t.co/eWyJZVzRR8 https://t.co/cQS9KRUvAt","@EssenceOnTwitch","cultural-icon",
"✈️ SFO>🌴☀️🏊👙🕶???? Where in the world is Carmen San Diego going?","@grahamharbison","travel",
"@netflix Where in the world is ""Where in the World is Carmen Sandiego?"" any updates? Trailer? anything?","@WX8BMC","cultural-icon",
"dad when I was growing up: why vacation when I can just go for a run & then spend the weekend in my recliner dad now: I will find Carmen San Diego if it kills me","@brianthehuman","travel",
"This Pup Has Traveled The World, And Has Drool-Worthy Pics To Prove It: Move over, Carmen Sandiego, this ... http://t.co/XVj3pcXgsB #FPG","@FuturePowerGen","travel",
"90s forever @netflix & I am here for it all!! #CarmenSandiego https://t.co/DAlsTvwWWM","@Draven1683","cultural-icon",
"Just downloaded Carmen San Diego and I'm about to let her knooooow","@alextheexplorer","cultural-icon",
"Was trying to sleep last night and my brain was like ""HEY YOU SHOULD TOTALLY BE CARMEN SANDIEGO FOR HALLOWEEN LET'S PLAN YOUR COSTUME NOW!""","@AnicaLewis","fashion",
"should i do pidge from voltron or carmen sandiego or just wear goddamn judy hopps again","@pocketiel","fashion",
"Netflix orders animated Carmen Sandiego series https://t.co/OMWfTiqz51 https://t.co/fd3ZCUpSln","@arnaudhacquin","cultural-icon",
"Netflix orders animated Carmen Sandiego series https://t.co/Am4dTDMAoU https://t.co/ueMj2Rb6BX","@sachiketi","cultural-icon",
"Pizza hut's logo is a red hat 😂😂😂 y'all ever thought about that?! Where's Carmen Sandiego? She's been running Pizza Hut lol","@JaylnOfficial","cultural-icon",
"Netflix plans live-action 'Carmen Sandiego' film with Gina Rodriguez https://t.co/zHjBAoYzMS","@InfiniteLives_","cultural-icon",
"Where in the World Is Carmen Sandiego? Becoming a Secret Travel Agent https://t.co/i6sTr8odvV","@mnrdg","travel",
"@MidgarFlwrGirl Would love to see a Carmen San Diego reboot too that would be awesome. Loved those education games","@wegamelgbtq","edutainment",
"literally me. I can so far speak french fluently but conversational farsi, Spanish, Korean and Amharic (Ethiopian)\. Anyone willing to teach me more conversational languages are more than welcome but I need to be #CarmenSanDiego therefore I learn what I can https://t.co/zFhcOxi1f4","@Diamond_ChaseMi","edutainment",
"Just recalled that last Halloween husb and I dressed as Waldo and Carmen Sandiego and found out afterward so did Edward Snowden and his g.f.","@Stefaniya","cultural-icon",
"@ZacharyLevi just like Carmen San Diego was never in San Diego, probably not in Cuba...","@PughVranhyre7","cultural-icon",
"A sensible trench coat and hat, how #chic she is, Carmen San Diego. #morning #cartoons #whereintheworld #women #idols","@TomancyOfficial","role-model","x"
"And where in the world is Carmen Sandiego?","@randyxjames","cultural-icon",
"Embrace your '90s nostalgia with these Halloween costumes (Carmen Sandiego, anyone?) https://t.co/gEXH1bWrtd https://t.co/uzBJ5GEc8r","@bust_magazine","cultural-icon",
"I played a lot of Where in the World is Carmen San Diego and Jump Start on CD-ROM. Mostly I just didn’t know things. Except for the number of feet in a mile because my fourth grade teacher kept reminding us that our town was between Route 52 and Interstate 80.","@entollefson","cultural-icon",
"I was already in my 20s when I discovered Carmen Sandiego, and yet the geology nerd in me loved the show. And I enjoyed the strong female characters. Glad to see it coming back! Not Your Shero: Carmen Sandiego and the importance of feminism in edutainment https://t.co/Y0g3IPT61d https://t.co/MUfv1Y8iqb","@S_R_P_S","edutainment","w"
"@WineandCrimePod A red coat, scarf and sunglasses? Was Rita actually Carmen Sandiego? https://t.co/p030vWylOD","@stuckinspincycl","fashion",
"Wearing a fedora in your LinkedIn picture makes me think I found Carmen Sandiego, not the right candidate #justsaying","@KatrinaKibben","cultural-icon",
"Carmen Sandiego' Coming to Netflix, Voiced By 'Jane the Virgin' Star https://t.co/wp9XLuUtqp https://t.co/9SJd5TCrS8","@wrrv","cultural-icon",
"@worm2126 Now he travels more than Carmen Sandiego. “@worm2126: I remember a @MinusThymus that used to give it to me on an occasion or two at PPL.”","@DC3_TWEETS","cultural-icon",
"Dear @ACwritersroom and @JohnVignocchi if Peggy was in @DisneyInfinity would her default be her military outfit or her ""Carmen Sandiego""","@RiverMets","fashion",
"I'm just a red coat away from stealing national treasures and running around the world to escape. #CarmenSanDiego #90skid #90sNostalgia https://t.co/1feq3GjoSr","@springinsnow","cultural-icon",
"Seeing all the cap peeps spring break travels on social, I feel like I’m watching where in the world is Carmen Sandiego and they’re racing around the tropical sphere","@taycollett","travel",
"Do it, Rockapella: Netflix is Making a New 'Carmen Sandiego' Show - Geek https://t.co/I6tsyFrUTG","@NewGamesPlay","cultural-icon",
"@NBATV He better give Carmen San Diego her trench coat back!","@Prather3Sean","fashion",
"Carmen Sandiego:The Secret of the Stolen Drums, a ‘04 game of the action-adventure genre by A2M. You have complete control of the character in a 3D world for the first time. The younger crowd or fans of the show will enjoy this one. #MondayCubed #Gamecube #nintendo #retrogaming https://t.co/fdzZrGpUya","@GidionV","cultural-icon",
"We found #CarmenSandiego, the #seawitch #ursula and #cortana inside Coolness of Cosplay http://t.co/rxKUIh59eJ","@directedition","fashion",
"#Netflix is learning how to play the franchise game with #CarmenSandiego https://t.co/Fg0CxR66v4 https://t.co/UQpbKyNc98","@MediaBaron2099","cultural-icon",
"ESE. I remember that game... Except we had Where in the World is Carmen Sandiego.","@DatFabi","cultural-icon",
"Here's a crossover idea: Carmen Sandiego & X-Files, that's actually about time travel","@bad_fanfic","cultural-icon",
"@ElsieLovelock Looking like Carmen SanDiego","@ozmadaus","cultural-icon",
"#NewProfilePic Sporting my New Carmen Sandiego coat! https://t.co/kNf6nlRdFl","@ProfRMCarlo","fashion",
"@bigredcobcast @GrantWistrom Is there any truth to the rumor that Mr Wistrom also knows where Carmen San Diego is?","@therealinformer","cultural-icon",
"It's cuz I took it and that glow saves lives! 💁🏻💁🏻 Carmen SanDiego is about to come out of hiding 🕵🏻‍♀️🕵🏻‍♀️ Adventures are our calling 👑 https://t.co/DQZIz585Jv","@mrowjazz","travel",
"Chuck Norris always knows the EXACT location of Carmen SanDiego.","@chucknorriskik","cultural-icon",
"Jane the Virgin actor to star in and produce new Carmen Sandiego Netflix film https://t.co/LAgjoUh24A","@CBCNews","cultural-icon",
". @netflix has reportedly ordered 20 episodes of a ""Where in The World Is Carmen Sandiego"" reboot: https://t.co/kejzXAh2EM https://t.co/HMeiltXm6U","@991WMYX","cultural-icon",
"I was real good at making paper planes in 4th grade & sold them for 50 cents to classmates, used profits to buy my bff a Carmen Sandiego hat","@too_lewd","fashion",
"#Netflix finds '#Carmen Sandiego' for its latest reboot #internationalspy #GinaRodriguez https://t.co/zTD0wdwWrN","@Gamolizer","cultural-icon",
"This week's Nostalgia Trip will remember a question: Where In the World... In Time... Space... Europe... the USA... Is #CarmenSandiego","@FredCasden","cultural-icon",
"Gina Rodriguez Voicing Carmen Sandiego in Netflix Show https://t.co/Du4Aj8KJLE https://t.co/U9KYyJZEiP","@GamingChats","cultural-icon",
"im gonnnaaaaa watch the carmen sandiego cartoon in german to try and help me not forget everything i learned over the summer","@katethulu","edutainment","w"
"Do we get to play the game as we watch? @netflix #CarmenSandiego #WhereInTheWorldIsCarmenSandiego https://t.co/3G1fAQFEex","@VerifiedCoop","cultural-icon",
"@arumboldt @libetdawn Was beginning to wonder Where in the World Carmen Sandiego was... hope you are having fun","@arumboldt","cultural-icon",
"The Reboot of ‘Carmen Sandiego’ to Premiere on Netflix in January Deadline reported, the reboot of classic anime series ‘Carmen Sandiego’ is set to premiere on January at Netflix. The streaming service has set Friday, January 18 as the release date. Th... https://t.co/uOekFca7hB https://t.co/D4Yuhmamla","@Amadeus2k","cultural-icon",
"Jane The Virgin’s Gina Rodriguez To Star In New Netflix Series Carmen Sandiego https://t.co/ozFMO9PCUA","@PhynoMyMentor","cultural-icon",
"Gina Rodriguez donning red fedora and trench coat of Carmen Sandiego https://t.co/bSrShvP8xm https://t.co/9jC6UHJIM1","@lvenus52","cultural-icon",
"@barstoolsports All this without even mentioning Round House and Where In The World Is Carmen San Diego","@eyyyhowudoin","cultural-icon",
"Peggy Carter & Carmen SanDiego, travelling the world in pursuit of each other. Bet that would be one heck of a good looking cosplay couple.","@aglitermacaroon","travel",
"What if @marshmellomusic is Carmen Sandiego & we're letting her travel the world committing crime because she dresses like a marshmallow now","@retronomic0n","cultural-icon",
"I have to admit - I'm excited! Netflix Reboots 'Carmen Sandiego' With Gina Rodriguez https://t.co/ySQDH46zPb via @thr","@jesslynhiltz","cultural-icon",
"VIDEO: 10 Reasons Where in the World Is Carmen Sandiego? Was the Best Educational TV Show … https://t.co/IAXZm0DlMJ https://t.co/4fQvsU2lxh","@parientee","edutainment",
"#BretsLog Still looking but has anyone found Carmen Sandiego? I want my hat back.","@bretrreimers","cultural-icon",
"Do it, Rockapella: Netflix is Making a New 'Carmen Sandiego' Show: https://t.co/aGnKCbzzTr https://t.co/oAtEvVaYtH","@geekdotcom","cultural-icon",
"Retweeted Deadline Hollywood (@DEADLINE): Gina Rodriguez To Star As Carmen Sandiego In Netflix Live-Action Feature https://t.co/tfaV4uyrWS https://t.co/T8Q9LJlyFI https://t.co/YfWDGQsEj7","@Taidon","cultural-icon",
"Halloween makes life more interesting: on my way home I ran into Fred Flintstone and Carmen Sandiego","@EmmiJacqueline","fashion",
"Oohh yeah Carmen Sandiego will be on @netflix","@ech0whiskey","cultural-icon",
"The Pizza Hut logos on top of delivery cars look like Carmen Sandiego’s hat and you can’t convince me otherwise.","@allyson_cooper","cultural-icon",
"Carmen Sandiego Returns in a New Educational App https://t.co/pmsZqhlepw https://t.co/ga1ip19HAC","@daniellensimps2","spam",
