"text","handle","category","star_tweet"
"@Duncanstein you can't buy airplane tickets with humor. If you could I would be carmen San Diego.","@MastTerBase","travel",
"Netflix making live-action Carmen Sandiego movie https://t.co/iHiMZU4UtU","@MDG87","cultural-icon",
"Me, riding to work: Oh man, that lady has such a cool hat and coat! She looks like Carmen San Diego! What a rockin' outfit! Me, a beat later, realizing it's Halloween: Oh.","@sashagrons","fashion",
"I owe 90% of my elementary school education 2 Wishbone(literature),Where n the World is Carmen Sandiego(geography),Magic School Bus(science)","@yessicana","edutainment",
"🎶She go from Nashville to Norway, down in through Zimbabwe...🎶 Yeah, you’re welcome for the ear worm. More from @photowhatnow! #aditheadipose #CarmenSandiego #cosplay #edit #cosplayer #photoshop #whereintheworld #fandoms #doctorwho #mashup #cosplayg… https://t.co/TDHNcP98dl https://t.co/46hmyhkZYJ","@aditheadipose","cultural-icon",
"@jaley Skype account. DM your email address. I’ll provide website on how to play. Think of Carmen Sandiego, 2018 style.","@jakramer2","cultural-icon",
"@MikePipper2 @Granddad_Sr @_V_Lady @akamaggieak @PineyMcknuckle And she stole her outfit from Carmen Sandiego. That's badass.","@TwoToTheFifth","fashion",
"Do it, Rockapella: Netflix is Making a New ‘Carmen Sandiego’ Show #techblogs #feedly https://t.co/rIwTgjt23g","@sergeanthacker","cultural-icon",
"@chuggaaconroy #Chuggamon Emile, hear me out on this and name your Sandile: Sandiego Just like Carmen Sandiego he wears black and red (in his final evolved form), is considered a CROOK(Ko-dile), and it will travel around the world with you.","@AceTrainerAzure","travel",
"my childhood girl power icons: shania twain the cheetah girls my mom elle woods the dixie chicks the girl from motocrossed carmen sandiego","@emlytptn","cultural-icon","x"
"Gina Rodriguez will be donning the red fedora and trench coat of Carmen Sandiego for… https://t.co/mN2KdQi3CO","@DHQLounge","cultural-icon",
"How come there are no good educational games for adults? Like, give me a more difficult version of Carmen Sandiego. What, only kids need to learn stuff?","@BestDaveInTown","edutainment",
"@do_r1te Hahaha! I'm like the Football Carmen San Diego! 💃✈️","@DuskySprngfield","cultural-icon",
"Oh man. I am apparently a total sucker for girls trying to pull off the Carmen Sandiego look.","@PFoxen","cultural-icon",
"Where in the #world is Carmen San… Sorry I mean @HereIsGina? https://t.co/Wk69VW7cLN via @latina #TuesdayMotivation","@comunicadpr","latina",
"@lizandrews2012 ""Excuse me, Carmen Sandiego, I didn't realize we had a geography expert on board""","@ChelleShriver","cultural-icon",
"History of the rise + fall of the company behind #80s #90s educational software classics Oregon Trail, Reader Rabbit, Math Blaster, Carmen Sandiego, and others via @outline https://t.co/ywuLVDxBcD","@ArielR_IP","edutainment",
"cool ‘Carmen Sandiego’ Coming to Netflix as an Animated Series Starring Gina Rodriguez https://t.co/KfuCfsG1Dx","@louiis7","cultural-icon",
"A CW star has locked down the role of Carmen Sandiego in the Netflix Reboot! https://t.co/TRMDCyLiVf https://t.co/SVjRyNfjRY","@kiss957","cultural-icon",
"Netflix plans live-action 'Carmen Sandiego' film with Gina Rodriguez - Engadget https://t.co/IWTjomnHID #Film #Movies","@FilmNewser","cultural-icon",
"Gina Rodriguez To Voice Carmen Sandiego In New Animated Netflix Reboot https://t.co/KVUKH6bK2q","@CelebsSocial","cultural-icon",
"@thenerdmachine if someone doesn't make @ZacharyLevi wear a trench coat, a la Carmen San Diego, before he flies off, I will be disappointed","@pattibon","fashion",
"Throwback Thursday news for those who grew up in the 80’s! The ""Carmen Sandiego"" edutainment franchise, which... https://t.co/kAc005FASu","@KWFC","cultural-icon",
"#WayBackInThe80s Everything I learned about geography, I learned chasing Carmen Sandiego across the United States, and then across the world.","@FebWriter","edutainment","x"
"My two favorite Halloween costumes from last year....Carmen Sandiego and Cruella DeVille 🙌🙌🙌 http://t.co/YUsP2cjnNh","@_Uwyy","fashion",
"My first television apprearance? A Carmen Sandiego Geography Bowl. I studied for American geography. Turns out it was world geography. 😬 https://t.co/YeBmvSHdmF","@leewolfwilson","cultural-icon",
"Wait... @HereIsGina is going to be Carmen Sandiego for a netflix show next year???? I'm so excited!","@AmaniMeans","cultural-icon",
"@WestsideBook @crazedceladon I feel like Carmen Sandiego","@ByCommonConsent","cultural-icon",
"@mthomps Carmen Sandiego and Sim City. Also, poker taught me how to bluff.","@suzanneyada","edutainment",
"We should make educational games so the next generation has their own Carmen Sandiego, Oregon Trail, Mathblasters, Cross Country Canada, etc","@FluffyPira","edutainment",
"Reliving days of yore with Where in Europe is Carmen Sandiego - made in 1988. Ooh, bad timing. #obseletegeography http://t.co/Atenyp8YPi","@minnousche","cultural-icon",
"Totally should have gone for the hot Carmen Sandiego look.","@Axdyn4170","cultural-icon",
"I remember this game was the shit in elementary school!! #CarmenSandiego where in the world is Carmen Sandiego lol #1999games #oldschool https://t.co/bsmqEz68TZ","@RemZisWorld","cultural-icon",
"‘Carmen Sandiego’ Animated Series Greenlit at Netflix, Gina Rodriguez to Star https://t.co/WTQRge0UFH https://t.co/vDnXwv14wd","@sports_eeuu","cultural-icon",
"#BestPartOfThe90sWas watching Where In The World Is Carmen Sandiego and other educational kids game shows.","@_Annetastic_","cultural-icon",
"Already have my next Halloween costume planned out. Carmen Sandiego. My date&39;ll go as Where&39;s Wally. Always wanted to do that","@knappbk238","cultural-icon",
"Now that I think of it PBS used to be a poppin station for me as a kid. Zoboomafoo, Dragon Tales, reading rainbow, magic school bus, Arthur, Barney and where in the world is Carmen SanDiego","@LL4dawg","cultural-icon",
"I still remember the time I went to Disneyworld around Halloween and among the costumed crowd I saw one person dressed as Waldo while the woman next to him was dressed as Carmen Sandiego. Greatest. Couples. Costume. Idea. Ever.","@michaeljande19","cultural-icon","x"
"Joseline was in a Carmen Sandiego outfit....this explains everything. #LHHATL","@Karnythia","fashion",
"@webcomicchat Q5: @ArchieComics, @Garfield and Peanuts @Snoopy comics have always been a big influence for me. Another non-comic influence for me is ""Where in the World is Carmen Sandiego?"", as my comics are about traveling to different countries of the world. (#90skid lol) #webcomicchat 🍭","@Lollipop_Comics","travel",
"‘Carmen Sandiego’ Coming to @netflix as an Animated Series Starring @HereIsGina https://t.co/Nqv9VUNYJb","@joshHsmith1991","cultural-icon",
"Already have my next Halloween costume planned out. Carmen Sandiego. My date&39;ll go as Where&39;s Wally. Always wanted to do that","@ildawffwilliam","fashion",
"Netflix finds 'Carmen Sandiego' for its latest reboot https://t.co/rMRRI7d8Ty https://t.co/YEKgHibqVW","@emmaschmidtok","cultural-icon",
"Where at LCDC Have you heard of Carmen San Diego? It’s a game kids play while secretly learning geography. We’... http://t.co/AfHlinKLcf","@ChuckwallaLCDC","edutainment",
"@outseide six otters standing on eachothers shoulders, in a trench coat and broad hat a la Carmen Sandiego. The wobbles give it away.","@Fauxglove","fashion",
"Netflix's 'Carmen Sandiego' debuts on January 19th, 2019 https://t.co/m0bBbO0bkl","@MusicPassionNow","cultural-icon",
"First thing I learned this morning: Ivy from Carmen Sandiego and Nami from One Piece have the same VA in German (she’s also Chris in SonicX)","@MasterOtenko","edutainment",
"Now I just saw said lady & once again she looked SO COOL in this wide brim kinda Carmen San Diego x Bieber hat. I need that hat.","@momjeansmami","fashion",
"@skeletonforhire concept: a barely discernible remix of the carmen sandiego theme underscoring the everyday adventures of ian kimmel","@jimihayden","cultural-icon",
".@HammerOnAir: REPORT: @Netflix Is Reviving ‘Carmen Sandiego’ With Gina Rodriguez (@HereIsGina). Read More: https://t.co/qvJ9lgu8QR https://t.co/T6bY3rsdtp","@Z1035Toronto","cultural-icon",
"Gina Rodriguez To Star As Carmen Sandiego In Netflix Live-Action Feature https://t.co/YDqavK3Qs5 by #DEADLINE via @c0nvey https://t.co/nadUjix6R4","@JuebakS","cultural-icon",
"Carmen Sandiego' Reboot Headed to Netflix https://t.co/04X3Aqp8lv https://t.co/96tW2RFVIW","@mrg_edwards","cultural-icon",
"New Carmen Sandiego Animated Series Coming to Netflix in 2019! https://t.co/2r4spm2u2V via @LongWait4Bella","@merlotmommy","cultural-icon",
"BEDELIA'S CARMEN SANDIEGO OUTFIT. FLAWLESS. #Hannibal #HannibalPremiere","@pocketrex","fashion","x"
"#etalk Kate Middleton Channels Carmen Sandiego for Commonwealth Day at Westminster Abbey: ... https://t.co/o9cD4k8we5 #Fashion #Celebrity","@Dubintertainer","fashion",
"Lady Gaga Is Really Into Dressing Like Carmen SanDiego Lately https://t.co/D31BNPSYZU #fashion","@hautestylenews","fashion",
"Gina Rodriguez To Star As Carmen Sandiego In Netflix Live-Action Feature https://t.co/HAvID9nZFY","@GOATfilmpodcast","cultural-icon",
"@WWEUniverse @TheDeanAmbrose With as much as they travel, probably a good idea to have a globe with you...or Carmen Sandiego or Waldo.","@ranrtt","travel",
"Where in the world is Carmen Sandiego...Bibby style! Jingle Bells people!! 😽🌲❄️☃️🎄⛄️😽 Photog… https://t.co/TRsKzUaCA7","@ThechezbibbyS","fashion",
"Netflix Planning Carmen Sandiego Reboot https://t.co/xKvBuo2w22 #Netflix #CarmenSandiego #GinaRodriguez via @geektothechic","@BoxOfficeBuz","cultural-icon",
"Gina Rodriguez Voicing Carmen Sandiego in Netflix Show https://t.co/9fUdChKcFU #TDoug https://t.co/bDObq8zKSd","@TDougNews","cultural-icon",
"Carmen Sandiego' live-action movie to star Gina Rodriguez https://t.co/RpMIZ0Iui6","@Accra1005fm","cultural-icon",
"#IfINeverHadToWorkAgainId be travelling all around the world.. where is carmen sandiego omigosh?? https://t.co/wH9iuuAXil","@elsi_quispe","travel","x"
"#Daria+#CarmenSandiego=🖤. . Bringing back the #90s with my #womancrushwednesday @hopejane for #blackheartsburlesque! 👓 🌍 💋 . . #cosplay #dariacosplay #carmensandiegocosplay #fiercefemmes… https://t.co/chsnahbqNX","@QueenieBurlesk","cultural-icon",
"@JaredLeto any plans for Halloween this year ?. I'm thinking of going as Carmen SanDiego,ghost hunting in St Augustine. Wish you came with","@LaylaVirgo","fashion",
"The rain + this song makes me feel like Carmen San Diego https://t.co/oSEeERAZLh","@FreeDieselGlo","cultural-icon",
"We Now Know Where In The World Carmen Sandiego Will Be In 2019 #Netflix #CarmenSandiego https://t.co/SNdjC4nib8","@OfficialLRM","cultural-icon",
"Truthfully.... I'm not sure who found who?!? #CarmenSandiego or #Waldo. #cosplay #BostonComicCon… http://t.co/EF7zRPsAX4","@thejohnlee","fashion",
"Where does Maria buy her trendy trench coats? Where in the world is Carmen Sandiego? #jodiarias (ok, I made that one up.)","@WildAboutTrial","fashion",
"@JCLately2011: Looking for Waldo? Carmen Sandiego? They're both at #PAXSouth #cosplay http://t.co/hgjSuqcBNA","@JCLately2011","cultural-icon",
"@nicodelort In a similar vein, I learned a lot from Mario's Time Machine. I also specifically remember an episode about guano in Carmen Sandiego??","@SethBaucum","cultural-icon",
"carmen sandiego is a queer icon https://t.co/1zd4GFOINU","@joshywinty","inspiration",
"Get my education back — watching Where in the World Is Carmen Sandiego? (game show)","@homie_big","edutainment",
"Halloween idea: Carmen Sandiego","@hausofskywalker","fashion",
"#Top3 @Top3Tyrant Honorable Mentions: Grimm and Evil, Ahh! Real Monsters, and Where In The World Is Carmen San Diego?","@a_ferretti25","cultural-icon",
"Is this just some awesome marketing from the upcoming Carmen Sandiego movie?...🤔 @netflix","@JacquieSchifano","cultural-icon",
"@ken_you_not Sounds like a possible nemesis for Carmen SanDiego in a future reboot for Netflix","@IllsonTrillips","cultural-icon",
"When I wear my trench coat and fedora I feel like Carmen San Diego. #fashion #rain #noumbrella","@writenaked","fashion","x"
"⚡️ “Netflix greenlights a Carmen Sandiego series” https://t.co/fHUONbctjR","@3BelowZero","cultural-icon",
"My greatest rival on the geography bee scene is getting engaged. Congratulations to him, but now it's up to me to catch Carmen Sandiego.","@JackEdathil","cultural-icon",
"I lost it at Christine with the Carmen San Diego hat. ;__; xD","@CountDmitri","fashion",
"Chuck Norris knows the exact location of Carmen SanDiego. #chucknorris","@FactsAboutChuck","cultural-icon",
"Who wore it better? Carmen Sandiego (Where in the world is...) or Miss Scarlet (Clue)? http://t.co/IaOx69ZmKw","@Count_Marzo","cultural-icon",
"Gina Rodriguez will be donning the red fedora and trench coat of Carmen Sandiego for… https://t.co/mAgQNf6WVs by @mashable #News #update https://t.co/A1ZCArlFaD","@parmarkavi","cultural-icon",
"Netflix may have found their 'Carmen Sandiego' and she comes with Golden Globe credentials https://t.co/2nhvucMxZd https://t.co/Ucq2gaQnHp","@UPROXX","cultural-icon",
"Thankfully, I learned this all but playing Carmen San Diego on the pc as a kid lol https://t.co/M1vxHxYOfh","@DamonInReelLife","edutainment",
"My favorite dectective is Carmen sandiego. Yeah she used to be a good detective and now her skills to steal cool shit but the girl has great fashion style and knows how to make an exit https://t.co/iTHiTcm4Ge","@ceddywap1738","inspiration","x"
"Cnet Netflix is making a Carmen Sandiego movie with Gina Rodriguez - CNET https://t.co/gJhbCXIqbt","@technews122","cultural-icon",
"Netflix plans live-action 'Carmen Sandiego' film with Gina Rodriguez: https://t.co/ZbTwMV0WdU","@brynovation","cultural-icon",
"“Where in the hell is Carmen San Diego”","@didgeridougrou","cultural-icon",
"Eat your heart out, Carmen San Diego. There is a new world traveller in town!… https://t.co/doz6sTTzCd","@MattBousum","travel",
"Today we celebrate #GirlsinICT by presenting several inspirational women in this field! Janese Swanson is an inventor and software developer of toys and games for girls, known for co-developing the first of the Carmen Sandiego educational games! #GirlsInICTDay https://t.co/Yy0M1sJlLg","@cunterview","feminism",
"I'd come home and watch Ghostwriter and Where in the World is Carmen Sandiego every day","@_MissRandi","cultural-icon",
"Everything I learned about women I learned from Carmen Sandiego. And zombie movies. And Godzilla. Okay, I don't know anything about women!","@bpmatlock","edutainment",
"Where in the World Is Carmen Sandiego? Becoming a Secret Travel Agent https://t.co/bT85zXWZIF https://t.co/aykEMEtOuW","@hnbreaking","travel",
"@seewhatsnext @HereIsGina Where in the World Is Carmen Sandiego? Exclusively on Netflix.","@Kairukurumi","cultural-icon",
"me traveling int'l like carmen san diego but in a camel coat, new balances and a huf fitted rolling up like ""whats ur trap scene like""","@pterosaur","travel",
"All hail Carmen Sandiego, a hero for our time.","@HindMakki","inspiration","x"
"@jsnell I didn’t do the survey, but when I heard the hats question, Carmen Sandiego was my actual first guess and I was so happy to hear it at the end.","@MatthewDoel32","cultural-icon",
". @netflix has reportedly ordered 20 episodes of a ""Where in The World Is Carmen Sandiego"" reboot: https://t.co/qIbZIO6aun https://t.co/2IpVUBjHj3","@1037KISSFM","cultural-icon",
"#Netflix Developing Live-Action 'Carmen Sandiego' Movie Starring Gina Rodriguez https://t.co/ga0BFo2AKE","@comic411","cultural-icon",
"[Heavy Breathing Intensifies] I *LIVE* for these costumes: #Steampunk #Waldo and #CarmenSandiego #cosplay*faints* http://t.co/gHKa0hWOcC","@ShatteredStitch","cultural-icon","x"
"A 'Carmen Sandiego' reboot is headed to Netflix, featuring Gina Rodriguez and Finn Wolfhard https://t.co/tosiaqXeX1 https://t.co/LIFoSL06sq","@RollingStone","cultural-icon",
"#GinaRodriguez To Star As Carmen Sandiego In #Netflix Live-Action Feature #GoldenGlobe https://t.co/bCnIRBy6Oh https://t.co/FJJcYAhLOB","@TVolizer","cultural-icon",
"@elmo you've never heard of Carmen Sandiego, the lady in a red hat & trenchcoat who sneaks around the world from Kiev to Carolina, have you?","@JeremiahLiles1","fashion",
"This pent up frustration outlet hunt feels like finding Carmen San Diego, always annoyingly out of reach. Yet still after the same red hat.","@classicjenifer","cultural-icon",
"Gina Rodriguez donning red fedora and trench coat of Carmen Sandiego https://t.co/4H16298BXH","@BobbySmitty3","cultural-icon",
"Gina Rodriguez donning red fedora and trench coat of Carmen Sandiego https://t.co/8DCDGQNYiO https://t.co/TPE3703pyc","@TheTomColeman","cultural-icon",
"Gina Rodriguez will be donning the red fedora and trench coat of Carmen Sandiego for Netflix https://t.co/i8qYP75OaW","@fastnewstech","cultural-icon",
"Carmen Sandiego is out on the town! Happy Halloween 🎃👻🍁 @ Los Angeles, California https://t.co/tzuiEt90tf","@katsilvia","fashion",
"Truthfully.... I'm not sure who found who?!? #CarmenSandiego or #Waldo. #cosplay #BostonComicCon… http://t.co/EF7zRPsAX4","@thejohnlee","cultural-icon",
"The Gucci Fall 2011 collection would be perfect for Carmen Sandiego on Netflix. https://t.co/1uYU69ylKw","@themadameblue","fashion",
"@adrianpatnod I had the Carmen Sandiego game and she was seriously the coolest. As a kid who grew up in Thailand, I loved her world-traveling badassery.","@adrianpatnod","edutainment","x"
"Get Gina Rodriguez a Giant Coat, Because She’s Doing a Live-Action Carmen Sandiego Movie https://t.co/nUfTtEcq1I via @Vulture","@The_News_DIVA","cultural-icon",
"Netflix Reboots 'Carmen Sandiego' With Gina Rodriguez https://t.co/t6j5je8ecn https://t.co/WKVStidLgB","@toptvokevision","cultural-icon",
"Yas my role model @HereIsGina slayin' on @TheEllenShow today! 💃🏾#CarmenSandiego #JaneTheVirgin https://t.co/fzdOqDdeJS","@lreyna_17","inspiration",
"New post on my blog: Netflix is bringing back ‘Carmen Sandiego,’ and it’s going to star Gina Rodriguez https://t.co/Uaa9cP7pyC","@toptechin2017","cultural-icon",
"Man, I sure love that title song. Besides, Carmen Sandiego wasn't even that much of a baddie. She was just a very grey character. And that show was so great. Also very educating. https://t.co/SuisfmYvrP","@In_somniac19","cultural-icon",
"There's going to be a Carmen Sandiego show on Netflix??? YES!!","@syntheticiris","cultural-icon",
"Netflix orders animated Carmen Sandiego series https://t.co/ZOXCDi5L54 #Science #Tech #Culture #Reviews #Art #Media #News #Longform https://t.co/SmCjGppMdp","@Iconjurer","cultural-icon",
"The new Carmen Sandiego will defeat Thanos in 2019 @lesbihayley https://t.co/b6zzBrJeN3","@jeanmafuentes","cultural-icon",
"Erin Andrews fashion inspiration for the day is Carmen Sandiego","@mpbirchtree","cultural-icon",
"Whenever you’re feeling down about your bad decisions, remember that a winner on Where in the World is Carmen Sandiego once chose Idaho as her prize vacation. So cheer up emo kid.","@tinyelvisbkwd","travel",
"Netflix is rebooting Carmen Sandiego! https://t.co/OJMVpgiqz1 ~ @MandyShewFM https://t.co/FKaefKKwSU","@VirginRadioWPG","cultural-icon",
"@viiicky_j I say we live the Carmen SanDiego life and just globetrot and steal landmarks to fund further globetrotting","@Drunk_Sup3rman","cultural-icon",
"Carmen Sandiego has escaped and is once again hidden in the school! Find her for rewards, clues can be found by my door, or in classroom! https://t.co/wfBxZ627ES","@MrBrahn","cultural-icon",
"Already have my next Halloween costume planned out. Carmen Sandiego. My date&39;ll go as Where&39;s Wally. Always wanted to do that","@fletcherfm1359","cultural-icon",
"Travel the globe like a crook ducking Carmen Sandiego..","@1kSTEEZ","travel",
"Carmen Sandiego doesn't need a man she travels the world alone","@Sir_Rosebullet","feminism","x"
"#JaneTheVirgin star Gina Rodriguez to voice Carmen Sandiego on Netflix series https://t.co/Jh87g3dcZx https://t.co/RQodybt6EW","@FOXCinemas","cultural-icon",
"Carmen Sandiego' Reboot Headed to Netflix https://t.co/NrmwLLohQG https://t.co/0zBKQBG45a","@NoticiasEnglish","cultural-icon",
"@signup2013 Jane the Virgin's Gina Rodriguez May Voice Carmen Sandiego on Animated Netflix S @signup2013 https://t.co/NWpkHh9sKL","@signup2013","cultural-icon",
"my mission this year is to make @TheActualDRose be Carmen Sandiego for Halloween #WhereInTheWorldAreYou #RedFedora http://t.co/0vToWGt3IW","@ally_babi","fashion",
"Okay so @SariCarpenter posted a picture of Carmen San Diego and @peytonpclark posted a picture of Where's Waldo.....Halloween costumes????","@leifer_lizzie","cultural-icon",
"@peoplearewild @netflix @HereIsGina Thanks a lot, now the Carmen Sandiego song is gonna be in my head all day. 😄 Memories of when my kids were young.","@sarcastic_tara","cultural-icon","x"
"I just loved this show #CarmenSandiego #Cosplay https://t.co/QcEqrI78YP","@panchtatvam","fashion",
"@Wise_TMJ you the real life Carmen Sandiego..","@beyond_beauty25","cultural-icon",
"This Stranger Things Star Will Be In Netflix's Carmen Sandiego Reboot https://t.co/o8gxgbnvj7 https://t.co/sAPBa5Fvn9","@BeautyTrend101","cultural-icon",
"Chuck Norris always knows the EXACT location of Carmen SanDiego. @chucknorris #smarthome #IoT #domotique #homeautomation","@DomoGeek33","cultural-icon",
"Gina Rodriguez Set to Steal Our Hearts as Carmen Sandiego in Netflix Live-Action Movie https://t.co/r6TJRqy6MG https://t.co/g8xHSPJNvr","@Filmedia","cultural-icon",
"The fact that #OITNBseason2 features the lady from the Carmen Sandiego show now trips up my childhood.","@marandagibson","cultural-icon",
"@exjon Carmen San Diego… explored some pretty shady places.","@josephkoss","travel",
"Cookie threw that Hat on like Carmen Sandiego http://t.co/EhdNxnmNZh","@DJLOUDPACKLOS","fashion",
"@irisjaycomics if i had to pick ONE character it'd probably be Carmen Sandiego bc: 1. effortlessly stylish 2. no regard for laws 3. secretly a fucking nerd","@irisjaycomics","fashion",
"Gina Rodriguez Cast as Voice in Upcoming Carmen Sandiego Show at Netflix #TuneIn #TVInColour #GinaRodriguez #CarmenSanDiego #Netflix https://t.co/dWXgxspGC6","@TVInColour","cultural-icon",
"This year I saw a LIVE Delorean. Yesterday I saw hoverboarder Marty Mcfly. Time Travel is possible! Also, Carmen sandiego and Godzilla.....","@Powrev","cultural-icon",
"carmen sandiego game but an immersive sim","@goalcam","cultural-icon",
"Already have my next Halloween costume planned out. Carmen Sandiego. My date&39;ll go as Where&39;s Wally. Always wanted to do that","@rubibopcalderon","fashion",
"‘Carmen Sandiego’: New Images Tease the Animated Netflix Series’ Arrival in 2019!! Check It Out!! #CarmenSandiego, #FinnWolfhard, #GinaRodriguez, #Netflix https://t.co/UwyU2ZxQoK https://t.co/k3wpoJkw4a","@movizark","cultural-icon",
"@SiMpLyShOtTi you a real life Carmen San Diego minus the hat","@TheHyLife","fashion",
"⚡️ “Netflix greenlights a Carmen Sandiego series” https://t.co/nuVzF7JlBH","@dijonlowkey","cultural-icon",
"Interesting infographic on gamifying the classroom. Pretty nostalgic! Carmen Sandiego anyone? http://t.co/6SGzTpRpEd #edtech","@TFAEdTech","cultural-icon",
"The Making Of Carmen Sandiego - https://t.co/iBWNZUtDj2 The Making Of Carmen Sandiego Where In The World Is Car... https://t.co/mvaYpOSDGO","@OHTML5GAMES","cultural-icon",
"The Tilt cover of Where In The World Is Carmen Sandiego? completely misses the point.","@ray_whitney","cultural-icon",
"I’ve always wanted to be Carmen San Diego. Maybe I’ll finally work on doing that for next year. I guess I should start planning now. Lol","@Mhaysee","inspiration",
"ok so the knowledge that Carmen Sandiego lives on Netflix is my anchor for this insane day at work it's keeping me sane rn omg","@powerkranz","cultural-icon",
"Found her on a river boat. #WhereInTheWorld #CarmenSanDiego #RoadTrip #Adventure https://t.co/A3aEzQRm6n","@iLoveUrbanDecay","travel",
"Dressing up as Carmen Sandiego tonight, and my hat has mysteriously gone missing. The irony, unlike the hat, is not lost on me.","@LoreKeating","fashion","x"
"Gina Rodriguez will play Carmen Sandiego in the live-action movie https://t.co/bhG000pZOr #movies #netflix","@iSanjayJoshi","cultural-icon",
"Netflix orders animated Carmen Sandiego series https://t.co/oeIeldmyjt https://t.co/CT30f26ZBu","@eBasiony","cultural-icon",
"Where in the world is #CarmenSanDiego #Halloween #RPlace #red #drag #gaybar #robbieturner #gayboy #fabulous #glamour http://t.co/EYyfiLgUbf","@TheRobbieTurner","fashion",
"@cgousman personally i think ur gettin ur lovely Carmen Sandiego on in the hat/coat ,very nice lol. #Starlet","@mestasenesta","fashion",
"Why Joe dressed as Mr. Incredible but got on the Carmen San Diego hat?","@GuttenALaPlaya","fashion",
"You may have never learned Carmen San Diego's whereabouts, but you still have a chance to find these in #Vegas. Take our photo quiz: https://t.co/ofynJXETDf https://t.co/rvZzZFEA0H","@TotalVegasBlog","cultural-icon",
"Via @mxdwnmovies: Gina Rodriguez ( @HereIsGina ) to Play Carmen Sandiego in Live-Action Feature https://t.co/BmV0DLmWNH https://t.co/8fDxFBPUG1","@mxdwn","cultural-icon",
"Upon seeing a globe, l sang ""where in the world is Carmen Sandiego"". Anyone would do the same.","@_cdomino","cultural-icon",
"Watching Where on the Earth is Carmen San Diego? and I'm actually learning stuff. #education","@mew90","edutainment",
"Netflix’s Animated ‘Carmen Sandiego’ Series Gets January 2019 Premiere Date https://t.co/2u6dOeWj4M","@TenCountry973","cultural-icon",
"Gina Rodriguez Is Netflix's New 'Carmen Sandiego' https://t.co/AfWonHBwdp","@AnimationUpdate","cultural-icon",
