"text","handle","category","star_tweet"
"JANUARY 18!! JANUARY 18!!! WATCH CARMEN SANDIEGO ON NETFLIX ON JANUARY 18!! WE ALL WORKED VERY HARD ON IT!!","@amandawtwong","cultural-icon",
"@therealDJAshB Giiiirrrrl lol, the next party u throw should require us to wear wigs lol. Lika where is carmen San Diego party lol","@ImMzFree_TRICK","fashion",
"Get a first look at Netflix’s Carmen Sandiego animated series https://t.co/BW9UerCRwx https://t.co/LBRhVw5z1u","@ElmaElmacholt","cultural-icon",
"Carmen Sandiego, my car keys and any Rooster fan who agreed with the courting of Robbie Farah. Everyone start looking.","@eld2_0","cultural-icon",
"and now I have this ""Where in the world is Harry Styles"" stuck in my head. To the tune of ""where in the world is carmen sandiego""","@crazydramageek","cultural-icon",
"@AshleyCsanady commence giant Carmen Sandiego hat memes","@Melanie_Paradis","fashion",
"How Carmen Sandiego accidentally became an educational game icon https://t.co/F6ev0EDjjq","@KaseyGamez","role-model",
"VINTAGE-WHERE IN THE USA IS CARMEN SANDIEGO- Mystery Geography Board Game- 1993 https://t.co/UsF0wE6X8y https://t.co/CTkN2FlcOF","@GreatToysG","cultural-icon",
"Gina Rodriguez Voicing Carmen Sandiego in Netflix Show https://t.co/AHVJNIWKQD https://t.co/1lIq4E0Yhx","@NintendoXSwitch","cultural-icon",
"@mostlybree I LOVE HER HAT. It feeds into my latent Carmen sandiego love","@AlishaRai","fashion",
"Where in the world is Carmen SanDiego?","@jooleesaid","cultural-icon",
"So, the Persona 5 heroes use Lupin III, Carmen Sandiego, Captain Kidd, and Zorro as their personae. What famous outlaws are left?","@austinyorski","cultural-icon",
"Does Agent Carter always wear Carmen Sandiego's hat? #HTGAWM #HowToGetAwayWithMurder","@moniqueblognet","fashion",
"Gina Rodriguez will star in Netflix's live-action 'Carmen Sandiego' movie https://t.co/xkQJuXVUbc https://t.co/X7YPXt6VmH","@UPROXX","cultural-icon",
"It's Official: Carmen Sandiego Is Getting Her Own Animated Netflix Series https://t.co/VfMucdKIIB [via io9]","@darylelockhart","cultural-icon",
"@ErikaElyLewis @TBSNetwork @CaptainPlanet What?! That is so cool! I really learned a lot from that show! And Carmen SanDiego! :)","@Emmieinthecity","edutainment",
"Netflix Is Reportedly Reviving Carmen Sandiego With Gina Rodriguez https://t.co/BE8nFkcr7w https://t.co/k8muB3dZjb","@WMTWTV","cultural-icon",
"That moment when you realize the Carmen San Diego cosplay legions are actually Agent Carter #SDCC2015 #JustSleepDeprivedThings","@greglyon","fashion",
"Gina Rodriguez will bring Carmen Sandiego to life for Netflix https://t.co/7Pq9EQROen https://t.co/fUOFYnM299","@Channel__One","cultural-icon",
"Netflix is developing a live-action Carmen Sandiego movie https://t.co/yO5Wzrrfac https://t.co/OCamqDg69Q","@hotgamespc","cultural-icon",
"Gina Rodriguez To Star As Carmen Sandiego In Netflix Live-Action Feature https://t.co/pbJg7ejud3 via @deadline","@MZiets","cultural-icon",
"Is it weird to want a queer-er version of Ivy's outfit from Carmen Sandiego? #whereintheworld #carmensandiego #90skid","@EauxYesExclmtn","cultural-icon",
"#breakingkenyanews Gina Rodriguez to Produce and Star in Live-Action “Carmen Sandiego” Movie https://t.co/EDNcHweIuj via @omg_checkitout","@wangari_kimotho","cultural-icon",
"@ALLDAY_TJ Every time I've seen the ad with her in the red fedora, I think it's Carmen Sandiego.","@wilcomoore","fashion",
"Carmen Sandiego and Cobra Kai! Happy Halloween from The Sweat Social! #Halloween #happyhalloween #nola... https://t.co/VtPC4fiHE8","@TheSweatSocial","fashion",
"Where am I?! #whereintheworld #carmensandiego #where #travel #explore #architecture https://t.co/s5AVcBsrGi","@fsforeigner","travel",
"Get Ready, Gumshoes: Netflix Might Be Bringing Back Carmen Sandiego https://t.co/tCZBG7gGwo","@jtitsworth","cultural-icon",
"Gina Rodriguez Is Netflix's New 'Carmen Sandiego' - Animation Magazine https://t.co/XlrLaLjHUI","@Animationtweet","cultural-icon",
"Netflix finds 'Carmen Sandiego' for its latest reboot https://t.co/AMgdXxlyve https://t.co/yHWTQUcqwq","@Siddharthjrs","cultural-icon",
"Where In The World Is Carmen Sandiego? Who remembers this, Ioved it as a kid. Great show http://t.co/S3LRyd5hgz","@natrepair","cultural-icon",
"TechBite: ""Netflix's 'Carmen Sandiego' debuts on January 19th, 2019"" https://t.co/yyLqBmGWI6 #ITishNews","@shahfahadz","cultural-icon",
"If the Carmen Sandiego Theme Song was Metal… : https://t.co/zJ0eyGBFUK","@RockNewsFeed","cultural-icon",
"how he get Carmen Sandiego hat is the real question.","@___YanYan","fashion",
"Netflix orders animated Carmen Sandiego series https://t.co/OIY62nYTGA via @Verge","@RoseCaraway","cultural-icon",
"Is carmen sandiego on netflix? I need it to be.","@audiofreedom","cultural-icon",
"For Halloween, I would like to do a couple costume of Where's Waldo/Carmen San Diego, but where we just don't show up to any parties.","@wyllinois","fashion",
"Doing my best impression of Where in the world is #carmensandiego lol! I love this season because I enjoy wearing hats 👒🤠🧢 _____ #fashion #fashionblogger #photoshoot #style #fashionstyle… https://t.co/xLaT1AKL7d","@ShannonCWillis","fashion",
"Carmen Sandiego is returning as an animated children’s show on Netflix https://t.co/ysbsSweyCJ https://t.co/zWsz9rbuUO","@SmurfetteSims","cultural-icon",
"@netflix Where In The World Is Carmen Sandiego with Morena Baccarin, please","@matsbri","cultural-icon",
"Carmen Sandiego invented scamming and was the true gay icon","@mmcclena","role-model",
"Kotaku: Netflix is making a live-action Carmen Sandiego movie. https://t.co/ebiw5gvI9t https://t.co/XwSFB1nJSn","@KaryApps","cultural-icon",
"Where in the world am I? (Carmen Sandiego) HAPPY HALLOWEEN 🎃 https://t.co/OsoansWGet","@cappisces","fashion",
"@PushinUpRoses Carmen Sandiego, Treasure Cove! (by The Learning Company), and Encarta Encyclopedia's MindMaze.","@link5261","cultural-icon",
"@jmedriver you going to Belize? Maybe you'll find Carmen San Diego lol. Sounds like an interesting trip.","@lvilleshawn","travel",
"Where o'where will Carmen San Diego land this year? #travel #centralamerica #bonvoyagebiotches… http://t.co/cpS0QxjV0K","@yoloyogagirl","travel","x"
"Catching Carmen Sandiego #MyCrazyChildhoodDream","@harleyquinnical","cultural-icon",
"@ganbariley God, that throws me back all the way to 2004 when they aired Carmen Sandiego on french tv and seeing this gives me hype af","@BetamaxLoss","cultural-icon",
"Need a kickstart a trip to find #bae ... Aka Carmen San Diego","@YUNG_LOTION","travel",
"like yes I am aware thank you that is the reason for the question + it was a veiled carmen sandiego reference","@stargateship","cultural-icon",
"An N-Pacer inside joke 👑🕵🏾‍♀️ Special thanks to Crow for making the original transparency edit that inspired me to draw her as Carmen Sandiego~ https://t.co/8IXStfOrRa","@CureAdelie","cultural-icon",
"Carmen Sandiego has hat envy. https://t.co/ejrsRdQb4I","@meanrice","fashion",
"#DidYouKnow that the first three video game titles in the popular edutainment franchise Carmen Sandiego saw player… https://t.co/C2Cnl4s1w2","@DidYouKnowWP","cultural-icon",
"In 5th grade, I got a computer. Was really into text adventure games and obviously Carmen Sandiego! 6th grade, I accidentally bought (1)","@MeganDoesNOLA","cultural-icon",
"@PBSKIDS - What happened to the classics? Wishbone? Where in the World is Carmen Sandiego? Ghost Writers? Back when television taught children.","@DrBrianCook","edutainment",
"So, what if Carmen Sandiego was just like ""I'm bored, i need to find my replacement."" So she travelled around the world...","@SuperCaballeroJ","travel",
"What You Learn Hunting Carmen Sandiego Without Google's Help https://t.co/8JNTYevV7k","@ShitShat","edutainment",
"@SecUllr yeah what I know about the Norse is what I learned from the computer game Where In Time is Carmen Sandiego.","@CAPBrony","edutainment",
"Found Waldo and Carmen San Diego. My work here is done. #Halloween","@ajfeuerman","fashion",
"So the MMPR & #TheTick are making comebacks in the 2010s. And Netflix is already planning to make a Carmen Sandiego show in 2019!","@Wilt2K12","cultural-icon",
"there's no basis for carmen sandiego's knowledge of geography, more like carmary sue-diego https://t.co/Eh35DtVfOc","@baileymeyers","cultural-icon",
"If Carmen Sandiego is now a theatrical vigilante thief committing crime for a greater justice, does this mean... Will the police and INTERPOL effectively act as quasi-villains? That could be interesting.","@ElucidoVia","cultural-icon",
"Already have my next Halloween costume planned out. Carmen Sandiego. My date&39;ll go as Where&39;s Wally. Always wanted to do that","@salvatorefo1228","fashion",
"[Mashable] Gina Rodriguez donning red fedora and trench coat of Carmen Sandiego https://t.co/0DKtFJxpuG","@solpric","fashion",
"Carmen Sandiego' Coming to Netflix, Voiced By 'Jane the Virgin' Star https://t.co/8chCsKrDcQ https://t.co/ryEfv0UO3i","@mix977hv","cultural-icon",
"@_lilylionheart UPDATE: @swatisaur and I have named her Carmen San Diego CAUSE WE HAVE NO IDEA WHERE SHE IS","@_lilylionheart","cultural-icon",
"It's Official: Carmen Sandiego Is Getting Her Own Animated Netflix Series https://t.co/OhghoHrNTQ via @io9","@galaxyalex","cultural-icon",
"Just another day being Carmen Sandiego #NSBE #frequentflier ... But I will be doing research work on this trip !! http://t.co/6ZhiziCWVY","@lightuptheFIRE","travel","x"
"Gina Rodriguez To Star As Carmen Sandiego In Netflix Live-Action Feature https://t.co/qywIPZDqg9 via @deadline","@CBSEntDiversity","cultural-icon",
"Oh hey, btw, guys, I figured out why nobody's ever found Carmen Sandiego. She went and changed hats on us! #happyhalloween https://t.co/NGNcPjM5uH","@thebitterbeast","fashion",
"@DariusUncensord and that she is exploring to find her missing mother, Carmen San Diego...","@TheCool_","cultural-icon",
". @netflix has reportedly ordered 20 episodes of a ""Where in The World Is Carmen Sandiego"" reboot: https://t.co/wjoawxLYkF https://t.co/WHDuBFqpK2","@mystar1025","cultural-icon",
"Searching for my next adventure. Where on earth is Carmen SAN DIEGO... 🌍🌎🌏","@TheLittleTravis","travel",
"So, the last time I read in Carbondale it was Halloween and I dressed like Carmen Sandiego.","@daniellevalore","fashion",
"Netflix’s #CarmenSandiego Animated Series Adds Stranger Things Star https://t.co/jGAjhhpEgs https://t.co/YlGdLJfRYY","@FreddieMKR","cultural-icon",
"IGN: #CarmenSandiego is back in an all-new animated series coming from #Netflix! https://t.co/C18uZz72m9 https://t.co/iyPSzopZcd","@NGG_PR","cultural-icon",
"Gina Rodriguez to Star as Carmen Sandiego in Live-Action Netflix Film https://t.co/BrtXYHzeVY","@WomeninComicsNY","cultural-icon",
"SOMEONE PLEASE ACKNOWLEDGE THAT THEY KNOW ABOUT WHERE IN THE WORLD IS CARMEN SANDIEGO","@isabrownie","cultural-icon",
"@aprikii yeah i had a really detailed carmen sandiego headcanon as a kid lmao. she was my hero","@aprikii","role-model",
"Best part of the opening ceremony is the costuming, second is expanding my knowledge of obscure nations for trivia/ Carmen Sandiego purposes","@iambren10","edutainment",
"""Teach Like a P.I.R.A.T.E."" day at MVMS! Carmen Sandiego stopped by and stole the Liberty Bell… https://t.co/FNT9qzKY7L","@sivewright204","cultural-icon",
"Carmen Sandiego is a wealthy socialite who uses her considerable resources to stage elaborate daring supervillian-level heists in order to make geography interesting enough for kids to pay attention. She's a national goddamn hero.","@CyHawkWRNL","role-model",
"@KennyCable1000 how can I forget her, I spent hours hunting her and her VILE gang on my computer, Carmen Sandiego taught me my geography","@antholilmonster","cultural-icon","x"
"#Gizmodo #AU Netflix Could Be Bringing Carmen Sandiego Back: Where in the world is Carmen… https://t.co/zrBqt1TJ0b","@alayanimajneb","cultural-icon",
"While Carmen Sandiego managed to stay incognito during her trip to MK, she was unable to steal Cinderella castle. https://t.co/WHAZcFKjLM","@hecallsmePP","travel",
"@MsDanaMele OMG YES! Carmen San Diego! When I was in college I had this weird renewed obsession with her. Somehow, I had forgotten she was a villain, and I loved that my mind turned her into a hero. #2k18books","@SarahNSmetana","role-model",
"Wearing my Carmen San Diego jacket to figure out this mystery tonight 😏👀👯","@caragypsyhippie","fashion",
"United States Geography when in the USA is Carmen Sandiego game cards parts http://t.co/UVsET0WGyY http://t.co/CCyZVTgc1s","@justinianopesq1","cultural-icon",
"It's Official: #CarmenSandiego Is Getting Her Own #Animated Netflix #Series, starring @HereIsGina https://t.co/hw9Dq8jviv @io9 https://t.co/YMGKBxOwuE","@mixdevil66","cultural-icon",
"Carmen San Diego's hat #GoodPlacesToHideAnEgg","@JKickinit30","fashion",
"@Da7e @StormofSpoilers Just wanted to say thank you. I woke up singing the Carmen Sandiego theme and it took me a second to remember why it was stuck in my head https://t.co/3cinunEl8p","@kathryn_alyse","cultural-icon",
"@DoomAssistMe @runebee I should point out that Carmen Sandeigo will have an animated series on Netflix soon. https://t.co/EXIxVmnDM3","@Myles_uncharted","cultural-icon",
"just learned there's a carmen sandiego villain named Barb Dwyer and i want that to be someone's roller derby name","@Dorianize","cultural-icon",
"Where in the world is Carmen San Diego?","@CampyNeighbor","cultural-icon",
"Just realized the best cosplay photo would be Waldo and Carmen Sandiego together.","@j_hat","fashion",
"My WCW aka Woman Crush Wednesday beautiful American actress Film & television actress Gina Rodriguez. #WCW #AJBWCW #ginarodriguez #JaneTheVirgin #actress #WomanCrushWednesday #model #director #writer #CarmenSandiego @JaneWriters @TheCW @HereIsGina #beautifulwoman #LatinAmerica https://t.co/A6oANfIjUk","@alex6186","cultural-icon",
"The First Images of Netflix's Carmen Sandiego Are Here - read more - https://t.co/hNKgOvDf9m Carmen Sandiego has been found, and she's looking good on Netflix. Gina Rodriguez will make her debut as the new voice of the iconic globe-trotting thief in the new 20-episode anima... https://t.co/YaWr985lUk","@NewsflashN","cultural-icon",
"Where in the World is Gina Rodriguez? https://t.co/4oKM2yollD","@GamesOnFilmPod","cultural-icon",
"@BlackGirlNerds @ValerieComplex You can't get much more Latina than the name Carmen Sandiego","@saucissonsec","role-model",
"The adult version of Where in the World is Carmen Sandiego is Where in this Parking Garage is my Fucking Car and it’s not nearly as fun.","@cassanova3333","cultural-icon",
"The Brazilian girl in me is so happy that @HereIsGina will play Carmen Sandiego #carmensandiego #Netflix","@carolmaleixo","role-model",
"@KrangTNelson Amber's generation has no Nancy Drew or Carmen Sandiego to teach them proper sleuthing","@not_promoted","edutainment",
"October 27th: it’s not a Queer Lady Halloween Party until there’s at least one Carmen San Diego, one Dana Scully, and one Francine Frensky 😉 #inktober https://t.co/6VpIQFA42h","@ghostbatcomix","cultural-icon",
"@NedraTheDancer yea I'd rather you pull up in a trench coat I need that Carmen Sandiego love 🙏🏾","@JusRideTheJETT","fashion",
"@tabletop They were PC games, but the Carmen Sandiego series was the only way I learned anything about geography or history as a child","@tPfWC","edutainment",
"Where in the World is Carmen Sandiego? — I can't tell you that or I'd have to kill you ;) http://t.co/Qe0YW33YzE","@ashleydooleyxd","cultural-icon",
"its like the game where in the world is carmen sandiego ... i'm waiting for a checkin to wonder where in the world is Scales","@doug_TheBroke","cultural-icon",
"@jodellemicah @NightValeRadio @CecilBaldwinIII @AnimeRevCanada @ArdaWigs @ArdaWigsCanada That's gorgeous! Here's my geekiest (& most nostalgic) cosplay to date 🙂Carmen Sandiego. https://t.co/p5Sxr0zHA7","@cakeandmadness","fashion",
"Netflix's 'Carmen Sandiego' debuts on January 19th, 2019: https://t.co/r8nj6sJYTY","@pops131","cultural-icon",
"Where on #television is #CarmenSandiego ? @netflix #series #comingsoon .. #netflix #streaming #online #tv #indtada… https://t.co/T3otglMizI https://t.co/3bSX0EWpwo","@scifielements","cultural-icon",
"I've had the worst migraine all day and all I can think about is how did Carmen Sandiego stay hidden while wearing that super red coat?","@AntiUmbra","fashion",
"I'm just as frustrated as @Kaneshow with these people not getting the ""car"" game!!! GEEEEEZ PEOPLE #carmensandiego","@Jadachapman","cultural-icon",
"I Just had a fun idea: Carmen San Diego as a dog wearing her signature red cloak and cool hat (ya'll remember her right?)","@Hitaka5Ever","fashion",
"@miriamkp Sounds like a start to a ""Where in the World is Carmen SanDiego?"" style twitter tour of library hiding places! 🕶👠🌍","@teach_research","cultural-icon",
"Whenever I feel bad, I just remember that @netflix is going to reboot the Carmen Sandiego series, and then I feel better","@NotEcons","cultural-icon",
"#CarmenSandiego was a huge part of my childhood and it was awesome to ""find"" her at #Comikaze! Cosplay… http://t.co/0bfhuz0MYy","@thatemilykelley","cultural-icon",
"@gryphoness it has many of the same qualities that got me engaged and learning from Carmen Sandiego @AnaSalter @kballestrini","@Alhusoy","edutainment",
"VIDEO: 10 Reasons Where in the World Is Carmen Sandiego? Was the Best Educational TV Show Ever via PEOPLE.c… https://t.co/8dJwlD3MCh","@WeGotBeats66","edutainment",
"Man, I sure love that title song. Besides, Carmen Sandiego wasn't even that much of a baddie. She was just a very grey character. And that show was so great. Also very educating. https://t.co/SuisfmYvrP","@In_somniac19","edutainment",
"@treepaine Tell Taylor her next Halloween costume should be Carmen Sandiego.","@hopscotchy","fashion",
"This Carmen Sandiego art from Netflix is ABSURDLY good and my body has had chills all day https://t.co/1hKlBshZ0X","@spollenz","cultural-icon",
"ICYMI: Gina Rodriguez ready to branch out 👉🏽 set to star as Carmen Sandiego for Netflix, producing a string of TV series, & starring in features like Alex Garland’s Annihilation and an upcoming remake of Miss Bala"" #JaneTheVirgin @CWJaneTheVirgin https://t.co/w2eWurv5rz","@LDCLatino","cultural-icon",
"@sunnydaejones I guess I always saw Carmen Sandiego as a co-hero.","@bizette","role-model",
"#RoughlySpeaking Who wore it best... #RosalindRussell or #CarmenSanDiego #TCMParty #Hat and a Trench Coat http://t.co/SJA0v1jC24","@TyreeseSculley","fashion",
"@PaganChild Oh lol. I live in Charlotte. That was a play on Carmen San Diego bc I travel so much 😂","@BlkCarmenSDiego","travel",
"Help pick my Halloween costume... Sluagh, the green fairy (think absinthe), Carmen Sandiego, Morgan le Fay?","@KariDru","fashion",
"Bruh...Where in the world is Carmen Sandiego is by far one of the most educational cartoons #handsdown","@JazziMayonnaise","edutainment","x"
"@andrewMFspade I've watched every episode of Carmen Sandiego I'd say that makes me an expert on all things adventure!!!","@iPrinceP","travel","x"
"@LaceRossi Fodor's USA Travel Guide, World Almanac of the USA & Where in the USA is Carmen Sandiego Clue Book help me find Carmen in the US.","@JeremiahLiles1","travel",
"VIDEO: 10 Reasons Where in the World Is Carmen Sandiego? Was the Best Educational TV Show Ever … https://t.co/OHeyuA7Kzw","@solecastrop","edutainment",
"@essaym22 @JordanPDunsmore The Carmen Sandiego one has Gina Rodriguez as Carmen and Finn Wolfhard as Player, so I'm hyped for that.","@essaym22","cultural-icon",
"@HereIsGina Looking forward to catching her backstory next year. #carmensandiego #Netflix https://t.co/q0s8XHZdxh","@PaulGarcia1","cultural-icon",
"@hitoshiusagi @lucy_kick im gonna go the same day he is and im gonna dress up like carmen san diego and give u updates","@slayerizedcarol","fashion",
"Netflix is learning how in the world to play the franchise game with Carmen Sandiego https://t.co/1ZX8yAgiXE","@WY_Butler","cultural-icon",
"Where in the World Is Carmen Sandiego? Becoming a Secret Travel Agent https://t.co/hAZ3JOZWhX","@Un1v3rs0Z3r0","travel",
"True story. Back in the day, if you won on ""Carmen Sandiego"" you could win a trip anywhere in the country. I always thought I'd choose Oklahoma, because I really loved Rodgers & Hammerstein.","@billoram","travel",
"But @DRUNKBOYGEO and I found Carmen Sandiego and the white power ranger on the FDR drive tonight. #sucess","@ashleyyy_lol_","cultural-icon",
"This Vintage Coat has no label but is giving us #carmensandiego and #inspectorgadget all in one.… https://t.co/zMBct3QSZB","@Its_Poppin","fashion",
"Gina Rodriguez donning red fedora and trench coat of Carmen Sandiego https://t.co/X59EVYSQ0X #netflix #ginarodriguez","@wittich","cultural-icon",
"New Carmen Sandiego Cartoon In Development For Netflix https://t.co/FSmwWrYBFG https://t.co/T5faq4EGMV","@toonzone","cultural-icon",
"@tipsy_writer #tipsychat Also, back in my day, the best computer games were all educational. Who remembers Clue Finders, Math/Reading Blaster and Carmen Sandiego?","@MsOcampoWrites","cultural-icon",
"Where in the world is Carmen San Diego lol","@erikajtrevino","cultural-icon",
"@TheKalenAllen @TheEllenShow For some reason I’m getting Carmen Sandiego vibes from this outfit lol","@Rafesley","fashion",
"This was totally me for Christmas in the early 90’s. Look for the game Where in the World is Carmen Sandiego” and you’ll learn why I won my middle achool’s Geo-Bee... https://t.co/f4i4Hrz29N","@Hfinlays","cultural-icon",
"Where in the World is Carmen San Diego and Where's Waldo inspiring world travel. https://t.co/VJZ6IhtBba","@waters_jenna","cultural-icon",
"These kids could find Carmen San Diego... TX's state geography bee names a champ https://t.co/vu0KE21vze @dallasnews https://t.co/HVgh2EfCKM","@LandisImages","cultural-icon",
"looking back, I learned a lot of good shit from Where In The World Is Carmen Sandiego. #ChildhoodMemories","@indiarjewell","cultural-icon","x"
"@Hi_Sita thank u so much Carmen San Diego lol","@NewAge_Owtlaw","cultural-icon",
"VIDEO: 10 Reasons Where in the World Is Carmen Sandiego? Was the Best Educational TV Show Ever via PEOPLE.c… https://t.co/Y0asC9HbRy","@styloce","edutainment",
"Studio session went so good tonight where in the hell is Carmen Sandiego lol wrong Puerto Rican chick my bad where's @Double_A2011😂🗼🗼 !","@youngfolk10k","cultural-icon",
"I'm thinking the costume will be Carmen Sandiego tonight…","@MorellaAddams","fashion","x"
"@Imperialgrrl as best I can tell @Banzaibabee did a big Carmen Sandiego style heist on the east coast and is moving west to avoid capture.","@malfunct","fashion",
"I’m so happy they casted a Latina for Carmen SanDiego because let me tell u if they casted another white actress for a POC character smh","@dimplezonpoint","role-model",
"Netflix Is Reportedly Reviving Carmen Sandiego With Gina Rodriguez https://t.co/JLPHMy9M2t","@drocktrot","cultural-icon",
"@GeekBomb I can't tell if that is the hat of Carmen SanDiego or Darkwing Duck.","@Cadmandu","fashion",
"Worlds Cheapest Flights: http://t.co/7GLAWdIdu1 Catch me if you can .....where in the world is Carmen San Diego l… http://t.co/70dke6NNRO","@TravelDealsInt","travel",
"https://t.co/hDoYNVZsuk Carmen Sandiego May Be Fictional, but Her Style Is Hugely Influential  https://t.co/ns5RfCLKk4 https://t.co/P1dk2DwXbO","@rent_the_look","fashion",
"Where in the world is Carmen Sandiego? All clues lead to Netflix (And Gina Rodriguez.) https://t.co/cofkWTSigq https://t.co/gzyzhn141E","@DeShaunsMrk","cultural-icon",
"It's like playing where in world is Carmen Sandiego when my parents travel if I guess right my bills get paid for a month #iguessedwrong 😣","@mixmastermegs","travel",
"• Vogue: What if Carmen Sandiego wore haute couture? https://t.co/9AfS2OMlHL https://t.co/gyNJI5kfLb","@kelenike","fashion",
"The guy is like a real life Carmen Sandiego. https://t.co/Jf7jWEKVUU","@RussCanRead","cultural-icon",
"@iSmashFizzle Carmen Sandiego and Shego remain iconic queens who are too good for a world that's beneath them. HBIC. https://t.co/lFlkUiSTeb","@JamesFluker","cultural-icon",
"@Ginger_Zee loving the look! Very ""Where in the World is Carmen San Diego""-chic. #GMA #fashionista #iheartginger. https://t.co/uMLEqVh4ox","@MTimHossain","fashion",
"@antoinetriplett wow carmen sandiego and mario in the same car.","@antoinetriplett","cultural-icon",
"Gina Rodriguez to star as Carmen Sandiego in Netflix's live-action movie https://t.co/LjJtitoqgg","@kenyettaoverton","cultural-icon",
"Let's hope Ghost Writer is next! ⚡️ “Netflix greenlights a Carmen Sandiego series” https://t.co/1nEtXxLpUX https://t.co/362eNL4hZk","@elcezsays","cultural-icon",
"@scottsROW @CXHairs Like Carmen Sandiego, look for the enormous hat.","@SC_Cycling","fashion",
"First memories - Oregon Trail & Carmen Sandiego - are games - and we still resist gamification in education? #edtechchat","@ajpodchaski","edutainment",
"Carmen Sandiego Ready to Steal the Netflix Spotlight in January https://t.co/I4faKkJCOc https://t.co/4k83JZWebe","@moviesteem","cultural-icon",
"@Dibadisney there must be a Carmen Sandiego-style hunt that has mystery clues in the flower market at the church, then.","@keristars","cultural-icon",
"Someone get Jessica Chastain a fedora and trenchcoat and let's make that Carmen Sandiego movie already! https://t.co/N1bOW2nTLS","@IPreferPi314","fashion",
"Netflix Takes Aim At Hollywood With Gina Rodriguez's 'Carmen Sandiego' - Forbes https://t.co/nLXCW6mBc0 #Hollywood #hollywoodnews","@hashhollywood","cultural-icon",
"I found Carmen Sandiego! #GopherGameDay #HappyHalloween @ViaMarsala18 https://t.co/KNQ9K8YQEz","@BabyKorn1","fashion",
