"text","handle","category","star_tweet"
"@townhallproject @baddogmarley @DevinNunes And @SenCoryGardner who technically had a town hall or two but in a kind of ""where in the world is Carmen SanDiego"" kind of fashion, and they really shouldn't count.","@cassandraschoon","cultural-icon",
"[Mashable] Gina Rodriguez donning red fedora and trench coat of Carmen Sandiego https://t.co/1x7uaz9OaK","@selenavdp","cultural-icon",
"I'm tempted to go play Mr. Weatherbie's GNES buuuut he didn't have Where In the World Is Carmen Sandiego sooooo bummer","@its_kaylea","cultural-icon",
"Carmen San Diego AND Waldo. I gotta win big. #Halloween #costume #party https://t.co/vjvqTzDRBp","@MacAndrew","fashion",
"This Popular 1980s Cartoon Is Getting the Netflix Treatment https://t.co/Z63PXji7dP https://t.co/IaJvMjhm4S","@FortuneTech","cultural-icon",
"I wish I could play Where in the World is Carmen San Diego","@prideofnowhere","cultural-icon",
"@Lesliiiemarie you out here tryna put Carmen San Diego out of business traveling the world. U don't have time for little people anymore.","@suave_says","travel","w"
"Who remembers this? There was also a TV show too which @netflix is bringing back #carmensandiego #90s https://t.co/k8Y4y2f4ZL","@poly_zero","cultural-icon",
"How Carmen Sandiego accidentally became an educational game icon https://t.co/u4a3fKKPWB","@pixelmessenger","role-model",
"Greatest compliment I ever got: The boyfriend told me I looked like Carmen San Diego in my trench coat.","@edwardo3125","fashion","x"
"... Gina Rodriguez is going to be Carmen Sandiego. I may need to lie down.","@Rabengekraechze","cultural-icon",
"In all seriousness, Netflix please please please don't mess up Carmen Sandiego that's my childhood video game memories right there.","@SamJone66904646","cultural-icon",
"London —> Geneva —> Montreux—> Lisbon —> Porto —> Italy queued up for Q3/Q4 2018. On my #carmensandiego travel steez. 🌍🗺#worldwidecitizen #travelnoire #foreverrestless","@citygirlsnark","travel",
"@PrisBlossom So, @PrisBlossom, I feel like Carmen Sandiego grants the hipster cred we're all looking for, but Legends had a TEMPLE.","@jtotheill","cultural-icon",
"This will be perfect!!! @HereIsGina 👏🏼👏🏼👏🏼 #CarmenSandiego @netflix https://t.co/KAA6MQpsHD","@JonOlivencia","cultural-icon",
"Netflix finds 'Carmen Sandiego' for its latest reboot https://t.co/3jxJqctJpT #strartup #Dubai #UAE #Innovation","@silverbacklive","cultural-icon",
"@LanaWWE @RusevBUL I'm always a big fan of Where's Waldo and Carmen Sandiego as a couple costume!","@malecki_jason","cultural-icon",
"I might wear black for a year straight ⚫️♣️♠️... #blackonblack #black #red #rubywoo #carmensandiego… https://t.co/Cp9V1Pb2Gh","@sipintheair","fashion",
"This Popular 1980s Cartoon Is Getting the Netflix Treatment https://t.co/AzQ2fTe1Ih https://t.co/3mLDMLaCAe","@news2info","cultural-icon",
"But im still happy knowing that Gina Rodriguez is playing Carmen Sandiego 😍","@dirtymartinez","cultural-icon",
"Guess I'mma have to go carmen sandiego on @karlas13 hold up, let me get my red hat and pumps first 💃👒👠","@GrizzlyMcCloud","fashion",
"BanankoJanko: enews: Where in the world is Carmen Sandiego? All clues lead to Netflix (and Gina Rodriguez). … … https://t.co/5YOPUO2QH6","@KarloMdz1","cultural-icon",
"The animated Carmen Sandiego series, voiced by @HereIsGina and @FinnSkata, is launching on Netflix January 18 #CarmenSandiego https://t.co/AcmhjGwwpW","@vitalthrillscom","cultural-icon",
"My aspiration in life is to find Carmen SanDiego","@sevenofthrees","cultural-icon",
"@Trist_Chi I saw a gal in the airport one day in a perfect red coat and in a moment she was gone. That is how I met the real Carmen Sandiego.","@worldnamer","fashion",
"@Mix1041 Where In The World Is Carmen Sandiego #GeographyIsFun","@thesavvybear81","cultural-icon",
"There's a new detective in town. #carmensandiego #cosplay https://t.co/NlWtiOrzaJ","@Angie_BB3","fashion",
"@No_ChillButton absolutely!!! I want to cosplay but I'm not sure as what yet. Maybe Carmen Sandiego","@asiaelle","fashion",
"@ChocoChipRaisin LOVED Carmen Sandiego! I used to watch that show all the time and daydream. It was my first taste of travel!","@GoGirlGuides","travel","x"
"@JLove55 @alexriviello I lived in North Dakota for a while, and we had a custom version of Carmen Sandiego in my classroom. (Where in North Dakota...)","@pheriannath","edutainment",
"@missleylaha Now the Carmen San Diego theme song will be in my head all day","@SLAVES_BC","cultural-icon",
"VIDEO: 10 Reasons Where in the World Is Carmen Sandiego? Was the Best Educational TV Show Ever https://t.co/gtOxEANc9z","@RazzleTazzleMag","edutainment",
"Gina Rodriguez to star in second Carmen Sandiego project for Netflix https://t.co/rNtDX1XQ21","@8vothJve7YONwZV","cultural-icon",
"New 'Carmen Sandiego' Coming to Netflix in 2019, read more https://t.co/OR0bxkaSxk https://t.co/a9GdhlCIDY","@MatthewSardo","cultural-icon",
"Hosted By MFrazz: Sounds Like Netflix Is Bringing Back 'Where In The World Is Carmen Sandiego?' https://t.co/S54niqnb0g","@MFRZProductions","cultural-icon",
"Netflix finds 'Carmen Sandiego' for its latest reboot https://t.co/LSfZs3KHix","@krunox123","cultural-icon",
"Bedelia looks like she's wearing the blue version of Carmen San Diego's outfit. #Hannibal #HannibalPremiere","@kt_pumpkinhead","fashion",
"Lol from the Oregon trail, where in the world is Carmen San Diego, and nicks cat like reflexes... I can't stop laughing. I live my coworkers","@cynthesis646","cultural-icon",
"i want to buy a red coat, pair it with my red hat, and run around like Carmen Sandiego. Not for Halloween, just whenever i feel stealthy.","@twoslicepizza","fashion","x"
"I have no problem with any of this -- Netflix is betting on ‘90s kids nostalgia for learning with upcoming lineup https://t.co/QBf5i8Ndpp https://t.co/ncNEheYtY4","@FancyEpicGaming","edutainment",
"Why did Heather Cox wear a ""Where in the World is Carmen Sandiego?"" hat tonight on air?","@PaulMBanks","fashion",
"Happy Halloween, readers and writers! Let me ask you something: “Where in the world is Carmen San Diego?” https://t.co/SciQLFfoHZ","@ShannonCSimcox","cultural-icon",
"#WhatIThoughtWhenIWas18 I’d travel the world by the time I’m elderly at age 40. Thanks to Where in the World is Carmen Sandiego! I’ve accomplished my goals! Love that game 😉","@DrJeanGreySmith","travel","x"
"Netflix orders animated Carmen Sandiego series https://t.co/hhSc0pfF8R","@RHAF_HQ","cultural-icon",
"The fact that I wanted to be Carmen Sandiego when I grew up probably says a lot about me.","@LetoileSan","role-model",
"A little sad I am still in need of my winter coat this week. Where are you San Diegooooo. #cali #dreams #carmensandiego","@amandadonohue","cultural-icon",
"Carmen Sandiego on @netflix!! I learned so much through that game lol!","@gisellebites","edutainment",
"We don't know where in the world Carmen #SanDiego is, but we know where YOU should be! #Travel to ""America's Finest City"" and be welcomed #California style by the amazing and hospitable staff of @hotel_republic! #Discover more and book your stay NOW! https://t.co/OivdHvdmHe https://t.co/ukSHebi4la","@GayTravel","travel",
"I'm the #lovechild of #carmensandiego and #sallybowles!!!! #redlips #redhat #selfie… https://t.co/4IBHx8HPhi","@notacoconut","fashion",
"Cookie got on here ""Where in the world is Carmen San Diego"" outfit. Fit to kill. #EmpireFox #Empire","@KELiCHiA","fashion",
"All I knew how to do on the computer was play Oregon Trail and Where is Carmen SanDiego. This is such a great opportunity for girls. #STEM #coding #girlpower","@kelleyk525","edutainment",
"Netflix is betting on ‘90s kids nostalgia for learning with upcoming lineup https://t.co/FndkY7MF92 https://t.co/zd5vPCX3pn","@KickItWithAsh","cultural-icon",
"so we just started a lookout for @DanThorn_ #WhereIsDan Move over Carmen Sandiego!","@SpencerWeather","travel",
"Carmen also reminds me of ""Where In The World Is Carmen San Diego?"" She took me places. My car also takes me places. hmm.","@vampyweekz","travel",
"Let's have a Carmen Sandiego reboot. Same theme song, just new. More kids. Focus on adventure not education, and it'll be golden. https://t.co/1PbtxDtcoO","@sydiest","cultural-icon",
"Get a first look at Netflix’s Carmen Sandiego animated series https://t.co/ow1VDg1ee3 https://t.co/afhJMTcllh","@SusanGentileus","cultural-icon",
"@MikePipper2 @Granddad_Sr @_V_Lady @akamaggieak @PineyMcknuckle And she stole her outfit from Carmen Sandiego. That's badass.","@TwoToTheFifth","fashion",
"Carmen Sandiego: Gina Rodriguez to Voice the Role for Netflix https://t.co/cupeoSXYfS via @po_st","@JPaulo645","cultural-icon",
"Kimmy Schmidt's Final Season, Carmen Sandiego and More Coming To Netflix In January https://t.co/hXNzwHdCYm","@AnnisAnnismhdi","cultural-icon",
"The First Images of Netflix's Carmen Sandiego Are Here #vegas https://t.co/A3xMxLOTRY https://t.co/7Z4HIffLhW","@nightlife_nv","cultural-icon",
"Apparently, Netflix is making a live-action movie adaptation and a cartoon based on Carmen Sandiego. I am totally down with this idea, I used to love those games as a kid.","@66Xeno","cultural-icon",
"There’s Carmen Sandiego! “@Attractions: Spotted the @AgentCarterTV bus at Disney’s Yacht Club Resort: http://t.co/8LgU1j67A8”","@parkscopejoe","cultural-icon",
"Watched an old episode of where in the world is carmen SanDiego? I'm still terrible at geography, but really think we should bring it back.","@Drbootymd","cultural-icon",
"Had to recycle Carmen San Diego this year due to last minute issues, but #HappyHalloween Tweeties!! 🎃🌍 https://t.co/aEzUpYt3Tq","@ThaPlatinumOne","fashion",
"Carmen San Diego is on my flight!!! #childhooddream http://t.co/y928lvvP5q","@Ericdehn","travel",
"No one ever stops to ask HOW in the World is Carmen Sandiego. (:","@jdshort","cultural-icon",
"Now wondering if many hours playing Carmen Sandiego (and her being a globetrotter badass head of a criminal org. with an awesome red trench and matching fedora) had anything to do with my later pursuing international affairs, cybercrime research 🤔 🚩https://t.co/7W1MAUzcL8 https://t.co/tN1yi4fwdP","@camillefrancois","edutainment",
"Consider - a cartoon where you have Ms Frizzle teaching a classroom attended by a young Carmen Sandiego.","@EnochBranard","cultural-icon",
"I'm traveling AND wearing my new trench coat today. Carmen Sandiego vibes.","@sosarahsays","travel","x"
"Where in the world is Carmen San Diego... #halloween #carmensandiego #iheardshesinhouston #catchherifyoucan ... 😏 https://t.co/9ilSq3r78N","@ladiiA_X0X0","fashion",
"@IUWSoccer How on earth did an Austrian end up in Guatemala and then Indiana? It’s real life Carmen SanDiego.","@DanielKarell","cultural-icon",
"‘Carmen Sandiego’ Series Greenlit at Netflix with Gina Rodriguez | Variety https://t.co/gdFdeNmx9s","@RafaFloresLA","cultural-icon",
"Sudden flashback to how much time I spent playing Carmen Sandiego: Math Detective in my youth","@WretchScientist","cultural-icon",
"Netflix Could Be Bringing Carmen Sandiego Back https://t.co/zKOWAUmzFz","@MR_PUNJABI","cultural-icon",
"I give credit to Carmen Sandiego for helping me learn my state capitals.","@writefelissa","edutainment","x"
"@RJCity1 While pursuing Carmen Sandiego?","@Justin_E_Preece","cultural-icon",
"Sounds Like Netflix Is Bringing Back 'Where In The World Is Carmen Sandiego?' https://t.co/QEt8ydwFSD","@madine3","cultural-icon",
"Where in the world...#100happydays day 22 #worldtraveler #halloween #carmensandiego #costume http://t.co/FTmHTs78jE","@ManicPixiTravel","fashion",
"Carmen Sandiego was the realest female Villain!","@leeeyo_","role-model",
"OHMYSHRIMP! Thrilling news! @netflix will be the home to a NEW #animated series for #travel friend #CarmenSandiego! https://t.co/nw9O3JuvK8","@GarminSandiego","travel",
"Pharrell stole Carmen Sandiego's hat. #Ironic #NBAAllStar","@MarkMcLovin","fashion",
"@HereIsGina GINA PLS TELL ME UR PLAYIN CARMEN SANDIEGO","@thebevpoet","cultural-icon",
"Netflix orders animated Carmen Sandiego series https://t.co/bzITbysNCN #technology","@TechNewsRT","cultural-icon",
"Wasn't expecting this so soon! Netflix's new #CarmenSandiego series starring #JaneTheVirgin's Gina Rodriguez and #StrangerThings' Finn Wolfhard will premiere on January 18. https://t.co/76W4Y9NHXR","@LAdynerdsMeetup","cultural-icon",
"@HereIsGina @netflix Carmen Sandiego is one of my favorite Characters. I can't wait for this project! Netflix is KILLING IT!!!","@SpaceyScorpion","cultural-icon",
"#BTS of an #Tbt Carmen Sandiego 📺 Photoshoot I shot in my studio a few months back💃🏼.💡Styled in… https://t.co/CETanOKiTv","@OfficialAEmery","fashion",
"Netflix orders animated Carmen Sandiego series https://t.co/91TAs0qkVK https://t.co/7dDQayDwd3","@ClimbersIce","cultural-icon",
"Geography 210: No One Cares where Carmen SanDiego is. @midnight #WorseCollegeClasses","@guapsterlulu","cultural-icon",
"Gina Rodriguez, ‘Stranger Things’ actor, to lend voice to Netflix’s ‘Carmen Sandiego’ https://t.co/2KSnvwe5He","@cahyasri","cultural-icon",
"Where in the world is Carmen Sandiego? Apparently, the answer is about to be “Netflix,” and she’s bringing Gina Rodriguez along with her. … https://t.co/oDpd05OJ2u","@Lightatrocity","cultural-icon",
"Got Carmen Sandiego working on my Apple IIe! Just needed to give the drive interface card a shake. https://t.co/y3ndW3c3R8","@Sierra_OffLine","cultural-icon",
"Netflix plans live-action 'Carmen Sandiego' film with Gina Rodriguez https://t.co/IJztznFiNK","@BlurbBoard","cultural-icon",
"Got another check mark on my Halloween costume bucket list!! #poisonivy hanging out with Carmen San Diego and Joker! #halloween #rfdidi #deeliteful #advocarenerd @ Nebraska https://t.co/y1kxya6EKT","@deeliteful_di","fashion",
"@M_A_Patterson My costumes are always geeky. Last year I was Carmen Sandiego.","@taradwyatt","fashion",
"Interactive Swift playground book teaching hacking/cryptography w/ ‘where in the world is carmen san diego?’ theme. 😍","@drunknbass","cultural-icon",
"Carmen San Diego! Somebody besides me remembers her? She made geography (and then history) fun! Still look'g for her https://t.co/O9o3cFWELz","@leprchaunrabbit","edutainment",
"Netflix's animated CARMEN SANDIEGO series starring Gina Rodriguez confirmed; Finn Wolfhard to also voice a role https://t.co/Dq2nNy18O6 #TV","@charlestrotter","cultural-icon",
"Where in the world is Carmen Sandiego? In case you’re wondering, it seems she’s taken off with some of our Erstwilder Halloween treats! 🎃🖤 Jess @cakeandmadness looked fab in her classic costume at our event last Saturday 😍❤️ https://t.co/SaF0eOoqx5","@Erstwilder_","cultural-icon",
"Should Nick & I be Waldo & Carmen Sandiego for Halloween?","@_madzo","cultural-icon",
"Gina Rodriguez To Star As Carmen Sandiego In Netflix Live-Action Feature https://t.co/O8vNJmFKVh https://t.co/HRaH2crucK","@HotStumbles","cultural-icon",
"Have we actually found out where Carmen Sandiego is or she still going around robbing people and traveling the world freely crossing border control with an arrest warrant ? #whereintheworldiscarmensandiego","@TimMaccheroni","travel",
"Gina Rodriguez Is Going To Be Carmen Sandiego In A Live-Action Film And I'm Breaking Out My Red Fedora To Celebrate https://t.co/uNpZqhcd7F","@charlieinthebox","fashion",
"Changed my mind: 2014 I'm tryna be Carmen San Diego chic","@surrealsermons","fashion",
"Gina Rodriguez donning red fedora and trench coat of Carmen Sandiego https://t.co/7UBG1wRiVL https://t.co/RYLic0B93x","@Eletiofe","cultural-icon",
"#Netflix finds '#Carmen Sandiego' for its latest reboot #internationalspy #GinaRodriguez https://t.co/zTD0wdwWrN","@Gamolizer","cultural-icon",
"@Lin_Manuel @eheinlen I always assumed Carmen San Diego gave up the spy life and settled down with a talented artist and the dog she found in her travels. Then she changed her name to Vanessa..they say, behind every great man.","@DPinto85","travel",
"Where in the World Is Carmen Sandiego? #Security #safetravel #travels #CyberSecurity : https://t.co/TiU5NPkuAl","@MarkoIvanusa","travel",
"Carmen Sandiego coming to Netflix in 2019 #netflix #carmensandiego #animatedseries https://t.co/8kLSHDdZlr https://t.co/yxOty1YoxY","@mediaquartic","cultural-icon",
"@RKalland @TylerIAm this is a list of answers to a Carmen Sandiego adventure","@edsbs","travel",
"Gina Rodriguez To Star As ‘Carmen Sandiego’ In Netflix Live-Action https://t.co/EPaTBDsugo via Upcoming100","@Max_Flimflam","cultural-icon",
"@JoshuaMK2 When I saw this coat, the first thing that came to my mind was Carmen Sandiego.","@MineBoomGaming","fashion","x"
"If you find yourself needing an encyclopedia set, may I suggest being a contestant on Where In the World is Carmen Sandiego? #gumshoe","@NitWok","cultural-icon",
"Netflix Is Reportedly Reviving Carmen Sandiego With Gina Rodriguez https://t.co/NriReBgeyW https://t.co/jH06yhTyIq","@freeonlineup","cultural-icon",
"Kourtney Kardashian Takes Younes Bendjima on a Surprise Birthday Trip Oh, the places they'll go! Kourtney Kardashian channeled her inner Carmen San Diego for Younes Bendjima's birthday--and no, we're not talking about a role-playing fantasy.... https://t.co/qBZQizG7D0","@ArnoldOwens10","travel",
"Yo tameka with that Carmen sandiego hat on #AtlantaExes","@jazzi_babi927","fashion",
"Who remembers the game where in the world is Carmen Sandiego?💕✈️🌎 • That's me 🙌🏻💕 • Adven… https://t.co/fyAPgmJdS7 https://t.co/1FUM80UPQ4","@fitlifecreation","cultural-icon",
"@FXDWGTJ @negativecamber_ @charlie_whiting @PaulF1B @LewisHamilton I see he went with his Where in the World Is Carmen Sandiego outfit","@GraceRD1","fashion",
"@puppypudge So if you want to rock a fedora you basically have to be Indiana Jones, Sarah Bernhardt or Carmen Sandiego.","@Pisscress","fashion",
"Gina Rodriguez to Star as Carmen Sandiego in Live-Action Netflix Film https://t.co/Sh1u6sD8qN","@mraustinjq","cultural-icon",
"I'm still waiting on my invitation to compete on an episode of Carmen Sandiego...I can get all of these maps correct!","@Aguilla112","cultural-icon","x"
"Tbh the Carmen Sandiego/Waldo couple's Halloween costume is the best one I've seen yet","@courtlizcamp","fashion",
"Tryna decide between dressing up as Spinelli or Carmen Sandiego for halloween","@_YoKizzzle","fashion",
"Netflix plans live-action ‘Carmen Sandiego’ film with Gina Rodriguez https://t.co/K53KjrGDaN","@son93ksnb","cultural-icon",
"Netflix Could Be Bringing Carmen Sandiego Back","@xorewohykef","cultural-icon",
"@0xabad1dea likely wearing 13.5 women's, or like Carmen Sandiego's hat!","@pira_ebooks","fashion",
"Its Carmen Sandiego without her trenchcoat😱😱😉 https://t.co/LUEkUY94bd","@Attilathehunnny","fashion",
"""Where is Carmen Sandiego?"" ""On netflix, apparently."" Guh, 90's. https://t.co/nVufECAb4T","@Des_Shinta","cultural-icon",
"Netflix is betting on ‘90s kids nostalgia for learning with upcoming lineup https://t.co/W1NoEBq5id","@WitWGARA","edutainment",
"Carmen Sandiego': Gina Rodriguez nel live-action ... #CarmenSandiego #Netflix #News #LiveAction #GinaRodriguez https://t.co/6YJ9YvE11v","@AwardsToday","cultural-icon",
"Gina Rodriguez to Star as Carmen Sandiego in Live-Action Netflix Film https://t.co/2ZQLd3ImHb","@rougeassassin89","cultural-icon",
"Is it just me or do we all want a new version of Where In The World Is Carmen Sandiego?","@oneredcatmedia","cultural-icon",
"@IDDocHymes ""Where in the world is Carmen Sandiego? Doo be doon whoop!"" I can hear the game show song in my head!","@osnsmom","cultural-icon",
"I feel like I'm playing Where in the World is Carmen San Diego, Sarah Povinelli version","@thebigRC","cultural-icon",
"It's 450 now ""@RackedNStacked: If I won that 300 mill... I'm traveling all over the world. Where in the world is ""Carmen"" Sandiego?""","@RossGee_","travel",
"Netflix Is Making A Carmen Sandiego Movie https://t.co/65J1GormjN","@JMClarkent","cultural-icon",
"did anyone else play that ""Where in the world is Carmen San Diego"" computer game???","@Therese_Scanlon","cultural-icon",
"@MFollowill Fair enough thank you sir for your input...other than Carmen Sandiego I don't know of a person that's had to travel more than you!!","@diarrheabutt","travel",
"@lewgotproblems No Arthur? Bill Nye the science guy? Where on earth is Carmen Sandiego? Shame!","@garhunt05","edutainment",
"🙌🏾Jane the Virgin's Gina Rodriguez May Voice Carmen Sandiego on Animated Netflix Series https://t.co/w8vkOugkus","@Tasty_goddess","cultural-icon",
"Netflix plans live-action 'Carmen Sandiego' film with Gina Rodriguez https://t.co/M75tYQOU0s","@psizan","cultural-icon",
"#HowOldAreYou playing Carmen Sandiego and The oregon trail on floppy disk in ""computer science"" #Lmao","@marlaa","edutainment",
"@WE_Linds I had a Carmen Sandiego game on MS DOS when I was little. Wonder how her fashion translated in so few pixels.","@stefsoliman","cultural-icon",
"Carmen Sandiego Is Officially Happening With Gina Rodriguez at Netflix https://t.co/uyVF5YWA8N https://t.co/f6wYxxVhbS","@FastTelegraphco","cultural-icon",
"Retweeted Kim Stiefel (@KimStiefel79): Where in the World Is Carmen Sandiego? Becoming a Secret Travel Agent... https://t.co/SGNa1TTyjs","@halimlounnas2","travel",
"Carmen Sandiego probably on twitter","@savionanthony","cultural-icon",
"@BlueStreak_98 Netflix, 2019. https://t.co/tbi19M0sKq","@BlueStreak_98","cultural-icon",
"@pkligerman @Ryan_Truex What's with all the globe-trotting as of late, PK? You're like Carmen Sandiego.","@nascarcasm","travel",
"Channeling some serious Carmen Sandiego vibes in today's #ootd http://t.co/xakoIMHvf3 #fbloggers #wiw #style","@TVIBblog","fashion",
"And I still can't find #carmensandiego... #globe #vintageglobe #dreamingoffaroffplaces #wackytacky https://t.co/QUGCHlB7LW","@wacky_tacky","cultural-icon",
"Netflix could be bringing Carmen Sandiego back https://t.co/Nz4MxhQqak https://t.co/gzbq6eQX4w","@scitecho","cultural-icon",
"I found Carmen Sandiego's brother on my bus https://t.co/yoBG3vv5CW","@Mattw_dev","travel",
"Carmen Sandiego Returns in a New Educational App https://t.co/8XskcFpc7G https://t.co/zkPuCcxLuu","@AmbergruffinG","edutainment",
"I remember this computer in Elementary School. My favorite game was Carmen Sandiego. #thegoldbergs","@iamnotatwit","cultural-icon",
"Twin I read Carmen SanDiego was coming back out and thought of yo ass lol *spins globe* #GiGiSanDiego @gigimaguire","@amillz","travel",
"Just heard electronic mixes of Livin on a Prayer & Carmen Sandiego theme while waiting for Kickass Women of SHIELD panel #lifecomplete #c2e2","@ADHicken","cultural-icon",
"Found Waldo and all of his friends at all locations. Nice. The Buno Spain one is hard. Next year, do we get a ""Where in the world is Carmen Sandiego""?","@etcwilde","cultural-icon",
"Carmen Sandiego is the true 90s gay icon","@ShyguyShiloh","role-model",
"#StrangerThings star @FinnSkata will join @HereIsGina in @Netflix's reboot of #CarmenSandiego https://t.co/LUXLK8MQx2 https://t.co/XaU9CNuyt5","@THR","cultural-icon",
"Netflix making live-action Carmen Sandiego movie https://t.co/kDTlta99K5","@Absolute_BNG","cultural-icon",
"Where in Time is Carmen Sandiego seemed harder than the geography Carmen Sandiego games. #gamedev #retrogaming https://t.co/PsjAftcBgT","@sjfostersound","cultural-icon",
"@Glamamom @searsStyle Very Carmen Sandiego of you. Love a mysterious woman. #SearsSummer","@brihigh01","fashion",
"#digitaltrends Netflix wants us to know who in the world is Carmen Sandiego https://t.co/zFcKaI5OwG","@gezgintrk","cultural-icon",
"@Hauuuitsomar damn traveling the world like Carmen San Diego. I have five weeks before my next trip","@MANE_uncensored","travel",
"Netflix plans live-action 'Carmen Sandiego' film with Gina Rodriguez https://t.co/I1rPwinizg https://t.co/ZnIudredcx","@garybartanus","cultural-icon",
"Pharrel knows about the whereabouts of Carmen Sandiego. Or they at least patronize the same hat shop.","@GayGosling","cultural-icon",
"Gina Rodriguez will play Carmen Sandiego in the live-action movie https://t.co/bhG000pZOr #movies #netflix","@iSanjayJoshi","cultural-icon",
"Carmen Sandiego and Waldo Costume for Couples | https://t.co/RbrTlwqvxE #HalloweenCotumes","@snehapawar7261","cultural-icon",
"i wish her red coat was long like carmen sandiego's.","@beckycarman","fashion",
"http://t.co/mGbxcn1dLb MT @CarmenSandiego: The creators of #CarmenSandiego would like your input for new adventures. http://t.co/SeWSPcQy8C","@oytamarind","cultural-icon",
"""Do it, Rockapella!"" - my mom to my kid just now. I like to think of Carmen Sandiego references as evergreen.","@AlyssaKayeB","cultural-icon","x"
"Gina Rodriguez Will Star in Animated ‘Carmen Sandiego' Netflix Series https://t.co/wTDK88Y6Xt #Celebuzz #1143759 #1","@tech_journal","cultural-icon",
"Gina Rodriguez to voice Carmen Sandiego in Netflix animated reboot https://t.co/ZmPfhahGg0","@OneYMedia","cultural-icon",
"Where In North Dakota is Carmen Sandiego has been properly dumped and available for download for over a year and nobody told me?!","@SpindleyQ","cultural-icon",
"Carmen Sandiego Is Hiding At Netflix HQ! https://t.co/K1M58Fsdft #carmensandiego #netflix","@andy_brim","cultural-icon",
"Giving you sweaty #carmensandiego on vacation realness @ Disney's… https://t.co/fqDtZ3aZyX","@lalalalaurs","travel",
"Sounds Like Netflix Is Bringing Back 'Carmen Sandiego' https://t.co/MNepzrpKvz","@studiohq","cultural-icon",
"This dude was touring the globe like Carmen San Diego https://t.co/KJ6ysFox5W","@Jamaicanhitman","travel",
"Netflix Is Reportedly Reviving Carmen Sandiego With Gina Rodriguez https://t.co/sVlJ3cSo9X","@HispanicNews","cultural-icon",
