"text","handle","category","star_tweet"
"*sees carmen sandiego cosplay* dude sick Pauline","@Sir5000","fashion",
"Anyone remember Where in the World is Carmen Sandiego? #TvShowsThatIMiss #travel #ThursdayThoughts https://t.co/tvacKaRNMD","@TravelToLiv","cultural-icon",
"My mom travels like Carmen Sandiego so we always go to her to book trips for us cuz she be finding good deals but for some reason she’s dragging her feet wit this one 😩 but we gonna listen to her cuz u can’t tell a real Zoe about their ppls","@FashionGawd3sS","travel",
"Netflix Is Making A Carmen Sandiego Movie https://t.co/pq7LsEy4QV","@Gam3Wrld","cultural-icon",
"Which Carmen Sandiego game is the hardest? I loved Where in the USA and Where in the World (the late 90's versions of the games)! The time travel one was a little hard. The math one was harder because I hate math! #gamedev #retrogaming #CarmenSandiego https://t.co/0HZRopB5im","@sjfostersound","edutainment",
"Sounds like Netflix is bringing back ""Where in the World is Carmen Sandiego?"" https://t.co/lKXgZ8o2BC","@LatinoVoices","cultural-icon",
"@gillovnot YES!!!! She looks like carmen San Diego LOL. But I loooove the outfits. Idkw","@soniasounds","fashion",
"@TheGemJade So do we but can we even FIND you Carmen Sandiego? How do we know you're not already on vacation?","@Hertz","travel",
"When I wear my trench coat I'm instantly transformed into either Carmen SanDiego or Inspector Gadget.","@apwingfield_12","fashion",
"Petition to relocate the entire WVU football stadium, Carmen-Sandiego-Style, to a location that makes any goddamn sense with the geography of this town.","@WolverKeith","cultural-icon",
"Gina Rodriguez will be donning the red fedora and trench coat of Carmen Sandiego for Netflix https://t.co/0aEjZqO1jq","@shuhabtrq","cultural-icon",
"marina!!!!!!!!!!!!!!!! marina you're looking like carmen san diego in that hat and coat!!!!!!!! hello again!!!!!! #thelword","@mackdougs","fashion",
"*scratches forehead* okay. So originally the first episode of Carmen San Diego Math Detective was considered not ad friendly - but now it's public it is... However now the second unlisted video is considered not ad friendly... This confuses me.","@Resulka","cultural-icon",
"I planned to stream a Carmen Sandiego game, but the nostalgia of elementary school drew me in","@Lady_Noremon","edutainment",
"Kate McKinnon's Ms. Frizzle vs Gina Rodriguez's Carmen SanDiego needs to happen","@GarfOfTheGalaxy","cultural-icon",
"Does Not Compute. Carmen Sandiego is hero. https://t.co/IpyVeeWmTh","@cheerfulhobo","role-model",
"just realized how unintentionally hilarious i've been in choosing to wear a carmen sandiego shirt for the ladies' free skate","@Dorianize","fashion",
"@KarenEDeering @susanqwood @MichaelCBender Like a Carmen Sandiego outfit, trenchcoat and wide brimmed hat.","@SybilT2","fashion",
"#Hot #CelebrityNews Beyoncé is the Carmen Sandiego of Pop http://t.co/bUED8ZC7UN #InstantFollowBack","@Beyonce_Watch","cultural-icon",
"So...I basically did #InternationalWomensDay & #WaybackWednesday in one closet cosplay Does anybody else remember #CarmenSandiego No?🤔 Kay😅💚 https://t.co/fAaG6TSbfk","@NoelWillett","role-model",
"@everyonepoos You must have SUCKED at ""Where in the World is Carmen Sandiego?""","@MerlinRPM","cultural-icon",
"@MidnightRem 4) I played the hell out of the ""Carmen Sandiego"" games, trivia games, building games... Everything that would be called ""edutainment"" now.","@MidnightRem","edutainment",
"@dosnostalgic I was just remembering ""Where in the world is Carmen SanDiego?"" What a great game :D","@RetroGamerVE","cultural-icon",
"Remember that year [former boyfriend’s name redacted] dressed up as Carmen San Diego and Where’s Waldo for Halloween because we were in a long-term long-distance relationship? We were too cute and boring to succeed I now realize.","@cherisseyanit","cultural-icon",
"Viral: VIDEO: 10 Reasons Where in the World Is Carmen Sandiego? Was the Best Educational TV… https://t.co/qWoJnxL8Zk https://t.co/QR9dFO1FD9","@DaphneLowy","edutainment",
"Engadget: Netflix finds 'Carmen Sandiego' for its latest reboot https://t.co/mGc8S1vbil https://t.co/02cwDUHgP7","@playcompass","cultural-icon",
"I also gotta shoutout the flight attendant who looks likes a mix of my aunt Oreda and The Chief on Where in Time is Carmen San Diego on PBS.","@rantsandraves13","fashion",
"Netflix Is Making A Carmen Sandiego Movie https://t.co/F6YQSJD2QY","@jdotfield","cultural-icon",
"I was obsessed with #CarmenSandiego as a kid. I’m looking forward to this reboot. @netflix #90s #90sKid #TheCartoonHadABetterThemeSong https://t.co/f7cnLvdy7k","@StageName2Come","cultural-icon","x"
"@ikebarinholtz So this is what it's come to, eh? That singer looks like he was in that band from Where in the World is Carmen Sandiego. Rockapella I want to say?","@SatanicRights","cultural-icon",
"Netflix Takes Aim At Hollywood With Gina Rodriguez's 'Carmen Sandiego' https://t.co/fAUNw0zGDb","@Lucas_Wyrsch","cultural-icon",
"Carmen Sandiego reboot with Gina Rodriguez doing Carmen's voice??? Yes, I am very here for that.","@jslaught19","cultural-icon","x"
"Retweeted Maia Rayn (@MaiaRayn): Carmen Sandiego is returning as an animated children’s show on #Netflix... https://t.co/y87HFbYuAC","@ameriporean","cultural-icon",
"In Brazil, we don't say Carmen Sandiego. We say Eike Batista and I think that's beautiful. https://t.co/Nm37g3y5KP","@caesarologia","cultural-icon",
"The most international woman I know is Carmen Sandiego.","@nayirikendir","role-model",
"@JustinnLamar thank you! Wish you were here but hope you're having fun Carmen Sandiego","@WhitneyiAM","cultural-icon",
"LOVE this. http://t.co/HkaylmOk6q … Wonder if my tweens would watch 90s tweens fight crime with geography facts? #carmensandiego","@theotherpamela","cultural-icon",
"@BumpyMcGump ಠnಠ ""Where in the world is Carmen Sandiego?""... STEP UP YOUR GAME.","@hananahammocks","cultural-icon",
"VIDEO: 10 Reasons Where in the World Is Carmen Sandiego? Was the Best Educational TV Show Ever https://t.co/8QP4iVA8st","@SrtaPearson","edutainment",
"@sammies1718 People looking for the real Carmen Sandiego are gonna be pissed.","@KJSFAN","cultural-icon",
"Netflix is developing a live-action Carmen Sandiego movie https://t.co/JR3r9TLrvv","@pixelmessenger","cultural-icon",
"@josilicious_ so when you say ""casual"" what do you envision? I am at a loss for what to wear Saturday 😬 I may show up as Carmen Sandiego.","@RedHeaded","fashion",
"Chuck Norris always knows the exact location of Carmen SanDiego... #chucknorrisfacts","@TScottRoss","cultural-icon",
"Where in the World Is Carmen Sandiego? Becoming a Secret Travel Agent https://t.co/9paF7qF57r (https://t.co/sWCGpqpSLK)","@newsyc20","travel",
"@magencubed I love Carmen Sandiego’s evening look","@sillyhead","cultural-icon",
"Gina Rodriguez donning red fedora and trench coat of Carmen Sandiego https://t.co/8v52vVBvj6","@Khorshedo","cultural-icon",
"im gonna make an IG video about cats wearing those carmen sandiego hats ..im sick of it","@o_darien","fashion",
"Jane the Virgin's Gina Rodriguez to Voice Netflix's Carmen Sandiego https://t.co/f7eC77aaUY","@EnanoO_4G","cultural-icon",
"@KayJayBee21 ESP with that Carmen San Diego hat on","@NaeZone","fashion",
"Carmen Sandiego is back! Catch the world's greatest thief on @netflix - January 18th. #comicsandconvo #carmensandiego #netflix https://t.co/eD1WuJcbgl","@ComicsAndConvo","cultural-icon",
"Took some time to introduce the kids to Oregon Trail and Where in the World is Carmen San Diego today. They taught me about #Minecraft.","@Real1Alexander","cultural-icon",
"@JulieSLalonde When she takes off her hat, Carmen Sandiego (pictured) finds it easy to blend into a crowd undetected.","@Hartamophone","fashion",
"Fitz channeling Carmen Sandiego in a @BrixtonMfg hat #wornattherippedbodice https://t.co/OMnfOcnJOx","@TheRippedBodice","fashion",
"I liked Where in the USA and Where in the World! Catching baddies and learning geography was kinda cool! #gamedev #CarmenSandiego #retrogaming https://t.co/mOebd4luvg","@sjfostersound","cultural-icon",
"Carmen Sandiego Reboot Arrives On Netflix In January https://t.co/q48eVnr3hv https://t.co/v0WZeQjuXB","@marsh_app","cultural-icon",
"‘Carmen Sandiego’ Animated Series Greenlit at Netflix, Gina Rodriguez to Star https://t.co/nI4NknXLlM","@scidle","cultural-icon",
"I know I’m not the only one who remembers Carmen Sandiego?","@adriennespaige","cultural-icon",
"Netflix plans live-action 'Carmen Sandiego' film with Gina Rodriguez https://t.co/5UHStdiIbY","@compsolv","cultural-icon",
"Costume Idea: You dress up as Waldo, your girlfriend dresses up as Carmen Sandiego and then you both don’t go to the lame costume party.","@snoop_t","cultural-icon",
"Not sure typical airport employee clothing inspiration seems to be ""Carmen Sandiego.""","@BentonSartore","fashion",
"Gina Rodriguez as Carmen Sandiego?! Thank u Netflix!!!","@sGomez809","cultural-icon",
"Just downloaded Carmen Sandiego app... goodbye world see ya in a month","@therealtylerwar","cultural-icon",
"Playing Where in the World is Carmen Sandiego with Clara. Do you known how hard it is teaching a kid while using 80s geography?","@awormann","edutainment",
"So after 4.5 of a now 6h layover in ATL, I've seen 8 diff women (young & old) with Carmen SanDiego fedoras on. Is this a thing now?","@L_M_Venegas","fashion",
"Gina Rodriguez donning red fedora and trench coat of Carmen Sandiego https://t.co/oDTWr9m2Yg #Netflix #Gina_Rodriguez https://t.co/fKuYYk3nvL","@I_AM_Finance","cultural-icon",
"@4mxnute I wanted a big hat, cause her whole shtick reminded me of carmen sandiego","@MagiKoopa24","fashion",
"Man, @WWEGames, how am I supposed to do justice to this Carmen Sandiego CAW if she can't wrestle in a hat OR a trenchcoat?","@LTDangerous","fashion",
"@amandawtwong because you liked my tweet, I now know there will be a new Carmen Sandiego next year. thank you ;-;","@dasiavou","cultural-icon",
"Where on Earth is Carmen Sandiego? ('96) Theme is a Mozart tune w/ lyrics. Beautifully animated, really drew you in. Probably the best adventure/mystery/educational cartoon ever. Carmen was a fantastic villain; charismatic & cool. Gina Rodriguez will play her in a new Netflix one https://t.co/QL2DRPTHni","@bloodyw0nder","edutainment",
"good news, Carmen San Diego is in Astoria #Halloween https://t.co/YeoRRIw5eA","@takinyerphoto","fashion",
"#30DayGamingChallenge TUE: Holy villainous team-up! #Hazama, #DrEggman, #ShangTung, #Bowser & #CarmenSandiego form my villain team! https://t.co/5w3KwzihkI WED: Heroes unite! #Cortana, #Tails, #JohnnyCage, #Sakura & #Yuffie assemble to battle them! https://t.co/WcvDCxQQmE","@mattdoylemedia","cultural-icon",
"Wow. @Jeopardy had an entire category tonight called ""Fedora"" and not one single answer (question) was Carmen Sandiego! #disappointed https://t.co/aH9GuurHu2","@MsMensing","fashion",
"“Carmen Sandiego was always intended as a game. It was the school systems that decided it was educational, not us.” https://t.co/ggZPD8ohxJ","@DanB","edutainment",
".@vladmech finally did it! He found them! BOTH! #Waldo #CarmenSandiego #sdcc #notlgsdcc #comiccon #cosplay http://t.co/fQ5AhEKR1D","@thenotlg","fashion",
"Hmmm....I did not know this Netflix's 'Carmen Sandiego' debuts on January 19th, 2019 https://t.co/IVfcBuqWh7","@ThaSandmanNYC","cultural-icon",
"Congrats @hereisgina! Jane the Virgin's Gina Rodriguez to Voice Carmen Sandiego on Animated Netflix Series https://t.co/Wl1Sl2JwBh","@TheCWProvidence","cultural-icon",
"I swear @AgentCarterTV better find a way to work into canon that Peggy is the inspiration for Carmen Sandiego. http://t.co/KOGb6r9WsM","@MildlyAmused","cultural-icon",
"@topherflorence cameo's video alone needs a whole essay because it time travels between aesthetics from ""where on earth is carmen sandiego"" to ""blade runner""","@spacetwinks","travel",
"Where in the World Is Carmen Sandiego Mystery Geography Board Game https://t.co/znj8DFZzU7 #games https://t.co/Z6E2SdXJbF","@Toyzene","cultural-icon",
"Just thinking about how I dressed up as Carmen Sandiego for Halloween last year and nobody knew who that was. http://t.co/dNCWGpDMGr","@OliviaHelen27","fashion",
"Netflix finds 'Carmen Sandiego' for its latest reboot https://t.co/LueCIL4gGi","@HPsRedBeard","cultural-icon",
"@lizheileman @latrinaa35 @DonnieWahlberg No the carmen san Diego hat. https://t.co/PckbysTcBz","@BecksLS30","fashion",
"I don't mention it often enough but I freaking love Carmen Sandiego, one of the best educational characters of all time. I'm almost tempted to do a Journey series on this along with pokemon. I'm THAT excited","@SuedeBlade","edutainment",
"Carmen Sandiego's coming to Netflix? Oh, no. The jokes that I'm going to hear…I'll just have to fight everybody.","@c_sirrah","cultural-icon",
"#SM 'Carmen Sandiego' Reboot Headed to Netflix: Netflix ordered an animated reboot of the Eighties computer game… https://t.co/uOc2MVqvpy https://t.co/CpiK4HlTx5","@CurrentSocials","cultural-icon",
"Gina Rodriguez to star in Netflix’s live-action ‘Carmen Sandiego’ movie: https://t.co/eHUBdqYKJU via @AOL","@iammannyj","cultural-icon",
"Lady Gaga vs. Carmen Sandiego: Who Wore It Better? - Readers Poll - PopCrush http://t.co/IDQTJOCmOd","@ladygaga_Info24","fashion",
"Already have my next Halloween costume planned out. Carmen Sandiego. My date&39;ll go as Where&39;s Wally. Always wanted to do that","@pauleneublmckee","cultural-icon",
"And seek out my own adventures. Carmen Sandiego was my hero and inspired me to live an adventurous life #imaginationeducation #ashleythearchaeologist #girlpower https://t.co/1i6bMA3IAP","@imaginationeduc","role-model",
"@netflix lemme write Carmen Sandiego","@TBruinsmaFilms","cultural-icon",
"I'm telling you: live-action Carmen Sandiego movie starring @JLo with Gina Rodriguez as her secret sister.","@rudy_the_star","cultural-icon",
"I had to stop and ask myself, were people really looking for me, or was I just running from my problems...? #CarmenSandiego #Halloween https://t.co/0y4kpy6VJF","@ECrumrine","fashion",
"@DaOBeeZY I'd wear this with the giant Carmen Sandiego hat","@ThatCubanZeta","fashion",
"Carmen Sandiego, New Animated Series, Coming to Netflix in 2019! #childhood https://t.co/Is4fz7aXdc","@AwardsCircuit","cultural-icon",
"@SeeMomClick A6 my kids love skylanders and carmen Sandiego #FiOSPhilly","@gizmordj","cultural-icon",
"@kwallace31 Netflix session lol. What you up to in Mongolia looking for Carmen San Diego?","@Afrikanic","cultural-icon",
"This Pup Has Traveled The World, And Has Drool-Worthy Pics To Prove It: Move over, Carmen Sandiego, this adven... http://t.co/Xe8b2gXUeD","@carbonmotion","travel",
"#BreakingNews VIDEO: 10 Reasons Where in the World Is Carmen Sandiego? Was the Best Educational TV Show Ever https://t.co/GRJKeTZKKp","@RaizMakmur","edutainment",
"3 costumes this year. 1 for Pax, 1 for Halloween Party, &1 for Halloween in NOLA. Need ideas. Carmen Sandiego for Pax, Jessica rabbit 4 NOLA","@RayMarkAble1","fashion",
"@caseyliss @erinliss crazy. I know we used them for WitWi Carmen San Diego in elementary school. (Born in ‘83)","@Berrythrills","edutainment",
"@DubiousCA No seriously, it would pull excellent double-duty, I could cosplay her AND Carmen Sandiego","@DubiousCA","fashion",
"This popular 1980s cartoon is getting the Netflix treatment https://t.co/RFsLVe3WgV","@FortuneMagazine","cultural-icon",
"Carmen Sandiego: Gina Rodriguez to Voice the Role for Netflix https://t.co/w8QAc0PNb8 https://t.co/P8NvDQ0UaC","@TommieLeeVegas","cultural-icon",
"@bigredcobcast @GrantWistrom Is there any truth to the rumor that Mr Wistrom also knows where Carmen San Diego is?","@therealinformer","cultural-icon",
"@mr_isaacs @iwearthecrowns @thecommonpeople @JustinAglio @chellymil @MatthewFarber @EdGamer @captainXav @MGrundel @lucasgillispie The first game I ever played for learning was The Oregon Trail...an oldy but a goody!! More recently @PlayCraftLearn (obviously), Where in The World Is Carmen Sandiego (another oldy)","@BenSpieldenner","edutainment",
"I can't wait when i'm able to travel the world. I'm gonna be like Carmen SanDiego lmao","@_Jazzy26","travel","x"
"Knowing I can ignore that voice has lead me to take up a new hobby, I'm learning to play the violin, something I've wanted to do since I heard ""The Violin"" by Eileen Ivers and Brian Dewan on the Where in the World is Carmen Sandiego? soundtrack, but never thought I'd be able to. https://t.co/ogbDZcdndD","@DrFunkin","cultural-icon",
"@beezwitit im starting to think you may be the real life carmen san diego 🤔","@91ultra_","cultural-icon",
"@KleinschmidtJD Where is Carmen Sandiego?","@Noriega_Edith","cultural-icon",
"Yes yes but HOW in the World is Carmen San Diego?","@realchrisjett","cultural-icon",
"@InariPopcorn Steal it, Carmen Sandiego style.","@MarketDemocracy","cultural-icon",
"@raiden I was Carmen Sandiego for Halloween last year. Oh god, that reminds me of my crippling anxiety of what to do this year. @_@ Fly safe!","@giapet","fashion",
"If I get this, I bet I could find a matching coat... #carmensandiego #whereintheworld https://t.co/OYxAZ23fZO","@rebeccajensen","fashion",
"There's always a Waldo and a Carmen Sandiego at every Halloween party.","@earose","cultural-icon",
"Children of the '90s Rejoice, For Carmen Sandiego Is Getting Her Own Animated Netflix Series https://t.co/DfbxDIc6Fh","@wingmandateapp","cultural-icon",
"Catch us if you can #carmensandiego #whereswaldo #halloween #2015 #nyc #inhiding #perfectcouple https://t.co/5uFSrvWYRi","@Parnia","cultural-icon",
"Halloween party here we come! #CarmenSanDiego #WheresWaldo #WeCute http://t.co/KZAnYoUw06","@CatAliceSimpson","cultural-icon",
"MIA feat. Juicy J, ""Wiz Khalifa"" should rather be titled, ""Where In The World Is Carmen Sandiego?"" #goodjoke #neverheardthissong","@anneaviary","cultural-icon",
"I've been searching my whole life yet still can't find Carmen SanDiego on a globe.","@electric_glass","cultural-icon",
"Cause of the #CarmenSandiego discussion, I'm really feeling my childhood heroes today. The stories that make you love stories are the best. https://t.co/pkM1y4KFcK","@BayAlden","cultural-icon",
"@andreamoody_ keepin it classy like Carmen San Diego....","@thedojonerd","cultural-icon",
"But...where in the world is Carmen sandiego?? @fratdiva","@Iam_Forbidden","cultural-icon",
"New post: ""Netflix is making a Carmen Sandiego movie with Gina Rodriguez - CNET"" https://t.co/GMG3l19f28","@AM_Mancorp","cultural-icon",
"if I write Wonder Woman I'm introducing Carmen Sandiego as the new villain","@llamaemilia","cultural-icon",
"VIDEO: 10 Reasons Where in the World Is Carmen Sandiego? Was the Best Educational TV Show … https://t.co/patGkfWPcR https://t.co/Dca75WEO0y","@GennyPliego","edutainment",
"An Agent, a random Ski Bum, The Gentleman Ghost, and Carmen Sandiego... One rainy, chilly Halloween… https://t.co/zx1OLwWj6a","@Kusalaknits","fashion",
"Netflix is betting on '90s kids nostalgia for learning with upcoming lineup - Polygon https://t.co/oyDml2Ms17","@Netflixreport","edutainment",
"My Denver women's fashion trend observations My little pony colored hair: vats happening Carmen San Diego hats: ish don't think so #NYFW","@TheRealPeteMcG","fashion",
"Carmen AND Waldo in the same place?! #costume #halloween #carmensandiego #whereswaldo… https://t.co/DDNl9y3aJ4","@musicboxsong","fashion",
"Netflix is bringing back 'Carmen Sandiego,' and it's going to star @HereIsGina: https://t.co/FXFHw2j6Ef https://t.co/6fINPZMX3s","@dailydot","cultural-icon",
"Got 3/30 playing the Carmen Sandiego Logic Quest quiz. Can you top that? http://t.co/tLOpUI98MF #Sporcle","@FrancisMoreau","cultural-icon",
"Where in the world is (deep voice) Carmen San Diego? Apparently on the M60 bus to LaGuardia. http://t.co/P2MUOmn536","@capetownbrown","cultural-icon",
"OH MY GOD A CARMEN SANDIEGO SHOW IS GREENLIT AT NETFLIX!!! https://t.co/52JKeBULn8","@nantoka_rin","cultural-icon",
"Where in the world is Carmen sandiego? 🌍🌎🌏💃","@Thomps28","cultural-icon",
"I'm just trying to figure it all out in fact the where abouts of Carmen Sandiego?","@_showtimer83","cultural-icon",
"Some of my TV/film icons were women: 1. Miss Frizzle taught me to take chances & make mistakes 2. Mary Poppins taught me to not do things for loved ones directly, but teach them values to do the act themselves. 3. Carmen Sandiego showed me the world.","@salawm","role-model","x"
"I'm hoping that at some point we learn that @HayleyAtwell is the one who gave #CarmenSandiego the idea for the hat. #AgentCarter #Origins","@triciaennis","fashion",
"WHAT IS IT WITH PEOPLE I FOLLOW ON TWITTER WATCHING MARPLE ON NETFLIX? SHOULD I START DOING IT? WHY AM I SHOUTING? WHERE IS CARMEN SANDIEGO?","@spicedrum","cultural-icon",
"You ask, @jamienotweet, why the beret?Same reason that the guy in the 2nd row is sporting a ""Where in the World is Carmen Sandiego?"" hat.","@loopylamb","cultural-icon",
"@LindseyStirling @HP Nice Carmen Sandiego hat! Rather fitting! 😂","@TribalSam","fashion",
"@jeffgerstmann I think proper drivers would be better though...where are they Sony?! And also where is Carmen Sandiego?!","@djarizmendi","cultural-icon",
"@xBigCatx First drawing of Ashe displayed. Looked like a white haired Carmen Sandiego.","@xBigCatx","cultural-icon",
"I just want to play Where in the World Is Carmen Sandiego?","@erin_reader","cultural-icon",
"@JesseKellyDC @jennyleesac30 Thank you, Carmen San Diego.","@thetugboatphil","cultural-icon",
"You idiots. That's not Jane Walker. That's just Carmen Sandiego in a different hat. This is why she keeps getting away. https://t.co/ECR9IrNaWe","@MikeBeauvais","fashion",
"Sent a picture of me in a hat to a friend asking if I should keep it. Her reply: ""Yes - you look like Carmen San Diego "" 🤔","@jlmeds","fashion",
"A Goofy Movie and now Carmen San Diego?! More proof that @sarahjoyshockey is my long lost older sister teaching me what cool stuff to watch.","@TophsterOven","edutainment",
"Oomf is the black Carmen Sandiego bc she traveling errrrwhere","@Fools_R_US","travel",
"Carmen Sandiego: The Secret of the Stolen Drums (GCN) 7/52. Lightweight action-edutainment for kids #52gamechallenge http://t.co/T4JnzrwQgS","@tvgamefan","edutainment",
"@Mach5Mike She's no more real than Carmen Sandiego. What other shocking truths about edutainment games have I not yet found out?","@Mach5Mike","edutainment",
"Do it, Rockapella: Netflix is Making a New ‘Carmen Sandiego’ Show","@xero_box","cultural-icon",
"I missed ""Wear Red"" & ""Crazy Hat Day"" for @redribbonweek so I combined them today & everyone asked if I was Carmen Sandiego!😂 #ThingsKidsSay https://t.co/TgF2AqDcam","@MrsCollins1787","fashion",
"😦📺💰☺Teen Mom: Gary Hires Carmen San Diego to Find His Biological Father https://t.co/znzLtuJHiu via @ibbb","@judy_armes","cultural-icon",
"if carmen sandiego can travel the world alone then so can i.","@AddyGYo","travel","x"
"Frankly I am *shocked* to learn that there were 87 winners on Where in the World is Carmen San Diego. I thought for sure there were only about...6 or 7.","@mikeapi","cultural-icon",
"@Wilson__Valdez @agraybee If they really wanted to be cool they would call themselves rACApella and sing about Carmen Sandiego.","@Travisorama","cultural-icon",
"Netflix orders animated Carmen Sandiego series https://t.co/0oWk5ViKHi https://t.co/MDPpsEMr6V","@winsontang","cultural-icon",
"Be on my 15th cruise sat! #lehgo #platinummember #carmensandiego","@NitroNeTT","cultural-icon",
"Thank you for finally finding Carmen Sandiego! https://t.co/G5b9RZPknk @toddvanluling","@elisaosegueda","cultural-icon",
"Feeling nostalgic #eci834? Give @TheCrashCourse educational games a watch! #carmensandiego was my favourite! #edtech https://t.co/atpRutZatL","@AndrewForeman21","cultural-icon",
"Please let this be a sign that quality Edutainment titles are coming back. I would love for my kids to learn as much as I did from games like Carmen Sandiego. https://t.co/kiFGIMdwf5","@Hewso81","edutainment","x"
"@MrsFelton6 Nice Carmen Sandiego hat","@jeremydvid","fashion",
"You guys will make a Carmen Sandiego pop but not a harry styles pop??!!! COME ON.","@sowrongitsnikki","cultural-icon",
"Gina Rodriguez will be donning the red fedora and trench coat of Carmen Sandiego for… https://t.co/mN2KdQi3CO","@DHQLounge","cultural-icon",
"Realizing the mid/late nineties was the age of the red trench coat. Vash the Stampede, Alucard, Vincent Valentine, Carmen Sandiego...","@realhotcullen","fashion",
"Lamenting the loss of edutainment PC games in computers & writing seminar today. Bring back Zoombinis & Carmen Sandiego!","@argella","edutainment",
"It is super hard for me to tell if someone is #Cosplaying as #AgentCarter or #CarmenSandiego. #Wondercon #Cosplay","@Kr0nusAlphaGeek","fashion",
"Currently waiting in the masquerade line as Carmen Sandiego. Seeing the excellent cosplay a will be worth being found! #fanexpocan","@caeboa","fashion",
"How Carmen Sandiego accidentally became an educational game icon https://t.co/wNjHshRKn2 https://t.co/aWqRIc0CAy #gamedev","@trickgs","role-model",
"@HerSoulWrites A1 (contd): I also sang to my dolls and then wrote about my adventures. I was Carmen Sandiego. #NostalgiaChat","@HerSoulWrites","cultural-icon",
"Incognito Khloe Kardashian Channels Carmen Sandiego With Her Trench And Fedora http://t.co/8tUp999NcI http://t.co/NPSy68ryp7","@lanewsnow","fashion",
"@AmeliaNGibson Listen. Everyone has their folk heroes. Carmen Sandiego is ours.","@meredithdclark","role-model",
"Netflix is making a Carmen Sandiego movie with Gina Rodriguez - CNET https://t.co/3zOTK6nyol","@TaniaGlezAZ","cultural-icon",
"Netflix finds 'Carmen Sandiego' for its latest reboot https://t.co/VMVE8EcGJu https://t.co/2OqGShBB8o","@benedictbacayon","cultural-icon",
