"contents","author","category","star_tweet"
"@VeraVulture cluefinders, zoombinis, Carmen Sandiego, Magic School Bus, all so good...","@DJOMiY","pop culture",
"Aside from 2 secret group projects, here are my upcoming cosplay projects. #cosplaywip #blackcat #catwoman #carmensandiego #cosplaygirl #cosplayprojects #badasswomen #leather #pleather… https://t.co/85MyUYaCeq","@NMouseCosplay","style",
"@MrHailZeon glad you are safe also , this looks totaly fine, im ok with this, just like the reboot of carmen sandiego im willing to give this a shot, at least she-ra has style unlike roar","@SuperFanComShow","pop culture",
"@brianne1017 I'll be in the back with a trenchcoat and a fedora pulled down over my face like Carmen SanDiego. I don't want ppl to see me!","@dawnyb","style",
"Someone called me Carmen San Diego because I'm wearing a trench coat. 💀","@waybeyondA","style",
"Voltage Halloween!! Goku, Helena from Neo Yokio, Cruiser D.Va, Carmen Sandiego, Bane, the powerpuff girls, and MECHA KONBOWWOW! 💖🎃💖 https://t.co/CebdTHMFI7","@SailorScooby","style",
"@HerryNelson34 Kidsongs, Barney, Reading Rainbow, Carmen Sandiego, Arthur, Magic School Bus & BlowPops were around since the 1980s.","@JeremiahLiles1","pop culture",
"Or, you know, I love that Jess has a Carmen Sandiego hat.","@eiri_ebooks","style",
"Need a kickstart a trip to find #bae ... Aka Carmen San Diego","@YUNG_LOTION","travel",
"The hero we need: Carmen Sandiego https://t.co/F1snsFktab","@dav_mcg","inspiration","x"
"Rihanna Gives Patent Leather Carmen Sandiego Vibes at the Grammys https://t.co/DWzMVL8eZo  https://t.co/WWaNofSnB1 via @ElleMagazine #fashion #news https://t.co/4nrDuuPhtR","@adellapasos","style",
"Doctor Who Meets Where in Time is Carmen Sandiego Meets Magic School Bus (because Ms Frizzle is River Song OBVIOUSLY)","@ConStar24","pop culture",
"My bad it’s “Where in America’s Past is Carmen Sandiego” :S still…time travel right?","@Chronoslinger","pop culture",
"@johndavidblake @Ed_Dorrell @Lord_Sugar's Amstrad 1512 Learned a lot from Where in the world is Carmen Sandiego","@cbokhove","edutainment",
"Gina Rodriguez Prepares Her Fedora For Netflix’s ‘Where In The World Is Carmen Sandiego… https://t.co/mXlgSRIvG8","@cgnetwork","pop culture",
"VIDEO: 10 Reasons Where in the World Is Carmen Sandiego? Was the Best Educational TV Show … https://t.co/ESdEBLBFUG https://t.co/7pmE56HNB4","@iamsalimali","edutainment",
"Netflix is betting on ‘90s kids nostalgia for learning with upcoming lineup https://t.co/fM2i24d3rR https://t.co/f17HlfJYwu","@Megamanxc","edutainment",
"Alicia Fox in that goth Carmen Sandiego outfit 👍🏻 #205Live","@pppiquer","style",
"Dora The Explorer is actually the illegitimate lovechild of Waldo (of Where's Waldo fame) and Carmen Sandiego? #DidYouKnow","@DagomoAwesome","pop culture",
"I've decided I'm only allowed to wear Carmen Sandiego styled outfits for all my trip pictures this go around https://t.co/CCPjGWk6SU","@LuckyBoyRVA","travel",
"Happy INTERNATIONAL Women's Day to the most international woman of all: Carmen San Diego","@AdjectiveNouns","feminism",
"Hey Carmen San Diego called she wants her outfit back https://t.co/kjq1hIBbGl","@Gigglesthecat13","style",
"@cristela9 Title Pitches: “Where In The World Would Dora Explore For Carmen Sandiego” or “Carmen, No Swiping”","@CourtneyPerdue1","pop culture",
"@Harry1994Photos Now give him a large red fedora and call him Carmen Sandiego.","@ilove1Dandbacon","style",
"#GoodPlacesToHideAnEgg in Carmen Sandiego's trenchcoat pocket.","@metanatron","style",
"Thoughts? Weatherman says I look like Carmen San Diego 🤦🏽‍♀️ . . . #whereintheworldiscourtney #carmensandiego #halloween #dressup #trenchcoat #trench #fall #weather #costume #costumeideas #tvnews #setlife #behindthescenes #stlouis https://t.co/S3HLIoOdP8 https://t.co/QbtrhRdNUc","@CourtneyDBryant","style",
"@KarenDavid @RobertBathurst Love that hat! It's like Carmen Sandiego & Agent Carter combined!","@MediaKAT1912","style",
"Where in the world is Carmen Sandiego? @ Denver International Airport https://t.co/5WXWKuhiFc","@AaronYovan","travel",
"@Fibby1123 I'm wearing my Carmen Sandiego costume to the Utah football game. Not as epic as Waldo in a crowd, but still pretty cool.","@Fibby1123","style",
"What videogame would you like to star in? — Where in the world is Carmen Sandiego? At least i'd be able to travel around the globe. https://t.co/JKhu71v3yo","@Igraine1976","travel",
"Carolyn's going to play cards, dressed in her best Carmen Sandiego outfit https://t.co/6fHSQndaYb","@LudicrousLouisa","style",
"I don't think y'all understand how much I love Carmen Sandiego. Edutainment of my childhood right there.","@pengwinpiper","edutainment","x"
"Thank the goddess for self control I almost purchased a boat load of pageboy caps and a Carmen San Diego rabbit fur hat.","@sbstnjck","style",
"@Lauzin My favorite costumes I saw were 11, Hunter S. Thompson & Carmen San Diego because god bless someone who watched PBS in the early to mid 90s","@Lauzin","style",
"VIDEO: 10 Reasons Where in the World Is Carmen Sandiego? Was the Best Educational TV Show Ever https://t.co/JNola5XzLo","@peggyco26230462","edutainment",
"@chuggaaconroy #Chuggamon Emile, hear me out on this and name your Sandile: Sandiego Just like Carmen Sandiego he wears black and red (in his final evolved form), is considered a CROOK(Ko-dile), and it will travel around the world with you.","@AceTrainerAzure","travel",
"Where at LCDC Have you heard of Carmen San Diego? It’s a game kids play while secretly learning geography. We’... http://t.co/qg6WgNqc0f","@thelivingcoast","edutainment",
"@RealMerrinD Can we agree that @LanaParrilla needs to dress up as Carmen San Diego and hide in random photos as we sing the theme? #OUAT","@kabienvenue","style",
"*jumps in backseat of car wearing a bloody shirt* ""Can you take me somewhere nobody will find me?"" *Carmen Sandiego turns around & winks*","@_NinJar","pop culture",
"VIDEO: 10 Reasons Where in the World Is Carmen Sandiego? Was the Best Educational TV Show … https://t.co/TvuEiTY7Ov https://t.co/lFEGfzdmD0","@achieverspeaks","edutainment",
"@digiphile @nitashatiku btw I bet my kids learned more social studies in Carmen San Diego, Nancy Drew, and The Oregon Trail than at school","@LisaAbeyta","edutainment",
"Since ""Gamification"" of education is making a comeback, why has NO ONE has made a 21st Century version of Carmen Sandiego? #WhereInTheWorld","@kckaye24","edutainment",
"10 Reasons Where in the World Is Carmen Sandiego? Was the Best Educational Show Ever https://t.co/BzFrZkszfM","@GivingMeMore","edutainment",
"Did anyone ever find #CarmenSandiego? Check out our list of the best of modern & classic #edutainment games! https://t.co/CxOIpZziTk","@SoperWritings","search",
"@thurrott Wait IBM is buying 34 billion dollars in red hats, they must really want to find Carmen San Diego.","@Kmoody2003","style",
"Throwing it back to my favorite #Halloween costume and my ALL-TIME favorite computer game - Carmen San Diego! #tbt https://t.co/mslXj6RyA1","@eevee_lena","style",
"@BlackGirlNerds She is Carmen San Diego in Dick Tracey cosplay and it. is. working.","@blondnotbomb","style",
"@wgbh Since both #DoubleDare and #SupermarketSweep are coming back later this year, I was hoping you guys would bring back another great #90s game show- #CarmenSandiego! It would be a great way to teach kids geography. Oh, and be sure to bring back @RockapellaMusic!","@LibertyGeek83","nostalgia",
"THANK U SO MUCH for the raids, @HumanGammaBomb and @MIXtopher . It was a fabulous first night of Carmen Sandiego. Ronald passed that Pune over to @GreatMsChief https://t.co/09SVxdwcTh","@gatbofficial","pop culture",
"TONIGHT'S WHISKEY-FUELED NOSTALGIC FEMINIST THOUGHTS: Carmen Sandiego is a bomb example of a character who is crazy empowered and super feminine without being sexualized/objectified","@down_w_lcc","feminism",
"@FeministaJones Where In The World is Carmen SanDiego","@justki","pop culture",
"@NBCTimeless @abigailspencer @lucianamangas @JLJMcCarron @TheTimelessRoom Last time I got wrapped up in #history my trio (sons) of Army men, got me into “The Lady in Red” #CarmenSandiego (PBS, 1991) #Clockblockers Now, we watch #Timeless Lucy needs THAT fedora! SLR🍀🐰 https://t.co/kYGFzUhpKr","@leprchaunrabbit","nostalgia",
"VIDEO: 10 Reasons Where in the World Is Carmen Sandiego? Was the Best Educational TV Show Ever https://t.co/FuPl8QD06i (December 22, 2015 …","@feedsynbot","edutainment",
"Is there a Where in the World is Carmen Sandiego style #vacation package? #rockapella","@407pogi","travel",
"Bus/Carmen Sandiego. Future stream? So, Nintendo did a thing. Nice that Earthbound is","@Monotone_ebooks","pop culture",
"Carmen Sandiego is my role model because she: - Is stylish - Educates children - Has a catchy theme song - Has friends and underlings with names that are puns - has two main hobbies, which are ""sticking it to the man"" and ""hiding from literally everybody""","@Ben_Etc","inspiration","x"
"I am the car phone came in a bag, “please be kind & rewind,” McDonald’s birthday party, Heads Up-7Up, Skip It, got my arm day workout from the pencil sharperner on their wall, Weekly Reader, Lynn Thigpen on Carmen SanDiego OLD.","@JauneJackson","pop culture",
"It's gonna come down to a flip toss up for Halloween costumes this year. The Morton Salt Girl vs. Carmen SanDiego. #nailbiter","@Icebox_Larson","style",
"Educational or Exploratory? Find out in this great article about one of the most successful learning games. #gbl #edtech The Making Of Carmen Sandiego https://t.co/jmK8aQNYDq via @kotaku","@athomas_tr","edutainment",
"BOCOME MYTERIOUS EXPLORER IN CARMEN SANDIEGO COSTUME https://t.co/UfOk3TAN0R #carmensandiego #halloweencostume #fyf #findurfuture https://t.co/BquZpUgn0a","@findurfuture","fashion",
"Also? Emma Stone was one fedora away from auditioning for Carmen Sandiego, no? #Oscars #oscars90","@TheFirstEcho","pop culture",
"@unormal Wasn't that basically what Brøderbund/The Learning Company was trying to do? My first game memory is Carmen Sandiego for Win 3.1.","@KawaiiDragoness","nostalgia",
"What’s your favorite Carmen Sandiego game? #gamedev #education #90s #retrogaming https://t.co/0arEgmY56I","@sjfostersound","pop culture",
"@ChrisGeeTwo @btken @jbendery Yes Chris- the head of the Watergate Squared investigation must fly there personally while wearing a Trench coat- as though hunting Carmen Sandiego. It's the only logical plan.","@WicketStratton","pop culture",
"Fun fact: when I was in 3rd grade, drawing Ninja Turtles was banned. It was Carmen Sandiego in 1st grade. 5th grade it was POGs. When I was teaching, my school banned YuGiOh — but I opened my classroom at lunch for *underground YuGiOh matches!* First rule of YuGiOh club… https://t.co/zZWOr9tS0o","@IanAByrd","pop culture",
"Gina Rodriguez donning red fedora and trench coat of Carmen Sandiego https://t.co/23njtoqzoZ https://t.co/EvX3lv7rLz","@MamaGG","pop culture",
"Carmen San Diego?? This post was automatically fetched from Redditt via /r/cosplaygirls and the or https://t.co/kEouIiNdMd #cosplay #anime","@SuperCosplayBot","style",
"carmen sandiego and the a-press challenge (an a-press is a click, hold, and unclick of her time-travel button)","@t54r4n1","travel",
"@GWOtaku This isn't a bad thing. Classic Carmen Sandiego was played out, they don't make the games anymore. I endorse edutainment Lupin the 3rd","@GWOtaku","edutainment",
"As someone who loved educational games as a kid, this is a very interesting read! (paging @Shryku since I know she's interested in this stuff) https://t.co/VsSdu43Rnv","@meli_meli_bear","edutainment",
"Did we just not get the Carmen San Diego cartoon in Australia? I honestly only learned of its existence last year.","@ElPrezAU","pop culture",
"Where in the World Is Carmen Sandiego? At the Paris Haute Couture Shows https://t.co/bbgmSqkgOn #fashion #fashion… https://t.co/IbMIR9W6Gz","@joefrancis","style","x"
"@HVSresearch Ohh 😢 What fun would that be, Madam? 😴😴When I could post pictures! Much like Where’s Waldo? Or #CarmenSanDiego I just need a red fedora! I think 🤔 SLR🍀🐰 https://t.co/y38dXabShr","@leprchaunrabbit","style",
"If this isn't the new Carmen Sandiego costume, what is even the point of the reboot?! #MetGala #PriyankaSandiego https://t.co/NyfDiUCKMe","@TyrannyOfStyle","style",
"New ""Where in the World is #CarmenSandiego"" @Netflix animated edutainment? Look out, #SchoolhouseRock! https://t.co/AGE83UdVXB @Jos_Humphrey https://t.co/PRa42uADkC","@alisonhum","edutainment",
"Gina Rodriguez donning red fedora and trench coat of Carmen Sandiego https://t.co/iRLcB9TjnW https://t.co/7T4hwkFpte","@sriramhebbar","pop culture",
"@MisterParks1973 My wife says #AgentCarter has less brim and #CarmenSandiego has more coat.","@AwflyWeeEli","style",
"I feel like playing Carmen Sandiego #edutainment","@Mr_19th_man","edutainment",
"Pretty sure Carmen San Diego is on my Southwest flight 🕵🏻","@ZaraTalks","travel",
"for me, i have to go back to my childhood to the games that i still have fond memories of. #GamesStruck4 -Dungeon of Doom on the mac -Where in the World is Carmen Sandiego on the Apple ][e -HERO on the Atari 2600 -Quest for Glory IV on PC (CD version feat. John Rhys Davies) https://t.co/ic3Ms4Z5Nt","@deacontaylor78","pop culture",
"Where in the World Is Carmen Sandiego? - Becoming a secret travel agent #33c3 https://t.co/7MmpoQh6IC","@c3talkguide","travel",
"@catpishh With a hat and a red coat, you'd be a shoe-in for Carmen Sandiego","@ChimpyEvans","style","x"
"I thought it only a carefree piece of edutainment, but Carmen Sandiego is real and she's stolen the months of Nov-Jan. ❄️💀❄️","@matthewamador","edutainment",
"#World #News Gina Rodriguez donning red fedora and trench coat… https://t.co/XuKZ9rDoF6 #StopRussianAggression #lbloggers @thebloggerspost https://t.co/fTR1MF0zJN","@alt_media_today","pop culture",
"@theluciebee I was really hoping this pic would be a Carmen Sandiego cosplay","@timbyrnes89","style",
"90’s babies - let’s hear you rejoice for the @netflix reboot of Carmen Sandiego !! We just wrapped up Season 1 for the show and now have our very own Steve D’Angelo recording the Spanish… https://t.co/djBswJ5LUg","@EggplantLF","pop culture",
". @HMHCo launches Carmen Sandiego's first iOS app https://t.co/uW4am50xHG #publishing #education https://t.co/6Gl00SStjB","@pubbusiness","pop culture",
"@kchironis But I LOVED educational games - Carmen sandiego, Jump Start (I especially loved the robot/mad scientist one), sim city. I eschewed a lot of “girly” things when I was younger but felt disconnected to make avatars so it was a lot of sim/collecting games","@marifullofgrace","edutainment",
"#CustomsStoppedMeCos I dress like Carmen SanDiego when I travel","@mseric","travel",
"@troughofluxury @StrangestMoon @nivenus For those of us of the age to have watched Carmen Sandiego, the kids who got Mexican states for the final were always fucked","@emeralddeevee","edutainment",
"As a kid I only watched PBS.. Mister Rodgers, Reading Rainbow, Bill Nye, Thomas & friends, Magic School Bus, Carmen Sandiego , Clifford, Barney and of course Lamb Chop. What a list !!! 💕💕💕💕💕 support the public channels","@vane84","pop culture",
"@CBCNews This guy and his boss just never quit giving.. Julian and World Traveler Stevie (busier than Carmen Sandiego), time to sit down...","@7Flash7","travel",
"Where in the world is Carmen Sandiego? Working at @Wendys in Utah, apparently. Tough time for international explorers. https://t.co/nadziWvW3I","@TbugOFFICIAL","travel",
"New trending story from People : VIDEO: 10 Reasons Where in the World Is Carmen Sandiego? Was the Best Educational … https://t.co/ha1mnfRAZ0","@GetForgiven","edutainment",
"#21 NC State traveled more than Carmen Sandiego and won the game. #blindrefs","@lamersonattheu","pop culture",
"@balsamicvinager My actual favorite thing about this video is ""Listen, action cartoons with female leads can work. Ever hear of Carmen Sandiego?""","@balsamicvinager","feminism","x"
"If you ever need to get out of a costume party just tell them you're coming as Carmen Sandiego. Then stay home.","@will1ham","style",
"Where in the World Is Carmen Sandiego? Becoming a Secret Travel Agent https://t.co/bT85zXWZIF https://t.co/aykEMEtOuW","@hnbreaking","travel",
"Wait. Is that a cookie with a Carmen San Diego hat on? 😂 #Empire","@dante2534","style",
"Restroom, Rest, & then Rise #Machine #CarmenSanDiego #OnAMission #SparksIsGunnaFly (@ Pilot Travel Center - @pilotflyingj in Council Bluffs, IA) https://t.co/WG4vAOyR8j","@Pulpmind","travel",
"Some of the best cosplay I saw today. #ladydeadpool #carmensandiego… https://t.co/BohSo1qtNQ","@TaylorBell15","style",
"Lady Gaga Swiped Her Hat And Trench From Carmen Sandiego’s Closet https://t.co/IDHYiNXp4C https://t.co/OujTWaeljh","@DAFIT_Fanbase","style",
"@Phunky_Brewster @alexandraerin I am now imagining that as a red trenchcoat-dress, her wearing a wide-brimmed red hat: I FOUND CARMEN SANDIEGO!!! cc @darth","@semiotic_pirate","style","x"
"My ACME babel translator is low again! VILE! #CarmenSandiego #gamer #gamedev #education #PC","@sjfostersound","edutainment",
"Gina Rodriguez Is Going To Be Carmen Sandiego In A Live-Action Film And I'm Breaking Out My Red Fedora To Celebrate https://t.co/O3bUfVGexi https://t.co/H0OZ9QPfUb","@azemarketing","pop culture",
"When do we get a Carmen Sandiego series where she's our anti-hero protagonist and every episode it's like THEY MIGHT GET HER THIS TIME!","@dyemooch","pop culture",
"In the style of Vanishing Point. Done by The Chief from Where in the World is Carmen Sandiego. https://t.co/ULePiA6yOt","@MJ_Baumann","pop culture",
"sir. you travel the world like you’re carmen sandiego. don’t do this.","@___nire_","travel",
"VIDEO: 10 Reasons Where in the World Is Carmen Sandiego? Was the Best Educational TV Show … https://t.co/cJuqWy7JPh https://t.co/Ch6n9ZEIU3","@iordomi","edutainment",
"In honor of Halloween, I feel like showing a photo of me in costume. Which 1: Carmen Sandiego, Velma, Princess Tiger Lily, or April O'Neil?","@ZeldasCreed","style",
"@HenryRamosTV @dparragaTV That hat is very Carmen San Diego and I say that very much as a compliment!","@ellierosetx","style",
"Netflix is learning how in the world to play the franchise game with Carmen Sandiego https://t.co/H6Wp8AeELL","@DcCosmos","pop culture",
"@NikolaiDenmark I demand that he begin wearing Carmen San Diego-esque attire immediately.","@Nicholi81","style",
"@Johnnys_House yes! I won with this Carmen Sandiego costume at Howl at the Moon Orlando. https://t.co/Cz9XzZgQON","@AlyssaKaye89","style",
"@katlauver where did u travel to now Carmen San Diego","@PhilsHouse","travel",
"Gillian Anderson's best outfit in HANNIBAL? Carmen Sandiego's Luigi. https://t.co/vCKyiw40wl","@gregbrown","style",
"Playing dress up and channeling Carmen Sandiego with this hat! Warm and Fuzzy sweater knit out… https://t.co/6DcirT61Kj","@JMPlumridge","style",
"@slaterize also: haven't learned this much about global geography since Where in the World is Carmen Sandiego","@slaterize","edutainment",
"@missbrianna24 Or you want to cosplay n be carmen sandiego bri hun lmaol 😉😁","@myterrybear","style",
"Y’all know I’ve been traveling a lot lately... #carmensandiego https://t.co/Z9KXGtBcwH","@schac_attack","travel",
"I'm like Carmen San Diego.... But blonde. #Whereswaldo #jetsetter #weekendgetaway with the babe… https://t.co/yXSvruF2Bp","@TaraLeeEddings","travel",
"Love my bff's they just text me & said ""where in the world is Angie aka Carmen SanDiego"" I travel 2 much but I ❤️it ✈️#jetsetter","@AngieHutchinson","travel",
"Each time I watch @JimShockey_ Adventures, it proves my point that he's been around the world more than Carmen Sandiego. #WhereInTheWorld","@buffhuntinlady","travel",
"Best reaction to my Carmen Sandiego costume this morning ""CARMEN! I FOUND you! Finally!""","@karlitaliliana","style","x"
"I feel like I live in 2 worlds - the traveling #CarmenSanDiego one and the one that misses friends/family/real life daily. #chasingpaper","@HCD3485","travel",
"@ChrisBarrett32 @CandiceAiston I now want Hillary to be Carmen Sandiego, next Halloween.","@ChrisBarrett32","style",
"Today in ""stuff at my parents house I forgot I owned"": Spanish language Carmen Sandiego https://t.co/PrthhaXhgL","@DrunkUber","pop culture - nostalgia",
"@DPacetti Where are you getting all this information about Carmen Sandiego? I'm learning so much!","@holypujoles","edutainment",
"Ran into those strangers who were dancing outside their car on the walk back from open mic & I was greeted with , ""It's Carmen Sandiego!!""","@courtneyjacquln","fashion",
"Carmen Sandiego if she were a fighter? #WonderWoman","@eskimomo9","pop culture",
"@badmovesDC You might also like seeing us dressed up as Carmen Sandiego and Where's Waldo: https://t.co/PhWxpzbeGD https://t.co/OJuWuJVY17","@badmovesDC","style",
"On an adventure with the kiddos every Summer. Where in the world is Carmen San Diego with her kids??? 😂😂 https://t.co/pcQ7s5meKI","@Bossy_Lady","travel",
"@SrGaia Carmen San Diego is working, not really able to travel much. Sister Gaia Love is much more interesting!","@carmendarlene","travel",
"Given her family history, I imagine she is LITERALLY stealing the show, Carmen Sandiego style, but without the cool outfit. https://t.co/wr8PqM1K4T","@anceldelambert","pop culture",
"@Da7e @StormofSpoilers Just wanted to say thank you. I woke up singing the Carmen Sandiego theme and it took me a second to remember why it was stuck in my head https://t.co/3cinunEl8p","@kathryn_alyse","pop culture",
"@barryhollander I'll rock my red one with a dramatic wide brim hat like Carmen Sandiego. I know you hate spunk, but you're stuck with me until December.","@noellelashley","style",
"Carmen Sandiego today @Forever21 @thegivingkeys @BananaRepublic #ootd #fashion #style #styleblog #astylebook http://t.co/7aV3DEEYCV","@AStyleBook_","style",
"I needa a Carmen Sandiago ""@Sir_Rosebullet: Carmen Sandiego doesn't need a man she travels the world alone""","@CodeNameNixon","feminism",
"This video/song is not the greatest but it features my oldest cousin (in the silver jacket). I remember watching him learn new moves by copying the dancers in ""Where In Time is Carmen Sandiego?"" Follow your dreams y'all. -s https://t.co/0VQcTUAIW6","@comosedicenerd","pop culture",
"As we speak a room full of highly educated adults cannot remember what state Pittsburgh is in. Carmen San Diego failed us.","@Get_Hoodzpah","edutainment",
"Imma let you finish, but Carmen Sandiego is the greatest female video game character of all time https://t.co/W1xyLLoI1U https://t.co/fcZhoZaN5q","@StrongerStrange","feminism",
"I have just found out that Carmen Sandiego (a childhood legend & role model) is coming to Netflix in 2019 #Squee https://t.co/EirnfZnV1z https://t.co/9srtRReb6r","@BMatB","inspiration","x"
"@ek_johnston Do you think: a) Carmen Sandiego and Where's Waldo could ever be soul mates? b) that'd be sad cause they'd travel the world and never find one another c) MAYBE THEY ARE TIME LORDS and forever alone","@patient9five7","travel",
"Qvo @alexdreamz wassup! Long time. Safe travel sir. #carmensandiego","@djcrumbz","travel",
"@LizMLibrarian I'm seeing more Carmen Sandiego, with the red hat and glasses.","@FSkornia","style",
"Travel glow. 😉 #Vacation #CarmenSandiego #WheresJess #Again? #😂 #HappyPlace #HardlyHome… https://t.co/U7cntkUsvr","@berryflavord","travel",
"Where in the world is Carmen San Diego? #AdventureGirls #MissingMyAce #ItsAllGood #Travel #Focus… https://t.co/ZdZj4UOI8M","@LIVEinTheBOOthe","travel",
"@nomadj1s Best Halloween costume my husband and I ever did was Carmen Sandiego & Where’s Waldo. UNTRACEABLE.","@hannahkardon","pop culture",
"DIY Halloween: Carmen San Diego https://t.co/etwrXRS2wB on @bloglovin","@gslovesme","style",
"It's not a comic con until you find Waldo and Carmen Sandiego. #sdcc2016 #comiccon #cosplay https://t.co/2jjjNMPf92","@BookBlerd","style",
"I feel as though I was the only kid who thought ""Where In Time is Carmen Sandiego"" was the best computer game ever, mostly because it came with an encyclopedia. YOU GOT TO LEARN THINGS! While solving mysteries! ...Yes, that there is the look that everyone gives me. #nerdlife","@AthenaLovegood","nostalgia",
"BILL NYE AND CARMEN SANDIEGO TAUGHT ME ALOT AS A YOUNGSTER...THANKS YALL","@JohnnyNelson","edutainment","x"
"Sooo.... we ain't even gonna try b4 the half cuz Carr was out?? But only down 3, could've been worse. Defense Showin' up again but Where TF In The World Is Our Offense?? But don't trip #RaiderNation I got Carmen San Diego on the case! We gone figure this out & #JustWinBaby https://t.co/Y3J1LU4PIL","@serb_alexander","pop culture",
"@FullTimeHoops1 @MGRADS @KingJosiah54 @buckleyhoops I wanted SO BADLY to be on Where in the World is Carmen Sandiego when I was in elementary school","@kensing45","inspiration",
"I bet I could find the plane. I was the Carmen San Diego computer game champ in elementary school. Just sayin'","@Legally_Bro","edutainment",
"One day I'll travel across the world and I will be the Carmen San Diego except with a Bible! 😆😂😄😎✈🚅🚴🚉🚠🚢⛵🚨🚵","@Firstborn_jpg","travel",
"@p0peyelang @BigBadBradRocks @SethMacFarlane What does China have to do with the U.S. media constantly sensationalizing climate science? And who has ever claimed that by (or before) 2030 we will all be underwater? And who is ""all?"" The entire planet? And where in the world is Carmen Sandiego? Find out next week on Twitter!","@DenDen410_","search",
"A holiday staple from my grandparents! Hotsauce with the romance of Carmen San Diego. I have a real softspot for the world travel motif. https://t.co/hQcC5CN2Mh","@Kydoon","travel",
