"text","handle","category","star_tweet"
"I am apparently the Carmen Sandiego of TF crime. Because one of my GF's is now a slime girl because of me.","@DragonessDella","cultural-icon",
"Your opinion does not exist to me if u cannot tell me the color of Carmen sandiego a trench coat","@SICKemAJ","fashion",
"VIDEO: 10 Reasons Where in the World Is Carmen Sandiego? Was the Best Educational TV Show … https://t.co/MIBSXUSy7d https://t.co/rPKgtfLRf1","@ontheplus","edutainment",
"Gina Rodriguez to Star in Netflix’s Live-Action ‘Carmen Sandiego’ Movie https://t.co/iP2jkorvUC https://t.co/6Z44xZoeqy","@Filmedia","cultural-icon",
"How Carmen Sandiego accidentally became an educational game icon - https://t.co/CWe6HRsyC5""We didn't want to call it... https://t.co/zJCjHHXFVq","@MaverickRainero","edutainment",
"@PG_3rd @CanuckPro @OfficialEGO @wizardspodcast @MakingTownsGuy @WeeklyWPodcast @IndyPowerRankin @kurtjohansson93 @TTW_podcast @SATPOD @Jocay19 @MrLARIATO @WWEVacant @WWE I'd never want to work @WWEVacant's schedule. Wrestler travels more than Carmen Sandiego! https://t.co/YnVRD6oiy9","@MarkinOut","travel",
"Chuck Norris always knows the EXACT location of Carmen SanDiego.","@Rosario70014355","cultural-icon",
"@HannahPopsy @EurostarUK You are rocking that #CarmenSanDiego / #PeggyCarter hat!","@supermod_l","fashion",
"Where in the world is Carmen San Diego? #trivia #tptrivia #geography #beerquiz http://t.co/lCVILUwocK","@timelesspints","cultural-icon",
"Just imagine if Carmen Sandiego and Waldo had a kid together","@Monkeygills","cultural-icon",
"Well let me travel around the world like Carmen Sandiego cause I been feenin for some Ramen https://t.co/4ydD2YJAbv","@StilettoMe","travel",
"2000+ miles away from each other: Carmen San Diego and Where's Waldo. Trying to find each other on Halloween.","@ConsentHousecat","cultural-icon",
"Wait, va a haber una serie de Carmen Sandiego en Netflix?.... GIIIIRL My Body is Ready!!!","@JaviTrulove","cultural-icon",
"So way back in my Carmen Sandiego article I mentioned that in that game you could travel to the ""future of 2014 AD"" http://t.co/CbD4N9K6sT","@caspiancomic","travel",
"@Da7e @StormofSpoilers Just wanted to say thank you. I woke up singing the Carmen Sandiego theme and it took me a second to remember why it was stuck in my head https://t.co/3cinunEl8p","@kathryn_alyse","cultural-icon",
"Gina Rodriguez to star as Carmen Sandiego in Netflix's live-action feature film https://t.co/e5925w3oLO via @ew","@MickeyPerez_1","cultural-icon",
"How to tell the difference between #AgentCarter and #CarmenSandiego. We're more than a red hat. https://t.co/jrXjDr5s87","@Madi2theMax","fashion",
"Gina Rodriguez To Play Carmen Sandiego In Live-Action Netflix Film https://t.co/2sTZeM98jn","@ramirezandres","cultural-icon",
"Netflix plans live-action 'Carmen Sandiego' film with Gina Rodriguez https://t.co/a4lt8d4Y0B","@ecuapaginas","cultural-icon",
"At any given time I’m thinking about one thing: Kerry Washington in full Carmen San Diego cosplay","@BradClayton11","fashion",
"Already have my next Halloween costume planned out. Carmen Sandiego. My date&39;ll go as Where&39;s Wally. Always wanted to do that","@larrytrujill","fashion",
"@GoodJobBrain Netflix greenlights a Carmen Sandiego series https://t.co/M6QwbapSij","@ballroomrsvp","cultural-icon",
"Already have my next Halloween costume planned out. Carmen Sandiego. My date&39;ll go as Where&39;s Wally. Always wanted to do that","@maybelleqqo","cultural-icon",
"#HappyBDay to Puerto Rican- American Rita Moreno! 'Anita' in ""West Side story""; Carmen, ""Where on Earth is Carmen Sandiego?"" animated series","@l_valles_c","cultural-icon",
"Halloween partay!!! #SelinaKyle #scarecrow #jubilee #rickandmorty #carmensandiego https://t.co/1dzxJebD8L","@RagebowBrite","fashion",
"🎥 Gina Rodriguez to play Carmen Sandiego in second Netflix production https://t.co/p7ZvpsmjvE","@afprelaxnews","cultural-icon",
"Carmen Sandiego at Graydons Crossing . #graydonscrossing #salmon #experiencegr @ Graydon's Crossing https://t.co/5XDB0niBQD","@EatGR1","cultural-icon",
"HOW COME NONE OF Y'ALL TOLD ME THERE'S A CARMEN SANDIEGO REBOOT? https://t.co/u1xlWCKjL7","@SwampPosting","cultural-icon",
"I loved Carmen Sandiego!! and her amazing hat! I was on a college campus last Halloween and saw someone dressed as her a hundred yards away and LOST IT. I screamed I FOUND YOU and she laughed and did the pose. It was great. https://t.co/TmYMxx5qCZ","@adigoesswimming","fashion","x"
"Netflix is rebooting Carmen Sandiego... I'm about to hit a new tier of gay y'all better watch out.","@notori0922","cultural-icon",
"Loved playing Carmen San Diego as a kid. I think that's why I like Catfish. @CatfishMTV travels everywhere, solving mysteries. #truthmatters","@TalentdMsRipley","cultural-icon",
"Carmen Sandiego Is Officially Happening With Gina Rodriguez at Netflix https://t.co/DvbfRiyx5b https://t.co/sJ34eyOkR8","@Worldintheway","cultural-icon",
"SNL' Tries Some Edutainment With 'Where In The World Is Kellyanne Co... https://t.co/UMGIke1VTF via @Cahulaan #TrumpRussia #TheResistance https://t.co/o0IJ7xPluy","@cahulaan","cultural-icon",
"This episode of @RoosterTeeth On The Spot has made me realize how badly we need a movie with @rosariodawson playing Carmen Sandiego https://t.co/01EyJeF964","@belghast","cultural-icon",
"When is Carmen San Diego and sex and the city series going to be on Netflix ?","@_CHRIS_tinaa_","cultural-icon",
"#lfa Netflix finds 'Carmen Sandiego' for its latest reboot https://t.co/pN8ehpacvm #Nrnhr","@ShunoJaan","cultural-icon",
"@SuckaFreeTee True “@SuckaFreeTee: Only Carmen Sandiego knows where Bobby Shurmda hat is....”","@intrepid_heroin","cultural-icon",
"Do it, Rockapella: Netflix is Making a New ‘Carmen Sandiego’ Show https://t.co/fvopVJjzXz https://t.co/WsN0Cr6b4B","@MondeDuFun","cultural-icon",
"AHHHH⚡️ “Netflix greenlights a Carmen Sandiego series” https://t.co/dFsr7X6Da8","@camiIamendes","cultural-icon",
"Netflix finds 'Carmen Sandiego' for its latest reboot https://t.co/4LWDvBj5NM https://t.co/6wVlXO1Bea #Tech","@MayyasPR","cultural-icon",
"@neontrotsky I will never forget that I learned the word spelunking from the Carmen Sandiego computer game","@neontrotsky","edutainment",
"@MatthewACherry @netflix Chief from Carmen San Diego. Plus she had no love for Joe Clark. #lynnthigpen","@Robinson_DC211","cultural-icon",
"@ImDanaDeLorenzo Thank you, and Please know that #KellyMaxwell lives on among the manthion of ""Tough brunettes who wear leather jackets"" including Elisa Maza (Gargoyles), Spinelli (Recess), @iamstephbeatz as Diaz Carmen San Diego and Jessica Jones (is @Krystenritter Latina?)","@BoredJason_13","cultural-icon",
"Gina Rodriguez to star in live-action Carmen Sandiego film for Netflix https://t.co/YtobT5vZM7 #music","@allisondejollie","cultural-icon",
"@TatianaInFlux No blog updates. Nothing. I'm thinking where in the world is Carmen Sandiego? @TatianaInFlux :-)","@jiveturkish","cultural-icon",
"MT @creativeedtech: Great idea @TeamCairney EdTech TakeOut podcast. Carmen Sandiego for a Green Screen lesson https://t.co/dEe7gjVl0q","@Kdmiller4","cultural-icon",
"Gina Rodriguez To Play Carmen Sandiego In Live-Action Netflix Film https://t.co/QzYrrw1RVc https://t.co/tI9PuKcxUI","@amanewsnow","cultural-icon",
"I just reminisced hard about old educational computer games I played when I was younger like ClueFinders, Carmen Sandiego, Oregon Trail. 😂😳😍","@bwr630","edutainment",
"@AndreaBils @BW I don't hate it, but that 'hut' icon made me think of Carmen Sandiego's hat! http://t.co/gbEx5AMOJt","@Sweet_Madness","fashion",
"Sounds like Netflix is bringing back ""Where in the World is Carmen Sandiego?"" https://t.co/ErBOSrdpqV via @HuffPostEnt","@JHopeChgo","cultural-icon",
"Gina Rodriguez to voice heist queen Carmen Sandiego for Netflix series https://t.co/kEofIRIvXf https://t.co/I6mSK4rgut","@mb4uli","cultural-icon",
"Umm...What in the what now?!? No. Nooooo! 40something me refuses to accept this. Carmen Sandiego was a mysterious badass traveling the world getting acapella songs written about her. She was #lifegoals. https://t.co/oeJDEhzzUX","@virgogirlgm","role-model",
"Carmen Sandiego caught at last: Carmen Sandiego's globe-trotting crime spree has finally come to an end, than... https://t.co/zsQpAS8nRr","@GAMING_LOUNGE","cultural-icon",
"Pit stop. ✈️ #carmensandiego #airportadventures @ Taipei Tauyuan International Airport https://t.co/Zw9JyFdVom","@PrettyRichi","travel",
"Gina Rodriguez donning red fedora and trench coat of Carmen Sandiego https://t.co/a47PMfRY4J","@DavidPapp","cultural-icon",
"@iglvzx carmen sandiego is a lesbian icon but she's also a cop who steals from indigenous cultures purely bc she's bored","@MarkLoafers","role-model",
"Netflix making live-action Carmen Sandiego movie https://t.co/Ecwdh7i3Gt","@platonictornado","cultural-icon",
"LRT Why bring Carmen SanDiego into this tacky ladies mayo madness tho... Carmen was a fly AF globe trotting WOC who's hat matched her fit..","@BitterSonicsFan","fashion",
"Interested in the Netflix Carmen Sandiego, I just hope they reveal the deaths of Rockapella were orchestrated by Dar Adal and not Carrie.","@codycloudkiller","cultural-icon",
"@HappyKoromaru @oliverbcampbell All we need now is @TheMercedesXXX to cosplay as Carmen Sandiego. ;)","@DangerCombo2012","fashion",
"VIDEO: 10 Reasons Where in the World Is Carmen Sandiego? Was the Best Educational TV Show … https://t.co/RvRdGTVy9P https://t.co/U7AUnE8G2D","@AdamDechanel","edutainment",
"Tonight's highlight: There was a couple doing sexy Waldo (from Where's Waldo) and Carmen Sandiego costume pair. They entered the costume contest but no one could find them when the contest started. Later that night I saw them in the fish tank and yelled ""I FOUND THEM!!""","@Genderplasmic","cultural-icon",
"Where in the World is Carmen SanDiego? Lolol Merry Christmas #ATLiens ;-* http://t.co/ygOHH7RsZm","@sunkissed410","cultural-icon",
"Everything I know about geography I learned from 'Where in the World is Carmen Sandiego.' (Which is to say...not much)","@kersskerner","edutainment",
"My son loves the game Guess Where, which is a lot like Guess Who but about geography. Where's Carmen Sandiego when you need her?","@Avesdad","cultural-icon",
"Where in the World Is Carmen Sandiego taught me everything I know about geography.","@Ms_Miri","edutainment",
"Netflix orders animated Carmen Sandiego series https://t.co/jbDAR1T7SL #thexeon","@thexeon","cultural-icon",
"Jumpstart, clue finders, carmen sandiego. I had all the learning games as a kid.","@LisKis93","edutainment",
"Walking the dogs wearing my green, trenchcoat. My neighbor invites me to up to his costume party thinking I’m dressed as Carmen Sandiego","@iamtoryshulman","fashion",
"(Sung to the Carmen Sandiego theme) ♬ Where in the world is / My kidnapped fiancé? ♬","@JTrainNeil","cultural-icon",
"@vwoelders leaned most of my geography via cross-country & Carmen San Diego! #bcedchat","@technolandy","cultural-icon",
"Carmen Sandiego was the entry level drug to Travel shows. #throwback https://t.co/eEK45y3ii2","@astr0mnaut","travel",
"A 'Carmen Sandiego' Reboot is Coming to Netflix in January! https://t.co/QRUGiBI4j2","@chilreku","cultural-icon",
"@K_JeanPierre He’s with Carmen San Diego","@AreLights","cultural-icon",
"@Br_Tr @netflix where have you been? https://t.co/MGZ2qELUbw","@julp","cultural-icon",
"Chuck Norris always knows the EXACT location of Carmen SanDiego.","@YDouib","cultural-icon",
"@GamingAndPandas zoo beanies! that game with carmen sandiego! there was this game on the gamecube. it had a kinda final fantasy feel to it. i played this short looking kid with a round kind apoofy but flat hat. i think it was kinda class based. the weapons had weird curvy spirally parts","@DeosIra","cultural-icon",
"Yep #Waldo and #CarmenSandiego put in an appearance. #BCC2015 @baltimorecomics #cosplay http://t.co/LbPXE3evUO","@Comic_Diva","cultural-icon",
"""He probably overseas in the middle of a safari. You'd have better luck scouring the globe for Carmen Sandiego"" #LMAO @synnikal","@ahad","travel","w"
"Netflix Developing Live-Action Carmen Sandiego Movie https://t.co/qqFDovlGRs","@SteveCrumpGames","cultural-icon",
"If you're looking for Carmen Sandiego, she's boarding a Flybe flight to Southampton. YOU'RE WELCOME.","@IrishBearDave","fashion",
"@krysboydthink @jeffwhittington @stephenbecker Love DC 'casts. Future Field Trips shud allow us 2 guess where you R. Carmen San Diego style1","@steven_maines","fashion",
"Netflix to Reboot 'Carmen Sandiego' https://t.co/d1XbSQ0TMh","@ShopGentlemen","cultural-icon",
"@composerose that's right, trilby. I cannot let the fashion choice of my personal hero Carmen San Diego be besmirched. :p","@EmpressSudol","fashion",
"@EGTF AKA What In The World Is Carmen Sandiego Wearing.","@richardcobbett","cultural-icon",
"I may or may not have (VERY) tentatively made plans with my sister to cosplay Ms Frizzle to her Carmen Sandiego. Heck yeahhhh","@DubiousCA","fashion",
"Jane The Virgin's Gina Rodriguez Will Help Revive Carmen Sandiego For Netflix https://t.co/qHl0QwHDbc https://t.co/75lKQu2vU3","@VIPortalINC","cultural-icon",
"Incognito Khloe Kardashian Channels Carmen Sandiego With Her Trench And Fedora - X17 Online http://t.co/4EbQ8QwfW3","@KardashianNewsb","fashion",
"Costume Guide to Carmen Sandiego's Criminal Style https://t.co/TBxac5a7Wt","@thecostumet","fashion",
"@WAGYPodcast Growing up, did you play educational games like Oregon Trail or Carmen Sandiego? Are there any that still hold up as fun today?","@joelschlosberg","edutainment",
"....what edutainment games did I play as a kid. I think the Carmen Sandiego games and Jump Start mostly?","@shslpsychopomp","edutainment",
"WHERE IN THE WORLD IS CARMEN SANDIEGO??!!?!????","@basedcam","cultural-icon",
"You remember Carmen Sandiego? Where on earth are @SeanCallahanTSW and Eri? It's beautiful! Thank you, darling! <3 http://t.co/0cZYqFS1GL","@Eri_Mandarian","cultural-icon",
"@voltorbflip my little gay baby hands played so many edutainment games as a child. i love carmen sandiego.","@trimmau","cultural-icon",
"TFW you love the Carmen Sandiego look, but can't pull off the hat. https://t.co/TVOWgDjovm","@jeffreguilon","fashion",
"Why doesn't Dora the Explorer try to find Carmen Sandiego? #makesyouwonder","@jchawner","cultural-icon",
"Gina Rodriguez, ‘Stranger Things’ actor, to lend voice to Netflix’s ‘Carmen Sandiego’ https://t.co/7VKFZf6MoZ #Dubai #Tech #Digital #Inbou…","@XeeSheikh","cultural-icon",
"@JATetro yeah I think I'm dressing up as Carmen Sandiego for Halloween.","@JessicaTaaffe","fashion",
"@torreytrust “@torreytrust: Oregon Trail, Carmen San Diego, and more for free! http://t.co/IpDUKSmsYJ #edtech” my childhood!","@sara_ackerson","cultural-icon",
"Who do you think has more frequent flyer miles Dora Waldo Carmen Sandiego I need answers 👇🏾","@NoTimeZone_","cultural-icon","x"
"@Shiroiko That red hat REALLY makes her look like Carmen Sandiego. Which is also awesome. :D","@sierralad","fashion",
"Were you at @AimIndiana's Ideas Summit in October?! Did you catch our video at the opening session? Halloween may be over, but Patti Yount stars in our spotlight video as the ever elusive Carmen Sandiego. https://t.co/66yO5UiIsm","@lochgroup","cultural-icon",
"Told my small group girls that I'd wear my Halloween costume for them tonight. Carmen Sandiego is leading a study in John tonight, guys!","@marlenedigsit","fashion",
"Wearing a fedora in your LinkedIn picture makes me think I found Carmen Sandiego, not the right candidate #justsaying","@KatrinaKibben","cultural-icon",
"Where in the World is Carmen Sandiego board game geography trivia 90s complete https://t.co/FGdPdUrN9R https://t.co/pemK5ofAfF","@nice_review","cultural-icon",
"Oh man. This day is the inspiration to start crafting math around Carmen Sandiego. Where to start? #msmathchat #mtbos","@AGoTeach","cultural-icon",
"@toddvanluling you're my hero!! I was obsessed w/Carmen Sandiego!!! https://t.co/aYZEw2Xexg","@LRCIndy_MSW","cultural-icon",
"@chuckspear Also, why isn't there a Carmen Sandiego series of OGNs? They'd be fun and educational. I'm available.","@chuckspear","edutainment",
"@MaryBethMacleo1 Give her a hat and she could be Carmen Sandiego! 😁💜","@katamarikitty","fashion",
"@narnie1883 Always wanted a Carmen Sandiego hat. She was so cool.","@petedonaldson","fashion",
"Gina Rodriguez Voicing Carmen Sandiego in Netflix Show https://t.co/Az2ll0xDnC https://t.co/TOdM2iGKXG","@topgamesv5","cultural-icon",
"Netflix Reboots 'Carmen Sandiego' 😸 With Gina Rodriguez https://t.co/tDgkWtLKfp via @thr","@HryJoy","cultural-icon",
"This hat makes me feel like Carmen San Diego.","@cupidswrath","fashion",
"How Carmen Sandiego accidentally became an educational game icon https://t.co/Ma8jUlFoGS","@MB_053","role-model",
"@iSmashFizzle I'm going to take the position that ""Where In The World..."" is told by unreliable & biased narrators (ie The Good Guys), and that Carmen Sandiego is in fact a modern day Robin Hood.","@loopnotdefined","cultural-icon",
".@HereIsGina to Star in Netflix’s Live-Action “Carmen Sandiego” Film https://t.co/PsmPgp5meI https://t.co/Ts0BStMwPd","@WomenaHollywood","cultural-icon",
"@alyankovic My brain is trying to play Chain Reaction - ""What connects pop icon and comic nerd genius @alyankovic to EGOT winner and legendary Carmen Sandiego player @TheRitaMoreno ?""","@RoyWayneMays","cultural-icon",
"Gina Rodriguez donning red fedora and trench coat of Carmen Sandiego https://t.co/nIDBsLQfsQ","@CapitalVA","cultural-icon",
"Gina Rodriguez to Voice Carmen Sandiego in Netflix Animated Reboot https://t.co/GlMpMsmNaP #celebrity #gossip","@celebnews1456","cultural-icon",
"HEADLINE: Netflix To Revive ""Carmen Sandiego"" Series, Probably Hosted By The Nerdist Guy, In Accordance With Monkey Paw Rules","@manvsinevitable","cultural-icon",
"Carmen Sandiego reboot in the works at Netflix https://t.co/l2eFX6SY1J","@animesuperherof","cultural-icon",
"Netflix is making a Carmen Sandiego movie with Gina Rodriguez - CNET #technology https://t.co/Tp08LuJQYa","@machiiicomp","cultural-icon",
"Netflix is bringing back Carmen Sandiego, and its going to star Gina Rodriguez - How People https://t.co/wxwTa3KBbF https://t.co/6FxjmBiBJO","@bitcoinagile","cultural-icon",
"Where In the World is Carmen Sandiego was my SHIT in elementary school. I stayed on that computer game after Type 2 Learn. #thosewerethedays","@racheezy94","edutainment",
"me and @awesomonster have been trying to set up streaming so we can play Where In The World Is Carmen Sandiego together for an hour!","@EricColossal","cultural-icon",
"Gina Rodriguez Will Star in Animated ‘Carmen Sandiego’ Netflix Series https://t.co/jkDGEanWwS https://t.co/oNB1VNMc9r","@CucusMusic","cultural-icon",
"Edutainment for the masses! The bonkers but brilliant cover art for Where in Time Is Carmen Sandiego? #Nintendo #NES #Retrogames https://t.co/Dkn6c98ghS https://t.co/I8BLP9leYC","@_nintendology","edutainment",
"Learned so much from this in my childhood #carmensandiego #childhoodmemories #awesome #nostalgia #knowlegdeispower http://t.co/tarl2uwsmW","@DanceMr_K","edutainment",
"Muahaha. I have a rather epic Carmen Sandiego costume that I put together for Halloween last year. https://t.co/ml1Pv4cgHz","@BookWithoutPics","fashion","x"
"ok but have you considered these early PC games: - mavis beacon teaches typing - freddi the fish - putt putt - carmen sandiego","@jmarieray","cultural-icon",
"So there's a guy here with a red fedora, long hair, and a red trenchcoat... pretty sure I just found #CarmenSandiego https://t.co/px4dh1WyGg","@owensbeeeee","fashion",
"Where in the World Will Gina Rodriguez Be When She Voices Netflix’s New Carmen Sandiego Series? https://t.co/kmaYDnQjP0","@fariflux","cultural-icon",
"Netflix made a Carmen Sandiego cartoom😍","@BoakyeNcayo","cultural-icon",
"Gina Rodriguez Voicing Carmen Sandiego in Netflix Show https://t.co/Pd7iPw9LSc https://t.co/6QCvdCuvog","@RelentLife","cultural-icon",
"Not Your Shero: Carmen Sandiego and the importance of feminism in edutainment https://t.co/C2wrKr3R6a","@Shows_Broadcast","role-model",
"(Gina Rodriguez To Play Carmen Sandiego In Live-Action Netflix Film) has been published on viral https://t.co/tMnNC6U4dy - https://t.co/b4CVVp9sXF","@ViralSnoop","cultural-icon",
"Netflix to Reboot 'Carmen Sandiego' https://t.co/ugljWwqepH #breakingnews","@BreakingNewss3","cultural-icon",
"My wife wore this hat several times this Halloween for her Carmen Sandiego costume. https://t.co/Qxu7y7Ikun 来自 @amazon","@mentietie","fashion",
"@GugsM and they are great memories! You should've told me travelling is nice, Carmen Sandiego","@sboshmafu","cultural-icon",
"As we speak a room full of highly educated adults cannot remember what state Pittsburgh is in. Carmen San Diego failed us.","@Get_Hoodzpah","edutainment",
"Gina Rodriguez to Star in Netflix’s Live-Action ‘Carmen Sandiego’ Movie https://t.co/LzRBGEXx1c via @thewrap https://t.co/pjPqOkPgiq","@The_News_DIVA","cultural-icon",
"@GoldenOwlEvents Any chance of seeing another adventure like Pirate Quest or Carmen Sandiego this year?","@awesomeguy81","cultural-icon",
"@gjburchell Carmen Sandiego is your mother in law? Hat seems a bit color faded though...","@nerbert","fashion",
"our stylist chuy has been calling me carmen sandiego all day mebe ill go 100 on Halloween","@mayalynne","fashion",
"@pptsapper Netflix is on your nostalgia. https://t.co/MOTOWr60i6","@LSUcaligrl","cultural-icon",
"Jane the Virgin's Gina Rodriguez May Voice Carmen Sandiego on Animated Netflix Series https://t.co/WAGjqBXyKo https://t.co/g4ePpHvD7X","@MoviesWorldNewz","cultural-icon",
"CARMEN SANDIEGO IS AN ICON AND I FEEL THAT GINA VERY MUCH LOOKS THE PART. I’M EXCITED. https://t.co/FqsTAldPYf","@Casey_Haunter","role-model",
"Khloe Kardashian is Giving Us Modern Day Carmen SanDiego at LAX @KhloeKardashian #Kardashian - STYLE BY... http://t.co/jeXUXaZ0ld","@StyleBySheena","fashion",
"This is going to drive me nuts until I figure this out. Like… where in the world is Carmen Sandiego?","@MADly_INsane","cultural-icon",
"@ScottFeinberg @scottfeinberg I was wondering the same thing about Carmen Sandiego. She used to travel a lot!","@Profparker","travel",
"Gina Rodriguez To Play Carmen Sandiego In Live-Action Netflix Film: She'll also lend her voice… https://t.co/ubRgGfiiHB https://t.co/kObY3BQnrz","@DoubleClick___","cultural-icon",
"@aparnapkin I hope you'll watch the new Carmen Sandiego when it comes out on Netflix 2019! We're all working very hard on it https://t.co/rKNCueaA9b","@amandawtwong","cultural-icon",
"I just almost bought a coat just in case I wanted to dress like Carmen Sandiego someday. I think I'm a cosplayer at heart. -Sue https://t.co/BzrJfzN2QZ","@RestrictedSxn","fashion",
"So do you all have memories of games use to play on with a cd? Mine were: Halloween Hugo, Carmen Sandiego, Oregon Trail, Wolfenstein Doom","@LauraFS1984","cultural-icon",
"The Gov Geeks aren’t that hard to find… are we? 🤓 — #whereswaldo #findwaldo #waldo #carmensandiego #whereintheworld #whereintheworldiscarmensandiego #govgeek #travel #hideandseek #hideandseekchallenge #career #halloweencostume #halloween #halloween2018 #halloweenparty https://t.co/JRQp6sOyaE","@TheGovGeeks","cultural-icon",
"@carolyn_will update: I found a red trench coat at Goodwill, so now I'm fulfilling my childhood dream of being Carmen Sandiego","@LaurenRPfeifer","fashion",
"I think my biggest role model is Carmen Sandiego","@VelociKara","role-model","x"
"I want to play Duke Nukem, Oregon Trail and Where in the World Is Carmen SanDiego! Is that too much to ask? #oldschool","@Oh_HeyCan","cultural-icon",
"The Sing-Off is such a cool show. Accapella music is so sick. Makes me miss Rock-apella 🎶where in the world is Carmen Sandiego🎶 #myjam","@iLL_e_noiZe","cultural-icon",
"Newswire: Netflix has finally found Carmen Sandiego https://t.co/pS5n4cbRVy","@IndieFilmTrends","cultural-icon",
"On the lowest of keys, PBS had the most fire children's programming in the 90s. Arthur, Magic School Bus, Bill Nye The Science Guy, Kratt's Creatures, Where In The World Is Carmen San Diego.","@thatkneegro","cultural-icon",
"Tyshenia wearing a hat and called her self Carmen sandiego on snap 😂😂","@NaiJackCityy","fashion",
"Dust off that magnifying glass! Carmen Sandiego is getting a Netflix movie https://t.co/QtoOANIPyT https://t.co/z6SypLGrED","@EagleStarNET","cultural-icon",
"Sounds like Netflix is bringing back ""Where in the World is Carmen Sandiego?"" https://t.co/dTde2avx84 via @HuffPostEnt","@RebeccaEverlene","cultural-icon",
"They better bring back @RockapellaMusic! #CamenSanDiego @netflix https://t.co/JYHcpHzmhx","@orothlain","cultural-icon",
"Why does everyone on the view have that pharell hat on from the grammys looking like carmen sandiego","@TiffSOoBlessed","fashion",
"My goal in life is to be so mysterious that you'll never know what country I'm in or what I'm doing. Real life Carmen Sandiego? #imgame","@carmartemis","travel",
"VIDEO: 10 Reasons Where in the World Is Carmen Sandiego? Was the Best Educational TV Show … … https://t.co/NFmaqa4fON","@mandy_frr","edutainment",
"This man out here trapping through time. Might flip on Carmen Sandiego outchea.","@BobbyMacVegas","cultural-icon",
"Where in the world is Carmen SanDiego? ✈️ #WeekendGetAways #SummerTime https://t.co/nr7XZU7kdp","@MariaSansone","travel",
"Wil this one include Rockapella? New Carmen Sandiego Animated Series Coming to Netflix Starring Gina Rodriguez - IGN https://t.co/jV58MiBRnk","@FancyEpicGaming","cultural-icon",
"#Netflix Developing Live-Action 'Carmen Sandiego' Movie Starring Gina Rodriguez https://t.co/ga0BFo2AKE","@comic411","cultural-icon",
"Oohh yeah Carmen Sandiego will be on @netflix","@ech0whiskey","cultural-icon",
