"text","handle","category","star_tweet"
"""Where in the world is Carmen Sandiego?"" @ Standout Style Boutique http://t.co/kgl6z5ychr","@AajaCorinne","cultural-icon",
"Carmen Sandiego Revival Headed to Netflix https://t.co/Sps9Bs19M1 /via @CBR","@Multiverse_News","cultural-icon",
"Gina Rodriguez donning red fedora and trench coat of Carmen Sandiego https://t.co/VdjBaiP6hF https://t.co/q2yfFIsIY7","@harsha85","cultural-icon",
"I want @ernestbaker to host the hood version of Where In The World Is Carmen Sandiego called Where In The World is Migos' Plug?","@ATL_PRiNCeSS","cultural-icon",
"Carmen Sandiego, the world's most iconic Latina super villain, is BACK! https://t.co/b3g38jvtgt","@heraldly","role-model",
"@CHamsClassroom @KatieF On another note, Carmen Sandiego is my Halloween costume :-). Pics will be posted!","@Ms_A_Yeh","fashion",
"@SparklinAngela y’all can find her but can’t find carmen sandiego","@yallhoesareugly","cultural-icon",
"There's a woman on this flight dressed like Carmen Sandiego","@mikeiadevaia","fashion",
"Gina Rodriguez donning red fedora and trench coat of Carmen SandiegoGina Rodriguez donning red fedora and trench c… https://t.co/SHhqc3DdPW","@Anandokarmoker1","cultural-icon",
"#Netflix rebooting #CarmenSandiego! 20 episodes of the animated series set to debut in 2019 w/ @HereIsGina as Carmen & @FinnSkata as Player! https://t.co/HLhhaCM4ls","@KiSS925","cultural-icon",
"Netflix’s Carmen Sandiego Animated Series Adds Stranger Things Star https://t.co/NnOKkdpCYt Visit https://t.co/JfRsX2KUCZ https://t.co/gQwOsTsbHq","@fantasysite","cultural-icon",
"I finally figured out Where In The World Is Carmen Sandiego. She's in Rome, hiding from Chuck Norris.","@TyVulpintaur","cultural-icon",
"Remember back in the day when we learned at school via Oregon Trail and Carmen Sandiego? So much fun! #edtechchat","@hinduja","edutainment",
"@CharmCity25 @YouTube I know I love Carmen Sandiego the puns in that game are funny as hell","@CardyShaun","cultural-icon",
"Lets see #halloween costumes #milwaukee!! Carmen Sandiego needs some disguises as she (I) travels around the world! http://t.co/kA8pCFddUB","@pancakes4life","fashion",
"Where in the world is Carmen Sandiego...... #travel #wanderlust #world #carmensandiego #where… https://t.co/kMu8JOEBrI","@arlyzmarie","travel",
"Mimi know she needed to quit with that Carmen San Diego outfit she had on!","@Mickens__","fashion",
"Netflix Developing Live-Action 'Carmen Sandiego' Movie Starring Gina Rodriguez https://t.co/iKWLJSjq6l","@RandallMonk","cultural-icon",
"Rockapella-Where In The World Is Carmen Sandiego: http://t.co/AOVU10oOqV why am i listening to this song","@fran77771","cultural-icon",
"@elyseholladay big hat + foreign country = got a little carmen sandiego vibe going","@vitor_io","fashion",
"Our Childhood Dreams Have Come True: Gina Rodriguez Is Playing Carmen Sandiego On Netflix https://t.co/zw5DsDJkhT","@wwwORTEGZcom","cultural-icon",
"😭😭😭😭 at Mia saying Rasheeda got the Carmen SanDiego outfit. She swear she you @rt_Tee","@TerrellChuggs","fashion",
"@GUBLERNATION So that's where in the world she is. p.s "" Where in Time is Carmen San Diego"" was a better game, Sweet elementary/middle school memories.","@MelissaBartoe","cultural-icon",
"Had the most random urge to play Where in the World Is Carmen Sandiego? Next time my son needs geography help I'm going to make him play.","@mikinho","cultural-icon",
"Puffy looking like a black Carmen San Diego with that hat on!! Lol","@SimoneGreenLive","fashion",
"⚡️ “Netflix greenlights a Carmen Sandiego series” https://t.co/qlgRwoLMRM","@AmandaHilden","cultural-icon",
"@angle1851 I'm loving this adventure you guys are on. Did you find Carmen Sandiego yet?","@LandonDowden","cultural-icon",
"@a2_4am Where in the USA is Carmen Sandiego? https://t.co/DxT5UubnDE #wozaday https://t.co/x3vOsyWDRA","@a2_4am","cultural-icon",
"I was obsessed with Carmen Sandiego as a child growing up in rural Arkansas. Was one of my first examples of an independent woman traveling the world. https://t.co/eXf2hP2UL1","@DriverWrites","edutainment","x"
"Now Rockapella needs to reunite to record the theme song! https://t.co/NAdGxxthFT -k2 #Netflix #WhereInTheWorldIsCarmenSandiego #Gumshoes https://t.co/iKgSMS4prQ","@betweenthecons","cultural-icon",
"Thats what i get for loving an explorer. A Carmen sandiego.","@JasiriSimba","travel",
"Seriously, Carmen Sandiego is a really good villainess.","@idamork","role-model",
"Carmen Sandiego Is Officially Happening With Gina Rodriguez at Netflix https://t.co/bCnlXp1a5y","@QkTipcom","cultural-icon",
"Sounds Like Netflix Is Bringing Back 'Where In The World Is Carmen Sandiego?' https://t.co/ZWstiyBVB2 https://t.co/ca8eJqBmKL","@mommashelping","cultural-icon",
"@SuperBeardBros Hey beard bros, if you were Carmen Sandiego, where in the world would you go? And, if after your trip was over, where in the world would you want to found? Best wishes, Nikki~","@AndromedaTL","travel",
"Report: Gina Rodriguez (@HereisGina) cast as Carmen Sandiego in new @netflix animated series https://t.co/EKWHx1e0xj https://t.co/5Zaxoelwet","@PasteMagazine","cultural-icon",
"Surrrsly doeeee, can somebody buy me where in the world is Carmen sandiego for my birthday??","@slightworkkk_","cultural-icon",
"Where in the world is Carmen Sandiego?","@_KE3N","cultural-icon",
"I would like to be considered to play Carmen Sandiego in the Netflix series please.","@jennalynne07","cultural-icon",
"wore a duster coat to work today and someone already called me Carmen Sandiego","@hancsut","fashion",
"A Carmen Sandiego AND a Selena TV series??! https://t.co/7XovkNVblO","@MarioNevarez","cultural-icon",
"Things I ponder when I can't sleep....if Waldo and Carmen Sandiego got married, would it be a non stop adventure, or a constant game of peek a boo, with no winner? #SleeplessInCalifornia","@RockinMissMolly","cultural-icon",
"The grand theft otter got a taste for filet mignon but he gonna be eating shoe leather real soon. #EatinGood #PoorKoi #CarmenSanDiego #CatchMeIfYouCan","@ErinnAlexander","cultural-icon",
"- Gina Rodriguez To Star As Carmen Sandiego In Netflix Live-Action Feature Deadline - Gina… https://t.co/G5s3Yk5By6 #SanDiego #News","@SanDiego_SoCal","cultural-icon",
"📷 Happy birthday to my fellow traveler and best friend! Hope you had a great night #CarmenSanDiego!... https://t.co/ugI02CfnA9","@kimberlydavis77","travel",
"UPI Latest News: Netflix orders 'Carmen Sandiego' with Gina Rodriguez #UPI #Latest #News https://t.co/u8W3fRA1yf","@_Reality_Check_","cultural-icon",
"So... @MichaelAusiello and @TVLine made #CarmenSandiego a trending topic in the US. Even as a cold hearted robot, I am impressed.","@WhoTrendedIT","cultural-icon",
"When it’s #Halloween and you can’t choose if you want to be #CarmenSandiego or #WonderWoman so you decide to be both! Carmen/Diana ran into The Purge’s Uncle… https://t.co/rVY6lWb2lG","@EricaKlafehn","fashion",
"I just saw Carmen SanDiego kissing Waldo at the bus depot","@Big_Mak92","cultural-icon",
"Our Childhood Dreams Have Come True: Gina Rodriguez Is Playing Carmen Sandiego On Netflix ❤️ #GinaRodriguez https://t.co/FzCPVHQ0mV","@MyMysticMuse","cultural-icon","x"
"@TheBigBlueBoy @HereIsGina @TessaThompson_x Are your @'s word play? Tessa with the area X and Gina with the Carmen SanDiego tease!!","@TheBigBlueBoy","cultural-icon",
"Just told AT&T that my childhood hero is Carmen Sandiego and I meant it.","@_magadeth","role-model","x"
"Netflix finds 'Carmen Sandiego' for its latest reboot https://t.co/Ee8Ad07DSb #Tech #Technology https://t.co/jmtmHJ4BH7","@CEOatMobiVerse","cultural-icon",
"@talkwordy Call yourself Santa, but that hat says Carmen Sandiego.","@Mattwilljackson","fashion",
"‘Carmen Sandiego’ Animated Series Greenlit at Netflix, Gina Rodriguez to Star https://t.co/u3E0npYk1U via @variety","@UrbanNoize","cultural-icon",
"Now streaming Where In The World Is Carmen San Diego? https://t.co/E7zpOa1wPN #extralife #SupportSmallStreamers","@giraffefeelspod","cultural-icon",
"Where in the world is Carmen Sandiego?... #halloween #90skid #LastNight #Round2 https://t.co/JdKltqvir5","@nopicsnochat","cultural-icon",
"@HECochrane 4. Where in the World is Carmen Sandiego? I enjoy playing decades old educational games way more than I probably should.","@HECochrane","cultural-icon",
"Where In the World Is Carmen Sandiego? Why, she's in each of our hearts each time we learn and then immediately forget geographic trivia.","@DKinMN","edutainment",
"Is #CarmenSandiego hiring? I too am good at travel, puns, and art theft","@andyjm_4","travel",
"#ziggystardust #halloween #tbt with my mamas @caseymita and Carmen Sandiego miss you guys!!! 👻💀🎃 https://t.co/W9FnXnhumR","@lexnovak","fashion",
"I love Gina but she looks like Carmen San Diego at this party #rhoc","@3icecubes","fashion",
"@UnburntWitch Can I also run around on a giant map Carmen Sandiego style?","@decafjedi","cultural-icon",
"@ariel_thethird THANK YOU! Is it weird I want to play this now. Go back in time with this game and Where in The World is Carmen Sandiego!","@trombley_grace","cultural-icon",
"@Trist_Chi I saw a gal in the airport one day in a perfect red coat and in a moment she was gone. That is how I met the real Carmen Sandiego.","@worldnamer","travel",
"#USATODAY Gina Rodriguez is the new voice of ‘Where in the World Is Carmen Sandiego’ on Netflix https://t.co/LQGSpalcRb https://t.co/ThrMQ0aeLw","@love_scroll","cultural-icon",
"It's Official: Carmen Sandiego Is Getting Her Own Animated Netflix Series https://t.co/S0U1Mo2vcB","@RandyS0725","cultural-icon",
"Kourtney Kardashian Takes Younes Bendjima on a Surprise Birthday Trip Oh, the places they'll go! Kourtney Kardashian channeled her inner Carmen San Diego for Younes Bendjima's birthday--and no, we're not talking about a role-playing fantasy.... https://t.co/0sBS9hWR4s","@Reynolds7Rodney","travel",
"Where in the world is carmen sandiego? — In Texas. http://t.co/kDyqWtqOBv","@mizzdanie92","cultural-icon",
"@ShapingYouth @AngelasClues @FredRogersCtr @AmazonStudios I'm super excited about what Netflix is doing with 90s programming reboots, too! #CarmenSandiego","@KidsMediaDoc","cultural-icon",
"@colorsoloud Is it part of a Carmen Sandiego costume?","@clawphd","fashion",
"Where in the world is Carmen Sandiego? Bradley Whitford killed her, stole her power and her hat. #Emmys2015","@Playboy","fashion",
"@BhasChat: I guess I was lucky to grow up in the 90s. Where in the World is Carmen Sandiego was my jam. Still study geography today.","@kungfulasers","cultural-icon",
"Gina Rodriguez To Star As Carmen Sandiego In Netflix Live-Action Feature https://t.co/HAvID9nZFY","@GOATfilmpodcast","cultural-icon",
"@MnNiceFC can we talk about how, with that outfit, it would probably be really easy to spot Carmen Sandiego?","@EvanReam","fashion",
"""#8 Her Fondness for Tacos..."" My kids totally love Carmen Sandiego and I did, too. (I still do!) When I was a... https://t.co/2KiFdtYruI","@LatinMami","cultural-icon",
"Netflix Is Making A Carmen Sandiego Movie - https://t.co/BrJMIJby7t Netflix Is Making A Carmen Sandiego Movie G... https://t.co/uvGYGTmRl5","@OHTML5GAMES","cultural-icon",
"@Misfit47 because you're carmen sandiego and you do frequent clothes changes to blend in?","@javabomb1","travel",
"How can I expect to live out my lifelong dream of dressing like Carmen Sandiego if red trench coats insist on being so expensive?","@savageglitter","fashion","x"
"#UnexplainedPantryItems Waldo and Carmen SanDiego. I sent Dora the Explorer in to find them. More: https://t.co/ZNjb7VcD5A","@bolly_dansis","cultural-icon",
"@TasiaValenza Awesome hat, Tasia! Wishing UL cosplay as #CarmenSandiego 4 this years #Halloween! 😎👍💪✊🌆🌃🗽❤️💛💖💋🌹🏁🏆🇺🇸 https://t.co/VSk8i6iywh","@littlehoss16j","fashion",
"Gina Rodriguez will play Carmen Sandiego in the live-action movie: Netflix has found a star for its upcoming Carmen Sandiego movie: Gina Rodriguez. Rodriguez will be starring as Carmen Sandiego in the upcoming live-action movie, The… https://t.co/njbhfhHm5t fonte:Mashable","@Lauralink2me","cultural-icon",
"sometimes when I wear my trench coat I think about being Carmen Sandiego","@allie_renae","fashion","x"
"@dgahk thats the 2017 spinoff forgot to tell u theyre makin a netflix series of carmen sandiego as well","@earley","cultural-icon",
"Carmen Sandiego caught at last: Carmen Sandiego's globe-trotting crime spree has finally come to an end, than... https://t.co/cqMrA98utg","@Kraids_Lair","cultural-icon",
"Netflix Reboots 'Carmen Sandiego' With Gina Rodriguez https://t.co/BlgxUc2ghW.","@OpusFlameheart","cultural-icon",
"Where in the world is Carmen Sandiego!? Her dinner is getting cold.","@mattgossen","cultural-icon","x"
"Netflix is learning how in the world to play the franchise game with Carmen Sandiego https://t.co/HXYtH4UeyR Nostalgic millennials, get ready for a Carmen Sandiego live-action movie and cartoon TV series. https://t.co/RzuQrzun8h","@anycurrencynews","cultural-icon",
"From HuffPo: Sounds Like Netflix Is Bringing Back 'Where In The World Is Carmen Sandiego?' https://t.co/gJncGi6y11","@WillSmirk4Food","cultural-icon",
"@athenahollow The Carmen Sandiego (the red one) reminds of Peggy Carter's hat on Agent Carter you can cosplay as either one with one hat!","@cyberstrike2k9","fashion",
"Ya'll, a Carmen Sandiego reboot is coming to Netflix. I just found out about this. Clearly I'm not a very good gumshoe. https://t.co/lYGS1iHfYH","@coulterlaura","cultural-icon",
"Where in the world is...*deep voice* Carmen Sandiego","@Miss_DickPizza","cultural-icon",
"#Breaking @netflix is developing a live-action film based on the classic edutainment video game series #CarmenSandiego https://t.co/C14UGhp5UT @BlastingNews #IARTG #PJNET #tcot https://t.co/yf8S2XX5Tz","@larrymlease","edutainment",
"Gina Rodriguez to Voice Carmen Sandiego in New Animated Netflix Series https://t.co/Npt4XrqCBB #TV","@eonlinefashion1","cultural-icon",
"Gina Rodriguez, ‘Stranger Things’ actor, to lend voice to Netflix’s ‘Carmen Sandiego’ https://t.co/yRvvwx6qa5 https://t.co/dKoAEWhRHe","@GardnerPearcy55","cultural-icon",
"#NEWS Gina Rodriguez donning red fedora and trench coat of Carmen Sandiego https://t.co/iGl4tQ1uIU https://t.co/xlY8E4wuUo","@nikhilhmakwana","cultural-icon",
"Gina Rodriguez, ‘Stranger Things’ actor, to lend voice to Netflix’s ‘Carmen Sandiego’ https://t.co/UutRKn1AkX","@hvlint","cultural-icon",
"@artifishly YES! It’s a tv show where you learns bout history through the narratives of this brother and sister (I think) who need to save historic objects because carmen San Diego keeps trying to steal them","@ChatsWithOrlie","edutainment",
"RN/Tad the Lost Explorer and the Secret of King Midas/COM/HBO RN/Carmen Sandiego/Ep.106,107/COM/NF","@iake93","cultural-icon",
"@braviary ...I think my love of travel stems from me playing way too much Carmen Sandiego as a kid","@LocksTheFox","travel","x"
"Photoset: ickaimp: 10 Costumes and Moments that made me giggle at Katsucon. Carmen SanDiego and Waldo are... http://t.co/zzAUc0lE2x","@LinuxScouser","fashion",
"We need to make a new game - ""Where in the World is @JohnVignocchi ?"". He travels so much it makes Carmen SanDiego look like a shut in.","@jason_moffitt","travel","x"
"Carmen Sandiego, who stole the Statue of Liberty's torch, slayed in a red fedora, and eluded hundreds of pint-sized gumshoes. https://t.co/C5iTBelJBc","@jaimewoo","fashion","x"
"@filamena Bonus points if you do it in a trench coat and fedora... If they ask about it, say that it's a Carmen Sandiego LARP.","@thegreatdanbyrd","fashion",
"Revisiting last week's #influential_videogames post: This is ""Where in the World is Carmen Sandiego"" for the Apple II/IIe, from 1985. (You know there's a thread coming.) https://t.co/t8f6XvX1lv","@UllerRM","cultural-icon",
"I found them both here, together @wizardworld Des Moines! #cosplay #comiccon #carmensandiego #waldo https://t.co/okfSkKIbKl","@mattpeppler","fashion",
"Our McDuece wasn’t dirty it was filthy. 25 reps of push-ups, squats and crunches followed by a 125 yard bear crawl. Repeat 4 times. Hat tip to Silicon, Carmen San Diego and Mookie for rising to the challenge.","@PlanoF3","cultural-icon",
"1993 Where In The U.S.A. is Carmen Sandiego Game Parts Pieces Geography Cards https://t.co/6brhlBAK3p https://t.co/J5FLn104wo","@DealGorgeous","cultural-icon",
"Watch out for @GlennThrush he's obviously the best investigative journo. He found Carmen Sandiego and wears her hat as a trophy(Just a joke)","@JoPhSa","cultural-icon",
"Netflix orders animated Carmen Sandiego series [The Verge] https://t.co/5NF8I9wIaW","@alanzeinorss","cultural-icon",
"@anxiousarchives Just imagined you with a Carmen Sandiego hat. And now can't unsee it.","@Malacorath","fashion",
"Netflix is betting on ‘90s kids nostalgia for learning with upcoming lineup https://t.co/W54XIpRLgI","@DNSRainbowNews","cultural-icon",
"Shady + red trench coat + red hat = Carmen San Diego for Halloween Do you all h... https://t.co/SnX6TkDpZr","@crashpalace","fashion",
"@_HouseOftheDead hey now, Carmen Sandiego was a bad ass international thief who could steal landmarks and taught me geography as a kid.","@EchoOwl","edutainment","x"
"Carmen San Diego spin off.. Where in the world is Sloane's brunch hat https://t.co/sveH2tcbgf https://t.co/bNbd8uchhP","@WisRoth","fashion",
"Netflix Is Rebooting 'Carmen Sandiego' With Gina Rodriguez https://t.co/FDTN4tpzao https://t.co/IQyIihoWlS","@POWER981FM","cultural-icon",
"Where on Earth is Carmen Sandiego? (I’m still sad I couldn’t find a hat that matched my coat 😩) #Halloween18 https://t.co/k4XNTk1WQ5","@bbyaimy","fashion",
"BE STILL MY HEART!!!! It's Official: Carmen Sandiego Is Getting Her Own Animated Netflix Series https://t.co/9DgqQycs0n https://t.co/7ODHhG0edv","@alioop7","cultural-icon",
"As far as I can tell, there has never been an official Carmen Sandiego action figure, figurine, statuette, or doll. With a new TV series and feature film from Netflix this year, 2018 has the opportunity to finally correct a travesty that has continued for 25 years","@WINGSPANTT","cultural-icon",
"@p0peyelang @BigBadBradRocks @SethMacFarlane What does China have to do with the U.S. media constantly sensationalizing climate science? And who has ever claimed that by (or before) 2030 we will all be underwater? And who is ""all?"" The entire planet? And where in the world is Carmen Sandiego? Find out next week on Twitter!","@DenDen410_","cultural-icon",
"So Carmen Sandiego will be on Netflix.. If you know, you know!! 🤯","@ksppppppppp","cultural-icon",
"@TheDaringExplor You found Carmen San Diego","@FelixFloetryJW","cultural-icon",
"Gina Rodriguez donning red fedora and trench coat of Carmen Sandiego https://t.co/hQLBoTrHyg https://t.co/NT2MYTqlrg","@hvinod24","cultural-icon",
"I'm like Carmen Sandiego except I'm white & she prolly looks way better in her lil outfit than I would. https://t.co/TiDHVAX2Ga","@samwhiteout","fashion",
"Carmen Sandiego stole more than a priceless gem & a map to El Dorado... She stole my heart. Other organs too. That's why her coat is red.","@Glennmandirect","cultural-icon",
"Adam Lambert Serves Carmen Sandiego En Bleu Realness - Who in the world is Adam Lambert's new style icon? Ummm, ap... http://t.co/WEngRkMzXL","@DiscountTixBox","fashion",
"I think I would like to take some vacation time to find out the answer to ""Where in the world is Carmen San Diego?"" Travel buddies welcome.","@SeanDavenport","travel",
"Why did I never realize Carmen Sandiego is Hispanic?","@Preachcaleb","role-model",
"shellygurumi: It has been decided that Sophie Devereaux was the original inspiration for Carmen Sandiego.... http://t.co/AEqqRf8cyK","@starsoverhead","cultural-icon",
"Dear @IssaRae please don't instastory and drive. We need you around for a season 3! Yours truly A Carmen Sandiego #Insecuritea #InscureHBO","@Thisladylion","cultural-icon",
"@jodellemicah @NightValeRadio @CecilBaldwinIII @AnimeRevCanada @ArdaWigs @ArdaWigsCanada That's gorgeous! Here's my geekiest (& most nostalgic) cosplay to date 🙂Carmen Sandiego. https://t.co/p5Sxr0zHA7","@cakeandmadness","cultural-icon",
"⚡️ “Netflix greenlights a Carmen Sandiego remake ” https://t.co/C1YwoOzhHQ no..","@arturo_dueno","cultural-icon",
"ITS BEEN 11 YEARS, AND I STILL CANT FIND CARMEN SANDIEGO","@tweetsdetomas","cultural-icon",
"Carmen Sandiego Is Officially Happening With Gina Rodriguez at Netflix: Get excited, gumshoes! Just days after it… https://t.co/tqWQgLlZmo https://t.co/Q1sGaVCqdR","@amandasome","cultural-icon",
"If I'm ever in a relationship during Halloween I want to do a couples costume of Carmen Sandiego and Waldo.","@Haroldd_C","cultural-icon",
"Sounds like Netflix is bringing back ""Where in the World is Carmen Sandiego?"" https://t.co/8nxSOSOHqU via @HuffPostEnt","@emillyorr","cultural-icon",
"Per @laureningram's instructions: Happy Birthday @derridalicious! (As I tweeted this, I just noticed that you look like Carmen Sandiego (if she was wearing glasses) in your current profile picture.)","@Gavin_J_Porter","fashion",
"@Carmen Sandiego my mother needs help♻️♻️💎😎🗳🗳🗳🗳🗳🗳👨‍💼👨‍💼👨‍💼🗳🗳🥕🥕🥕🥕🥕🥕🥕🥕🇮🇶♻️💕🍇🎅🍖🌈💰✍️T.V.","@TiCarter3","cultural-icon",
"Netflix Could Be Bringing Carmen Sandiego Back https://t.co/latugoAkrk","@efairhurst","cultural-icon",
"@HereIsGina @netflix @HereIsGina, can't wait, our Carmen Sandiego fangirl selves are squealing already! Please tell us a cameo by @TheRitaMoreno is in the works?","@MorrisJumel","cultural-icon","x"
"Colleague:What's your costume? Me: Carmen Sandiego Colleague: Is that a rapper? 😳","@TheMinneapolite","fashion",
"This was about 4 years ago... #carmensandiego #costume #cosplay #whereintheworldiscarmensandiego… https://t.co/GxyUhRIcjg","@TheJessicaMercy","fashion",
"Where in the World Is Carmen Sandiego? Becoming a secret travel agent [3... https://t.co/YLBBa4O9MQ via @YouTube","@tom_vanveen","travel",
"Already have my next Halloween costume planned out. Carmen Sandiego. My date&39;ll go as Where&39;s Wally. Always wanted to do that","@alinacfhorne","fashion",
"The real questions of life: ""Where is Carmen Sandiego?"", ""Are we humans or are we dancers?"" and ""What does the fox say?""","@TheRealGSmith","cultural-icon",
"VIDEO: 10 Reasons Where in the World Is Carmen Sandiego? Was the Best Educational TV Show … https://t.co/DxtAfjFHMO https://t.co/BHroDxY5qd","@MisonoAlex","edutainment",
"Netflix bringing back Where in the World is Carmen Sandiego might be the best news I have heard ever!!! https://t.co/NfQEyZd6tk","@slasher_nerd","cultural-icon",
"I'm sorry Stephanie, but Carmen Sandiego was the first thing I thought of when I saw the hat","@RexPColt","fashion",
"👠Found Carmen Sandiego this morning. #80skid #rainydayoutfit #fedora #trenchcoat #getreadywithme #ootd… http://t.co/7UEEWQfTEM","@whimwhamlife","fashion",
"90s ed. game power rankings: 1. Oregon Trail 2. Carmen Sandiego 3. World Discovery Deluxe 4. Mavis Beacon Teaches Typing 5. Amazon Trail","@onejoey","edutainment",
"Carmen Sandiego, The Popular 1980s Cartoon Is Getting the Netflix Treatment https://t.co/e8A8IipBBD","@Snapzu_Entertai","cultural-icon",
"my new hat makes me feel like Carmen San Diego 😎","@makennasorensen","fashion","x"
"@Sorkapi Thank you for revealing my basest desire to me Sor: Kairi dressed as Carmen Sandiego","@DrKotobuki","cultural-icon",
"@arumboldt @libetdawn Was beginning to wonder Where in the World Carmen Sandiego was... hope you are having fun","@arumboldt","cultural-icon",
"Check out these insane (and inexpensive!) Halloween costumes! https://t.co/YSUbdDlNXP My favorite is Carmen Sandiego!! #90s","@MyVintageSoul","cultural-icon",
"@morganmcmichael hat, socks, carmen sandiego, dr who license plate border, pinkie pie mug, colored mascara. http://t.co/LusjwDPCnR","@leggzmackenzie","fashion",
"@jenjacobyy Hahaha Guaranteed!!! I learned a lot of geography from Carmen Sandiego #WayBackInThe80s","@mandyjennette9","edutainment",
"I think the world is ready now for a Waldo/Carmen Sandiego romance/adventure anime: https://t.co/Oy80z9uiOU","@MDMRN","cultural-icon",
"That @awesomecon entertainment. #GeekpinEnt #WheresWaldo #CarmenSanDiego #AwesomeCon #Cosplay… https://t.co/wDxd3Lrug6","@GeekpinEnt","cultural-icon",
"@SNCmusic is there a video anywhere of you guys doing the Carmen Sandiego song? It would make my childhood happy.","@tessamalk","cultural-icon",
"Staff at the museum have gotten into the Halloween spirit this year. A witch a pirate and privateer, a turn of the century shopkeep, Carmen Sandiego, a skeleton, and Sherlock Holmes! 🎃 👻 What’s your costume? #nsm150 #halloweencostume https://t.co/zS65L75urP","@ns_mma","fashion",
"Gina Rodriguez Voicing Carmen Sandiego in Netflix Show - https://t.co/2WRBq8ACz2","@Cyber_Saber","cultural-icon",
"oh wow. Netflix is making a Carmen Sandiego cartoon AND live action film. the star of both of them will be Gina Rodriguez. Finn Wolfhard will co-star in the cartoon. https://t.co/U2PwnsC7Xq","@QueerCatDubh","cultural-icon",
"I anticipate that Ashe will get a Carmen Sandiego legendary","@nerf_thiss","cultural-icon",
"@scratch_paper right! But he stunting my travels lol. That's why they need Carmen SanDiego back on air.","@MzCrystalBella","travel",
"Netflix’s ‘Carmen Sandiego’ Reboot Finally Has a Premiere Date #Netflix https://t.co/z2basjSNqV","@Netflix_Updates","cultural-icon",
"There's some good stuff left to explore with Carmen Sandiego in terms of the mythology...like; who IS she? One of the compelling things about the character is that she's a mystery...a cat burglar who steals historical and cultural monuments. What motivates someone like that?","@DTHalliday","cultural-icon",
