"text","handle","category","star_tweet"
"Has there been an episode of Carmen Sandiego where she steals Paddington’s hat?","@helenhousandi","fashion",
"Gina Rodriguez to Star as Carmen Sandiego in Live-Action Netflix Film https://t.co/GeK96WbSBb","@saykoolmaye","cultural-icon",
"DogFood Load On First Leg towards Home. TurkeyDay here I Come!!!! #BatOutOfHell #CarmenSanDiego 🚛🔜🗺🖍📍Minnesota (@ Smuckers in Topeka, KS) https://t.co/UVz1NzgYcK","@Pulpmind","cultural-icon",
"This game taps into my wanderlust and love of Carmen Sandiego the tv show. I'm guessing @thegynomite would like it! https://t.co/0ljvtuErxX","@rosesarered23","travel","w"
"#erinandrews is looking like Carmen San Diego with that hat #SeahawksvsPackers","@rosseideactual","fashion",
"Only works if they keep the original theme! #90sKid ⚡️ “Netflix greenlights a Carmen Sandiego series” https://t.co/OC8uGVJA8c","@SN1983MCS","cultural-icon",
"@mthomps @NPR_Ed Also Carmen Sandiego (history/geography/travel) and the Sierra strategy games of the 80s/90s.","@alykat","edutainment",
"Bout to go as Carmen Sandiego for Halloween this year","@MartiniZealot","fashion",
"Netflix finds 'Carmen Sandiego' for its latest reboot - https://t.co/mRLoxEowXc - by Mat Smith","@thunderbluex76","cultural-icon",
"Perfecting this audio engineering skill. When Carmen Sandiego(the outfit) meets Beyoncé (background music) 🎶 #music #film https://t.co/pjbsUHZc1H","@CeceLGraham","fashion",
"@LindseyHouchin just going to call you Carmen San Diego! Always a new adventure ahead of you!","@Rebekkasaurus","travel",
"Petition to relocate the entire WVU football stadium, Carmen-Sandiego-Style, to a location that makes any goddamn sense with the geography of this town.","@WolverKeith","cultural-icon",
"@wolf_glade Comes together nicely to me. Only off part is the blush on Carmen San Diego there","@greendiablo1","cultural-icon",
"I was seriously wondering if they were doing a Carmen Sandiego show when I saw that red hat. #AgentCarter","@BoyandPiano","fashion",
"Lady Gaga vs. Carmen Sandiego: Who Wore It Better? – Readers Poll http://t.co/EzLIFsng2y","@bokuranoashiato","fashion",
"Colleague:What's your costume? Me: Carmen Sandiego Colleague: Is that a rapper? 😳","@TheMinneapolite","fashion",
"Man... I signed up to Netflix at the right time. All of Goosebumps is available and now they're making a Carmen Sandiego show!","@drewzu","cultural-icon",
"Blast from the past Carmen San Diego going on Netflix Hear that my daughters and sons OMG","@marylovesrafael","cultural-icon",
"@AmyKinLA This is v Carmen San Diego chic https://t.co/2vC2RVkhmd","@AmyKinLA","fashion",
"Hall shot of Life of Cosplay as Carmen Sandiego. I still don't know how she didnit. I had on… https://t.co/vwRScQxcxg","@Dbrooksphoto82","fashion",
"@Sketch_Dailies #sketch_dailies How can they miss #CARMENSANDIEGO when she's wearing all red and riding a helicopter? http://t.co/kndDWQx9Js","@BrianaMSalcedo","fashion",
"We had another in us- and hopefully more to come. This #game is way too much fun! What are some #games that you have serious #fond #memories of? #LetsPlay #carmensandiego #geography #Videogame #YouTube #sega #Nintendo #Subscribe #comment #firstdayofspring https://t.co/DYr72t8rrt","@2d1couch","cultural-icon",
"Also Carmen Sandiego speaks in spanish sometimes and if you think she sounds good in english","@MitsukiZi","cultural-icon",
"I feel like Carmen Sandiego is the only one that would ever really know. They must travel and kick ass… http://t.co/MiZrKXg2qb","@Grant_Abel","cultural-icon",
"Where in the World is Carmen San Diego! http://t.co/cCEuRgxVcn","@thejessknox","cultural-icon",
"*camera zooms across audience* ""All these people want to know: Where in the World Is Carmen Sandiego?"" - Chief #gameshow #carmensandiego #cosplay #femmefatale #VILE #90skid #computergame… https://t.co/Q0ZQpkZe4L","@ThatKtbGurl","cultural-icon",
"I kind of felt like Carmen San Diego with all the travel I've been doing these past few months. Read where I've been https://t.co/ZxpqcqMk2y https://t.co/ywqTJ9h5Jv","@BRichWrites","travel",
"@4mxnute I wanted a big hat, cause her whole shtick reminded me of carmen sandiego","@MagiKoopa24","fashion",
"Netflix is betting on ‘90s kids nostalgia for learning with upcoming lineup https://t.co/A7EEWZFZxz https://t.co/uAh0rGM21f","@bridge0005","cultural-icon",
"Educational Video Games: do they really exist? Indie Dev Strategies – Part II https://t.co/K9K4CzFobE via @lndieWatch Yes! #whereintheworldiscarmensandiego? #carmensandiego","@nancymacintyre","edutainment",
"@RetrovertigoVGN @_RetroGaming_ Sorry but the red 1 actually reminds me more of #CarmenSanDiego. Nice to see #KungLao but not sure if iconic","@GameChangerDOC","cultural-icon",
"Where in the World Is Carmen San Diego was, along with Reading Rainbow and Sesame Street, TV I really enjoyed with my kids. Lynne Thigpen was great as The Chief! One of my sons had a set of Weeblies he called The Rockapellas. #nostalgia & looking forward to the movie! https://t.co/Qt4bAnbSD4","@JHammons","cultural-icon",
"Happy International Women's Day to all (but most especially to Carmen Sandiego, the original international woman).","@chrissiegruebel","feminism","x"
"engadget: Netflix finds 'Carmen Sandiego' for its latest reboot https://t.co/DW4XSgF2dt https://t.co/i8xa6cXouM","@lluccipha","cultural-icon",
"@MissMollie_x the one in the top right, is that Carmen Sandiego's hat?","@Joshique_Noir","fashion",
"@richardcobbett @dosnostalgic I like New 52 Carmen Sandiego, who's just a sentient crimson hat.","@decafjedi","fashion",
"Netflix is betting on ‘90s kids nostalgia for learning with upcoming lineup https://t.co/agf8m90wxo","@polygonfeatured","edutainment",
"@GwentheHobbit There IS a spinoff game of Carmen Sandiego that’s called Math Detective... I preferred Word Detective and the remake of Where In Time Is Carmen Sandiego which was called Carmen Sandiego And The Great Chase Through Time myself though.","@GrahamRocks84","cultural-icon",
"When Carmen Sandiego goes on vacation. 😍","@jnlbrk","travel",
"i’m watching steven universe and connie put on a carmen san diego costume and then called herself veronica cucamonga i am SCREAMING","@la_terminator","fashion",
"You know that old kids show ""Where in the world is Carmen Sandiego?"" What we need: ""Where in the world is Harry Styles?""","@hailthedimples","cultural-icon",
"I saw Erin Andrews' outfit & said, ""She looks like Carmen SanDiego""! come on Twitter to realize that I'm just a 90s kid like everyone else.","@CassandraTenny","fashion",
"I was telling Mom about Desert Bus and now I have Carmen Sandiego music in my head again. I still blame @Graham_LRR. I'm still not really complaining.","@Sarah_Serinde","cultural-icon",
"@ErinHazelwood U can dress as Carmen Sandiego and I as Waldo...& no one will find us...drinkin all the vodka @ your Halloween party 😃","@althibbie","cultural-icon",
"Where in the world is Carmen Sandiego? Heading to #Netflix! https://t.co/itf3hlgJNJ","@LIVE959","cultural-icon",
"#UnexplainedPantryItems Waldo and Carmen SanDiego. I sent Dora the Explorer in to find them. More: https://t.co/ZNjb7VcD5A","@bolly_dansis","cultural-icon",
"@janinecompoop It’s been a long while! we should catch up. you can tell me your adventures as Carmen Sandiego lol","@Intricate93","travel",
"Sounds Like Netflix Is Bringing Back 'Where In The World Is Carmen Sandiego?' https://t.co/drECnu5iuQ https://t.co/Z0AnYAmAKn","@MoviesWrld","cultural-icon",
"Netflix Bringing 'Carmen Sandiego' Reboot With Gina Rodriguez & 'Stranger Things'' Finn… https://t.co/7pHxrP2Ino","@starnewsn1","cultural-icon",
"@Ginger_Clark Funny, I was *just* telling my kids about Carmen Sandiego. Also The Oregon Trail. I miss 80s computer games.","@C_M_Franklin","cultural-icon",
"@pcgamer Minesweeper? Pinball? Lots of Milton Bradley cereal games. Magic School Bus! Loved my mom’s Casino Deluxe, lol. And tried sooo hard at Where in the World is Carmen SanDiego even though it went way over my head at the time","@xxxKaleidoscope","cultural-icon",
"The Math Blaster & Carmen Sandiego entries took me right back to the days of playing educational CD-ROMs on PC. Good times! https://t.co/lZjBo48VP7","@TonyaWithAPen","cultural-icon",
"Netflix is Bringing Back 'Carmen Sandiego' with Gina Rodriguez Playing the Lead https://t.co/BitJUwHGv7 #beauty #healthy #fashion https://t.co/n5lH0N1F54","@UltraYOUwoman","cultural-icon",
"@mississippiDAWN comparing someone to Carmen Sandiego doesn't come across as though you love her hat.","@Ingridium","fashion",
"""Where in the World is Carmen Sandiego""? She's now at @Netflix, and her real identity is @HereIsGina as she'll not only voice her in a new Cartoon series but she'll now also don the Red Trench Coat in live-action form too: https://t.co/QTh5azTac2","@KevDGrussing","cultural-icon",
"Netflix's animated CARMEN SANDIEGO series starring Gina Rodriguez confirmed; Finn Wolfhard to also voice a role https://t.co/Dq2nNy18O6 #TV","@charlestrotter","cultural-icon",
"Netflix's 'Carmen Sandiego' to begin streaming in January https://t.co/jZoTRZbf4a https://t.co/MDxs7etbcg","@gonevoip","cultural-icon",
"Where in the world is Carmen San Diego? Deeming them ""Carmen"" hats and they are trending right now!… http://t.co/6NjbwLNcGw","@ShopGotham","cultural-icon",
"A;SOLDIFKJA;EOFIAJ; APPARENTLY WHEN I WAS IN ELEMENTARY SCHOOL WE GOT ASSIGNED TO WRITE ABOUT OUR HEROES AND OTHER KIDS WROTE LIKE SUPERMAN OR THE PRESIDENT OR THEIR PARENTS BUT I WROTE CARMEN SANDIEGO AND THE TEACHER WAS. CONCERNED. OH MY GOD.","@starsinmist","edutainment",
"@amyrran the first one is an old carmen sandiego game that had you traveling through time solving mysteries and puzzles... embarrassingly formative","@amyrran","inspiration",
"@LoveAndShalom You're the real life Carmen Sandiego.","@SisterFarrah","cultural-icon",
"That moment when you learn #CarmenSandiego is going to be played by @HereIsGina. #daymade #perfect #yesyesyes","@vsurmiller","cultural-icon",
"VIDEO: 10 Reasons Where in the World Is Carmen Sandiego? Was the Best Educational TV Show Ever https://t.co/5V0wQemX71","@mala_mute","edutainment",
"First look at the art style for Netflix's Carmen Sandiego animated series! https://t.co/Ut5WQhDy44","@NESbot_OT","cultural-icon",
"I'm just a girl on the run.. ✌️💥#mandypants #carmensandiego #adventures #neverstayinoneplace #explore… http://t.co/Nb2vuIQwef","@shanshannnnnnnn","travel","x"
"@Talen_Lee @0xabad1dea ....was it a red fedora? 'cuz Carmen Sandiego hasn't been seen for a while...","@munin","fashion",
"Where in the world is Carmen San Diego....like none of these new shows teach kids anything","@Hailey_photo","edutainment",
"I owe it to Carmen San Diego for teaching me world geography and not to look in windows in Antarctica","@hanndegs","edutainment",
"#Fanose #Movies #comics |https://t.co/0BB3kvAaFM ..soon. Gina Rodriguez to voice Carmen Sandiego in Netflix ani... https://t.co/3uMUgv2U0B","@hossamostafa707","cultural-icon",
"@ProJared I found Carmen Sandiego seems the thief now dances in Spain! #80's #whereintheworldisCarmenSandiego! https://t.co/EW8hCCjS64","@celticnord932","cultural-icon",
"@DelReid I had an Apple II in elementary school in the 80s. I beat Where in the World is Carmen Sandiego so many times as a latch-key kid.","@BillTooke","cultural-icon",
"#Throwback #Thursday - #where #in #the #world #is #carmen #sandiego? #edtech #education #computers http://t.co/fAvwSxKV9P","@TheAlinaGroup","edutainment",
"YAAAAAS!! . . #carmensandiego @hereisgina is going to be AMAZING as her on #netflix Roll on… https://t.co/0ctTFlUJsr","@LibraryTasha","cultural-icon",
"I'm more hype for that Netflix Carmen Sandiego than I need to be. That promo art just did it for me.","@TakeiaMarie","cultural-icon",
"Where in Upstream is @eschoenTHD ?!? Sounds a little like Carmen Sandiego 🤔🤣 ✈️ #Alwaysonthemove #TeamSchoen #MissedHimAgain https://t.co/Afev5XCp2J","@HRMThomasTHD","cultural-icon",
"Who in the world is voicing new 'Carmen Sandiego?' No plain Jane: Netflix adds primetime star power to 2019 reboo… https://t.co/iEFG2N7A0G","@TrendStyleDaily","cultural-icon",
"Where in the world is Carmen San Diego? #livingontheedge #vacay #travel #sweetescape #carm… http://t.co/tGlSA5U4cY http://t.co/7dXquCtPkw","@InstaMaui","travel",
"Netflix orders animated Carmen Sandiego series https://t.co/oxyYdC4oVz","@iamthebe_m","cultural-icon",
"Carmen Sandiego Returns in a New Educational App https://t.co/o8jqX74gHM https://t.co/0qqU51zgL8","@mildredkmorse","edutainment",
"Anyone know how I can get this absolute gem of a game running on modern hardware? It'd be so much easier if all the old Learning Company (I guess it's @HMHCo now) and Broderbund games were on steam. The super solvers and carmen sandiego games were absolute treasures as a kid. https://t.co/c2wMRCuHUy","@Sprokacola","edutainment",
"Live action afro-latina Carmen Sandiego...but make it Gina TORRES https://t.co/7rBkonKCtS","@_maleficentt","latina",
"OMG! 😱😱❤❤ Carmen San Diego! Netflix is betting on ‘90s kids nostalgia for learning with upcoming lineup https://t.co/eGOEqp15Je https://t.co/kICQ1eu3km","@snooogansomega","edutainment",
"@BreenIsTerrible unrelated: Carmen Sandiego is my actual dream woman","@jaythenerdkid","cultural-icon",
"Already have my next Halloween costume planned out. Carmen Sandiego. My date&39;ll go as Where&39;s Wally. Always wanted to do that","@maurinexqlhn","fashion",
"Where in the world is Carmen San Diego?","@tiffanywood14","cultural-icon",
"#BestPartOfThe90sWas watching Where In The World Is Carmen Sandiego and other educational kids game shows.","@_Annetastic_","edutainment",
"@wordscience Phase 3: put on #CarmenSandiego outfit and hunt down #Meaty before procuring autograph.","@serpentinefyre","fashion",
"@Kariseen You travel a lot for work or you just be out here on ya Carmen Sandiego shit?","@DjAceBoogie","travel",
"@warrenksmith @ECDaSilveyra I had to look it up - it was introduced in 1986. I remember playing Memory Castle and Where in the World is Carmen Sandiego? on the IIe's in elementary! Ah, good times.","@RW_Crank","cultural-icon",
"This tweet @netflix @NetflixLifee @HereIsGina #CarmenSandiego https://t.co/TzaTcpMhRa","@Batmancanseeyou","cultural-icon",
"Netflix Is Bringing Back 'Carmen Sandiego' With Gina Rodriguez #glamour #beauty #cosmetics https://t.co/ukdqUvRmcZ https://t.co/L7snrfRURV","@teylavera","cultural-icon",
"VIDEO: 10 Reasons Where in the World Is Carmen Sandiego? Was the Best Educational TV Show … https://t.co/KPc83DVORa https://t.co/UGwqoGJzhr","@KomijovaElyza","edutainment",
"I tracked Carmen Sandiego to Portland but all I found was her hat. @ Hawthorne Blvd http://t.co/QDZTpW5T2s","@CarlosOGomez","fashion",
"@kchironis I was homeschooled for several years, so edutainment was my bread and butter from age 11-13. Carmen Sandiego, Castle Explorer, the Way Things Work, Oregon and Yukon Trail, Magic Schoolbus, Journey of the Zoombinis. When I was a bit older, I played Escape Velocity for HOURS.","@ButWhatIfNeige","cultural-icon",
"@cavykatie @cypheroftyr Creatures! with the little Norns and Grendels I still have the package and CD around. I cannot pick a favorite, but admit that was definitely a highlight. Especially trying to teach them words. Also: Monkey Island, MYST & Carmen Sandiego I had fond times playing.","@StormyGriffin","edutainment",
"@frysquint @fiddleyoumust now i just want a carmen san diego remake starring harry styles. he has to wear the overcoat and hat to really sell it though.","@liamjackson84","fashion",
"J1 @ccc Hambourg - Thank you K.Nohl & N.Nikodijevic for your nice talk: Where in the World Is Carmen Sandiego? https://t.co/nAdhFDRmyt #33c3 https://t.co/nUniqDUdLE","@v_dagrain","cultural-icon",
"Carmen Sandiego is coming to Netflix and the actress voicing her is perfection https://t.co/fEIX1pidea","@nevinmarlina","cultural-icon",
"VIDEO: 10 Reasons Where in the World Is Carmen Sandiego? Was the Best Educational TV Show … https://t.co/yCGel6oZYZ https://t.co/MNA6gTaH6v","@lelyons3","edutainment",
"🙌🏻Thank you lovebug.As the #CarmenSanDiego of #Periscope✈️,I'm making my rounds this holiday season! 😉#LoveBugNation https://t.co/0MtwAVBOXq","@xoxoLizza","cultural-icon",
"Netflix plans live-action 'Carmen Sandiego' film with Gina Rodriguez https://t.co/KtkDhUOUx1","@ID291214","cultural-icon",
"Stranger Things Star Joins Netflix's New Carmen Sandiego Animated Series - IGN https://t.co/bajxryzG6U https://t.co/8V5Yiw2imQ","@ThisOnline_Co","cultural-icon",
"@Tuffcub @Parrow_ @OdinsonOfAsgard Also if they don’t know they will soon, Netflix are making a series based on it https://t.co/NhYTiWxryQ","@Tuffcub","cultural-icon",
"Netflix is betting on ‘90s kids nostalgia for learning with upcoming lineup https://t.co/JW1utw1G1x https://t.co/QbQxACk35I","@XboxOneNews","cultural-icon",
"@RicaPerrone Chuck Norris always knows the EXACT location of Carmen SanDiego.","@VxPr02","cultural-icon",
"Ang throwback ng Carmen Sandiego ha, nakaka-early 90s! Glad Netflix decided to reboot.","@masculinemarko","cultural-icon",
"How many times have I been compared to Carmen Sandiego whilst wearing my red hat, though?","@Strangeland_Elf","fashion",
"Where in the world is Carmen Sandiego...? Netflix, apparently. (And I know you just sang that in you head as you read it!) https://t.co/Fs6w6nMeop","@OverlordOf_Evil","cultural-icon",
"Remember how we had those Cluefinders, Reader Rabbit and Carmen Sandiego games to learn things while growing up? Where are those games for today's age group?","@LeClairJoshua","edutainment",
"Netflix Casts Gina Rodriguez As Carmen Sandiego In New Movie https://t.co/xqm2VRNAM1","@sarah052794","cultural-icon",
". @HMHCo launches Carmen Sandiego's first iOS app https://t.co/uW4am50xHG #publishing #education https://t.co/6Gl00SStjB","@pubbusiness","cultural-icon",
"As a cartophile, I am so excited for Netflix to make this show! https://t.co/xIjg4zDnFM","@allenlyeh","cultural-icon",
"Yaaaas, baby!!! #CarmenSandiego","@Abimelec_MR","cultural-icon",
"LIVE on #Periscope: Halloween in NYC Where's Waldo & Carmen Sandiego FOUND @fulltimeexplore https://t.co/8Cj5Mc4aOQ","@lisipowers","cultural-icon",
"My nickname at work is Carmen Sandiego. Someone get me a red trench coat, fedora, and the Mona Lisa.","@fennecmedic","fashion",
"Kendrick DNA video with Don Cheadle and Gina Rodriguez voicing Carmen Sandiego in a new netflix series (?!) is giving me life this afternoon","@megan_styleGF","cultural-icon",
"Sitting on the bus thinking does that woman know she is dressed like #carmensandiego? Is this a glorious coincidence? She has to know!","@duffpaleale","travel",
"Where in the world is Carmen Sandiego? Apparently she's at the Latchstring. #DialBackThePerfumeCarmen http://t.co/3ffUKdKS3D","@JenniferPurdue","cultural-icon",
"This hat is her signature now lol she ended Carmen Sandiego","@badgalmunaaa","fashion",
"Carmen Sandiego premieres on Netflix next month. #Hollywood #tvshow #tvseries https://t.co/Ko26x1DJEu","@MovieHatch","cultural-icon",
"Safe flight Carmen San Diego 😂😊","@raphieeeee","travel",
"@dylanishoule @ChristianDrake I was more so referencing ""where in the world is carmen sandiego"" but I'm all about the street cars","@47colin","cultural-icon",
"My niece is wearing a hat and looks like Carmen Sandiego and we're all dying.","@comeroundfullO","fashion","x"
"Netflix to Reboot 'Carmen Sandiego' https://t.co/d1XbSQ0TMh","@ShopGentlemen","cultural-icon",
"Congrats to @HereIsGina for taking a step forward for #LatinosInEntertainment as she talks about developing a Carmen Sandiego series with @Netflix (via @IndieWire) https://t.co/uvwyQGUfkN https://t.co/JGn8QgFySH","@CTFDN","cultural-icon",
"Who in the hell is Sarah Spain? Sounds like a character in ""Where in the World is Carmen Sandiego""...","@ErieSteel","cultural-icon",
"Netflix finds 'Carmen Sandiego' for its latest reboot https://t.co/eFBa7Cf1W2","@GadgetMondo","cultural-icon",
"Netflix is betting on ‘90s kids nostalgia for learning with upcoming lineup https://t.co/O9nKDC25t5 via Julia Alexander https://t.co/ZcS85LJumH","@techviagoogle","cultural-icon",
"Wonder if @HereIsGina knows how many Latinas are going to be Carmen Sandiego for Halloween now...","@angiejaime","fashion",
"Netflix is Developing a New CARMEN SANDIEGO Animated Series! https://t.co/ZZwmnApric #TDoug https://t.co/D1WSVA7Nsm","@TDougNews","cultural-icon",
"“World’s greatest thief” Carmen Sandiego wouldn’t wear a bright red coat. #IfCartoonsWereLogical","@jaredshroyer","cultural-icon",
"@SeeinHinessight ""I don't need feminism because I actually found Carmen San Diego.""","@SeeinHinessight","cultural-icon",
"WHERE IN THE WORLD IS CARMEN SANDIEGO Board Game VTG Mystery Geography 90s https://t.co/Tg2NRJF8Xm https://t.co/PkwpXDyLVP","@CarretMarilyn","cultural-icon",
"I love Geography. I also love Waldo, Carmen San Diego and Duck Tales.","@mahoganybasher","cultural-icon",
"Seeing as Carmen SanDiego was last nights costume, today I'm a Fashion Emergency. Hideous top, vest, and leg warmers. Oh yeah.","@LoveJanineMimi","fashion",
"NO F-ING WAY!!! They are bringing back Carmen Sandiego! I'm loving these reboots of my childhood favorites!! (Magic School Bus, etc.) https://t.co/frOnJ7PgZL","@Kindnesskru","cultural-icon",
"Happy Halloween from Carmen Sandiego! #halloween #carmensandiego #halloweencostume #90shalloween https://t.co/PySjJNDKwX","@stitchyfox","fashion",
"just tryna be Carmen Sandiego, ya know? ✈️ http://t.co/HNEZ8whK4A","@cmulcahy21","travel",
"@SeeMomClick A6 my kids love skylanders and carmen Sandiego #FiOSPhilly","@gizmordj","cultural-icon",
"I need a red trench coat in my life #carmensandiego","@tashamelina","fashion",
"@samsheffer Did you see this @BuzzFeed article with your iconic Reddit pic of Carmen Sandiego? http://t.co/q1WFELX3xE","@SamanthaRMason","cultural-icon",
"Netflix finds 'Carmen Sandiego' for its latest reboot https://t.co/X9rGw1t3CE https://t.co/oTvUqYfnue","@ishubham18","cultural-icon",
"THE LOOT THE WARR-ANT --- Gina Rodriguez To Star As Carmen Sandiego In Netflix Live-Action Feature https://t.co/vRg6k91ubb via @deadline","@ThtsWhatSheRead","cultural-icon",
"@WrecklessLove Have you gotten to his Carmen Sandiego outfit yet?","@somuchwhatever","fashion",
"@BrittanyFurlan “@BrittanyFurlan: I'd best describe my style as Carmen Sandiego with a heroin addiction.” That's exactly what my mirror looks like","@melancholiacv","fashion",
"Lucy looking like an old Hollywood cross between Carmen Sandiego and Peggy Carter is precious. #Timeless Props to the costume department. @NBCTimeless","@xiratania","fashion","x"
"Playing Where in the World is Carmen Sandiego & reliving my childhood. My geography knowledge is all from this game. http://t.co/RD4O4C3KlQ","@chalkhands","cultural-icon",
"Gina Rodriguez To Star As Carmen Sandiego In Netflix Live-Action Feature https://t.co/qufPqGin0c","@GamerLatino","cultural-icon",
"@greekemmy @LAMcL7 When it's criminal to tell the truth you get to be a cool anti-hero like Robin Hood or Carmen Sandiego. hehehe.","@ChateauRuby","inspiration",
"@Technophobia @pikestaff okay but think about it Carmen Sandiego/Dack Fayden buddy cartoon with similar music inspiration","@Rilgon","cultural-icon",
"Gina Rodriguez to Voice Carmen Sandiego in New Animated Netflix Series https://t.co/3nzzZlg67y https://t.co/f7USGQQQ54","@Rita10182","cultural-icon",
"Was listening to the Carmen Sandiego theme song, and I can't help but wonder why she was such a cool character. Other than her hella fashion","@BlackCatula","cultural-icon",
"Netflix May Have Found Their ‘Carmen Sandiego’ And She Comes With Golden Globe Credentials https://t.co/BtAen4EoFx https://t.co/qjcpq6Vsln","@MoviesWrld","cultural-icon",
"Carmen Sandiego is back to her old tricks on iOS: Well she sneaks around the world, from your iPh... https://t.co/z2r2CrtGaY #socialmedia","@GizmoFarm","cultural-icon",
"Was looking up Carmen Sandiego on Wikipedia to make sure I spelled it right, and discovered Netflix is supposedly making an animated show for 2019. Ahhh!!!!! Oh god, can it be 2019 now? I want to seeeee it! #Nerd","@darlingroland","cultural-icon",
"Gina Rodriguez donning red fedora and trench coat of Carmen Sandiego ☄ ⛱ $v Mashable〽 https://t.co/LYIDHYqHkN","@vrai777","cultural-icon",
"@65thvictor @rolistespod I was dressed as a Red Mage for Otakon this year. Now, I was fine with being mistaken for Alucard or Carmen SanDiego. It was an amateur costume. But Puss in Boots? Seriously?","@Shenorai","fashion",
"Deep thoughts.. Im 32 and still dont use algebra. Tetris has taught me how to pack trucks for events more than any class I took in 12 years of school. I still dont know where the fuc* Carmen San Diego is hiding","@D_rocky_sparks","cultural-icon",
"@andylassner, So is it ""Andy the Adventurous Jew"" or ""Average Andy?"" I think Andy the Adventurous Jew could give Carmen Sandiego and Dora the Explorer a run for their money! @RockapellaMusic could totally do your theme music!!!!!! I think we're on to something here.","@admccrow","travel",
"Carmen Sandiego, the world's most iconic Latina super villain, is back! #Travel #CarmenSandiego FUSION: https://t.co/T9PDaZtIOx","@GriotsRepublic","inspiration",
"Now the game show Where in the world is Carmen San Diego had a unique theme acupella style performed brilliantly by @RockapellaMusic","@Thibodeaux38","cultural-icon",
"Harry Styles is a real name?? I thought it was some sort of prank name or Carmen Sandiego villain. #shocking","@TheWholeTea","cultural-icon",
