"text","handle","category","star_tweet"
"We found each other!!!!!! #carmensandiego #waldo #AmazingLasVegasComicCon #cosplay #comiccon #ALVCC #bffs http://t.co/ATBKs0oX3K","@abbybrechner","cultural-icon",
"@VK_HM @yearofthecube I mean, it worked for Carmen Sandiego. Compare: https://t.co/OZsU8uL2Kr","@ianrw","cultural-icon",
"@NBCTimeless @abigailspencer @lucianamangas @JLJMcCarron @TheTimelessRoom Last time I got wrapped up in #history my trio (sons) of Army men, got me into “The Lady in Red” #CarmenSandiego (PBS, 1991) #Clockblockers Now, we watch #Timeless Lucy needs THAT fedora! SLR🍀🐰 https://t.co/kYGFzUhpKr","@leprchaunrabbit","cultural-icon",
"Lady Science no. 45 is out now! In this issue: ✅ @jessjoycej on Emily Warren Roebling's key role in the Brooklyn Bridge ✅ @EmmaLouiseBacke on the promise and failure of the cyberfeminist vision ✅ @JoyMLRankin on Carmen Sandiego's least known creator https://t.co/xNuklBDrgU","@ladyxscience","role-model",
"Netflix Takes Aim At Hollywood With Gina Rodriguez's 'Carmen Sandiego' Movie via @forbes by @ScottMendelson https://t.co/e9H8YkykN7 #CarmenSandiego #GinaRodriguez #Netflix","@ScottMendelson","cultural-icon",
"VIDEO: 10 Reasons Where in the World Is Carmen Sandiego? Was the Best Educational TV Show … https://t.co/KgaW59COU0 https://t.co/OliIAeFrwZ","@helenckearny","edutainment",
"@mental_floss Am I the only one who remembers the Carmen Sandiego choose your own adventure books? Also the board game was 👌👌","@snarkanism","cultural-icon",
"@RaeHughart A1: anything fun, inspiring or meaningful-great field trips, learning games like Carmen Sandiego, reading some great sci-fi #MasteryChat","@seanmarnold","edutainment",
"#Travel First time I heard about #Reykjavík was when I was a little brat playing ""Where In The World Is Carmen Sandiego?"" :)","@bluebay700","edutainment",
"@koginthemachine @KmoneysKorner ⚡️ “Netflix greenlights a Carmen Sandiego series” https://t.co/LCHzZVg2rk","@AxelCutlass","cultural-icon",
"""Gina Rodriguez, ‘Stranger Things’ actor, to lend voice to Netflix’s ‘Carmen Sandiego’"" by Christine Persaud via Digital Trends …","@HAAL","cultural-icon",
"Netflix orders animated Carmen Sandiego series: Netflix has ordered an animated Carmen Sandiego series, io9… https://t.co/ggBIsVBE8K https://t.co/68LjFviAs9","@MagicBitcoinNow","cultural-icon",
"Netflix plans live-action 'Carmen Sandiego' film with Gina Rodriguez https://t.co/7Cm8jGNaVh","@themash","cultural-icon",
"hah the he'll turn into Carmen Sandiego and start globe hopping I'm sure https://t.co/GVHUcUdJvU https://t.co/yYFC6ET3cB","@WhittWh","travel",
"@jiggsy I bet @Eve_Beauregard would make a great Carmen Sandiego cosplay.","@Strider_3029","fashion",
"Netflix was looking for an antique jewellery shop, has on knee and elbow pads, and is making a live-action Carmen Sandiego movie: https://t.co/bQIyEQj21J https://t.co/vCPdLqORfw","@nagcoza","cultural-icon",
"Netflix finds 'Carmen Sandiego' for its latest reboot https://t.co/Z0LaFyzAYr https://t.co/vev5H46QyW","@willwphoto","cultural-icon",
"Carmen Sandiego: Gina Rodriguez to Voice the Role for Netflix https://t.co/vb4RVA0NCW https://t.co/3lc5prHB5H","@just_marve","cultural-icon",
"Gina Rodriguez Set to Steal Our Hearts as Carmen Sandiego in Netflix Live-Action Movie https://t.co/5rrnb9PfBx","@RealMediaMedusa","cultural-icon",
"Those saucy Agent Carter promos always make me think for a moment they made a Carmen Sandiego show. #redhat #jauntyangle #whereintheworld","@ClockworkROSE","fashion",
"Netflix is making a Carmen Sandiego movie with Gina Rodriguez - CNET https://t.co/HXfGnFqPsD https://t.co/WDQ6Z2to1B","@scienceLeMagazi","cultural-icon",
"I was already in my 20s when I discovered Carmen Sandiego, and yet the geology nerd in me loved the show. And I enjoyed the strong female characters. Glad to see it coming back! Not Your Shero: Carmen Sandiego and the importance of feminism in edutainment https://t.co/Y0g3IPT61d https://t.co/MUfv1Y8iqb","@S_R_P_S","edutainment",
"@SarahLikesPink @PushinUpRoses Are you reviewing a Tex Murphy game? Yes. If not, yes! Also acceptable, an oversized sun hat with extra-wide brim like Carmen Sandiego.","@Simon_Ashtear","fashion",
"‘Carmen Sandiego’ Series Greenlit at #Netflix with Gina Rodriguez https://t.co/wi4y2defAO","@The_News_DIVA","cultural-icon",
"@RutledgeWood def a ""where in the world is Carmen sandiego "" vibe....cute little gumshoe","@lauriemacp","cultural-icon",
"#GuyStuff Children of the '90s Rejoice, For Carmen Sandiego Is Getting Her Own Animated Netflix… https://t.co/KZPQECynxm #DerangedRadio https://t.co/HqDeyt4v8a","@DerangedRadio","cultural-icon",
"@VanessaHudgens You were totally rockin' a Carmen Sandiego vibe on @DANCEonFOX last night. Super cute! All you needed was a hat! https://t.co/hGWQBzHQZK","@DevHamilton6","fashion","x"
"@cocob455 @The90sLife I liked Doug, & Ren & Stimpy. Salute your shorts was eh. I was a sucker for Hidden Temple. Usually came on right after Carmen Sandiego on public tv.","@perplyone3","cultural-icon",
"Remember: “Where in the World is Carmen Sandiego”? Any guess where Ahmet is 🗺? 🇹🇷 ⛴ ➡️? #vacationmode #travel https://t.co/8I7R7VTShv","@aaksoy87","travel",
"See, when I was a young child. I wasn't allowed to watch regular television because I was bad and failing in school. My parents made me watch PBS and I hated it at 1st but eventually my favorite tv shows became #WishBone and Where In The World Is Carmen Sandiego. I learned early.","@DMoNeYGoOnFaCe","cultural-icon",
"@ElisaInTime Netflix is making a live action Carmen Sandiego movie.","@SheSkeptical","cultural-icon",
"Thank you @qubo for #CarmenSanDiego I don't care that I'm 30, I still love this cartoon 🙋😁","@belinda_tbh","cultural-icon",
"Netflix is Bringing Back 'Carmen Sandiego' with Gina Rodriguez Playing the Lead https://t.co/b9OKfpyJXc #beauty #shopping #makeup https://t.co/kX7QHnJnUd","@dorothygburwell","cultural-icon",
"@pentilyet Guys if you wanna hunt this character design down just play any Carmen Sandiego game","@TeddyArgentum","cultural-icon",
"I need a girlfriend only so she can be Carmen Sandiego while I'm where's Waldo for Halloween.","@EricAldstadt","fashion",
"More than just a trendy #Halloween costume--this game taught me all i know about geography #carmenSanDiego https://t.co/a1MnTXLQw9","@WeaponsHotApp","fashion",
"Where on Earth is Carmen Sandiego? Gianmarco Passerini #GЖP #strangerthings #mixcolors #kiss #nightmare #carmensandiego #raimbow #selfie #winteriscoming #intellectual #instacolors #art… https://t.co/v433zOEcMQ","@PasseriniDesign","cultural-icon",
"vesperia gave me my murderboy, berseria gave me six lawless heathens, carmen sandiego was my childhood hero, etc etc","@starsinmist","cultural-icon",
"Gina Rodriguez To Star As ‘Carmen Sandiego’ In Netflix Live-Action https://t.co/Lpga3nSynT via @Upcoming100","@JcmHoldings","cultural-icon",
"Interesting infographic on gamifying the classroom. Pretty nostalgic! Carmen Sandiego anyone? http://t.co/6SGzTpRpEd #edtech","@TFAEdTech","cultural-icon",
"@eightyxseven @Z_A_Kline they should bring back Carmen Sandiego. Does everyone want their kids to suck at geography??","@notafullcolon","cultural-icon",
"Sometimes I fall off the grid and I feel like Carmen Sandiego.","@JBReclaim","travel",
"Carmen Sandiego Is Coming to Netflix and Will Have Jane the Virgin's Voice https://t.co/GSOZDUprqW #luxury #lifestyle #news https://t.co/t7y9pFwhKb","@dalymode","cultural-icon",
"Spent the night with Roz going on adventures for cookie dough and getting sluprees instead and playing a Carmen San Diego board game. I'm gonna miss this.","@ChelseaZielin","cultural-icon",
"Gina Rodriguez Starring in Netflix's Live-Action 'Carmen Sandiego' Movie https://t.co/mYrVSHHT11","@hot995","cultural-icon",
"https://t.co/U0pNCd2exR #unsigned #talent #forum #JaneTheVirgin star Gina Rodriguez and #StrangerThings star Fin… https://t.co/dSJzsiJilq","@goldenbeatz11","cultural-icon",
"Animated 'Carmen Sandiego' gets first poster, January release date https://t.co/CqAWcj5PZn https://t.co/kNsAjzAyTd","@TidingsThe","cultural-icon",
"Carmen Sandiego Is Officially Happening With Gina Rodriguez at Netflix https://t.co/ZfIuY15KCJ https://t.co/ttjlhOJlU4","@CNNcelebnews","cultural-icon",
"TheVerge: Netflix orders animated Carmen Sandiego series https://t.co/JH6MAKktsN","@boreronews","cultural-icon",
"@AshtonNButler next Halloween you got Carmen San Diego on lock tho 🔑👌","@StuveGrafik","fashion",
"That's why they call me Carmen San Diego! The Wanderlust Gene: Why Some People Are Born To Travel http://t.co/CHcFYHMNpz via @EliteDaily","@JezziJaymes","travel","x"
".@HereIsGina is extending her part of Carmen Sandiego! In addition to lending her voice to the animated series, she will also star in @netflix’s live-action feature of “Carmen Sandiego.” https://t.co/YTBkpRwPOc https://t.co/zFx2acFYPm","@WomenaHollywood","cultural-icon",
"Lady Gaga Swiped Her Hat And Trench From Carmen Sandiego’s Closet https://t.co/sGg7mbYHcE #MTVNews MTV https://t.co/ZebpPUAIYm","@IamFortune051","fashion",
"Netflix picks up a second Carmen Sandiego project, with Gina Rodriguez to star: https://t.co/26wHu8HLL8","@DenofGeekUS","cultural-icon",
"VIDEO: 10 Reasons Where in the World Is Carmen Sandiego? Was the Best Educational TV Show Ever https://t.co/L3fH95SlRu","@DemetriceNetzel","edutainment",
"@KLeighB47 I think you found your 2014 Halloween costume. #carmensandiego","@MikeAmmo","fashion",
"@immaculate__Jay Not Carmen SanDiego lol","@ThaRecklessKing","cultural-icon",
"It's official. Danny Mahealani is vacationing with Ethan, Waldo, and Carmen Sandiego. @MTVteenwolf @KeahuKahuanui @Charlie_Carver","@brkn2gthr","cultural-icon",
"Black cards, black cars. All black everything.

When she made Carmen Sandiego's signature look a little mo… http://t.co/pO5lbqmLSU","@nigerian_herald","travel",
"Jane The Virgin's Gina Rodriguez Will Help Revive Carmen Sandiego For Netflix https://t.co/jO66bNg8rc","@JulieDeane1","cultural-icon",
"@splunge2000 we just need an outfit for you, I see a mix of Carmen San Diego and Deckard.","@GVAJr77","fashion",
"@mcmansionhell I believe it is ""carmen san diego"" style...","@LynnApgar","fashion",
"Gina Rodriguez donning red fedora and trench coat of Carmen Sandiego https://t.co/Zi2I1kGVqT https://t.co/C7nV6KlWgP","@Ice_N_berg","cultural-icon",
"Yesss!!! Did anyone play the PC game way back when? I loved it. I love Gina Rodriguez too. Anyone watch Jane the... https://t.co/XFDcezkns2","@magic1021","cultural-icon",
"Netflix Could Be Bringing Carmen Sandiego Back https://t.co/Yn5yVCkd5q [via io9]","@darylelockhart","cultural-icon",
"I am 100% over this weird obsession with saying technology is making us dumber. The only reason I have ANY idea who Yuri Gagarin is is because of a video game. (Where In Time Is Carmen Sandiego, which remains a national treasure.)","@evdoyle","cultural-icon",
"The #NHLJets beating the Ducks at home will be like a kid winning the bonus round of Where in the World is Carmen Sandiego. Still optimistic","@Cshifty","cultural-icon",
"SNL' Tries Some Edutainment With 'Where In The World Is Kellyanne Conway?' https://t.co/zct8ykf0DZ #Digg","@RealTimeHack","cultural-icon",
"""Where in the world is Carmen Sandiego?"" #ICgeography","@Grade5Explorers","cultural-icon",
"Where in the World Is Carmen Sandiego? Becoming a Secret Travel Agent https://t.co/jGRz6uKBwB","@newsycombinator","travel",
"I've always wondered where Carmen San Diego went on vacation","@JosephCrabb","cultural-icon",
"@iSmashFizzle Carmen Sandiego is the bad guy?!?!?!?","@Kathy_Posey","cultural-icon",
"@emilybuckshot So many: Carmen Sandiego made me want to see the world and all the MECC games like Oregon and Amazon Trails made me want to go on epic adventures (as did the classic adventure games where exploring turned into an actual story.)","@nyhcmaven84","cultural-icon",
"@SkullMutant You truly are an international woman of mystery. You need a trench coat and a Carmen San Diego hat.","@High_INT_No_WIS","role-model",
"Gina Rodriguez to Star in Live-Action 'Carmen Sandiego' Feature for Netflix - Hollywood Reporter https://t.co/aEiiLjr7U4","@TribuneMAG","cultural-icon",
"#ToyAndGameGeography ""Where In The World Is Carmen Sandiego?"" No changes ncessary!. Anywhere you want her to be ;-)","@OilegorAerep","cultural-icon",
"Picturing @dorothynotgale in a Carmen Sandiego hat https://t.co/zBGolOFuOA","@ActuallyAmelia","fashion",
"Proud mom moment from our drive to school today: Milo asked, “Can we please listen to Carmen San Diego again?” My heart is full 😍 #momlife #whereintheworldiscarmensandiego","@GlassotOutside","cultural-icon",
"#tbt Halloween 2012, one of my favorite costumes to date. Carmen SanDiego. https://t.co/B9TjOcVakn","@MandiSiegel","fashion",
"@KayVictoriaC @prickism I had 5 1/4 when we got our first Apple II. Played Carmen San Diego on it.","@hks_is_me","cultural-icon",
"WHERE IN THE WORLD IS CARMEN SANDIEGO?","@JULIANYURI","cultural-icon",
"@pentilyet @Chloe_and_Kirea You mean we could have had cowgirl Carmen Sandiego?","@MrJoestarsBro","cultural-icon",
"https://t.co/mnsak9VWgp Netflix Is Reportedly Reviving Carmen Sandiego With Gina Rodriguez https://t.co/4IPVDwWgjJ #jamjamtv https://t.co/DZxUJkXkfX","@jamjamtv","cultural-icon",
"LRT: Gina Rodriguez as Carmen Sandiego, how did you reach into my brain and make my dreams a reality","@shamblebot","cultural-icon",
"New post on my blog: Netflix is bringing back ‘Carmen Sandiego,’ and it’s going to star Gina Rodriguez https://t.co/Uaa9cP7pyC","@toptechin2017","cultural-icon",
"☎️ me Vinny. on Instagram: “Carmen Sandiego visits the Spring Preserve | Tap photo for outfit... https://t.co/GrIgFEw3zQ","@BernieDexter","fashion",
"‘Carmen Sandiego’ Toon Series Starring Gina Rodriguez Bound For Netflix https://t.co/rJIWrlR3J5 #TDoug https://t.co/Q3KZvcs3IK","@TDougNews","cultural-icon",
"Netflix Takes Aim At Hollywood With Gina Rodriguez's 'Carmen Sandiego' - Forbes https://t.co/qTI8gBOnJ3","@CelebrGossipnew","cultural-icon",
". @netflix has reportedly ordered 20 episodes of a ""Where in The World Is Carmen Sandiego"" reboot: https://t.co/Rte9FCtWvm https://t.co/NLGHIO2x1W","@end1065","cultural-icon",
"Trip down memory lane... Carmen San Diego, Math Blaster! #iu13stc17","@mr_middle_2","edutainment",
"Carmen Sandiego and Waldo Costume for Couples | https://t.co/ZmP47e6wQj #CarmenSandigo&WaldoCostume","@snehapawar7261","cultural-icon",
"Where on earth is Eric Lamela??? Eric La-me-la #carmenSanDiego #coys","@SkipperVenn","cultural-icon",
"@PushinUpRoses I always shipped Carmen Sandiego with the Red Hat Linux guy: http://t.co/4GVVB0Cy0J","@Campster","cultural-icon",
"Where is the world is Agent Carter?? #agentcarter ##cosplay #carmensandiego #theultimates… https://t.co/p3lWZhma6L https://t.co/iKCuIZ5mn0","@withoutastitch","fashion",
"Do it, Rockapella: Netflix is Making a New 'Carmen Sandiego' Show - Geek: Geek Do it, Rockapella:… https://t.co/wJYNb0sx2y #geek #nerd #dork","@geeksinglesdate","cultural-icon",
"The hero we need: Carmen Sandiego https://t.co/F1snsFktab","@dav_mcg","role-model","x"
"Netflix Could Be Bringing Carmen Sandiego Back https://t.co/aCQHacA9V3","@Arilyna89","cultural-icon",
"Do it, Rockapella: Netflix is Making a New ‘Carmen Sandiego’ Show https://t.co/nuWVL8AzSG","@eltonbowie","cultural-icon",
"Gina Rodriguez to star as Carmen Sandiego in Netflix live-action feature https://t.co/14qH5su1vb","@Phil_Lewis_","cultural-icon",
"Lol he posted that Carmen sandiego pic on FB lolol can't wait for the ""what's up with that hat?"" Comments","@chunkeymonkey81","fashion",
"Someone should get Kanako to cosplay as Carmen Sandiego","@CDGSU","fashion",
"@Arepa_N_Ceviche Play you in Carmen Sandiego right now!! “@Arepa_N_Ceviche: I'm poppin in geography and history”","@SLiiiMe","cultural-icon",
"I’m passing through a town called Brenda Arizona which is like if Carmen San Diego sucked","@yusefroach","cultural-icon",
"@gooeyblob Carmen Sandiego is in town?","@Sporkicide","cultural-icon",
"Already have my next Halloween costume planned out. Carmen Sandiego. My date&39;ll go as Where&39;s Wally. Always wanted to do that","@jeannieveford","fashion",
"Gina Rodriguez to Voice Carmen Sandiego in New Animated Netflix Series https://t.co/V80IvtDdCF https://t.co/l8VnFcIsIU","@feraliaga","cultural-icon",
"Netflix is betting on ‘90s kids nostalgia for learning with upcoming lineup https://t.co/ULmrUTXdiU","@talkdaybright","edutainment",
"Chuck Norris always knows the EXACT location of Carmen SanDiego.","@HarveyPierce8","cultural-icon",
"Netflix is rebooting Carmen Sandiego as an animated kids’ series https://t.co/tNL64wUB4I","@passustheaux","cultural-icon",
"That pic of me in the yellow hat reminded @wraithdrmr of Carmen Sandiego, so this happened. #photoshopcosplay http://t.co/Rafwjutg2I","@ladygelfling","fashion",
"Netflix Is Reportedly Reviving Carmen Sandiego With Gina Rodriguez https://t.co/GDXGT1PSjL #celebrity #gossip","@CelebNewsFast","cultural-icon",
"@LaceyEvansWWE @WWENXT And a Carmen Sandiego hat.","@confusedraptor","fashion",
"Gina Rodriguez-Led ‘Carmen Sandiego’ Animated Series Gets Premiere Date at Netflix #CarmenSandiego https://t.co/smbqzCvYIK","@TheTraceC","cultural-icon",
"Carmen Sandiego Is Officially Happening With Gina Rodriguez at Netflix https://t.co/hQHiasC8RR","@Global_00","cultural-icon",
"You know you're working retail on Halloween when you have to ask Where's Waldo and Carmen Sandiego if they need help finding anything.","@poodlestar","fashion",
"Can anyone ever say on their first date they wore a Carmen Sandiego get up? Tonight should be interesting.","@ginacolorado5","fashion",
"Gemini Venus; I wanted to be a spy so I could travel the world like Carmen Sandiego and wear different disguises https://t.co/ibLoWsP6Lz","@PrettyYoungTT","fashion",
"Carmen Sandiego #whereintheworld #mua #worldclass #mensstyle #fashion #makeuplooks #macboy #cosmetics… http://t.co/xL18KRl2iE","@henkster91","fashion",
"Get a first look at Netflix’s Carmen Sandiego animated series https://t.co/1aoONJCtEu https://t.co/Cyhd5323pI","@lindsaywalms","cultural-icon",
"@lightlybow Journey, fallout, fable, overcooked, where in time is Carmen San Diego","@BoBo_Of_ID","cultural-icon",
"My new goal in life is to star in a live action ""where in the world is Carmen San Diego?"" movie. #dreams #aspirations","@agedwhitewhine","role-model",
"Hi please vote on this: Should my boyfriend and i be where’s waldo and carmen san diego 4 halloween","@nashosaurus_rex","cultural-icon",
"I got a new phone and apparently it comes with new emojis. I now have 🕵️‍♂️#RaymondReddington and 🕵️‍♀️#CarmenSanDiego. Thank you, #Samsung. #TheBlacklist #JamesSpader #DoItRockapella","@LynnGleason815","cultural-icon",
"I spoke in this over a year ago. Now the wait us almost over. Gina Rodriguez is Carmen San Diego.","@JPSimmons","cultural-icon",
"Sounds Like Netflix Is Bringing Back 'Where In The World Is Carmen Sandiego?' https://t.co/bY4amx4NsF https://t.co/nnlszl7y3U","@TheRichardDoyle","cultural-icon",
"@KevinWriteStuff Plus there's learning. Edu-tainmenu. Sliders meets Quantum Leap meets Where is Carmen SanDiego.","@KevinWriteStuff","edutainment",
"Gina Rodriguez donning red fedora and trench coat of Carmen Sandiego https://t.co/d3ypKHPSll #Netflix https://t.co/GIMkJgwF2s","@appmevee","cultural-icon",
"@Amuly21 the Peggy shirt I have is a profile of her in the red hat. I wore it a few weeks ago and someone asked if it was Carmen San Diego","@codenamezinc","fashion",
"Netflix's live-action Carmen Sandiego movie will star Gina Rodriguez https://t.co/x5BvkNUfq3","@WomanSBuzz","cultural-icon",
"I'm at this show ... AKA captain hat low looking like Carmen Sandiego.","@DidIASQ","fashion",
"It's the Carmen Sandiego costume from SnapChat. #TeachersSeries","@ThatAlbertLimon","fashion",
"NETFLIX IS GOING TO MAKE A CARMEN SANDIEGO SERIES","@GuardianDany","cultural-icon",
"Gina Rodriguez to star in Netflix’s Carmen Sandiego movie https://t.co/NVIzmNcKjT","@webgonewild","cultural-icon",
"Netflix to Reboot 'Carmen Sandiego' https://t.co/HGV7Oyp5vG #style #coelcast","@CoelCast","cultural-icon",
"Where in the World is Carmen Sandiego?? https://t.co/lsJ1mkuQWt #carmensanediego #cosplay #costumes #hats","@withoutastitch","fashion",
"Netflix's 'Carmen Sandiego' debuts on January 19th, 2019 https://t.co/9yKt83GDvf via @Yahoo","@CaulCmc49ers84","cultural-icon",
"Gina Rodriguez Voicing Carmen Sandiego in Netflix Show https://t.co/tvsn14Ksos https://t.co/JNUn9dOGdE","@Multi_News0","cultural-icon",
"Gina Rodriguez To Star As Carmen Sandiego In Netflix Live-Action Feature https://t.co/IvNjcvNWxG $AIZ #stocks #stockmarket","@StocksPredictr","cultural-icon",
"What's new on Netflix in January 2019 by Phil Nickinson New year, new Netflix. Or the same old awesome Netflix. Whichever way you see it, really. It's time to get a little uncomfortable. Maybe it's because you see your childhood staring back at you whe… https://t.co/PJbV2HikC1","@Kuujikai","cultural-icon",
"@NonteStephen Carmen Sandiego media I have consumed: 1) computer games 2) choose your own adventure books 3) board game 4) 3 different tv shows","@NonteStephen","cultural-icon",
"Attention ‘90s Kids: Netflix Is Bringing Back CARMEN SANDIEGO - https://t.co/eQ8fJPasO2 -https://t.co/zb8eyEayWl #cinema","@luizsantiago","cultural-icon",
"Got a great idea from a friend...Where in the USA is Carmen Sandiego for Geography unit.Ideas on how to approach? #tlap #4thchat","@beebepins","cultural-icon",
"@navahw I've been trying to remember Carmen sandiego's name for weeks now. Thank you so much!","@matencerawolf","cultural-icon",
"Chuck Norris always knows the EXACT location of Carmen SanDiego.","@chucknorriskik","cultural-icon",
"Check out @tripstyler’s travels a la Carmen Sandiego & enter to win a luxe prize package valued at more than $2500. http://t.co/boXZIVsgm2","@maliayoshioka","travel",
"What You Learn Finding Carmen Sandiego Without Google's Help | https://t.co/5sDPr70rv1","@cracked","edutainment",
"Netflix’s good castings like Gina Rodriguez as Carmen Sandiego and Kate McKinnon as Ms. Frizzle that make me blame Marvel for Iron Fist.","@paulidin","cultural-icon",
"@ericalindbeck @stephaniesheh @BrinaPalencia You know, with an actual fedora you could probably cosplay as Carmen Sandiego.","@adam_kun","fashion",
"spirit halloween is selling a knockoff carmen sandiego costume im so tempted","@wingsofdiamonds","fashion",
"I was wearing a fly ass hat at a bar and someone asked me if I was Carmen San Diego. 🙌🙌🙌","@samroy23","fashion","x"
"Someone should buy the rights to Carmen sandiego & make a spy/treasure hunter thriller Netflix series. I'd watch it.","@TheAngelKing","cultural-icon",
"Seriously the BEST thread of 2018. No others need apply. Bonus points to anyone who actually had a Commodore 64 to play the game on. (Yes, we exist. We're just old now.) #CarmenSandiego meets ... wait. What the hell is Junior wearing? #TrumpCrimeFamily","@RachelMcGonagi1","cultural-icon",
"@ColliderVideo What 90's Cartoon Could Work More As A Movie ???? Gargoyles Captain Planet Where Is Carmen Sandiego Swat Kats #ColliderMovieTalk","@MarioPR05","cultural-icon",
"@shelbyholliday Next yr for Halloween please be Carmen San Diego.","@CJ_Powell","fashion",
"I don't really understand the fashion trend of girls dressing like Carmen Sandiego from, 'Where in the World is Carmen Sandiego'.","@mashburger","fashion",
"Someone sponsor my travel time in Carmen sandiego","@ShawdieRED","travel",
"@petercoffey @MaureenBug Nope. I remember playing Carmen Sandiego in elementary/middle school in MD (on an Apple II GS). I’m about a decade older than these folks, though.","@DrEMLichtenberg","edutainment",
"Now y'all see why I randomly travel so much, just call me Carmen San Diego #Barz","@kgjuiceman","travel",
"But really, where in the world IS Carmen Sandiego? #latenightthoughts","@KristynSvoboda","cultural-icon",
"I found a copy of the Where on Earth is Carmen Sandiego animated series for $5 at Farm & Fleet earlier tonight. I... http://t.co/dZglG3YH8H","@NekoArc","cultural-icon",
"Netflix is bringing #CarmenSandiego to life and they already have an actress for it. https://t.co/z7BJbenxiK","@CinemaOnline","cultural-icon",
"Video Games are dangerous, thanks to too much Where In the World Is Carmen Sandiego? I steal antiquities and wear red fedoras even though hats look really bad on me.","@Ruby_Stevens","cultural-icon",
"Jane the Virgin” star Gina Rodriguez In Netflix Remake Of Where in the World Is Carmen Sandiego - https://t.co/edhiA5Zwqu","@Youngdynastymag","cultural-icon",
"@BeardsInc All you need to know is if a kid got Africa in the final map round of Carmen Sandiego on PBS, they were screwed. Proof we suck.","@jneas81","cultural-icon",
"@nrose I've just been informed that the dome was stolen, Carmen Sandiego-style, from a local high school.","@nrose","cultural-icon",
"@KatiMichel TY! For you: I pick Carmen Sandiego, fellow world traveler ;)","@RachyMills","travel",
"I thought Halloween being on a Wednesday was gonna hamper a lot of the fun of the holiday, but so far I found both Waldo & Carmen Sandiego on their way to to work this morning and it made me smile!","@ShitMovieFest","fashion",
"@russellcrowe Is this the Aussie version of Dora the Explorer, Where in the World is Carmen Sandiego, or Where's Waldo? 🗺","@KathySchwab77","cultural-icon",
"""To travel is to live.."" | So grateful to share this experience with carmen_sandiego_! We've prayed,… http://t.co/7PXxlMqqT5","@JasmineAlston","travel",
"ever since 98 I've wanted to be carmen sandiego. She's got a pretty cool life. https://t.co/iwAeQUM40G","@chicago_palms","role-model",
