"text","handle","category","star_tweet"
"All I knew how to do on the computer was play Oregon Trail and Where is Carmen SanDiego. This is such a great opportunity for girls. #STEM #coding #girlpower","@kelleyk525","cultural-icon",
"I loooooooOOOOoooved the Carmen Sandiego games as a kid, and Great Chase Through Time shaped my complete infatuation with point-and-click adventure games, but I'm left with an odd question: I wasn't into Carmen at the time, and why *wasn't* I?","@shinyzack","cultural-icon",
"Netflix finds 'Carmen Sandiego' for its latest reboot https://t.co/HYm5Iepqfb","@luzhuangfenghui","cultural-icon",
"@PushinUpRoses Brag about how his edutainment collection is more comprehensive than anyone else's because he managed to snag the WiiWare Carmen Sandiego Adventures in Math games before it was too late.","@LotusPrince","edutainment",
"Netflix is betting on ‘90s kids nostalgia for learning with upcoming lineup https://t.co/tZYcqlbpJf https://t.co/Dk8YiOZFFo","@GamingTday","cultural-icon",
"@HereIsGina is going to be Carmen Sandiego for a live action Netflix movie and I don't know what to do with myself anymore. Perfect. Casting. Hell. Frikken. Yes. https://t.co/YZ4bTmorf9","@MasterTainment","cultural-icon",
"Where in the World Is Carmen Sandiego? (#33c3) https://t.co/r6rEFTjSG0 < how #secure are travel system? You'd be surprised. https://t.co/30pQSpd7Go","@myfear","travel",
"Gina Rodriguez to star in live-action Carmen Sandiego film for Netflix https://t.co/EdBqqZyOIa","@CranberryFiend","cultural-icon",
"New post (Carmen Sandiego found Waldo! This would be a fun couple's Halloween ...) has been published on D ... - https://t.co/xl9gTbNenR https://t.co/5getkxz8fX","@diyhalloweencos","cultural-icon",
"My buddy at work made this for me. Thanks Jimmy!! ✈️🌏💃 #whereshouldigonext?#CarmenSandiego… https://t.co/rCmSetY261","@SundayPancakes","cultural-icon",
"New post from Engadget RSS Feed: ""Netflix's 'Carmen Sandiego' debuts on January 19th, 2019"" https://t.co/G0IXZICL0i","@drunktechguy","cultural-icon",
"@LasVegasLocally @unlv It's the cowboy version of ""where in world is Carmen Sandiego"" being released for the Mega drive and Master System. Sorry, I'm a Sega kid.","@sweetiebird","cultural-icon",
"Driving from Pierre to Bismarck today. Two Dakotan capitals in one day? Carmen Sandiego would be proud. #RunningTo","@thomasmarkz","travel",
"Carmen Sandiego was the entry level drug to Travel shows. #throwback https://t.co/eEK45y3ii2","@astr0mnaut","travel",
"Okie so obviously ppl are stupid while in my alucadd cosplay some guy just asked me if Iam spos to be vampire Carmen sanDiego wtf ppl","@thacrimsonfukr","fashion",
"I travel in style. Like Carmen Sandiego. Or Quinta from the internet. https://t.co/Mjk81daFby","@Mo2119","travel",
"I was right... but where is my pizza? I don't think anyone knows at this point...I hope Carmen Sandiego and Waldo are enjoying their NY style pizza feast.","@LilMarauder","cultural-icon",
"I only used Apple computers in elementary school: Carmen San Diego, Math Blaster, Oregon Trail, etc...","@EAR_JORDAN","edutainment",
"@mimimld Oh snap oh Carmen Sandiego headazz.j/k have a safe flight Miss, you goin to scope from there? https://t.co/CZC5YuAtaK","@Ronin_po","travel",
"""I already have the fedora and coat."" - @HereIsGina #CarmenSandiego https://t.co/Cy0f1uxWtD","@Latina","fashion",
"@iSmashFizzle I think the game devs realized this because Carmen Sandiego: Word Detective was such a tonal shift and I still have nightmares 😂","@MikeVPottery","cultural-icon",
"Carmen Sandiego is a freedom fighter who liberates symbols of mankind's achievements from the international corporate monster ""Acme.""","@JohnWAllie","inspiration",
"Happy Halloween from Belle and Carmen Sandiego. #beautyandthebeast #whereintheworldiscarmensandiego… https://t.co/EeNekMFkMX","@SimonisLauren","fashion",
"But netflix announced a Carmen San Diego movie and I am excited. I loved this show when I was a kid","@Hyuuzu","cultural-icon",
"@SpencerKarter #JaneTheVirgin star #GinaRodriguez will star & produce in a live action #CarmenSandiego movie 4 #Netflix. What's your reaction? https://t.co/Y7aH13eocc","@olderbrother21","cultural-icon",
"Netflix may be reviving Carmen Sandiego with the luminous Gina Rodriguez! Thoughts, gumshoes? https://t.co/eQBCdHEKSF https://t.co/xFbyzm4DBS","@BillyNillesDUH","cultural-icon",
"Stranger Things Star Joins Netflix's Carmen Sandiego Series https://t.co/DPc1E7Htnp","@maths_games","cultural-icon",
"Where in the World Is Carmen Sandiego? Becoming a secret travel agent https://t.co/WAnnYqM7Bt #TravelTech #PNR #Privacy #Security #33c3 https://t.co/qniFCmJaDa","@wballaa","travel",
"Cookie's idea of a disguise is donning a hat that makes her look like Carmen Sandiego. #Empire","@DispatchesFTC","fashion",
"Best couples costume - Where's Waldo & Carmen Sandiego http://t.co/wwwFeIQDgZ","@halloween8929","cultural-icon",
"Sometimes I wake up in the morning & wonder where in the world I am that day & feel like Carmen Sandiego. I should buy a hat.","@nickikb","fashion",
"@Rose_Matafeo I am still shook from learning that Carmen Sandiego is only in NZ","@jonohutchison","edutainment",
"""Netflix plans live-action 'Carmen Sandiego' film with Gina Rodriguez"" https://t.co/l556giSk7A","@nbuoy5","cultural-icon",
"think im gonna be 'carmen sandiego' for Halloween since ppl claim I be MIA and ducked off. https://t.co/LgcGH8st9z","@ADoseOf_Anna","fashion",
"@DustinRossSaid wait wait wait...where in the world is Carmen Sandiego with Lynne Tillman and Rockapella, or the cartoon?","@jaydork24","cultural-icon",
"Where in the world is Carmen San Diego? Have you been there? Why not? #Travel #RefinedRelaxation #Vacation #GirlsTrip #GuysTrip #GradTrip","@RefinedNRelaxed","travel",
"@fuggirls I have a beloved red trench that I once paired with a red felt fedora from a costume shop and BOOM Carmen Sandiego for Halloween! Easy-peasy","@EarthVsSoup","fashion","x"
"@Midday180 The Mendela Effect. Carmen San Diego's outfit being yellow instead of red. The black mark on the back of Pikachu's tail never existing. There's a whole alternate universe. Look it up","@RealBartBennett","cultural-icon",
"Gina Rodriguez Set to Steal Our Hearts as Carmen Sandiego in Netflix Live-Action Movie https://t.co/LozpInWWux","@FilmBah","cultural-icon",
"b. 11 December 1931: RITA MORENO, Puerto Rican actress and singer best known as Sister Peter Marie in 'Oz', Anita in 'West Side Story', Violet in '9 to 5', voicing Carmen in 'Where in the World is Carmen Sandiego?' & as cast member of 'The Electric Company' #birthdays #History https://t.co/Le7QEwhnck","@LittleManKriel","latina",
"Carmen Sandiego requests her hat back, Zac.","@heathercore","fashion",
"Ely is dressed up as this girl. Carmen Sandiego https://t.co/Wv6E0QQanv","@JustinElysandra","fashion",
"@snark_tank @Mare_Bear_Baum seriously how cutting edge is this title? Carmen San Diego is my idol http://t.co/LkVfys8oDC","@sug_knight","inspiration",
"@Quirktastic_co Carmen San Diego there I said it","@TrueHoover","cultural-icon",
"Where in the world is Carmen Sandiego PORRA","@systemofdadal","cultural-icon",
"No one ever stops to ask HOW in the World is Carmen Sandiego. (:","@jdshort","cultural-icon",
"where in the world is carmen sandiego?","@lacey_ell","cultural-icon",
"The only photos I got of my costume. #drunk #carmensandiego #Halloween #halloween2015 https://t.co/cM4McyyBnI","@olgieshmolgie","fashion",
"@lex_1721 I love spirit! So cheap & I've never had an issue with the flight. Also, did you take a plane to visit me in gb? #CarmenSandiego","@StephanieSeidl","travel",
"Netflix Bringing Back ‘Where In The World Is Carmen Sandiego?’ https://t.co/lDekHJBdFV","@ceceonair","cultural-icon",
"@MikeBeas Can they just make a real life Carmen Sandiego show or something.","@ZacCoffman","cultural-icon",
"OMG! I’ve wanted to mysterious “like Carmen Sandiego” since I was a little girl 😂 I don’t think I’ll ever get over wanting to aloof","@SweetRazzberrie","inspiration",
"@BeckuhBeck Let me know when Rocakapella shows up to do the Carmen Sandiego theme song.","@DD1070","cultural-icon",
"@smd @grahamblooming IDGAF about all of the ""Carmen Sandiego"" comments. That hat is badass. Hat(ers) gonna hate #lol","@katerskater23","fashion",
"I hope Edward Snowden and Lindsay Mills go as Where's Waldo and Carmen Sandiego for Halloween. That would be epic.","@abditum","fashion",
"In this week's Street View, one New York transplant describes her style as ""northern-Caribbean-meets Carmen Sandiego."" https://t.co/j6bsebq0Dh","@Chicago_Reader","fashion",
"I feel that this outfit needs a jaunty Brummer red hat. #CarmenSanDiego https://t.co/YcD1dOX74Z","@nex0s","fashion",
"Netflix is making a Carmen Sandiego movie with Gina Rodriguez - CNET https://t.co/iwwEfViEeW","@GadgetMondo","cultural-icon",
"exploring the Dorsoduro neighborhood in Venice, Carmen Sandiego style👣🇮🇹 #travelgram #eurotripping… https://t.co/oweHg4QRh6","@NYCtoEverywhere","travel","x"
"[cue scary music] 🎃 ...anyone know what classic Hallowe'en movie poster this looks like? #nofilter #fog #rhymejaws #trickortreat #homemadecostume #carmensandiego https://t.co/x2q7D9zfsd","@RhymeJaws","cultural-icon",
"Gina Rodriguez to star in Netflix’s live-action ‘Carmen Sandiego’ movie: https://t.co/bcQsVfcdiA via @AOL","@yesnodetroit","cultural-icon",
"Netflix orders animated Carmen Sandiego series https://t.co/zmwKyu4qbr https://t.co/qTlXAVkhnk","@mguastafierro","cultural-icon",
"Netflix is missing out on the opportunity for a great live action Carmen Sandiego series. Still excited though!","@BN2187","cultural-icon",
"Children of the '90s Rejoice, For Carmen Sandiego Is Getting Her Own Animated Netflix… https://t.co/bplSyZK2aC","@Fausto_Enrique","cultural-icon",
"Gina Rodriguez to Star as Carmen Sandiego in Live-Action Movie for Netflix! https://t.co/aF7Mk5fY2E","@NewsiniApp","cultural-icon",
"@LaconicLelex @c_gonzalez Telling list. But yes, I did love Col. Santiago as a kid, and Carmen Sandiego remains a secret role model. ;)","@Quinnae_Moon","inspiration",
"Hari Nef in Gucci AW16 Milan menswear show is SO EXCELLENT, dang, That Carmen Sandiego outfit.","@kohquette","fashion",
"@WWEUniverse @TheDeanAmbrose With as much as they travel, probably a good idea to have a globe with you...or Carmen Sandiego or Waldo.","@ranrtt","cultural-icon",
"Hey Folks! Please Like, Share and Comment on this Post:Netflix is bringing back ‘Carmen Sandiego,’ and it’s going … https://t.co/ayQc7zg7GL","@iashleyrichards","cultural-icon",
"Netflix's Carmen Sandiego Series Gets a Release Date https://t.co/Vgk19QvaF7 https://t.co/jteLFenxWc","@CBR","cultural-icon",
"Carmen San Diego outfit inspo #ootd #badhairdontcare #hat👒 #sfstyle @ Pacific Heights, San… https://t.co/TvuiWzs4jv","@VisitingVntg","fashion",
"Netflix's Carmen Sandiego Series Gets a Release Date https://t.co/YTAWedZy21","@Comics_Un","cultural-icon",
"Where in the World Is Carmen Sandiego? Becoming a Secret Travel Agent https://t.co/9paF7qF57r (https://t.co/sWCGpqpSLK)","@newsyc20","travel",
"I think imma be zero or Carmen San Diego for Halloween","@AdelaCadela","fashion",
"Netflix's 'Carmen Sandiego' debuts on January 19th, 2019 - https://t.co/DMgztWjZNI","@TheNewsGlobe","cultural-icon",
"I'm thinking the costume will be Carmen Sandiego tonight…","@MorellaAddams","fashion","x"
"1. Okay, fair 2. It’s not really Carmen Sandiego if her face isn’t at least partially occluded 100% of the time","@cromage","cultural-icon",
"Throwing it back to my favorite #Halloween costume and my ALL-TIME favorite computer game - Carmen San Diego! #tbt https://t.co/mslXj6RyA1","@eevee_lena","fashion",
"@LudellaHahn WHOA! Ludellah, you look exactly like Agent Carter! You are the best when it comes to Cosplay! Ever considered Carmen Sandiego?","@dangerboy450","fashion",
"-Day 325- Off again ✈️ #AYearInMyLife #PerthBound #CarmenSandiego @ Melbourne Airport - Domestic… https://t.co/dkhNmviklF","@StuckinTransit_","travel",
"PS, where's Morgan at? Is he roaming Carmen San Diego-style? #deadbuzz #twd #TheWalkingDead","@KTCrowley","fashion",
"Netflix Developing Live-Action 'Carmen Sandiego' Movie Starring Gina Rodriguez : https://t.co/Pl0wFf3EsP | #JhootayViewsWithMalick #AskChNisar","@echoserviceinfo","cultural-icon",
"@HereIsGina cast as Carmen SanDiego?! YAS! Loved the show as a kid! She's going to be absolutely perfect! Can't wait to watch on Netflix! 😍🎉","@mrandamiller517","cultural-icon","x"
"Get a first look at Netflix's Carmen Sandiego animated series https://t.co/wlqiAEN5sL","@Mccart386","cultural-icon",
"An N-Pacer inside joke 👑🕵🏾‍♀️ Special thanks to Crow for making the original transparency edit that inspired me to draw her as Carmen Sandiego~ https://t.co/8IXStfOrRa","@CureAdelie","cultural-icon",
"where in the world is carmen sandiego?","@ELWellingtonJA","cultural-icon",
"@stemorgs All the Carmen Sandiego variants are good, nothing but love for my ultimate style icon","@MarthaPShearer","fashion",
"oh my god, I didn't think I could love Carmen Sandiego anymore tham I already do but KEVIN DART helmed the team who redesigned it?!","@DayGloDoe","cultural-icon",
"CARMEN SANDIEGO STA PER TORNARE GRAZIE A NETFLIX https://t.co/zyEsrGbQsi","@Sothe_Mizuno","cultural-icon",
"A unique crossover costume idea for couples: dress up as Carmen San Diego & Waldo! Full guides here: http://t.co/NAWZs3uyAe","@costumeplaybook","fashion",
"""Use Machine Learning to Find Waldo"" (https://t.co/Aa7YRc30ck) JK--Why don't you find Carmen Sandiego & Amelia Earhart while you're at it?","@jameskobielus","cultural-icon",
"[On a date] Her: I like a man who has travelled the world. Me: *trying to impress* I know where Carmen Sandiego is.","@kwkorpi","travel",
"Netflix plans live-action 'Carmen Sandiego' film with Gina Rodriguez https://t.co/VfIAoig3Gl","@k3shtk4r","cultural-icon",
"#FoundInDorasBackpack a locket with pictures of Waldo and Carmen Sandiego, two travelers that paved the way for explorers everywhere.","@artsyfilmtype","travel",
"Did some shopping for Halloween stuff after work & I am pretty damn excited. I got some good stuff. Newest costume idea: Carmen Sandiego.","@smackalalala","fashion",
"I found Carmen San Diego in Santa Monica. She updated her coat color but didn't foul me.… https://t.co/MvqnP43uJv","@DominicDDaniel","cultural-icon",
"@EarthPix I learned about them from Carmen Sandiego","@wild_ste","edutainment",
"Carmen Sandiego got me ahead of my class w/ geography + history, I’m so hyped! https://t.co/XWBo0gPNVr","@altered_alice","cultural-icon",
"Carmen Sandiego and Waldo grab lunch #cosplay #cvg2018 #instagrammer #whereswaldo #whereintheworldiscarmensandiego #couplescostume @ Sheraton Bloomington Hotel https://t.co/1MHo13FnlG","@GoMidWestYWoman","cultural-icon",
"Greenlit: Gina Rodriguez Will Explore the World as Live-Action ‘Carmen Sandiego’ + More https://t.co/YlppYksW9o https://t.co/OD9E9NZXY0","@UpNewsMedia","travel",
"Chuck Norris always knows the EXACT location of Carmen SanDiego. #ChuckNorris https://t.co/BWC9iWeDeZ","@aur_bataye","cultural-icon",
"Gina Rodriguez To Play Carmen Sandiego In Live-Action Netflix Film https://t.co/Bd7vqA88iO https://t.co/x1jYgiomfO","@LAdad18","cultural-icon",
"New hat got me feeling like Carmen sandiego http://t.co/zxqmVKtlBA","@Lexnosex_","fashion",
"Dreamin' of adventures. Where to, gumshoe? #carmensandiego https://t.co/Ltttj46zgi","@DonniOnTheGo","travel","x"
"Netflix Making Live-Action 'Carmen Sandiego' Movie Starring Gina Rodriguez As Globetrotting Villain https://t.co/IhHWJF9Vr8","@Guyism","cultural-icon",
"Looking for good PC games for Emmy -pref learning ones. I used to like Carmen Sandiego & Operation Neptune & Treasure Cove","@CarolineG82","edutainment",
"Netflix finds 'Carmen Sandiego' for its latest reboot https://t.co/LEaOE3TH7Q via @engadget","@jontarius","cultural-icon",
"Netflix is betting on ‘90s kids nostalgia for learning with upcoming lineup https://t.co/jIoo5YT1DF https://t.co/Es6lnC53QU","@GamerIntel","edutainment",
"Report: Gina Rodriguez Cast in Carmen Sandiego Animated Series for Netflix https://t.co/fj69zeE6jL","@BadBlueTech","cultural-icon",
"Hi please vote on this: Should my boyfriend and i be where’s waldo and carmen san diego 4 halloween","@nashosaurus_rex","cultural-icon",
"He bought his hats at the same shop as Carmen Sandiego https://t.co/xRbb2KPyU2","@DoctahDean","fashion",
"#AgentCarter 10 minutes in and already I'm considering switching my Carmen Sandiego cosplay to Peggy. BRAIN, I HAVE FOUR WEEKS.","@mandichaos","fashion",
"Gina Rodriguez is the new voice of ‘Where in the World Is Carmen Sandiego’ on Netflix https://t.co/4KIcippsJX","@SocialLifeMiami","cultural-icon",
"#BreakingNews Gina Rodriguez donning red fedora and trench coat of Carmen Sandiego https://t.co/qU3wJPfcqS","@RaizMakmur","cultural-icon",
"Adam Lambert Serves Carmen Sandiego En Bleu Realness - Who in the world is Adam Lambert's new style icon? Ummm, ap... http://t.co/xyDspNwk99","@RapPromotions","fashion",
"Consider the best fedora wearer of all time: Carmen Sandiego.","@the_eumelia","fashion","x"
"HeMan & Thunder Cats🙅🏿‍♂️ Smurfs 🙅🏿‍♂️ (Devil ting dat) Eventually Popeye 🙅🏿‍♂️ (cause Olive be hoing) Carmen Sandiego 👍🏿 Rescue 911 👍🏿 Sesame Street 👍🏿 TV6 News","@Dal_Joe","cultural-icon",
"It's our last day playing Carmen SanDiego! Will they find her using all the math and geography clues?! #crosscurricular #preal #innov8dmps","@sarconk","cultural-icon",
"Netflix Is Making A Carmen Sandiego Movie https://t.co/rj82FZGeJi","@XSpBlog","cultural-icon",
"Gina Rodriguez to Voice “Carmen Sandiego” for Netflix as Two Movie Studios Battle for Her Next Slot (Exclusive) https://t.co/X3hh0vT1AM","@SylviaLlewellyn","cultural-icon",
"Where at LCDC Have you heard of Carmen San Diego? It’s a game kids play while secretly learning geography. We’... http://t.co/9rWmGIbwEh","@LCDCtortoises","edutainment",
"Gina Rodriguez to Star as Carmen Sandiego in Live-Action Netflix Film - https://t.co/iBkF2GtXXn https://t.co/iBkF2GtXXn","@Winstanley247","cultural-icon",
"Good luck finding me in my Magic Eye Carmen Sandiego disguised as Waldo costume. #Halloween","@RhythmOrangutan","cultural-icon",
"@TXKimsonFan Hayden was rocking her Carmen Sandiego's hat yesterday #GH","@EnfantProdige","fashion",
"I'll consider my life a success if people relate me to Carmen Sandiego #wanderlust","@MikeBacos","travel","x"
"News Gina Rodriguez Will Play Everyone’s Favorite Art Thief In ‘Carmen Sandiego’ https://t.co/zMmIhYS23f","@ManchesterDrb","cultural-icon",
"Getting snapchats from @chelsea_hawk is like playing where in the world is Carmen SanDiego.","@colbycanderson","cultural-icon",
"Gina Rodriguez to voice animated Carmen Sandiego series on Netflix https://t.co/3RU66zTXzB","@sammythehouse","cultural-icon",
"@LookAtLollyy you still got a lot of world to explore Carmen San Diego","@YungHouseNigga","travel",
"cool ppl at work today, i wonder if its always like this on saturdays including: a woman practically cosplaying carmen sandiego, with a bright orange jacket and wide brimmed hat the nicest, most patient (single?) father with 3 kids, the best dreads ever, and black panther socks","@GammaGuts","fashion",
"THE NEW CARMEN SANDIEGO LOOKS NEATO gonna check it out once it comes out!!","@Pupstaroo","cultural-icon",
"Heading into Richmond, VA like Carmen San Diego. **coat not pictured** @ Richmond, Virginia https://t.co/iK0JKyhG9N","@sheilatempter","fashion",
"Looking at Erin Andrews hat makes me want to sing the theme song from Carmen Sandiego.","@AsheWhi","fashion",
"Where in the Waterworld is Carmen Sandiego? #80s90sMashup","@Signs_of_Life","cultural-icon",
"#InstaMagAndroid where in the world is Carmen SanDiego lol! #bluesign #worldtravelers #jetsetter… https://t.co/HhduBi8W7i","@maddvocals","travel",
"Netflix Plans 'Carmen Sandiego' Series with 'Stranger Things' Star and 'Jane the Virgin'… https://t.co/Eu0pWbdfAw https://t.co/uyiJjVKNZ8","@emmaloggins","cultural-icon",
"@ebizliz whats your costume? I think I might be going as a ""student"" aka myself. LOL. Carmen Sandiego costume might be a possibility","@ConvoCounts","fashion",
"@ErinHazelwood U can dress as Carmen Sandiego and I as Waldo...& no one will find us...drinkin all the vodka @ your Halloween party 😃","@althibbie","fashion",
"Rewind Review – Where in the World is Carmen Sandiego?: Where in the World Is Carmen Sandiego is an education... https://t.co/CI8TevDKGb","@RumAndGaming","edutainment",
"@ChrisJonesGeek Are you doing a Carmen San Diego? If so, where's your hat?","@heasgarnich","fashion",
"VIDEO: 10 Reasons Where in the World Is Carmen Sandiego? Was the Best Educational Show Ever https://t.co/7wzGzMFwuG via @People","@justmerebear","edutainment",
"VogueRunway Carmen Sandiego's presence was felt through Margiela's trench coats and UlyanaSergeenko's gangster sty… https://t.co/Du7Df6CMRz","@CocoLaVieEnRose","fashion",
"So @HereIsGina is live-actioning my girl Carmen Sandiego. I’m on the fence cuz I haven’t seen Gina in a villainess role. I expect a Spy Kid/Catch That Kid kind of feature but hoping more for a Ocean/Gone in 60 Seconds heist. Never say never, Player! See you next crime https://t.co/mAgt4TMIZX","@Mojavi_8","cultural-icon",
"@MatthewACherry @netflix The ""Where in the world is Carmen San Diego?"" Lady?","@gonzalezderwin","cultural-icon",
"I found Carmen San Diego @LeslieRubinWCHS http://t.co/LRTkmbu8m2","@wvudurrett","cultural-icon",
"Remember when I used to pretend I'm Carmen Sandiego and how much you hated it when I called you Waldo? I miss.","@Her_Randomness","fashion",
"@googlemaps hey when that new carmen sandiego series on netflix premieres can you do the same thing you did for april fools?","@theRealiHeart","cultural-icon",
"Netflix is betting on ‘90s kids nostalgia for learning with upcoming lineup #CarmenSandiego https://t.co/ywZ7SKtdVS via @Polygon","@AmberNDuran","edutainment",
"I was obsessed with #CarmenSandiego as a kid. I’m looking forward to this reboot. @netflix #90s #90sKid #TheCartoonHadABetterThemeSong https://t.co/f7cnLvdy7k","@StageName2Come","cultural-icon","x"
"The Reboot of 'Carmen Sandiego' to Premiere on Netflix in January https://t.co/HMbAPoYt32","@HNewsSource","cultural-icon",
"Netflix brings back Carmen Sandiego https://t.co/Pp7Ew9BYK6 #CarmenSandiego","@NothingsOn123","cultural-icon",
"Dog food Pickup, then I’m Homeward Bound! #HomeRun #BatOutOfHell #CarmenSanDiego🚛🔜Minnesota📍🗺🖍 (@ Big Heart Pet Brands in Topeka, KS) https://t.co/kCe9nMXGi3","@Pulpmind","cultural-icon",
"@zgrockergirl looks like a Carmen San Diego hat","@shannonbryana","fashion",
"Where In the World is Carmen San Diego 😈✈️","@laurenjilek","cultural-icon",
"My two favorite 90s educational carton shows: Carmen SanDiego and Magic School Bus 💃🚌💨","@RodTheBoat","edutainment","x"
"Carmen Sandiego was a fashion icon and no one can convince me otherwise. #WhereintheWorldisCarmenSandiego #trenchcoats https://t.co/Mi1Ao01pm1","@kcam91","fashion",
"@DiscordianKitty @GSTalbert @Delafina777 I get more of a Carmen Sandiego vibe. Are you a time traveling super criminal history buff?","@Kuroishi11","travel",
"I CANT STRESS ENOUGH HOW EXCITED I AM. CARMEN SANDIEGO IS MY IDOL⚡️ “Netflix greenlights a Carmen Sandiego series” https://t.co/IhtrtIs9p6","@TheSteffie","inspiration",
"sometimes I feel like Carmen San Diego...","@OHHHthatsBre","cultural-icon",
"Please, please, please tell me @RockapellaMusic is part of the new @netflix Carmen San Diego film.....","@cmhurley831","cultural-icon",
"this mornings #halloween shenanigans with my coworkers! #wonderwoman #carmensandiego & #batgirl… https://t.co/qavZYmaW9a","@DaQuool","fashion",
"The Carmen San Diego game was everything.","@chasingskylines","cultural-icon","x"
"Carmen Sandiego basically took me out on a date tonight 👭 🌏✈️ http://t.co/EA0pFtXng6","@mishqarossier","cultural-icon",
"Netflix's Carmen Sandiego Reboot Has a New Premiere Date and Some Mysterious Teaser Images https://t.co/rS686JCucQ via @io9","@MattFetchko","cultural-icon",
"Netflix plans live-action 'Carmen Sandiego' film with Gina Rodriguez https://t.co/IIjgiOvban https://t.co/jolsd7h1zD","@EngadgetUK","cultural-icon",
"Playing “Where in the world is Carmen Sandiego” with my friends like... 🕵🏻‍♀️ #seasia #travel https://t.co/77W2bvYLXe","@einthewild","travel",
"Haha. . Some call me Carmen San Diego or Dora the Explorer","@Gotblessings","cultural-icon",
"Where in the World is Carmen San Diego taught me everything I know about World Geography ✈️🚁🚤🚂","@Ms_BrittanyB","edutainment","x"
"#fashion #style Kate Middleton Channels Carmen Sandiego for Commonwealth Day at Westmin... https://t.co/iwMhosBt0y https://t.co/si8hZSeH12","@FashionStyleTwt","fashion",
"@cortezad Happy birthday mom! That's an awesome Carmen Sandiego coat!","@courtlanw","fashion","x"
"i wanna be one of those celebs that just has one outfit like waldo or carmen san diego......wait...maybe i just want to be hard to find","@yeahsometimes","cultural-icon",
"From Carmen Sandiego to Freddi Fish, you'll see some of the more noteworthy female heroines and influencers from one of the greatest eras for kids' software ever. https://t.co/28sH3C2znM","@Syfyfangrrls","feminism",
"exploring the Dorsoduro neighborhood in Venice, Carmen Sandiego style👣🇮🇹 #travelgram #eurotripping… https://t.co/oweHg4QRh6","@NYCtoEverywhere","fashion","x"
"Carmen Sandiego probably would have been a great girlfriend, if you didn’t mind traveling with a kleptomaniac.","@BrianPMiles","cultural-icon",
