"text","handle","category","star_tweet"
"Can't wait to see Carmen Sandiego again #Netflix","@DaJMeRos","cultural-icon",
"Gina Rodriguez will bring Carmen Sandiego to life for Netflix https://t.co/TiscKkfUcT","@fizapirani","cultural-icon",
"I want to play Duke Nukem, Oregon Trail and Where in the World Is Carmen SanDiego! Is that too much to ask? #oldschool","@Oh_HeyCan","cultural-icon",
"Just call me Carmen San Diego. 💃🏼Where to next? Well, in order to combat post trip depression, just booked my next… https://t.co/RZl12VWYFb https://t.co/SJ5a1vSJd9","@Crazytravelista","travel",
"Carmen Sandiego Cosplay https://t.co/V9LMYWjoKd https://t.co/1rAlc8oLuB","@CosplayRR","fashion",
"The First Images of Netflix's Carmen Sandiego Are Here - https://t.co/qDcaVBzF0b","@TrillyOnline","cultural-icon",
"While no one is watching, The BBC steals Big Ben, Carmen Sandiego-style. http://t.co/Ly1AA0q4PK","@iamsas","fashion",
"@Ky1eLong favorite super hero? Left or right sock first? Where in the world is Carmen Sandiego?","@mediocrebest","cultural-icon",
"Car 54, Where in the World is Carmen Sandiego? #IconicTVMashup #IconAwards","@sergebomba","cultural-icon",
"@thisisrory You wearing a certified @JoeBudden special fit. You've got the ankle exposed, just missing the Carmen San Diego hat.","@PhilyJ_213","fashion",
"WHEN in the world is Carmen Sandiego coming to Netflix? *hacks database* January 18! Who’s ready to go on an adventure with @HereIsGina and @FinnSkata? #NetflixNewsWeek https://t.co/d4UC2kb5vZ","@seewhatsnext","cultural-icon",
"@reneil Gina Rodriguez To Star As Carmen Sandiego In Netflix Live-Action Feature https://t.co/AxH9V7a0KJ","@IndyCapUSA","cultural-icon",
"Doing more traveling than Carmen San Diego https://t.co/CucPmB53Qf","@SleazyC_","travel",
"Rewarding some students with some old, yet fun computer games that will help learning about History, Math and Science more appealing. Where is Carmen Sandiego and JumpStart adventures have a staple of my childhood... https://t.co/Gml52IDBu6","@alextable","travel",
"#GinaRodriguez to Voice #CarmenSandiego for #Netflix Animated Series as Two Movie Studios Battle for Her Next Slot https://t.co/bdx8TZ5ho9","@PopCultureZone","cultural-icon",
"@Holtarna @Phukfaic @chxmicalwarfare @Overmayor This sounds like an actualized version of the time travel Carmen Sandiego game from the 90s that I remember playing and ragequitting because it was too frivolous.","@PunkerTY","cultural-icon",
"Can somebody make a Carmen Sandiego app already?! Make geography fun","@anemmanie","cultural-icon",
"Netflix Is Reportedly Reviving Carmen Sandiego With Gina Rodriguez https://t.co/0TkxydqTaq https://t.co/TRD647ZsEs","@WJCLNews","cultural-icon",
"Where in the World is Carmen Sandiego ❤️ Where’s Waldo #halloween… https://t.co/olJ40ZQ3ei","@aleanamarieB","fashion",
"1. Form-fitting long button coat, either red or blue 2. Janelle Monáe’s 2018 VF Oscar Party dress 3. Carmen Sandiego’s entire outfit ...I have a type https://t.co/TWgdBXoWj8","@DrownARiver","fashion",
"What You Learn Hunting Carmen Sandiego Without Google's Help https://t.co/rKp0AsfNIS","@Mario_Tekdung","edutainment",
"After acquiring live-action film rights to the Carmen Sandiego media franchise, Netflix is officially moving forward with a screenwriter for the project: Game Night writer Mark Perez. The https://t.co/qyRtljDPkL","@dreambuilderpro","cultural-icon",
"In honor of #geoweek here is an ode to my personal geographic hero, Carmen Sandiego http://t.co/y1vCxHcJfX #osmgeoweek","@RosemaryWardley","inspiration",
"Inspired by my longtime 💖 of #CarmenSanDiego, I've created @YouTube playlist #game called, 'Find Amara' ~ where you watch other creators videos & try to spot me... take that Waldo: https://t.co/jI7S1rJDlG 🔍🤔🎬 Best Adventures, @AmaraInSeattle & #AmaraNotInSeattle 😉 https://t.co/4C2E9ahXYl","@AmaraInSeattle","cultural-icon",
"#BreakingNews Netflix Is Reportedly Reviving Carmen Sandiego With Gina Rodriguez https://t.co/kidyKQEIRc","@RaizMakmur","cultural-icon",
"@mechapoetic some of the more effective edutainment games like carmen sandiego were 90% reading external sources, often enclosed","@HepCatPJs","edutainment",
"Amazon's Alexa: ""Why is Carmen Sandiego bad at basketball? Because she's always traveling."" Good joke, but the thing is, I didn't ask...","@JohnsonIU","cultural-icon",
"@missleylaha Now the Carmen San Diego theme song will be in my head all day","@SLAVES_BC","cultural-icon",
"Outfit of the day goes to Shay. Where in the world is Carmen San Diego? She's smashing cans on the roof of Nomads... https://t.co/8fh8SouOcD","@NomadsStKilda","travel",
"Kourtney Kardashian Takes Younes Bendjima on a Surprise Birthday Trip Oh, the places they'll go! Kourtney Kardashian channeled her inner Carmen San Diego for Younes Bendjima's birthday--and no, we're not talking about a role-playing fantasy.... https://t.co/UtdchCXUC1","@JesusGreen462","travel",
"All of Gen-Y knows that this will flop w/o Rockapella// Netflix has finally found Carmen Sandiego https://t.co/Vnf8AwB2NQ","@dchapdelaine","cultural-icon",
"Netflix orders animated Carmen Sandiego series https://t.co/0lPspMisCm https://t.co/iUH1HG56zo","@Frednewsfeed","cultural-icon",
"@Silver_Slinger Where In Time Is Carmen Sandiego? Looking back on it now, it wasn't really that great a show, but the idea of going on adventure through time was just the coolest!","@Frimmel","cultural-icon",
"@kylaelena @USSStellarDrift @HKTaylor7 @vzaitsevlaw @ImaSithDuh @ElfFromDenerim @DrunkDalish @LadySeek3r @ladyiolanthe @CarrieLynne2323 Speaking of which, did you hear about the live action Carmen Sandiego movie starring Gina Rodriguez?","@SapphyrKnight","cultural-icon",
"@mattdonders loll Matt calls it my Carmen San Diego hat","@amandapilla_","fashion",
"If you wear a red stetson as part of a generic '40s costume you will get about 60/40 people thinking you're Carmen Sandiego or Peggy Carter","@DanaLeighBrand","fashion",
"#Update Gina Rodriguez, ‘Stranger Things’ actor, to lend voice to Netflix’s ‘Carmen Sandiego’ https://t.co/aBJQrOFpiu #GeekyNurture https://t.co/49xyRalypu","@geekynurture","cultural-icon",
"The hat says Carmen Sandiego https://t.co/OWATriHroE","@DannyJLeBrun","fashion",
"@Phil_Lewis_ Confession: (Those hats always make me think of like evil Carmen San Diego)","@shefalikulkarni","fashion",
"Bigger thief, the Grinch for stealing Christmas, or Carmen Sandiego for stealing everything?","@jeffunscripted","cultural-icon",
"There's a woman dressed like Carmen Sandiego on this bus. Ask her trivia questions about world geography y/n","@uisgebeatha","edutainment",
"@iSmashFizzle Wow so @iamstephbeatz you too realize you should play Carmen Sandiego right? Who do we get on this?","@Noteless","cultural-icon",
"@Jarlent Have you played Around the World in 80 Days? It absolutely is meant to teach you facts. That is why it has a section literally called FUN FACTS. And so is Carmen Sandiego; MANY edutainment games are meant to teach things you'd learn in an academic setting.","@PushinUpRoses","edutainment",
"🎃 Happy Halloween everybody! 🎃 ""Where in the world is...."" #carmensandiego 🎃 #halloween #nyc https://t.co/pB6KQVu9oo","@MoniqueDarton","fashion",
"This pic makes me feel like Carmen Sandiego 😂 http://t.co/iclb1AueQL","@CapitalsChick","fashion",
"Iconic! Netflix Is Bringing Back OG Scammer Carmen Sandiego & Everyone Is GEEKED https://t.co/H54BxjvaFD https://t.co/17PTS0YsIY","@TheUrbanNewz","cultural-icon",
"Where in the world is Carmen SanDiego? #BrownsInterviewQuestions","@Mic_Dvs","cultural-icon",
"You better know what you're up to, @netflix! #CarmenSandiego #Netflix #LordOfTheRings https://t.co/RdHVUJgccI","@GandalfTheMex","cultural-icon",
"Carmen Sandiego reboot coming to Netflix https://t.co/sHrBjMAF3p","@jemimah_knight","cultural-icon",
"VIDEO: 10 Reasons Where in the World Is Carmen Sandiego? Was the Best Educational TV Show … https://t.co/yj93FO0knN https://t.co/C5pNU432es","@Maria156tt","edutainment",
"She needs a Carmen Sandiego hat https://t.co/42NpbAYL0W","@CourJenna","fashion",
"@Kainin YUS I’m ready for the resurgence of Carmen Sandiego cosplay 😍😍😍😍","@KaniDayOfficial","fashion",
"I found Carmen Sandiego in an airport in Dallas. She's gone blonde and prefers sitting on the floor. Strange cat. https://t.co/43CxYw71uv","@EricHolljes","cultural-icon",
"VIDEO: 10 Reasons Where in the World Is Carmen Sandiego? Was the Best Educational TV Show … https://t.co/MtoNjBOOL2 https://t.co/M7xmPeXsVq","@muldrix26","edutainment",
"question of the day: if I own a black trench coat and a red fedora can I still make a Carmen Sandiego #costume work? #holloween","@brittkeegan","fashion",
"Gina Rodriguez to Star as Carmen Sandiego in Live-Action Netflix Film https://t.co/SyxDT4Zuct","@richardleewest","cultural-icon",
"@naturenohurry91 @BecksLS30 @NKOTB After ""investigating"" It's from 2012 and they shared it with the cruisers from that year! I feel like Carmen Sandiego right now! 😂😂😎","@latrinaa35","cultural-icon",
"@traciethoms i remember learning lots from Where in Time is #CarmenSandiego & #Mathnet (the Square 1 tv show version of #Dragnet","@JoshuaBrunken","cultural-icon",
"When I grow up I want to be Carmen Sandiego. That hat...","@sork_brady","fashion",
"i just told my sister she should cosplay carmen sandiego bc no one ever knows where is she is this how shade works or","@kailydica","fashion",
"Gina Rodriguez To Star As Carmen Sandiego In Netflix Live-Action Feature (Mike Fleming / Deadline) https://t.co/mLwoRjt7x0 https://t.co/jQRmzn6XJR","@WeSmirch","cultural-icon",
"90s Halloween costumes on tonight's #FreshOffTheBoat that I love- Carmen Sandiego, Miss Piggy, The Mask, Where's Waldo","@KathleenHessman","fashion",
"Netflix has announced a premiere date for its Carmen Sandiego reboot and shared some some mysterious teaser images https://t.co/j6BygYymoK https://t.co/tqnE9TQSQm Gizmodo","@smiewl2","cultural-icon",
"Gina Rodriguez Is Netflix’s New ‘Carmen Sandiego’... https://t.co/VBRpKrcgFy","@animag","cultural-icon",
"Wait. Is Netflix REALLY making a new Carmen Sandiego series starring Gina Rodriguez? OMG OMG","@kurai","cultural-icon",
"@thatgirllei but what do I knowwwww. Haha hey Lei that Carmen SanDiego hat is cleannnnn btw 😎 lol","@iMikee_V","fashion",
"All I wanna do is play Where in the world is Carmen Sandiego.","@MsMozell618","cultural-icon",
"Well I was talking to a child about Where in the World is Carmen Sandiego except I called her Carmen Electra and I think I’m just going to sit out the rest of the day. But will keep this in mind for Halloween next year.","@missleylaha","fashion",
"Gina Rodriguez to Star in Live-Action Carmen Sandiego Netflix Movie https://t.co/koAXA5K096 https://t.co/p0xk9dAyM8","@OldSkoolGeek420","cultural-icon",
"""It's Official: Carmen Sandiego Is Getting Her Own Animated Netflix Series"" #CarmenSandiego https://t.co/A4PvNUHJDj","@Alia_Shi","cultural-icon",
"i just found out that they're making a live action carmen sandiego movie. just one step closer to my dream of making Mavis Beacon Teaches Typing into a movie","@andymoney69","cultural-icon",
"@katdvs We were poor. I got to play Oregon Trail & Carmen Sandiego in elem. In jr high learned Printshop...and that's about all my training.","@Samantha12Jane","edutainment",
"That red, wide-brimmed hat just makes me think of Carmen Sandiego.","@thisisjelli","fashion",
"Where in the World is Carmen Sandiego uses 15 mb of hard drive & 8 mg of ram but fits music, language & info abt over 50 countries.","@kendallfire_xo","edutainment",
"""Where in North Dakota Is Carmen Sandiego? is a 1989 edutainment video game""","@LucasHayas","edutainment",
"Tonight I learned the Carmen Sandiego game show was an actual thing! My childhood is vindicated","@KaylinEvergreen","cultural-icon",
"@RubinReport Sometimes I find myself wishing Carmen Sandiego would raid the National Archives and steal the Constitution.","@ShaunPWelch","cultural-icon",
".@Yapi we’re still having a hard time understanding why you’d want to visit abandoned buildings at 4am in the morning. But we love reading about it! #haikyo #creepypasta p.s. Who else remembers booting these up in elementary? #carmenSandiego #oregonTrail #imTooOld https://t.co/ByNJ6RBLvR","@fromEveryst","cultural-icon",
"@twolinepass He has stolen the arch like Carmen San Diego. Only logical explanation","@HummelTown","cultural-icon",
"CARMEN SANDIEGO: Gina Rodriguez Cast In Netflix Film Adaptation https://t.co/LKxR4AN8iQ","@FilmBookJoseph","cultural-icon",
"@ladyluvstech We had a desktop when I was 5, lots of learning games. Math puzzles + Carmen San Diego were my early childhood #ladylovescode","@whatthefoz","cultural-icon",
"Netflix is betting on ‘90s kids nostalgia for learning with upcoming lineup https://t.co/aN7fEXLNCN https://t.co/uvPP3eTJxw","@enquidu_project","edutainment",
"Dust off that magnifying glass! Carmen Sandiego is getting a Netflix movie - Digital Trends https://t.co/kLwAgaRFTX","@NewGamesPlay","cultural-icon",
"Netflix’s Carmen Sandiego Movie To Be Written By Mark Perez ('Game Night') https://t.co/cnUwJqIvrD","@ViewmasterMikey","cultural-icon",
"@discordapp @SinnerTheGame Something sneaky? Carmen sandiego https://t.co/0wipJe24US","@elicarruthers","cultural-icon",
"It's Official: Carmen Sandiego Is Getting Her Own Animated Netflix Series. https://t.co/Icf18ikNRM","@CineMGC","cultural-icon",
"Jane The Virgin's Gina Rodriguez Will Help Revive Carmen Sandiego For Netflix https://t.co/nXHN5Urpxq","@MODENUMB1","cultural-icon",
"I feel like Harleigh is Carmen San Diego. She's never here, always traveling. Where in the world is Harleigh?","@KaitlynKing3794","travel",
"Netflix may have found their 'Carmen Sandiego' and she comes with Golden Globe credentials https://t.co/whBACtoQeh https://t.co/0rhndracZh","@HitFixUPROXX","cultural-icon",
"Erin Andrews with the really great Carmen San Diego outfit today.","@PatrickTruby","fashion",
"Couldn’t help it. The sale at @target made this too inexpensive for this geography buff not to get. But, I think I’ve figured out where #CarmenSandiego is... she’s in the East Wing of the… https://t.co/ovRF9wWRav","@OgeeEverett","cultural-icon",
"@EddieGoldx your Carmen Sandiego trip going well huh breh","@GeekMeDwn","travel",
"Seriously the BEST thread of 2018. No others need apply. Bonus points to anyone who actually had a Commodore 64 to play the game on. (Yes, we exist. We're just old now.) #CarmenSandiego meets ... wait. What the hell is Junior wearing? #TrumpCrimeFamily","@RachelMcGonagi1","cultural-icon",
"Oh you're really traveling, you're parking Winnebagos What country am I in now, I'm Carmen Sandiego","@skywolfmountain","travel",
"Sounds Like Netflix Is Bringing Back 'Where In The World Is Carmen Sandiego?' | The Huffington Post https://t.co/kLUCbKLJYV","@jonb4431","cultural-icon",
".@HereIsGina is voicing Carmen Sandiego for Netflix?! @infoCinelandia","@Journeys_Film","cultural-icon",
"Might see me anywhere like Carmen san Diego","@mod_young","cultural-icon",
"Netflix is making a Carmen Sandiego movie with Gina Rodriguez https://t.co/9YPODewv8z","@techhnews","cultural-icon",
"@netflix re: Carmen Sandiego - will Rockapella be returning?","@snacks_kyburz","cultural-icon",
"@DThoursonPalmer Carmen Sandiego is a neckbeard in @netflix's new anime. https://t.co/7Opg7MiNT5","@nsjpatrick","cultural-icon",
"You ever think Waldo is Carmen Sandiego's son/sibling? I mean people are always looking for them, they're skilled at hiding & they wear red.","@EnSabahNurX","cultural-icon",
"Netflix is betting on ‘90s kids nostalgia for learning with upcoming lineup https://t.co/OadMCvdz19 via @Polygon","@StefanKantor","edutainment",
"Gina Rodriguez to voice Carmen Sandiego in Netflix animated reboot - https://t.co/5TZeC3UXgh https://t.co/A5joYtK80q","@Red5Apps","cultural-icon",
"@mametown Girl, you travel around that country more than bloody Carmen Sandiego","@LJ_Parrish","travel",
"Well, well, well, looks like that dastardly @CarmenSandiego is planning a come back. Polish your detective skills at LCM+L before her return! ⚡️ “Gina Rodriguez is bringing a Carmen Sandiego film to Netflix” https://t.co/El7TItRbPc https://t.co/01VGJkT4bp","@LivingComputers","cultural-icon",
"I ❤ed Carmen Sandiego as a kid. This would be so fun in the classroom https://t.co/09lDZFhTuG","@wileyteaching","cultural-icon",
"Eclectic costumes from friends at @DukeUCAE ! Dust Bunny, Ghostbuster, Red Riding Hood, Scooby Doo, Carmen Sandiego http://t.co/zI3KlArh9b","@WorkingatDuke","fashion",
"@davidpoblador Speaking of spooky things about airline systems: https://t.co/igqZMJaPYW","@tazjin","cultural-icon",
"@ZacharyLevi Remixing the Carmen Sandiego theme song? Awesome! Now lets look at the huge floor map to locate him! Lol","@Nikki_One_Luv","cultural-icon",
"https://t.co/rAJlGLXFWv ✖ #Where in the world is Carmen Sandiego? On a bus in Seattle. #levinsmr https://t.co/TBkeklmkbd","@ForbexCat","travel",
"VIDEO: 10 Reasons Where in the World Is Carmen Sandiego? Was the Best Educational TV Show Ever The PBS game show w… https://t.co/i0uiCSkS3S","@wegetnews","edutainment",
"Ruby just came up with her first fan theory. Re: Carmen San Diego... ""Wait, is her daughter Dora the Explorer??""","@shutterMuggz","cultural-icon",
"@xc_appel I'm currently eating pizza 25 miles from the airport. This feels like some Carmen Sandiego shit rn","@risuchan","travel",
"Gina Rodriguez Voicing Carmen Sandiego in Netflix Show https://t.co/hFjKxt23GI","@maths_games","cultural-icon",
"As we speak a room full of highly educated adults cannot remember what state Pittsburgh is in. Carmen San Diego failed us.","@Get_Hoodzpah","edutainment",
"New session - Where in the World is Carmen San Diego? The Evolution of Mobility with @gocroozen ✈️ | RSVP: https://t.co/FZYo7UtJMy #ASW17","@AtxStartupWeek","cultural-icon",
"#Daria+#CarmenSandiego=🖤. . Bringing back the #90s with my #womancrushwednesday @hopejane for #blackheartsburlesque! 👓 🌍 💋 . . #cosplay #dariacosplay #carmensandiegocosplay #fiercefemmes… https://t.co/chsnahbqNX","@QueenieBurlesk","fashion",
"Agent Carter’s red hat in all these previews is very Carmen Sandiego.","@hvbeg","fashion",
"I delivered all the fruit and Christmas cheer. Now where in Carmen San Diego am I?","@BiZonkerz","cultural-icon",
"A cross between Carmen Sandiego & Bill Nye Science Guy, this time-travelling prof is redefining #PBL. http://t.co/dRuXmBBaR5 @changemakers","@KennyGrassroots","edutainment",
"@shaemvx Gina Rodriguez is playing Carmen Sandiego and suddenly I can’t breathe https://t.co/jZdTLlKrIR","@shaemvx","cultural-icon",
"Happy birthday!! @babyhaim side note, I keep singing your voice in the tune of carmen san diego <3 where in the world are you?","@Tasminallen","cultural-icon",
"But...where in the world is Carmen sandiego?? @fratdiva","@Iam_Forbidden","cultural-icon",
"@theprophetpizza that second pic is carmen sandiego but make it fashion AF","@tylerwatamanuk","fashion",
"My kids are getting desktop comps today for their B-days. Question: what are some good educational kid games? I had Carmen Sandiego etc.","@CarmichaelDave","edutainment",
"⚡ Netflix greenlights a Carmen Sandiego series https://t.co/AHlKdPRwxj","@albertorivera10","cultural-icon",
"@SteveMartinToGo Are you Waldo or Carmen Sandiego this Halloween?","@BernhardtM","cultural-icon",
"Excited @HereIsGina will be the voice of lead character Carmen Sandiego, in the New Animated Series, Coming to Netflix in 2019! #StreamTeam","@ToughCookieMom","cultural-icon",
"@paceonearth dude, where in the world are you? #carmensandiego","@SMacAfee","travel",
"So in other words... you’re just planning your next vacation? Ol’ Carmen Sandiego Head ass... https://t.co/BOkV4UEKt9","@DizzyDEEzle","travel",
"@BigBird I imagine that Carmen Sandiego teamed up with a criminal boss from one of my other video games & his gang is working for V.I.L.E.!","@JeremiahLiles1","cultural-icon",
"I'm just as frustrated as @Kaneshow with these people not getting the ""car"" game!!! GEEEEEZ PEOPLE #carmensandiego","@Jadachapman","cultural-icon",
"@Adam_Jacobi I think we finally know where Carmen Sandiego is","@LeighSpeaks","cultural-icon",
"Where's my gritty Carmen San Diego reboot?","@MrAnnual","cultural-icon",
"Lady Gaga Is Really Into Dressing Like Carmen SanDiego Lately https://t.co/aPGkcn5gYX #ELLE #Fashion https://t.co/iX47j5K9TR","@FlashlightFashn","fashion",
"@maxgladstone Carmen Sandiego is my idol.","@maxgladstone","inspiration",
"CARMEN SANDIEGO -amazing signature red trenchcoat -danny phantom whomst??? this BITCH INVENTED GHOSTING -runs away from her problems -has one (1) good angle -master of the Dramatic Exit -bombshell LÜKS: Broad Shoulders, cinched waist, rocks warm tones, dark glamour waves https://t.co/vPLAPdSoQN","@slashonsleeves","fashion",
"Netflix’s Carmen Sandiego Movie To Be Written By Mark Perez ('Game Night') https://t.co/mI6yHv0LYA #Movies #TV","@watchtvcentral","cultural-icon",
"I am 100% over this weird obsession with saying technology is making us dumber. The only reason I have ANY idea who Yuri Gagarin is is because of a video game. (Where In Time Is Carmen Sandiego, which remains a national treasure.)","@evdoyle","cultural-icon",
"Carmen Sandiego Is Officially Happening With Gina Rodriguez at Netflix #Celebrities https://t.co/NgAIl41fBS","@CelebritiesNwsl","cultural-icon",
"How Carmen Sandiego accidentally became an educational game icon https://t.co/yVtsFBGJ19 https://t.co/KoVPF0fDef","@The_Real_TroyS","edutainment",
"Where in the world is Carmen Sandiego? Netflix. https://t.co/n4CEhdI29R https://t.co/MNnXjR6ou8","@CBS12","cultural-icon",
"@GourmetRayA u wanted to be Carmen Sandiego this weekend lol","@KP_Trill","cultural-icon",
"#ParentPickedLiked Sounds Like Netflix Is Bringing Back 'Where In The World Is Carmen Sandiego?' https://t.co/52pk6aZRrf","@ParentPicked","cultural-icon",
"How Carmen Sandiego accidentally became an educational game icon https://t.co/PnROkWYFYD #CarmenSandiego https://t.co/4k6jwRMcPJ","@getgamechat","edutainment",
"Carmen Sandiego is coming to #Netflix! https://t.co/1eUWSrMas5","@geekswithforks","cultural-icon",
"@DubiousCA No seriously, it would pull excellent double-duty, I could cosplay her AND Carmen Sandiego","@DubiousCA","fashion",
"I'm late to the #timeless party, but I am REALLY enjoying this show. If you liked ""Where in Time is Carmen San Diego"" then you should watch this show. It's all up on Hulu, so you can catch up on two seasons of entertaining time travel fun with a great cast - M #RenewTimeless","@lezwatchtv","cultural-icon",
"Where in the World Is Carmen Sandiego? Becoming a Secret Travel Agent https://t.co/Lan5IFiwgJ https://t.co/RM3UKQ8p7d","@winsontang","travel",
"Where in the world is #CARMENSANDIEGO? I aspire to be her. Travel. Not steal things. #sketch_dailies @sketch_dailies http://t.co/BedMDqlai0","@jaymetwins","travel","x"
"the netflix carmen sandiego thing looks good tbh","@weqrio","cultural-icon","x"
"Netflix is rebooting Carmen Sandiego as an animated kids’ series https://t.co/tNL64wUB4I","@passustheaux","cultural-icon",
"Gina Rodriguez Will Play The Iconic Carmen Sandiego In An Upcoming Netflix Live-Action Film https://t.co/iu5qT1E5iu https://t.co/UZjlde3ETc","@BuzzFeedEnt","cultural-icon",
"@KaceyecaK @efoxband And one of those Carmen Sandiego hats.","@brianscribeNY","fashion",
"Carmen Sandiego taught me more about geography than geography class in HS","@Pastor_Blem","edutainment","x"
"i think i'll never be allowed in ireland again cause i got this book from the only public library in dublin and accidentally brought home am i an internacional criminal can i wear carmen sandiego outfits?","@calamiteajane","cultural-icon",
"How many times will I say ""Do it Rockapella"" and not hear the Carmen Sandiego theme song?","@nerditry","cultural-icon",
"@derekalexander Not as cool as her hat ;) #CarmenSandiego http://t.co/HYDSzSqYyl","@UrzasRage","fashion",
"It's now mandatory that @KatieLinendoll dress up as Carmen Sandiego for every wrestling event that her and @notsam attend #whereintheworld","@GTSRobin","fashion",
"WHAAAAAT?!?!?!!? ~It's Official: #CarmenSandiego Is Getting Her Own Animated #Netflix #Series~ https://t.co/Zroby7SBXy via @io9","@K41N_of_2358","cultural-icon",
"@byKimAHoward Carmen Sandiego would be a GREAT costume.","@bhootbabe","fashion",
"What Netflix’s New Carmen Sandiego Show Will Actually Be About https://t.co/aY4iQxvc2g","@NortonAntiHarry","cultural-icon",
"Because I am a geography nerd. I've caught Carmen Sandiego over and over. And yet she keeps getting away. We really need a better jail.","@adamsounds","cultural-icon",
"Gina Rodriguez to Star as Carmen Sandiego in Live-Action Netflix Movie https://t.co/gHjeYJNfOm","@Q_Country1029","cultural-icon",
"Swear I'm wearing hella trench coats & big hats this fall/winter yall gone think I'm Carmen Sandiego 👒👜","@missnicky2you","fashion","x"
"The Making Of Carmen Sandiego: Making Educational Games Fun- https://t.co/f9K4LbPxb6 check it out !!! #programming #gamedev #indiedev","@patys_prog","edutainment",
"@fionafaltys @HayleyAtwell @FLSupercon @AgentCarterTV Gotta say, the red hat looks way Carmen Sandiego though","@fionafaltys","fashion",
"""Chuck Norris is the reason Waldo is hiding, and why Carmen San Diego can't be found.""","@ChuckNorrsFacts","cultural-icon",
"""@el_smasho_gutso: @xxx_luca i get it, carmen sandiego"" lol hahahaha where in the world is ....","@xxx_luca","cultural-icon",
"🌎@Netflix is bringing back Carmen Sandiego! https://t.co/pukiXptUEM https://t.co/VXPxeCc2Fy","@REMEZCLA","cultural-icon",
"@CJPatruno Sharing an airb&b with Waldo and Carmen Sandiego.","@FriedMarian","cultural-icon",
"@petrarchian real question: why aren't WE ALSO reading Carmen Sandiego fanfics","@griffincandey","cultural-icon",
