"text","handle","category","star_tweet"
"This Pup Has Traveled The World, And Has Drool-Worthy Pics To Prove It: Move over, Carmen Sandiego, this adven... http://t.co/NhiD4SnCzm","@_GreenWatch","travel",
"childhood heroes: - catwoman - sailor mars - carmen san diego this says so much","@aprikii","inspiration","x"
"Gina Rodriguez Is Going To Be Carmen Sandiego In A Live-Action Film And I'm Breaking Out My Red Fedora To Celebrate https://t.co/alaZRBFbxt https://t.co/WtYcgDlaXY","@amandasome","pop culture",
"Carmen Sandiego is one of the best female videogame anti hero protagonist. We need to talk about her more #GamerGate #notyourshield","@MichaelSpaceJam","inspiration",
"Everyone’s asking “Where in the world is Carmen Sandiego,” but nobody asks “how in the world is Carmen Sandiego... upholding her criminal empire that’s actually a front for a humanitarian organization representing women of color and providing geographical education to kids?”","@MoTheDuck","edutainment","x"
"Some days I wish I was Carmen Sandiego, traveling the world","@BigIrish777","travel","x"
"Netflix may have found their 'Carmen Sandiego' and she comes with Golden Globe credentials https://t.co/2nhvucMxZd https://t.co/ZFW70GC3EK","@UPROXX","pop culture",
"@EGTF AKA What In The World Is Carmen Sandiego Wearing.","@richardcobbett","pop culture",
"@ArtistSeanSeal @RetroFeeder That's too bad. Somewhere I still have the B: drive disk for the Carmen San Diego game I beat back in 8th grade. I think that was the first game I ever beat.","@LudonarrianGame","pop culture",
"@KevinWriteStuff Plus there's learning. Edu-tainmenu. Sliders meets Quantum Leap meets Where is Carmen SanDiego.","@KevinWriteStuff","edutainment",
"When you find your Carmen San Diego hat #lifegoals #complete @GoorinBros xoxox","@RachelDorcy","style",
"VIDEO: 10 Reasons Where in the World Is Carmen Sandiego? Was the Best Educational Show Ever … https://t.co/WcFHLM1FFP","@mag_nota","edutainment",
"We're channeling our inner 'Carmen Sandiego' this #TravelTuesday https://t.co/RWvoObIC02 #CbusChic @UniglobeTravel #carmensandiego #travel","@CbusChicMag","travel",
"DiggTop: 'SNL' Tries Some Edutainment With 'Where In The World Is Kellyanne Conway?' https://t.co/ZSc7IGn3q0","@TLWNewsPump","pop culture",
"Geek Girl Mistress Zelda's amazing Carmen Sandiego cosplay: https://t.co/wyUQfJGUZB","@geekxgirls","style",
"It also had a few educational games on it that I definitely attribute all of my later interests and skills. Kid Pix, Spooky's Typing, The Treehouse and Where in the World is Carmen Sandiego. Oops this turned into a callout post on myself, haha. https://t.co/k88HRWtkwz","@alzuna","edutainment",
"I'm still waiting for a #CarmenSandiego movie. My enjoyment of that TV show might have been the first signal of my wanderlust","@darylparanada","travel","x"
"Also, anyone remember Carmen Sandiego? It’s how I learned geography. I met Greg. He was awesome! My dad was a trooper for sanding in line with me for five hours. https://t.co/38kgYapzwu","@adventuresmissa","edutainment",
"Is Boomer trying to be Carmen Sandiego? Or trying to bite @BJRains' style? https://t.co/YaNq0VrnoV","@MichaelLKatz","style",
"Gina Rodriguez donning red fedora and trench coat of Carmen Sandiego https://t.co/JVQackz3nV https://t.co/0VCiLrLK5V","@PublicidadBlog","pop culture",
"@lovemeree Carmen sandiego style lol","@Viva_Ventura","style",
"I hope there's a mission in Federation Force where Samus styles all over your squad in her Carmen Sandiego disguise https://t.co/xlju5MOgKK","@Crime_Wizard","style",
"carmen sandiego was literally all i wanted to be when i was a kid lmao. she was my hero and lifespo","@aprikii","inspiration","x"
"my ideal woman is mila kunis as carmen sandiego","@rubykinnso","pop culture",
"Thanks to SCG - Super Cosplay Girls for sharing my Carmen Sandiego cosplay ^^ http://t.co/DasF54ATXf","@_Shiroki","style",
"My team’s annual summit is the week of Halloween and the day after we’re doing a murder mystery dinner where we can dress up. An idea popped in my head as going as Carmen Sandiego. Has to be an easy DIY. All I need is a red trench coat and hat.","@tcamil","style",
"I think Marc Jacobs inspiration was Carmen San Diego 😂 #NYFW https://t.co/jw5aDzIxnu","@rayeesuh","fashion",
"10 Reasons Where in the World Is Carmen Sandiego? Was the Best Educational Show Ever https://t.co/BzFrZkszfM","@GivingMeMore","edutainment",
"Adam Lambert Serves Carmen Sandiego En Bleu Realness: Who in the world is Adam Lambert's new style icon? Ummm,... http://t.co/Yevm7PATiE","@MusicXcellent","fashion",
"Gina Rodriguez donning red fedora and trench coat of Carmen Sandiego https://t.co/ZEP28yiA1G","@MobiOps","pop culture",
"Holy fudge @netflix is making a Carmen Sandiego tv show and @HereIsGina is playing Carmen and this is iconic wow I'm shook","@getaclucy","pop culture",
"Today I'm schooling my 7th graders on the greatness of educational cartoons.It is glorious. #CaptainPlanet #CarmenSandiego #thepowerofstory","@MsLReads","edutainment","x"
"Someone sponsor my travel time in Carmen sandiego","@ShawdieRED","travel",
"@saltymamas Carmen Sandiego. Lady is a beautiful, intelligent, sultry reverse Batman. She is ready for anything the detectives try, has supreme control over her choices and privacy, is the head of her organization, is both educated and competent, and has boundless imagination and ambition. https://t.co/mQgfA43xtl","@WKQualls","inspiration",
"Whenever I see a woman wearing a wide brim red hat, I can't help but think of #CarmenSanDiego","@kaleighnestman","style","x"
"London —> Geneva —> Montreux—> Lisbon —> Porto —> Italy queued up for Q3/Q4 2018. On my #carmensandiego travel steez. 🌍🗺#worldwidecitizen #travelnoire #foreverrestless","@citygirlsnark","travel",
"Thinking about my #firstever #SDCC2015 #cosplay Might be #AgentCarter but am afraid it'll look more like #CarmenSanDiego. #WinWin?","@JodiSox","style",
"All I knew how to do on the computer was play Oregon Trail and Where is Carmen SanDiego. This is such a great opportunity for girls. #STEM #coding #girlpower","@kelleyk525","edutainment",
"If Soojin visits San Diego what if I blasted Where's Carmen San Diego in the car","@TheGayAgenda69","pop culture",
"Happy Halloween! Most people had no idea who I was dressed as, but those who did loved my costume #Halloween18 #carmensandiego https://t.co/8MIaSZMd2D","@yvetteholguin","style",
"Lots of travel in the next few weeks! #SanFrancisco, #Philly, #NYC then #Miami. Just trying to keep up with #CarmenSandiego... #travel","@AlexisAnth","travel","x"
"#BeforeTheInternetExisted we used Carmen Sandiego to learn something about other places https://t.co/5RLeVxEU5K","@alexmyth_design","nostalgia",
"@knottyyarn I also have a friend who won Carmen Sandiego in elementary school, so . . .","@DarcyAMiller","pop culture",
"@WWEUniverse @TheDeanAmbrose With as much as they travel, probably a good idea to have a globe with you...or Carmen Sandiego or Waldo.","@ranrtt","travel",
"The person who taught me the words auburn and spelunking was Carmen Sandiego","@ErinMarkey","edutainment",
"Where in the world is Carmen Sandiego is today's ""Where in the world are my car keys?""","@RossLaRocco","pop culture",
"@knightessrouge Oooo! You mean you're gonna cosplay ""Where in the world is Carmen Sandiego?"" :P","@DuffBrian","style",
"me, thinkin out loud: speaking of iconic classical/romantic music... beethoven's sonata pathetique was bgm in the carmen sandiego video game","@panzerkunstt","pop culture",
"Grampa JoJo wears Carmen Sandiego clothes","@BootyCommune","style",
"Im watching carmen San Diego as an adult & just realized it was a educational show! I was learning as a little kid & I didn't even know!","@comicMartinRizo","edutainment","x"
"Video #games as educational texts. Nothing new, Carmen SanDiego, Decisions Decisions, etc from the nineties did that. http://t.co/WJb2VGSkPi","@johannescronje","edutainment",
"Gina Rodriguez Is Bringing Carmen Sandiego Back in all of Her Globe-Strutting Glory https://t.co/KQZakOLFqH https://t.co/Sxg52ftp8r","@thegist","travel",
"Oh I spotted someone dressed as Carmen Sandiego for #Halloween. So I have the theme song in my head, so now you can, too! ;)","@mrlibrarydude","style",
"@GeorgeLA96 it’s better than that. He’s traveling the country in pursuit of the mysterious Carmen Sandiego","@the16thdoc","travel",
"Carmen Sandiego Returns in a New Educational App https://t.co/TgHZtVNlY7 https://t.co/cSsl19BdXG","@MarleenTynes","edutainment",
"Lowkey af I make my birthday costume-ish related cause 99% i have a wack halloween & this year ill be working in vegas so.. #carmensandiego","@_jenny0h","style",
"@Barkeromo Similar style as a proper fedora. I have a coat to match for the full Carmen San Diego look.","@harleyquinnical","style",
"My middle school educator friend Rachel just told me “Everything I teach was taught to me either by Carmen Sandiego or John Green.” @johngreen @TheCrashCourse","@mktraband","edutainment",
"@BuckleyKerri Everlane has a cropped city anorak that might work. https://t.co/ls6mAFWROL I envy people who can wear trenches, though--I always feel like Carmen Sandiego. ;)","@EFSlattery","style",
"@CarmenOrChante That's whatsup you aint playing you bout to be on your Carmen San Diego traveling for real and Home 2 work cant beat it!","@swzhaobudaozion","travel",
"#VOICE LIKE #MZ CARMEN SANDIEGO #AKA #CARMEN JONES#NO SACKCLOTHE#LIVE TRAVEL ECPLORE #SAFELY#IMAGINATION IS 🔑🔐🚪💰💸💵","@STAYBIG3","travel",
"#tbt I used to love this... I learned something every episode. #chilhoodmemories #carmensandiego… http://t.co/OlbzXBPaSu","@IcyJohnson","edutainment","x"
"Gina Rodriguez donning red fedora and trench coat of Carmen Sandiego: https://t.co/KC2c2SkzPS","@brianrobplus","pop culture",
"Great minds think alike! I found #whereswaldo, or did Waldo find me? #CarmenSandiego is sure getting around #Akron today. #Halloween #librariansarecool #childrenssection @akronlibrary https://t.co/MSIyCVyZVH","@TravlingYoyo","waldo",
"@DarkFilly Or Carmen Sandiego outfit. https://t.co/U8MWeQmQ4V","@ROY_MXRACE","style",
"@BRACKETcast the most iconic part of Carmen Sandiego is the hat","@OminousJazz","fashion",
"Maybe I'm just super good at empathy, but I want to ask, ""HOW is Carmen Sandiego?"" Is she okay? Travel is stressful, you know?","@Mike_Laidlaw","travel",
"Some times I get nostalgic for the old school computer games you'd play on the old Macintosh computers at school like OregonTrail, that nursery rhyme game where you had to put all the characters back in their stories, & Carmen Sandiego... 😭 i just want to play CarmenSandiego","@CmndrLex","edutainment",
"she is doing some of the greatest Carmen sandiego cosplay i have ever seen https://t.co/AYf61YRybN","@solomonmissouri","style",
"I have a long red coat at home so now I can dress up as carmen sandiego any time I want #kubecon @RedHat https://t.co/VvZQBKtApU","@charwarz","style",
"Did Carmen Sandiego ever time travel or am I misremembering things?","@CBazenas","pop culture",
"Happy Halloween, readers and writers! Let me ask you something: “Where in the world is Carmen San Diego?” https://t.co/SciQLFfoHZ","@ShannonCSimcox","search",
"#CarmenSanDiego with blonde hair, Nine West hats & red Peoni crossbody bags, #ootd http://t.co/PokxzNw0Jn","@duffydossier","style",
"Netflix is developing a live-action Carmen Sandiego movie: Netflix is developing a live-action film based on the classic edutainment video game series Carmen Sandiego, according to entertainment industry website Deadline. The series - which begin in 1985… https://t.co/5caBClUgv9 https://t.co/yBBMoX0O1G","@zimisss","pop culture",
"@katieoliver01 @DK_Hamilton @BiancaSloane And Ava's not fooling anyone with that trench coat, hat, and sunglasses. I FOUND CARMEN SANDIEGO!","@DebiVSmith","style",
"@edbites Hold on to your hat, you can play it again right now! https://t.co/H6W2QeyGhB","@DrDonnaYates","pop culture",
"#washingtondc #traveling #travel #travelgram #carmensandiego #tbt #cold #fun #red #washingtonmonument… https://t.co/fnplY96HfW","@lesvega","travel",
"Gina Rodriguez donning red fedora and trench coat of Carmen Sandiego https://t.co/eKH6er45yd","@Justine___C","pop culture",
"@SmutFennec ahh Carmen Sandiego. Never could get her hat right. Its so weird lookin.","@CrazyNekoZ","style",
"Best 90s computer games/ education games 1. Backyard sports 2. Pajama Sam 3. Math blasters 4. Reader Rabbit 5. Carmen Sandiego","@Chauber7","nostalgia",
"Is someone in the audience wearing Carmen Sandiego drag? 😃 #DragRace","@WootiniGG","style",
"That time I found both of them. #waldo and #carmensandiego #cosplay from #NYCC 2014 https://t.co/pKUlkQUgre","@evildirtydave","style",
"Eichorst looking like Carmen San Diego in that hat and trench coat. #DatStrain #PFStrain","@LBrothersMedia","style",
"Attention Kim Kardashian: you are not Carmen San Diego..stop wearing trench coats ✋🙈","@ash_steurer72","style",
"Facebook Hides Your Exes, Carmen Sandiego Returns on Mobile… [Digest] https://t.co/IhVMESVLqt #Science #MakeUseOf","@PakStuff","pop culture",
"Carmen Sandiego with @HereIsGina ? 27 year old me's hero is meeting 7 year old me's hero. https://t.co/XjVQHareWk","@Victoria_Ugarte","inspiration","x"
"Had a dream I was Carmen Sandiego so I brought my trench coat out today","@eesuhh","style","x"
"@InPartyConflict I have not. But ive been planning on building a campaign set around the old where in the world is Carmen Sandiego. World exploring and plane hopping.","@critacademy","travel",
"I suddenly want a Magic School Bus/Carmen Sandiego crossover where the twist is Ms. Frizzle was Carmen the whole time.","@TheChrisPranger","pop culture",
"Carmen Sandiego is the perfect blueprint for a honey.Mysterious walks on the wild side and likes to travel. #WhereInTheWorld","@therealjames20","travel",
"Gina Rodriguez donning red fedora and trench coat of Carmen Sandiego https://t.co/4ZB2kYf0Nr https://t.co/x4Yy3xcYQN","@TechSigma_","pop culture",
"Lady Gaga Swiped Her Hat And Trench From Carmen Sandiego’s Closet https://t.co/xSILqChY3Q","@wavesharing","style",
"@chrissyteigen love the idea of you snooping around passengers for the scoop w ur big black Carmen Sandiego hat","@jasminedumpling","style",
"@BigBird oh, & did you see a woman in a red hat & trenchcoat at Dragon Con? #CarmenSandiego","@JeremiahLiles1","style",
"How to tell the difference between #AgentCarter and #CarmenSandiego. We're more than a red hat. https://t.co/jrXjDr5s87","@Madi2theMax","style",
"I'm just gonna say it: Full Metal Alchemist cosplay looks like Carmen Sandiego #Egx #Oldmanreference","@RedbeardtheGame","style",
"They need to come up with a game called ""Where in the world is @715sLOhTZing driving his Honda this weekend"" #CarmenSanDiego","@Ham0fficial","travel",
"I blame #CarmenSandiego for making me want to travel so much ✌️🌎","@pars_15","travel","x"
"Netflix is betting on ‘90s kids nostalgia for learning with upcoming lineup https://t.co/oGetVloRDR via @Polygon","@watchalot_cast","edutainment",
"The hat. Carmen Sandiego? https://t.co/OlXmE4vqtg","@tlcesq","style",
"@lilithlw wonder if Carmen San Diego ever got jet lag during all her international travels tho","@NoamMintz","travel",
"Pretty happy with Emma and my couples costumes: Carmen Sandiego and Waldo https://t.co/4dvAqr5pOF","@BantamSam13","waldo",
"When u download Carmen Sandiego instead of packing for or trip in 8 hours","@Angiee_Otero","pop culture",
"Rasheeda is giving me some ""Carmen Sandiego"" teas with that outfit, and I LOVE IT! #LHHATL","@SimplyPaigeB","style","x"
"Where in the World Is Carmen Sandiego? - Becoming a secret travel agent #33c3 https://t.co/7MmpoQh6IC","@c3talkguide","travel",
"Because of the Carmen Sandiego games, I learned so many names of European currency now obsoleted by the Euro. Also I think some of the countries and borders changed too since I played.","@arc315","edutainment","x"
"No One In the World Actually Ever Found Carmen Sandiego...Until Now! https://t.co/5mK8ZEvqtl #edchat #edtech","@MsMensing","pop culture",
"Coolest hat? #CarmenSandiego #Undertaker #MaryPoppins #DarkwingDuck #Kuzco or #ScroogeMcDuck? #Funko https://t.co/LkO7y6I7LM","@FearlessRiOT","style",
"@BrooklynBettyB you're making it very difficult lol. How is your trip around the world, Carmen Sandiego?","@dcmadness202","travel",
"(were those white carmen sandiego hats?)","@TONYCnimm","style",
"spirit halloween is selling a knockoff carmen sandiego costume im so tempted","@wingsofdiamonds","style",
"@edgarwright this is like ""Where In The World Is Carmen Sandiego?"" Spoiler, she was always in Brazil.","@TheKarenMelgar","pop culture",
"It ain't Where I been but a Where I'm bout Ta go!! Let The Journey Begin! #CarmenSandiego http://t.co/k8Ts56PLNN","@Reshika_Renee","travel",
"Waiting for inspiration to strike so I can type a really profound tweet and get recognition for my insight. The only thing on my mind: Why did they stop making Carmen Sandiego games?","@Imitation0fLife","pop culture",
"@Dulce_TaughtMe super amazing you're carmen sandiego and wonder woman in one","@luxuriously_g","feminism",
"i think i just saw carmen sandiego driving","@eddiepo0","fashion",
"#FollowFriday #FF @RealityGlitch because he found Carmen Sandiego but then they just traded hats? I dunno it was kinda weird.","@Nintendo_Legend","style",
"@sanc Carmen gets lost easier then your car keys and the remote: Where in the sofa cushions is Carmen Sandiego.","@Battybuddy","pop culture",
"@BaileeMadison @satishere @RhysMatthewBond @hallmarkchannel That's back when you were wearing your Carmen Sandiego outfit. :)","@canadajoe1","style",
"@UnburntWitch Throw on a red fedora and you're Carmen SanDiego!","@davidkreutz","style",
"Joseline was in a Carmen Sandiego outfit....this explains everything. #LHHATL","@Karnythia","style",
"But Carmen Sandiego would be an awesome Overwatch hero","@RynnyRyn","pop culture",
"@johncampea Hey John alot of talk lately about having a female action hero.How about a live action Carmen Sandiego film? Your thoughts?","@ElzieQ","inspiration",
"Already have my next Halloween costume planned out. Carmen Sandiego. My date&39;ll go as Where&39;s Wally. Always wanted to do that","@nelsondimpissac","waldo",
"I might make a #CarmenSandiego homage in #Contestant25 after hearing that iconic song by @RockapellaMusic. #JustSaying #writerslife","@PlayerWM86","rockapella",
"CARMEN SANDIEGO WORD DETECTIVE ARTHUR'S COMPUTER ADVENTURE AMAZON TRAIL 3RD EDITION READER RABBIT MY WHOLE CHILDHOOD ALL AT ONCE","@JessWhineygirl","pop culture",
"Already have my next Halloween costume planned out. Carmen Sandiego. My date&39;ll go as Where&39;s Wally. Always wanted to do that","@nakeshadicke","waldo",
"Where in the world is Carmen Sandiego? #halloweencostume https://t.co/yQ7p7e1Oy3","@zooma56","style",
"Lebron travel more than Carmen San Diego","@kenanbell","travel",
"""Yes, you have to wear the hat."" Page 2: https://t.co/gfDecUyJVm #carmensandiego #gumshoes #webcomic","@allilevine","style",
"Carmen Sandiego. I think I'm gonna be Carmen Sandiego for Halloween.","@DanielleRMonk","style",
"@McMeatymeat literally the bEST part about computer class was when we finished learning boring programs n they were just like 'OK PLAY CARMEN SANDIEGO '","@McMeatymeat","nostalgia",
"Did everyone my age learn what Spelunking was from Carmen Sandiego?","@kebophoto","edutainment",
"Who has a bigger fedora Darkwing Duck or Carmen San Diego?","@DJ_Digipig","style",
"Our vacations are beginning resemble an episode of Where in the World is Carmen Sandiego. @MikeCromwell2 🚂✈️","@tashamcisaac","travel","x"
"[Mashable] Gina Rodriguez donning red fedora and trench coat of Carmen Sandiego https://t.co/9ITEjr3aI7","@netzlesen","pop culture",
"A3) learned a lot about the world via Carmen San Diego as a kid. #guildchat","@LnDDave","edutainment",
"Another great post from the vault: Educational Games of The Past: Carmen Sandiego http://t.co/nSobkyt8Ru http://t.co/aSqGGeiRtx","@MaglomaniacInc","nostalgia",
"Gina Rodriguez donning red fedora and trench coat of Carmen Sandiego https://t.co/qsYAgq6sIM https://t.co/xsaQOmjdGx","@fbancoff","pop culture",
"i used to think carmen sandiego was a man because ""car-man"" and also sandiego seemed manly to me??","@chirasul","pop culture",
"Netflix is betting on ‘90s kids nostalgia for learning with upcoming lineup https://t.co/ULmrUTXdiU","@talkdaybright","edutainment",
"Just saw the best couple costume downtown: Waldo + Carmen Sandiego. #halloweengoals","@AllieBamma","style",
"I learned this from playing ""Where In Time Is Carmen Sandiego"" https://t.co/c5b3Wxb1tf","@TheHoustangeles","edutainment",
"I LOL when I heard ""She's Carmen Sandiego, she travels around the world."" They respond with ""I do too, I'm going to Puerto Rico next month.""","@laxrafs","travel",
"@BeijaMVelez Ok Carmen Sandiego 👌🏽 I see you! Take flight, live in the air, keep busy. Keep hustling","@matny","travel",
"@stocktonrestore noticed some ""where in the world is"" banter. For the record, I was the ""Carmen San Diego"" champ of Elim Elementary...","@leejneves","nostalgia",
"@leighalexander I love your Lo-Fi LPs for seeing games I never played, but the Carmen Sandiego one is such a happy nostalgia trip. :)","@stoppableforce","travel",
"VIDEO: 10 Reasons Where in the World Is Carmen Sandiego? Was the Best Educational TV Show … https://t.co/DxtAfjFHMO https://t.co/inRR4ZEgPn","@MisonoAlex","edutainment",
"✈️✌🏼️ That time again #JetSetter #CarmenSanDiego #CatchMeIfYouCan #CatchUp","@RoxieMarroquin","travel",
"Where in the world is Carmen Sandiego? 2nd and Charles. Segundo y Carlos for my Latin Lovers out there. 😘 #lookingforWaldo","@AnIndigoGal","pop culture - waldo",
"Who ever can build a micropub client that allows me so publish save files from games on https://t.co/MkEivfMeV2 to my website will be my hero.....Power or computer has shut off every time my kids play Carmen San Diego (https://t.co/k6Q3BsL7dA)","@jgmac1106","pop culture",
"Trying to teach my game design students the amazing-ness of Where in the World is Carmen Sandiego!? #90skid #gamedesign https://t.co/A2HQYKcEJa","@i_jessicajones","nostalgia",
"Gina Rodriguez donning red fedora and trench coat of Carmen Sandiego https://t.co/W9TIS7leWj","@PedroArtino","pop culture",
"Netflix's Live-Action Carmen Sandiego Will Star Gina Rodriguez (via #InStyle) #celebrity #entertainment #lifestyle https://t.co/SLUQTMSO4d","@KILLPOPCULTR","pop culture",
"I travel more than Carmen San Diego during the holidays","@Mr_Tanner23","travel","x"
"Alright. The Chief from Where in the World is Carmen Sandiego has been postponed. For @GaymerX, I will bring back my Ness cosplay.","@kungfulasers","style",
"Great question, where in the world /is/ Carmen Sandiego? Maybe this administration will learn some geography during their search? https://t.co/zw0sojCPp4","@ElucidoVia","search",
"@AshleyCsanady commence giant Carmen Sandiego hat memes","@Melanie_Paradis","style",
"@I_Dont_Know_Her LMAO and also for jacking Carmen San Diego's style?! #WhereIntheWorldisCarmenSanDiegovibes #youindangergirl #dragandgagher","@VetDepot","style",
"@b_rad_hill Tbt to my first Halloween date party & dressed up as Carmen Sandiego","@L__Pellegrino","style",
"#FirstTimeISawMe was Carmen Sandiego Not many latino women in the media back then and it was educational as well!! Such good memories 😌 https://t.co/faD9vF1jlw","@ArtofMichi","latina","x"
"My Sunday Funday hat. Kinda feels like I'm channeling my inner Carmen Sandiego... http://t.co/mE9KDZhBWC","@EMIIMUSIC","style",
"@wittysobriquet We fought for the computer with the 3 1/2 floppy drive in school because it had Carmen Sandiego, but I did a lot of bison hunting on the trail. Absolute classic.","@GeekLukeG","pop culture",
"@BrendaPayton13 @Sean20164889 Loved that Carmen Sandiego outfit!","@9ERSorBUST","style",
"""This is sorta a busted trip, we never found Carmen SanDiego""","@gabby_sartori13","travel",
"@tarasueme @ellis_writes I’m thinking I might have to cosplay Carmen San Diego.","@awkwordly","style",
"Every time I see Agent Carter in the red hat, I hope she turns rogue and takes the name Carmen Sandiego @ElectricFancave @nerdsrocket","@Dr_Funkin","style",
"VIDEO: 10 Reasons Where in the World Is Carmen Sandiego? Was the Best Educational TV Show Ever https://t.co/z6rf8Vd1y4","@cop_terri","edutainment",
"When the internet gets mean, I miss the days when the worst thing I experienced was landing at the wrong airport in Carmen San Diego.","@anniefdowns","pop culture",
"do you think our generation is so travel centric due to growing up w/ shows like #CarmenSandiego? http://t.co/qWncqRi6Yl","@ptau","travel",
"Today I dressed up as Carmen Sandiego, and completely independently of that, my classmate was Waldo. Beautiful unexpected things do happen.","@PetrichorInF","style","x"
"@Spacekatgal We also had Carmen Sandiego, snap bracelets, Akira, Calvin and Hobbes, The Adventures of Pete and Pete, and the godlike Pro-Stars (Bo, Wayne, and Michael).","@chrispepp","pop culture",
"Traveling by train through the Wild West 100 years after the gold rush. Where in time is Carmen Sandiego.","@penouilh","pop culture",
"@TheJessicaJames why is it that when you wear those hats you look so cute and when I try I look like Carmen SanDiego? 😒 #perfection","@GabriellaaaaaC","style",
"""She was a flash of crimson across a security camera, listless brown eyes and a passionless pout hidden under a slanted fedora."" The first line from what was Carmen Sandiego fanfic I wrote for a creative writing class in college. She steals something from the Cloisters.","@ConStar24","pop culture",
"Carmen Sandiego's Travel Agent #NoWayThatsAJob","@GoddammitTJ","travel","x"
