"text","handle","category","star_tweet"
"Gina Rodriguez, ‘Stranger Things’ actor, to lend voice to Netflix’s ‘Carmen Sandiego’ https://t.co/B6D5vbOild https://t.co/9NeUpNgwEE","@webandgraphix","cultural-icon",
"@pghguyinva that baton is better traveled than Carmen Sandiego","@suz_b31","travel",
"A nurse, a superfan, a farmer, Carmen Sandiego, the Queen, a jazzy accountant, & Taylor Field would like to wish you all a #HappyHalloween https://t.co/uoqEMOQLhs","@SaskCanola","fashion",
"It was a prize I won for being on a traveling version of carmen sandiego TRUE STORY.","@gpike_","cultural-icon",
"I first learned about feminism and geography in the same place: Where in the World is Carmen Sandiego?","@juliarebeccaj","edutainment","x"
"@Jenn_Melody lmao ima get you a red trench coat with the matching fedora for Halloween your carmen sandiego thats it","@Pompous_","fashion",
"starting a new hashtag for @c_colicchio13 and my trip to Europe, honoring Carmen San Diego it will be #WhereInTheWorldAreDrewAndCJ","@drewedborg12","travel","x"
"@TheONLYValMac On a beach, feet up, with Carmen San Diego....Throwback “@TheONLYValMac: @JayREllis now where are you? :)”","@JayREllis","travel",
"Netflix’s ‘Carmen Sandiego’ Series Gets Premiere Date https://t.co/z33yMNh7EH #Netflix https://t.co/UfMpb7jkDt","@HipHopWired","cultural-icon",
"Where in the World Is Carmen Sandiego? Becoming a Secret Travel Agent https://t.co/frqPYTSqU5","@ryf_feed","travel",
"I get all my science related info from Bill Nye and all my foreign policy info from Carmen San Diego. Both are equally credible. @PatandStu","@don92064","edutainment","x"
"What the hell does a chocolate chip cookie in a Carmen Sandiego hat gotta do with #Empire?","@Dreams_on_Paper","fashion",
"Netflix Developing Live-Action Carmen Sandiego Movie https://t.co/zwuKhyQ06Z","@Gamerview_reach","cultural-icon",
"@SharonHayes @TalkNerdyToMe72 I actually dressed as Carmen Sandiego one Halloween and ran into a Waldo 😂","@syd_viciously","fashion",
"@ThatPaigeGuy mr inspiration 😂 cannot wait until you finish that Banks I want it, it reminds me of Carmen Sandiego 🙌","@4wardthoughtz","cultural-icon",
"Entertainment Wrap: Gina Rodriguez To Produce And Star In Live-Action ‘Carmen Sandiego’ Movie For Netfli https://t.co/yEAuFLH52O","@983TheCoast","cultural-icon",
"Ah yes, the episode of X-Files where Scully botches a Carmen Sandiego cosplay and flashes a copy of TMNT instead of her badge. A classic!","@ArchivistPrime","fashion",
"Gina Rodriguez donning red fedora and trench coat of Carmen Sandiego https://t.co/vkzFchiV4s","@rumanmahmudbd","cultural-icon",
"@netflix can we get Carmen Sandiego?","@OffHandComments","cultural-icon",
"Back in my day we had to look up our Carmen Sandiego clues in a two inch thick almanac. Kids these days... #retrocomputing #appleII #apple2 https://t.co/oj4tyK7iAL","@nathanpryor","cultural-icon","x"
"who's producing this Netflix Carmen Sandiego thing?","@PIX3LP3T","cultural-icon",
"All this news about #CarmenSandiego reminds me of #LynneThigpen. @Netflix_CA @netflix @HereIsGina https://t.co/vcI7ai7qCA","@alexismclaren","cultural-icon",
"Where in the world is Carmen Sandiego @Jawanhawk?? 🤷🏽‍♂️🤷🏽‍♂️","@mtyrone","cultural-icon",
"Permanently inspired by Carmen Sandiego. 💄#always #mylook #hat #lipstick #brunette #blackandwhite… https://t.co/9EgGlrQz5f","@sampulon","fashion","x"
"@adamlambert Halloween costume? An Undead Carmen Sandiego, perhaps? ;p","@TamaleChic","fashion",
"@SoccerFanKevin @DJCPI I just finished on Carmen Sandiego which is a Netflix animated series coming out next year.. I’m not allowed to speak on the details but I think it’ll be pretty good (I am biased, obviously)","@amandawtwong","cultural-icon",
"Netflix's New 'Carmen Sandiego' Series Poster, Release Date https://t.co/UZ6I1NoTF9","@bleedingcool","cultural-icon",
"@NJTRANSIT buses are harder to find than Carmen San Diego.","@dylan_mcvillain","cultural-icon",
"Also, the only reason my profile pic is what it is is because that jacket and hat make me look like Carmen San Diego. Man I loved that game.","@katiapsyche92","fashion",
"Netflix plans live-action 'Carmen Sandiego' film with Gina Rodriguez https://t.co/h0GcyuSdt6","@diggtech","cultural-icon",
"New on Quartz: Netflix is learning how in the world to play the franchise game with Carmen Sandiego https://t.co/8EKV8akv9v","@phooll123","cultural-icon",
"We should make educational games so the next generation has their own Carmen Sandiego, Oregon Trail, Mathblasters, Cross Country Canada, etc","@FluffyPira","edutainment",
"Darryl's father's name is Carmen San Diego","@purelygenius","cultural-icon",
"Fire up your old PC and get ready for some grade A edutainment, because new 'Carmen Sandiego' is coming to Netflix: https://t.co/dnPdKyALOn https://t.co/z6cERcVEk3","@pedestriandaily","edutainment",
"@b4byh4ndz My dream Halloween costume is Carmen San Diego!!!! And you get to be her every time it’s cold wtf!!!!!!","@brrriah","cultural-icon",
"Carmen Sandiego Lore. This woman was an international woman of mystery with a penchant for historic monuments,","@Thatgirldavis","cultural-icon",
"#Daria+#CarmenSandiego=🖤. . Bringing back the #90s with my #womancrushwednesday @hopejane for #blackheartsburlesque! 👓 🌍 💋 . . #cosplay #dariacosplay #carmensandiegocosplay #fiercefemmes… https://t.co/chsnahbqNX","@QueenieBurlesk","fashion",
"“Carmen Sandiego” reboot voiced by Gina Rodriguez coming https://t.co/YgWid64J84 via @W3LiveNews #Netflix #GinaRodriguez #CarmenSandiego","@W3LiveNews","cultural-icon",
"Some times I get nostalgic for the old school computer games you'd play on the old Macintosh computers at school like OregonTrail, that nursery rhyme game where you had to put all the characters back in their stories, & Carmen Sandiego... 😭 i just want to play CarmenSandiego","@CmndrLex","edutainment",
"Netflix plans live-action 'Carmen Sandiego' film with Gina Rodriguez https://t.co/oS5GQMMnN2","@willwphoto","cultural-icon",
"Bedelia going for Carmen SanDiego-chic, there #HannibalPremiere","@StillDefending","fashion",
"@RadioKayla I can't see the rest of the hat but in that outfit I picture you as Carmen Sandiego.","@vitothebigguy","fashion",
"@kevinrichardson I love that you're wearing the exact outfit as last Monday with the exception of that Carmen San Diego hat lol","@nickytoronto","fashion",
"Also, I think I just found Carmen San Diego on the M60 bus to LaGuardia.","@capetownbrown","cultural-icon",
"#TBT #Halloween #AlmostThatTimeAgain #CarmenSanDiego #IdentityThief… https://t.co/b4zIuE6syC","@DerbyCity_Chick","fashion",
"Where in the world is Carmen Sandiego?","@danaaamo","cultural-icon",
"Happy #Halloween 🎃 🎃 🎃 #whereswaldo #waldo #carmensandiego #costume #ootd #wiw #wiwt #instagood… https://t.co/asn1JnA2ZI","@soliloquously","cultural-icon",
"Carmen Sandiego is back to her old tricks on iOS: Well she sneaks around the world, from your iPhone to your iPad... The geography-ob...","@itsme_sadhvi","cultural-icon",
"Gina Rodriguez Voicing Carmen Sandiego in Netflix Show https://t.co/eqYWTU8hbG #Games https://t.co/Gi1spi4cDz","@News_VideoGame","cultural-icon",
"""[Carmen Sandiego] has been one of the most overwhelmingly positive, progressive, and diverse edutainment franchises in history, and it almost single-handedly defined what an educational video game should look and feel like."" https://t.co/BV0hjfRkUL","@SellersBest","role-model",
"@RadioAmy @merib yeah yeah yeah!!! 🎉🎉🎉 (but where is the Carmen Sandiego hat?!)","@mikesaenzsays","fashion",
"Where in the world is #CarmenSanDiego? She's performing at #VelvetLounge #DragBrunch! PS: She's also #WonderWoman! https://t.co/axUyIE7QwX","@WinniPaul","cultural-icon",
"When I was 8 I was the first kid on the block to beat Super Mario Brothers and Kung Fu. Learned every country's flag with Carmen SanDiego. https://t.co/QKahpzWHxd","@microscope_eyes","cultural-icon",
"Chuck Norris always knows the EXACT location of Carmen SanDiego.","@AngelJe69541804","cultural-icon",
"@untaintedtea Me, weeks ago: [draws Carmen Sandiego] I hope they do something new with her soon she's the best Netflix: I AGREE","@untaintedtea","cultural-icon",
"VIDEO: 10 Reasons Where in the World Is Carmen Sandiego? Was the Best Educational TV Show Ever https://t.co/ftUvspgSc4 via @People","@Jill_Chodak","edutainment",
"Netflix finds 'Carmen Sandiego' for its latest reboot https://t.co/xxIlh0PP5D #Tech https://t.co/n4ZsURhvxC","@FrostbiteWorld","cultural-icon",
"📷 ginarodriguez-news: Netflix Reboots ‘Carmen Sandiego’ With Gina Rodriguez Where in the world is... https://t.co/083RrsqpSe","@djeterg19","cultural-icon",
"Do it, Rockapella: Netflix is Making a New ‘Carmen Sandiego’ Show https://t.co/gecT57ce9q #Geek #Technology","@TweetTechnoFeed","cultural-icon",
"Where In The World Is Carmen Sandiego? 2001 PC MAC CD geography game https://t.co/6i86meDA8C https://t.co/rwOXkRpwBQ","@VidGame33","cultural-icon",
"Get a first look at Netflix's ""Carmen Sandiego"" animated series https://t.co/oebGWYYUce","@RobertMWalker2","cultural-icon",
"Carmen Sandiego is returning as an animated children’s show on Netflix https://t.co/g1V4YvucEm via @Polygon","@doowah_diddy","cultural-icon",
"Netflix Is Bringing Back 'Carmen Sandiego' With Gina Rodriguez Playing the Lead @GioRivera say what?!? https://t.co/UTpWmk4Bnh","@valsbytes","cultural-icon",
"""Gobi brave in Inner Mongolia"" -The Chief, Where In The World is Carmen San Diego","@Danielleri","cultural-icon",
"""Chuck Norris is the reason Waldo is hiding, and why Carmen San Diego can't be found.""","@ChuckNorrsFacts","cultural-icon",
"@maydaymindy9 Girl,let me find Waldo first. Then this Carmen SanDiego is missing somewhere in the world. First things first!","@BrettMaier3","cultural-icon",
"Netflix's CARMEN SANDIEGO Animated Series Gets a Poster, Seven New Images, and a Premiere Date https://t.co/OvFFCgQNTL https://t.co/qXEpDHQ94H","@punga127","cultural-icon",
"Where in the world is Carmen Sandiego? Halloween / @StephLindquist's birthday, New York, 2009. #TBT http://t.co/PyYaNX6b4k","@TheJennyLam","fashion",
"@CowboyCentaur @booday I once modified a red cowboy hat from the 99¢ Store to be part of my Carmen Sandiego cosplay.","@ComicsCourtney","fashion","x"
"I think Carmen San Diego is the baddest redhead to have ever lived, personally 👐.","@DatDamnDarius","cultural-icon","x"
"Pizza hut's logo is a red hat 😂😂😂 y'all ever thought about that?! Where's Carmen Sandiego? She's been running Pizza Hut lol","@JaylnOfficial","cultural-icon",
"Jane The Virgin’s Gina Rodriguez To Star In New Netflix Series Carmen Sandiego https://t.co/Qj02IoaIDT https://t.co/Ghrgr0HlgR","@kingDewale","cultural-icon",
"Carmen San Diego in disguise w/ a different color hat. natgeo's photo http://t.co/u0GvbkGX0S","@IHStreet","fashion",
"@HereIsGina @netflix Oh man. OH MAN. Carmen Sandiego as a Lupin III-esque gentlewoman thief show would be the bomb-diggity","@senabryer","cultural-icon",
"The look like CARMEN SAN DIEGO WITH OUT HER HAT HAHAH http://t.co/TTmkOimqTh","@_FatimaRivera","fashion",
"We had another in us- and hopefully more to come. This #game is way too much fun! What are some #games that you have serious #fond #memories of? #LetsPlay #carmensandiego #geography #Videogame #YouTube #sega #Nintendo #Subscribe #comment #firstdayofspring https://t.co/DYr72t8rrt","@2d1couch","cultural-icon",
"@LORDHEFNER Was Carmen SanDiego Afro Latina? Because that’d be my vote","@Pyrowoods","role-model",
"@meggymish @epeterd916 @iamisgo11 @IhszNaomi @GuyFawkes1984 @NestorRedux @GoldSaltFlour @NAVYDAWG6119 @TheRogue_Elf @BeccaMick @AV_snarkeyes @ScarilyCheerful @CarrPirateKing @wraithburn @AWGecko @vetjr89 @El__Bohemio @stabyoulots @IntellectShorty @deans0114 @heartsabustin @gr8357 @yourfaveclete @djm1992a @priebjm @secjr112 @camiila_mua @Sheraoftexas @AllanKirkhart @Shrike1988 @EricMertz_KC @bitterclinger4e @NucMM1retired @LadyJessMacBeth @theBaytownsub @StephenLHall @Sjanderson86 @theone20152016 @MrBoTheCat @StacyDmomof5 @JHWalz32 @repub9989 @MeerkatYitz I adored the Carmen Sandiego mythos. I was that kind of geek. There was even choose your own adventure kind of books for her. One time my dad bought me an interactive cassette tape game my family played during a road trip. You’d have to pause and decide an answer with the fam","@GentlemanRascal","travel",
"Where in the world is Carmen Sandiego? #cosplay #classic https://t.co/W0onypmvuI","@StephMurphy22","cultural-icon",
"Stranger Things Star Joins Netflix's Carmen Sandiego Series https://t.co/DPc1E7Htnp","@maths_games","cultural-icon",
"Carmen Sandiego Returns https://t.co/wxvUUyjdnW https://t.co/VxN6AS5iA0","@medicalbook1","cultural-icon",
"@KarenDavid @RobertBathurst Love that hat! It's like Carmen Sandiego & Agent Carter combined!","@MediaKAT1912","fashion",
"New article (The First Images of Netflix's Carmen Sandiego Are Here) has been published on The Daily Digest - https://t.co/gUPNKOuJpL #WalkAway","@TheDailyDigest","cultural-icon",
"@joshchafetz (You have to draw ""Tim"" out to four syllables to make it scan with the Carmen Sandiego theme, just FYI)","@joshchafetz","cultural-icon",
"Gina Rodriguez To Voice Carmen Sandiego For Netflix https://t.co/F23U4FVBeC #breakingnews","@BreakingNewss3","cultural-icon",
"Apple IIe Bird vs Dr Jay Apple IIgs Carmen Sandiego NES Super Mario Bros Gameboy Dr Mario x86 Xwing SNES Madden Pentium Sim City 2000 N64 Smash Bros PS2 GTA Xbox Battlefront Wii Mario Galaxy Xbox 360 Burnout PS3 LittleBigPlanet Xbox One Battlefront https://t.co/SmnIBHAtiZ","@GeekByExample","cultural-icon",
"@JacobAWohl I dunno Carmen Sandiego, I bet you can give them some ideas..... Go go gadget tin foil hat!!!","@AmadeusHack","cultural-icon",
"@sarocthemc @rhymesayers Carmen San Diego cosplay?","@frightpod","fashion",
"Hold up...they bringing Carmen Sandiego back on Netflix? It's suuuuper lit!","@MikelWalker_","cultural-icon",
"Porsha looking like a Fashion Nova Carmen Sandiego. #RHOA","@aboveyou_isDW","fashion",
"This Friday at @geekyteas, Carmen Sandiego aka @itskelseylane reveals where the hell she’s been! #cosplay #comedy #standupcomedy #carmensandiego #burbank https://t.co/SZd42VDwwK","@CosplayComedy","fashion",
"Netflix is making a Carmen Sandiego movie with Gina Rodriguez - CNET https://t.co/OSLSv81lbY","@divimixmax","cultural-icon",
"Who in the world is she?(Carmen San Diego I see you) And what is she wearing? https://t.co/q2IzxcFzRe","@kylevoumard","fashion",
"Where in the World Is Carmen Sandiego TV Show Videos >>> totally awesome plz. http://t.co/6Q5U5nW9Za","@astyrred","cultural-icon",
"Gina Rodriguez, ‘Stranger Things’ actor, to lend voice to netflix’s ‘Carmen Sandiego’ https://t.co/OZ6IRNp4xN","@Charles_Valette","cultural-icon",
"Carmen Sandiego Returns in a New Educational App https://t.co/Ak9KGiKkRx https://t.co/1HTzDx8Qpp","@TiffanyawootenA","edutainment",
"Carmen San Diego outfit inspo #ootd #badhairdontcare #hat👒 #sfstyle @ Pacific Heights, San… https://t.co/TvuiWzs4jv","@VisitingVntg","fashion",
"Netflix plans live-action 'Carmen Sandiego' film with Gina Rodriguez https://t.co/aep5GXk4j0 via @engadget #netflix #carmensandiego","@jonathasrr","cultural-icon",
"Agent Carter walking up in places with a Carmen Sandiego fedora. You getter get it!","@ConStar24","fashion",
"I'm so excited about Carmen Sandiego on Netflix. This gumshoe is ready!!","@OffHandComments","cultural-icon",
"Growing up I had educational TV. Reading rainbow, Bill Nye the science guy, magic school bus, Carmen San Diego. Children's TV now is 🚮","@JENNY4RMTHEBLOC","edutainment",
"📷 hypable: Netflix developing new ‘Carmen Sandiego’ animated series, Gina Rodriguez to star Jane the... https://t.co/r380jbhRf1","@chrysalisamidst","cultural-icon",
"Contemplating Halloween. Thinking about resurrecting 'Rick as Carmen Sandiego', which is a thing that happened once.","@rklipman","fashion",
"""Congrats! Have u been traveling with Carmen Sandiego, you're a world traveler!"" (9 out of 10! ) http://t.co/tOf4AEI2Iv via @play_buzz","@Beldodie","travel",
"Also Bedelia's blue Carmen Sandiego outfit. Give it to me.","@Scarimonious","fashion",
"Netflix sets release date for 'Carmen Sandiego' animated series starring Gina Rodriguez 🙌 https://t.co/dNdnJ5wiGg","@Hypable","cultural-icon",
"Another great post from the vault: Educational Games of The Past: Carmen Sandiego http://t.co/nSobkyt8Ru http://t.co/aSqGGeiRtx","@MaglomaniacInc","cultural-icon",
"#fashion #beauty #trends Rihanna Gives Patent Leather Carmen Sandiego Vibes at the Grammys https://t.co/pHq83W4661","@TheB4DASSGirl","fashion",
"How Carmen Sandiego accidentally became an educational game icon https://t.co/F6ev0EDjjq","@KaseyGamez","edutainment",
"It's official: Carmen Sandiego is getting her own animated Netflix series https://t.co/5BdmOiQNUQ https://t.co/zpFP4OoNux Gizmodo","@smiewl2","cultural-icon",
"Amelia Earhart, Carmen San Diego, tupac, all trying to drive somewhere on 55s right now","@TheCaroliKid","cultural-icon",
"⚡️ “Netflix greenlights a Carmen Sandiego series” https://t.co/JZEgqBo6Yc","@ReenaMJSingh","cultural-icon",
"VIDEO: 10 Reasons Where in the World Is Carmen Sandiego? Was the Best Educational TV Show Ever https://t.co/TKh4OBuhbL #celebrity #gossip","@celebnews1456","edutainment",
"Oh no I hope I don't end up dressing like Carmen Sandiego. I cannot believe that my secret muse, my angel of fashion goals, is Carmen m'fin Sandiego.","@ASwampWolf","fashion",
"It's Official: Carmen Sandiego Is Getting Her Own Animated Netflix Series https://t.co/npiqASFzss","@louispr","cultural-icon",
"@jameelajamil @Disney I was thinking I’d love you to play Carmen Sandiego but with a twist. She/you steals the art & returns it to the rightful owners 😆","@CurvyZoe","cultural-icon",
"#KidTech | Carmen Sandiego resurfaces on Netflix https://t.co/8azFWzmB2s | @Kidscreen https://t.co/k6jd6vIJjf","@DinkyNerds","cultural-icon",
"The perfect outfit for live action Carmen Sandiego https://t.co/fBTV83y8WO","@VERWHO","fashion",
"@alerivera35 this tweet represents my struggle of wanting to be Carmen San Diego for Halloween, but not doing it cause no one will get it","@Titoro_","fashion",
"The National Archives at Kew house the Domesday Book, compiled at the order of William the Conqueror, an important character in ""Where in Time is Carmen Sandiego?""","@jenningsjaxfl","cultural-icon",
"I always found her in Sicily. #carmensandiego #netflix https://t.co/3abnimVibF","@ericbaranda","cultural-icon",
"@PushinUpRoses @MerryLandOfAus In my computer class all we did was learn to type and play Carmen Sandiego. No etiquette at all! D:","@AprilVonLon","edutainment",
"Netflix’s Carmen Sandiego Animated Series Adds Stranger Things Star https://t.co/eMAPSyMWLL #imdb #movies #hollywood https://t.co/EFR7qV8FNi","@imdbcenter","cultural-icon",
"I saw a guy with a bright red fedora and matching shirt at BART and all I could think was that I found Carmen Sandiego.","@mizunotic","fashion","x"
"Also, there's a 90s Pride Cosplay Ball @TiltToronto this weekend and I might just bust out ye old Carmen Sandiego Cosplay.","@krissy_myers","fashion",
"#Woopra Where in the World is Carmen San Diego: How to Engage Customers Along the Journey. Read Blog: https://t.co/ia1ir3hVTV","@App_sw_","cultural-icon",
"@angle1851 I'm loving this adventure you guys are on. Did you find Carmen Sandiego yet?","@LandonDowden","travel",
"It's dreary outside, so I think it's the perfect time to chase #CarmenSandiego around the globe. I'd… http://t.co/5KQYmzxfEy","@GX3_Dawn","travel",
"""Gina Rodriguez donning red fedora and trench coat of Carmen Sandiego"" https://t.co/zXzfbnJC4F #Mashable #News","@TanyaReddy9","cultural-icon",
"anyways I'm trying to download a carmen sandiego game for my nieces and the only I can get it is so!?!?!?!?!","@TraseroDSeungri","cultural-icon",
"I'm excited for this. // Netflix Reboots 'Carmen Sandiego' With Gina Rodriguez https://t.co/LMrI5SPnTS via @thr","@NEligahn","cultural-icon",
"Chuck Norris always knows the EXACT location of Carmen SanDiego.","@KumpulaLinnea","cultural-icon",
"@AminESPN @CassidyHubbarth Cassidy is a world traveler. She's like where in the world in Carmen San Diego. Bristol last night, LA today.","@TheRyanFeldman","travel",
"My grandmothers had encyclopedia sets, I had an almanac that came with Where in the World is Carmen Sandiego and we also owned Microsoft Encarta growing up.","@DameDrFoxyB","cultural-icon",
"Madeline, Carmen SanDiego, Chiquita Banana, Selena. Halloween costumes I've kept on my backburner for years... Which one to finally execute?","@_sailormoody","fashion",
"@dyeknom are you really with Carmen Sandiego?","@TKtheknight","cultural-icon",
"You could be Carmen Sandiego... #vintage #map #jacket #whereintheworld #carmensandiego #halloween… http://t.co/ZNU3pCOgFI","@VintiqueLA","fashion",
"Gina Rodriguez cast as Carmen Sandiego In Netflix Live-Action Movie https://t.co/CkEAsyI1hB","@GeeksOfColor","cultural-icon",
"Khloe Kardashian is Giving Us Modern Day Carmen SanDiego at LAX @KhloeKardashian #Kardashian https://t.co/j1FLf3VmCb #style #fashion","@StyleBySheena","fashion",
"Netflix is making a Carmen Sandiego show starring Jane the Virgin’s Gina Rodriguez https://t.co/IvEIVF8DbR https://t.co/DwRv8B82Sj","@rwmcorp","cultural-icon",
"#GinaRodriguez will be the new #CarmenSantiago for #Netflix! https://t.co/QogCTuuVPk","@_CineAddiction","cultural-icon",
"YES - have to find these! I still have very fond memories of playing Carmen Sandiego in 5th grade. Plus - during the summer my mom was allowed to bring home her classroom computer and I played Oregon Trail all summer long. #memories","@LeahTalbert","edutainment",
"Gina Rodriguez To Star As Carmen Sandiego In Netflix Live-Action Feature https://t.co/zBI04hbxnP","@CoreTempArts","cultural-icon",
"Now all I need to do is unlock a fedora. #carmensandiego #PokkenTournament https://t.co/eVD8NLELuM","@eKatzzy","fashion",
"Gina Rodriguez to Voice Carmen Sandiego in Netflix Animated Reboot https://t.co/sPlw8qw74k https://t.co/9W32AMhGR3","@la_patillaUs","cultural-icon",
"Gina Rodriguez donning red fedora and trench coat of Carmen Sandiego https://t.co/d6pKUMuRJY","@Tanvirideas","cultural-icon",
"Dula mi Carmen Sandiego ni Modjie. haha! Thank u internet! old school! ^_^","@kiannenique","cultural-icon",
"@ErinAndrews Awesome Carmen San Diego retro outfit today, nicely done!","@yankeefan209","fashion",
"@DrLupo @FortniteGame Where in the world is Benjamin Dr Lupo? (In my best Carmen Sandiego impression)","@figjam300","cultural-icon",
"Kourtney Kardashian Takes Younes Bendjima on a Surprise Birthday Trip Oh, the places they'll go! Kourtney Kardashian channeled her inner Carmen San Diego for Younes Bendjima's birthday--and no, we're not talking about a role-playing fantasy.... https://t.co/uCiAyTMz6Z","@BarrWarren","travel",
"@AshleyONFOX7 @fox7austin all that's missing is a red hat....Carmen sandiego lol...","@imfromatx","fashion",
"Right before my birthday?? Oh @netflix you spoil me! https://t.co/2j4ZJUk1pq #CarmenSandiego","@rachelkaser","cultural-icon",
"Hmm: Gina Rodriguez to Star in Live-Action 'Carmen Sandiego' Feature for Netflix https://t.co/nMvhRaJ1P5 via @thr","@CCTabet","cultural-icon",
"#news #tech Do it, Rockapella: #Netflix is Making a New ‘Carmen Sandiego’ Show: Where in… https://t.co/o0kjh1ijEL","@opennViral","cultural-icon",
"one day i'm going to dress up as Carmen Sandiego and run around Epcot April 03, 2015 at 11:39PM","@LiveinADHD","fashion",
"literally me. I can so far speak french fluently but conversational farsi, Spanish, Korean and Amharic (Ethiopian)\. Anyone willing to teach me more conversational languages are more than welcome but I need to be #CarmenSanDiego therefore I learn what I can https://t.co/zFhcOxi1f4","@Diamond_ChaseMi","edutainment",
".@HereIsGina Rodriguez to star in #CarmenSandiego Netflix Original movie! https://t.co/Lfwkha2uW7 https://t.co/qonoaYhrYR","@FanFestNews","cultural-icon",
"Hakuna Matata, day by day, where in the world is Carmen SanDiego? #thoughtsToLiveby","@HighHopes14","cultural-icon",
"""Chuck Norris is the reason Waldo is hiding, and why Carmen San Diego can't be found.""","@cchucknorrris","cultural-icon",
"As part of a generation trained in traveling through time to find Carmen San Diego. This wasn't shit. https://t.co/Ot4WSSFxKs","@aaronmsmall","travel",
"In the next month, I will be in six countries and four states. I feel like Carmen SanDiego. (And yes, now the song is playing in my head).","@littledidcknow","travel",
"Thinking maybe this year's Halloween cosutme will be Carmen Sandiego and I just won't show up to parties so people can't find me.","@mslaurentaylor","fashion",
"@NCsweetMelissa Reminds me of the Carmen Sandiego hat","@someguyinsac","fashion",
"Every article has called her ""the female James Bond"" and ""superspy"". Carmen Sandiego was an international thief! A super styling one, obvs","@aSparkleFactor","fashion",
"Oh it's on. The first (read:only) Italian phrase I learned came from #CarmenSandiego circa 1985: Che amava il pesce. http://t.co/CQkPiY4drf","@GoldStarMarimo","edutainment","x"
"#ECCC red hat guide! wide brim, red trenchcoat: Carmen Sandiego; brimmed, suit: Agent Carter; fez: 11th Doctor","@malept","fashion",
"Bethenny walked into lunch with Carole wearing the latest in ""Where in the World is Carmen San Diego?"" fashion. #RHONY","@TheHopeSpears","fashion",
"Carmen Sandiego Revival Headed to Netflix - CBR https://t.co/KAq4AUBJfm","@dino_man","cultural-icon",
"Where in the world is Carmen Sandiego? At a Halloween party with Juno. https://t.co/P6PSB8bLDh","@christiegraceo","fashion",
