"contents","author","category","star_tweet"
">Carmen Sandiego time-travels to steal Ben Franklin's Key, stopping his electricity research. Wouldn't that cause a massive freaking time paradox?","@MagicaRanger","pop culture",
"I still love ""Where In The World Is Carmen Sandiego"". I learned a lot about world geography from that game, plus it was fun to be an international detective, using clues to find those thieves! #retrogames #retrogaming","@IQ_Adventures","edutainment",
"BEDELIA'S CARMEN SANDIEGO OUTFIT. FLAWLESS. #Hannibal #HannibalPremiere","@pocketrex","style","x"
"Okay. I still have NO ideas for a Mardi Gras costume. I was thinking Carmen Sandiego, but idk that people will get it.","@PasDeOops","style",
"Carmen Sandiego Returns in a New Educational App https://t.co/3bt1Yqcl5u https://t.co/0ZWELR92Zh","@margarettwalte5","edutainment",
"if i dont get to start traveling soon idk what imma doooo i wanna be carmen sandiego","@mynameischapman","travel",
"Netflix is betting on ‘90s kids nostalgia for learning with upcoming lineup https://t.co/8D5SpjAtFP https://t.co/zWhVsMjboj","@Jasondonnelly18","edutainment",
"@almielag spelunking will always be my favorite word (which I learned as a youngin from the Where In the World Is Carmen San Diego? game)","@neontrotsky","edutainment",
"Domino #cosplay by Carmen Sandiego https://t.co/TmfdvBH5ME Photo by @mineralblu https://t.co/m98hUT8K4j https://t.co/WJNaDMt2db","@TITANSofCOSPLAY","style",
"Awesome and Easy Carmen Sandiego Costume... #HalloweenIdeas https://t.co/Mb89S48sZ7 https://t.co/jPfmk8gGR4","@HalloweenIdeaz","style",
"Waldo and Carmen Sandiego cosplay couple ahead of me :3","@CheeseWarlock","style",
"So...I basically did #InternationalWomensDay & #WaybackWednesday in one closet cosplay Does anybody else remember #CarmenSandiego No?🤔 Kay😅💚 https://t.co/fAaG6TSbfk","@NoelWillett","feminism",
"@evilgaywitch Carmen Sandiego gave me a love for completely over the top 20s era outfits","@evilgaywitch","style",
"@HunterxoMUSE where in the world is Carmen San Diego? That's what that hat reminds me of 😂","@Tenkay23","style",
"@muffinlordSA @CBCArts @CanadianPacific this poster is from 1942. Carmen Sandiego is clearly an immortal traveller.","@Jon_Ore","travel",
"HAPPY HALLOWEEN! Life is gourd! 🎃👻 #carmensandiego #ghostrider #2010 https://t.co/HO6N7U5V15","@shaydakiss","style",
"How Carmen Sandiego accidentally became an educational game icon https://t.co/QUldC0aLYM","@GamerGeekNews","edutainment",
"I'm tryna be like Carmen sandiego this year with all the vacations I wanna take","@Merakii__","travel","x"
"@omgfloofy Where in the World is Carmen Sandiego was an amazing edutainment title back in the day, and it could still be fantastic today.","@omgfloofy","edutainment",
"@luigilazuli If I ever go to the same con as u, I gotta have my Carmen Sandiego cosplay ready so we can take a super villain thieves selfie","@signeswan","style",
"This show made me the geography wiz and buzzfeed quiz master I am today. Thank you Carmen Sandiego 😘 @CarmenSandiego @RockapellaMusic https://t.co/GTUs2QMguD","@kateisfun","edutainment",
"@reincarmation thank you, Carmen Sandiego!","@anniemurphie","pop culture",
"Watched Carmen Sandiego turn not Latina at all over time. #EurocentricCallOuts https://t.co/33WMgH4hiH","@phoneticletter","latina",
"Where is Carmen Sandiego? : In 1985, and under the auspices of developer Brøderbund Software, a Disney ex-artist (Gene Portwood) and some video game programmers and designers (Mark Iscaro, Dane Bingham and Lauren Elliott) bring Carmen Isabela Sandiego, https://t.co/mJmbug7yeX","@zappingnews_EN","pop culture",
"Reading this paper and already getting mindblown. Carmen sandiego was an educational game and probably the best ever made. https://t.co/kBy9ZSTmaZ","@PencayFome","edutainment",
"Wait let me get this straight...🤔they'll make a non-animated Dora the Explorer movie and I still can't get a non-animated Where in the World is Carmen Sandiego, Thundercats, The Jetsons, Captain Planet, or a non-animated Magic School Bus...🤔 @michaelbay 🤔⁉️","@TheRichlatino","pop culture",
"Carmen Sandiego was the originator of Future hats & brunch boots","@Scott_CEOofSUH","style","x"
"Carmen Sandiego @ Burlington International Airport - BTV https://t.co/rGTvkt7H26","@Ben_Walking_AT","travel",
"#Breaking @netflix is developing a live-action film based on the classic edutainment video game series #CarmenSandiego https://t.co/jtojWOX4OF @BlastingNews #IARTG #PJNET #tcot https://t.co/xtv0ktXeSc","@EpicNewsComp","edutainment",
"Windows 95. Where I eventually learned Where in the World Carmen Sandiego was....I think. It could've been just her V.I.L.E criminals.","@bluskyz00","nostalgia",
"Also, I guess they couldn't legally say ""Carmen Sandiego,"" but I am highly amused by the costume that is CLEARLY Carmen Sandiego but is labeled ""World Traveler.""","@AnicaLewis","fashion",
"Kourtney Kardashian Takes Younes Bendjima on a Surprise Birthday Trip Oh, the places they'll go! Kourtney Kardashian channeled her inner Carmen San Diego for Younes Bendjima's birthday--and no, we're not talking about a role-playing fantasy.... https://t.co/84BE8fnvXN","@Blackburn1Floyd","travel",
"@t54r4n1 @earthtopus I dunno, I think they've got to flip it and make Carmen Sandiego the hero.","@kukkurovaca","pop culture",
"@JamesOKeefeIII Nobody cares. Enjoy your Carmen Sandiego cosplay tho","@alberttimlin","style",
"@cjd3vries @SuchiPahi @PeterOrlowicz @NC_CyberLaw @dj13p 3. Next to Carmen San Diego on the flight to Houston.","@SleepyHead_band","travel",
"hopefully netflix puts a new and unique spin on carmen sandiego i want a story driven show with bits of educational facts here and there","@Clankity","edutainment",
"VIDEO: 10 Reasons Where in the World Is Carmen Sandiego? Was the Best Educational TV Show Ever https://t.co/g37uG8gJ5B","@FujikageYori","edutainment",
"@LnDDave “@LnDDave: A3) learned a lot about the world via Carmen San Diego as a kid. #guildchat” and that learning can be fun!","@nancyrubin","edutainment",
"@glowupdoll I was Carmen San Diego for Halloween when I was like eight.","@GinaArielle","style",
"Okay everyone I don’t know if anyone remembers Carmen Sandiego but I played the computer game all the time and I remember her trench coat and hat being a tannish yellow color! Apparently her outfit is completely red though? If you know who I’m talking about lmk what u think:","@gabby_biz","style",
"Dudes, I found Carmen Sandiego. She went blonde & was shopping for silver at the Puerto Vallarta airport today. http://t.co/4DVWhK6iou","@Jeremy_Danner","travel",
"VIDEO: 10 Reasons Where in the World Is Carmen Sandiego? Was the Best Educational TV Show Ever https://t.co/08iOqBUoLc via @People","@PSDBGSafety","edutainment",
"That long red coat.. That red fedora.. You stole my heart, Cute time explorer #carmensandiego #gamervalentinepoem","@UrzasRage","pop culture",
"@tomblappy an extra booing sound effect was added in Where in the USA is Carmen Sandiego, I heard it in My First Amazing World Explorer.","@JeremiahLiles1","pop culture",
"Day I decide I'm being Carmen San Diego for Halloween, Lindsay Lohan Instagrams a pic of Carmen San Diego saying she loves her...Help...","@lifewithlauren1","style",
"Today we celebrate #GirlsinICT by presenting several inspirational women in this field! Janese Swanson is an inventor and software developer of toys and games for girls, known for co-developing the first of the Carmen Sandiego educational games! #GirlsInICTDay https://t.co/Yy0M1sJlLg","@cunterview","feminism",
"Video Games are dangerous, thanks to too much Where In the World Is Carmen Sandiego? I steal antiquities and wear red fedoras even though hats look really bad on me.","@Ruby_Stevens","pop culture",
"VIDEO: 10 Reasons Where in the World Is Carmen Sandiego? Was the Best Educational TV Show Ever … https://t.co/AphP678sY9","@FiverrToy","edutainment",
"Lumbersexual and Waldo & Carmen San Diego are 2 of the funniest couples' costumes on this list http://t.co/MubcGmT2Mo #halloween","@commonwealthlv","style",
"@britbristow @instagram That is SO cool! You could host your own travel show, Ms. Bristow! You go to some fantastic locations! Thank you so much for keeping us posted on all of your projects - instead of “Where in the World is Carmen Sandiego?,” it could be “Where in the World is Brittany Bristow?” Hah!","@ThomasMalloryE2","travel",
"@Imperialgrrl as best I can tell @Banzaibabee did a big Carmen Sandiego style heist on the east coast and is moving west to avoid capture.","@malfunct","style",
"VIDEO: 10 Reasons Where in the World Is Carmen Sandiego? Was the Best Educational TV Show … https://t.co/DxtAfjFHMO https://t.co/BHroDxY5qd","@MisonoAlex","edutainment",
"Beautifully narrated and heart-felt Lo Fi Let's Play of Carmen Sandiego by @leighalexander - http://t.co/QJ26BosYPj. Thank you, Leigh!","@razorangelwings","pop culture",
"A great female Halloween costume idea: Carmen San Diego","@atownfrombtown","cosplay",
"Where in the world is Carmen Sandiego? She's @RedHat, of course, where a red hat never stands out. https://t.co/YXlinOq5eg","@IngridTowey","style",
"Caraaazzyyyy Halloween adventures this past week 🎃 I've had the Carmen Sandiego theme song stuck in… http://t.co/PkkAUtsP7E","@tricia229_MK","pop culture",
"Educational information + humor? Now *that's* edutainment. Where in the World is Carmen San Diego OTOH. ;_;","@rhymebyter","edutainment",
"@BillyBiggle I first saw Mount Rushmore in the America's Heroes video, then I saw it in Carmen Sandiego & My First Amazing World Exolorer.","@JeremiahLiles1","edutainment",
"Uhm… is that… is that #CarmenSandiego's coat & hat?!? Never underestimate a #flamingo in a #fez… @GarminSandiego https://t.co/A1dbwA0O8F","@MobileMollusk","style",
"carmen sandiego taught me most of what I know about U.S. geography and that henchmen have distinct M.O.s like chewing gum or loving salsa music","@RaptorOfLove","edutainment",
"@zachschabot safe travels! You're like the new version of ""where in the world is Carmen San Diego""! #yeahimold","@lovingthepeak","travel",
"Connie dressed up like Carmen Sandiego and Steven dressed up like Luigi. #StevenUniverse #BlogAllTheTime","@yahoo201027","style",
"@Ebonyteach I definitely played Carmen SanDiego in elementary. Well, the ""computer teacher"" played on the ONE Tandy computer while we all watched and gave our input on finding her. 😂😂","@ebonyfem123","nostalgia",
"Colton's not sure how he feels about my Carmen Sandiego hat. Good thing it's on my head, and not his… https://t.co/Q9hJsYusJW","@PickiSays","style",
"When I was a kid I wondered if Carmen Sandiego and Waldo had eloped and were traveling the world on vacation. Talk about hard to find love","@_CodyHahn","pop culture",
"Someone is gonna do an ""educational"" iPad app for kids called ""Eagle Strike Force TSA Screener Security Force Heroes"" that's a cross between Where in the World is Carmen San Diego? and Call of Duty: Modern Warfare and it's gonna blow this out of the water ~FIN~","@zachmortice","pop culture",
"@graykimbrough @causalinf @ernietedeschi The only good cop games involved Carmen sandiego. And arcade style NARC before seeing a movie at the multiplex.","@jeremyskog","pop culture",
"@obsidian_blue Oregon Trail!!! Yes! I loved that and the Carmen Sandiego games in elementary school.","@MetalSwift","edutainment",
"I’m kinda disappointed in myself that I’ve never been Carmen Sandiego for Halloween....","@carmencleek_","style",
"This emoji 💃 is actually a low key Carmen SanDiego without her hat","@lilsmokedog","style","x"
"The real mystery is what was Carmen Sandiego wearing under that trench coat. We may never know.","@alan_smithee_jr","pop culture",
". @KaneBlack is joking about all the Agent Carter costumes remind him of Carmen San Diego.","@SleepyTearyEyed","style",
"The Purge, Carmen Sandiego, and Boxer Princess, lolz!! 💋😈👻👿☣🕸 #treehouse #patiobar #halloween… https://t.co/BMk4EV6g7y","@cmpromoprincess","style",
"watching all of this magic school bus makes me want to watch carmen sandiego and captain planet too","@harperfischer","pop culture",
"MRW I learn the band Tilt covered ""Where In The World is Carmen Sandiego"" http://t.co/ImNkp7rK6b","@IndystarX","rockapella",
"Gina Rodriguez Prepares Her Fedora For Netflix’s ‘Where In The World Is Carmen Sandiego’ Reboot https://t.co/qYNxT0H88P","@GinaLawriw","pop culture",
"@janedouglas It's even better when it is innocuous stuff. I got carded getting a season of the ""Where on Earth is Carmen Sandiego?"" educational cartoon series from the 90s for someone. Careful, you might learn some geography from this, best to do it with an adult.","@SneaksyRanger","edutainment",
"Gina Rodriguez donning red fedora and trench coat of Carmen Sandiego: https://t.co/xmNpdyUn4W","@Tom__Coleman","pop culture",
"Carmen Sandiego and the importance of feminism in edutainment, via @SyfyWire #SundayMorningMedicine https://t.co/EVfmgD5fQm https://t.co/fqHGIC2Xgk","@nursingclio","feminism",
"@JoeJohnsonIce I love that Carmen San Diego cosplay.","@Chiaki747","style",
"PJ Day! Get your jammies on & get ready for a Reading Road Trip! Where in the USA is Carmen Sandiego Reading? http://t.co/hyyhV66TfB","@lakemyra","pop culture",
"@alice Oh my GOD I did! I lived for educational games. Carmen Sandiego was my fave 💃🏼","@randomfurlong","edutainment",
"@BuzDanger @ItsKatieKendall @GalGadot Considering the trench coat that she wore during Wonder Woman, I can totally see it. Wait…is Wonder Woman actually Carmen SanDiego?","@waynedixon","pop culture",
"I still miss the educational programming of the late '80s/early '90s. I miss Square One TV, Ghostwriter, Where in the World is Carmen Sandiego?, and all of the other shows that made learning fun. I didn't... https://t.co/jrBUe3TlwM","@nottfo","edutainment",
"My homegirl called me and said ""where in the world is carmen San Diego? What part of the globe u in now??"" 🤣🤣🤣 yaw play bruh","@WhoCANWorrY","travel",
"Gina Rodriguez donning red fedora and trench coat of Carmen Sandiego https://t.co/4ZB2kYf0Nr https://t.co/x4Yy3xcYQN","@TechSigma_","pop culture",
"Where in the world is Carmen SanDiego? She's actually right in front of me at the airport. Mystery solved.","@angela_bode","travel",
"#CustomsStoppedMeCos I dress like Carmen SanDiego when I travel","@mseric","fashion",
"Where in the World Is Carmen Sandiego? Becoming a Secret Travel Agent https://t.co/B6ZLGJNcFS","@wearefirelabs","travel",
"@navahw I've been trying to remember Carmen sandiego's name for weeks now. Thank you so much!","@matencerawolf","pop culture",
"I #travel so much that Twitter doesn't know which local ads to push. #carmensandiego #ivebeeneverywhereman 🌎🌍🌏💃🏻🕶🗺","@CourtneyPaints","travel","x"
"#Furrybootleggames Where in the World is Carmen Sandiego but some traveling fur and all the cons","@grayt_fox","pop culture",
"Does dressing up like a sexy Carmen SanDiego count as cosplay?","@SapEntInc","style",
"@WineandCrimePod A red coat, scarf and sunglasses? Was Rita actually Carmen Sandiego? https://t.co/p030vWylOD","@stuckinspincycl","style",
"@Beertheist I'd personally like to see you in a Carmen Sandiego-esque trench coat and hat combo.","@PatsHoppedUp","style",
"First thing I learned this morning: Ivy from Carmen Sandiego and Nami from One Piece have the same VA in German (she’s also Chris in SonicX)","@MasterOtenko","edutainment",
"@jaiannegilkey that feel when you walk into Mr. Norton’s classroom and saw that the lights were off and the screen was pulled down you knew you were either playing carmen sandiego or watching liberty’s kids that day and either way it was going to be lit af","@aly_nort","edutainment",
"#JaneTheVirgin star @HereIsGina is doubling down on '90s icon #CarmenSandiego by playing her in a live-action film for Netflix, as well as voicing her in an animated series https://t.co/dp652w66Ru https://t.co/RITK9nBvDw","@MyTrackingBoard","pop culture",
"Because I am a savvy traveller who does her research, I neglected bringing my winter coat to Boston. Carmen Sandiego has nothing on me.","@tittergrrl","travel",
"Fashion News: Carmen Sandiego Is Coming to Netflix and Will Have Jane the Virgin's Voice https://t.co/4euHtsVqdJ","@LondonOpulence","pop culture",
"Netflix may have found their 'Carmen Sandiego' and she comes with Golden Globe credentials https://t.co/9a6apGXwli https://t.co/fMnMt9sPKY","@UPROXXTV","pop culture",
"#BretsLog Still looking but has anyone found Carmen Sandiego? I want my hat back.","@bretrreimers","style",
"1. Gina Rodriguez is awesome 2. I absolutely loved Carmen Sandiego as a kid 3. There may or may not be video footage of me singing the theme song wearing a hat and a sweet pair of sunglasses and using a marker as a microphone when I was 5 or so https://t.co/HXHT7UnXXR","@dbrobst92","nostalia","x"
"my formative game experiences were the windows 95 game sampler cd-rom, clyde’s adventure, where in the US is carmen sandiego, and animal quest v 2.0","@spammm","inspiration",
"@DaGiltyMan Every time I wear my red fedora or wear my Agent Carter t-shirt, I get Carmen Sandiego comments. ;)","@Sabriality","style",
"Where in the World Is Carmen Sandiego? Becoming a Secret Travel Agent https://t.co/ivL0Oln2d3 (cmts https://t.co/f0R89vr4Tf)","@newsycbot","travel",
"Didn’t we learn this a year ago? What’s the news here — that Netflix has turned its #CarmenSandiego series into a movie? https://t.co/aMuvKoQUEU","@billkuchman","pop culture",
"What You Learn Hunting Carmen Sandiego Without Google's Help - https://t.co/sHthauGM70","@rozekolins","edutainment",
"""[Carmen Sandiego] has been one of the most overwhelmingly positive, progressive, and diverse edutainment franchises in history, and it almost single-handedly defined what an educational video game should look and feel like."" https://t.co/BV0hjfRkUL","@SellersBest","edutainment",
"Did anyone else used to have a crush on Carmen Sandiego as a kid?? I had major infatuation. I imagined cooking for her on her private jet.. travelling the world with her and robbing people blind. ha #WhereInTheWorldIsCarmenSandiego https://t.co/USumRX9OXw","@tobiasximenez","travel",
"@mcmansionhell I believe it is ""carmen san diego"" style...","@LynnApgar","style",
"@FeministaJones “Where In the World Is Carmen Sandiego”. Best hosts, best game, best theme song.","@raisedbymoogles","pop culture",
"He traveled further than Carmen Sandiego https://t.co/tso3P7XBhr","@MrAllenAlmachar","travel",
"@BulletsForever Roy Hibbert travels more than Carmen San Diego.","@pwfariss24","travel",
"I think when I am finally able to start my world travels, I will cosplay as Carmen San Diego. I already have the trench coat.","@jessicabfry","travel",
"Lady Gaga Swiped Her Hat And Trench From Carmen Sandiego's Closet - https://t.co/Voax4zMoa9 https://t.co/I1xyVKx1op #ladygaga","@GagaHeart3","style",
"I've been reminiscing about Carmen Sandiego a lot lately because I learned the word ""dossier"" from Where in the World is Carmen Sandiego.","@guydpete","nostalgia","x"
"While Carmen Sandiego managed to stay incognito during her trip to MK, she was unable to steal Cinderella castle. https://t.co/WHAZcFKjLM","@hecallsmePP","travel",
"@RHOC_KellyDodd is pulling off that #CarmenSandiego chic tonight on #RHOC https://t.co/OlqGp94YB9","@Lou2693","style","x"
"SNL' Tries Some Edutainment With 'Where In The World Is Kellyanne Conway?' —Check it: https://t.co/YbZYOz7fzD","@RickYaeger","pop culture",
"@KristinZiemke YES! We just have to plan the city-- it's like playing #carmensandiego these days. I'm in U.S. soon for great #edtech talks!","@MindWise_CK","pop culture",
"Let’s keep the Carmen San Diego bus going on this beautiful Saturday! . . . #thenostalgicghost… https://t.co/eTBSLPC6Km","@nostalgicghost9","pop culture",
"Car 54, Where in the World is Carmen Sandiego? #IconicTVMashup #IconAwards","@sergebomba","pop culture",
"Where in the world is Carmen Sandiego?⚾️ @ Braves Game @ Turner Field http://t.co/zvAJPYOoes","@G0G0_Gadget_","pop culture",
"What You Learn Hunting Carmen Sandiego Without Asking Google | https://t.co/5sDPr70rv1 https://t.co/3kHxmaYReM","@cracked","edutainment",
"I thought I was beating the system by asking Jeeves Carmen Sandiego questions to solve the case, but I was learning. https://t.co/Ouo8b8GQlC","@jdylan901","edutainment",
"My bus to Freedom, who is coming? We leave at dawn! #nomad #carmensandiego #partybus #goodmorning… https://t.co/oC8RkJy58J","@darebarecub","travel",
"@MaraWilson @harrisj anybody else think that Mara ought to do a Carmen Sandiego cosplay at some con? The definition of epic right there.","@icassassin","style",
"When playing Where in the World is Carmen Sandiego, if you traveled to certain countries, you had to switch floppy disks and wait for the game to reload.","@mch_tweets","pop culture",
"Hey Twitter, I like the little emoji icons beside event hashtags, but I don't get what Carmen Sandiego has to do with the #AusOpen","@MelanieDinjaski","pop culture",
"My brother calls me Carmen Sandiego because I’m always traveling and I’m pretty happy about that 😊","@jackieOhh_","travel","x"
"Whenever you’re feeling down about your bad decisions, remember that a winner on Where in the World is Carmen Sandiego once chose Idaho as her prize vacation. So cheer up emo kid.","@tinyelvisbkwd","travel",
"🎶 Where in the world is... 🎶 #carmensandiego #tbt #halloween #redtrenchcoat #ladyspy #superspy… https://t.co/TD3lTVH5tm","@ThatKtbGurl","style",
"Sad fact of the night: need Carmen Sandiego & Spider-Man to learn crimlaw (fact imp as non-def 2 conspiracy & prop force 2 stop crime, resp)","@LucyNaturae","edutainment",
"What if Carmen Sandiego was Dora The Explorer's mom?","@kingmost","pop culture",
"i'm so mad, i left my pirate coat AND my carmen sandiego hat upstate :(","@KittyCatalyst","style",
"See, when I was a young child. I wasn't allowed to watch regular television because I was bad and failing in school. My parents made me watch PBS and I hated it at 1st but eventually my favorite tv shows became #WishBone and Where In The World Is Carmen Sandiego. I learned early.","@DMoNeYGoOnFaCe","nostalgia",
"Advice of the Day: Be a flamingo in a flock of pigeons. Model wears the Carmen Sandiego Coat. #outerwear #ootd #ootdcoat #ootdouterwear #houndstoothcoat #hoodedcoat #fashionista #houndstoothouterwear #jacket #pigeonquote #adviceoftheday #advice #lifeadvice #tips https://t.co/q2nTD390RB","@mypinkmartini","style",
"I am excited for this cartoon that will teach children where Paraguay is! https://t.co/RKgC1YyO0J","@JoeStreckert","edutainment",
"@elevenafter it originally started as a script for a Carmen SanDiego film but wardrobe just couldnt nail a red hat that Tom would wear.","@Latenitedraw","style",
"Today I'm schooling my 7th graders on the greatness of educational cartoons.It is glorious. #CaptainPlanet #CarmenSandiego #thepowerofstory","@MsLReads","edutainment","x"
"Why did I spend so much time and energy learning state capitols as a child? Were the grooming us for Carmen Sandiego auditions?","@ETCinSTL","edutainment","x"
"Lol me and the husband dressed up as Waldo and Carmen Sandiego for Halloween before ❤️ #FreshOffTheBoat","@april_rose","style",
"@grace_rolek i think connie is more like carmen sandiego. guess who's dressing up on halloween. #stevenuniverse https://t.co/FeaMXOK5Zp","@gem_drill","style",
"#SANTASELENA rocking that Carmen Sandiego outfit like whoa http://t.co/s6nCwnCzAq","@fidmart85","style",
"Travel the World. Word to Carmen Sandiego","@BedRoomGNGSTA","travel",
"I feel like Carmen Sandiego in this fall floppy hat. Floppy hat $7.99 at Target, Animal print… https://t.co/pYLzCdkDcI","@Fizz_Fashions","style",
"VIDEO: 10 Reasons Where in the World Is Carmen Sandiego? Was the Best Educational TV Show … https://t.co/S1YhyxNNKH https://t.co/CbLyzSIbCr","@Mybeauty_health","edutainment",
"@HotshotSD it's a very fun word though. I remember as a kid I learned what spelunking was because of the Carmen San Diego game. #dictionary","@Queen_Bongo","edutainment","x"
"She's got to survive, if only because I'll never come up with a better name for a car. Not only is it a car pun, but I also lose track of where I've parked her on the daily, which leads to the question... where in the world is Carmen Sandiego? Thank you, I'll be here all week.","@elliesaysso","search",
"@bertsesame I learned about Kokomo from Where in the USA is Carmen Sandiego & The Blues Brothers, I didn't know Santa Claus is in Indiana.","@JeremiahLiles1","edutainment",
"@TheRealQty Might i suggest Carmen Sandiego if you want a point and click adventure?","@Mitorequiem","pop culture",
"@pippinbarr will play it later! i JUST did a carmen sandiego let's play where i riffed on high concepts/feat. airport noise so it resonated","@leighalexander","pop culture",
"Not Your Shero: #CarmenSandiego and the importance of feminism in edutainment https://t.co/TNRdMr5F6r https://t.co/sTPyEOoaq9","@SyfyWire","feminism",
"@gravislizard I had a lot of The Learning Company's stuff, Encarta, an interactive reference atlas with Where In The World Is Carmen Sandiego","@fiebrigeGestirn","pop culture",
"me when i'd get a new carmen sandiego game from that little flimsy paper magazine at the book fair delivered to my classroom 4 weeks later https://t.co/QCxxJ3mskC","@_Brodes","nostalgia",
"VIDEO: 10 Reasons Where in the World Is Carmen Sandiego? Was the Best Educational TV Show … https://t.co/FkFUCwITFT https://t.co/dtG7wtQ6Vl","@swimmerboy2379","edutainment",
"VIDEO: 10 Reasons Where in the World Is Carmen Sandiego? Was the Best Educational TV Show … https://t.co/ANaMAhIuk4 https://t.co/RqFfRl22Ky","@PascalGaroute","edutainment",
