"text","handle","category","star_tweet"
"Last night I realized that I have been dressing up as Carmen Sandiego. https://t.co/YuVki6ezJL","@cassieoneil_","fashion",
"Chuck Norris always knows the EXACT location of Carmen SanDiego.","@NorrisKicksButt","cultural-icon",
"New Carmen Sandiego Animated Series Coming to Netflix Starring Gina Rodriguez - IGN https://t.co/mcEKyPLBrn https://t.co/n8ws6sYIRM","@Times_Up_Ent","cultural-icon",
"Where in the world is Carmen Sandiego? Hanging out in the @CBSHSAdvising office today with Alvin & the Chipmunks, the Share Care Bear, Beevis and Arthur! Happy Halloween! #backtothe80s&90s https://t.co/afPCz5inWD","@ClemsonCBSHS","fashion",
"Netflix’s #CarmenSandiego reboot will be a perfect pairing for its #MagicSchoolBus revival. https://t.co/6dskBIsTsZ","@billkuchman","cultural-icon",
"@angwilliams @HiAndrewJenkins Halloween lifesaver! I have Carmen San Diego waiting to be revived if need be but thank you!","@lifewithlauren1","fashion",
"Netflix Reveals First Look at Carmen Sandiego https://t.co/2rEyXPJvR3","@syedmu83","cultural-icon",
"Y'all are acting like Carmen Sandiego, female leader of an international crime syndicate, is not a worthy choice for fashion role model.","@WriteOnSteph","feminism",
"I grew up using early EDU software, worked for a large school district, and run EDU business development today. This article rings a lot bells, both nostalgic and alarming for many companies I see in this space today. #education #d…https://t.co/x7lpfATmX0 https://t.co/rrZvhzlRfO","@erik_heinrich","cultural-icon",
"@Nervatel .@Nervatel What if Nancy Drew, Squirrel Girl, and Carmen Sandiego started an international ""overlooked by feminism"" syndicate","@MSamenfink","feminism",
"What Netflix’s New Carmen Sandiego Show Will Actually Be About https://t.co/rViVibJkRq","@moviesteem","cultural-icon",
"Netflix should bring back ""Where in the World is Carmen San Diego?""","@RocheCorp","cultural-icon",
"Just downloaded Carmen Sandiego app... goodbye world see ya in a month","@therealtylerwar","cultural-icon",
"‘Carmen Sandiego’ Animated Series Greenlit at Netflix, Gina Rodriguez to Star https://t.co/5ZWWVcUbEv","@RichGaluszka","cultural-icon",
"Netflix plans live-action 'Carmen Sandiego' film with Gina Rodriguez - Apple Watch 101 - https://t.co/e5yULTS35T https://t.co/iQ6QmKkUno","@AppleWatch101","cultural-icon",
"Our first look at Netflix's new Carmen Sandiego animated series starring Gina Rodriguez. She's back January 18. https://t.co/1IRQkN4KcY","@godzineblog","cultural-icon",
"Gina Rodriguez to Voice Carmen Sandiego for Netflix https://t.co/3EfVEtV09c #TV","@noemihurn","cultural-icon",
"@egabbert in a hat you could be easily mistaken for Carmen Sandiego and we're still looking for her.","@goingattraction","fashion",
"I wanna be Carmen Sandiego for Halloween. But I'm too lazy to buy a red coat and hat.","@rachelhodges12","fashion",
"Thought about wearing a bun... Might have to dust off my Carmen Sandiego","@JusDahl","fashion",
"carmen sandiego is such a style icon","@cyborgkirstie","fashion",
"Netflix Is Reportedly Reviving Carmen Sandiego With Gina Rodriguez https://t.co/OfUlk0JFov","@theDextazLab","cultural-icon",
"I’m bummed that I wasn’t able to travel this year because I had to put more energy towards other areas. This time next year my mood will be “where in the world is Carmen Sandiego.”","@honestasgaston","travel",
"@leupagus (I'm also distracted by the fact that once Councilwoman is dressed like Carmen Sandiego sans hat. V. stylish)","@leupagus","fashion",
"Saturday Night Social: Gina Rodriguez Will Voice Carmen Sandiego in Netflix's Upcoming Animated Series https://t.co/1QqipyfIYl","@gaw_test","cultural-icon",
"oh shiiiit Gina Rodriguez as Carmen Sandiego?!","@gimpheartmusic","cultural-icon",
"@SUP3RFRUIT #nostalgia freddie fish, putt putt travels through time, where in the world is Carmen San Diego. Recess, saved by the bell,","@Hitomimyhomie14","cultural-icon",
"ICYMI: Animated Carmen Sandiego Series Coming to Netflix Starring Gina Rodriguez https://t.co/zyhUSU9ZDk","@GeeksOfColor","cultural-icon",
"Gina Rodriguez will be donning the red fedora and trench coat of Carmen Sandiego for Netflix https://t.co/hZYsjAQwqy","@RyanTy195","cultural-icon",
"VIDEO: 10 Reasons Where in the World Is Carmen Sandiego? Was the Best Educational TV Show … https://t.co/7wAnS4Yqwh https://t.co/LKIMrEQ4q7","@kamalhassanpop","edutainment",
"@simplex_reverie Fictional - Carmen San Diego. That chick knows her way around the globe! Real life - My best travel friend. Some of the best memories of my life have been when I have been on trips with her.","@xfbard","cultural-icon",
"Gina Rodriguez to Voice Carmen Sandiego for Netflix https://t.co/lrhduGKaTu","@Comics_Un","cultural-icon",
"@IntenseDesire 😂😭 “@IntenseDesire: In the latest Carmen San Diego fashions http://t.co/ouxlfFyMtn”","@Lei_Bay_Bay","fashion",
"Netflix orders animated Carmen Sandiego series https://t.co/ELVnDTj5DO via @Verge","@Ki2KitsuneY","cultural-icon",
"Casually stalking @sdimagg's flight because I'm not coping well with her being over a huge ocean. It's like she's Carmen SanDiego.","@ravelrie","travel",
"is anyone more of an inspiration than carmen sandiego","@howsurdabin","inspiration","x"
"Where did the blockbuster educational games go? #computerGames #education #CarmenSandiego http://t.co/6wA7S2lrP1","@puzzlebeard","edutainment",
"Netflix is betting on ‘90s kids nostalgia for learning with upcoming lineup https://t.co/ULmrUTXdiU","@talkdaybright","cultural-icon",
"‘Carmen Sandiego Returns’ launches on iOS https://t.co/xX8KhDHwin #slashgear #tech https://t.co/22vaXMLVW5","@patrickperez1","cultural-icon",
"#Mashable Gina Rodriguez donning red fedora and trench coat of Carmen Sandiego https://t.co/qcJVwio5ii https://t.co/JsBTPJECOe","@TechieTurf","cultural-icon",
"My supervisor said I look like Carmen Sandiego with my big hat and curly hair. Investing in a red trench now.","@rolyatetak","fashion",
"@troughofluxury @StrangestMoon @nivenus For those of us of the age to have watched Carmen Sandiego, the kids who got Mexican states for the final were always fucked","@emeralddeevee","edutainment",
"#WhatIThoughtWhenIWas18 I’d travel the world by the time I’m elderly at age 40. Thanks to Where in the World is Carmen Sandiego! I’ve accomplished my goals! Love that game 😉","@DrJeanGreySmith","travel","x"
"Me *puts on Carmen Sandiego fedora and heads out* https://t.co/qv2EqZN4js","@sylphanne","fashion",
"@Mxnarch_ Or ""Where in the World is Carmen Sandiego"" years old?","@Mxnarch_","cultural-icon",
"Gina Rodriguez Joins Netflix’s Live-Action ‘Carmen Sandiego’ Movie | Carmen Sandiego video https://t.co/vpXBKyXDyg","@trend247","cultural-icon",
"hnnnngggggggg carmen sandiego was my actual childhood hero who made me gay","@starsinmist","cultural-icon",
"Gina Rodriguez to Play Carmen Sandiego in Live-Action Netflix Feature: https://t.co/3wymA0BULV https://t.co/a1jwkvCks0","@NerdMusicRadio","cultural-icon",
"Come Get A Map https://t.co/JX7Yoc6NEX #posterPoster #maps #travel #carmensandiego #trackyourtrip https://t.co/n5bNs85d63","@PosterArtHouse","cultural-icon",
"@BlairBraverman If you’re geography inclined people, you can name all the counties in a state. Or all the states and capitals, or countries and capitals... like Carmen Sandiego.","@sarahsplains","cultural-icon",
"The return of Carmen Sandiego and Miss Frizzle on Netflix is so special, and here's why: https://t.co/zkBD7Cnp4y https://t.co/a8TBydNG5U","@FOXCinemas","cultural-icon",
"@VerPayne 🙀 You must educate them. I saw someone on Halloween dressed as Carmen Sandiego and I was super stoked that we had found her.","@krystinbradshaw","fashion",
"@scottEweinberg I learned what spelunking was from Carmen Sandiego. My mom and I played the first handful of games together on Saturday nights in the 80s.","@Supavixen","cultural-icon",
"As a person who owes all of my geographical knowledge to #CarmenSandiego, I'm quite thrilled about this new show. Netflix does it again. https://t.co/Ymtng5Osaw","@jamrobcar","cultural-icon",
"#Google #Hot #News Beyoncé is the Carmen Sandiego of Pop http://t.co/viPpa5y9sN #InstantFollowBack YBNews","@Detra_Tenor","cultural-icon",
"Can’t wait to see Gina Rodriquez as the fabulously mysterious Carmen Sandiego in both a live action movie and an animated series on Netflix 🤩 https://t.co/sJKoLZEVun","@JosephFredriksz","cultural-icon",
"#JaneTheVirgin star Gina Rodriguez will play #CarmenSandiego in Netflix's reboot - https://t.co/tTfhU8JsBx https://t.co/Dw9KkgVt5G","@wgtc_site","cultural-icon",
"Anybody else grow up playing where in the world is Carmen San diego in school? I learned so much about geography from that. AND DIVERSITY!","@inspiredofword","edutainment","x"
"They're finally here! Visit my store to buy the latest Where On Earth Is Carmen Sandiego? in our store https://t.co/sSIJLY0jTz. #BluRay #Anime #Cartoon #deal #savings","@FredBluRayDog","cultural-icon",
"For the love of all that is right in the universe, Why has there not been an updated ""Where in the World is Carmen Sandiego?"" iOS game?!","@BrewmasterWansu","cultural-icon",
"Leathers, scarf, ikat, high waist, boots, Carmen San Diego hat. #fashion #fashun","@evandileo","fashion",
"@vwoelders leaned most of my geography via cross-country & Carmen San Diego! #bcedchat","@technolandy","cultural-icon",
"Where in the world is Carmen Sandiego http://t.co/WuOmVZeewg","@ZAVIEE","cultural-icon",
"Gina Rodriguez to star as Carmen Sandiego in Netflix's live-action movie https://t.co/LjJtitoqgg","@kenyettaoverton","cultural-icon",
"‘Carmen Sandiego’ Toon Series Starring Gina Rodriguez Bound For Netflix https://t.co/xo0caUQzlY https://t.co/JNsdY8aOAS","@autocarsnews","cultural-icon",
"Catching Carmen Sandiego #MyCrazyChildhoodDream","@harleyquinnical","cultural-icon",
"Worse Carmen Sandiego cosplay ever. #metvwonderwoman #svengoolie","@Irezumi23","fashion",
"Where in the world is Carmen Sandiego? Bradley Whitford killed her, stole her power and her hat. #Emmys2015","@Playboy","fashion",
"""Excuse me, Carmen Sandiego, I didn't know we had a geography expert on board."" @OITNB season 2 is off to a good start!","@ACappellaNow","cultural-icon",
"Sounds Like Netflix Is Bringing Back 'Where In The World Is Carmen Sandiego?' - The Huffington Post https://t.co/Q5N9aD6Kzf","@AWEichenlaub","cultural-icon",
"Carmen Sandiego and Waldo would be easy but lowkey wanna dress up as Bulma and Vegeta.","@STROBELIGHTS","cultural-icon",
"📷 pietramaximoffs: mcu meme » 1/8 outfits If the hat was black, she’d be Carmen SanDiego! https://t.co/ucYisOtZvW","@DarqueQueen7","fashion",
"#WhereInTheWorldIsCarmenSandiego? Starring in a live-action #Netflix movie starring @HereisGina Rodriguez: https://t.co/O0aXBWCfaO https://t.co/qcdz3i09uV","@nerdist","cultural-icon",
"@comewhenicall @SamMaggs Is this her audition for @netflix 's Where in the World is Carmen SanDiego?","@Rainzford","cultural-icon",
"#SM Gina Rodriguez Will Also Star in a Live-Action 'Carmen Sandiego' Movie for #Netflix… https://t.co/J4RefI2cps","@CurrentSocials","cultural-icon",
"Help me cast the Carmen Sandiego biopic! I'm gonna lead with: Carmen Ejogo, Ruth Negga, Kerry Washington, and Penelope Cruz. (cc: @iSmashFizzle ) https://t.co/F51LBolrND","@westratenick","cultural-icon",
"- Netflix Takes Aim At Hollywood With Gina Rodriguez's 'Carmen Sandiego' Forbes - Gina Rodriguez… https://t.co/zifVMj6jnr #SanDiego #News","@SanDiego_SoCal","cultural-icon",
"Gina Rodriguez donning red fedora and trench coat of Carmen Sandiego https://t.co/UqxcOZzZgA https://t.co/LLbivW6uaf","@HostingCarlos","cultural-icon",
"Looks Like the Rumors Are True and Gina Rodriguez Is the New Voice of Carmen Sandiego https://t.co/QVbmOk4JfL https://t.co/KgglavcU5F","@bolhaw5","cultural-icon",
"Netflix orders animated Carmen Sandiego series via #TheVerge https://t.co/q6mq0Bsf9K","@GinoRamirezB","cultural-icon",
"@chanee41483 What’s the point of texting if you don’t respond 😂😂😂. I’ll just put on my Carmen Sandiego coat and fly away LOL","@kristensmith","fashion",
"Carmen Sandiego Is Officially Happening With Gina Rodriguez at Netflix https://t.co/qzejoNFCba","@qw32urjs","cultural-icon",
"@rabblerowsdower On the bus today I created a character that was part Daria, part Lama, and you. I named it, Lamity and legit squeaked at my excitement about her going to far off places to nap while wearing a Carmen Sandiego hat.","@DrewTweetsStuff","travel",
"#CarmenSandiego has been one of the most overwhelmingly positive, progressive, and diverse edutainment franchises in history, and it almost single-handedly defined what an educational video game should look and feel like. https://t.co/EalPB0chpw","@Syfyfangrrls","edutainment",
"😭😭😭😭 at Mia saying Rasheeda got the Carmen SanDiego outfit. She swear she you @rt_Tee","@TerrellChuggs","fashion",
"Bring back #CarmenSandiego. US kids don't know geography. Either do adults.","@cupcakekitty09","cultural-icon",
"Surprised & honored to be the image #inspiration behind a #carmensandiego character from a role I played on #theboldandthebeautiful by multi-talented #artist @jerry.nojoke #howcoolisthat 😎☝🏽🤩 #swipeleft... https://t.co/IWu8flPtHv","@SHIREENCRUTCH1","inspiration",
"Already have my next Halloween costume planned out. Carmen Sandiego. My date&39;ll go as Where&39;s Wally. Always wanted to do that","@margitwashi1552","fashion",
"Thirtieth anniversary of Carmen Sandiego marked with new iOS app: Global learning company Houghton Mifflin Har... https://t.co/UpCA93Ghg0","@gorocube","cultural-icon",
"@ericalindbeck @stephaniesheh @BrinaPalencia You know, with an actual fedora you could probably cosplay as Carmen Sandiego.","@adam_kun","fashion",
"@Official_BGG @ChibiTifa Carmen San Diego finally got the firepower she needed to keep from getting followed. I stan the concept art for that fact","@Johnson20XX","cultural-icon",
"@DAbruzzoTweets I researched my favorite game show Carmen Sandiego & learned it used to be taped next to Sesame Street.","@JeremiahLiles1","cultural-icon",
"@PushinUpRoses If you're not Carmen Sandiego for Halloween I just don't even know what to believe anymore.","@SarahLikesPink","fashion",
"@drquuxum .@drquuxum Halloween costume: Carmen Sandiego palette swap","@nex3","fashion",
"@booboobytes 😍🔥 Classy Carmen Sandiego?? Jessica Rabbit in a hat??","@BlueRisu","fashion",
"Yes, I have a hat that looks like #CarmenSanDiego https://t.co/XJJXtmz8Zt","@ohmisshollie","fashion",
"Carmen Sandiego, ball with me","@kassiedutch","cultural-icon",
"@TheShow34 Elementary school computer class in 1987 was Ski Free, Oregon Trail and Carmen San Diego. Damn, being a kid was awesome","@samtheaustinP1","cultural-icon",
"Netflix’s ‘Carmen Sandiego’ Series Gets Premiere Date https://t.co/IZn762k78u https://t.co/fzWw2wLEl1","@NuMainstreams","cultural-icon",
"""Netflix orders animated Carmen Sandiego series"" :D one of my favorite shows as a kid! https://t.co/SUOLwdWdO8","@pontelon","cultural-icon",
"@EA please for the love of god remake where in time is carmen sandiego on PS4 VR.","@getlemonhead","cultural-icon",
"@Muffinus I'm an Anthropology Major; want to make educational books and games in the same genres as Carmen Sandiego and Magic School Bus. :)","@Anidex","edutainment",
"Netflix's 'Carmen Sandiego' debuts on January 19th, 2019 https://t.co/ml1ghY7EnT https://t.co/1HsCkKJdFs","@moebiusweb","cultural-icon",
"@missnatoshi This coat makes your look like Carmen Sandiego, I like it","@Missconsin","fashion",
"Student written blog post reviewing a variety of #games4ed including @icivics #winthewhitehouse @EdGE_at_TERC #ravenous and the timeless classic #CarmenSandiego https://t.co/EoJuKXIcwa #gbl #stuvoice #stuchoice @stephqniee","@mr_isaacs","cultural-icon",
"Play Where in the World is Carmen Sandiego Online - Super Nintendo Games / Browser Flash Emulator http://t.co/Sr0h6cvu16 Because #Geography","@spchamp","cultural-icon",
"I named my car after Carmen San Diego as they both share the trait of unreliability. #whereintheworlddidmybrakesgo","@CharleeAnn","cultural-icon",
"I miss Where in the World is Carmen Sandiego. That was a boss game.","@platyperry","cultural-icon",
"#Where in the World Is Carmen Sandiego? Becoming a Secret Travel Agent https://t.co/oy9Hn5z5K4","@Michael_Vasanth","travel",
"@iSmashFizzle Wait, she was brown? I think I never put together that obviously ""Carmen San Diego"" is a Spanish name... Or I just never noticed the animated characters ethnicity. The Chief was clearly the hero, though.","@CrazedZooChimp","inspiration",
"Carmen Sandiego has landed back home in Nashville. Thank you for a truly awesome week Toronto… https://t.co/mbYVgE8IC6","@emmadashlee","cultural-icon",
"What Netflix’s New Carmen Sandiego Show Will Actually Be About https://t.co/H5ZVuPyqxf https://t.co/O4QpeYz8Uw","@notisviral","cultural-icon",
"@BlackGirlNerds @ValerieComplex Her name was Carmen Sandiego. How does that not scream Hispanic?","@boatloadsbaley","latina",
"I found Carmen Sandiego! #Oia #Santorini #Greece #holiday #beautiful #takemeback #travels #KittyCatontour http://t.co/JFDcsIVlG9","@catalac10","travel",
"Using the style of Carmen Sandiego to teach kids about the oceans. http://t.co/VABVgEIw9Y","@jason_wilson","fashion",
"Netflix is making a Carmen Sandiego movie with Gina Rodriguez - CNET https://t.co/NH5vAD74ky","@cookho_search","cultural-icon",
"@kyrasolano @gillian_dalman I would have thought it was obvious...him being a world explorer. A medieval Where in the World is Carmen San Diego #mrcopolo #ch1003","@MedievalAngie","travel",
"Ooo, this is some neat news. Gina Rodriguez is a good choice for Carmen Sandiego https://t.co/CvkI7PTig7","@GeoHolms","cultural-icon",
"@kenjisalk @iSmashFizzle Carmen Sandiego > Thomas Crown","@AntonSirius","cultural-icon",
"New post (Where's Waldo and Carmen Sandiego...) has been published on 2017 Halloween - https://t.co/jrIUGM9VOy https://t.co/Q8L7a0vvaz","@Halloween_2k17","cultural-icon",
"At any given time I’m thinking about one thing: Kerry Washington in full Carmen San Diego cosplay","@BradClayton11","fashion",
"Carmen Sandiego #whereintheworld #mua #worldclass #mensstyle #fashion #makeuplooks #macboy #cosmetics… http://t.co/xL18KRl2iE","@henkster91","fashion",
"Annnnnnnd our next trip is booked 👍 @Dan_Flannigan #travelers #carmensandiego","@MeghanMcCaffrey","travel","x"
"@midwesttraveler screw Carmen San Diego. Its more like ""where in the world is @jondavidson ""","@bad_belvin","travel",
"Gamification! Now you're singing my song! I employ games wherever I can. Gamified PD to learn Schoology was started two years ago. Right now, I've stolen @irvspanish's Carmen Sandiego idea for my geometry class using @DeckToys and @breakoutEDU. #12DaysofSchoology","@JaredRLopatin","edutainment",
"And just like that Carmen Sandiego is on my cosplay list. The only villain I truly loved as a child.","@Pandoya","fashion","x"
"Mistigram: @Dubaiwalla is kind of like Carmen Sandiego in that you never know where in the world he'll be turning up next.  This architectural photograph of his is of the ceiling in an atrium in The Netherlands' foreign ministry, and was included in this… https://t.co/XiZIlmIel5 https://t.co/tQNb8dLKHx","@mistfunk","travel",
"#fbf to my days of robbing banks, #carmensandiego style 😎 #photoshoot with the fantastic duo spyology… https://t.co/6qwH50HITq","@alikends","fashion",
"When you can't decide between play dough work and Carmen Sandiego cosplay https://t.co/JIAw78gEeU","@PDXIrish","fashion",
"I just listed: 'Where In The World Is Carmen Sandiego?', for $22.99 via @amazon http://t.co/NAvYxS2DqQ","@2ndroundmusic","cultural-icon",
"All dressed up...going to work as #CarmenSanDiego","@Jabyp","fashion",
"It's Friday! If you were Carmen Sandiego, where in the world would you want to be this weekend? #TGIF #travel","@COMOHotels","travel","x"
"All I knew how to do on the computer was play Oregon Trail and Where is Carmen SanDiego. This is such a great opportunity for girls. #STEM #coding #girlpower","@kelleyk525","edutainment",
"This will be perfect!!! @HereIsGina 👏🏼👏🏼👏🏼 #CarmenSandiego @netflix https://t.co/KAA6MQpsHD","@JonOlivencia","cultural-icon",
"I played Carmen Sandiego on a floppy disk when I was 10 and I thought it was pretty bad ass. 🤷🏻‍♀️","@KelseeBlake","cultural-icon",
"Gina Rodriguez To Play Carmen Sandiego In Live-Action Netflix Film https://t.co/fziFKedleq","@ShonaMo","cultural-icon",
"@MeatSauce1 Thanks Carmen Sandiego","@Thanks70257451","cultural-icon",
"Gina Rodriguez Where in the World Is Carmen Sandiego Casting | via @POPSUGARLatina Latina https://t.co/GxAMnHY6zU","@RitaVee_","latina",
"@NBCNightlyNews ""Something iconic has gone missing in London..."" I bet Carmen Sandiego stole it. #BigBen","@schnautzr","cultural-icon",
"Paul calls Tiff Carmen SanDiego with the hats & he says he's over it #bb18","@JennEllensBB","fashion",
"Jane The Virgin’s Gina Rodriguez To Star In New Netflix Series Carmen Sandiego https://t.co/17v5pGa8gh https://t.co/h2KikW2X8u","@360Nobs","cultural-icon",
"This emoji 💃 is actually a low key Carmen SanDiego without her hat","@lilsmokedog","fashion","x"
"Since it is 4 am, I am up for the day. Cannot sleep in hotels. And flight leaving soon. Goodbye Mississippi. #carmensandiego","@SarcastiCarrie","travel",
"Drake's Dad Does His Best Carmen Sandiego Drake's dad must have a thing for adventure, mys https://t.co/AjcqpgpnTn","@blacq2","travel",
"@MeWeFree Carmen’s Hat? Like Carmen Sandiego? Lol","@charlee_buns","fashion",
"Netflix's 'Carmen Sandiego' debuts on January 19th, 2019 https://t.co/xl3begASiN","@DNSRainbowNews","cultural-icon",
"@Tierney_Megan the accuser is Carmen Sandiego","@Yedois","cultural-icon",
"@SarahLikesPink @PushinUpRoses Are you reviewing a Tex Murphy game? Yes. If not, yes! Also acceptable, an oversized sun hat with extra-wide brim like Carmen Sandiego.","@Simon_Ashtear","fashion",
"SNL' Tries Some Edutainment With 'Where In The World Is Kellyanne Conway?'⏩ https://t.co/yvMTEorGJ2 Chris Pine as a Rockapella crooner. Y…","@humbertoemelec","cultural-icon",
"Growing up I had educational TV. Reading rainbow, Bill Nye the science guy, magic school bus, Carmen San Diego. Children's TV now is 🚮","@JENNY4RMTHEBLOC","edutainment",
"Gina Rodriguez will be donning the red fedora and trench coat of Carmen Sandiego for Netflix https://t.co/LLWKVGjiO1","@tech_politics","cultural-icon",
"Is it just me or does Agent Carter's hat look like Carmen Sandiego's? #agentcarter #carmensandiego","@ki4rex","fashion",
"Just noticed that when I wear cap sleeves my moose looks like he’s working on a Carmen Sandiego cosplay https://t.co/TlHo3Ieabk","@generdica","fashion",
"DiggTop: 'SNL' Tries Some Edutainment With 'Where In The World Is Kellyanne Conway?' https://t.co/ZSc7IGn3q0","@TLWNewsPump","cultural-icon",
"Gina Rodriguez will star in and produce Netflix’s live-action Carmen Sandiego movie https://t.co/LlBTN1UM23","@NYDailyNews","cultural-icon",
"Netflix Takes Aim At Hollywood With Gina Rodriguez's 'Carmen Sandiego' https://t.co/qXFq09lxte","@paulmac708","cultural-icon",
"Then you find out that you and Carmen Sandiego share the birthday day and then you have no other option but to cosplay her.","@BeaIank","fashion",
"The first pic is literally Carmen Sandiego meets Cowboy Bebop. I'd be hip to it.","@FinalAeons","cultural-icon",
"omfg ""The only person who can wear a fedora and earn my respect is Carmen Sandiego"". #MRA","@noctis_vernum","fashion",
"Trish is looking like Carmen San Diego in that red coat. #LethalWeapon","@cbarajas82","fashion",
"I bet Carmen San Diego is hiding under Pharrell's hat.","@DCYanda20","cultural-icon",
"Carmen Sandiego' #Reboot Headed to #Netflix - Rolling Stone #carmensandiego https://t.co/tq5FvNxBYg","@TheDirector2730","cultural-icon",
"@monicabyrne13 The only Carmen I'm familiar with is the character Carmen SanDiego, and she wears a red spy trenchcoat and hat.","@Duecenage","fashion",
"Gina Rodriguez to voice Carmen Sandiego in Netflix animated reboot https://t.co/nXXtQWKx8u #happeningnow","@Newsofthehour1","cultural-icon",
"A lot of the games I played put dreams of travel in me: Carmen Sandiego, Leisure Suit Larry 5, Indiana Jones and the Fate Of Atlantis (what should’ve been the 4th Indy movie but we got Crystal Skull instead.) They used real locations which just made it more palpable.","@nyhcmaven84","cultural-icon","x"
"Gina Rodriguez Set to Steal Our Hearts as Carmen Sandiego in Netflix Live-Action Movie https://t.co/KGluSlg0uO","@mrwilliamlaw","cultural-icon",
"@FeministaJones Giving us “Where in the World is Carmen Sandiego?”","@axolROSE","cultural-icon",
"This made me chuckle, but now if there isn’t a Carmen Sandiego alt costume Ill be very sad. https://t.co/rtg10A2OMD","@crystalskyes80","fashion",
"Why is Cam Newton dressed up like Carmen Sandiego","@DonnieDarko1023","fashion",
"Why is #Joseline dressed like Carmen Sandiego with that red hat? #LHHATL","@leila_estes","fashion",
"Still unsure where I got that Carmen San Diego style hat last night, but it looked 🔥🔥","@colemanhell","fashion",
"RottenTomatoes - Our first look at Netflix's new Carmen Sandiego animated series starring Gina Rodriguez. She's back January 18. https://t.co/ZBQU5jCRjE","@CinemApp_CineUK","cultural-icon",
"Where In the World Are Carmen Sandiego's Car Keys? #RuinAVideoGame @midnight","@Brewmeisterjw","cultural-icon",
"There’s not a day that goes by that I don’t think about Where in the World is Carmen Sandiego PC game","@hannafloyd","cultural-icon",
"EW has the exclusive first look the #CarmenSantiago animated series on #Netflix. The lead character will be voiced by Gina Rodriguez. https://t.co/dzT9Ko0yQw","@reddotdiva","cultural-icon",
