"text","handle","category","star_tweet"
"#gizmodo: My Family Died Of Dysentery In The Palm Of My Hands - And I Loved Every Minute Of It - Before kids hunted for Carmen Sandiego, in a time when computers could barely muster a few on-screen colours, a game called The Oregon Trail taught studen... https://t.co/YTysbo74ai","@TferThomas","cultural-icon",
"hahaha meu orientador: ""Not sure whereabouts in the world you are at the moment"" carmen sandiego feelings hahahahaha","@mandybc","cultural-icon",
"Gina Rodriguez to star in Netflix’s Carmen Sandiego movie https://t.co/RIBRRH4j5x https://t.co/6KQ92QpRPA","@marylui27","cultural-icon",
"Gina Rodriguez cast in Netflix's 'Carmen Sandiego' movie - Fox News https://t.co/gCnLIQIDlj https://t.co/hObcMaIjX0","@MoviesWrld","cultural-icon",
"I love old educational television. Similarly, a reminder that I would pay BIG MONEY for Super Solvers HD Collection https://t.co/FLlHKar7iC","@BardicKnowledge","edutainment",
"Netflix to find Carmen Sandiego in January https://t.co/RPZ24ntFLp via @kidscreen #kids https://t.co/f2Wd20Jjbo","@BloomAhti","cultural-icon",
"@MatthewACherry @netflix I have three daughters. I wish there were more engaging shows like Where in the World is Carmen SanDiego for them rather than @YouTube","@R_Nevy","cultural-icon",
"Netflix is making a Carmen Sandiego show starring Jane the Virgin’s Gina Rodriguez https://t.co/FUTHnEvQlV https://t.co/ZclVEVAx1D","@Thetechlicense","cultural-icon",
"Most people cite #CarmenSandiego has the quintessential fedora wearing female badass. For me, it's #CyberSix. https://t.co/qGTT71QSeD","@themage26","fashion",
"#Poster Netflix: Where on Earth Is Carmen San Diego? https://t.co/VKEKPtfnXn","@ComicZulia","cultural-icon",
"I wish I had a red trench coat I would be carmen sandiego.","@LookAtLollyy","fashion","x"
"this girl dressed up as carmen sandiego in fresh off the boat IS ME https://t.co/uvAHQnrOkY","@aprikii","fashion","x"
"Netflix Is Reportedly Reviving Carmen Sandiego With Gina Rodriguez https://t.co/uB8EVJiQes https://t.co/DaDW2BDyNd","@WTAE","cultural-icon",
"Where In the World Is Carmen Sandiego? On A Netflix Animated Series, Voiced By Jane The Virgin Star Gina Rodriguez https://t.co/iVEiXqzuoK","@deadpoolspeaks","cultural-icon",
"Netflix is rebooting Carmen Sandiego? All I have to say is, it better have this for the theme... https://t.co/XxmntQH7rw","@thedork_knight","cultural-icon",
"As many times as #CarmenSanDiego #escaped on an #airplane, I #bet she has enough #airmiles to #buy a #trip to #mars. #WhereInTheWorld #WTF","@Gregster357","travel",
"I’m still thinking about the woman who walked into the store yesterday in a denim overcoat and bright red purse and Carmen Sandiego hat. Teach me your ways queen cause girl was serving LOOKS","@davidmarzano","fashion",
"Netflix to Reboot 'Carmen Sandiego' https://t.co/jcwZRMcWFa #MyMusicGrind https://t.co/Jlha6rAyQd","@ky_darius","cultural-icon",
"Yes! Loved this show! Sounds Like Netflix Is Bringing Back 'Where In The World Is Carmen Sandiego?' https://t.co/tZZkpTNS8y","@therealmissym","cultural-icon",
"Felicia Beechie Haney getting in some of her usual style points #blackgirlsrock #carmensandiego https://t.co/eS8dbDhBSt","@houseofchill","fashion",
"@SofiaCarson U r the real life Carmen San Diego... Except ur playing Where in the World is Carson San Diego","@Savannah2Y","cultural-icon",
"Today I dressed up as Carmen Sandiego, and completely independently of that, my classmate was Waldo. Beautiful unexpected things do happen.","@PetrichorInF","cultural-icon","x"
"@GreyDeLisle ""So is a clever woman"" -Carmen San Diego","@eric_olivo","role-model",
"@JoannaStern You didn't dress up as Carmen Sandiego... WHY????","@jrsydevyl","fashion",
"Disappointed I wasn't approached to be the voice of the new Carmen Sandiego. I look awesome in hats and trench coats.","@CarlinAida","fashion",
"I come bursting onto the TL Kool-Aid guy style to yell at everyone I don’t know what in the world Carmen Sandiego is.","@DrScotchNSoda","fashion",
"@colferbert don't forget the carmen sandiego hat and sunglasses indoors! that was such a good day.","@anannafesto","fashion",
"@mayormike75 @LastWeekTonight me and @Sammymoe will dress up as Waldo and carmen sandiego... #IHaveNeverSatInAPremiumLocation","@mayormike75","cultural-icon",
"@nerdist Captain Marvel Wonder Woman Buffy Summers Carmen San Diego Eleven","@JeremyBiz","cultural-icon",
"top left banana carmen sandiego lookin https://t.co/E6Nmn04HPW","@rekka236","cultural-icon",
"Carmen Sandiego was a bad in an almost Robin Hoodian way—except I guess she kept stuff? Unclear. I was excited she was Latina. https://t.co/SpvDY7fuXA","@TheMadameMeow","role-model","x"
"Carmen Sandiego is my dream girl!","@Alex_Brennan16","cultural-icon",
"@smashified Where on the Battlefield is Carmen Sandiego?","@NintendoForce","cultural-icon",
"lmfao i was looking through the CDs in my car and i have a carmen sandiego cd in the passenger side map pocket","@falldamaged","cultural-icon",
"@rollinrabbits Where in Time is Carmen San Diego taught me all I know","@devengreves","edutainment","x"
"""New plan for Halloween: you dress as Waldo, I’ll dress as Carmen San Diego. We can just hide in a..."" http://t.co/0fezLiPLks","@EpicBert","cultural-icon",
"Netflix is making a Carmen Sandiego movie with Gina Rodriguez - CNET https://t.co/nyshyxFbF5","@Trending_Global","cultural-icon",
"in the past week... louisville cincy toledo cincy louisville cincy columbus lorain columbus and its not over. i feel like carmen sandiego","@KatieMo2012","travel",
"@ScandalABC “@ScandalABC http://t.co/MvOy5RfFHA” she's w/ #CarmenSanDiego think about it ...They're both fab women in coats&hats! http://t.co/P8oMzOOyLX","@BobblHeadLives","fashion",
"Where on the World is Carmen Sandiego was just the best game ever, wasn't it? I mean, C'MON. Educational and fabulous http://t.co/hNUqze2GqF","@PaddyFreeland","edutainment",
"Kennedy lies on the podium, the refs call a technical they didn't have to, and A&M travels like Carmen San Diego https://t.co/9GLyFJXcgp","@JMartJamboree","travel",
"javiera mena cosplays as carmen sandiego, laura croft, other amazing outfits. where in the world is she? https://t.co/owwidhKu9v","@samcmac","cultural-icon",
"carmen sandiego is either a) the person who best embodies the yolo lifestyle b) secretly the greatest history teacher in the world","@howsurdabin","edutainment",
"Netflix is betting on ‘90s kids nostalgia https://t.co/plyLhNs7WL via @Polygon","@dcllive1","cultural-icon",
"Pokémon Go to the Past is going on the list of games I wish I had a company to publish, right below my all-time dream software title, Where in Hell Is Carmen Sandiego?","@zgryphon","cultural-icon",
"My question is why would you make a worldwide mystery adventure movie out of CLUE when you could do Carmen Sandiego https://t.co/OHYY3r33qO","@LaurenTHCW","cultural-icon",
"Catching Carmen Sandiego: Part 2- Razor Sharp Reasoning: http://t.co/jODsQVKOID Indian Trips for hipsters http://t.co/dWI5FQa9j9","@kunalmathur","travel",
"Gina Rodriguez To Star in Live-Action Carmen Sandiego Netflix Movie https://t.co/YBbN2QyYpG https://t.co/pmYCAAO1Ni","@EpicLootDrop","cultural-icon",
"#nowplaying Where In the World Is Carmen Sandiego? by Rockapella http://t.co/TftkkEtY5E","@atyamasu_bot","cultural-icon",
"Goodies from EB Games today. Carmen Sandiego was one of my heroes growing up. Love the games and I loved her. Strong, independent woman who literally took what she wanted out of life. #OctopathTraveler #carmensandiego https://t.co/3Qg52UfjBE","@gamerfaith","role-model",
"@Fearless_Fred Would you accept #CarmenSandiego as an anti-hero? Because that's exactly what I want. Punisher, but Carmen.","@nickthetrekkie","cultural-icon",
"Some mornings I feel like Carmen Sandiego and wonder where in OK I willI be today? I will let you know in a bit. #OklaEd","@jzweiac","cultural-icon",
"Rasheeda got on that Carmen Sandiego outfit on #LHHATL","@ATLREPPA","fashion",
"Ahhhhhh I was low key obsessed as a kid. ⚡️ “Netflix greenlights a Carmen Sandiego series” https://t.co/Jie06xR1bT","@femfoodienoir","cultural-icon",
"If this is the art style used in the new Carmen Sandiego Netflix series then count me in! 👍 https://t.co/ChXu64CqW0","@DannyLaShep","cultural-icon","x"
"@AngieWorldOrder Another flight? Carmen Sandiego whomst?","@BlackFranFine","travel",
"#KimJongUn, Waldo, Carmen SanDiego & the Starbucks barista who disappeared into the drive-thru window with your credit card 10 minutes ago.","@jim_gourley","cultural-icon",
"@FaShionMaja just trying to travel the world like u Carmen San Diego","@CrysROCSurworld","travel",
"Carmen Sandiego Returns in a New Educational App https://t.co/M7emUOkfgH https://t.co/DRwRUix2IW","@RachelbsweeneyB","edutainment",
"Gina Rodriguez to Voice Carmen Sandiego for Netflix https://t.co/VhAhQd8EH6","@Filmedia","cultural-icon",
"Gina Rodriguez to Star in Live-Action 'Carmen Sandiego' Feature for Netflix - Hollywood Reporter https://t.co/4PuFJxSMvk https://t.co/nIccfNZsHR","@PeopleWorldNews","cultural-icon",
"I want to disappear for a full week. Carmen sandiego style.","@QueenBriana23","cultural-icon",
"@soWWMD @Realjmannarino You haven't been through healthcare till you've been thru carmen Sandiego's healthcare. Its an adventure everyday.","@charlesmaynar10","travel",
"How Carmen Sandiego accidentally became an educational game icon https://t.co/QUldC0aLYM","@GamerGeekNews","edutainment",
"@alexharpermodel Wow! You are quite the jetsetter. Forget Carmen Sandiego. Someone should develop a ""Where in the World is Alex Harper"" game. 😉😘💖✈🌎","@freefunlover","travel",
"@missnatoshi This coat makes your look like Carmen Sandiego, I like it","@Missconsin","fashion",
"A little Halloween fun. 💄🎃 #carmensandiego #halloween http://t.co/UC55GCrRpu","@queenofspades14","fashion",
"#Gina Rodriguez to Voice Carmen Sandiego in Netflix Series - https://t.co/tkALnLiGfC https://t.co/11s0G3G4Jb","@yemekyapmaknet","cultural-icon",
"Netflix Is Reportedly Reviving Carmen Sandiego With Gina Rodriguez https://t.co/WLaQwL6hTk https://t.co/3gqblFpYrJ","@wbaltv11","cultural-icon",
"0.6: Sounds like Netflix is bringing back ""Where In The World Is Carmen Sandiego?"". unknown location any weapon place.","@headlinejokebot","cultural-icon",
"@sarah_connors everyone who travels regularly should be required by law to wear a Carmen Sandiego outfit","@ari_raid","fashion","w"
"Taking style notes from Carmen Sandiego. #streetstyle #carmensandiego #incognito #denim @ Alfred… http://t.co/aznGMuUqVv","@Always_Judging","fashion",
"Remember when I used to pretend I'm Carmen Sandiego and how much you hated it when I called you Waldo? I miss.","@Her_Randomness","fashion",
"Also, Where in the World Is Carmen Sandiego?","@mocksibrown","cultural-icon",
"Thank you for your contribution, Anonymous. Very Carmen Sandiego of you. #gogofilm","@LastManRocking","cultural-icon",
"In an uber car in London going to the airport to get to Paris. It's 3am here. #carmensandiego","@jolinda22","travel","w"
"https://t.co/mqujiXqw8C New Carmen Sandiego animated series coming to Netflix in 2019 https://t.co/ezEzh8oaK5 (via Flixist) https://t.co/MF0","@Games2Gold","cultural-icon",
"Where in the USA is Carmen Sandiego? (Board Game): Purchase Where in the USA is Carmen Sandiego? (Board Game) ... http://t.co/bqTTL9HNu7","@NMindtheBollox","cultural-icon",
"I would watch so much Carmen Sandiego if it was on netflix","@88mugsy88","cultural-icon",
"@GinxTV ether mickeys world of illusions on the mega drive or Where in the World is Carmen Sandiego","@Samos89","cultural-icon",
"Already have my next Halloween costume planned out. Carmen Sandiego. My date&39;ll go as Where&39;s Wally. Always wanted to do that","@daughertyaj332","fashion",
"‘Where in the World is Carmen Sandiego?’ Netflix, Of Course https://t.co/vuOVJTTQS6","@nerdbastards","cultural-icon",
"*patiently waiting for Netflix to release 'Where in the world is Carmen San Diego?' & 'The Magic School Bus' series* 🙆🏻","@reneemacasaet","cultural-icon",
"Eat your heart out Carmen Sandiego. ✌🏼️🇻🇳 #GluSandiego #90skid #GLT #travelgram #nam… https://t.co/OhfRXwmLJt","@Sticky__Icky","cultural-icon","x"
"Where in the world is Carmen San Diego? 🎃 #Halloween https://t.co/k9IWAyACLp","@katika_0","fashion",
"#Fashion Lady Gaga Is Really Into Dressing Like Carmen SanDiego Lately https://t.co/8BIzvdxPQU","@BraamFashion","fashion",
"yes! A reboot I'm excited about ... 2019 feels so far away. https://t.co/y0rUoDs656 #CarmenSandiego #netflix","@goldfederation","cultural-icon",
"Netflix Is Rebooting 'Carmen Sandiego' With Gina Rodriguez https://t.co/LNjahrWCJP https://t.co/74YSCdunhT","@hot105nonstop","cultural-icon",
"How Carmen Sandiego accidentally became an educational game icon https://t.co/VMKFpmAmx6","@VoidSwimmer","role-model",
"I couldn't tolerate Jay-Z and that rap thing so I foolishly took a nap thinking it was over and i'm sorry because I would have loved to see those Carmen Sandiego costumes.","@Kevunn","fashion",
"Carmen Sandiego' Reboot Headed to Netflix https://t.co/hItC7l3mjP https://t.co/BoeczbnqTO","@Amontanafm","cultural-icon",
"@mtracey shameful of her to try to gain sympathy from millennials by dressing up as Carmen Sandiego","@ActualLiam","fashion",
"Our own #CarmenSandiego is headed to @netflix! Thrilled to produce the new series starring @HereIsGina & @FinnSkata: https://t.co/s4Wsai7NET","@HMHCo","cultural-icon",
"Art Briles would do horribly on Where In The World Is Carmen San Diego. #Geography #Baylor #AlabamaAndFloridaAreInTheSouth","@RossRead","cultural-icon",
"Stranger Things Star Joins Netflix's New Carmen Sandiego Animated Series - IGN https://t.co/bajxryzG6U https://t.co/8V5Yiw2imQ","@ThisOnline_Co","cultural-icon",
"My mother at Dottie's red hat, ""I thought that was Carmen Sandiego."" *dies laughing* #AgentCarter","@silverwolfstar7","fashion",
"@PushinUpRoses Brag about how his edutainment collection is more comprehensive than anyone else's because he managed to snag the WiiWare Carmen Sandiego Adventures in Math games before it was too late.","@LotusPrince","travel",
"I lost it at Christine with the Carmen San Diego hat. ;__; xD","@CountDmitri","fashion",
"A mere 10 days following Halloween, and I am planning my costume for next year. I think I would make a hot Carmen Sandiego, don't you?","@DarkLadyBritt","fashion",
"I wish I had the photoshop skills to make some Where In The World Is Carmen Sandiego memes based on Eugene Melnyk and his being MIA at the BOG","@NHL_Boss","cultural-icon",
"Alcohol is evil but I'm gonna mule a large amount of beer across state lines in a giant suitcase on a greyhound bus because I am an awesome sister and I feel sneaky like Carmen Sandiego https://t.co/1N4dyuw0v0","@megansarahj","travel",
"@bravescarmen @aubietiger1928 couple choices, Car-Car, Carmen San Diego, Sherri, Carl, Carpet or just Car.","@BrandonBravos","cultural-icon",
"Bruh traveling like Carmen Sandiego","@MIGUELGUAPISIMO","travel",
"Where in the World Adult Costume #carmensandiego #halloween #costumes https://t.co/FSyBZxPAoL","@purecostumes","fashion",
"Where in the World Is Carmen Sandiego was a trip. The format was genius. It was like a game show, but Greg Lee and The Chief had these...","@JoeyWinterDay","cultural-icon",
"I'm not saying I'm a geography nerd, but I named my daughter Carmen Sandiego.","@fatuussapiens","cultural-icon","x"
"Why does no one talk about Carmen Sandiego as a feminist icon for young girls? She's a bad ass, self-sufficient woman who don't need no man.","@_Michaela","role-model","x"
"What You Learn Hunting Carmen Sandiego Without Google's Help: By Jason Iannone Published: December 05th, ... https://t.co/ajS6ovdzIp","@laughsillusions","edutainment",
"She found me!!! #CarmenSandiego #photobomb #HappyHalloween #OctoberZone #troubleseason pixz4fun http://t.co/CEs3jSZPr1","@KillaKarla928","fashion",
"The Reboot of ‘Carmen Sandiego’ to Premiere on Netflix in January Deadline reported, the reboot of classic anime series ‘Carmen Sandiego’ is set to premiere on January at Netflix. The streaming service has set Friday, January 18 as the release date. Th... https://t.co/uOekFca7hB https://t.co/D4Yuhmamla","@Amadeus2k","cultural-icon",
"My daughter going w/ the Carmen Sandiego look for hat day at school... https://t.co/GheUfbxiBw","@BKLYNGODFATHER","fashion","x"
"Carmen Sandiego books were lit tho. Flippin all through them mfers.","@tonedibiase","cultural-icon",
"@SusanArendt Why not a red trenchcoat too? Be Carmen Sandiego instead?","@vbarreirojr","fashion",
"#BREAKING Carmen Sandiego has been found! https://t.co/Pfx62u3GhE #retrogaming #retro #edutainment","@gamingswagblog","cultural-icon",
"Netflix no para de sorprenderme. https://t.co/zg6eQkVQCj","@LeandroElPipo","cultural-icon",
"@netflix sooo... How about that Carmen Sandiego??","@gracequaintance","cultural-icon",
"Haha.. Lov it!! ♥️ Where in the World Is Carmen Sandiego? At the Paris Haute Couture Shows https://t.co/V2Vgkl2SxD #fashionblogger https://t.co/eJxe24yC2h","@theriz_re","fashion",
"Oh snap! Carmen Sandiego is coming to Netflix!","@Unknown_Star","cultural-icon",
"@netw3rk He’s also traveling more than Carmen Sandiego am I right","@parquetsays","travel",
"Incognito Khloe Kardashian Channels Carmen Sandiego With Her Trench And Fedora: Where in the world is Khloe… http://t.co/x4Me5L2z7F","@test88ing","fashion",
"@WatTsu42 I like it. Sassy. Stylish. Very Carmen SanDiego.","@EricLloyd","fashion",
"#IfIWonPowerball I'd travel the world. Trying to find Carmen San Diego","@WindRiverII","cultural-icon","x"
"Spanning the globe like Carmen Sandiego! Remember Pek's video of that?","@TheTWolvesFan","travel",
"The first strong female character for me while growing was Carmen Sandiego and the first time I really saw myself well represented on screen was with Katherine Barrell playing Nicole Haught so...SEEING THIS IS COMPLETELY MINDBLOWING. Damn. https://t.co/ARVCvia5It","@john_henry_","role-model",
"@MissFushiGaming So that's where Carmen Sandiego is.","@TheMadSmith","cultural-icon",
"""@Pisces_HC: #Pisces has traveled half way around the world while you are still putting on your shoes."" #CarmenSandiego","@_GentleOriental","travel",
"GINA IS GOING TO PLAY CARMEN SANDIEGO IN A NETFLIX ADAPTATION? LEGEND","@standbyggyu","cultural-icon",
"Making a few minor alterations for optimum Carmen Sandiego Halloween. http://t.co/Ntr4Iusekf","@Han","fashion",
"Gina Rodriguez to Star as Carmen Sandiego in Live-Action Netflix Film https://t.co/ACCrxNHZgv","@kmazfm","cultural-icon",
"Our Childhood Dreams Have Come True: Gina Rodriguez Is Playing Carmen Sandiego On Netflix https://t.co/he3vFNlT9s","@DMCKentAten","cultural-icon",
"@enews ""Where in the world is Carmen Sandiego? All clues lead to Netflix (Gina Rodriguez). https://t.co/3BBpV6i0EC"" https://t.co/TzdVZoab4l","@Ktwilson82","cultural-icon",
"How Carmen Sandiego accidentally became an educational game icon https://t.co/eQwVkDizOA","@GameArtWales","edutainment",
"@nicksays_summer Omg. Totally read that in ""Where in the World is Carmen Sandiego"" tune LMAO","@bcase82","cultural-icon",
"As she got older and the gray fog of dementia crept into her mind, Carmen SanDiego wouldn’t know where in the world she was.","@AAxline","cultural-icon",
"Carmen Sandiego Coming to Netflix, Voiced By Jane the Virgin Star https://t.co/JNmL2cdUhZ https://t.co/You4Z9Xx31","@zesty_tv","cultural-icon",
"Sam Nunberg just needs a red trench coat and a fedora and he could be the next Carmen Sandiego.","@mitty1375","fashion",
"There's a woman on this flight dressed like Carmen Sandiego","@mikeiadevaia","travel",
"When I started teaching Where in the World is Carmen Sandiego was the it game. 21st Century version -Where in the World is @emitoms Enjoy","@wyowayne68","edutainment",
"@ColorMeRed your thumbnail reminds me a little of Carmen San Diego. I'm a geography major #MSc","@9ERSorBUST","cultural-icon",
"Netflix’s Carmen Sandiego Gets First Image Plus New Cast #Netflix #ComingSoon https://t.co/i1bm3SU2W6","@Netflix_Updates","cultural-icon",
"Netflix’s Carmen Sandiego Gets First Image Plus New Cast https://t.co/YQFrnZMWrv","@OneFortyReviews","cultural-icon",
"Netflix's 'Carmen Sandiego' debuts on January 19th, 2019 https://t.co/c1uEeGZyRi (https://t.co/9rLpzYUT9X)","@exatienda_com","cultural-icon",
"#WhereOnEarthIsCarmenSandiego : a master class in crime https://t.co/PoH6qXmA9v #cartoons #edutainment #CarmenSandiego #FoxKids #nostalgia https://t.co/K3Jt9tyPtm","@GamingRebellion","cultural-icon",
"@ApeyBee U got tickets for everything! I go on one trip & people callin me carmen San Diego haha ... I bet I got Ye tickets to sell already","@_BigSheed","travel",
"Happy Halloween from the original #MissTravel! Looking for the perfect travel themed #Halloween #costume?? #CarmenSandiego #WheresWaldo https://t.co/fLChnRiTuW","@DateMissTravel","cultural-icon",
"@Gamer_GFX “@Gamer_GFX: Where in the world is Carmen Sandiego?” Shes in my car man in san diego","@ALIENAIRWRECK","cultural-icon",
"They need to put Where In The World Is Carmen San Diego on Netflix. I need to call them.","@jdK1051","cultural-icon",
"@TokyoCourtesan @AvaZaneXO Thank you!!! 😍😍😍 Carmen San Diego was my cartoon crush when I was a kid 🌏🌎🌍","@MeetJosieQu","cultural-icon",
"New hat got me feeling like Carmen sandiego http://t.co/zxqmVKtlBA","@Lexnosex_","fashion",
"Debating on trying to convince my boyfriend to go as a couple costume for Halloween. Carmen San Diego and Where's Waldo.","@NowWriteItOut","fashion","x"
"Gettin' my Carmen Sandiego on. #Halloween #LateNightShopping https://t.co/5PZWwikEm1","@nomdeplume_83","fashion",
"@stevemaythe1st @designtaxi Carmen Sandiego's hat?","@dominiquebyron","fashion",
"In addition to voicing #CarmenSandiego in a Netflix animated series, @HereIsGina will play the criminal mastermind in a live-action film for the streaming giant https://t.co/dp652w66Ru https://t.co/GoFdJXfrTc","@MyTrackingBoard","cultural-icon",
"A CW star has locked down the role of Carmen Sandiego in the Netflix Reboot! https://t.co/TRMDCyLiVf https://t.co/SVjRyNfjRY","@kiss957","cultural-icon",
"This woman is wearing so much red I thought I just found Carmen SanDiego.","@KerianneCardiff","cultural-icon",
"How Carmen Sandiego accidentally became an educational game icon - https://t.co/oBAneoByvI via @gamasutra","@ego_wall","edutainment",
"@Andrea_Rosu Oh, jeez, that looks AWESOME. And you are killing it in that outfit, Carmen Sandiego hat and all. :)","@jeffmac813","fashion",
"Where in the world is Carmen Sandiego?","@sarah_landon","cultural-icon",
"ENJOY GUYS, WOULD LOVE A RETWEET! LOOKING for Carmen SAN DIEGO: A WEST COAST journey. https://t.co/ZYxXOXNEVL via @YouTube","@iMade_YouLook","travel",
"What in the where in the world is Carmen San Diego ???","@BombSquadTV305","cultural-icon",
"@people #ThisShowRightHere “@people 10 reasons Where in the World Is Carmen Sandiego? was the best educational TV show ever https://t.co/GmRIdDyyCQ”","@reedjl","edutainment",
"I'm so excited for this Carmen Sandiego reboot even though I only saw the show in Spanish.","@UNORTHODOXING","cultural-icon",
"@LLIJJ41 Yes!! Lol ur like where in the world is Carmen San Diego?! ✈🌍🌎🌏","@s_hill84","travel",
"My Carmen Sandiego meets India Arie travel look 🔎📸 . . . . #wcw #love #livefree #fashion #model #pose #amsterdam #throwback #netherlands #naturalhair #travel #btm #coach #rayban #trenchcoat #mua #ootd #smile #serenity #ariesseason #aries #aprilbaby #lamode #instagoodMy Carme… https://t.co/FZhcvj8mZ2","@mjoi1584","travel",
"@netflix I have a spec script for #CarmenSandiego if you’re interested. No joke.","@Miss_Hils","cultural-icon",
"Gina Rodriguez To Star As Carmen Sandiego In @Netflix Live-Action Feature https://t.co/thGi494Xvx via @deadline @HereIsGina #television #film #streaming #video #onlinevideo #Hollywood","@MakerBasic","cultural-icon",
"@VampyBitme looks like Carmen Sandiego only wearing black & planning her next move. https://t.co/svDMgGQBLm","@junobi_wan1412","fashion",
"Report: Gina Rodriguez Cast in Carmen Sandiego Animated Series for Netflix https://t.co/JE0GPhLemE","@BadBlueTech","cultural-icon",
"So there seems to be a Max Black Rabbit floating around #FC2016 who is taking on, on the spot commissions. Find him, Carmen Sandiego style!","@KyeraSkerpent","fashion",
"Netflix plans live-action 'Carmen Sandiego' film with Gina Rodriguez https://t.co/fWZRxFnqZi","@DNSRainbowNews","cultural-icon",
"@chicazul kinda reminds me of a Carmen Sandiego after a long trip and some booze","@lukec","travel",
"@theothervoices Thank you for all the recent retweets (but not for what you did to Carmen Sandiego!)","@StarTalkRadio","cultural-icon",
"#GinaRodriguez will be the voice of #CarmenSandiego in Netflix's new series. https://t.co/JhLhVU7UPP","@diverselygeek","cultural-icon",
"Where on Earth is Carmen San Diego will never get old to me....tht show taught me everything lol","@thedonjr16","edutainment","x"
"I stan ""Where in the World is Carmen Sandiego?""","@samanthamillie_","cultural-icon",
"I'm so happy my Carmen Sandiego costume was well-received ☺️ #HalloweenCostumes http://t.co/6lh23NEIbE","@crystatimmerman","fashion",
"@abcnews I remember Where in the World is Carmen Sandiego & that was a great way to learn geography. 👾 #gamification","@8e7an","edutainment",
"@KelseyChapstick Whoa, so THAT'S where in the world Carmen Sandiego is!","@stormbeard","cultural-icon",
"my formative game experiences were the windows 95 game sampler cd-rom, clyde’s adventure, where in the US is carmen sandiego, and animal quest v 2.0","@spammm","role-model",
"Carmen San Diego, Minecraft, and more. @gzicherm discusses why #gamified learning tools work http://t.co/nUgNCgDvQ6 @TEDTalks #education","@pingpongstory","edutainment",
