"text","handle","category","star_tweet"
"Gina Rodriguez will be donning the red fedora and trench coat of Carmen... https://t.co/rxhiUyinLB https://t.co/xZ9HnWb5iC","@1001ptUS","style",
"#fashion #style Lady Gaga Is Really Into Dressing Like Carmen SanDiego Lately https://t.co/vezS0Sym1B","@GoFynd","style",
"Frankly I am *shocked* to learn that there were 87 winners on Where in the World is Carmen San Diego. I thought for sure there were only about...6 or 7.","@mikeapi","pop culture",
"Pretty happy with Emma and my couples costumes: Carmen Sandiego and Waldo https://t.co/4dvAqr5pOF","@BantamSam13","cultural icon",
"@SarahSecord You could so cosplay as Carmen Sandiego.","@SolusLupus","style",
"https://t.co/RGkbvYRR3C Vintage Red Doeskin Womens Fedora Black Strip Hat Bollman Co. Carmen Sandiego","@MerryKicks","style",
"There's a woman dressed like Carmen Sandiego on this bus. Ask her trivia questions about world geography y/n","@uisgebeatha","edutainment",
"@Mario__Bones Carmen San-Diego's costume was red.","@xaaronh","style",
"Next year for #Halloween I'm going to be Carmen SanDiego and tell people my boyfriend is Waldo and then act confused when we can't find him","@stephstarrnd","style",
"My female role models(cartoon/comics) growing up:She-Ra, Carmen Sandiego, Power Puff Girls, Lara Croft, Disney's Belle, Kida & Mulan, Death.","@Rafaela_Freitas","inspiration","x"
"VIDEO: 10 Reasons Where in the World Is Carmen Sandiego? Was the Best Educational TV Show … https://t.co/s9BqqfsWH3 https://t.co/jNenl8FIM1","@Flavorida","edutainment",
"VIDEO: 10 Reasons Where in the World Is Carmen Sandiego? Was the Best Educational TV Show … https://t.co/KPc83DVORa https://t.co/UGwqoGJzhr","@KomijovaElyza","edutainment",
"i bought a hat and it is burgundy wine coloured and very beautiful and i love it a lot and i only realised just as i was putting it on that it's a carmen sandiego hat. that is why i have subconsciously bought this item","@neonacropolis","style","x"
"Somebody get me a red hat, I think I can cosplay Carmen SanDiego. My hair is perfect for it right now.","@JulieJubz","style","x"
"@CRASHQUEEN_ you should name ur car CARmen sandiego","@princesshyruIe","pop culture",
"@mr_isaacs @iwearthecrowns @thecommonpeople @JustinAglio @chellymil @MatthewFarber @EdGamer @captainXav @MGrundel @lucasgillispie The first game I ever played for learning was The Oregon Trail...an oldy but a goody!! More recently @PlayCraftLearn (obviously), Where in The World Is Carmen Sandiego (another oldy)","@BenSpieldenner","edutainment",
"Thanks to SNL, I've now gone on a multi-hour trip to YouTube for ""Where In The World Is Carmen Sandiego"" clips. The 90's were fun, you guys.","@SethDRothman","travel",
"Carmen Sandiego's travel agent #BadSummerJobs #midnightshow @midnight","@realbadger","travel",
"#Otakon lineup is ready! Thursday: Hinata Friday: Wonder Woman Saturday: Carmen SanDiego Sunday:… https://t.co/YI2tgi8zO5","@LifeOfCosplay","style - cosplay",
"Check out ""Not Your She-Ro: @carmensandiego and the Importance of Feminism in Entertainment"" @syfy! We're so excited to be working on a TV show AND book series that promotes a strong, complicated female character (and stars @HereIsGina!) https://t.co/JndRo3e9O9 https://t.co/Advp1Y5piX","@HMHKids","feminism",
"#TrainThoughts: the prerecorded safety announcements on the @nyctsubway 7 train sound exactly like the Chief from “Where in the World Is Carmen Sandiego?” Also just learned that Lynne Thigpen died in 2003. 😢 #90sNostalgia","@Gul_Dukat88","nostalgia",
"@GrlWithABoyNam3 and then I think of games when I was a wee kiddo. I have such fond memories of DOS-based Where in the World is Carmen Sandiego and Jeopardy... and Barbie Fashion Designer CD-ROM. 😂 Also Sims Social on Facebook, I’d still be playing that if they hadn’t shut it down long long ago.","@Xandara","nostalgia",
"Lady Gaga Swiped Her Hat And Trench From Carmen Sandiego’s Closet https://t.co/sGg7mbYHcE #MTVNews MTV https://t.co/ZebpPUAIYm","@IamFortune051","style",
"Sitting next to Carmen San Diego at a hip cafe. What do I know about style? Nothing. It's fine.","@butterypat","style",
"@ek_johnston Do you think: a) Carmen Sandiego and Where's Waldo could ever be soul mates? b) that'd be sad cause they'd travel the world and never find one another c) MAYBE THEY ARE TIME LORDS and forever alone","@patient9five7","travel",
"@narnie1883 Always wanted a Carmen Sandiego hat. She was so cool.","@petedonaldson","style",
"@wgbh Since both #DoubleDare and #SupermarketSweep are coming back later this year, I was hoping you guys would bring back another great #90s game show- #CarmenSandiego! It would be a great way to teach kids geography. Oh, and be sure to bring back @RockapellaMusic!","@LibertyGeek83","edutainment",
"in hour 3 of a layover, flight is delayed another 3, then it'll be another 5 before I land but they just asked for Carmen Sandiego on the PA","@svt827","pop culture",
"I'm seeing lots of Agent Carter cosplay here at #WizardWorldPhilly but they still initially trigger as Carmen Sandiego to me.","@Mecha_M8","style",
"Already have my next Halloween costume planned out. Carmen Sandiego. My date&39;ll go as Where&39;s Wally. Always wanted to do that","@CatarinaDoyle2","waldo",
"@PageWestRN your trips to all @DignityHealth hospitals for #NursesWeek reminds me of ""Where in the World is Carmen San Diego."" Where next?","@noswar","travel",
"@kady Sure you can, you just have to add the wide-brimmed fedora and heist various heritage artifacts to complete the Carmen Sandiego look.","@SimonBob","style",
"In the car to @c2e2 & realized: We are all #cosplay dressed as #hat people - I'm #CarmenSandiego, @beezd #DoctorWho, @JackRellok #Rorschach!","@MobileMollusk","fashion",
"Where in the world is Carmen Sandiego!? Currently at JFK airport that's where! http://t.co/3BMa9Lcg61","@cashcash","fashion",
"namedropping the mujahideen and travelling to Zaire are wonderful ways in which where in the world is carmen sandiego dates itself","@CaptainNovolin","travel",
"Show up to a Halloween party dressed as Carmen San Diego and I marry you. That's fact. I have no choice.","@lunchbox_23","style",
"How to go from head wound to Carmen Sandiego in one easy step!! #hat https://t.co/V7LhfwtPAe","@SaraGlancy1","style",
"Where in the World Adult Costume #carmensandiego #halloween #costumes https://t.co/FSyBZxPAoL","@purecostumes","style",
"i miss carmen sandiego, she was my hero","@slayerizedcarol","inspiration","x"
"@mr_isaacs @iwearthecrowns @thecommonpeople @JustinAglio @chellymil @MatthewFarber @EdGamer @captainXav @MGrundel @lucasgillispie The first game I ever played for learning was The Oregon Trail...an oldy but a goody!! More recently @PlayCraftLearn (obviously), Where in The World Is Carmen Sandiego (another oldy)","@BenSpieldenner","nostalgia",
"As we speak a room full of highly educated adults cannot remember what state Pittsburgh is in. Carmen San Diego failed us.","@Get_Hoodzpah","edutainment",
"Carmen Sandiego for halloween i think but i'll have to find a neat red trenchcoat.","@formetopoupon","style",
"VIDEO: 10 Reasons Where in the World Is Carmen Sandiego? Was the Best Educational TV Show … https://t.co/MHkIYv4z3k https://t.co/cOIVdSJ6Ix","@jazzi8056","edutainment",
"My nickname at work is Carmen Sandiego. Someone get me a red trench coat, fedora, and the Mona Lisa.","@fennecmedic","style",
"VIDEO: 10 Reasons Where in the World Is Carmen Sandiego? Was the Best Educational TV Show … https://t.co/cJuqWy7JPh https://t.co/Ch6n9ZEIU3","@iordomi","edutainment",
"@oneilllo Louise O'Neill - international woman of mystery. Need to get you a Carmen Sandiego hat.","@d_ruddenwrites","fashion",
"🎼 She glides around the globe, and she'll flim-flam every nation, She's a double dealin diva with a taste for thievery. Her itinerary's loaded up with moving violations. Tell me where in the world is Carmen Sandiego 🎼 https://t.co/OWjmV0aFr4","@ProducerDavid","pop culture",
"Timothy Mozgov travels more than Carmen San Diego","@the_real_charbi","travel",
"@Rackie_ you always go on so many adventures. you're like the sexy Carmen Sandiego. never know where you're gonna be next lol","@ConyeWest469","travel",
"A brave super sleuth managed to track down Carmen Sandiego: https://t.co/OqRwL5M9uF https://t.co/0MlJysylqK","@coslive","pop culture",
"#FlashbackFriday Where in the World is Carmen SanDiego? taught me everything I know today about geography. This dude was my fave bad guy https://t.co/myJBxwZ8U1","@MikMaqRacer83","edutainment",
"Someone help me decide my Halloween costume. Slash, Sherlock Holmes, Carmen Sandiego, Reggie Rocket, or a rorschach test.","@MegsFehlhaber","style",
"Gina Rodriguez donning red fedora and trench coat of Carmen Sandiego https://t.co/SBvc32Zdvf https://t.co/bDWE4FS3eD","@hax_lucas","pop culture",
"Thank you @HuffingtonPost & @toddvanluling, Staff Writer now I know who Carmen Sandiego was, is, may be etc Guess I was too old to wonder!","@capitolhilldc1","pop culture",
"man we gotta find this dude by learning his ever move i feel like im playing where in the world is carmen san diego","@dannydanfordd","edutainment",
"VIDEO: 10 Reasons Where in the World Is Carmen Sandiego? Was the Best Educational TV Show … https://t.co/e7phf399sU https://t.co/W71JyC2gbD","@CarlKlutz","edutainment",
"I like how Spain goes to France and France goes to Spain, Ukraine goes to Russia and Russia goes to Ukraine (and I *think* Serbia and Croatia are a similar pair but I'm not certain because my childhood Carmen Sandiego was before the former Yugoslavia dissolved) https://t.co/muJAuYi8tE","@impstrump","edutainment",
"Where on Earth is Carmen Sandiego? Time Traveler Zach Ivy ACME Detective Agency http://t.co/4sbqlC7nWH http://t.co/nV1ASkSzzE","@HotDeals16","travel",
"Thought for Halloween NEXT year: Elroy Jetson Carmen SanDiego Pop Art Patrick Bateman!","@ArmandoGJR","style",
"After Magic School Bus and Bill Nye, Netflix continues to reboot your 90's childhood with Carmen Sandiego. https://t.co/zIX2LcksYI","@lachstep","pop culture",
"@brianaxelrod @ProperWhiskey My man! I’m starting to play where in the world is Carmen San Diego with you. Some people just need to be learned. So let’s see if I learned them enough.","@himynameisbrew","edutainment",
"@phonologix ha i got this coat for a carmen sandiego costume, actually","@therealcbrad","style",
"@petercoffey @MaureenBug Nope. I remember playing Carmen Sandiego in elementary/middle school in MD (on an Apple II GS). I’m about a decade older than these folks, though.","@DrEMLichtenberg","edutainment",
".@JoeBiden was already one of my favorite people, but learning that he was on an episode of ""Carmen San Diego"" makes him even cooler!","@yankeegrl2","pop culture",
"Guys... it happened again today. I'm wearing a red coat looking like Carmen San Diego!!! https://t.co/VZ6Bsv9DFK","@chelosky_","style",
"You're halfway through this computer-science edutainment game in which Carmen Sandiego somehow steals the concept of monads.","@webbedspace","edutainment",
"Carmen Sandiego is an icon pero like if she was meant to be a representation of Hispanic culture and an icon for Latinas, why she got blue eyes??? I know some Latinas have blue eyes but let’s just be real and honest with ourselves here https://t.co/VCwX19kyly","@reginacordium__","latina",
"@aalastairr I am aware thanks. Think more like Carmen Sandiego hat... https://t.co/3IRMQuMUlw","@flakmagnet","style",
"@Emoroffle @kav_p Damn... now i am seeing her with a wider hat and all in red... Perfect Carmen Sandiego!!!","@Baronesa1980","style",
"@LaurenGoode @CaseyNewton Mark Zuckerberg and Sheryl Sandberg should be Where’s Waldo and Carmen San Diego for Halloween.","@LessThanLiz","waldo",
"Carmen Sandiego: Math Detective and Gizmos and Gadgets were my educational game childhood and they were both EXCELLENT. https://t.co/lSazVcL55t","@OxyOxspring","edutainment",
"Why Where in the World Is Carmen Sandiego? Was the Best Educational Show Ever https://t.co/uRF9evYCsJ via @People https://t.co/LnSA8SJlC5","@Wipeoutt31","edutainment",
"@Todd_Spence @sportsfeedia Where is Carmen SanDiego? The educational show","@ido4me_period","pop culture",
"@IIILD all of my travels and told me I'll never be Carmen San Diego. Liiiiiiike, idk 😂","@_NaiTai","travel",
"Plot twist: Dora the Explorer grows up to become Carmen Sandiego!","@ItsMeAshleyWee","travel",
"@RT_com The mania is agents killing someone in the u.k. and 2 guys killing someone pretending they want on vacation together for a day and a half after being physically seen with putin. Like wholly shit carmen san diego has a better assortment of operatives.","@OneAboveTwo","pop culture",
"Where in the world is Carmen SanDiego #youngatheart #games #Elementary","@kimbobabii","edutainment",
"Hello! I teach middle school and love to use episodes of the Carmen Sandiego- it is great for learning about geography!#sstlap","@fry_ingrid","edutainment",
"Where in the World Is Carmen Sandiego? Becoming a Secret Travel Agent [video] https://t.co/IXB78ZS9CF","@betterhn100","travel",
"@Twoflower @lunadoxy she wore a disguise that was half Shadow half Carmen Sandiego","@d_m_elms","style",
"Not Your Shero: Carmen Sandiego and the importance of feminism in edutainment https://t.co/CaopiDfdXm https://t.co/hqKH8paxTR","@AndreaEidinger","feminism",
"Seriously? Nobody thought of checking the airport for her until now?? #CarmenSandiego http://t.co/dXXs7fdeST","@todmaffin","travel",
"All the learning games that defined my childhood: Cluefinders, Jump Start, Carmen Sandiego, Amazon Trail.... she won't get any of those","@LisKis93","nostalgia",
"It was always Carmen Sandiego being a bad ass and seeing all her adventures getting of trouble that I loved the most about the cartoon show.","@CCTakato","inspiration",
"every time i see a woman in a red coat i think maybe...just maybe...it's carmen sandiego.","@davelucci","style","x"
"@PileOfSalt @strawberrycor @Klom29 Peg wearing that Carmen Sandiego costume and looking for ""clues"".","@Swallowfire","style",
"The Pizza Hut logos on top of delivery cars look like Carmen Sandiego’s hat and you can’t convince me otherwise.","@allyson_cooper","pop culture",
"If I was an IG model that travelled a lot I would totally craft my persona around Carmen Sandiego","@cbenjaminrucker","travel","x"
"Super stoked to learn abou the history of educational games tonight! Who loved Math Blaster, Oregon Trail, or Carmen San Diego? What was your favorite ""educational"" game?","@LoadingLaw","edutainment",
"What You Learn Hunting Carmen Sandiego Without Google's Help https://t.co/Y6ZMxcABeA #google","@_newstech_","edutainment",
"Does anyone else think Gina Torres looks a little like Carmen Sandiego in that hat? Could she play @HereIsGina's mom in the reboot? #RoyalWedding","@soimwatching","style",
"Just realized the #PizzaHut logo looks like #CarmenSandiego's hat. But like reverse the color. I just… https://t.co/YBBjZAr7xi","@redjag007","style",
"@WhtC4nBrwnDo4U @Dom_Book15 Don't accept that bs...bron travels more than carmen sandiego","@_Pierre_Escargo","pop culture",
"[GAMESBEAT] Splash: Underwater Sanctuary will use Carmen Sandiego tactics to teach you about fish http://t.co/R0dTtrQggW","@VideoGameWire","edutainment",
"If the Wide-Brimmed Hat Fits! Gina Rodriguez Will Play Carmen Sandiego in Live-Action Movie https://t.co/JNORw6vxPZ","@buzz_haven","pop culture",
"• Vogue: Carmen Sandiego would have loved the Fall 2017 couture collections. https://t.co/4NXGhACNjn… https://t.co/HapbF3UYax","@kelenike","style",
"Now the game show Where in the world is Carmen San Diego had a unique theme acupella style performed brilliantly by @RockapellaMusic","@Thibodeaux38","pop culture",
"My humor seems to be falling on deaf ears. The lady in that article has a floppy hat and she's a criminal. She's Carmen San Diego.","@dave_mayhem","style",
"Netflix is learning how in the world to play the franchise game with Carmen Sandiego https://t.co/ZuGWma8cQw","@dwnreport","pop culture",
"@jonrosenberg The old Carmen San Diego is operating a bordello in the 70's costume. Classic.","@Kittenfish87","style",
"""What is the capital of Papua New Guinea?"" Me: ""Port Moresby"" THANK YOU CARMEN SANDIEGO!","@Johanna_Ann","edutainment",
"@scratch_paper right! But he stunting my travels lol. That's why they need Carmen SanDiego back on air.","@MzCrystalBella","travel",
"Well until further notice, Big Hat Logan is now Carmen Sandiego","@donald_gamer","style",
"Already have my next Halloween costume planned out. Carmen Sandiego. My date&39;ll go as Where&39;s Wally. Always wanted to do that","@chiawilli750","cosplay",
"Where in the world is Carmen Sandiego (a.k.a. me)? #vacation https://t.co/4mD2tiCSnl","@lucywellington","travel",
"Gina Rodriguez donning red fedora and trench coat of Carmen Sandiego https://t.co/dXtfgeIVB3 #Tech #Technology https://t.co/SkTChHgfsQ","@CEOatdesibazar","pop culture",
"Where's Waldo? Finding Nemo? Where in the world is Carmen Sandiego? It's not like any of these characters is wearing camo, people, come on","@ewfeez","pop culture",
"@Jillgamesh @todayiamree @Swandre3000 @Ice_Cream_Jones how do y'all feel about carmen sandiego hat vampire dad","@akatookey","style",
"Finally heading home! Travel stats by the time I get home- 27 days traveled. 8 countries visited. 19 flights & 6 speed boats taken. 21 hotel stays. 11 additional site inspections. Top that, Carmen San Diego. #hotels #hotelier #travel #roadwarrior #nomad #work","@adaydrmbelievr","travel","x"
"Already have my next Halloween costume planned out. Carmen Sandiego. My date&39;ll go as Where&39;s Wally. Always wanted to do that","@salvatorefo1228","waldo",
"@sarahphinneytv Rocking the Carmen Sandiego trench coat!","@DrWoodfunk","style",
"Where in the world is this? #cosplay #CarmenSandiego #Otakon2016 https://t.co/5QTqZ1v47W","@BlitzComicGuy","style",
"@jmattmiller I do too! And Carmen San Diego, which is why I turned it into a digital breakout/choose your own adventure hybrid #ditchbook","@btcostello05","pop culture",
"Tweeter in Carmen Sandiego cosplay outfit (@embassthon ) has been crawling London for 12 hours visiting all embassies for a charity event.","@ValksyLG","style",
"@laurenashley_42 I've seen some greet Agent Carter cosplay! The only downside is I think she gets confused with Carmen Sandiego.","@A_tiny_Amazon","style",
"Knowing I can ignore that voice has lead me to take up a new hobby, I'm learning to play the violin, something I've wanted to do since I heard ""The Violin"" by Eileen Ivers and Brian Dewan on the Where in the World is Carmen Sandiego? soundtrack, but never thought I'd be able to. https://t.co/ogbDZcdndD","@DrFunkin","rockapella",
"I am willing to legally change my name to Carmen Sandiego if someone will sponsor me to travel the world & make a TV show about where I am","@attackofthezeeb","travel",
"@Gristle_McNerd @dicewarriors Carmen San Diego laughs at your INFERIOR SCIENCE!","@derekthebard","edutainment",
"I got my Carmen San Diego hat I thought I was in disguise lol","@freeleaux","style",
"I remember this computer in Elementary School. My favorite game was Carmen Sandiego. #thegoldbergs","@iamnotatwit","nostalgia",
"Where in the World Is Carmen Sandiego? Becoming a Secret Travel Agent https://t.co/qOyW6WyGNN via ycombinator","@ScottPValentine","travel",
"A unique crossover costume idea for couples: dress up as Carmen San Diego & Waldo! Full guides here: http://t.co/NAWZs3uyAe","@costumeplaybook","style",
"@ATLREPPA “@ATLREPPA: Mama Pope lookin like Carmen Sandiego in the red dress all she was missing was the hat #scandal”|!!!!!","@KeithJonesJr","style",
"Netflix is betting on ‘90s kids nostalgia for learning with upcoming lineup https://t.co/BICkvnOyrK https://t.co/hivZ7UR4T7","@_blok12345","edutainment",
"Studio session went so good tonight where in the hell is Carmen Sandiego lol wrong Puerto Rican chick my bad where's @Double_A2011😂🗼🗼 !","@youngfolk10k","pop culture",
"Confirmed: The only reason Waldo is so hard to find is because Carmen Sandiego taught him everything he knows.","@NapBonPar","waldo",
"Wearing red lipstick makes me feel like Carmen Sandiego. #villainy #whereintheworld","@SalemPeterson","style","x"
"@faeriefountain If you want to be Carmen Sandiego buy a red hat and coat and never leave the house. Maximum effort!","@Yamazuya","style",
"@stop My sisters taught me how to type on it. I had Mavis Beacon and some Brøderbund education games like Carmen Sandiego","@Stammy","edutainment",
"Gina Rodriguez donning red fedora and trench coat of Carmen Sandiego https://t.co/YNXGatkE5P https://t.co/NYRlIyykww","@MintLLC","pop culture",
"@Yanithagawd is like Carmen Sandiego every time I turn around she about to go on vacation 😩 take me with you SHEESH","@ChrissyCorleone","travel",
"Hey! THERE in the world is Carmen Sandiego! Awesome hat, cool shades. http://t.co/9Z7zsPfrna (via @manrepeller) http://t.co/2pvp9BnkgW","@AllisonMadison","style",
"@itsarifitz @IISuperwomanII @tystiklorius Carmen Sandiego traveling around the world as a secret agent, solving crimes and mysteries with her signature mark being red. A red cloak left behind or a red kiss mark. She also has a coalition of other secret agents with codenames similar to hers. 😍🔥","@shiyanigiri","travel",
"I Drew Carmen San Diego in my Art Style :) http://t.co/2gj78A0Dem","@TheChainofGame","pop culture",
"Gina Rodriguez Is Going To Be Carmen Sandiego In A Live-Action Film And I'm Breaking Out My Red Fedora To Celebrate https://t.co/AOybKLqPcI","@Stephanie_Neece","style",
"Happy Halloween, readers and writers! Let me ask you something: “Where in the world is Carmen San Diego?” https://t.co/SciQLFfoHZ","@ShannonCSimcox","pop culture",
"Ok my fav cosplay couple so far - Carmen Sandiego and Waldo. #genius","@chilisizzle","style",
"@TheWizKid730 @ShadowTodd Why you gotta pick on fedoras? Carmen Sandiego, Old gumshoe films... That's all I've got.","@KpHeaney","style",
"If Carmen San Diego wore high fashion! @_dion_lee_ Resort 2018 #style #fashionblogger #luxe https://t.co/IOXwmzX2Gx","@fashion_duke","style",
"How Carmen Sandiego accidentally became an educational game icon https://t.co/YrH1tF9PKy #CarmenSandiego https://t.co/MH3zHCj6x6","@michael_piggott","inspiration",
"Happy #Halloween from #CarmenSandiego! #Halloween2016 https://t.co/LPR5OV9aLb","@GBadilloBooks","style",
"Alicia Keys looks like Carmen Sandiego in that hat.","@bekah_frances","style",
"Hipster Sighting: 20 something ginger, wearing child's ""Where in the world is Carmen Sandiego"" backpack and Non-GMO free range shoes","@Vintage_Carrot","pop culture",
"i'm so mad, i left my pirate coat AND my carmen sandiego hat upstate :(","@KittyCatalyst","style",
"""Well sure Wonder Woman made $500m but that's only like 177k in Bitcoin sooo...look here comes Scarlett Johanssen as Carmen San Diego!""","@docmidnight","pop culture",
"I feel like no one knows who Carmen Sandiego is and it's really bothering me because I'm trying to explain my halloween costume to IDIOTS","@Jumbahjackski","style",
"My mom just said I remind her of Carmen San Diego ~ this may be the best parental compliment ever!!! #Whereintheworld #travel #mom https://t.co/YaQGGpdzn9","@AmaraInSeattle","travel","x"
"@TBbloggers A3) This year I plan to be Carmen Sandiego if I can find a red trench coat. #TampaBayTuesday #TopTenTuesday #Halloween","@SmithTia","style",
"Congratulations @HereIsGina!! You’ll be an amazing #CarmenSandiego! You’ve got me doing a “Memory Lane Monday”- when I dressed up as Carmen for Halloween! I called myself “Carmen Mandy-ego” ☺️ #Netflix #Latina 👏🏽 https://t.co/lXl1W5Cx9Q","@AmandaSalas","latina",
"Parenting styles: I (Mom) take the 8yr old to watch football and introduce him to the greatness of #CarmenSandiego Dad lets the 6yr old watch Insidious And everyone ends up happy... 🤦‍♀️","@SAPoirier923","pop culture",
"Carmen Sandiego, the world's most iconic Latina super villain, is back https://t.co/hj4gWyEcZ1 via FusionNews","@SheilaJ13169593","latina",
"Carmen Sandiego Returns in a New Educational App https://t.co/ZnP5NyTXNY https://t.co/EMbh2907B8","@RamonamconradM","edutainment",
"Nice Carmen Sandiego cosplay there, PK Subban. https://t.co/aSftAy1kBp","@strawbecky_81","style",
"@ChuckWendig Carmen Sandiego was an early fueler of my love of stylish villains.","@DoctorOffDuty","style","x"
"@Amelia_E_Adler Adventures in business travel... Glad you're safe, and that you're learning to survive the Carmen San Diego lifestyle. ;)","@real_attentive","travel",
"I'm going as Strong Bad as Carmen Sandiego for #Halloween and idgaf if no one gets it","@2_Girls_1Up","style",
"@CarmenSandiego what is the next chapter in your journal Carmen San Diego my bus or my house or my parents ?","@twiteameahora","travel",
"https://t.co/qE0437xWol What makes you #travel? For me, it's to learn. via @HuffingtonPost #worldcitizen #CarmenSanDiego #ineedavacation","@allezelizabeth","travel",
"Just saw a young guy in a royal blue suit wearing a bright red trilby get on the train. Like his mum was Carmen Sandiego.","@newcurator","style",
"Gina Rodriguez donning red fedora and trench coat of Carmen Sandiego https://t.co/Puil48Gcx5","@manishr0ckz","pop culture",
"Carmen Sandiego, the world’s most iconic Latina super villain, is back https://t.co/C0ekmshKs0 https://t.co/pZNWYpnxw7","@arrowsmith","latina",
"Where in Time is Carmen Sandiego? Macintosh. Cabrinety Box 284. Keeping track of time is important when traveling. http://t.co/SU4wHo4pTk","@cabrinety","pop culture",
"Oregon Trail AND Carmen Sandiego?!?! I'm in love. 😍😍😍 #ditchbook #edtech #gttribe https://t.co/l6ppMegrwQ","@jmattmiller","edutainment",
"Can't sleep? Try Googling ""Carmen Sandiego cosplay."" It won't help you sleep, but woo, what a ride.","@bookandbottle","style",
