"text","handle","category","star_tweet"
"I used to want to be Carmen SanDiego. She was all over the damn globe","@vanitastrawberi","travel","x"
"It's Official: Carmen Sandiego Is Getting Her Own Animated Netflix Series https://t.co/S0U1Mo2vcB","@RandyS0725","cultural-icon",
"@Harry_Styles where in the world is Carmen SanDiego: Harry Styles edition.","@drunksince1991","cultural-icon",
"Gina Rodriguez to portray 'Carmen Sandiego' in live-action Netflix film https://t.co/w8hclIygaz","@real_reality","cultural-icon",
"⚡️ “Gina Rodriguez is bringing a Carmen Sandiego film to Netflix” https://t.co/BIkwSdF3kC","@Mivia1","cultural-icon",
"Netflix has announced a premiere date for its Carmen Sandiego reboot and shared some some mysterious teaser images https://t.co/wqNfGJjaQR https://t.co/N0PYNH0ZXK","@thinktankftw","cultural-icon",
"where in the world is Carmen Sandiego, where in LA is Harry Styles","@gavssg","cultural-icon",
"VIDEO: 10 Reasons Where in the World Is Carmen Sandiego? Was the Best Educational TV Show … https://t.co/WO6FVMYyr6 https://t.co/QV8Cdwq7XM","@be9e776a3d1f4ec","edutainment",
"Yo, yes to every aspect of that Carmen Sandiego Netflix original series. As 90's kids, the nostalgia is appreciated","@TazzTaylor3","cultural-icon",
"Gina Rodriguez Is Netflix's New 'Carmen Sandiego' https://t.co/WgRxYBqLir","@latinorebels","cultural-icon",
"How many kids' parents got divorced in the 90s bc if you won Where In The World Is Carmen San Diego they only let one parent go with you on the trip?","@BetchesHeadPro","travel",
"VIDEO: 10 Reasons Where in the World Is Carmen Sandiego? Was the Best Educational TV Show Ever https://t.co/2FkHfeLp2E #celebrity #gossip","@CelebNewsFast","edutainment",
"Tried on a trench coat and made a Carmen San Diego joke to the woman working there and got a blank stare...time to find an ice floe.","@closetmystic","fashion",
"@Trashtocouture I LOVE your items I have seen on your website. You are a talented person! You need harder questions Carmen San Diego! :)","@dl_mad","cultural-icon",
"Walking home in windy rain with a red trench coat, clutching my hat brim, I realize: the transformation is complete. I'm Carmen Sandiego.","@southerlysweet","fashion","x"
"@LaurakBuzz Carmen Sandiego? Is that you? Seriously tho that's a nice outfit","@ByronDoodles","fashion",
"Chuck Norris is the reason Waldo is hiding, and why Carmen San Diego can't be found.","@LegendaryNorris","cultural-icon",
"Gina Rodriguez To Star As ‘Carmen Sandiego’ In Netflix Live-Action https://t.co/7OCW7Gy6vY via @Upcoming100","@Loop__16","cultural-icon",
"It's Official: Carmen Sandiego Is Getting Her Own Animated Netflix Series https://t.co/a42fj0Vfzz via @io9","@NoetheMatt","cultural-icon",
"Somehow, I always imagine people who answer names like Dorothy to wear floppy hats and Carmen Sandiego coats","@tobystic","fashion",
"Like if something is wrong just tell me. I shouldn't have a to be a PI and go out searching like its Carmen San Diego","@Don1Der","cultural-icon",
"@Ann_Niobe I want to be Carmen Sandiego in Crocs. I’d totes cosplay that.","@semiotic_pirate","fashion",
"@Autumnal771 I was playing Carmen Sandiego's Great Chase Through Time when this pops up and it reminded me of you. http://t.co/M1gJhejxOq","@Alfonzopancakes","cultural-icon",
"My late night #sketch of #CARMENSANDIEGO for @Sketch_Dailies - Show made me realize I sucked at geography as a kid http://t.co/zPXu512Nfr","@kiwifruitbird","cultural-icon",
"Like Carmen Sandiego, Drake's dad must have a thing for adventure, mystery and international intrigue. #drake #dennisgraham #fathersday #tmz https://t.co/FSsZ9pXUoa","@HipHopillustrat","travel",
"VIDEO: 10 Reasons Where in the World Is Carmen Sandiego? Was the Best Educational TV Show Ever via PEOPLE.c… https://t.co/Y0asC9HbRy","@styloce","edutainment",
"@hulseyjw was @Tyne_Ag the only one in her elementary class who actually found Carmen San Diego???","@grab_the_thruth","edutainment",
"OMG⚡ Netflix greenlights a Carmen Sandiego series https://t.co/po7JhhjHjN","@calidreamin08","cultural-icon",
"@lillythepink57 @kchironis Theme park world, we played heaps of that, Carmen sandiego and magic school bus, the game on encarta 😂","@lillythepink57","cultural-icon",
"What You Learn Hunting Carmen Sandiego Without Google's Help: By Jason Iannone Published: December 05th, ... https://t.co/ajS6ovdzIp","@laughsillusions","edutainment",
"""Chuck Norris is the reason Waldo is hiding, and why Carmen San Diego can't be found.""","@cchucknorrris","cultural-icon",
"Imma let you finish, but Carmen Sandiego is the greatest female video game character of all time https://t.co/YvIprQXjaD https://t.co/W0QfIPho7H","@ViveVideojuegos","role-model",
"Is it weird to want a queer-er version of Ivy's outfit from Carmen Sandiego? #whereintheworld #carmensandiego #90skid","@EauxYesExclmtn","cultural-icon",
"@iM4RINA yeah--especially if Carmen San Diego has a ""brother"" she travels with xD","@Anyesshi","cultural-icon",
"@greekemmy @LAMcL7 When it's criminal to tell the truth you get to be a cool anti-hero like Robin Hood or Carmen Sandiego. hehehe.","@ChateauRuby","role-model",
"@constatively #CECS6100 @jpowellUNT learning games must teach w/o teaching obviously like Carmen Sandiego..all games teach though","@zwu0001","edutainment",
"@_rottenboy Also Carmen Sandiego is a gay icon and no one can convince me I'm wrong","@_rottenboy","role-model",
"#CarmenSandiego: #GinaRodriguez Cast In #Netflix Film Adaptation https://t.co/2kYcYgz93A https://t.co/2FUEJW1b0R","@FilmBookdotCom","cultural-icon",
"This Thanksgiving I’m thankful for being able to park my baby outside of my parents house, while she gracefully charges for my road trip tomorrow. Thank you @Tesla & @elonmusk for Carmen. Where in the world is Carmen Sandiego? To be continued tomorrow. 😊❤️🦃 https://t.co/OmPR6apc8f","@LaurenFrancisco","cultural-icon",
"I just looked at my travel schedule until mid-February. I feel like Carmen SanDiego, only without the trench coat. Or the video game.","@bsmog","travel","x"
"Carmen Sandiego is coming to Netflix and the actress voicing her is perfection https://t.co/QCcYiKR3RG","@evinmonika","cultural-icon",
"The First Images of Netflix's Carmen Sandiego Are Here Carmen Sandiego has been found, and she's looking good on Netflix. Gina Rodriguez will make her debut as the new voice of the iconic globe-trotting thief in the new 20-episode... https://t.co/jFSkYaBhJw","@JimMiller54170u","cultural-icon",
"Gina Rodriguez donning red fedora and trench coat of Carmen Sandiego https://t.co/eKH6er45yd","@Justine___C","cultural-icon",
"@ChrisBarrett I remember Picadilly and Paws Teaches Typing on Apple IIe/IIc. I grew up at home with Carmen Sandiego and Chessmaster 3000!","@cfarivar","edutainment",
"International woman of mystery Carmen Sandiego would like to see @HeyScoops on @midnight #100DaysofAsking #Day76 http://t.co/SkMEsRMVD3","@cloyd007","role-model",
"@SecretHighTier @Ryyudo @PleaseDieForMe @mosesplan @Chickzama there is, however, geography. pretty sure i can beat the carmen sandiego hater","@w_i_t_c_h_e_r_y","cultural-icon",
"@BJCalvillo @ericartell Hilarious.😂✌️ p.s where is Carmen Sandiego?😳","@RonaRandall","cultural-icon",
"@5SOSTumblrx Ashton is playing real life Carmen Sandiego. We just gotta find him! :D","@x5SosRusher","cultural-icon",
"Getting back on my Carmen Sandiego lifestyle","@mshourglass","travel",
"Netflix greenlights 'Carmen Sandiego' animated reboot - Netflix is rebooting yet another childhood staple as th... https://t.co/BvfatSPplh","@zyiteblog","cultural-icon",
"‘Carmen Sandiego’ Animated Series Greenlit at Netflix, Gina Rodriguez to Star https://t.co/kl0MIq6Emg #music #news","@ShadowLinesDoc","cultural-icon",
"How Carmen Sandiego accidentally became an educational game icon https://t.co/PnROkWYFYD #CarmenSandiego https://t.co/4k6jwRMcPJ","@getgamechat","edutainment",
"Gina Rodriguez to star in Netflix’s live-action ‘Carmen Sandiego’ movie: https://t.co/bcQsVfcdiA via @AOL","@yesnodetroit","cultural-icon",
"@emilyjodell Because of all the pictures you post covering the globe I imagine your life being like an eyeglasses wearing Carmen San Diego.","@lordknows262","fashion",
"Netflix: we have to find Carmen Sandiego!! Me: 😒😒 Netflix: ...played by Gina Rodriguez lol Me: https://t.co/J0nxafxDEh","@drunkhaught","cultural-icon",
"Are the Where in the World and Where in the USA is Carmen Sandiego games the best geography games out there? #gamedev #retrogaming #CarmenSandiego https://t.co/uAr9izjv19","@sjfostersound","cultural-icon",
"Carmen Sandiego Ready to Steal the Netflix Spotlight in January https://t.co/zdBEl0PvVw #SykoNews","@Syko","cultural-icon",
"Gina Rodriguez to Voice Carmen Sandiego for Netflix https://t.co/3EfVEtV09c #TV","@noemihurn","cultural-icon",
"Netflix Could Be Bringing Carmen Sandiego Back https://t.co/k6moPSrzY5","@krakencorpjr","cultural-icon",
"@holly_sonders your Carmen SanDiego costume is 🔥🔥🔥","@colinblasko","fashion",
"That one time when you're really feeling fancy in your Carmen San Diego hat #summernights… https://t.co/ZR3seplAj5","@SShannanigan","fashion",
"Thank you to @WerdyGirl, @HonoredPuppet, & @MisterWeisman for doing our #podcast. #oregontrail #carmensandiego https://t.co/AphusLiHHf","@FullBellyLaughs","cultural-icon",
"Where in the world is Carmen Sandiego? (On Netflix, and she's being played by Gina Rodriguez) https://t.co/JCrVSEnNwh https://t.co/JSY6sKZIqG","@Jezebel","cultural-icon",
"Netflix to reboot #CarmenSandiego as animated series w/ Gina Rodriguez (@HereIsGina), Stranger Things' Finn Wolfhard https://t.co/s3eyQQSC5T https://t.co/PwRgsbJy4Z","@coslive","cultural-icon",
"In my top 10 fave costumes at #YelpGetsSpooked : Carmen San Diego here with Waldo","@klkunze","cultural-icon",
"smh when you google ""carmen sandiego gina rodriguez"" you get a picture of Finn Wolfhard instead https://t.co/TjpCLoUbD6","@rustik69","cultural-icon",
"Carmen Sandiego: Gina Rodriguez to Voice the Role for Netflix https://t.co/ySk3e0RnZC https://t.co/X4iBi95mAK","@SpazzySquirrel","cultural-icon",
"You could be Carmen Sandiego... #vintage #map #jacket #whereintheworld #carmensandiego #halloween… http://t.co/ZNU3pCOgFI","@VintiqueLA","fashion",
"Chuck Norris always knows the EXACT location of Carmen SanDiego.#GDG","@hello123457893","cultural-icon",
"@jacottrell51 @ThatHippieJesus I know they are able to relocate entire sites (e.g.Abu Simbel) so as soon as I can, Im stealing the whole island Carmen SanDiego style.","@Drstevenhobbs","cultural-icon",
"I've been able to show my kids #CarmenSandiego and #CommanderKeen for a year & I've only found out about it now??! https://t.co/AXefmwQExb","@spaceseeker19","cultural-icon",
"Carmen Sandiego was a hero to generations of Latina Canadians, Wikipedia claims https://t.co/EiTNccHEhP","@RoqPlanas","role-model",
"Gina Rodriguez will be donning the red fedora and trench coat of Carmen Sandiego for… https://t.co/mAgQNf6WVs by @mashable #News #update https://t.co/A1ZCArlFaD","@parmarkavi","cultural-icon",
"Check my @expedia #Storybook adventures, in which I channel Carmen Sandiego http://t.co/EssSsM6tI4 http://t.co/HEvEHRtCND","@TripStyler","travel",
"Double Dare. Legends Of The Hidden Temple. Global Guts. Where In The World Is Carmen San Diego. Wild n Crazy Kids. What Would You Do.","@HarloHaven","cultural-icon",
"@korduslu Carmen San Diego was another one","@ttvwillyhaynes","cultural-icon",
"Speaking of gaming & changing edu trends, NCSS Social Education article on Carmen Sandiego in social studies. #sschat http://t.co/mNGCeRj4ph","@JoeSangillo","edutainment",
"Netflix’s Carmen Sandiego Movie Sets ‘Game Night’ Scribe Mark Perez As Writer https://t.co/R6vA5ErMkV https://t.co/XnMrtU3Z24","@Filmedia","cultural-icon",
"Thing I want to happen: an Agent Carter-esque show about the exploits of world traveling villain Carmen Sandiego.","@erniebufflo","cultural-icon",
"@BryanFuller Gina Torres for Carmen Sandiego should they ever do a reboot.","@_Destati_","cultural-icon",
"Gina Rodriguez To Play Carmen Sandiego In Live-Action Netflix Film https://t.co/nPb6vBFdfY","@bradrian","cultural-icon",
"Kotaku: Netflix is making a live-action Carmen Sandiego movie. https://t.co/u7uWbdtllq https://t.co/lu3I4oS11g","@Louisology_YT","cultural-icon",
"Via NT: Where in the world is Carmen Sandiego? On Netflix starring Gina Rodriguez https://t.co/0z4Vwm45Lc","@maskoffmedia","cultural-icon",
"If where's Waldo and Carmen San Diego got married, would anyone be able to find their wedding? If so, could you teach me how to ""I spy""?","@PuffLyle","cultural-icon",
"@HereIsGina @netflix Carmen San Diego!!!! Loved her growing up","@oliviakdelrio","cultural-icon",
"What Netflix’s New Carmen Sandiego Show Will Actually Be About https://t.co/H5ZVuPyqxf https://t.co/O4QpeYz8Uw","@notisviral","cultural-icon",
"where in the world is carmen sandiego?","@olimeridaXXX","cultural-icon",
"📷 pietramaximoffs: mcu meme » 1/8 outfits If the hat was black, she’d be Carmen SanDiego! https://t.co/ucYisOtZvW","@DarqueQueen7","fashion",
"Yaaas! @HereIsGina set to voice this popular childhood cartoon in @Netflix live-action movie! https://t.co/1Dw8q2Izcu https://t.co/9n9cNvuCsN","@VH1","cultural-icon",
"@LindsayPavlas Half of me questions why there hasn't been a Carmen Sandiego reboot the other half knows they'd screw it up","@Zerglinator","cultural-icon",
"@artifishly YES! It’s a tv show where you learns bout history through the narratives of this brother and sister (I think) who need to save historic objects because carmen San Diego keeps trying to steal them","@ChatsWithOrlie","edutainment",
"When I was growing up, there was a popular educational computer game called Carmen Sandiego. Is it still around?","@HRDipendra","edutainment",
"Gina Rodriguez To Star in Live-Action Carmen Sandiego Netflix Movie https://t.co/YBbN2QyYpG https://t.co/pmYCAAO1Ni","@EpicLootDrop","cultural-icon",
"Netflix Could Be Bringing Carmen Sandiego Back https://t.co/q70MIAllEe","@LeeColston2","cultural-icon",
"Theress a little girl dressed up as Carmen San Diego &she was holding the hand of (i presume) her little bro who was dressed up as Waldo T^T","@katsnapped","fashion",
"@LndsPatterson @Q102_Mollie All you need is the right hat and you'll be the perfect Carmen sandiego for Halloween","@twatsmear","fashion",
"@Platynews @BryanRenno @bitmOO Also The Carmen Sandiego games had a mix of adventure and visual novel...","@Platynews","cultural-icon",
"can carmen san diego step on me blease","@_kaphna","cultural-icon",
"@nathanleegraham @MetOpera Serving Carmen Sandiego realness https://t.co/iI3io6Xc5C","@AmirTalai","cultural-icon",
"Man in a fedora just stopped me on the street and asked where the airport was. Pretty sure I'm now living in a Carmen Sandiego game.","@pulpandpolitics","travel",
"VIDEO: 10 Reasons Where in the World Is Carmen Sandiego? Was the Best Educational TV Show … https://t.co/ExiwTgDZF2 https://t.co/bItd5LMi2M","@doogjohn","edutainment",
"@jhaletweets @TheRitaMoreno you ladies excited for the Carmen Sandiego reboot on netflix with @HereIsGina i sure am! https://t.co/gAojfNrbRR","@JamesStocker16","cultural-icon",
"""Chuck Norris knows where Carmen Sandiego is."" >> Top Chuck Norris Facts http://t.co/oQ8tlEHp37","@doorway123","cultural-icon",
"Gina Rodriguez will play Carmen Sandiego in new Netflix film https://t.co/uMj0Yyogdh https://t.co/eYKsAu390M","@NylonMag","cultural-icon",
"Gina Rodriguez To Star As Carmen Sandiego In Netflix Live-Action Feature https://t.co/BT69Nvc2ay #news","@crafts_24","cultural-icon",
"The question isn’t IF I would’ve been Carmen Sandiego for Halloween if I were a girl, but how many times I would’ve been her.","@MattByMoonlight","fashion",
"Where in the world is HereIsGina? The actress is set to voice Carmen Sandiego in new animated netflix series… https://t.co/yqLWvDRXNF","@Julia_Abdulla","cultural-icon",
"How Carmen Sandiego accidentally became an educational game icon https://t.co/5IyasjEQGu https://t.co/f1xyIzBGwH","@gamasutra","role-model",
"@headdeskben YEEES! I had Math and Word Carmen Sandiego ones too, with like a science base or something that was sinking? OMG I know right every year I go and look to see if anyone has found a way to play them!","@PrinceBubblegum","edutainment",
"VIDEO: 10 Reasons Where in the World Is Carmen Sandiego? Was the Best Educational TV Show … https://t.co/GRCLytkDw1 https://t.co/xPNkkidDyL","@kumarmangla","edutainment",
"@toddysire_ More like Carmen Sandiego coming to steal valuable monuments in 2018, where trenchcoats are so cliché. https://t.co/LrxDtmQgki","@WynneRichport","cultural-icon",
"My friends might be traveling abroad, but I just bought the Carmen San Diego game for my phone. So who's the real world traveler??","@laurapolsean","travel",
"@ColorNat carmen san diego has a red coat tho... i mean 😑","@lvsre","fashion",
"Carmen Sandiego' Animated Series Greenlit at Netflix, Gina Rodriguez to Star - Variety https://t.co/31aOyy41QJ https://t.co/ASmYIshdRG","@SharmaPyari","cultural-icon",
"New Carmen Sandiego Animated Series Coming to Netflix in 2019! #StreamTeam https://t.co/VXFBf7qagY via @LongWait4Bella","@ToughCookieMom","cultural-icon",
"#throwbackthursday to a day in the Tuscan sun. Getting that #wanderlust vibe. Where to next!? #carmensandiego #travelblogger #travel #bringiton #beachbodycoach #writerslife… https://t.co/0vRNRP41kY","@SillypantsB","travel",
"@Li0ness_LoL @bombsfall 3) underrated is a hard metric. I think I'll throwback to the old Brøderbund Carmen Sandiego games. Learned so much from them.","@Li0ness_LoL","edutainment",
"@DeionGottaSTFU @signedsirelle @JuChainz Sirelle like the real life Carmen San Diego, you never really know where he is smh hes everywhere","@Pizizzle","cultural-icon",
"@itsarifitz @IISuperwomanII @tystiklorius Carmen Sandiego traveling around the world as a secret agent, solving crimes and mysteries with her signature mark being red. A red cloak left behind or a red kiss mark. She also has a coalition of other secret agents with codenames similar to hers. 😍🔥","@shiyanigiri","travel",
"@AmandaCerny @soneva instead of Where in the World is Carmen San Diego it should be Where in the World is Amanda Cerny","@cutlassdude96","travel",
"@ColliderVideo What 90's Cartoon Could Work More As A Movie ???? Gargoyles Captain Planet Where Is Carmen Sandiego Swat Kats #ColliderMovieTalk","@MarioPR05","cultural-icon",
"Halloween throwbacks! #carmensandiego #snapchat #deerfilter #cleopatra #sloths #clown #blurry #witch https://t.co/7EdsarDpYx","@Shaina_KCCI","fashion",
"It was from watching Carmen Sandiego on PBS that made me great at Geography, especially North and South America Geography, others eh...","@MARKSINACORI","edutainment",
"I love that #AgentCarter's final costume is like Carmen Sandiego! Cute! #AvengersAcademy https://t.co/ZBdTnJk78M","@ThatArchivist","fashion",
"Heyyyyy! I'm in Luxembourg!!! Feeling like Carmen San Diego in my white hat and wooden jewelry made by… http://t.co/E4Jat8P4XU","@KoyaWebb","fashion",
"How Carmen Sandiego accidentally became an educational game icon https://t.co/C3yNC5Jw5K https://t.co/MktwndVRbf","@Gaming_T_V","edutainment",
"Where in the world is Carmen Sandiego ??","@Lthogue","cultural-icon",
"Driving up and down Waldo looking for a pokemon called Carmen San Diego @UF","@WilyVagabond","cultural-icon",
"First memory I have of James Avery is him giving clues on ""Where in the World is Carmen Sandiego?""","@JesusZoidberg","cultural-icon",
"Did anyone else notice that Bebe Neuwirth was dressed up like Carmen San Diego on Madam Secretary tonight?","@nationsfilm","fashion",
"Carmen Sandiego Is Officially Happening With Gina Rodriguez at Netflix https://t.co/Ek36gaQvkj https://t.co/2Rbwx2HO0y","@sarcastard1","cultural-icon",
"@Snarkyname @Gray_DM @LeeMinSaya @ChipBrent @Tatted_Dread_ I just took it as him being appalled by how gay Carmen Sandiego's hat is on dude.","@Rasputin_RGLM","fashion",
"https://t.co/WBdAcmBL3A Netflix greenlights 'Carmen Sandiego' animated reboot https://t.co/dSskRLdsKy https://t.co/dRYOaK9KxI","@serougy_llc","cultural-icon",
"@PDTheatre What I didn't learn in college: Where in the world is Carmen Sandiego","@broadwaygonnabe","cultural-icon",
"@timvracer You're Carmen SanDiego lately! Traveling the World! lol","@JTX_LOBO","travel","x"
"Where in the World is Carmen Sandiego? — I can't tell you that or I'd have to kill you ;) http://t.co/Qe0YW33YzE","@ashleydooleyxd","cultural-icon",
"My friend Justin has a neat article on using video games for education. Where in the world IS Carmen Sandiego, a... http://t.co/GmbbLaCTkF","@danielvalentine","edutainment",
"How Carmen Sandiego accidentally became an educational game icon https://t.co/YrH1tF9PKy #CarmenSandiego https://t.co/MH3zHCj6x6","@michael_piggott","edutainment",
"Children of the ’90s Rejoice, For Carmen Sandiego Is Getting Her Own Animated Netflix Series https://t.co/oPWsKTL71R https://t.co/wMHkl4gLaE","@RazzleTazzleMag","cultural-icon",
"So much fun at Kai's Boo-tastic #Halloween Bash! 🎃👻💀 #GangsAllHere #carmensandiego #arianagrande… https://t.co/OwlliZiU1e","@Andia_B","fashion",
"@lasenorarivera Reminds me of Carmen SanDiego but without the trench coat.","@Fun_Sized27","fashion",
"Netflix’s ‘Carmen Sandiego’ debuts on January 19th, 2019 https://t.co/EWz6nUow4J https://t.co/kbc0KqQ2oW","@Pungroo","cultural-icon",
"Carmen Sandiego and the Case of the Missing BIC.","@floppypankakes","cultural-icon",
"@DestynToBeGREAT @Da_Hulk_Smashem or where in the world is Carmen SanDiego","@MacdaddyTai24","cultural-icon",
"Gina Rodriguez as Carmen Sandiego? Gina Torres not available? Just because the actor is popular doesn’t mean they are a good fit.","@Dirty_E","cultural-icon",
"""All I know is something suspicious is happening in town"" #CarmenSandiego","@AineCrabtree","cultural-icon",
"@thewisecrab Hmm...dunno. But besides those two,the only other TLC game I've played are the two Carmen Sandiego ones. :D","@lightnarcissus","cultural-icon",
"Netflix developing new 'Carmen Sandiego' animated series, Gina Rodriguez to star - shark-pup: swan2swan:... https://t.co/fhSVUnKByd","@VioletVioIence","cultural-icon",
"Big #shades and springtime hat to make me feel like Carmen #sandiego #100happydays #sunny http://t.co/nvHxW1Lt4V","@lifelooklens","fashion",
"@morganmpage You can't just time travel and kidnap all the historical figures like some kind of... transgender Carmen Sandiego!","@HyenaSpotz","cultural-icon",
"Happy International Women's Day! Unofficial sponsor: Carmen Sandiego. If nothing else, hat to face ratio goals.","@aparnapkin","role-model","x"
"Writing an article on game-based learning and what do I find beside me? The Queen of education gaming herself, Ms Carmen San Diego for Windows 95/98 😂 https://t.co/tOzOwjCOsk","@orourke28","edutainment",
"TELEVISION: @HereIsGina Rodriguez to voice title character in @netflix's animated series ""#CarmenSandiego."" https://t.co/sGp8YTh8gM","@HispanicallyUrs","cultural-icon",
"@pxlsicle @KowalskiKliq the Carmen San Diego, too! World geography!","@jayaresea","cultural-icon",
"Who wants to go get me a Carmen San Diego hat from the Netflix? DreamWorks? whatever booth, I will be your best friend","@vqnerdballs","fashion",
"@Kainin YUS I’m ready for the resurgence of Carmen Sandiego cosplay 😍😍😍😍","@KaniDayOfficial","fashion",
"I'm excited for this. // Netflix Reboots 'Carmen Sandiego' With Gina Rodriguez https://t.co/LMrI5SPnTS via @thr","@NEligahn","cultural-icon",
"@thejdshadow @CCTakato @OsitaNwanevu @macasaurus_r3x Where In The World Is Carmen Sandiego... Good times, as its sequel, “Where In Time Is Carmen Sandiego?”.","@Jo_Kwanghee_07","cultural-icon",
"It's amazing how things change but stay the same. My generation had Carmen Sandiego to teach us geography, Gen Z has Drake.","@punslikepizza","edutainment","w"
"@melancholily13 sooo Lyra rocking a Carmen san Diego hat is what you're saying ;)","@CamazotzTyr","fashion",
"A CARMEN SANDIEGO HAT!! Be still my heart https://t.co/2hCUkOFMRQ","@aquatictapir","fashion","x"
"My buddy at work made this for me. Thanks Jimmy!! ✈️🌏💃 #whereshouldigonext?#CarmenSandiego… https://t.co/rCmSetY261","@SundayPancakes","cultural-icon",
"VIDEO: 10 Reasons Where in the World Is Carmen Sandiego? Was the Best Educational TV Show … https://t.co/3OBKS8zTib https://t.co/xeS93RXwNa","@mohammedwajee","edutainment",
"Just have one question: where in the world is Carmen Sandiego? #QuestionOfTheDay","@CARLEARA","cultural-icon",
"@AleHitti Whoa totally forgot that Putt-putt games existed but I’m now having flashbacks to brushing a cars teeth 😂😂 really though first game ever was Oregon trail, some jungle math game and where in the world is Carmen Sandiego followed by a glorious introduction to the PS1 https://t.co/ZBOZ13Xfc3","@LittlestFinch","cultural-icon",
"Between this, Carmen Sandiego and Grace and Frankie, no one speak to me that week.","@poormanstinafey","cultural-icon",
"Carmen Sandiego Is Officially Happening With Gina Rodriguez at Netflix - https://t.co/hj3ogkPIxp","@OnCikCom","cultural-icon",
"Gina Rodriguez To Play Carmen Sandiego In Live-Action Netflix Film https://t.co/9Ano1G8PN9","@newsmirror2017","cultural-icon",
"Netflix’s Carmen Sandiego Live-Action Movie Just Found Its Carmen https://t.co/MXOSpYJf5S","@LuxuryFashionIt","cultural-icon",
"@MeWeFree also, what happened to Carmen Sandiego's flight rewards?","@ImNotTron","travel",
"Gina Rodriguez donning red fedora and trench coat of Carmen Sandiego https://t.co/Rq4jogr6bu","@EmperorDarroux","cultural-icon",
"Lmfao Alexis dressed up as Carmen SanDiego. I cannot 😂 #LHHNY","@7inchheelz","fashion",
"@jessiejuwono Her hat looks pointy. Is Carmen Sandiego a witch? That... is something I wanna see now.","@NeoWestchester","fashion",
