"text","handle","category","star_tweet"
"@heathermgirls this is a flawless Carmen Sandiego cosplay, @KatBarrell #wynonnaearp https://t.co/Q9GwTWnNqW","@heathermgirls","style",
"Choreographing a gymnastics routine to Mungojerrie and Rumpleteazer from Cats in 2nd grade. ALSO, insisting that my 2nd grade teacher use the format of Where in the World is Carmen Sandiego to teach us Geography--which she did. I sat in a box with a walkie-takie & was the chief. https://t.co/60DjwbhEXg","@TheWoodzick","nostalgia",
"@julcasagrande @MilosRocks @jessiejess1228 @Its_St3fanie @natseki9 @Mymeaneviltwin @Unic0rnQueen1 @etherealraccoon @TangledHotMess @kristenRN202 @_lola_bee @AsYouuuWiiish Aw I’m your woman crush?! I’m so happy! Lol 😝 have fun on your adventures Carmen San Diego","@eminem11683","travel",
"#NewProfilePic Sporting my New Carmen Sandiego coat! https://t.co/kNf6nlRdFl","@ProfRMCarlo","style",
"The more I travel, the more I feel strange being in this country I call home. I do not fit in at ALL!!! 😥 Becoming #carmensandiego 🌎🌍🌏","@TihdaVongkoth","travel",
"Love when people include all 7 places they’ve ever lived in their social media bios as well as the order in which they moved to each city. Thanks for taking me on your journey there, Carmen San Diego.","@Tork88keys","travel",
"The sad thing about the new #Hamburglar is that he's just copying his big sister Carmen San Diego's style.","@HHutch","style",
"Google search: Carmen Sandiego cosplay, and you will b disappointed","@proplax","style",
"@AandGShow Carmen Sandiego is more appropriate, being that you were in the airport.","@NieceePiecee","travel",
"Where in the Burlington Coat Factory is Carmen SanDiego?","@TheOnlyCamshaft","style",
"Toni Braxton Miss Piggy Mariah Carey Ursula from The Little Mermaid The Pine Sol Lady Angelica Pickles Fantasia Storm Ms. Celie Ciara Rihanna Madea Suzie Carmichael SZA Daria Kimberly Reese Dora The Explorer Carmen San Diego Karen from Will & Grace Beyonce Me https://t.co/BJmaqrWtOc","@MEBDKX","pop culture",
"@soPanel Now that vacation is over, Lo-Fi Let's Play of Carmen Sandiego in an airport, with musings on being followed","@leigh_books","travel",
"A+ human @elleemmie and her amazing Carmen Sandiego coat, from what I've come to call… https://t.co/VAju2X1hmZ","@dreadpiratedrew","style",
"@marshallbertram Northeast Spain IS a where, but I think you may be thinking of Carmen Sandiego","@NotJKRowling","pop culture",
"http://t.co/mGbxcn1dLb MT @CarmenSandiego: The creators of #CarmenSandiego would like your input for new adventures. http://t.co/SeWSPcQy8C","@oytamarind","travel",
"I told my coworkers I was considering being Carmen Sandiego for Halloween. I got blank stares and then ""Oh! From the math game!"" Babies.","@_hollywouldnt","style",
"hah the he'll turn into Carmen Sandiego and start globe hopping I'm sure https://t.co/GVHUcUdJvU https://t.co/yYFC6ET3cB","@WhittWh","travel",
"I saw a guy with a bright red fedora and matching shirt at BART and all I could think was that I found Carmen Sandiego.","@mizunotic","style","x"
"Why are the ladies of New York all wearing Carmen Sandiego hats now","@Abbygator","style",
"I've decided that if I can find a red coat and red hat by October, I'll be Carmen Sandiego for Halloween 2014. Any good ideas?","@ladywoods13","cosplay",
"Next Up.... How do I make a decent Carmen Sandiego cosplay because I really feel she's my patron saint for 2017.","@LianaBrooks","style",
"#Throwback #Thursday - #where #in #the #world #is #carmen #sandiego? #edtech #education #computers http://t.co/fAvwSxKV9P","@TheAlinaGroup","edutainment",
"Most people cite #CarmenSandiego has the quintessential fedora wearing female badass. For me, it's #CyberSix. https://t.co/qGTT71QSeD","@themage26","feminism",
"Where in the world is Carmen Sandiego...wow I can hear the theme song playing from my childhood thank you Netflix lol https://t.co/88NijZsCoT","@TaintedPhilly","pop culture",
"@fairlyliterary Watching & playing, ""Carmen Sandiego"" helped taught me how to read & develop my analytical skills","@fairlyliterary","edutainment",
"Twin I read Carmen SanDiego was coming back out and thought of yo ass lol *spins globe* #GiGiSanDiego @gigimaguire","@amillz","travel",
"I found Carmen Sandiego. She was hiding as a coat rack https://t.co/UTH4XLjrnW","@ScienceJesus","style",
"Where in the world is Carmen Sandiego? #SalmaHayek wore her to the #sagawards 😂💃🏼","@DragcentricDeb","style",
"Teach children to use the NSA database to find Carmen Sandiego.","@Taosym","pop culture",
"Car 54, Where in the World is Carmen Sandiego? #IconicTVMashup #IconAwards","@sergebomba","pop culture",
"Were you at @AimIndiana's Ideas Summit in October?! Did you catch our video at the opening session? Halloween may be over, but Patti Yount stars in our spotlight video as the ever elusive Carmen Sandiego. https://t.co/66yO5UiIsm","@lochgroup","pop culture",
"""Where In The World Is Rob Ford"" I smell a sequel to the popular educational game ""Where In The World Is Carmen Sandiego?"" #pnpcbc","@TrevorsIdeas","edutainment",
"Dragon's Outdoor Adventures: Work This is Carmen Sandiego?","@Horse_videogame","travel",
"@TheGamingDeer @4JStudios its a old school gaming joke. An edutainment game ""Where in the world is Carmen Sandiego""","@sithlordfaust","edutainment",
"I’ve decided I wanna do a series of playing old learning games I played growing up (treasure mountain, Carmen San Diego, Oregon trail) on Twitch & YOU CAN’T STOP ME","@AlexanderEmpyre","nostalgia",
"Lady Gaga Swiped Her Hat And Trench From Carmen Sandiego's Closet - https://t.co/Voax4zMoa9 https://t.co/I1xyVKx1op #ladygaga","@GagaHeart3","style",
"When I was little I wanted to be Carmen Sandiego soo bad mostly because of the hat","@wildflower_92","inspiration",
"Last night's show was amazing! Thanks to @thepitnyc for having us. #Hats #CarmenSanDiego #howimetyourmother","@UrLuvOurMusical","style",
"@dianasaladpot Ya boy probably thinks Carmen Sandiego is some designer he's never heard of.","@katt_j83","style",
"@sgrstk Carmen SanDiego was the original manic pixie dream girl. Shows up, takes something important, disappears, and claims they're both better off","@UpThePieFights","pop culture",
"@soWWMD @Realjmannarino You haven't been through healthcare till you've been thru carmen Sandiego's healthcare. Its an adventure everyday.","@charlesmaynar10","travel",
"adventures continue, appointed carmen san diego #whereintheworld #breathtakingviews #nicjames #nomad… https://t.co/98I46wMugw","@nicoledivell","travel",
"Anybody else grow up playing where in the world is Carmen San diego in school? I learned so much about geography from that. AND DIVERSITY!","@inspiredofword","edutainment","x"
"@meggymish @epeterd916 @iamisgo11 @IhszNaomi @GuyFawkes1984 @NestorRedux @GoldSaltFlour @NAVYDAWG6119 @TheRogue_Elf @BeccaMick @AV_snarkeyes @ScarilyCheerful @CarrPirateKing @wraithburn @AWGecko @vetjr89 @El__Bohemio @stabyoulots @IntellectShorty @deans0114 @heartsabustin @gr8357 @yourfaveclete @djm1992a @priebjm @secjr112 @camiila_mua @Sheraoftexas @AllanKirkhart @Shrike1988 @EricMertz_KC @bitterclinger4e @NucMM1retired @LadyJessMacBeth @theBaytownsub @StephenLHall @Sjanderson86 @theone20152016 @MrBoTheCat @StacyDmomof5 @JHWalz32 @repub9989 @MeerkatYitz I adored the Carmen Sandiego mythos. I was that kind of geek. There was even choose your own adventure kind of books for her. One time my dad bought me an interactive cassette tape game my family played during a road trip. You’d have to pause and decide an answer with the fam","@GentlemanRascal","travel",
"So #GinaRodriguez is th new #CarmenSandiego. Be honest, ya can totally picture her in the red wide brimmed hat. #InnerSpace","@aditheadipose","style",
"Level 5 Peggy is dressed Carmen Sandiego style. #AvengersAcademy https://t.co/nxnPdkcsqB","@LoisLaned","style",
"Ah yes, the episode of X-Files where Scully botches a Carmen Sandiego cosplay and flashes a copy of TMNT instead of her badge. A classic!","@ArchivistPrime","style",
"I think I found Carmen Sandiego! (Seriously I LOVE the coat, but the floppy hat? Not so much.) https://t.co/jnxlZ9mcP3","@palaceprincess","style",
"@Sketch_Dailies #sketch_dailies How can they miss #CARMENSANDIEGO when she's wearing all red and riding a helicopter? http://t.co/kndDWQx9Js","@BrianaMSalcedo","style",
"Gina Rodriguez donning red fedora and trench coat of Carmen Sandiego https://t.co/5OtgbMraM5","@antonio_s_t","pop culture",
"@CodyMatzFox9 What if Waldo and Carmen Sandiego were actually Beta testers for this new travel thing? #idkwhereimgoing #whereintheworld?","@sailorlaalaa","travel",
"@margarita “@margarita: Carmen Sandiego is my favorite international woman” same","@invisiblecircus","feminism","x"
"@Jayizms We need to just link since Sean is out country. He wouldn’t even know. He ain’t even tell us bye. He wanna be Carmen Sandiego but I don’t see no red trench coat, hat or HEELS!","@triggaNIZER","pop culture",
"24 years ago since the feminist icon Carmen San Diego graced the small screen. Because completely nonsensical, fancy women can be notorious jewel thiefs. https://t.co/4clHQfpGpe","@orourke28","feminism",
"@Da7e @StormofSpoilers Just wanted to say thank you. I woke up singing the Carmen Sandiego theme and it took me a second to remember why it was stuck in my head https://t.co/3cinunEl8p","@kathryn_alyse","pop culture",
"Driving from Massachusetts to Michigan. Flight to NYC tomorrow AM #carmensandiego","@TaraReed_","travel","x"
"I told Sami if she doesn’t come to Rezz’s halloween show with me I’d probably be going alone and she says I need to go as Carmen Sandiego then lmfao.","@WeciPieces","style",
"Gina Rodriguez to voice animated Carmen Sandiego series #FactsApps #Fashion https://t.co/MVHUielLgl https://t.co/Y61X1jCwRj","@FactsApps","pop culture",
"I remember an early phonics lesson from my parents as I was trying to read the TV chyrons: It’s “war“ in the Gulf, like “wore,” not “where” like they’re trying to find Carmen Sandiego.","@MattEckel","pop culture",
"@IsraelButson exactly. A game can be educational while being a great game. I didn't play Carmen Sandiego to learn geography, and yet I did","@kindofstrange","edutainment","x"
"❤️ Carmen SanDiego Wonder woman 💛 🔹 Wendy from Peter Pan Raggedy Ann 🔹 #CharacterDay http://t.co/MdCSYQU5vY","@Lauritaaaa2497","pop culture",
"@DaleVsTheWorld traveling the world with Carmen SanDiego.","@_shanakin","travel",
"News from People : VIDEO: 10 Reasons Where in the World Is Carmen Sandiego? Was the Best Educational TV Show Ever https://t.co/mu0Tkx5vUe","@Huudxi__Xaohno","edutainment",
"This is also true for Frosty the Snowman, The Cat in the Hat and Carmen Sandiego. Most hat based entities are waiting to be challenged... https://t.co/VKhNwzGhr5","@MrJeffTrammell","pop culture",
"just realized how unintentionally hilarious i've been in choosing to wear a carmen sandiego shirt for the ladies' free skate","@Dorianize","style",
"I just learned where Minnesota is. If this were Where in the World is Carmen Sandiego, I would have tried to put it in Kentucky.","@Jenifesto","edutainment",
"Lumbersexual and Waldo & Carmen San Diego are 2 of the funniest couples' costumes on this list http://t.co/MubcGmT2Mo #halloween","@commonwealthlv","style",
"OMG Carmen Sandiego costume you guyz. My favorite. YESSSSSS. #FreshOffTheBoat","@angryplus1","style","x"
"Thank you @EACgov for getting the Carmen Sandiego song stuck in my head... https://t.co/8dYwJdxAWD","@katyowenshubler","pop culture",
"@ebontongue Somehow I could see you in a Carmen Sandiego-esque fedora...","@Myuphrid","style",
"@danlovaa posted from Elma? Okay Carmen Sandiego chill with the traveling #WhereInTheWorldIsDanielLovern","@Jeff_Renaud_","travel",
"Netflix is learning how in the world to play the franchise game with Carmen Sandiego https://t.co/slR14V6kry","@msbutah","pop culture",
"I am ""Where In The World Is Carmen San Diego"" taught me geography years old. I am also learned to type really fast in AOL chat rooms until my brother picked up the phone and the dial up internet was ruined years old.","@sarabrains","edutainment",
"Lady Gaga Swiped Her Hat And Trench From Carmen Sandiego's Closet - https://t.co/MBGZWpPU03 https://t.co/vF6aanPXyk","@LadyGagareports","style",
"I love Molly and everything she questions. Thank you for pushing the difficult issues. #insecurehbo @YvonneOrji #carmensandiego","@alexhiniker","pop culture",
"Pharrell stole Carmen Sandiego's hat. #Ironic #NBAAllStar","@MarkMcLovin","style",
"I think this trip is the closest I'll ever feel to being Carmen SanDiego.","@RachShoshana","travel",
"[WP] Waldo and Carmen SanDiego have a child, and then lose him on a trip. Now, they have to find out where he is. https://t.co/0w0VHbL4If","@rWritingPrompts","pop culture",
"We are so excited for @netflix's #CarmenSandiego with @HereIsGina & @FinnSkata! Thank you all for making it happen! https://t.co/uNDIdzwPRN","@NetflixLifee","pop culture",
"[INFO]Lady Gaga Swiped Her Hat And Trench From Carmen Sandiego’s Closet https://t.co/IPxN6nO8PP https://t.co/dLrRn86GJ9","@MailRPW","style",
"@LadyHawkins But you won't like... TAKE it, right? It'll still be there when you leave? Or do you plan to Carmen SanDiego style steal it?","@MrsLauraRoslin","pop culture",
"Bethenny walked into lunch with Carole wearing the latest in ""Where in the World is Carmen San Diego?"" fashion. #RHONY","@TheHopeSpears","style",
"Gina Rodriguez donning red fedora and trench coat of Carmen Sandiego https://t.co/mF35O2cw9D","@CarlosMTrivino","pop culture",
"Should have included Carmen Sandiego “@HayleyAtwell “@stuunalee @HayleyAtwell who wore it better tbh http://t.co/LcfWu0qf3P””","@wallflowerarts","style",
"@Amanda_Cavaseno That time of the year again. Have a very merry Xmas and enjoy your travels Carmen Sandiego :D","@tmosfear","travel",
"Everybody dresses as Waldo for Halloween but nobody has the gall to pull off Carmen Sandiego","@xMOONS","style",
"A8: Carmen Sandiego! We love to explore the globe -- red trench coat optional. @TravlandLeisure #TL_Chat","@JDVHotels","travel",
"Not Your Shero: Carmen Sandiego and the importance of feminism in edutainment #shero #mediastudies https://t.co/cCvD32VKqY","@PaulDarvasi","feminism",
"Rodriquez is already set to voice Carmen in the Netflix reboot of the popular animated series, due in 2019 along with a line of books from the owner of the property, educational... https://t.co/iPbh6kcdIT","@ichurchmethod","pop culture",
"I don't care what your OC is, or what universe they're from. Wide-brimmed red hat that hides brunette lady's eyes MEANS Carmen Sandiego","@synthpopisback","style","x"
"@JoeJohnsonIce I love that Carmen San Diego cosplay.","@Chiaki747","style",
"I used to want to be Carmen SanDiego. She was all over the damn globe","@vanitastrawberi","inspiration","x"
"You: “Let’s get this bread” Carmen Sandiego: “Hold my trenchcoat”","@EscoBlades","pop culture",
"@defonce_ For real though, this run as a whole is pretty solid drive-wise. Glad those Carmen San Diego VHS tapes I sent you are helping :D","@AlexHuffman","pop culture",
"Where in the World Is Carmen Sandiego? Becoming a Secret Travel Agent https://t.co/bT85zXWZIF https://t.co/aykEMEtOuW","@hnbreaking","travel",
"@blowticious OMG wait... a Pokémon go style real world RPG but it’s where in the world is Carmen San Diego 😯","@killadelfkid","pop culture",
"Why is ""Agent Carter"" wearing a Carmen San Diego hat?","@JugglerOfGeese","style",
"Dear fellow con goers, Despite the red hat, I am not, in fact, Carmen San Diego. Sincerely, The Tiny #PeggyCarter Cosplayer #AgentCarter","@TehKatieElf","style",
"@JayElectronica “@JayElectronica: Thank You Based God. #rare” <---- where in the World is Carmen San Diego? #mia #albumsoonplease","@bossladydeess","pop culture",
"Carmen Sandiego Costume – A DIY Guide https://t.co/mTdYkLfcPl https://t.co/BySLd4Go1F","@CosplaySavvy","style",
"tourist in raincoats look like carmen sandiego's henchmen","@CHEFofJOKES","travel",
"@bpsycho1 solid choice, I love me a femme fatale my top fictional girlcrush is still carmen sandiego >__>","@jaythenerdkid","feminism",
"Did we ever learn where in the world Carmen Sandiego is? https://t.co/sYxbgSKzxq","@GCNWrites","search",
"Thinking about hitting up a couple of Goodwill's for Carmen Sandiego cosplay pieces.","@NCogsmith","style",
"What would it take for me to learn Spanish? I know it’s worth it, I know I can, BUT who am I going to talk to? Who am I? Carmen San Diego?","@Mannequin_SKY","pop culture",
"@GreenBeanSuprem i only found out that carmen sandiego was an edutainment kinda thing this year, so no","@Speed_Freak01","edutainment",
"#carmensandiego #beige #trenchcoat Size 6-8 $40 shipped #vintage #fashion #vintageclothing… https://t.co/l0xdFRjZVQ","@Its_Poppin","style",
"Carmen Sandiego and Cobra Kai! Happy Halloween from The Sweat Social! #Halloween #happyhalloween #nola... https://t.co/VtPC4fiHE8","@TheSweatSocial","style",
"dressed up like carmen sandiago with no place to go #marveluniverseadventure #agentcarter #carmensandiego","@m_crosher","style",
"how he get Carmen Sandiego hat is the real question.","@___YanYan","style",
"INFO l @HereIsGina will Voice Every ’90s Kid’s Favorite Globe-Trotting Thief, Carmen Sandiego, in a @netflix Animated Series ! https://t.co/9dJ6t9rxwa","@GRodriguez_net","travel",
"Where are....? #CarmenSandiego #Waldo #Halloween #Halloween2018 #CouplesCostume https://t.co/7a7IalBB0Q","@littlesassilie","style",
"@BigBird I was on Amazon & I found a KFC toy of Carmen Sandiego's car, I have a feeling that she's been driving around everywhere.","@JeremiahLiles1","pop culture",
"Just realized the best cosplay photo would be Waldo and Carmen Sandiego together.","@j_hat","cultural icon",
"@MatrocFM @KevinLHough Halloween is an excuse to dress up and party here. adults usually go out on the weekend before the holiday (unless it lands on a weekend.) I went out last night to my local bar and dressed up as Carmen San Diego (an old computer game character)","@alloftheponies1","style",
"VIDEO: 10 Reasons Where in the World Is Carmen Sandiego? Was the Best Educational TV Show … https://t.co/RvJykL0hYp https://t.co/ekfzsz2foQ","@hoomanity111","edutainment",
"@RachelLeishman @the_moviebob When did Carmen San Diego stop being a detective story and become more of a tool to teach people geography?","@jcsturgeon","edutainment",
"Where in the World Is Carmen Sandiego? Becoming a Secret Travel Agent: Comments https://t.co/8aiid7n8Bx","@BacelyY","travel",
"spatscolombo: So I accidentally learned today about this thing where lots of people ship Carmen Sandiego... https://t.co/78wSoAtJli","@AquarIanMM","waldo",
"Where in the world is @debecks ? Might be in SE Calgary! . . #Halloween #Costume #CarmenSanDiego #RedHot https://t.co/mPh4RZRZjR https://t.co/VK6gVP3rAC","@cdjackman","style",
"*Puts on Carmen Sandiego hat and vanishes into Whole Foods* https://t.co/vg9IPbiHp1","@karaweisenstein","style",
"Already have my next Halloween costume planned out. Carmen Sandiego. My date&39;ll go as Where&39;s Wally. Always wanted to do that","@DaltonStokes1","waldo",
"Happy #Halloween, from our staff to yours: Carmen Sandiego, Batgirl, a cat and Kate Middleton. https://t.co/NnOkXqCrNf","@BoettcherFdn","style",
"@IQ_Adventures Omg, I learned more about geography from Carmen San Diego than I did from school! 🕵🏻‍♀️","@CalinadianGal","edutainment",
"@damonbenning @GarySharp1620 I feel like Carmen San Diego, traveling everywhere today!","@straightcash52","travel",
"@JeremyKawika Those sneaky bastards making learning fun. Oregon Trail, Where in the World is Carmen San Diego, Mario Type...","@BTNPollGuy","nostalgia",
"“Where in the universe is Car-men San-di-e-go?” “Carmen Sandiego is on Rigel VII.”","@mattsta","travel",
"@iSmashFizzle Carmen Sandiego and Shego remain iconic queens who are too good for a world that's beneath them. HBIC. https://t.co/lFlkUiSTeb","@JamesFluker","pop culture",
"@tithenai That hat looks like Carmen Sandiego's hat. Spill it: that couch is really a world-famous couch and Acme gumshoes are after it, eh?","@ActsofAndrewB","style",
"I may need to move to a rainier place, bc I really enjoy wearing my trench coat. Makes me feel like a news reporter, or Carmen San Diego..","@AlysTigue","style",
"Ladies... Carmen San Diego would be an awesome Halloween costume. Js","@poindextertunes","style",
"Rihanna Gives Patent Leather Carmen Sandiego Vibes at the Grammys https://t.co/DWzMVL8eZo  https://t.co/WWaNofSnB1 via @ElleMagazine #fashion #news https://t.co/4nrDuuPhtR","@adellapasos","style",
"@espn That dude travels more than Carmen Sandiego.","@TheGriffGardner","travel",
"Imma let you finish, but Carmen Sandiego is the greatest female video game character of all time https://t.co/EKj5pFEkUD https://t.co/PsZcyHb10i","@GaTrailer","feminism",
"Today, tell the International women in your life how much you appreciate their work. Carmen Sandiego, you're a darned fine crook.","@SpookingtonsDIM","feminism",
"Cosplay as Carmen Sandiego at work today? Yes, I think I shall.","@RawkinRobinGoes","style",
"@TheKalenAllen I’m curious if people would stop recognizing you without your signature Carmen SanDiego hat.","@CaseyDoesItBest","style",
"Gina Rodriguez donning red fedora and trench coat of Carmen Sandiego https://t.co/yGifG6wlSC https://t.co/LgIFAYF07h","@realJoshSzuslik","pop culture",
"The skids need constant reminding. The only red fedora is on one Miss Carmen Sandiego, TYVM 😉 https://t.co/WOs1oOLN23","@da5ch0","style",
"@Just_Meg @annehelen Carmen Sandiego was great too and I loved playing the computer game even before the show came out. I probably learned more about world geography from that game/show than I did in school, haha","@JoannaConn3lly","edutainment",
"Achievement unlocked: couples costume! #whereswaldo #carmensandiego… https://t.co/MNMai1WjAT","@bearkosh","style","x"
"Channeling some serious Carmen Sandiego vibes in today's #ootd http://t.co/xakoIMHvf3 #fbloggers #wiw #style","@TVIBblog","style",
"Gina Rodriguez Is Going To Be Carmen Sandiego In A Live-Action Film And I'm Breaking Out My Red Fedora To Celebrate https://t.co/OzGtkStcvJ via @MeAliVelez","@newyorknewart","pop culture",
"I want to be carmen san diego for Halloween but also forever","@spacecadetjon","style","x"
"I'm planning all my travels today and I feel like Carmen Sandiego! Hope you all get that 90s reference. https://t.co/nrMvFxNLRN","@ejshields09","travel","x"
"@slaterize also: haven't learned this much about global geography since Where in the World is Carmen Sandiego","@slaterize","edutainment",
"She put on her Carmen San Diego hat.....","@Cornbread_Cunt","style",
"i think i'll never be allowed in ireland again cause i got this book from the only public library in dublin and accidentally brought home am i an internacional criminal can i wear carmen sandiego outfits?","@calamiteajane","pop culture",
"Who wore it better? Joseline VS. Carmen Sandiego VS. Rasheeda! #LHHATL http://t.co/iAuRLGaYlM","@LoveHipHopVH1","style","x"
"Ladies and gentlemen, please welcome to the ring, Carmen San Diego--- oh, that's @LaceyEvansWWE #NxtCitrusSprings Lacey probably wouldn't travel around the world anyway. USA USA USA! https://t.co/6gbEyTmyv3","@Newtycg","travel",
"VIDEO: 10 Reasons Where in the World Is Carmen Sandiego? Was the Best Educational TV Show Ever … https://t.co/ICj09uXThC","@gossip_24_365","edutainment",
"@brogepi You really really really do. Carmen Sandiego-style bureaucracy at its finest.","@discordfairy","pop culture",
"A little sad I am still in need of my winter coat this week. Where are you San Diegooooo. #cali #dreams #carmensandiego","@amandadonohue","search",
"Where in the world is Carmen Sandiego? Who cars! You want to #hire me instead! #3dprinting #3dprintres #employment #job","@3Dprint_Seattle","pop culture",
"I grew up watching Mr. Rogers, Sesame Street, Where in. The World is Carmen Sandiego, 3-2-1 Contact, Magic School Bus. Besides Sesame Street what are the educational shows for kids these days?","@pretavoyager","nostalgia",
"SNL' Tries Some Edutainment With 'Where In The World Is Kellyanne Conway?' https://t.co/zct8ykf0DZ #Digg","@RealTimeHack","pop culture",
"The first strong female character for me while growing was Carmen Sandiego and the first time I really saw myself well represented on screen was with Katherine Barrell playing Nicole Haught so...SEEING THIS IS COMPLETELY MINDBLOWING. Damn. https://t.co/ARVCvia5It","@john_henry_","feminism",
"I tried tilted fedora, belted trench coat red lips look I associate with River Song from #DrWho and my husband thought I was Carmen Sandiego","@Iheartwerebears","style",
"Where in the World Is Carmen Sandiego? Becoming a Secret Travel Agent https://t.co/B6ZLGJNcFS","@wearefirelabs","travel",
"International / Cosplay weekend has me all / Amped for Halloween! #Toad #CarmenSandiego #wavingarmtubeman http://t.co/DIkoteYcuj","@PennyandPaper","style",
"Gotta love this hat. Almost reminds me of Carmen SanDiego ;) #selfie #carmensandiego http://t.co/BowywfYmur","@Emilylenore55","style",
"#BREAKING #news: Introducing our Travel Series. It's the fun of #Travel & the #nostalgia of #Carmen Sandiego. (link below): https://t.co/oP7kObLLbh #IAmACreator #travelblogger #Blog #vlog #BestFanArmy #Twitter #games #world #trip #weekend #fun #latelate #Motivation #inspiration","@VerdictSquadNow","nostalgia",
"VIDEO: 10 Reasons Where in the World Is Carmen Sandiego? Was the Best Educational TV Show … https://t.co/DxtAfjFHMO https://t.co/BHroDxY5qd","@MisonoAlex","edutainment",
"The hat of life! Where in the world is Carmen San Diego flow...#whatiworetoday #rockmom #fauxfur… https://t.co/EpGEwXCsOn","@3thechicway","style",
