"text","handle","category","star_tweet"
"@NewYorkPBS @ThirteenWNET Public schools educated me- and public television was great for me. From Sesame Street, Mr. Rogers’ Neighborhood, Reading Rainbow, Ghostwriter, Where in the World is Carmen Sandiego, and countless other shows, I appreciate what public TV has done. https://t.co/Df2CrqL5PG","@jamaaltbailey","edutainment",
"Travel the world on some Dora the Explorer or Carmen San Diego or Wild Thornberrys type ish","@TheDunbarSystem","cultural-icon","x"
"#Hat #sunnydays #happygirl #whereintheworld #carmensandiego #saturday #selfie https://t.co/eV69541gQK","@LOLIKEWHOA","fashion",
"why does rihanna have on carmen sandiego's coat (i love it)","@geeequinn","fashion",
"Justin's hat reminds me of Carmen Sandiego #BBOTT","@palmys05","fashion",
"Summer aspiration: Find Carmen San Diego. She's finally going down.","@JoeCeppy","cultural-icon",
"I love #AgentCarter but he outfit is all Carmen SanDiego","@HugChick","fashion",
"@iMatsumotoxo Turn it red and it's a Carmen Sandiego cosplay!","@FlowerofFrost","fashion",
"Already have my next Halloween costume planned out. Carmen Sandiego. My date&39;ll go as Where&39;s Wally. Always wanted to do that","@vikkiafuxs","fashion",
"Where the hell is Carmen Sandiego???","@RawOverlord","cultural-icon",
"Okay @netflix you are giving me #CarmenSandiego and I love @HereIsGina! https://t.co/raX2DLrgmz","@natalie_nicoleg","cultural-icon",
"New post: ""Netflix orders animated Carmen Sandiego series"" https://t.co/sWXD1AQiun","@mshvrge","cultural-icon",
"@SimplyRagny While I support this idea whole-heartedly... Just be aware that if you wear that hat, you're GOING to get ""Carmen Sandiego"" comments. Not that that's a bad thing, but not what you're going for.","@AdmiralMemo","fashion",
"I think it's clear at this point that Vladimir Putin is holed up somewhere with Carmen San Diego. WHO WILL SOLVE THE GEOGRAPHY RIDDLES!!?","@TheUniverseGM","cultural-icon",
"Brian and I wanna be Where's Waldo and Carmen Sandiego for Halloween","@stunneyr0bins","cultural-icon",
"[Photographer]Waldo and Carmen Sandiego via /r/cosplay https://t.co/7P8CfpN5zn #cosplay https://t.co/JlpImTmMpN","@CosplayLove2","cultural-icon",
"Carmen San Diego sightings! @ Miami International Airport - MIA https://t.co/rW7GBkKYhK","@sap181","travel",
"it’s getting to the point where now i’m just mentally photoshopping harry styles into a carmen sandiego trenchcoat.","@ofjustimagine","cultural-icon",
"Where in the world is Carmen Sandiego? Apparently, working as a stewardess on my flight to San Antonio... http://t.co/AS1ExP63BD","@ReuseRecruiting","travel",
"VIDEO: 10 Reasons Where in the World Is Carmen Sandiego? Was the Best Educational TV Show Ever via @People https://t.co/M9k1OynQ27","@RJBailey","edutainment",
"thing they do for fun in Buenos Aires (where i ALWAYS found Carmen San Diego)? sit just behind a fence and watch airplanes take off and land","@jcompton11","travel",
"This needs to be made. ""@WinnipeggerRush: Am I alone in thinking there needs to be a ""Where in the World is Carmen Sandiego?"" movie.""","@FearlessRiOT","cultural-icon",
"Will this finally be the year I achieve my dream of going as Carmen Sandiego for Halloween?","@amberhumbug","cultural-icon",
"wow so is Where on Earth is Carmen Sandiego.","@iw2ma","cultural-icon",
"But... Carmen Sandiego... I AM MEETING REAL WORLD CARMEN SANDIEGO","@SteeleFitzwater","cultural-icon",
"Why this look like Carmen Sandiego without the hat https://t.co/qbvlqJiS1t","@BryleighTate","fashion",
"My daily visit to @KateBeckinsale 's Insta left me with this thought; ""Where in the world is Carmen Sandiego ?"" See this Instagram photo by @katebeckinsale https://t.co/aXcT1mi0R6","@BaxalaSodi","fashion",
"Browsing Wikipedia I've discovered something: in 2019 Netflix will release an animated series about Carmen Sandiego :D https://t.co/kOEsAH6rkv","@jescudegodia","cultural-icon",
"Pretty happy with Emma and my couples costumes: Carmen Sandiego and Waldo https://t.co/4dvAqr5pOF","@BantamSam13","cultural-icon",
"Netflix's 'Carmen Sandiego' debuts on January 19th, 2019 https://t.co/ZxKst6tEu9","@chosenlyric","cultural-icon",
"how carmen sandiego accidentally became an educational game icon https://t.co/WzMb2aJnZd","@DegammageUK","edutainment",
"@schweinsty I loved Carmen Sandiego. *-* It was more educational than Where's Waldo. (You learned geography.) Mostly a video game and TV game show, but I think a cartoon, too.","@McNultyAmy","edutainment",
"http://t.co/jpfMqJrTsw Less than a week now until I don the Carmen Sandiego hat and dash all about London to stand outside state's embassies","@scattermoon","fashion",
"@jhaletweets Love some Carmen Sandiego. She is the Learning Thief.","@Jeice_Burter","edutainment",
"Lady Gaga Swiped Her Hat And Trench From Carmen Sandiego's Closet https://t.co/GBrijGD5k3","@updates4gaga","fashion",
"Gina Rodriguez, ‘Stranger Things’ actor, to lend voice to netflix’s ‘Carmen Sandiego’ https://t.co/bkgsqtpbDF","@spirispark","cultural-icon",
"Tonight a homeless man casually looked at me and asked, ""where in the world is Carmen Sandiego?"" and I was done","@BrightStacheBox","cultural-icon",
"@mikeaustinwest came up and helped us beat Carmen SanDiego while learning more about ancient Egypt!!! #wendellhowlout #kidslovedit https://t.co/niPRmg7hBS","@Msmootoo","edutainment",
"With school back in session, now is the perfect time to brush up on those geography skills. Sure, it's not Carmen Sandiego, but ""Columbia"" was the bee's knees back in 1885. Who's up for a game? #backtoschool #c19 #geography https://t.co/R799VIBLdc https://t.co/clKMJvghmX","@AmAntiquarian","cultural-icon",
"All copies have been distributed. Thank you so much @sparsevector. Again, go check it out. Get him cracking on an M-rated Carmen Sandiego!","@IndieGamerChick","cultural-icon",
"Reading travel guides reminds me of Where In the USA is Carmen Sandiego.","@Animblevagrant","travel","w"
"There's a guy busking in Ely wearing Carmen Sandiego's hat. Today's answer is: Ely. https://t.co/jfJu5Uv4Yr","@Legal_Dan","fashion",
"Someone told me I look like Carmen Sandiego when I put my red hat on.","@juramhawk","fashion",
"🎶Where in New York is Carmen Sandiego?🎶 I found this geography quiz half-validating, half-embarrassing. http://t.co/OpUU3QBMGJ","@pduchan","cultural-icon",
"""It's Carmen San Diego but with blonde hair"" ""No it's not"" ""Yes it is her, she has the same hat.""","@leclairra","fashion",
"carmen sandiego and joker fight it out in smash bros","@HatokTalk","cultural-icon",
"Ticking the Carmen Sandiego box in my fashion inspiration checklist. So buying this. I don't care if its 35 deg out. http://t.co/3QMTGCnkFV","@AnnaHamill","fashion",
"Carmen Sandiego | concept art #travel #gamingpc #gamers #Archaeology character design https://t.co/3hGdU9ikVU","@ApgarArts","travel",
"Sign up for the Everyday Explorer newsletter: https://t.co/HcTlHIbBt7 Lot's of Carmen Sandiego gifs and mentions await.","@theLeighWright","travel",
"Netflix Takes Aim At Hollywood With Gina Rodriguez's 'Carmen Sandiego' - Forbes https://t.co/hhCjLHs1UI","@Hollywoodwatchs","cultural-icon",
"FYI: Theres no such place as Carmen, San Diego. Tom Zegan http://t.co/EP099Wqda9 #quotes #inspiration","@pedrodemocrata","cultural-icon",
"@MattNorlander only if it was upside down like Carmen Sandiego.","@therealestdan","cultural-icon",
"@PancakeMix85 Where in the world is... Carmen Sandiego. https://t.co/bZG4LFseem","@HighlordDarius","cultural-icon",
"A new Carmen sandiego series is coming to netflix... I'm confused","@savvybear1981","cultural-icon",
"@Cam_Oflage Get a hat and you’re Carmen Sandiego","@shawarmapapi","fashion",
"@AlexHolleyFOX29 spain or mexico where in the world Carmen sandiego 330 market st no.","@jakew1967","cultural-icon",
"Get Gina Rodriguez a Giant Coat, Because She’s Doing a Live-Action Carmen Sandiego Movie https://t.co/2x0ftobCBC https://t.co/4ZkKW0Xk9g","@BetaSeries_News","cultural-icon",
"Introduced my kids to #CarmenSanDiego and they love it. Too bad it hasn't been updated and still has old geographical data! Still great fun!","@carlsantos55","cultural-icon","x"
"@DaGiltyMan Every time I wear my red fedora or wear my Agent Carter t-shirt, I get Carmen Sandiego comments. ;)","@Sabriality","fashion",
"@sbkaufman @angeladuckw @Playworks Amazing discussion - thank you all! Btw: Where in the World is Carmen Sandiego is a close second to playing Kick the Can","@ELMConsultingCo","cultural-icon",
"@joanneprada is a messier Carmen San Diego 2.0 Homegirl taught me the scam in my youth. Joanne refined the process 😂😂😂","@LMZzz","cultural-icon",
"#33c3 Where in the World Is Carmen Sandiego? Becoming a secret travel agent https://t.co/Tq5aEwJ9Vy","@kittyhundal","travel",
"#CARMENSANDIEGO: #GinaRodriguez Cast In #Netflix #Film Adaptation https://t.co/FiZXPm8oLe https://t.co/LyRS9x5jC2","@FilmBookTomasi","cultural-icon",
"First poster and images for Netflix’s Carmen Sandiego https://t.co/sn7eCYQr8S https://t.co/XrXoNb3FDf","@ScriptFeed","cultural-icon",
"New post (Netflix is learning how in the world to play the franchise game with Carmen Sandiego) has been published on all new - https://t.co/FL39My1lu7 https://t.co/GJRVZAajq4","@R7ty20","cultural-icon",
"Carmen Sandiego Netflix movie better have a Rockapella soundtrack...","@jpatrickrigney","cultural-icon",
"Well, well, well, looks like that dastardly @CarmenSandiego is planning a come back. Polish your detective skills at LCM+L before her return! ⚡️ “Gina Rodriguez is bringing a Carmen Sandiego film to Netflix” https://t.co/El7TItRbPc https://t.co/01VGJkT4bp","@LivingComputers","cultural-icon",
"Where in the world is #carmensandiego @ Washington Square Park https://t.co/oRtLb6UKrj","@TerwilligerPDX","cultural-icon",
"https://t.co/T3MiRoKSDF : Netflix plans live-action 'Carmen Sandiego' film with Gina Rodriguez https://t.co/dzPzCDOTAd","@A2eTechnologies","cultural-icon",
"the netflix carmen sandiego thing looks good tbh","@weqrio","cultural-icon","x"
"I feel like Carmen Sandiego is the only one that would ever really know. They must travel and kick ass… http://t.co/MiZrKXg2qb","@Grant_Abel","cultural-icon",
"There is no doubt that where in the world is carmen san diego was the best educational game ever http://t.co/lPRSMOi6fI #ThinksyNostalgia","@bertiebeeeee","edutainment",
"I found Carmen Sandiego! #Oia #Santorini #Greece #holiday #beautiful #takemeback #travels #KittyCatontour http://t.co/JFDcsIVlG9","@catalac10","travel",
"Gina Rodriguez Is Carmen Sandiego In Netflix’s New Live-Action Film https://t.co/arr9GnmJCT","@MegKBax","cultural-icon",
"I approve this news 👍#🌎🌍🌏❓ ⚡ Netflix greenlights a Carmen Sandiego series https://t.co/Y6iLgTWPwy","@CEO_Kehoe","cultural-icon",
"Well, there's RedHat as well. From a generation that sees the RedHat logo and remembers Carmen Sandiego. #MemoryPalaceBonusRoom","@melodychamlee","fashion",
"alex: whats your type? jonas: brunette. red hat. mysterious-- alex: carmen sandiego. jonas: oh yeah. that explains a lot","@mettatonex","fashion",
"A grrrrreat day for Christmas tree shopping. Note Carmen Sandiego in the back..... http://t.co/3AXURcgx3n","@tpappas6","cultural-icon",
"VIDEO: 10 Reasons Where in the World Is Carmen Sandiego? Was the Best Educational TV Show … https://t.co/nr3yAOJdcZ https://t.co/CsTReqs9NW","@MentorTerri","edutainment",
"@StarKat99 @auntiepixelante It reminds me so much of that original 80's game of Carmen Sandiego ^.^ But in a fun space universe!","@StarKat99","cultural-icon",
"Travel experience: 20+ years of looking for Carmen Sandiego","@sheyxpeare","cultural-icon",
"My first love was Carmen Sandiego, because she was dark, mysterious, well traveled, and forced me to learn weird trivia.","@eaglethehawk","travel",
"@xdredikx I feel like you are Carmen SanDiego but travel the world to flirt with girls.","@OliverWicked","travel",
"Gina Rodriguez donning red fedora and trench coat of Carmen Sandiego https://t.co/SBvc32Zdvf https://t.co/bDWE4FS3eD","@hax_lucas","cultural-icon",
"Netflix orders animated Carmen Sandiego series https://t.co/mmiFycwRoS #TechNews https://t.co/84CvvsnAsE","@Vish3890","cultural-icon",
"""New plan for Halloween: you dress as Waldo, I’ll dress as Carmen San Diego. We can just hide in a..."" http://t.co/0fezLiPLks","@EpicBert","fashion",
"Netflix is betting on ‘90s kids nostalgia for learning with upcoming lineup https://t.co/Y56FnhVCO0","@DTAMedia","cultural-icon",
"The First Images of Netflix's Carmen Sandiego Are Here https://t.co/Lqmr4r5scC","@TheDailyDigest","cultural-icon",
"It's Friday! If you were Carmen Sandiego, where in the world would you want to be this weekend? #TGIF #travel","@COMOHotels","travel","x"
"Another '90s Favorite Is Being Rebooted at Netflix—And Gina Rodriguez Is Playing the Lead https://t.co/9b3dgt270Q via @glamourmag","@80sMusicGirl","cultural-icon",
"Something about Carmen Sandiego in your art style just seems so right. I love this piece, @Mografi_Joe.<3 https://t.co/GS0RxUPAuN","@timleftwich","fashion",
"Lol, Future wears the same type of hat that Carmen Sandiego does.","@CristianoVilan","fashion","x"
"Never forget being 16 in a car full of dudes singing every word to Carmen Sandiego","@haleyhiggins_","cultural-icon",
"@JuliePJones @Skype @SEANJFAHEY @KarlyMoura @SARAHLANDIS @kellyihilton @beardsleyteach @MistyKluesner @jerslergms Basically, in our Carmen Sandiego game, we could examine cultural clues like “Hispanic musicians” to see what Gloria Estefan has in common w Camilla Cabello song (Havana). They would use the atlas in Discus Kids to find Cuba. But I’m also using Seesaw to save Ss responses.","@Kerry_R_Harding","cultural-icon",
"@TeachHeath @TASFair Mr Heath is up north in WA so I love the geography game! Where in the World is Carmen San Diego was my fav growing up!","@GeneinLetford","cultural-icon",
"Gina Rodriguez To Star As Carmen Sandiego In Netflix Live-Action Feature https://t.co/r9NmHzpoua #entertainmentnews #Trending @Netflix_Canada #Movies #Action","@Movie_tym","cultural-icon",
"Learn about Gina Rodriguez, ‘Stranger Things’ actor, to lend voice to Netflix’s ‘Carmen Sandiego’ https://t.co/Q5IVGGfWF0 on www.Service.f…","@Digital_SFit","cultural-icon",
"I like how Spain goes to France and France goes to Spain, Ukraine goes to Russia and Russia goes to Ukraine (and I *think* Serbia and Croatia are a similar pair but I'm not certain because my childhood Carmen Sandiego was before the former Yugoslavia dissolved) https://t.co/muJAuYi8tE","@impstrump","edutainment",
"#WhatImRunningFrom 5th Graders who are far too curious and overly excited about geography ~Carmen San Diego","@boomdingwinning","cultural-icon",
"@Iesha87Official @HereIsGina Yessss and thanks for the info ...... and yes world this adult male Latino oilfield worker loves carmen San Diego","@arnold_beltran","role-model",
"The voice of the mayor on Doug was the guy who hosted ""Where in the World is Carmen Sandiego?"" I love the internet.","@bshawesome","cultural-icon",
"do you think our generation is so travel centric due to growing up w/ shows like #CarmenSandiego? http://t.co/qWncqRi6Yl","@ptau","travel","x"
"#BretsLog Still looking but has anyone found Carmen Sandiego? I want my hat back.","@bretrreimers","fashion",
"Why Tim dancing around on snap chat is just and inspector gadget coat and a Carmen San Diego hat lol","@AONEAL24","fashion",
"@olordy_brian But like a funny Carmen Sandiego? I am back next Monday and you will need to revive me with a tea as soon as I arrive please and thank you.","@NourHadidi","cultural-icon",
"That red hat is reminding me of where in the world is Carmen San Diego #LHHATL","@outspokenkimmie","fashion",
"Carmen Sandiego is coming to Netflix, as the age of retro (un-originality) continues.. #tv #netflix #gaming https://t.co/qpz0vnG1QA","@vicious_candy","cultural-icon",
"@TheFilmRenegado You and Carmen Sandiego would make a cute couple with your hats.","@OzzieArcane","fashion",
"Carmen Sandiego is returning as an animated children’s show on Netflix https://t.co/29XD5kjlVd via @Polygon #videogames #gaming https://t.co/gzUqXQ8Sva","@jzacharypike","cultural-icon",
"Where in the World is Carmen Sandiego?! Ahhhh!! It’s been an adventure-less week of computer… https://t.co/bhDi70O0c7","@LaycieLoveHI","cultural-icon",
"I want to see @KeroKeroppi64 stream some old school educational pc games. Time to build up that vocabulary and general world knowledge. I'm thinking some magic school bus games and some Carmen San Diego games","@ThatsADarkHorse","cultural-icon",
"where's waldo and carmen sandiego is lit'rally the cutest couple costume omg","@mpdtarantula","fashion",
"Where in the World Is Carmen Sandiego? https://t.co/6QhhAjsiQu","@charlesdbarker","cultural-icon",
"@slmteched That is true for me too. I learned how to get Math done and play Where in the World is Carmen SanDiego. @amylpie @alcp #eduvue","@techyturner","edutainment",
"So I just downloaded Sandiego Inc ..which is kinda like Where in the World is Carmen San Diego OMG. Hyperventilating.","@petersereno","cultural-icon",
"I'm going 2 b Carmen San Diego 4 Halloween (have 2 dress up). Then when I don't go to work they will be like ""Where in the World is..."" oh.","@adamwalkerwho","fashion",
"VIDEO: 10 Reasons Where in the World Is Carmen Sandiego? Was the Best Educational TV Show Ever The PBS game show w… https://t.co/i0uiCSkS3S","@wegetnews","edutainment",
"#Gossip #Celebrity Beyoncé is the Carmen Sandiego of Pop http://t.co/nAEBTBwQgj #TeamFollowBack","@Beyonce_Watch","cultural-icon",
"Just saw the best couple costume downtown: Waldo + Carmen Sandiego. #halloweengoals","@AllieBamma","cultural-icon",
"""Carmen San Diego’s signature smirk gives it away: travelers are having questionably legal amounts of fun."" http://t.co/PrPIrUkRdz","@TUStudyAbroad","travel",
"@whittynovels Well.... my first woman crush was fergie and then Carmen Sandiego","@theinfamouswig","cultural-icon",
"Netflix is Bringing Back Carmen Sandiego - With Gina Rodriguez! (Report) https://t.co/NbHNF55WJq https://t.co/9wd7B1BUjE","@news_24_365","cultural-icon",
"@nfidel_ In 1994, we used the Carmen San Diego video game in our after-school program with 7 to 11 year-olds, to develop world geography knowledge. In order to proceed through the game, children needed to use almanacs and other ref. works. This was before Google was so widely available.","@RGracielaMontes","cultural-icon",
"Netflix is making a reboot of Where on Earth is Carmen SanDiego, which officially makes up for them taking away seasons of Bob's Burgers.","@VintageDisney28","cultural-icon",
"How Carmen Sandiego accidentally became an educational game icon https://t.co/q9uorMKp1K","@F4GSocial","edutainment",
"Gina Rodriguez cast in Netflix's 'Carmen Sandiego' movie https://t.co/sXrguSarct","@TroyCoby","cultural-icon",
"@_rallycap ""Where in the World are Tyson and Usain Bolt"" - a Carmen Sandiego style caper show...","@RyanKeim","cultural-icon",
"@MimiImfurst Are you wearing your Carmen Sandiego outfit again?","@corey081590","fashion",
"What if Dora the Explorer is the lovechild of Waldo and Carmen Sandiego and she just really really wants to see her parents again? :(","@howtoraymond","cultural-icon",
"@MarkConnollyCBC I dressed up as Carmen Sandiego once, but I was working in an office where everyone was at least 5 years younger than me. No one understood the reference, and I had to replay the opening theme of the TV show on you tube all day for everyone to sort of understand.","@thomsonjennifer","fashion",
"Netflix Could Be Bringing Carmen Sandiego Back https://t.co/FIW0cL4E6s via @io9","@franksands","cultural-icon",
"A life-action Carmen Sandiego is coming to @Netflix, starring your favorite TV actress. https://t.co/WuUzt4B3hi","@InStyle","cultural-icon",
"Already have my next Halloween costume planned out. Carmen Sandiego. My date&39;ll go as Where&39;s Wally. Always wanted to do that","@tuckerzcvdvenus","cultural-icon",
"No lie, I'm really excited for Carmen San Diego and Bill Nye on Netflix 😂","@PageRay","cultural-icon",
"@coffee4danz This is like ""Where in the World is Carmen Sandiego."" What adventure are you embarking upon now?!?","@JulieBrethauer","travel",
"Where is the world is Carmen San Diego? I mean....cute dresses.","@misschristiegee","cultural-icon",
"@Quinnae_Moon To be fair, a red fedora is very different from a traditional black fedora. Looks nice! Like a classier Carmen Sandiego.","@tellahtruth","fashion",
"And now this: Carmen Sandiego is returning as an animated children’s show on Netflix https://t.co/8s46HF4crF - @Polygon https://t.co/HkYQQkeQMD","@hdboothe","cultural-icon",
"@beeswomp @r_gonz_ knuck tatt idea: [Picture of The Chief from Where in the World is Carmen San Diego]GUM SHOE","@daddylongegg","cultural-icon",
"What does Carmen Sandiego & Little Witch Academia have in common? Carmen's to her pursuers like LWA's to EVERYONE WAITING FOR IT @netflix https://t.co/CT9rGA5W9N","@fullOanime","cultural-icon",
"@GalGadot With that awesome coat, I'm now 110% convinced that you'd make the perfect Carmen San Diego. Why hasn't that movie been made yet? Or a new video game, for that matter? Either way, that view is STUNNING. Hope you're having a great day!","@Adam407","fashion",
"Carmen Sandiego' Reboot Headed to Netflix https://t.co/4puz5kb8CT https://t.co/MfHNO9MRUF","@MollyVybz","cultural-icon",
"Netflix orders animated Carmen Sandiego series https://t.co/D6ewDdYpdS","@tf_events","cultural-icon",
"I want someone to explore the world with Carmen San Diego style","@RyanRams","travel","w"
"I hope the Netflix Carmen Sandiego rumors are true. Although, I'd been hoping that Gina Torres would play her one day.","@jk_tidwell","cultural-icon",
"Idk if ive mentioned this on my twitter b4 but i am SO HYPED FOR THE CARMEN SANDIEGO REBOOT WITH GINA AND FINN NONE OF Y'ALL UNDERSTAND https://t.co/SZQ5OJNhZ2","@nymphonies","cultural-icon",
"Gina Rodriguez donning red fedora and trench coat of Carmen Sandiego https://t.co/jEFBE87mE4 https://t.co/uBwgxgIsXa","@PansehTsewole1","cultural-icon",
"I want to start buying big hats, but I can't decide between Carmen Sandiego & Bridget Bardot https://t.co/ARkQhhddI2","@athenahollow","fashion",
"Gina Rodriguez Will Play The Iconic Carmen Sandiego In An Upcoming Netflix Live-Action Film https://t.co/xlM6IKsliS https://t.co/jQXKeEW2we","@ReinaaRoyale","cultural-icon",
"Halloween is taken VERY serious @MagnetForensics! Check it out #carmensandiego #death #fox #Ash #pooh #catlady #witch #BB-8 #bubbleman https://t.co/a1SM4DSDe9","@kellybraiden","fashion",
"Netflix plans live-action 'Carmen Sandiego' film with Gina Rodriguez https://t.co/NRJxHcHQ2r https://t.co/f4S6NWcEyv","@coolisah","cultural-icon",
"Caroline definitely wore it better than Carmen Sandiego. @itskatelambert #TeachersSeries","@TreshonBrown4","fashion",
"there's a Carmen Sandiego series coming to Netflix? Coo.","@JerseyDread","cultural-icon",
"@babytwigxxx Rockos Modern Life Duck Tales Goof Troop Ren and Stimpy CatDog Two Angry Beavers Doug Carmen San Diego Inspector Gadget Arthur Magic School Bus Need I go on...?","@DevDidThat","cultural-icon",
"A new Carmen Sandiego could be coming to Netflix https://t.co/VcTOnMqHhC https://t.co/Rm49PXOKwg","@superfabis","cultural-icon",
"#PleaseExcuseMeFor letting Carmen Sandiego get away... but she's blinded me with geography!","@wchrisg0528","cultural-icon",
"@CarmenSandiego She went to Brazil. #FindFran #CarmenSandiego","@TalithaRabboni","cultural-icon",
"Finally got my Carmen SanDiego hat! 😊","@KristinnArielle","fashion",
"Carmen Sandiego Returns in a New Educational App https://t.co/FexmZl2xkv https://t.co/fJ9l59PdgR","@HeathergfieldsG","edutainment",
"@NetflixAndAnts Excuse you I was gay for Carmen Sandiego pretty recently","@SurlyNurseJoy","cultural-icon",
"Should be if you're gonna parade around in that Costco Carmen San Diego costume","@Franklinaire","fashion",
"Great show. RT@EmmeRogers: Excitedly diving into #AgentCarter! Loving the red hat! Very #CarmenSandiego!","@JBMaddawg","fashion",
"VIDEO: 10 Reasons Where in the World Is Carmen Sandiego? Was the Best Educational TV Show … https://t.co/mWAgtCQGBl https://t.co/8CTOHFfQj2","@Peter_S_Becks1","edutainment",
"When I grow up I want to be Carmen Sandiego. That hat...","@sork_brady","fashion",
"Is this real life @NetflixES ??????? https://t.co/EAbSEPvrEY ❤❤❤❤❤❤❤❤ #CarmenSandiego #pleasemakeithappen","@clatormo","cultural-icon",
"Netflix Announces 'Carmen Sandiego' Reboot With Gina Rodriguez & 'Stranger Things' Finn Wolfhard https://t.co/xVm5XXOq8Y","@SocialinMemphis","cultural-icon",
"@BigBird I caught all of Carmen Sandiego's crooks, but Carmen is still out there in the US!","@JeremiahLiles1","cultural-icon",
"She in her Carmen Sandiego hat. #EmpireFOX","@LolaBJones","fashion",
"Any more news on Carmen Sandiego @NetflixUK? Apart from where she is... obviously haha 🌎 https://t.co/esY6GDf7yE","@LouEmo84","cultural-icon",
"@irisjaycomics if i had to pick ONE character it'd probably be Carmen Sandiego bc: 1. effortlessly stylish 2. no regard for laws 3. secretly a fucking nerd","@irisjaycomics","fashion",
"@Hogmanlolz @NateHillTV But where in the is Carmen Sandiego?!","@WhoIsBossLogic","cultural-icon",
"#news Carmen Sandiego: #netflix is working on the return of the character in an animated series https://t.co/VfCz473Wdy https://t.co/p3vIAXr8CL","@BitFeedCO","cultural-icon",
"@HereIsGina (Gina Rodriguez) to Star in #CarmenSandiego Series on Netflix! OMFG https://t.co/ayNpK9e7WA https://t.co/noCtXdFbKl","@HollywoodHoller","cultural-icon",
"Ashe is basically Carmen Sandiego meets Vash the Stampede.","@RemingtonWild","cultural-icon",
"Big fan of STEM education for kids, but there are now 9,582 ""learn to code"" toys, no innovation in geography ed. since Carmen San Diego.","@josephflaherty","edutainment",
