"text","handle","category","star_tweet"
"Viral: VIDEO: 10 Reasons Where in the World Is Carmen Sandiego? Was the Best Educational TV… https://t.co/qWoJnxL8Zk https://t.co/QR9dFO1FD9","@DaphneLowy","edutainment",
"@frysquint @fiddleyoumust now i just want a carmen san diego remake starring harry styles. he has to wear the overcoat and hat to really sell it though.","@liamjackson84","style",
"@HayleyAtwell looks like carmen san diego's hat","@MRumson","style",
"red peacoat arrived today for Carmen Sandiego... its perfect! cute enough to wear casually as well! #cosplay #Magfest","@Rawrbug","style",
"@JuliePJones @Skype @SEANJFAHEY @KarlyMoura @SARAHLANDIS @kellyihilton @beardsleyteach @MistyKluesner @jerslergms Basically, in our Carmen Sandiego game, we could examine cultural clues like “Hispanic musicians” to see what Gloria Estefan has in common w Camilla Cabello song (Havana). They would use the atlas in Discus Kids to find Cuba. But I’m also using Seesaw to save Ss responses.","@Kerry_R_Harding","pop culture",
"#Breaking @netflix is developing a live-action film based on the classic edutainment video game series #CarmenSandiego https://t.co/EDzXwG9puB @BlastingNews #IARTG #PJNET #tcot https://t.co/ggDKhRRfKq","@eoanews","edutainment",
"I played Oregan Trail and Where in the World is Carmen Sandiego on floppy disks in elementary school. https://t.co/LOlk20ipoU","@T_dot_Lee_PhD","nostalgia",
"Will power: seeing a woman with a floppy red hat, a red trench coat and sunglasses and not tweeting ""There in the World is Carmen Sandiego""","@byarijoseph","style",
"@JATetro yeah I think I'm dressing up as Carmen Sandiego for Halloween.","@JessicaTaaffe","style",
"http://t.co/nUpEkvfU0K Where in World is Carmen Sandiego doesn't just teach factoids but how to find info #uwdtl14","@LACNYCnell","edutainment",
"Gamification is not game based education (!Oregon Trail, !Carmen San Diego). #l21conf","@mr_rcollins","edutainment",
"Simply brilliant. Lessons learned: never post your boarding pass online! ""Where in the World Is Carmen Sandiego?"" https://t.co/hP5Jk6ybe2","@GMZ_Iker","pop culture",
"Sorry if the whole bus hates that Rockapella's Carmen San Diego theme plays every time I get a text, but I think it's delightfully ironic.","@TanookiSuitRiot","pop culture",
"@oliversharland that's why it's Carmen Sandiego's hat of choice","@RockJonny","style",
"#AlternativeFutures After Boots the monkey is murdered, Dora the explorer partners up with Swiper and one day becomes Carmen Sandiego.","@driftwoodbern","pop culture",
"The educational programs growing up were mad dope. Carmen San Diego, Zoobalee Zoo, puzzle place","@BederomO","nostalgia",
"@PushinUpRoses I will fight anyone who tries to tell me Carmen Sandiego was not top tier edutainment. Those games were my life. https://t.co/9ULaStw18d","@DMThisIsPam","edutainment",
"I'm sorry Stephanie, but Carmen Sandiego was the first thing I thought of when I saw the hat","@RexPColt","style",
"Loved this trip down memory lane: My 20-year quest to find Carmen Sandiego https://t.co/gni22Zr8KN via @HuffPostEnt","@jerrydoran","travel",
"@ZacharyLevi buckle up! You’re traveling a la Carmen San Diego! We hit $333k! http://t.co/RdZiqKJt9t #IWantMyHerdHQ","@lisamazeballs","travel",
"@iamrodneysmith What was that old TV show. Where in the world is @iamrodneysmith oh i mean Carmen San Diego... Have a great day Rod and thank you for being such a great American","@leshaneco","pop culture",
"He got the Carmen San Diego hat on https://t.co/dQNuNcix5x","@Lamar_NoOdom","style",
"I'm going to dress up as Carmen Sandiego to Thalias.","@JerkwithaFace","style",
"@profnojaegers I have hidden 13 ninja muffins somewhere in the world carmen sandiego style","@SillySilverWind","pop culture",
"The late Lynne Thigpen as The Chief on Where in the World Is Carmen Sandiego? shaped my early ideas of what a person in charge should look like. #InternationalWomensDay (Image from: https://t.co/r2Hr656uRd) https://t.co/hXKdCtPWPq","@jdbeety","feminism","x"
"Wherever in the world Carmen Sandiego is, she's no longer got a monopoly on the red hat and coat… http://t.co/U8ekuI9iRv","@ErishaAnn","fashion",
"Spent a lot of my childhood watching PBS, with shows like Mr. Rogers Neighborhood, Square One Television and Where In The World Is Carmen San Diego? Mr. Rogers taught us all important lessons as a child, and his legacy will live on forever. #MrRogers #PBS https://t.co/MBmsvEghDY","@James_R_Gullage","nostalgia",
"So this new character #FANG in @CapcomFighters #SFV kinda feels like Grim Fandango meets Carmen Sandiego in Crane Style?","@GamesNetworking","style",
"Congratulations to our Costume Contest winners: Riley the Beer Keg, Rebecca as Carmen San Diego,… https://t.co/Bg3DJubpv1","@murphysvb","style",
"In this reality, Carmen Sandiego and Rum Tum Tugger drive around in a van solving mysteries ...","@Cr0ss0verB0t","travel",
"I'm in Canada trying to watch California play Hawaii in Australia so I'm basically Carmen San Diego without the hat","@tteberry","style",
"@scattermoon *giggle* we tweeted about Carmen Sandiego last night- not knowing your cosplay choice- weird synchronicity ^_^","@Orphemeriel","style",
"Found Waldo and Carmen San Diego. My work here is done. #Halloween","@ajfeuerman","style",
"Wore my Carmen Sandiego trench coat today cuz #fashion https://t.co/z0zdBP7EaJ","@BjagzGaming","style","x"
"Oregon trail & where is Carmen san Diego were beneficial to our education!","@Sco____","edutainment","x"
"Does anyone have a big hat to make this outfit complete?!?! #whereintheworldis #carmensandiego… https://t.co/fg4sJk7lFV","@TheDaftknees","style",
"Where in the World Is Carmen Sandiego? Becoming a Secret Travel Agent https://t.co/a8IBrQtBeq","@taragana_server","travel",
"#CarmenSandiego has been one of the most overwhelmingly positive, progressive, and diverse edutainment franchises in history, and it almost single-handedly defined what an educational video game should look and feel like. https://t.co/EalPB0chpw","@Syfyfangrrls","edutainment",
"@MaraWilson I do keep expecting there will be a Carmen Sandiego-style tweet about where you are","@harrisj","travel",
"@mdachamp trench coats remind me of Casablanca and Carmen San Diego lol","@carriepearl_","style",
"Fashion News: Netflix is Bringing Back 'Carmen Sandiego' with Gina Rodriguez Playing the Lead https://t.co/rTvdV3THEs","@LondonOpulence","style",
"WE LEARNED ABOUT HER IN CARMEN SANDIEGO: CHASE THROUGH TIME. ONLY REAL FANS KNOW!! https://t.co/7a4usccq5p","@oolongpassion","edutainment",
"Someone please tell me not to bring my complete Carmen Sandiego cosplay with me to Vegas. I DON'T HAVE ROOM IN MY LUGGAGE. OR THE TIME TO DEDICATE TO A PHOTO SHOOT.","@CarmenSandiejo","style",
"I apparently am never going to learn to never check a bag. Consequently, I'm naming my bag Carmen SanDiego. #lostluggageclub #aa","@kimikimkim","travel",
"If Carmen Sandiego isn't a feminist icon then feminism is wrong. Full stop.","@EvanRyanA","feminism","x"
"I think Carmen Sandiego dressed up as Waldo might be easier to find than any consistency from the Cubs rotation at the moment. #Cubs #MLB","@jwswim1","pop culture",
"@ashes2ashes13 So need a Geography comp. Where in the World is Carmen Sandiego style","@trev_l","pop culture",
"Lady Gaga is rocking carmen sandiego chic tonight 😂♥️ #AMAs https://t.co/53IGZkZ0n7","@losingclayton","style",
"Already have my next Halloween costume planned out. Carmen Sandiego. My date&39;ll go as Where&39;s Wally. Always wanted to do that","@vaughanhsw446","waldo",
"If the Wide-Brimmed Hat Fits! Gina Rodriguez Will Play Carmen Sandiego in Live-Action Movie https://t.co/wTE03aRw0y https://t.co/dYB9OXTPUd","@HealthBeauty747","pop culture",
"Carmen Sandiego Cosplay by Tara Cash #Highlight #Cosplay #VideoGames Full Gallery: https://t.co/SNVMtyHKQs","@tmwth","style",
"Where in the World Is Carmen Sandiego? Becoming a Secret Travel Agent [vid https://t.co/3AQzZ2qSRl (https://t.co/E5pLaNtKmJ)","@newsyc150","travel",
"I went to buy a Venom costume. But then I found a Carmen Sandiego costume. I CAN'T DECIDE!","@Neverlandslost","style",
"The last theme night was Halloween, and somebody was dressed as Carmen Sandiego. So when they passed by me I went, “Where in the world are you?!” And the reply was, “Exactly! :D”","@tboogieee","style",
"I may have been late, it may have been my easiest costume to date, it may have been quiet and I was too busy this weekend to do both days, but I honestly had a great time at Games Expo Ireland yesterday. Carmen Sandiego has been a love of mine for a l… https://t.co/RTAUbC88Zz https://t.co/2IjTRgdhVT","@withoutastitch","style",
"I'm more of a Carmen Sandiego in a trench coat than a Corinne in a trench coat. 🥀 #TheBachelor","@megtopper10","style",
"Wonder if @HereIsGina knows how many Latinas are going to be Carmen Sandiego for Halloween now...","@angiejaime","latina",
"Super conspicuous hat choices #truedetective then again it works for Carmen sandiego","@invisiblecircus","style",
"Carmen Sandiego stole the hat #MasterCriminal Cc: @18moptop https://t.co/f1NTYWstL0","@ct460","style",
"Facebook Hides Your Exes, Carmen Sandiego Returns on Mobile… [Digest] https://t.co/hM0VjZATQP #Science #MakeUseOf","@PakCStuff","pop culture",
"We're following Carmen SanDiego around the airport. We think her next stop is Mn. Stay tuned for ""Where in the world Carmen SanDiego is""","@ms_rundmc","travel",
"Already have my next Halloween costume planned out. Carmen Sandiego. My date&39;ll go as Where&39;s Wally. Always wanted to do that","@angelatktd","cosplay",
"I had a dream we were going to Disney World but instead of doing a Disneybound Jamie straight up did a cosplay of Carmen Sandiego...","@mechromanced","style",
"If it were red I could wear it for a Carmen Sandiego costume. But it's blue-green!","@pantalonesfuego","style",
"I just LOVE Halloween here at my two costumes this year #CarmenSandiego #SrirachaMuchacha https://t.co/O7Pa4UZK61","@PalomaStarr","style",
"Already have my next Halloween costume planned out. Carmen Sandiego. My date&39;ll go as Where&39;s Wally. Always wanted to do that","@besticmlbert","waldo",
"@Vic_Turban @cacowgirl8 @CherryLimeade_3 @fakelindz I usually see Waldo on Halloween.Do you know- where in the world is Carmen Sandiego?","@Betty_Begen","style",
"‘Carmen Sandiego’ Returns with First-Ever iOS App: Launch of new educational mobile game from Houghton Mifflin... https://t.co/23SFbZ4sHp","@vyssual","edutainment",
"Amazing #feminism and #socialjustice: Saturday Night Social: Gina Rodriguez Will Voice Carmen Sandiego in Netfl... https://t.co/5h52WjlzdJ","@Stefeminism","feminism","x"
"#MeetTheGamer Gaming since Dad brought home an IBM when I was 5 PS4/PC, RPG, MMO, Adventure Carmen San Diego, SimLife, The Longest Journey, Baldur's Gate 2, WoW, Dragon Age, @ESO Met my BFF gaming, and it helps with my alchohol/ED recovery Books, politics, cross stich, cats","@sosomanysarahs","pop culture",
"this years halloween fit: Carmen Sandiego 💃🏽","@_vichoria","style",
"MT @creativeedtech: Great idea @TeamCairney EdTech TakeOut podcast. Carmen Sandiego for a Green Screen lesson https://t.co/8YoxsAUbd5","@DoInkTweets","pop culture",
"Can I just dress up like Carmen Sandiego whenever I'm traveling abroad and let you guys guess where I am?","@nisbobis","travel","x"
"I think I loved watching Carmen Sandiego so much because all she did was travel around the world and have ... https://t.co/ZDWaUc1TdF","@barbierants","travel",
"@affiliatesummit alrighty, Carmen Sandiego is more my style. That was my 80's go to PC game, love it.","@ConvoCounts","pop culture",
"On the road all day..looking forward 2 seeing new cities! I'm going 2 make like #CarmenSandiego #roadtrip #Adventure http://t.co/aTaTeaKad5","@NineMusesProd","travel","x"
"Every time is see #AgentCarter cosplay I think it's Carmen San Diego","@MargieC","style",
"@queerapika like my hair was wavy without frizz and I had this big carmen sandiego hat and a deep, throaty laugh","@queerapika","style",
"@LeavittAlone your tweet made me confused about whether or not i hated this until i realized i just like carmen sandiego","@zchevat","pop culture",
"@tomandlorenzo @RalphLauren Where in the World is Carmen San Diego fashion!","@jon92027","style",
"@TH3R3VLCLXVDS no cable? boy get that carmen sandiego out of here i hated not having cable them cartoons was wack once we got cable shit was lit 😂😂","@avatareric","pop culture",
"Harden travels more than Carmen Sandiego but mentioning it means you ""hate fun"" apparently https://t.co/9MxyWp3yyY","@Jawnikowski","travel",
"@unxpectedsparks @jackbanh I don't trust those weirdos from the ""Carmen Sandiego's coat was yellow"" universe.","@dspins","style",
"Camila Albuquerque is Brazil's answer to Carmen Sandiego.","@mookiealexander","pop culture",
"Gina Rodriguez donning red fedora and trench coat of Carmen Sandiego https://t.co/adwQRvuksz https://t.co/6CTcmDH186","@nimitdshah","pop culture",
"Today I think I saw Carmen SanDiego boarding a bus in northern Virginia. She works in finance, y'all","@thecountesscoco","travel",
"Already have my next Halloween costume planned out. Carmen Sandiego. My date&39;ll go as Where&39;s Wally. Always wanted to do that","@monikaacm953","cosplay",
"#AccordingToUrbanLegend, Waldo and Carmen Sandiego are secretly having an affair somewhere in the world and it's up to Dora the Explorer to find them.","@TuttlePatriarch","pop culture",
"I found Carmen San Diego in Santa Monica. She updated her coat color but didn't foul me.… https://t.co/MvqnP43uJv","@DominicDDaniel","style",
"Did I grow up with the wrong Carmen Sandiego? Cuz I recall her having dark hair and being Latina af. https://t.co/SjhJnyrTgp","@LFTDBeezy","latina",
"LIVE on #Periscope: Halloween in NYC Where's Waldo & Carmen Sandiego FOUND @fulltimeexplore https://t.co/8Cj5Mc4aOQ","@lisipowers","style",
"Already have my next Halloween costume planned out. Carmen Sandiego. My date&39;ll go as Where&39;s Wally. Always wanted to do that","@fletcherfm1359","cosplay",
"Lightning struck my brain with another great idea for an @telltalegames episodic adventure game: Where in the World is Carmen Sandiego?","@asvaitso","pop culture",
"#HappyHalloween from #Prince, #CarmenSandiego, the #Bluths and everyone else at Clarity Partners! https://t.co/owABNXxfBn","@ClarityPartners","style",
"#carmensandiego #pokemongo + #purge ...it must be Halloween!… https://t.co/xevKMAlKRw","@itsbabyt","style",
"That @awesomecon entertainment. #GeekpinEnt #WheresWaldo #CarmenSanDiego #AwesomeCon #Cosplay… https://t.co/wDxd3Lrug6","@GeekpinEnt","style",
"The rise and fall of the company behind ‘Reader Rabbit’ and all your favorite educational games https://t.co/sm1jIczX7W via @outline","@CSandusky_TCC","edutainment",
"Where in the world is #carmensandiego? Try Looking at #GothamCity jail. #dallasfandays #dallasfanexo #cosplay fanexpodallas #fanexpodallas #fanexpo Carmen is @tranimation and GCPD is… https://t.co/tzLDoK6KlA","@misspmjcosplay","style",
"Even more wait... Is Carmen Sandiego really Dora the Explorer, all grown up? #QTNA","@AmperoDJ","pop culture",
"I’d like to find a dope costume party to go to this season ... I wanna be Carmen San Diego","@ItsMsCoCo","style",
"Gina Rodriguez donning red fedora and trench coat of Carmen Sandiego https://t.co/t6BC69rzhJ","@ALErtMarketer","pop culture",
"@bombsfall This Aubergine Ninja Carmen Sandiego needs to be in my Hallowe'en costume/trip to pharmacy arsenal.","@gingerhat","fashion",
"@mseric Well of course, and being Carmen Sandiego means an awesome hat too","@ANGRYref","style",
"My German lessons taught me ""we have him!"" &""they see us!"" so I'm pretty sure they were written by the people who trained Carmen Sandiego.","@trishaleighKC","edutainment",
"Carmen Sandiego she dope they brung magic school bus back out shit so the kids shoulda a new her like Candace San... https://t.co/GwGyOiwVpI","@Leericole","pop culture",
"@RBTVpod Basically any PBS show from the 90’s: square one, Carmen San Diego, bill nye the science guy, wishbone, Arthur, ghostwriter, lamb chop?","@brainofe","nostalgia",
"holiday party this year is spies/espionage-themed, so I'm pretty sure I need to get my Carmen Sandiego costume together","@techn0madic","style",
"@KristinZiemke YES! We just have to plan the city-- it's like playing #carmensandiego these days. I'm in U.S. soon for great #edtech talks!","@MindWise_CK","pop culture",
"@splunge2000 we just need an outfit for you, I see a mix of Carmen San Diego and Deckard.","@GVAJr77","style",
"#HappyHalloween baes 🎃💕 who am I? Hint... Where in the world is .. Lyndsey SanDiego 😝 #carmensandiego… https://t.co/3rhZADSXIe","@LyndseyAriel","style",
"@JuanVato and a latin name. Yes! Not to b confused with the Carmen San Diego game","@cgpb","pop culture",
"Airport art says a lot about what that community values, what the culture is, the history, the way they see themselves or the way they want visitors to perceive them as. Where in the world is Carmen Sandiego today?#whereintheworld #voyager #traveler #community #art #localart… https://t.co/y43IW73jVT","@trendiwendii","travel",
"Gate Agent just called Carmen San Diego for passport verification in my flight. Half of the people waiting turned their heads to see her.","@cesarcenteno","travel","x"
"This is how I learned my geography #carmensandiego #videogames #retro https://t.co/sryeuKwExa","@RillaMulwane","edutainment",
"where's waldo and carmen sandiego is lit'rally the cutest couple costume omg","@mpdtarantula","style",
"I thought I found Carmen Sandiego once but it was just some other lady in a red hat and matching trenchcoat stealing the Eiffel Tower. So close.","@jonmcbrine","style",
"Good luck finding me in my Magic Eye Carmen Sandiego disguised as Waldo costume. #Halloween","@RhythmOrangutan","style",
"Everyone's wearing Carmen Sandiego hats these days. So many expeditions, so little sun protection.","@theseknees","style","x"
"I wanted to be Carmen Sandiego for Halloween but if I'ma be in the south its gonna be too hot for my red trench coat smh gotta rethink this","@Neo_Sole3000","style",
"@successwsagiven u dont get the hell outta here with that where in the world is Carmen San Diego hat!","@philly_feek","style",
"Where in the World is Carmen Sandiego ❤️ Where’s Waldo #halloween… https://t.co/olJ40ZQ3ei","@aleanamarieB","waldo",
"What You Learn Hunting Carmen Sandiego Without Google's Help https://t.co/oOUklGKJlc","@YMD_nigga","edutainment",
"I was Carmen Sandiego for Halloween once and I really hope a picture of that exists!! (Where in the world is it??? lol)","@ayyyychill","style","x"
"@TheAmberMonaco where in Carmen San Diego are you living your digital nomad life these days?!? I thought I saw you moved! #travelskills","@socialwithash","travel",
"What is the minimum number of countries you visit chasing Carmen Sandiego across the globe? https://t.co/iUuUnSRGcr https://t.co/eLPlx5y4Va","@RewardStock","travel",
"Random adventures with Carmen Sandiego aka @likklebitch_ @ Blockheads https://t.co/CoHPdK7pAp","@MSFATTY","travel",
"This made me chuckle, but now if there isn’t a Carmen Sandiego alt costume Ill be very sad. https://t.co/rtg10A2OMD","@crystalskyes80","style",
"les comparto VIDEO: 10 Reasons Where in the World Is Carmen Sandiego? Was the Best Educational TV Show Ever https://t.co/qf8EwxczfW","@adrianaamanuel","edutainment",
"@JCLately2011: Looking for Waldo? Carmen Sandiego? They're both at #PAXSouth #cosplay http://t.co/hgjSuqcBNA","@JCLately2011","style",
"My mom's name is Carmen so my classmates said that my mom was Carmen San Diego. I really should get her a red trench coat. She had a blue one for most of my life.","@SaiyanaBrief","style",
"In honor of #NCSS14 this week, primary source gem-NCSS article, teaching w/ Carmen Sandiego. Wow ed tech has changed! http://t.co/EyrNPIEtCT","@DiscoveryEd","edutainment",
"@TellyStern Carmen Sandiego refuses to apologize for traveling so much #AssociatedPressHeadlines","@ConspiracyMaker","travel",
"I'm gonna go ahead and say what everyone has been thinking all day long... @AmandaSalas is gonna make a great Carmen Sandiego for Halloween.","@TheNewAgeIcon","style",
"looking back, I learned a lot of good shit from Where In The World Is Carmen Sandiego. #ChildhoodMemories","@indiarjewell","edutainment","x"
"When do we get a Carmen Sandiego series where she's our anti-hero protagonist and every episode it's like THEY MIGHT GET HER THIS TIME!","@dyemooch","pop culture",
"Is Ava supposed to be hiding out with that Carmen Sandiego outfit?? #GH","@somuchwhatever","style",
"I give in. Here is the bulk of my #CarmenSandiego costume. https://t.co/bRlXGsaemK","@Fibby1123","style",
"If they made Carmen Sandiego in the style of @assassinscreed my heart would possibly implode. #gaymer","@BDTallyHO","pop culture",
"I wish I had all the parts of my Carmen Sandiego outfit already because today I'm going to be doing a whole load of travelling.","@scattermoon","travel",
"spotted together. #whereswaldo #carmensandiego #halloweencostume https://t.co/22ZOCnoRHb","@XdanielleX","style",
"@InariPopcorn Steal it, Carmen Sandiego style.","@MarketDemocracy","pop culture",
"Netflix is betting on ‘90s kids nostalgia for learning with upcoming lineup https://t.co/GUXYu3Ji7g https://t.co/RzZIvIuPlA","@klaash727","edutainment",
"3 trains, 1 bus, 1 rickshaw, 1 boat, 1 car (so far). I feel like Carmen Sandiego.","@RamirezCarolina","travel","x"
"@MuhammadLila I learned about him from Civ 4 and Where In Time is Carmen Sandiego","@dr_osprey","edutainment",
"Was #InternationalWomensDay intjust about Carmen San Diego?","@LainieLenertz","feminism",
"Pay for kids to follow clues left by #CarmenSandiego and learn about Geography, History, Math, and all that jazz along the way.","@thisislarimix","edutainment",
"@brokeymcpoverty Can we get a Carmen Sandiego/Dora the Explorer Avengers-style team up afteward? In the style of Gena Rowlands in Gloria or Taraji P in Proud Mary!","@Badlands75","pop culture",
"G+: never mind Carmen SanDiego, where in the #adjunct/iverse is the #precariousfaculty blog? …but the hat, red… https://t.co/6WR4ZDirIJ","@VanessaVaile","style",
"@ClintSmithIII @lpolgreen @nhannahjones @alexismadrigal I think you should do it with a time travel theme, maybe a bit Carmen Sandiego","@LogicalDash","travel",
"The Magic School Bus / Carmen Sandiego crossover we've all been waiting for? >_> https://t.co/dSGc1qy9Uy","@LordBahumat","pop culture",
"This emoji 💃 is actually a low key Carmen SanDiego without her hat","@lilsmokedog","style","x"
"@BigBird I just got some toy cars today. They look just like the RV & cars in my Carmen Sandiego games, one of the cars is yellow.","@JeremiahLiles1","pop culture",
"Spent the most epic day hunting all over LA for Diego (Not Carmen) SanDiego and his criminal gang. Thanks for the epic adventure @popkiller","@kylemaddock","travel",
"@DeMarko @demarko Carmen Sandiego is so going to be my next Halloween costume.","@Han","cosplay",
"ok help me on friday do i be a bunny for the 4th yr in a row for halloween or carmen sandiego","@doIlification","style",
"That's def not NY. I learned states by shapes in grade school... Thanks Carmen Sandiego! https://t.co/3uaMnjnChq","@ansky81","edutainment",
"First She-Ra, now Carmen Sandiego?! More strong women role models in media is something we can never have enough of! What are some other amazing, empowering animations from the past that could do with this treatment?","@lordneptune","feminism","x"
"Lady at the bar wearing a trench coat and fedora... Guys! Guys! I found Carmen Sandiego and she's going to steal something in Hawai'i...","@vonOberst","style",
"Let’s play a game: Where am I? #travel #carmensandiego https://t.co/8AmDyF0wmr","@NamasteBre","travel",
"Carmen Sandiego and Waldo...try to find us. 🌎👓#halloween 🎃🕸👻 https://t.co/ARNSWViqk4","@macATTACKholla","style",
"Bruh @Yoh31 just mentioned Carmen Sandiego! Carmen Sandiego! Next he'll be comparing the XXL Freshmen to the Magic School Bus.","@NostalgicPrsnt","travel",
"Gina Rodriguez Where in the World Is Carmen Sandiego Casting | via @POPSUGARLatina Latina https://t.co/GxAMnHY6zU","@RitaVee_","latina",
"@zepphere THANK YOU I wanted it to have that carmen sandiego CD cover feel","@pomeloprince","pop culture",
"Drake's Dad Does His Best Carmen Sandiego: Drake's dad must have a thing for adventure, mystery and international… https://t.co/Bz57SIjby8","@superstarleak","travel",
"@_efflorescence_ dude... I used to play this game called Where in the World is Carmen Sandiego. In the game you'd travel from city to city.","@WeAreExistence","travel",
"Already have my next Halloween costume planned out. Carmen Sandiego. My date&39;ll go as Where&39;s Wally. Always wanted to do that","@keshaparromero","cosplay",
"@subbes first my mind went to people who use red hat linux, then Carmen Sandiego and then finally to the people it actually refers to","@raruler","pop culture",
"Just another day getting weird looks at the bus stop because I’m humming the Carmen Sandiego theme song, thanks @simple_beep","@Sakurina","pop culture",
"If the Carmen Sandiego Theme Song was Metal…: Never before has geography been so brutal. The post If the Car... https://t.co/AjK4FsI0bp","@samulitmakela","pop culture",
"As a kid I played “where’s Waldo.” As a middle schooler I played “Where in the world is a Carmen San Diego.” Now as an adult I like trying to guess where @LesleyMurph will take “the road Les travelled” next. #travelblogger #shesmyhero #goplaces #seetheworld","@mykindnova","travel","x"
"@MKtheWorst I hope you twirled your Carmen Sandiego hat as a reciprocating gesture","@bcbwilla","style",
