"text","handle","category","star_tweet"
"I love old educational television. Similarly, a reminder that I would pay BIG MONEY for Super Solvers HD Collection https://t.co/FLlHKar7iC","@BardicKnowledge","edutainment",
"@LaceRossi I have the Where in the World is Carmen Sandiego Clue Book & The World Almanac to help me find Carmen across the globe.","@JeremiahLiles1","travel",
"Anyone know how I can get this absolute gem of a game running on modern hardware? It'd be so much easier if all the old Learning Company (I guess it's @HMHCo now) and Broderbund games were on steam. The super solvers and carmen sandiego games were absolute treasures as a kid. https://t.co/c2wMRCuHUy","@Sprokacola","edutainment",
"i found carmen sandiego! she tried to trick me by losing the hat but I know it's her #metgala https://t.co/A85KqpKI50","@bookycakes","style",
"@ginamarie72310 If you had a red trench coat, I would think you were Carmen Sandiego","@skykestrel","style",
"@TMBmedia @Sleevetalkshow @DocThompsonShow @skiplacombe @KAL79 @stuntbrain That's a Carmen San Diego, or Linux Redhat #WhatILearnedToday","@partsguy22","pop culture",
"@greekemmy @LAMcL7 When it's criminal to tell the truth you get to be a cool anti-hero like Robin Hood or Carmen Sandiego. hehehe.","@ChateauRuby","inspiration",
"Little known fact. Where in the world is Carmen San Diego was based off of @CUBOSCO travels as a child. #JetSetter","@BIGTIMEbenedict","travel",
"i wish her red coat was long like carmen sandiego's.","@beckycarman","style",
"@FeverFlowers it's my dream to one day do a waldo+carmen sandiego couple cosplay tbh","@TheAsterik","style","x"
"@ami_angelwings I'm traveling with Carmen Sandiego","@maxx_chaos","travel",
"#WayBackInThe80s Everything I learned about geography, I learned chasing Carmen Sandiego across the United States, and then across the world.","@FebWriter","nostalgia","x"
"Can @LanaParrilla dress up as Carmen Sandiego for like 1 day? https://t.co/BxpUUdZGZs","@amberelf","style",
"Did we just not get the Carmen San Diego cartoon in Australia? I honestly only learned of its existence last year.","@ElPrezAU","pop culture",
"Carmen Sandiego is an undercover ACME agent tasked with bringing down VILE members and teaching kids geography. In this essay I will...","@firehawk32","pop culture",
"Feeling nostalgic #eci834? Give @TheCrashCourse educational games a watch! #carmensandiego was my favourite! #edtech https://t.co/atpRutZatL","@AndrewForeman21","nostalgia",
"@SimplyRagny While I support this idea whole-heartedly... Just be aware that if you wear that hat, you're GOING to get ""Carmen Sandiego"" comments. Not that that's a bad thing, but not what you're going for.","@AdmiralMemo","style",
"Jovetic would make for a fantastic remake of ""Where in the World is Carmen Sandiego?"". Also, he'd look quite fetching in the red hat.","@KDS_Football","style",
"#TBT to one of the very, very first cosplay photoshoots I did at #GeekGirlCon several years ago with the lovely @theautumnrogue as #CarmenSanDiego. She was lovely enough to do a quick last minute shoot with me during the con. I needed to dig this set out… https://t.co/PCDzhtxRUh https://t.co/ly0ysjk6zK","@Keyaroscuro","style",
"Hey @StarbucksCanada, is this supposed to be a Mountie hat? Those are brown. This looks like Carmen Sandiego's hat. https://t.co/uJPI4nTYcu","@jeffhunt00","style",
"@GetKrissed lol. How long are you planning to be Ms. Carmen Sandiego? And I'm thinking of doing Cuba. They have flights from Ft. Lauderdale","@dcmadness202","travel",
"The ladies can get away with the future hats because he stole his swag from Carmen San Diego","@Tha_Kota","style",
"Traveling more than my girl Carmen SanDiego #foreal #jetset #suitelife","@shay_bron","travel",
"I wanted to have a metal band, travel the world, get to make video games and play them all the time, and go on these Carmen Sandiego style long voyages. Basically be an international woman of mystery. ...did I make it happen? #TweetYourNonPrincessyLittleGirlDreams","@nyhcmaven84","feminism",
"@0x3w1ng Look, Carmen Sandiego, you do insist on wearing the hat all the time","@Talen_Lee","style",
"I wanted to have a metal band, travel the world, get to make video games and play them all the time, and go on these Carmen Sandiego style long voyages. Basically be an international woman of mystery. ...did I make it happen? #TweetYourNonPrincessyLittleGirlDreams","@nyhcmaven84","travel",
"Gina Rodriguez donning red fedora and trench coat of Carmen Sandiego https://t.co/Byvlg5CuGU https://t.co/BBlU8I6HDr","@aniksheth","pop culture",
"You guys. They are rebooting Magic School Bus AND Where In The World Is Carmen SanDiego?!? https://t.co/0iSyhXuSN3","@mrs_rieman","pop culture",
"I dreamt I cosplayed/crossdressed (Cross-Played?) as Carmen Sandiego for a Con, and I woke up just as I saw myself in the mirror and realized I was wearing the Hat wrong. Thinking back at it, I think I can pull it off with the right kind of Training...","@CJHuaman94","style",
"Popular 80s and 90s educational video game hit & kids' game show #CarmenSandiego will make its live-action debut starring @HereIsGina on @netflix https://t.co/TqFR9PgtPY","@geekradioshow","pop culture",
"@Glowpinkstah Wonder Woman, Carmen San Diego, Dory, a ninja turtle, Claire Fraser 😜","@nellasantos","pop culture",
"Throw back to 1990s and Where in the World is, Carmen Sandiego? #tbt @netflix #CarmenSandiego #sschat #geography #studentengagement #teach https://t.co/p5UMBmFGaY","@6gees","nostalgia",
"educational games I plan to discuss in my talk: Carmen Sandiego, Life and Death, Quandaries, and gonna ask for permission about another!","@demodulated","edutainment",
"@welcomemattv I learned that my favorite game show, Where in the World is Carmen Sandiego, was taped next to Sesame Street, you know Carmen?","@JeremiahLiles1","nostalgia",
"I always wanted to have one of those jackets the gumshoes wore on Carmen Sandiego.","@iAmMrKenny","style","x"
"Excited Bill Nye the Science Guy eps are on @netflix! Now to complete my life, please add Where in the World is Carmen Sandiego. 🌋💃🏻","@sarlinz","pop culture",
"@important_pod I'd also like to request (demand) a bracket episode of the best old school children's educational computer games. Everything from Treasure Mountain to Oregon Trail to the Jumpstart series to Carmen Sandiego to SimCity.","@JN_Floyd","edutainment",
"Best 90s computer games/ education games 1. Backyard sports 2. Pajama Sam 3. Math blasters 4. Reader Rabbit 5. Carmen Sandiego","@Chauber7","edutainment",
"@BlippiOfficial Reading Rainbow, Where in the world is Carmen San Diego, Bill Nye the Science Guy, Bobby's World, Muppet Babies, the Magic School Bus, Sesame Street","@PitayaDreams","nostalgia",
"@_MarieGrey I wonder, how come you have never done a cosplay of Carmen Sandiego. You would make a good Carmen","@ErnieCosplayApp","style",
"VIDEO: 10 Reasons Where in the World Is Carmen Sandiego? Was the Best Educational TV Show Ever https://t.co/JNola5XzLo","@peggyco26230462","edutainment",
"Rasheeda looking like where's Carmen Sandiego with this red hat","@_JustKynny","style",
"Kayla came in with a new outfit of black & maroon & wearing one of my maroon hats & I just pointed & said ""I found her! Carmen Sandiego!""","@Luv_Chan","style","x"
"#lovely #minimal #learning #kidsshows #pbs #tvshows #smartkids #whereintheworld #teachers #carmensandiego #backintheday","@RebeccaEverlene","edutainment",
"Where in the World Is Carmen Sandiego? Becoming a secret travel agent, by Karsten Nohl, Nemanja Nikodijevic #33c3 https://t.co/wzIVopsZse","@ivc","travel",
"@Rheadangs OMG YOU ALSO PLAYED THAT GAME? I KNEW THAT's A 90's Indian Girl Experience! I had such a crush on Carmen Sandiego seriously, which of course I thought was coz I liked her clothes 😂","@redqueensparta","style",
"Heading to 4 countries in #Africa this week to film, this is our estimate of one location #CarmenSanDiego style http://t.co/mMOfDUpCo9","@C9MLtd","style",
"Awww this is cute, but I go on vacations regularly and men in general are trash no matter where you go Carmen Sandiego.","@downtwnfoxybrwn","travel",
"On the lowest of keys, PBS had the most fire children's programming in the 90s. Arthur, Magic School Bus, Bill Nye The Science Guy, Kratt's Creatures, Where In The World Is Carmen San Diego.","@thatkneegro","nostalgia",
"Where in the World is Carmen Sandiego ❤️ Where’s Waldo #halloween… https://t.co/olJ40ZQ3ei","@aleanamarieB","icon",
"Booked my flight for Tokyo. Starting to think I might be Carmen San Diego...","@kelkesh","travel",
"@MissHurtad0KISD YES! I LOVE Carmen San Diego! Thank you for sharing that. Keyboarding is such an important skills to have! Thank you for sharing that with the @TCCA12's #tccachat #TCCA18 group! :)","@TCCA12","pop culture",
"Happy Halloween from Holly Golightly, The Little Mermaid, Carmen San Diego, a cowgirl, and a… https://t.co/78U4Ced6BI","@KalieShorrMusic","style",
"Is it weird to want a queer-er version of Ivy's outfit from Carmen Sandiego? #whereintheworld #carmensandiego #90skid","@EauxYesExclmtn","cultural icon",
"New post: Netflix Takes Aim At Hollywood With Gina Rodriguez’s ‘Carmen Sandiego’ https://t.co/9s3LlxA9If Netflix Takes Aim At Hollywood #celebrity #glamour #promis #fashion#","@Glamour_news1","pop culture",
"9 yr old me is shaken 2 the core how iconic💕 ⚡️ “Gina Rodriguez is bringing a Carmen Sandiego film to Netflix” https://t.co/OMFwErtwcK","@ItsFuckingArt","pop culture",
"Why yes, that is Carmen Sandiego. Hat tip 1983. #kidagain #waitsgoteasier https://t.co/ddbrEGiWC5","@blueskywit","style",
"""New Carmen Sandiego cartoon!"" Yes, very good, ty Netflix ""It's gonna explore her history and origin!"" No, gdi,this isn't necessary Netflix","@Mechaphil","pop culture",
"@frosty75 @eddielack Just read a tweet. Is isn’t in Detroit but will meet in philly. It’s like a game of “where in the world is Carmen Sandiego”. Mike smith style","@johnmichaeldaly","pop culture",
"Carmen Sandiego is amazing. She is an awesome woman of colour.","@Veeren_Jubbal","feminism","X"
"Whenever I wear a hat I feel like Carmen Sandiego, but with a worse travel agent cuz where in the world am I? Goddamn Queens. That's where.","@lizfuh","travel",
"Well. There's Carmen SanDiego. (Sonja in red cape/hat.) #RHONY","@AmyJamesrunsfar","style",
"Rockin that ""where-in-the-world-is-Carmen-San Diego"" look! Hahaha head wrap and red hat to cover the… https://t.co/KZPA62OoBp","@DianaVaden","style",
"today I read correspondence re: tracking down Greta Garbo to sign a release in 1969 and someone needs to make a Carmen-Sandiego-style biopic stat","@archivesofsara","pop culture",
"If you insist on wearing Carmen Sandiego's hat, of course you'll disappear. https://t.co/x4jpOJ4USr","@DGoddamnGlover","style",
"And if they got on those Carmen Sandiego hats, it's a wrap. The bigger the hat, the less crap they taking! https://t.co/e5anTxUZf6","@busyworksport","style",
"I think I may save this Carmen Sandiego outfit for the next time I take a trip. I want to go to an airport gate like this.","@DrCourtneyShah","travel",
"I desperately want to read a #novel whose protagonist is Carmen Sandiego. Dark and gritty, please and thank you. #Publishing #Author #Crime","@KathrynLAmonett","pop culture",
"spacetwinks: carmen sandiego was a brilliant woman and master thief who told both the entire world and the... http://t.co/DQHnckdW6I","@AzaharaHime","feminism",
"Wait...hold up. Netflix is releasing both a Carmen Sandiego live-action movie & an animated series?! THIS IS BRAND NEW INFORMATION!!! Excuse me while I find my passport & detective hat. I’ve got a pun-loving, Latina master thief to hunt down! https://t.co/QEBW9E3kvI","@TheMike_M","latina",
"Already have my next Halloween costume planned out. Carmen Sandiego. My date&39;ll go as Where&39;s Wally. Always wanted to do that","@knowlestbil","cosplay",
"@bobbylox @devolverdigital @rawfury @adultswimgames Some of the most beloved educational games of the 16bit era weren't even intended to be educational. ""Carmen Sandiego"", and ""Oregon Trail"" were just supposed to be general entertainment. I wish someone could say why that doesn't happen anymore.","@apLundell","edutainment",
"Gina Rodriguez Prepares Her Fedora For Netflix’s ‘Where In The World Is Carmen Sandiego… https://t.co/Aq1KluWCiy","@cgnetwork","pop culture",
"October 27th: it’s not a Queer Lady Halloween Party until there’s at least one Carmen San Diego, one Dana Scully, and one Francine Frensky 😉 #inktober https://t.co/6VpIQFA42h","@ghostbatcomix","lgbtq",
"#kakashi and #carmensandiego do #phxcc in style. #phoenixcomicon #phxcomicon2016 #cosplay https://t.co/TQJBf5t6Tn","@eliasaidwhat","style",
"Approximately once every 4 years I get excited about my Halloween costume and this year I'm being Carmen Sandiego and I'm amped","@MollyOtto","style",
"Carmen Sandiego Returns in a New Educational App https://t.co/TSQ6xhgSBx https://t.co/GD28fzH1Oi","@greta_myrick","edutainment",
"Lupita Nyong'o does Carmen Sandiego on the streets of NYC and yes, it's adorably chic: https://t.co/YOcQteoLzj","@tomandlorenzo","style","x"
"@missyemig @ItsLinzzz_ @Blackgawd Carmen Sandiego lifestyle","@DJ_Rub1out","travel",
"I'm in Spain. #CarmenSandiego https://t.co/lSa8MVLCBk","@The_Jessicak","travel",
"@LoriSchmidt Did you dress as Carmen Sandiego for Halloween? 😉","@cbusbj99","style",
"Who wore it better? Carmen Sandiego (Where in the world is...) or Miss Scarlet (Clue)? http://t.co/IaOx69ZmKw","@Count_Marzo","pop culture",
"Yes! This. @HereIsGina Gina Rodriguez Will Play The Iconic Carmen Sandiego In An Upcoming Netflix Live-Action Film https://t.co/dnjjSawoXv","@rajeev2OO5","pop culture",
"One day I want to be playing Carmen Sandiego on Redhat Linux.. maybe wearing a Fedora :)","@UrzasRage","style",
"Somehow, I always imagine people who answer names like Dorothy to wear floppy hats and Carmen Sandiego coats","@tobystic","style",
"@NJTRANSIT buses are harder to find than Carmen San Diego.","@dylan_mcvillain","pop culture",
"@touchablyalive Thanks Mom ❤️ haha. Tell her that she'll look fabulous in a Carmen Sandiego hat","@wonderburrito","style",
"Good piece->Not Your Shero: Carmen Sandiego and the importance of feminism in edutainment https://t.co/tRWV5uurYV","@TonyaWithAPen","feminism",
"@arabized @eman_cipation_ aren't you the one that turned into Carmen sandiego? Traveling from country to country...","@SyrianSmurf","travel","x"
"@_rallycap ""Where in the World are Tyson and Usain Bolt"" - a Carmen Sandiego style caper show...","@RyanKeim","pop culture",
"Retweeted Jarett Wieselman (@JarettSays): Gina Rodriguez will star in and produce a live-action Carmen Sandiego movie for Netflix!!! She also voices the iconic character in an upcoming animated series https://t.co/2PrJ9su9kc","@willwritesgood","pop culture",
"@tdw_au Where in the World is Carmen Sandiego?...one of those sneaky games where you have fun and learn stuff too :D https://t.co/1ZZo7hyb2b","@tdw_au","edutainment",
"This is perhaps my best costume in years. Sorry, past Bre who dressed as Wednesday Addams, Poison Ivy and Carmen Sandiego.","@bschossow","style",
"Already have my next Halloween costume planned out. Carmen Sandiego. My date&39;ll go as Where&39;s Wally. Always wanted to do that","@rubibopcalderon","cosplay",
"Carmen Sandiego Returns in a New Educational App https://t.co/IupqMdSOts https://t.co/g8rBETshjv","@DorisdbryantD","edutainment",
"@kchironis Oh man, Dollz and Neopets, that takes me back. Carmen Sandiego, Heroes of Might and Magic, Might and Magic, Final Fantasy, Kingdom Hearts... ping @tearannosaurus what else did we play?","@veespirit","pop culture",
"@salbright62 Might want to ask Carmen San Diego! She gets around. Hope hubby has a safe trip!","@kchuff13","travel",
"Already have my next Halloween costume planned out. Carmen Sandiego. My date&39;ll go as Where&39;s Wally. Always wanted to do that","@mignonrd1011","waldo",
"Carmen Sandiego, located! Teachers and librarians in this summer's #NEH-sponsored and Newberry-hosted seminar ""Reading Material Maps in the Digital Age"" are exploring the unique potentials of using physical maps and globes in the K-12 classroom. #teaching #education https://t.co/Glm33pCfss","@NewberryLibrary","edutainment",
"I still love ""Where In The World Is Carmen Sandiego"". I learned a lot about world geography from that game, plus it was fun to be an international detective, using clues to find those thieves! #retrogames #retrogaming","@IQ_Adventures","edutainment",
"Netflix is betting on ‘90s kids nostalgia for learning with upcoming lineup https://t.co/rmC0jLMQbb https://t.co/vrEraS6duW","@MoneyMatchGame","edutainment",
"I dig Diana's Carmen San Diego hat 8D #MeTVWonderWoman","@DigitalCAPS","style",
"carmen sandiego is that show bruh 😂 i’m learning to cherish qubo again 😭😩","@KingSkarrr__","pop culture",
"@RowdyCMoore MST3K, Daria, Perfect Strangers, Greatest American Hero, Night Court, Where In the World is Carmen Sandiego, WKRP in Cincinnati, Airwolf, Jayce and the Wheeled Warriors","@KennyT83","pop culture",
"Gina Rodriguez donning red fedora and trench coat of Carmen Sandiego https://t.co/bopOJOcNiF https://t.co/eJasxwAND2","@Fertigos","pop culture",
"Imma let you finish, but Carmen Sandiego is the greatest female video game character of… https://t.co/jFXvpxJPCB https://t.co/xPWXFmIXKx","@gamznewz","feminism",
"So far the sexy Carmen San Diego outfit has been my fave #VSFashionShow","@SamiMelaragno","style",
"VIDEO: 10 Reasons Where in the World Is Carmen Sandiego? Was the Best Educational TV Show Ever https://t.co/K2hqq5WKWT","@alanaleng66","edutainment",
"Gina Rodriguez donning red fedora and trench coat of Carmen Sandiego https://t.co/ZuxOvSF7JA https://t.co/Gs4utRykq6","@empire_infocom","pop culture",
"This Is America, Charlie Brown is awesome. Along with Liberty Kids and Carmen Sandiego. Educational programming FTW.","@PaulAlgu12","edutainment",
"@TheKalenAllen @TheEllenShow For some reason I’m getting Carmen Sandiego vibes from this outfit lol","@Rafesley","style",
"Childhood fashion icon. Carmen Sandiego. https://t.co/q98dNVGZmX","@arxxxxmand","fashion",
"Weeks after I go as Carmen San Diego for Halloween they recreate the game for iPhone and iPad. Am I a trendsetter?","@lifewithlauren1","style",
"Is it wrong that one of my childhood role models was Carmen Sandiego? I absolutely loved the games and wanted to be like her when I grew up.","@Rafaela_Freitas","inspiration","x"
"Next Halloween I'm going to be Carmen Sandiego. I'm not buying a red hat or trenchcoat, I just won't show up to your party.","@curreting","style",
"Do I dress as Wednesday Addams or Carmen Sandiego for Halloween? (I have the pieces for both, I’m just indecisive)","@RedHeaded","style",
"@TokyoCourtesan @AvaZaneXO Thank you!!! 😍😍😍 Carmen San Diego was my cartoon crush when I was a kid 🌏🌎🌍","@MeetJosieQu","pop culture",
"Plan to make travel a higher priority into the latter portion of this year & beyond. Carmen Sandiego is my spirit animal. 🙏🏾","@ElysianHue","travel","x"
"Anyone seen Waldo? He's been missing since 1987. 100s of sightings, 0 confirmed. Last seen roaming the world w/ Carmen Sandiego. #Joking","@tmaamtt","pop culture",
"@thelaceyclaire Where in the World is Carmen San Diego 🎶 your just missing a red trench coat aka FLAWLESS!","@Jess_Nics27","style",
"@nomadj1s Best Halloween costume my husband and I ever did was Carmen Sandiego & Where’s Waldo. UNTRACEABLE.","@hannahkardon","style",
"@MichaelVarrati I will never complain about more Carmen Sandiego in my life. Thank you!","@RVAgeek","pop culture",
"""Where In The World Is Carmen Sandiego?"" That was a good educational game","@i_Archive","edutainment",
"I liked the Red Hat Society better when I thought it was a Carmen Sandiego death cult.","@undeadmolly","style",
"@TehZerp Next you're going to be hating on Where in the World is Carmen Sandiego. I dont even know you anymore. DO IT ROCKAPELLA","@thedopp","pop culture",
"How Carmen Sandiego accidentally became an educational game icon https://t.co/dvYdcrzZBz https://t.co/bHV92ys6dq","@jackmonkeygames","inspiration",
"Umbrella-less, TTC debacle, zero car2gos, infinite Uber wait times. Still made it to work, albeit looking like soggy Carmen Sandiego. #dlws","@rinabang","pop culture",
"Carmen Sandiego: The Secret of the Stolen Drums (GCN) 7/52. Lightweight action-edutainment for kids #52gamechallenge http://t.co/T4JnzrwQgS","@tvgamefan","edutainment",
"this mornings #halloween shenanigans with my coworkers! #wonderwoman #carmensandiego & #batgirl… https://t.co/qavZYmaW9a","@DaQuool","cosplay",
"@bkabak @pmulls Gotta do it Carmen Sandiego style... LETS GO... TO THE MAP!","@nyillini311","pop culture",
"STOP it! Hold the phone! Carmen Sandiego is coming back?!?! EEK! Star @HereIsGina will be in it! #edutainment https://t.co/fOggoiFYI5","@TheTeachersWife","edutainment",
"Where in the world is Harry Styles? *where in the world is Carmen San Diego tune*","@juiiceydre","pop culture",
"@scottsROW @CXHairs Like Carmen Sandiego, look for the enormous hat.","@SC_Cycling","style",
"@AsiaRChapman 10 out of 12. Missed the Archer ? and to me, a red hat will forever = Carmen Sandiego. XD","@FugaPericulum","style",
"#throwbackthursday to a day in the Tuscan sun. Getting that #wanderlust vibe. Where to next!? #carmensandiego #travelblogger #travel #bringiton #beachbodycoach #writerslife… https://t.co/0vRNRP41kY","@SillypantsB","travel",
"Found out the woman sporting a red hat is dressed up as #CarmenSanDiego. #GNO2015","@lootsfoz","style",
"She might be wearing black, not red, but I still found her! #carmen #carmensandiego #tokyo #omotesando http://t.co/6BTi4xVPG6","@EricJadi","style",
"Where in the world is Carmen Sandiego? #Winter #travel #WhereInTheWorld http://t.co/JTa5nTKjYW","@kimray02","travel",
"@formerlylux I've been trying to get my wife to get a Carmen San Diego hat, I think they look so classy!","@caseygreer2","style","x"
"@TheOnion It’d be pretty much him doing all Carmen Sandiego cosplay.","@madmantx","style",
"?baby, you summertime fine…? Ahhhh warm weather, how I miss thee! #2moreweeks #traveler #wanderer #carmensandiego… http://t.co/pmTMyhixQu","@models24seven","travel",
"""Gina Rodriguez will be donning the red fedora and trench coat of Carmen Sandiego for Netflix"" https://t.co/7xL5JgUPRu","@guzmanadrian","pop culture",
"""Where in North Dakota Is Carmen Sandiego? is a 1989 edutainment video game""","@LucasHayas","edutainment",
"@LaceyEvansWWE Wear red and you're Carmen San Diego","@Popetherev28","style",
"If this is the art style used in the new Carmen Sandiego Netflix series then count me in! 👍 https://t.co/ChXu64CqW0","@DannyLaShep","pop culture","x"
"@IntenseDesire 😂😭 “@IntenseDesire: In the latest Carmen San Diego fashions http://t.co/ouxlfFyMtn”","@Lei_Bay_Bay","style",
"Ready for #planetcomicon day 3! #pcckc #planetcomicon #day3 #whereswaldo #carmensandiego #cosplay https://t.co/beX9AeRgTm","@AmberCapp","style",
"#news #fashion Carmen Sandiego Is Officially Happening With Gina Rodriguez at Netflix: Get excited, gumshoes! Just days… #movie #glamour https://t.co/Lbfa5ANWj4","@FlaShBloGWorld","pop culture",
"@st0rmhusky Im not sure whether me or @Dashtiger84 is the Carmen Sandiego. We keep chasing each other across the globe.","@Mangusu","travel",
"@MissMollie_x the one in the top right, is that Carmen Sandiego's hat?","@Joshique_Noir","style",
"okay we are officially going as carmen sandiego and where's waldo for the halloween party we're going to friday","@lacksauthority","style",
"Who is that with the Carmen sandiego hat? https://t.co/m10wtUr7b3","@SlimJawn215","style",
"VIDEO: 10 Reasons Where in the World Is Carmen Sandiego? Was the Best Educational Show Ever https://t.co/eCIRl3Q7VP","@NewsViralFeed","edutainment",
"Ooooh, Cookie, I like that Carmen San Diego fedora. #Empire","@CocoaAfrodisiac","style",
"Remember the game ""Where in the World is Carmen Sandiego?"" This hat takes me straight back to elementary school.🤓 #ThrowbackThursday https://t.co/HU7i2ScSzn","@RachelRouhana","fashion",
"Where in the World Is Carmen Sandiego? Becoming a Secret Travel Agent #seohero https://t.co/kUv398K5gF","@seoherobot","travel",
"Where in the world is Carmen Sandiego? Love this Lise Meitner fedora from @rillacreative based in San… https://t.co/wKfTmwWvV5","@ofthemomentshop","style",
"90s ed. game power rankings: 1. Oregon Trail 2. Carmen Sandiego 3. World Discovery Deluxe 4. Mavis Beacon Teaches Typing 5. Amazon Trail","@onejoey","edutainment",
"Car 54 where in the world is Carmen Sandiego? #VideoGameSitcoms","@KoolKoopz","pop culture",
"I miss how @tarah and @deviantollam are just so easy to talk to. (I still remember my first impression of @tarah at the Shoot: ""Smart and stylish, like Carmen Sandiego, but..real and nice."")","@Vintage_Sister","style",
"#MegaDriveMonday These rather weird, but wonderful adventure games involving Carmen Sandiego! #megadrive #retrogaming #sega #segagenesis #megadrivemonday https://t.co/rSzoroOgl7","@RetroSegaWorld","pop culture",
"VIDEO: 10 Reasons Where in the World Is Carmen Sandiego? Was the Best Educational TV Show … https://t.co/xOjysqt8el https://t.co/O7OBUxT6Ev","@allisyaputrim","edutainment",
"Carmen Sandiego wants her hat back.","@iMDRW","style",
"#Where in the World Is Carmen Sandiego? Becoming a Secret Travel Agent #Hacker #News #Headline https://t.co/vEU2MK5YYA","@CurtisUrijah","travel",
"@morganmpage You can't just time travel and kidnap all the historical figures like some kind of... transgender Carmen Sandiego!","@HyenaSpotz","pop culture",
"@liveshiv my girl where are you? Like holy you be globe trotting like you Carmen San Diego","@STDYMBBN","travel",
"Do people cosplay as Carmen Sandiego?","@TKN951","style",
