"text","handle","category","star_tweet"
"Khloe looks like a super hot Carmen Sandiego. Who likes to vacation sometimes. https://t.co/74xpFiyBFt","@jenniferbunni","fashion",
"Perfect idea. I need a girl to dress up as Carmen Sandiego for Halloween and be my date because I'm going as Waldo.","@BackRowLearner","fashion",
"Ok so apparently Gina Rodriguez is gonna be the voice of an animated CARMEN SANDIEGO show and it is EVERYTHING!","@KarenBabaren","cultural-icon",
"In addition to voicing the titular thief in a new cartoon, Gina Rodriguez will be STARRING IN A FREAKING LIVE-ACTION CARMEN SANDIEGO MOVIE! All I can say is YES PLEASE GIVE IT TO ME NOW. As a lifelong Carmen Sandiego fan & a @HereIsGina fan, I'm psyched! https://t.co/wPBeVCmH2d","@AdamTheAlien","cultural-icon",
"Looks like Carmen Sandiego stole the statue of David. #doitrockapella #HappyHalloween http://t.co/vQOa6hVIXL","@phira","fashion",
"Netflix is betting on ‘90s kids nostalgia for learning with upcoming lineup https://t.co/W54XIpRLgI","@DNSRainbowNews","cultural-icon",
"Catherine Zeta-Jones looks like Carmen Sandiego in this movie #red2","@iv_an","cultural-icon",
"What do you get when you have The Doctor, Waldo, and Carmen Sandiego in one location? An epic adventure! Follow our journey and see if you can figure out where we’re stopping, you might… https://t.co/JXIKGmIbo1","@bossierlibrary","cultural-icon",
"@_AlexLawrence It would be FANTASTIC to have a ""where in the world is Carmen SanDiego"" type Go app that teaches kids about locations, etc.","@drgurner","edutainment",
"Get a first look at Netflix's Carmen Sandiego animated series https://t.co/1dz5FudGnj","@AmandaW29474500","cultural-icon",
"#fbf I still find joy playing the first edition of Where in the world is Carmen Sandiego 😂💕Fly to Peking ✈️ https://t.co/EPX03VfCS5","@EastLATraveler","cultural-icon",
"Gina Rodriguez to star in Netflix’s live-action ‘Carmen Sandiego’ movie: https://t.co/pmAQFZWzHL via @AOL","@AdamMaina_","cultural-icon",
"Check out ""Not Your She-Ro: @carmensandiego and the Importance of Feminism in Entertainment"" @syfy! We're so excited to be working on a TV show AND book series that promotes a strong, complicated female character (and stars @HereIsGina!) https://t.co/JndRo3e9O9 https://t.co/hcYbrw6tUr","@HMHKids","feminism",
"Netflix's Carmen Sandiego Reboot Gets January Premiere Date — First Look https://t.co/cIoRp7oUot https://t.co/QjS1edKNmB","@Rapida_movies","cultural-icon",
"Tonight's highlight: There was a couple doing sexy Waldo (from Where's Waldo) and Carmen Sandiego costume pair. They entered the costume contest but no one could find them when the contest started. Later that night I saw them in the fish tank and yelled ""I FOUND THEM!!""","@Genderplasmic","fashion",
".@mbilodeau to me, wearing a fedora: ""You look like Carmen Sandiego."" Mission accomplished! 😝😝","@CLoureiroTO","fashion",
"@buzzerblog They should see about getting Carmen Sandiego from PBS. Educational Game Show programming!","@TheZorker","edutainment",
"Where in the world is Carmen Sandiego?","@Branndilynnn","cultural-icon",
"@IDDocHymes ""Where in the world is Carmen Sandiego? Doo be doon whoop!"" I can hear the game show song in my head!","@osnsmom","cultural-icon",
"Everybody dresses as Waldo for Halloween but nobody has the gall to pull off Carmen Sandiego","@xMOONS","fashion",
"everyone saying Carmen Sandiego (@MrAaronAbrams included) but I'm getting a Rule-63 Riddler cosplay vibe? #Hannibal http://t.co/lUF74uAAcf","@oliveiranth","fashion",
"This #OrigamiOwl chica is on the move!!! To the tune of #CarmenSandiego - where in the world is our favorite... http://t.co/qW77fr89oK","@MyLifeIsAHootDD","cultural-icon",
"Gina Rodriguez will be donning the red fedora and trench coat of Carmen Sandiego for Netflix https://t.co/baHDz6uwPk https://t.co/8GP0lHFQ5p","@moomblr","cultural-icon",
"‘Carmen Sandiego’ is coming to Netflix Along With Gina Rodriguez https://t.co/v5SkYLhftf","@sobobrova44896","cultural-icon",
"My favorite Halloween costume was: 3rd grade- Carmen Sandiego I didn’t look anything like carmen, but I still loved it. #geographynerd","@strongbasil","cultural-icon",
"@evankirstel @BoingBoing I grew up on games + Cross Country USA, Oregon Trail, Chivalry, Carmen Sandiego.. they were educational tools","@mbreingold","edutainment",
"Sounds Like Netflix Is Bringing Back 'Carmen Sandiego' https://t.co/EfbixR6K5k","@LilBit019","cultural-icon",
"Netflix is betting on ‘90s kids nostalgia for learning with upcoming lineup https://t.co/fM2i24d3rR https://t.co/f17HlfJYwu","@Megamanxc","edutainment",
"Where in the world is Carmen Sandiego @Jawanhawk?? 🤷🏽‍♂️🤷🏽‍♂️","@mtyrone","cultural-icon",
"Carmen Sandiego wannabe is back. #arrived #nothomeforawhile #🤷 #actress #castings #ihadtodance #uponarrival #nokidding #icantdance #forshit #btw https://t.co/NkCTwuiTfu","@CooperNatalia","cultural-icon",
"Netflix finds 'Carmen Sandiego' for its latest reboot https://t.co/jybyMh3uCP #Gadget https://t.co/CclJEgwM2b https://t.co/G0PN1QuVsI","@techmagseven","cultural-icon",
"@jeremynewberger @GOP @kayleighmcenany oh my god I am going to be Carmen Sandiego for Halloween - thanks for the idea!!","@tigerquinn7","fashion",
"If the NSA knew what it was doing, it'd tell us where Carmen SanDiego is.","@RibsinBacon","cultural-icon",
"@nuffsaidNY ri have a red coat...that's my go-to costume...I can be Carmen Sandiego or a sexy vampire. LOL my red coat is magic.","@femalemsktr","fashion",
"#AgentCarter certainly stands out in a crowd. Though her fashion is leaning a bit too ""Carmen Sandiego"" for my tastes","@k8monstrsCloset","fashion",
"@straphangeryyc Next thing, someone's gonna just take our building off its foundations and carry it off Carmen Sandiego style.","@straphangeryyc","cultural-icon",
"Should Nick & I be Waldo & Carmen Sandiego for Halloween?","@_madzo","cultural-icon",
"@xoamelia I am SO SAD that I suck at Photoshop, because I really want to make a manip of the Gos with a Carmen Sandiego hat on.","@xosarahdevon","cultural-icon",
"Where in the world is Carmen Sandiego? She's at FrightWorks in Knoxville. #happyhalloween http://t.co/E0yqbpMqoE","@nomadbykate","fashion",
"Halloween found #CarmenSanDiego lol https://t.co/lpWZvNQjM9","@tracy548","fashion",
"Gina Rodriguez Voicing #CarmenSandiego in Netflix Animated Series https://t.co/NAdhmSn5EO https://t.co/Q4vjVQbOd0","@FreddieMKR","cultural-icon",
"SUHweet!!! MT @ellencarmichael: You are now able to download The Oregon Trail game, and soon, Carmen San Diego, too! http://t.co/eoHXZx7R0R","@kcresto","cultural-icon",
"Carmen Sandiego' Netflix reboot with Gina Rodriguez and Finn Wolfhard gets poster and release date https://t.co/hqFr7ogr4e","@pcoppodcast","cultural-icon",
"@DHThompson38 @HockeyNightPod NBC hates the NHL, I’ll see what I can do. Where in the world are you now, Carmen Sandiego?","@Sober_Stevens","cultural-icon",
"An old woman on this bus in a Carmen Sandiego hat and coat just winked at me. #thisishowitstarts","@d_ruddenwrites","fashion",
"Netflix is bringing back Carmen Sandiego, and its going to star Gina Rodriguez - How People https://t.co/wxwTa3KBbF https://t.co/6FxjmBiBJO","@bitcoinagile","cultural-icon",
"Do you remember the tv show: Where in the world is Carmen Sandiego? 《tune》 High pressure geography quiz! #fb","@arshe2020","cultural-icon",
"New post: Netflix plans live-action ‘Carmen Sandiego’ film with Gina Rodriguez https://t.co/kwHVwlzwlD","@smellhound","cultural-icon",
"Gina Rodriguez Will Play The Iconic #Carmen #Sandiego In An Upcoming Netflix #LiveAction Film https://t.co/zTowXhHlZL https://t.co/1jbX3NSPzf","@entertainanglr","cultural-icon",
"@_lola_bee What in Carmen San Diego do you max out on in good old El Paso? Wait don't answer that.","@thetickster73","cultural-icon",
"Netflix plans live-action 'Carmen Sandiego' film with Gina Rodriguez https://t.co/fWZRxFnqZi","@DNSRainbowNews","cultural-icon",
"I JUST REALIZED THAT CARMEN SANDIEGO IS IN THE BACKGROUND OF THE ALOLAN DUGTRIO COSPLAY???????","@silencedrowns","fashion",
"Current mood: looking for a sweet deal on fake mustaches and Carmen Sandiego hats, because this is the time of day when The Complainer always comes looking for me.","@batoutofmel","fashion",
"VIDEO: 10 Reasons Where in the World Is Carmen Sandiego? Was the Best Educational TV Show Ever https://t.co/Fn4RSAAHJD","@LeldeSaulgozis","edutainment",
"Travel the world like a crook duckin Carmen sandiego","@BasedYoungJesus","travel",
"Where in the world is #CarmenSandiego ? More like where in the world is Emilia Urquiza @Ingobernable @netflix","@MrHorrorPsychDT","cultural-icon",
"#GameStruck4 #MyChildhood in the 90s.. Except I first played Zelda in mid-2000s on GameCube. Lol #CarmenSandiego #007Goldeneye #smashbros #Ocarinaoftime #GamesStruck4 https://t.co/7I0Q9BNC0T","@heyaHermione","cultural-icon",
"what is it about my face that tells men in those carmen san diego hats i'm interested?","@alex3nglish","fashion",
"An Agent, a random Ski Bum, The Gentleman Ghost, and Carmen Sandiego... One rainy, chilly Halloween… https://t.co/zx1OLwWj6a","@Kusalaknits","fashion",
"@ek_johnston Do you think: a) Carmen Sandiego and Where's Waldo could ever be soul mates? b) that'd be sad cause they'd travel the world and never find one another c) MAYBE THEY ARE TIME LORDS and forever alone","@patient9five7","cultural-icon",
"Gina Rodriguez Voicing Carmen Sandiego in Netflix Show - Where in the world is Carmen Sandiego? Apparently, the... https://t.co/wIW012DW7Y","@BrainstormIdea","cultural-icon",
"Justin's hat reminds me of Carmen Sandiego #BBOTT","@palmys05","fashion",
"@BigBird now there's a way to help more kids find Carmen Sandiego, you can help provide education for all girls :)","@JeremiahLiles1","feminism",
"Netflix’s Carmen Sandiego Movie Sets ‘Game Night’ Scribe Mark Perez As Writer https://t.co/mS4rwxptFh via @deadline","@TheLastReel","cultural-icon",
"⚡ Netflix greenlights a Carmen Sandiego series https://t.co/IAZwSJxMKa","@PeteVikes22","cultural-icon",
"Well.. it will be better than that. THANK YOU @netflix THANK YOU!!! #carmensandiego https://t.co/PvyafoXIaf","@chiquitapr_25","cultural-icon",
"#halloween2016 Vs. #halloween2017 Carmen San Diego Vs. Lara Croft. I definitely needed last years costume this year bc it was cold af. 😂 https://t.co/FOyB7cOGxf","@MsAuviErlene","fashion",
"Daily Podcast: Captain Marvel, Stranger Things 3, Solo, Star Wars, Carmen Sandiego, Netflix, and Pacific Rim Uprising https://t.co/DHgMidp4UV https://t.co/AYRMW3OO65","@Filmedia","cultural-icon",
"Carmen San Diego lookin ahh","@iamjdxbb","cultural-icon",
"@Sketch_Dailies #CARMENSANDIEGO She's been under her hat the entire time! http://t.co/XXS5EJ7c5u","@tarakeet","cultural-icon",
"@tabletop They were PC games, but the Carmen Sandiego series was the only way I learned anything about geography or history as a child","@tPfWC","edutainment",
"@MikeSullivan Indy? He's scouring the globe like kids looked for Carmen Sandiego, searching for a clue on how to beat OSU 🕵#GOBUCKS","@Noah_traveling","travel",
"Where In The World Is Carmen Sandiego ?","@Steffy4hunnid","cultural-icon",
"Jumpstart, clue finders, carmen sandiego. I had all the learning games as a kid.","@LisKis93","edutainment",
"Netflix Could Be Bringing Carmen Sandiego Back https://t.co/zKOWAUmzFz","@MR_PUNJABI","cultural-icon",
"I AM READY⚡️ “Netflix greenlights a Carmen Sandiego series” https://t.co/14mtmTB1G4","@HannahDahneke","cultural-icon",
"Nice hat, Bedelia! She looks like a reverse-color-wheel Carmen SanDiego! #hannibalpremiere","@Rhoda_Night","fashion",
"When you want to be Carmen Sandiego for Halloween but no one knows who that is 🙃","@mula__mulan","fashion",
"#Gossip #Celebrity Beyoncé is the Carmen Sandiego of Pop http://t.co/w130IGmmi3 #Beyonce","@6Beyonce","cultural-icon",
"""This is sorta a busted trip, we never found Carmen SanDiego""","@gabby_sartori13","cultural-icon",
"Doing a Carmen Sandiego costume group would be fun at some point, but I'd need people who could sing to dress as Rockapella. @AetaCapella?","@kjatar","fashion",
"No one noticed Carmen Sandiego and The Man with the Yellow Hat hiding on top of The Oscar Mayer Wienermobile. The perfect getaway.","@RainbowJohnJ","cultural-icon",
"Rainy days mean I get to wear my trench coat and call myself Nancy Drew for the day. If it was red, I would be Carmen San Diego.","@BGWCplanner","fashion",
"You know what I miss? Where In The World Is Carmen Sandiego. (Even though my sense of geography and history are still rather appalling lmao)","@maiji","cultural-icon",
"@lululemon, long tunic, boots, coat that is too big to fit in my carryon, and probably the hat that I'll only wear once but feel compelled to bring since it's a good time to pretend I'm Carmen San Diego.","@deakhaus","fashion",
"My next couple weeks be like...Portland✈️Denver✈️Cheyenne✈️Denver✈️Pittsburgh✈️Denver✈️Pittsburgh✈️San Antonio. I’m like Carmen Sandiego! 😋 #consultantlife","@richyricha","travel",
"A game like Snake mixed with Where in the World is Carmen Sandiego?, but with more content that teaches 21st Century Literacies.","@EduGameIdea","edutainment",
"@FloydMayweather It’s like Carmen San Diego and Where’s Waldo finally found each other. Nice floor mat, totally necessary for those karate slippers you’re wearing😂😭.","@EezySeatown","cultural-icon",
"👉https://t.co/TUg2kYOdJA Gina Rodriguez To Star As Carmen Sandiego In Netflix Live-Action Feature ►►https://t.co/TUg2kYOdJA via #entertainment #entertainment #OnePlanetSummit https://t.co/MuXkQPBee3","@stat_lisa","cultural-icon",
"I want to go adventuring with Carmen Sandiego","@fatima_elhassan","travel",
"I found Carmen sandiego while tablesitting!! Artist alley H-02 adventures https://t.co/UWsd0PdtKC","@mimserino","cultural-icon",
"@Company971 @CommonManRadio Tell Lori Schmidt that Carmen San Diego wants her hat back.","@MEATBAT24","fashion",
"@kingmost fire up Carmen Sandiego whilst enjoying the wonderful fragrance.","@djynot","cultural-icon",
"engadget: Netflix finds 'Carmen Sandiego' for its latest reboot https://t.co/saFyyPTbEK https://t.co/1MCqVYfEz0 #tech","@TechCurations","cultural-icon",
"Rip Hunter still! Can you tell I really want to write a time travel murder mystery? It's like Where In Time is Carmen San Diego meets a procedural meets the DC Universe. https://t.co/ktp5HxBDJs","@ShaneMBailey","cultural-icon",
"Lamb chop, reading rainbow, between the lions, magic school bus, Carmen sandiego, mr. Rogers man damn I'm old","@NeighborhoodRoe","cultural-icon",
"Sosh looks like a non hispanic Carmen San Diego. #girls","@mj_starchilde","cultural-icon",
"@VZWpaulu thank you! seriously. a much better reference than carmen sandiego, i thought.","@ColinDeval","cultural-icon",
"Gina Rodriguez to Play Carmen Sandiego in Live-Action Netflix Feature: https://t.co/3wymA0BULV https://t.co/hKg9eN7SlM","@NerdMusicRadio","cultural-icon",
"Carmen Sandiego' Reboot Headed to Netflix https://t.co/zt0oELTYm5 https://t.co/rqJHuiH0fp","@GiGiCaponePR","cultural-icon",
"#CelebrateGaming 1986 ad memories - Where in the World is Carmen Sandiego continued to be a big educational crossover http://t.co/GCgi3SO9Ua","@VGBounceHouse","cultural-icon",
"#Netflix's #CarmenSandiego animated TV series now has a release date! Be on the lookout for the show on January 18, 2019! https://t.co/nNyn7hU6aW","@GeekBomb","cultural-icon",
"#ITriedMyBest but sorry Chief I can't figure out where in the world is Carmen SanDiego https://t.co/XjU5bJR3oH","@wchrisg0528","cultural-icon",
"@MediaObsessed I freaking WISH! Can't fit that hat over the fro tho ""@MediaObsessed: @arisacox International Woman of Mystery, are you Carmen Sandiego?!?!""","@arisacox","fashion",
"Gina Rodriguez Voicing Carmen Sandiego in Netflix Animated Series https://t.co/qT0yollbEt #TDoug https://t.co/vbjUQvRZv1","@TDougNews","cultural-icon",
"...actually, now I want to see a gender bent Kamen Rider Diend styled after Carmen San Diego. That would be rad.","@derekthebard","cultural-icon",
"Another image of our wonderful #pisatower #pisa#leaningtower#jaynelaroundtheglobe#carmensandiego#bossstatus #travel… http://t.co/pEF2idvRqK","@hotel_la_pace","travel",
"Currently at Louisiana Book Festival: Carmen Sandiego, Waldo, and a satyr","@Deboracracy","cultural-icon",
"#JaneTheVirgin star @HereIsGina is doubling down on '90s icon #CarmenSandiego by playing her in a live-action film for Netflix, as well as voicing her in an animated series https://t.co/dp652w66Ru https://t.co/x5j2DG696u","@MyTrackingBoard","cultural-icon",
"VIDEO: 10 Reasons Where in the World Is Carmen Sandiego? Was the Best Educational TV Show … https://t.co/YUvAVAopz3 https://t.co/36RirwrXDF","@masecdante","edutainment",
"What's this trend of people wearing Carmen Sandiego style hats","@sara_m_g","fashion",
"@lilbrigid you just need a rather large hat and you can be Carmen Sandiego also that looks good ma'am","@rowast","fashion",
"@nathanbeveridge When I'm talking about Where in the World is Carmen Sandiego I mean this 1985 era version. Not an App :-) #edtech http://t.co/nMb7g5weSD","@nathanbeveridge","edutainment",
"@RachelLeishman @the_moviebob When did Carmen San Diego stop being a detective story and become more of a tool to teach people geography?","@jcsturgeon","edutainment",
"@msagara I learned this from the coffee machine in Where In Time Is Carmen Sandiego","@hanlsp","edutainment",
"@AlexHelenMac I’ll get you the Carmen San Diego hat. Not sure I can pull that look off any more. https://t.co/xwk35tkAgl","@LancePaters1","fashion",
"If woman came to my house in a trench coat, I'm thinking 2 things. One she's Carmen Sandiego or Al Capone. Two she about to kill me.","@NeekGoBacon","fashion",
"Where in the World? (Is Carmen Sandiego): Guest Post by Meradeth Houston: I love time-travel stori... http://t.co/Ppr8MCCaWI @stephfaris","@PatHatt24","travel",
"Where in the world am I??? #carmensandiego #halloween #overlay @ Somewhere on Earth https://t.co/2qRhJyENDT","@JisaLayne","fashion",
"‘Carmen Sandiego’ Gets January Premiere Date On Netflix https://t.co/8Dnm2Oc7sS","@qerubin90","cultural-icon",
"I can't wear the East Nashville floppy, felt hat. I always look like Carmen Sandiego.","@stepfordbunny","fashion",
"Carmen Sandiego, Encarta 1995 and Anthony Bourdain taught me a lot about this world","@kgthatboy","edutainment",
"@StarKat99 @auntiepixelante It reminds me so much of that original 80's game of Carmen Sandiego ^.^ But in a fun space universe!","@StarKat99","cultural-icon",
"VIDEO: 10 Reasons Where in the World Is Carmen Sandiego? Was the Best Educational TV Show … https://t.co/SKmTygtWni https://t.co/IlzHKkbuBq","@grace_kellerman","edutainment",
"@iSmashFizzle @GeorgeFoster72 Who in the world is Carmen Sandiego?","@uga009","cultural-icon",
"Carmen Sandiego is returning as an animated children’s show on Netflix https://t.co/mHvSVtIgC8","@polygonfeatured","cultural-icon",
"@jeffiluv @KQhotbomb @miked41 @KevCesc @ErinAndrews You look like Carmen Sandiego cool hat dickhead","@BeejusChrist","fashion",
"@Marina_Sirtis My early childhood was Sesame Street, The Magic School Bus, Bill Nye, Mr. Rogers, Carmen Sandiego, and Star Trek TNG/DS9. TNG is still my fave.","@PloCoon","cultural-icon",
"Netflix to reboot 'Carmen Sandiego' animated series (starring Gina Rodriguez) https://t.co/uZ7wXpAmPN","@NESbot_OT","cultural-icon",
"@TheRealQty Might i suggest Carmen Sandiego if you want a point and click adventure?","@Mitorequiem","cultural-icon",
"@carolyn_will update: I found a red trench coat at Goodwill, so now I'm fulfilling my childhood dream of being Carmen Sandiego","@LaurenRPfeifer","cultural-icon",
"@NBA @cavs @nyknicks @matrix31 is missing his Carmen San Diego @CarmenSandiego hat, nice trench! @nbafashion101 @NBAFashDotCom","@WiTHENORTH","fashion",
"Dressed up as captain hook today. I was repeatedly mistaken for Carmen San Diego. I know who she is now and I'm not even mad. :) https://t.co/CrNVWYstCu","@Bre4nAfter","fashion",
"New Carmen Sandiego Cartoon In Development For Netflix https://t.co/FSmwWrYBFG https://t.co/T5faq4EGMV","@toonzone","cultural-icon",
"Another '90s favorite is being rebooted at Netflix—and Gina Rodriguez is playing the lead: https://t.co/Q7v3Wf7h3P https://t.co/JR0rqhCe7W","@glamourmag","cultural-icon",
"Carmen Sandiego Returns in a New Educational App https://t.co/M7emUOkfgH https://t.co/DRwRUix2IW","@RachelbsweeneyB","edutainment",
"@HobbyGameDev I learned a lot with Where in Time is Carmen San Diego. History and geography ;)","@nunodonato","edutainment",
"VIDEO: 10 Reasons Where in the World Is Carmen Sandiego? Was the Best Educational TV Show Ever https://t.co/M8j4Fa9o9l","@cecelia_hoaw","edutainment",
"Netflix Is Reportedly Reviving Carmen Sandiego With Gina Rodriguez https://t.co/GDXGT1PSjL #celebrity #gossip","@CelebNewsFast","cultural-icon",
"I was already in my 20s when I discovered Carmen Sandiego, and yet the geology nerd in me loved the show. And I enjoyed the strong female characters. Glad to see it coming back! Not Your Shero: Carmen Sandiego and the importance of feminism in edutainment https://t.co/Y0g3IPT61d https://t.co/MUfv1Y8iqb","@S_R_P_S","feminism",
"I put the “miss” in misdemeanor when I stole the beach from Lima. Halloween 2017 costume revealed #CarmenSandiego #HappyHalloween 👻🎃 https://t.co/k4fBlA2GLB","@goldafishm","fashion",
"Dressed as Agent Carter again today, 4 people have stopped me saying I'm Carmen Sandiego. She wears all red. I'm revoking their nerd cards.","@intotheairwaves","fashion",
"@NoTheOtherLeft “How do we make Carmen Sandiego even cooler? I know, have her repatriate artifacts!”","@admiraljello","cultural-icon",
"Where in the World Is Carmen Sandiego? Was my fave 90's pc game","@savionanthony","cultural-icon",
"where in the world is carmen sandiego RIGHT NOW????","@figgled","cultural-icon",
"Children of the '90s Rejoice, For Carmen Sandiego Is Getting Her Own Animated Netflix Series https://t.co/xTW6goZhV2 https://t.co/EZoC8SLQTq","@sucre_fils","cultural-icon",
"The urge to cosplay Carmen Sandiego for Halloween this year is strong.","@ChibiTifa","fashion","x"
"[Photographer]Waldo and Carmen Sandiego This post was automatically fetched from Redditt via /r/co https://t.co/yDXf8Oqgg3 #cosplay #anime","@SuperCosplayBot","cultural-icon",
"Netflix is making a Carmen Sandiego movie with Gina Rodriguez - CNET https://t.co/wmz2DarRau","@tech_politics","cultural-icon",
"VIDEO: 10 Reasons Where in the World Is Carmen Sandiego? Was the Best Educational TV Show … https://t.co/UKZX7PSp6c https://t.co/HEc1gkdsz2","@chardmedia43","edutainment",
"All copies have been distributed. Thank you so much @sparsevector. Again, go check it out. Get him cracking on an M-rated Carmen Sandiego!","@IndieGamerChick","cultural-icon",
"@BloodyPopcorn It could also be Carmen San Diego's hat.","@PhantoMantis","fashion",
"Saturday Night Social: Gina Rodriguez Will Voice Carmen Sandiego in Netflix's Upcoming… https://t.co/pfbvu46lAe https://t.co/siEvNGq5IS","@SPCObaltimore","cultural-icon",
"@brooksasanoun Game companies please make cluefinders 4th grade adventures also amazon trail 3 and where in time is carmen sandiego go go","@kormtrom","cultural-icon",
"Everything I know about geography I learned by chasing Carmen Sandiego.","@OMGmyFACE","edutainment","x"
"about to purchase where in the usa is carmen sandiego..","@LaMarcelle","cultural-icon",
"@BigBird Facebook even had its own version of the game Where in the World is Carmen Sandiego, it was my favorite Facebook game ever.","@JeremiahLiles1","cultural-icon",
"@iSmashFizzle Across media, Carmen character actually has kind of an in-depth backstory and is portrayed ""as more of an anti-hero than a proper villainess"" https://t.co/cZIAURCqLg","@renatasnacks","feminism",
"@thesingoff How about having @RockapellaMusic on to sing the Carmen San Diego theme?","@Webpuppy45","cultural-icon",
"@ktslager tbh carmen san diego is a feminist icon","@kittenproponent","inspiration","x"
"One of the reasons why I was Carmen Sandiego for Halloween was because it was a good excuse to buy a red fedora. Still don't have it :(","@FannyBanany","fashion","x"
"Netflix is making a Carmen Sandiego show starring Jane the Virgin’s Gina Rodriguez https://t.co/PjUAb4Nivj","@ZyiteGadgets","cultural-icon",
"⚡️ “Netflix greenlights a Carmen Sandiego series” https://t.co/TbckO3zd8o","@hirene7up","cultural-icon",
"@MissJenniferEss “@MissJenniferEss: @KJSmith567 OMG where are u?!” I'm in LA. Where are u my Carmen San Diego, traveling the world and whatnot?!??","@KJSmith567","travel","w"
"@jorcubsdan this road trip is giving me flash backs to grade school and Where in the World is Carmen San Diego?","@riccio14","cultural-icon","w"
"Just realized the #PizzaHut logo looks like #CarmenSandiego's hat. But like reverse the color. I just… https://t.co/YBBjZAr7xi","@redjag007","fashion",
"#Armageddon #2015 #costumes #cosplay #carmensandiego #free #attackontitans #kittymaid #anime #follow… https://t.co/RVTJ2g7SYB","@matthewchildsnz","fashion",
"Relationship goals! I dress up as Carmen Sandiego. Partner in crime goes as Waldo. Bonus points: gender bender. Hells. Yes.","@Violinagin","fashion",
"Realizing that the only reason you know geography is because of Carmen Sandiego...","@Kvargas26","edutainment",
"""Excuse me, Carmen San Diego, I didn't realise we had a geography expert on board."" #OITNBseason2","@junglejim4322_","cultural-icon",
"YES! @HereIsGina to voice Carmen Sandiego in @netflix animated series: https://t.co/rPNANLwy3E via @BrowBeat","@rosaliechan17","cultural-icon",
"The Netflix gods are smiling upon us all today https://t.co/daLNnS3ZEd","@marissaapena","cultural-icon",
