"contents","author","category","star_tweet"
"I never finished all my Carmen SanDiego missions in elementary school I’m mad now","@_nicogarza","nostalgia",
"Hee! @ladytian & I just saw the best couples cosplay. Waldo & Carmen SanDiego. Sadly, we were on the escalator, so we have no proof that we found them. #WonderCon","@ralkana47","style",
"Where in the world is Carmen Sandiego? And by Carmen Sandiego, I mean my car keys.","@AndyAsAdjective","pop culture",
"Gina Rodriguez donning red fedora and trench coat of Carmen Sandiego https://t.co/7SHomRQ1vY https://t.co/nEc9Vx8eHF","@_psyfi","pop culture",
"Gina Rodriguez Is Going To Be Carmen Sandiego In A Live-Action Film And I'm Breaking Out My Red Fedora To Celebrate https://t.co/cuWDXnLvEh https://t.co/uju37gUpGx","@azemarketing","pop culture",
"Computer class meant learning to type, and playing Oregon Trail & Where in the World is Carmen Sandiego on an Apple IIe. https://t.co/S8baGOHfhZ","@OV_099","nostalgia",
"VIDEO: 10 Reasons Where in the World Is Carmen Sandiego? Was the Best Educational TV Show … https://t.co/hRl3JnxPSf https://t.co/7r50M0aPop","@JoryBlake","edutainment",
"I got a Carmen San Diego vibe from Sharna in that hat. #DWTS","@Rin11","style",
"Kourtney Kardashian Takes Younes Bendjima on a Surprise Birthday Trip Oh, the places they'll go! Kourtney Kardashian channeled her inner Carmen San Diego for Younes Bendjima's birthday--and no, we're not talking about a role-playing fantasy.... https://t.co/I5kzAtJKU2","@MelvinC6100","travel",
"$309,000,000 after taxes. SHYT. I wouldn't even know what to do with that. I might just travel the world. Word to Carmen Sandiego.","@BedRoomGNGSTA","travel","x"
"Worked all #Halloween, but we managed to have some fun. 🎃👻🍬🎩👒 #whereintheworld #carmensandiego… https://t.co/tR3jOrt6rP","@JillianEaston","style",
"@AmoebaSisters @iamscicomm I recently played Magic School bus and it was really good, also tried Oregon Trail And Where in Time is Carmen Sandiego -both so hard!","@GeneticCuckoo","pop culture",
"Lady Gaga Swiped Her Hat And Trench From Carmen Sandiego's Closet - https://t.co/XFLY9fn3BE https://t.co/7LvyVoGmei","@LadyGaGaview","style",
"Where in America's Past Is Carmen Sandiego? (Macintosh game 1992) https://t.co/kyn574J7tu She's traveled back in time to #metoo the framers of the constitution. you go, grrrrl!","@JimJimjeru","travel",
"@Andrea_Rosu Oh, jeez, that looks AWESOME. And you are killing it in that outfit, Carmen Sandiego hat and all. :)","@jeffmac813","style",
"I just learned that Carmen Sandiego stole the cotton gin in the first episode of Where in Time is Carmen Sandiego and that sounds like a hero's move, tbh.","@Luarien","pop culture",
"Watched Where in the World is Carmen Sandiego for lesson planning inspiration, now have #Rockapella stuck in my head","@amanda_tesl","pop culture",
"Carmen Sandiego Returns in a New Educational App https://t.co/CCisEdAqjL https://t.co/CoAIhynt0e","@BussellGloria","edutainment",
"@diddy @Zoo757 You went and remixed Carmen Sandiego's hat....impressive","@kblakdastoner","style",
"The many faces of Danielle's ""Where in the World is Carmen San Diego"" hat #girls #fun #memories… http://t.co/oEPpwHsfiB","@kimmieagin","style",
"@GoldenOwlEvents Any chance of seeing another adventure like Pirate Quest or Carmen Sandiego this year?","@awesomeguy81","pop culture",
"Fun fact: The first time I met @timfrancisco , he mentioned being involved with the development of Babel Fish - Elementary school me felt like I had met an Interweb Star ( Like Carmen San Diego. ) We have a solid team at https://t.co/KbmpqrgKmo @djkinkle @HealingVibes no doubt. https://t.co/Oao1KeRxDm","@Marcquistador","pop culture",
"I’m so burnt out at this point my fashion style is what would happen if Carmen Sandiego went to one DIY show every few months but no more than that","@brat_mitzvah","style",
"Or them Carmen Sandiego lookin hats https://t.co/dINJxfwotY","@Real_EazyE","style",
"✨Am I the only person who can’t wear a trench coat without singing the Carmen Sandiego theme song? ✨ #whereintheworld @ Chinatown https://t.co/9SFxJod1xV","@Jetsetterjrnl","rockapella",
"What You Learn Hunting Carmen Sandiego Without Google's Help https://t.co/rKp0AsfNIS","@Mario_Tekdung","edutainment",
"Happy Halloween, readers and writers! Let me ask you something: “Where in the world is Carmen San Diego?” https://t.co/SciQLFfoHZ","@ShannonCSimcox","search",
"@miss_samia 💡 you need a Carmen San Diego Hat","@Mad_H_A_T_T_E_R","style",
"i wanna be carmen sandiego for halloween one year and stay home so ppl will be like ""where in the world are you?"" and ill be like ""idk"" 😏","@altpunkhemmings","style","x"
"Introduced my kids to Where in the World is Carmen San Diego (Geography) and 3-2-1 Contact (Science) today.","@tdeibarlow","edutainment",
"Spent the night with Roz going on adventures for cookie dough and getting sluprees instead and playing a Carmen San Diego board game. I'm gonna miss this.","@ChelseaZielin","pop culture",
"Self as Carmen Sandiego (from Where in the World is Carmen Sandiego) Please excuse the quality of the hat! https://t.co/mjxfIf5Z6K","@GiftingL","style",
"@mrmatera A2 - I've never tried it myself, but I can think of Mario is Missing or Where is Carmen Sandiego as examples of this kind of game mechanics. They could support travel and history research very well. #xplap","@pandacucho","pop culture",
"@UglyCalifornia you been sleeping on me traveling the world like Carmen sandiego","@Ronweezy112","travel",
"In this reality, Ron Burgundy and Carmen Sandiego drive around in a van solving mysteries ...","@Cr0ss0verB0t","pop culture",
"@dosmeow I have been waiting FOREVER for a globe-trotting adventure game where you play as notorious detective-turned-master thief Carmen Sandiego as she competes with and ultimately foils the ambitions of an evil criminal organization","@TheRiolu_","travel",
"@Jayizms We need to just link since Sean is out country. He wouldn’t even know. He ain’t even tell us bye. He wanna be Carmen Sandiego but I don’t see no red trench coat, hat or HEELS!","@triggaNIZER","pop culture",
"Wishbone Activity Zone Mavis Beacon Teaches Typing Rugrats the Movie Activity Challenge Where in the World is Carmen Sandiego? https://t.co/1oQTzehI9p","@jewmanjii","nostalgia",
"Rasheeda and this Carmen San Diego hat? #LHHATL","@JamelleMyBelle","style",
"When the internet gets mean, I miss the days when the worst thing I experienced was landing at the wrong airport in Carmen San Diego.","@anniefdowns","pop culture",
"Just reminded of best couple costume I saw on Halloween: Carmen Sandiego and Wally.","@jaqx0r","waldo",
"@byKimAHoward Carmen Sandiego would be a GREAT costume.","@bhootbabe","style",
"Carmen San Diego opened doors for Latinas on a global level #truth http://t.co/F2S6BwGMVi","@BoomBoomDuPrey","latina",
"You know how you get a new car and then see that car all the time on the street. My day = that but with Carmen San Diego references...","@Winegarden_A","pop culture",
"@knottyyarn I also have a friend who won Carmen Sandiego in elementary school, so . . .","@DarcyAMiller","pop culture",
"Dust off your red fedoras, there’s a brand-new Carmen Sandiego reboot coming, starring Gina Rodriguez!The Jane the Virgin star will be set to produce along with also star in a live-action film adaptation of the... https://t.co/QKKk7HcaUU","@easier2live","pop culture",
"@Proton_Jon Keep traveling like this and Carmen Sandiego will be out of a job...","@Vincents_Sin","travel","x"
"• Vogue: Carmen Sandiego would have loved the Fall 2017 couture collections. https://t.co/4NXGhACNjn… https://t.co/HapbF3UYax","@kelenike","style",
"There's a guy busking in Ely wearing Carmen Sandiego's hat. Today's answer is: Ely. https://t.co/jfJu5Uv4Yr","@Legal_Dan","style",
"Something about Carmen Sandiego in your art style just seems so right. I love this piece, @Mografi_Joe.<3 https://t.co/GS0RxUPAuN","@timleftwich","style",
"Look women in trench coats to me = Carmen Sandiego. LOL!","@NeekGoBacon","style",
"@miss_mad_love sigh. I swear I can't find you.. are you sure you aren't in a Carmen San Diego cosplay","@HeroOfCant0n","style",
"How Carmen Sandiego accidentally became an educational game icon https://t.co/F6ev0EDjjq","@KaseyGamez","inspiration",
"Latinx actress Gina Rodriguez will play master thief Carmen Sandiego! https://t.co/01IEIDAvVi","@HornetStories","latina",
"VIDEO: 10 Reasons Where in the World Is Carmen Sandiego? Was the Best Educational TV Show Ever … https://t.co/58o7HV34R9","@parishatzi","edutainment",
"Be brave start following us on Soundcloud. Follow us and see where we go, unlike Carmen San Diego!","@daatomicpodcast","pop culture",
"Don’t get me wrong. I support hats. I lobbied very hard for Reb and her ladies to wear Carmen Sandiego hats with their bridesmaids dresses. Also, capes.","@EricDrumm","style",
"Seeing a lot of ladies being #CarmenSanDiego for Halloween. Was there a memo?","@SaintBrendan","style",
"Gina Rodriguez donning red fedora and trench coat of Carmen Sandiego https://t.co/z3zaFseoAy https://t.co/nkcvPkoKIF","@xinco","pop culture",
"Kourtney Kardashian Takes Younes Bendjima on a Surprise Birthday Trip Oh, the places they'll go! Kourtney Kardashian channeled her inner Carmen San Diego for Younes Bendjima's birthday--and no, we're not talking about a role-playing fantasy.... https://t.co/I0C7fOeRlL","@JoshCrawford01","travel",
"Our trip home had to do a stop over so we are trying hats. I’m into this pimp meets Carmen Sandiego look! https://t.co/6rCkeXuBjk","@DrCarpineti","travel",
"@Rudeism #AltCtrloftheDay Where in (the World)/(Time) is Carmen Sandiego? with a (globe)/(hardcover copy of H.G. Wells' The Time Machine)","@DustinYourEyes","pop culture",
"marina!!!!!!!!!!!!!!!! marina you're looking like carmen san diego in that hat and coat!!!!!!!! hello again!!!!!! #thelword","@mackdougs","style",
"#GamerGate Nov 1985 #retrogaming ad memories - Where in the World is Carmen Sandiego? Educational games level up! http://t.co/fyrH8Erdrz","@VGBounceHouse","edutainment",
"What if Carmen SanDiego and Waldo with the striped hat and sweater are somewhere with all my pens and sunglasses?","@RoxieBrookshire","cultural icon",
"Splash: Underwater Sanctuary #will use Carmen Sandiego tactics to teach #you about fish http://t.co/19k3IN3Y1D #GamesBeat","@VideoGameNwsBot","edutainment",
"Wondering what happened to the edutainment game software of your youth, like Reader Rabbit and Oregon Trail? This article covers the corporate shenanigans that led to their downfall. https://t.co/kzXJi25XN0","@ArcadeSpiritsVN","edutainment",
"I'm going to change my name to Carmen San Diego after all this travel within the next month. MI > TX > NYC > CHI > NYC","@hopealcocer","travel","x"
"#ObamaCare failing & @BarackObama playin Where in the World is Carmen Sandiego. Vacation's over pal, u created the mess now help clean it up","@timetopreach","travel",
"@HeatherAntos An epic Carmen Sandiego style heist!","@mattleong13","pop culture",
"@MeWeFree also, what happened to Carmen Sandiego's flight rewards?","@ImNotTron","travel",
"Where in the world is Carmen Sandiego just kidding where in the world is my car","@CRASHQUEEN_","pop culture",
"@mralanorth @thegrugq I kind of feel like I need to put together a Carmen Sandiego outfit for defcon, tbh.","@OaklandElle","style",
"VIDEO: 10 Reasons Where in the World Is Carmen Sandiego? Was the Best Educational TV Show Ever via PEOPLE.c… https://t.co/Y0asC9HbRy","@styloce","edutainment",
"wearing my jacket that makes me feel like Carmen Sandiego but instead of being a gentlemen thief im delivering chocolate chip cookies.","@ajleaps","style",
"Traveling from Leningrad to West Germany to catch Carmen San Diego https://t.co/V5NKOmSGgd","@sarahkendzior","travel",
"Hacker News - Where in the World Is Carmen Sandiego? Becoming a Secret Travel Agent [video] https://t.co/HCn4TnAb87","@SecNewsBot","travel",
"first the Taj Mahal, now the #Louvre? You can call me #CarmenSandiego #Paris #tourist http://t.co/oYSIAjnj8w http://t.co/GiN1iHrkdU","@alphawat","travel","x"
"@richandcreamy Pssst, Carmen Sandiego rulz so much! As a kid, I wish I was like her because she would travel over the world in luxury.","@MGShogun","travel",
"@TheGamingDeer @4JStudios its a old school gaming joke. An edutainment game ""Where in the world is Carmen Sandiego""","@sithlordfaust","edutainment",
"My #BlackPanther outfit is almost complete. Just gotta find some black ripped jeans my size. This gonna be harder than finding Carmen Sandiego.","@Nerdonic","pop culture",
"It's easy to put together this fun DIY Carmen Sandiego Costume! #Halloween #costume https://t.co/LJ5818oMeU https://t.co/ok5N54HPAb","@ThriftyJinxy","style",
"@tomblappy after the Magic School Bus episode came an Up Next: Bill Nye, a Carmen Sandiego promo & part of the opening of Kidsongs Season 2.","@JeremiahLiles1","pop culture",
"Gina Rodriguez donning red fedora and trench coat of Carmen Sandiego","@MoniMantequilla","pop culture",
"My husband @Nascar0420 just compared Ana to Carmen San Diego with the hat & over coat! #toofunny #GH","@Tara_g420","style",
"I literally have been up for 24 hours. @JoeMeansBizness was right I'm really traveling all over like Carmen San Diego","@Dlenrie","travel",
"Photo: cosplay-paradise: [AMA] Found Waldo and Carmen San Diego at the same time http://t.co/9pBk1ljZeM http://t.co/TKB5BKqP1s","@HouseOfArn","style",
"The First Images of Netflix's Carmen Sandiego Are Here Carmen Sandiego has been found, and she's looking good on Netflix. Gina Rodriguez will make her debut as the new voice of the iconic globe-trotting thief in the new 20-episode... https://t.co/srSeiDWHrw","@JerryChandler54","pop culture",
"I am down for new Carmen Sandiego cartoons on Netflix, but I still think a live-action lady would look pretty rad in this outfit. https://t.co/ledr6L6EWW","@BAMFPIMP","style",
"Embrace your inner Carmen Sandiego and visit each corner of the globe! Check out @Mashables 2016 traveler's guide https://t.co/DlnjG2kZL9","@EdelmanDC","travel",
"And, above all: who's Georgij's mystery girl and where the heck is he now? *muffled carmen sandiego's theme playing in the distance* https://t.co/EkaegnSYWQ","@raxilia_r","rockapella",
"Okay w/ your traveling ass. Carmen Sandiego, who?!? https://t.co/HYuZp3Uvy8","@Qkfman","travel",
"Our McDuece wasn’t dirty it was filthy. 25 reps of push-ups, squats and crunches followed by a 125 yard bear crawl. Repeat 4 times. Hat tip to Silicon, Carmen San Diego and Mookie for rising to the challenge.","@PlanoF3","pop culture",
"I feel like Carmen SanDiego in this hat... lol xD #bored #selfie #merrrrr http://t.co/73c6fzb5jS","@ArwenStarsong","style","x"
"If I'm ever in a relationship during Halloween I want to do a couples costume of Carmen Sandiego and Waldo.","@Haroldd_C","style",
"Carmen Sandiego was pulling off heists hopping from continent to continent in that SICKENING red coat with matching 6 inch heels and wide brim. A legend. Your faves tried, but they didn't have the range. https://t.co/itNV0xYEAS","@xMurderCWrote","style",
"Fan Expo 2015: Carmen Sandiego & Waldo FINALLY found… Together?: Do you have any fun cosplay images to share f... http://t.co/XjzYHLA9JQ","@VillainCostumes","style",
"VIDEO: 10 Reasons Where in the World Is Carmen Sandiego? Was the Best Educational TV Show … https://t.co/OlrcFzVnlS https://t.co/HQKQ5XLbEV","@alicetreatsyou","edutainment",
"@RobMeekel @KikkiPlanet Sipping mojitos in Belize with a mysterious woman named Carmen Sandiego. #wheresPrento","@Marty_Chan","travel",
"@ClareCoffey You just need a hat with that, and you can be Carmen Sandiego.","@brando_minich","style",
"How Carmen Sandiego accidentally became an educational game icon https://t.co/VMKFpmAmx6","@VoidSwimmer","inspiration",
"Happy International Women's Day to all (but most especially to Carmen Sandiego, the original international woman).","@chrissiegruebel","feminism","x"
"Feeling like ""Where in the World is Carmen SanDiego""..Melissa style 💁🏽 Quick trip to Chi-town to… https://t.co/XGm66NKxIj","@MelissaAHoffman","travel",
"Imma let you finish, but Carmen Sandiego is the greatest female video game character of all time [Destructoid] #de… https://t.co/HG2b1zd0kX","@8bitGrrl","feminism",
"@jaivergent and he beat up a Carmen Sandiego cosplayer and stole the coat.","@lbjb247","style",
"VIDEO: 10 Reasons Where in the World Is Carmen Sandiego? Was the Best Educational TV Show Ever https://t.co/ftUvspgSc4 via @People","@Jill_Chodak","edutainment",
"I want to start buying big hats, but I can't decide between Carmen Sandiego & Bridget Bardot https://t.co/ARkQhhddI2","@athenahollow","style",
"STOP it! Hold the phone! Carmen Sandiego is coming back?!?! EEK! Star @HereIsGina will be in it! #edutainment https://t.co/fOggoiFYI5","@TheTeachersWife","edutainment",
"@SpectralProngs the red one is v carmen sandiego (also omg i thought the grey hat behind you was part of the hat lmfaooooo @ meeeee)","@peruvianpiranha","style",
"If tease image is indicative of overall style I am freaking IN. The world could always use more Latina anti-heroes! https://t.co/vVW4WjXDxF","@SuedeBlade","latina",
"@cjhitchcock -Honorable Mentions- Phantom 2040 Gravity Falls Avengers: Earth's Mightiest Heroes Johnny Bravo Where on Earth is Carmen SanDiego? Aeon Flux","@cjhitchcock","pop culture",
"Carmen Sandiego Returns in a New Educational App https://t.co/jE9piScVFQ https://t.co/DyBtp4JaTT","@NicholegsilvaG","edutainment",
"I don't know why it took me so long to figure out but it dawned on me with his travels. Sean Dane is Carmen San Diego right? @musean","@ZachIsHere","travel",
"#TravelTuesday Got a few trips coming up: Playa Del Carmen, San Diego, Cabo & still deciding on where to go this summer","@LeslieMarshall","travel",
"@_bijuu_ lmao what if I'm going to class then going on a Carmen San Diego style expedition?","@CapnJesus","style",
"@teamTblanchard You travel more than Carmen Sandiego these days.","@DaveMuscarella","travel",
"@rabblerowsdower On the bus today I created a character that was part Daria, part Lama, and you. I named it, Lamity and legit squeaked at my excitement about her going to far off places to nap while wearing a Carmen Sandiego hat.","@DrewTweetsStuff","travel",
"@Hyper_Jen @reggieaqui @NatashaABC7 Pretty sure she's in some exotic, foreign country in a red trench & oversized hat a la Carmen San Diego. https://t.co/BzBbuIqUS9","@FiveTenFoodie","pop culture",
"@MonizDave there were a few! I also remember a game show called Where In Time Is Carmen Sandiego, because apparently she could time travel?","@andrewces","pop culture",
"Just told someone they don't need that Red Coat cause they aren't Carmen Sandiego 😕","@Greedy_Gretchen","style",
"Gina Rodriguez donning red fedora and trench coat of Carmen Sandiego https://t.co/WkovQ2XKeq https://t.co/UbXVnqQWC7","@Perceptiveone","pop culture",
"Like Carmen Sandiego: where will I end up next? 😎 👠 All I’m missing is a red trench coat! See you 4pm-6pm at the Monroe County Clerk’s Office #ROC #NewsLife https://t.co/mJ73fOvEqP","@jeanniemcbride_","style",
"Choosing to be Carmen Sandiego for Halloween means seeing more CarmenxWaldo fan art than I ever wanted to see","@kriseliart","style",
"also the music between acts reminds me of Where In The USA Is Carmen SanDiego traveling music. YOU KNOW WHAT IM TALKING ABOUT #90sKids","@inklerss","travel",
"I want a trenchcoat and a wide brim hat. Feelingfeeling Carmen Sandiego.","@AxelssonRAWR","style","x"
"Not surprisingly, one of my favorite shows growing up was Where in the World is Carmen San Diego? I had the board game too. ;) #traveler","@JanetBrent","travel","x"
"note to self: draw callista in carmen sandiego's outfit 2morrow","@pizzacontigo","pop culture",
"I said why you got that Carmen Sandiego hat on","@BiggieSnuggs","style",
"@LawyerRogelio Get her a big hat and she could easily be Carmen Sandiego.","@johnwluke","style",
"I can't name a Latino private eye in the last 20 yrs - @thechicoleo Carmen Sandiego - @TyTheRobot #FanBrosShow https://t.co/ILKMieeEuj","@TatianaKing","latina",
"Compare Carmen Sandiego to The Magic School bus, which kinda cooled itself in the late 90's, but will have a Netflix reboot this year","@CPKlassen","pop culture",
"INFO l @HereIsGina will Voice Every ’90s Kid’s Favorite Globe-Trotting Thief, Carmen Sandiego, in a @netflix Animated Series ! https://t.co/9dJ6t9rxwa","@GRodriguez_net","travel",
"@Diegoiest They're wearing red, so my guess is Carmen sandiego.","@FarrenDustfur","style",
"Then wayyyy back in the day bill nye the science guy and where in the world is Carmen San Diego used to come on","@ElleStar_","edutainment",
"It is a true gift to travel the world with someone you love. I hope Carmen Sandiego feels the same way about me. I would ask him but I don’t know where in the world he is right now.","@bobsaget","travel",
"Ryan: I have love for Carmen Sandiego. Liked the PC games, game show, and used to watch this too! Good blend of education and entertainment!","@CartoonClubCC","edutainment","x"
"I need some boots for my carmen sandiego costume, but I'm far too uncertain of my size to order online.","@Redback","style",
"What is this Carmen SanDiego dress/jacket she is wearing?!","@jasmineleann","style",
"ok help me on friday do i be a bunny for the 4th yr in a row for halloween or carmen sandiego","@doIlification","style",
"Carmen Sandiego Returns in a New Educational App https://t.co/OwfcvDHgC0 https://t.co/Cg3foA8obi","@pamelawwinfield","edutainment",
"Mexican wedding cookies are as well traveled as Carmen Sandiego. https://t.co/KnyuvTMx5F https://t.co/o7vPHCFr7O","@seriouseats","pop culture",
"Gina Rodriguez donning red fedora and trench coat of Carmen Sandiego https://t.co/YApz81MyDi","@rezwanrasul","pop culture",
"🎶She go from Nashville to Norway, down in through Zimbabwe...🎶 Yeah, you’re welcome for the ear worm. More from @photowhatnow! #aditheadipose #CarmenSandiego #cosplay #edit #cosplayer #photoshop #whereintheworld #fandoms #doctorwho #mashup #cosplayg… https://t.co/TDHNcP98dl https://t.co/46hmyhkZYJ","@aditheadipose","pop culture",
"Happy #Halloween! #Oconomowoc store (left) & #SunPrairie (Carmen Sandiego, right) https://t.co/qkqL6JO0my","@HL_Paints","style",
"@angmarim someone pls photoshop a carmen sandiego hat and wig and coat on mark ham ill","@weathrhills","style",
"Where on Earth is Carmen Sandiego? #CarmenSanDiego #Cartoon #Cartoons #EduTainment #FoxKids https://t.co/ceV7j32SDI","@whydoisay","search",
"Carmen Sandiego and her sister on a sexy beach vacation...? #jerseyshore #walkofshamy https://t.co/ORZ3RsU5WG","@SgWingo","travel",
"@HerryNelson34 I found a KFC toy of Carmen Sandiego's car on Amazon! She must be in it!","@JeremiahLiles1","pop culture",
"spatscolombo: So I accidentally learned today about this thing where lots of people ship Carmen Sandiego... https://t.co/J1kP8VYxtH","@Daedalus64","waldo",
"i'm the sherlock holmes, harriet the spy, inspector gadget, dick tracey, where's carmen san diego & waldo, bill nye the science guy type..","@MsExQuisite","pop culture",
"@anyhoo_harry Every time you post these, I picture him in a trench and large hat like Carmen San Diego","@ohhnoitsamyy","style",
"@a_mwriter I think I saw Carmen Sandiego wearing them in a country that uses rials. #Spoofchat","@GovConSME","style",
"Gina Rodriguez donning red fedora and trench coat of Carmen Sandiego https://t.co/IS1KN02ndF https://t.co/PfSHzVLCVS","@guchiscarllete1","pop culture",
"SOMETIMES I WEAR A RED COAT AND PRETEND I AM CARMEN SANDIEGO. #ANDSINGTHESONG #BOTHVERSIONS","@calentura","style","x"
"Is that Carmen San Diego on the back row of the jury box, in the black hat? #TCMParty","@SomRandomOlDude","style",
"If she had the hat, she would be Carmen San Diego a real G lol. https://t.co/7SJiUmHnze","@WeAreReckless","style",
"Where in the World is Carmen Sandiego?, Which I played more of later games in the series, but it was iconic for oldies like me.","@SnowVix_Dani","game",
"Had to recycle Carmen San Diego this year due to last minute issues, but #HappyHalloween Tweeties!! 🎃🌍 https://t.co/aEzUpYt3Tq","@ThaPlatinumOne","style",
"VIDEO: 10 Reasons Where in the World Is Carmen Sandiego? Was the Best Educational TV Show … https://t.co/lzqOnf1ZMV https://t.co/EiwO5WcA0H","@norfaiz","edutainment",
"@L_Aitken answering for my wife because she’s bad at twitter but she has her own GoG account with rollercoaster tycoon, Carmen Sandiego and the Titanic Out of Time adventure game, Sims as well but that mostly seemed to be for pool murdering","@stevenalanclark","pop culture",
"A;SOLDIFKJA;EOFIAJ; APPARENTLY WHEN I WAS IN ELEMENTARY SCHOOL WE GOT ASSIGNED TO WRITE ABOUT OUR HEROES AND OTHER KIDS WROTE LIKE SUPERMAN OR THE PRESIDENT OR THEIR PARENTS BUT I WROTE CARMEN SANDIEGO AND THE TEACHER WAS. CONCERNED. OH MY GOD.","@starsinmist","inspiration",
"where in the world is Carmen sandiego was the best thing. She was bad asf and I learned geography","@hoeesue","edutainment",
"@NHStokes damn, you're like carmen san diego yo. traveling all over the world lol. whats in san diego?","@buzzkillerbb","travel",
"@jonrog1 I've moved into the age range that should be called ""you can't figure out the controller anyway"". I would love a game like Assassin's Creed but only the adventure/storyline. Not the killing and mayhem. A grown-up Carmen San Diego game.","@souzou_no","pop culture",
"@phonologix ha i got this coat for a carmen sandiego costume, actually","@therealcbrad","style",
"A1) Carmen Sandiego. Magic School Bus. School-aged stuff. Most of the Corp-ED attempts have not faired so well. #guildchat https://t.co/lNsdXraYGu","@aa_altieri","pop culture",
