"text","handle","category","star_tweet"
"@JMPerkins The Warriors is so good. Campy in the way costumes are done. But any movie with The Chief from Carmen Sandiego is awesome.","@spaceVulture42","cultural-icon",
"Someone found us >.> The #CarmenSandiego and #Waldo #conspiracy #cosplay #DragonCon2017 https://t.co/gL9ROs3ITi","@Liane_DeeTee","fashion",
"Looks like @netfilx is making more good decisions. Shout out to @HereIsGina on her new gig -- Carmen San Diego! https://t.co/dgXlREksyu #representationmatters #latina #movie","@LLERO_ONLINE","role-model",
"‘Carmen Sandiego’ Toon Series Starring Gina Rodriguez Bound For Netflix https://t.co/ubZla9ckGj https://t.co/OkwJ3gEuff","@MoviesWorldNewz","cultural-icon",
"Favorite episode of ""Where in the World is Carmen Sandiego?"": when a car of men was stolen in San Diego.","@GavinJamieson","cultural-icon",
"I found Carmen Sandiego. She was hiding as a coat rack https://t.co/UTH4XLjrnW","@ScienceJesus","cultural-icon",
"@SamSykesSwears @netflix They can do a cross over event with Carmen Sandiego where they are hunted down by Slylock Fox","@kenjisalk","cultural-icon",
"Hope I meet a woman in a big floppy Carmen Sandiego hat before they're not cool anymore.","@YOPATIO","fashion",
"@PizzaKari Carmen Sandiego didn't get this kind of anti-feminist pushback when SHE did a game.","@stuffisthings","role-model",
"#ITriedMyBest but sorry Chief I can't figure out where in the world is Carmen SanDiego https://t.co/XjU5bJR3oH","@wchrisg0528","cultural-icon",
"Netflix is betting on ‘90s kids nostalgia for learning with upcoming lineup https://t.co/UcDsTRSqZP https://t.co/0nOYsk3D9N","@gucci_dolphin1","cultural-icon",
"q3) favorites, eh? I'm going with Where in the World is Carmen Sandiego. Geography, culture, logic. Started a big chain of learning #lrnchat","@fugu13","edutainment",
"""Welcome to Costume World. How can I help you?"" ""Can't decide between Carmen San Diego, Waldo, Santa Claus, or LL Cool J in I'm Bad video."" https://t.co/yX2YMR23Ak","@chachoficial","fashion",
"If Carmen Sandiego had the ability to travel in time, why did she bother hiding in remote parts of the world at all?","@ianfedergreen","cultural-icon",
"Netflix Is Reportedly Reviving Carmen Sandiego With Gina Rodriguez https://t.co/EUwIyjWhy4","@TLNNewOrleans","cultural-icon",
"@aliciakeys Dope look, it's like a hip-hop mix of Carmen Sandiego and Raiden. I dig it.","@HarveyLinton","cultural-icon",
"My partna's in va know u might see me anywhere like Carmen San Diego..","@_Hollyhood_Reed","cultural-icon",
"Netflix is working on a live action Carmen Sandiego film and we’re way more excited about that than we should be.","@PunchLikeAGirl1","cultural-icon",
"@Kevin_McCashion Hat tip to Troy-born polymath Dave Masher, creator of Where in the World is Carmen Sandiego","@JohnMinehan1","cultural-icon",
"@EarlIII1 @JackPosobiec @thomasbsauer He's like Carmen Sandiego with more Navy","@DanRossCooper","cultural-icon",
"I thought I was beating the system by asking Jeeves Carmen Sandiego questions to solve the case, but I was learning. https://t.co/Ouo8b8GQlC","@jdylan901","edutainment",
"@401authrequired i love Carmen Sandiego!!! and yes she is an international woman!!! 😎 https://t.co/V6p7ORJDAH","@pouchedfox","role-model",
"Netflix Is Reportedly Reviving Carmen Sandiego With Gina Rodriguez https://t.co/exQM7P25fS","@CelebrityNewsCo","cultural-icon",
"@marylockwood412 Carmen SanDiego taught you how to navigate the Oregon Trail","@erin_lockwood","edutainment",
"So #Netflix is going to do a #CarmenSandiego movie. I wish @PBS would bring back the game show and we could have @RockapellaMusic do the theme song again.","@LibertyGeek83","cultural-icon",
"The First Images of Netflix's Carmen Sandiego Are Here Carmen Sandiego has been found, and she's looking good on Netflix. Gina Rodriguez will make her debut as the new voice of the iconic globe-trotting thief in the new 20-episode... https://t.co/Usdy5kmGha","@JoshCrawford01","cultural-icon",
"Netflix Reboots 'Carmen Sandiego' With Gina Rodriguez https://t.co/1CpF3rUYRx","@SaveTheGBHQ","cultural-icon",
"Jane The Virgin’s Gina Rodriguez To Star In New Netflix Series Carmen Sandiego https://t.co/nkP5PHUKrx https://t.co/EwIQHZrnIO","@oyeakd","cultural-icon",
"The First Images of Netflix's Carmen Sandiego Are Here Carmen Sandiego has been found, and she's looking good on Netflix. Gina Rodriguez will make her debut as the new voice of the iconic globe-trotting thief in the new 20-episode... https://t.co/ATx1jdYXpx","@Gabriel50841278","cultural-icon",
"Already have my next Halloween costume planned out. Carmen Sandiego. My date&39;ll go as Where&39;s Wally. Always wanted to do that","@monikaacm953","cultural-icon",
"“Where in the hell is Carmen San Diego”","@didgeridougrou","cultural-icon",
"#QueenSugar Where in the world on NICKI MINAJS ALBUM.... (In the style of Carmen San Diego)","@Imwithtash","cultural-icon",
"Karlie Kloss Pulls a Carmen Sandiego On Us! http://t.co/59huVS3OuE - #model #fashion","@ColorsportUK","fashion",
"😍😍😍 I love airports. They're like I Spy, Where's Waldo, and Where in the World is Carmen SanDiego all… http://t.co/b5QbzKNzMd","@malissabarrett","travel",
"We learned to use computers on candy-colored Apples, and each student was assigned a floppy disc. You felt like a champ when you came up with a cool away message for you AIM Instant Messenger. I learned everything I know from Carmen Sandiego and Legends of the Hidden Temple.","@SirJanks","edutainment",
"How many kids' parents got divorced in the 90s bc if you won Where In The World Is Carmen San Diego they only let one parent go with you on the trip?","@BetchesHeadPro","travel",
"@Hiddanas @DapymanUSA There isn’t a movie but Netflix is reviving the show soon though https://t.co/zLc1TRkfVq","@Biggamehnter","cultural-icon",
"where in the world is carmen san diego i just dont know these things and wish i did because she is undeniably the greatest explorer ever","@tbwinfieldjr","cultural-icon",
"""Chuck Norris always knows the EXACT location of Carmen SanDiego.""","@denisson82","cultural-icon",
"Talking about game shows, I brought up Where in the World is Carmen San Diego? Those kids got SCREWED unless they wanted a trip to Delaware.","@Worsel555","travel",
"Idk much about Carmen Sandiego but the show looks pretty","@Inkvenger","cultural-icon",
"Who remembers Playing The PC Game "" Where In the World Is Carmen SanDiego"" In Elementary When All The Classwork Was Finished?","@generation_up","cultural-icon",
"(CHUCKNORRIS) Chuck Norris always knows the EXACT location of Carmen SanDiego.","@FortuneMod_","cultural-icon",
"@mattatarms @whatthedeckHS @dawniedk @Gosox_ I googled it so I could remember. There was a game in 2015 called Carmen Sandiego returns and it was actually quite good. Apparently it no longer exists on app stores though.","@TruthAM","cultural-icon",
"Netflix is Bringing Back Carmen Sandiego – With Gina Rodriguez! (Report) https://t.co/CNrbAQZLV0 https://t.co/ucVNVkuIAv","@LasVegasNvBlog","cultural-icon",
"I got my Carmen Sandiego coat in! Just waiting on the shoes 👠 now :) #carmen #carmensandiego… https://t.co/bQSXpbnrcj","@MeraBelleCos","fashion",
"@RadioBethany Rocking the Carmen Sandiego trench coat!","@BarimusPrime","fashion",
"First poster and images for Netflix’s Carmen Sandiego https://t.co/AxR4RYLvsX","@terencekoger","cultural-icon",
"@TommyBirch Where in the world is Carmen Sandiego?","@andruwgreen","cultural-icon",
"Carmen San Diego taught me so much about art and geography the video game came with a book","@Lo_Namath","edutainment",
"Couples Costume Ideas: Carmen Sandiego and Where's Waldo","@datwriterhelen","cultural-icon",
"@BeachyTwy Gina Rodriguez in ‘Carmen Sandiego’ in Netflix Live Action Feature | Deadline https://t.co/fdyLxXsHRC","@deano10593","cultural-icon",
"Gina Rodriguez donning red fedora and trench coat of Carmen Sandiego https://t.co/LOZpkuOBRm https://t.co/ZK5cbkkW2G","@EClassHosting","cultural-icon",
"@lavendrsblue @horsearms Real Carmen Sandiego energy","@kneedeepsnow","cultural-icon",
"Where In The World Is Carmen San Diego???? My Lil' Explorer #AmaniViana #MyBooger #Westminster https://t.co/7s883ibOro","@AGonzalez47","travel",
"@claireseldon_ed @amuseED I learnt more about geography playing Carmen Sandiego than I have since!! #aussieED","@robmctaggart","edutainment",
"@SlimChakra u still living the Carmen SanDiego lifestyle?","@JoeCool_Burr","travel",
"@bunnycartoon Don't like the possibility of Carmen having lore, though. Literally nobody has ever asked who in the world is Carmen Sandiego.","@mouse_inhouse","cultural-icon",
"VIDEO: 10 Reasons Where in the World Is Carmen Sandiego? Was the Best Educational TV Show … https://t.co/gqIMUU2Ba9 https://t.co/j2rnvpfMxV","@OptioneerJM","edutainment",
"🎶 ""Where in the world is Carmen Sandiego?""❓🌎💋 C'est l'Halloweeeeen! 🎃 #halloween #halloween2015… https://t.co/eRBsH0l57z","@IamAprilMiranda","fashion",
"Netflix is learning how in the world to play the franchise game with Carmen Sandiego #franchise https://t.co/NExRA34UBu","@FuseTogether","cultural-icon",
"@johnmcvies I also rocked a gigantic Carmen Sandiego hat like whoa and a red sequence cape","@MitigatedText","fashion",
"That red coat is giving me Carmen Sandiego. https://t.co/mQ7CDuYe4B","@BlkRanger21","fashion",
"Where in the world is Carmen San Diego?","@hllambert14","cultural-icon",
"Carmen Sandiego' Reboot Headed to Netflix https://t.co/XmwX5Lubya https://t.co/i1fwmp2MV0","@VergaraTefy","cultural-icon",
"Where in the world is Carmen Sandiego?","@CrissAndersonn","cultural-icon",
"Netflix orders animated Carmen Sandiego series https://t.co/qnBTdlJAWs https://t.co/20acAlGTUR","@judedawsonnews","cultural-icon",
"I have a long red coat at home so now I can dress up as carmen sandiego any time I want #kubecon @RedHat https://t.co/VvZQBKtApU","@charwarz","fashion",
"Gina Rodriguez is the new voice of ‘Where in the World Is Carmen Sandiego’ on Netflix https://t.co/UPy1rj2oFB","@NarrendraM","cultural-icon",
"@leighalexander No. It means you can take the day. Steal it. Carmen Sandiego style.","@delphi_ote","fashion",
"@TapuKimo Mandela effect. Did curious George have a tail? What color was Carmen San Diego's coat? Bernstein or Berenstain Bears?! Ahhhhhhh","@AndoVGC","cultural-icon",
"@fraaannciiiiis I guess we now know where in the world Carmen Sandiego is OHHHHH SNAP jk that is a dope coat","@condiricenbeans","fashion",
"2019 is a long wait, but it'll be worth it if done right. I still remember playing the computer games on Win95! #Netflix #CarmenSandiego https://t.co/RVkbRnvqAt","@jehuty88","cultural-icon",
"Why do I remember Carmen Sandiego with dark hair? If she’s a red head how have I not been her for Halloween yet? https://t.co/RgDM1o2sVG","@katieferg","cultural-icon",
"#Netflix orders animated Carmen Sandiego series https://t.co/qAv7ioJcME","@extremetechlove","cultural-icon",
"How Carmen Sandiego accidentally became an educational game icon https://t.co/QUldC0aLYM","@GamerGeekNews","role-model",
"Feeling like a sexy Freddie Krueger! #carmensandiego #hat #feelingmyself #harness #newpiercing… https://t.co/o8R5hRKxEI","@scoobycooper","fashion",
"Netflix orders animated Carmen Sandiego series https://t.co/bYRQxveEye https://t.co/yIW6eEU2lI","@MSDTechNews","cultural-icon",
"@whittynovels honestly if carmen sandiego wasn't your first woman crush then get out of my face","@whittynovels","cultural-icon",
"Remember the days of playing Carmen San Diego in computer class? Those days were the best.","@MorganTidey","cultural-icon",
"Look women in trench coats to me = Carmen Sandiego. LOL!","@NeekGoBacon","fashion",
"@yasicultist @Blaquechris Where in the world is Carmen Sandiego?","@sidpierre","cultural-icon",
"Carmen Sandiego Is Officially Happening With Gina Rodriguez at Netflix: Get excited, gumshoes! Just days after it… https://t.co/Gz8r4tlBYI","@news899update","cultural-icon",
"My buddy at work made this for me. Thanks Jimmy!! ✈️🌏💃 #whereshouldigonext?#CarmenSandiego… https://t.co/rCmSetY261","@SundayPancakes","cultural-icon",
"@EspiaDeGleeks Who the hell is naya-carmen sandiego? *kitty*","@AngellOverCriss","cultural-icon",
"@BlogXilla From the Carmen Sandiego collection? “@BlogXilla I got that same hat. Melo http://t.co/334w29nCe5”","@xDecadent","fashion",
"@FeministaJones Oh my goodness yes, a long way from old Apple IIe with Oregon Trail and Carmen Sandiego.","@JLSigman","cultural-icon",
"⚡️ “Netflix greenlights a Carmen Sandiego series” https://t.co/xGrmy169J1","@MStarzky","cultural-icon",
"Netflix finds 'Carmen Sandiego' for its latest reboot https://t.co/mZe95UJUv9 https://t.co/cBHCBgJxfU","@RaZeR_LvP","cultural-icon",
"@lululemon, long tunic, boots, coat that is too big to fit in my carryon, and probably the hat that I'll only wear once but feel compelled to bring since it's a good time to pretend I'm Carmen San Diego.","@deakhaus","fashion",
"Netflix finds 'Carmen Sandiego' for its latest reboot https://t.co/qbmKToFbMq #Indonesia1Kata https://t.co/MHTiA6TZ8H","@bagus_tandiono","cultural-icon",
"vague #spoilers for the ‘I’ll be your home’ by carmen_sandiego update. it’s so soft and lovely and I guess objectively not crushingly sad, but I’ve still been blinking back tears nearly the entire chapter so far","@weatueanon","cultural-icon",
"TIL Carmen Sandiego is getting a new animated series in 2019 on Netflix.","@Cyrus_VGZ","cultural-icon",
"Netflix is betting on ‘90s kids nostalgia for learning with upcoming lineup https://t.co/By4XGp1F8j https://t.co/SbtAPgBSUX","@AngelFofficial1","edutainment",
"Carmen SanDiego was the shit. I still reference stuff I learned from those computer games. No lie","@PageRay","edutainment","x"
"#NotGreatJeopardyCategories Clothing styles for Carmen Sandiego","@saizowleon","fashion","x"
"Netflix found Carmen Sandiego! She's Gina Rodriguez and she's starring in its new live-action movie, the first for that character 🔥 https://t.co/Pf4aPKxPlu https://t.co/4s7n7bwWS7","@jennifer_bisset","cultural-icon",
"Her Carmen Sandiego clothes #FoundInDorasBackpack https://t.co/gTJY3K5qeg","@tonidevelin","fashion",
"#womaninblack=the real life Carmen sandiego or female Waldo","@BoricuaCaramelo","cultural-icon",
"Netflix finds 'Carmen Sandiego' for its latest reboot https://t.co/aAQsgLBVxP https://t.co/rkhmYePqD6","@NuttyMucker","cultural-icon",
"When i was a child I was very disappointed to not find Carmen Sandiego on my first trip to San Diego. All the clues pointed there!","@alexjaureguiis","cultural-icon",
"@BigBird one of Carmen Sandiego's crooks muttered that his trip to the second largest state had better measure up, he's in Texas!","@JeremiahLiles1","travel",
"It's not a Carmen San Diego hat. Hers was larger. It's a Peggy Carter hat. Sheesh. #AgentCarter","@4srs_synergyfox","fashion",
"@lizroscher Am I seeing things or is whoever's sitting next to Tempest Dujour wearing a Carmen Sandiego getup?","@holly_holl","fashion",
"Anyone ever find Carmen San Diego? ✈️🌎 Or was that some weird F'd up childhood metaphor that we will never truly find ourselves? 😭","@shaughnessy119","cultural-icon",
"Carmen Sandiego is coming to Netflix and the actress voicing her is perfection https://t.co/ayYg0RHLjv","@alisamalikan","cultural-icon",
"Even though he has a red hat now, we have to make sure that Carter Page never thinks that he's equal to or better than: 1. Carmen Sandiego 2. Paddington Bear 3. Bill Murray in Life Aquatic 4. Jessie from Toy Story 5. Rachel McAdams in this part of The Notebook https://t.co/Cn6DMURJYE","@pardenmoi","fashion",
"I think I walked passed Carmen Sandiego this morning. Long red coat & red hat included!","@TinManNYC","fashion","x"
"Already have my next Halloween costume planned out. Carmen Sandiego. My date&39;ll go as Where&39;s Wally. Always wanted to do that","@nelsonixjkcl","cultural-icon",
"Where in the world is my Garment Sandiego? The sequel where Carmen Sandiego has been found, but she left her coat somewhere","@MicahBradbury","fashion",
"Doing more traveling than Carmen San Diego https://t.co/CucPmB53Qf","@SleazyC_","travel",
"Yes, bitches. I am ready for this vacation. #costarica #sunny #carmensandiego https://t.co/ZNJbKLvdro","@namoagogo","travel",
"Chuck Norris knows where Carmen Sandiego is #chucknorrisfacts","@Talktodjrp","cultural-icon",
"VIDEO: 10 Reasons Where in the World Is Carmen Sandiego? Was the Best Educational TV Show Ever https://t.co/S6Ofld0uui","@CelebritySights","edutainment",
"I'm going as Carmen Sandiego, on account of I can wear my toasty red coat. I made a hat last night, but I still need to buy a wig!","@jkwak","fashion",
"Bless @netflix Mark Perez & @HereIsGina for giving us the quality content we deserve. #CarmenSandiego","@FanCityTV","cultural-icon",
"Cnet Netflix is making a Carmen Sandiego movie with Gina Rodriguez - CNET https://t.co/gJhbCXIqbt","@technews122","cultural-icon",
"Where in the World is Carmen Sandiego. shouts to some notables like Adventures of Pete & Pete and Arthur","@_DannyWill","travel",
"@dumdum90s Tome tries to hit on Ms Wendy during an interview on Don't Forget Your Toothbrush. Kyle travels to Thailand to find Carmen Sandiego.","@dumdum90s","travel",
"@FATMXCL HAVE YOU EVER WATCHED CARMEN SANDIEGO BEFORE","@sanzochan","cultural-icon",
"@J9Roem #throwback A demonstration of just how old & bad travel booking security is: https://t.co/V6avX1GRFC #33c3 https://t.co/bIvp4DENy6","@J9Roem","cultural-icon",
"New Carmen Sandiego Animated Series Coming to Netflix in 2019! #StreamTeam https://t.co/Q9DaZ5q8o0 via @LongWait4Bella","@HomespunChics","cultural-icon",
"Where In the World Is Carmen Sandiego? On A Netflix Animated Series, Voiced By Jane The… https://t.co/S0OUeAYA0T #Movie_News #dont #first","@robibladez","cultural-icon",
"I know it's just playing in to studio's fear of new IP's, but I'm kind of excited for this. Where in the World is Carmen Sandiego was the first CD game I ever owned, back in '92, right after my dad had upgraded the computer with one of those new-fangled CD drives. I feel old now. https://t.co/SBT55ItRqk","@MovieTrawler","cultural-icon",
"@XFilesNews @GillianA She looks great! The blue hat gives her a Carmen San Diego look. :)","@XFTeacher","fashion",
"@darkgryphon42 Do you want us to recommend friends, or games? I would ask @DOSNostalgic . I'd also look at Sierra and Lucas Arts adventure games of the 80s and 90s, King's Quest, LSL, and general edutainment Carmen Sandiego, Oregon Trail, and Dracula in London.","@Simon_Ashtear","edutainment",
"We are not playing Blue's Clues or being Dora the Explorer. If you want me to know something say it or I'll become Carmen San Diego.","@temp4evers","cultural-icon",
"Rouge the Bat, to my knowledge, has never been drawn wearing Carmen Sandiego's outfit. This is a crime that must be rectified.","@VersusMe101","fashion",
"#GinaRodriguez donning red fedora and trench coat of #CarmenSandiego https://t.co/xbQfnxG5f6 https://t.co/pboKuZG6df","@atulaugust","cultural-icon",
"That's why kids these days aren't graduating. We had dope shows that taught us shit. Ghost Writer, Carmen Sandiego, Wishbone","@flippedhatnupe","edutainment",
"Saint Louis last weekend, Ann Arbor Michigan this weekend. I feel like Carmen Sandiego... #whereintheworldiseddiesalinas #mr305","@themexipinoy","travel",
"I love Molly and everything she questions. Thank you for pushing the difficult issues. #insecurehbo @YvonneOrji #carmensandiego","@alexhiniker","cultural-icon",
"Gina Rodriguez Will Play The Iconic Carmen Sandiego In An Upcoming Netflix Live-Action Film https://t.co/qChvDJaaps https://t.co/qTPMyP2Fl7","@inspiredMichael","cultural-icon",
"#TBT to Janese Swanson, inventor & founder of Girl Tech + co-developer of the first Carmen Sandiego educational games. #womenintech https://t.co/0GSwx78YHd","@girldevelopit","cultural-icon",
"Jan 18th. Carmen returns! @netflix @NetflixUK #CarmenSandiego #Netflix https://t.co/2zkAqzWPwp","@nerdinformants","cultural-icon",
"Where in the world... oh, she’s right here! Gina Rodriguez is the new Carmen Sandiego, in… https://t.co/VlQtL2VDcr","@themagazinecity","cultural-icon",
"@soPanel Now that vacation is over, Lo-Fi Let's Play of Carmen Sandiego in an airport, with musings on being followed","@leigh_books","travel",
"@BionicDance But is it Carmen Sandiego or one of her henchmen?","@RistinRaccoon","cultural-icon",
"lrt looks it's carmen sandiego!","@SoFarNone","cultural-icon",
"Netflix found the perfect Carmen Sandiego https://t.co/KZIACAHWt5","@CNET","cultural-icon",
"Criminally insane/tells so many lies forgets asin gets lost in their land of makebelief asin don't forget asin ignore the FACT asin it will compound EXPONENTIALLY asin domino effect: Carmen Sandiego becomes Dora the Explorer who is Daria asin criminally insane... https://t.co/PIdTvq88ZD","@AugustFanon","cultural-icon",
"Student written blog post reviewing a variety of #games4ed including @icivics #winthewhitehouse @EdGE_at_TERC #ravenous and the timeless classic #CarmenSandiego https://t.co/EoJuKXIcwa #gbl #stuvoice #stuchoice @stephqniee","@mr_isaacs","cultural-icon",
"1985: ""Where in the world is Carmen Sandiego?"" 2014: ""Where in the wold is Bobby Shmurda's hat?""","@Amber_Hayes27","cultural-icon",
"Is it weird to want a queer-er version of Ivy's outfit from Carmen Sandiego? #whereintheworld #carmensandiego #90skid","@EauxYesExclmtn","cultural-icon",
"EXCLUSIVE: Gina Rodriguez To Star In ‘Carmen Sandiego’ As Netflix Sets Live-Action Feature https://t.co/VhGBjgxprb","@videofest","cultural-icon",
"Staying engaged right up to the holidays by using google maps and research skills to track Santa - Where in the World is Carmen San Diego style! @westcot_school https://t.co/60Wbe7fNpq","@kelseywoodley","cultural-icon",
"Favourite children's program of the 80s and 90s? Mr. Dressup? Carmen Sandiego? Reading Rainbow? #ThrowbackThursday","@michaelkwan","cultural-icon",
"My friends might be traveling abroad, but I just bought the Carmen San Diego game for my phone. So who's the real world traveler??","@laurapolsean","travel",
"Rasheeda on here giving me ""Carmen San Diego realness with hat chile #LHHATL","@BePassionate25","fashion",
"Fellas, if she: - is always travelling the world - is constantly stealing your heart (and diamonds also) - leaves you little clues about where to find her - teaches you about geography - was hotter in the 80's She's not your girl. She's Carmen Sandiego","@c12h22o11balls","cultural-icon",
"If I bought an awesome red coat, I a) could be Carmen San Diego for Halloween and b) would have an awesome red coat.","@tristawinnie","fashion",
"VIDEO: 10 Reasons Where in the World Is Carmen Sandiego? Was the Best Educational TV Show Ever: The PBS game s... https://t.co/s6I18s8F1Q","@_SoundAround_","edutainment",
"@ShoMarq Wear a red hat and trenchcoat and blame it on Carmen Sandiego.","@thejeffchaney","fashion",
"Where in the World is Carmen Sandiego? COMING TO NETFLIX, Y'ALL!!!! https://t.co/GRPtmJd9yl","@UnSaxon51","cultural-icon",
"I might have the detective hat look down, but I'm no Carmen Sandiego. Deets here: https://t.co/m4KIAgu46M https://t.co/11jnSXaLTW","@Yaszy_SFF","fashion",
"@DynastyOuthouse He’s probably chilling somewhere with Carmen Sandiego. 🤷🏻‍♂️ https://t.co/6LIkKBkwdF","@TheFFRealist","cultural-icon",
"Where in the world is Carmen San Diego kinda night. 😏🌎🌙|| #smize #beard #hats #smirk #trou… http://t.co/DToyRz0U42 http://t.co/LYVuJyrpkc","@andrewcurryla","fashion",
"If they really want to take me back, please cover: Carmen Sandiego Zoom Bill Nye the science guy Dawson's Creek TRL #NinetiesCNN","@W1lmerSarmiento","cultural-icon",
"If the NSA knew what it was doing, it'd tell us where Carmen SanDiego is.","@RibsinBacon","cultural-icon",
"Gina Rodriguez to star in live action adaption of Carmen Sandiego for Netflix. https://t.co/08vHkzzYwP","@DRMovieNews","cultural-icon",
"Gina Rodriguez To Play Carmen Sandiego In Live-Action Netflix Film https://t.co/LPQB39ymmU","@CclearWorld","cultural-icon",
"Our Childhood Dreams Have Come True: Gina Rodriguez Is Playing Carmen Sandiego On Netflix https://t.co/Byt6js9Rzn","@spkluis","cultural-icon",
"It's time to wonder ""Where In The World Is Carmen Sandiego?"" again in a new series coming to @netflix! LOOK- https://t.co/Zm2G07YzFZ","@Radio1045","cultural-icon",
"https://t.co/91N1OF0ocw Netflix orders animated Carmen Sandiego series Netflix has ordered an animated Carmen Sandiego series, io9 report… https://t.co/IbLmuookFK","@emilysmiley20","cultural-icon",
"Netflix’s ‘Carmen Sandiego’ debuts on January 19th, 2019 https://t.co/EWz6nUow4J https://t.co/kbc0KqQ2oW","@Pungroo","cultural-icon",
"[CHIKA MINUTE] 'Jane the Virgin' star to voice Carmen Sandiego in new Netflix series https://t.co/CHieUTbx2M | via GMA News","@PHShowbizNow","cultural-icon",
"LF: Carmen San Diego Torrent because we miss this iconic game 😂 @mady_siy https://t.co/d9pD5itEAH","@justinbieBERNIE","cultural-icon",
"With the news that Carmen Sandiego is being given the @netflix treatment with @HereIsGina, I'm reminding Twitter that I've already found her https://t.co/wHtxNX2XmN","@heyDejan","cultural-icon",
"Where in the world is #CarmenSandiego #halloween #halloweencostume #halloweenweekend… https://t.co/jNvEnu9KeB","@JesseOfOz","fashion",
"Carmen San Diego cosplay I can get into https://t.co/qRVuVyPbVm","@Lauzin","fashion",
"@fenrir_71 @TriTro29 @Itsmehaddasb @CLC1905 @marklowen @lemondefr @SylvieKauffmann @pvdork That's why they couldn't find Carmen San Diego https://t.co/64qAgjlkEL","@catmonkey22","cultural-icon",
"Where in the world is carmen San Diego is coming to #Netflix. Okay... I'm happy again 😍🤗 #WhereintheWorldisCarmenSandiego","@zondawson","cultural-icon",
